"names","values"
"event","ive got lots to say but im kinda feeling sick and not really up to give u the best update.

in a nutshell...sundays game just rocked..i LOVED playing steves team.  
Jess: ""I fell off the treadmill!!""
Me: ""HEY EVERYBODY!! DID I TELL YOU THAT JESSICA FELL OFF OF THE TREADMILL?!"" lol

and how great was it when steve tried to kick over brad?!?! yeah right!!  nearly impossible to kick over someone who bursts past 6 ft when ur a few ft from him! lol!  and matt ""running out of fuel"" and brads sweet goal...and MY SWEET GOAL! i've always wanted to do that! so freaking awesome!  and me yelling at brent to run to the other side to cheer for the other team..LOL

then i went to eat w/bb and his family..then i got harassed by jeremy and ben for the next 4 hours.  it was really sweet of them to drive from far away to see my game!  jeremy washed my car and ben put gas in my car..how nice! lol.

brian as usual made vday even better.  bought me the beach bag i LOVE w/flip flops all over it! LOVE SHOES! and the ever so sweet heart locket w/""I Love You"" on the front and two pics of me and him on the inside.  I wanted to cry...his heart is so big and beautiful.  and even more..ive been living a fairy tale valentines day for the past almost 4 years..  <3 u always bb

so i talked w/my dani this weekend...i miss her so much and i cant wait til she gets back.  i talked to her for a while on sunday night on my drive back..i had some things to rant about and she listened as she always did.  i miss our talks from a year ago, and our 'adventures' lol. and she sent me a touching card in the mail..shes great.  and she sent me a get well card through email.  awwww!! 
thanks to everyone who sent me get well wishes, i need them, i still feel oh so icky!  one of my fav msgs was from meg:
""smile cupcake: ok lish...if u got me sick, imma be mad!  i'm getting a sore throat again!!! i've been sick twice this winter already and both times they started as a sore throat!  i think its fishy that we always seem to be sick at around the same times!  i guess we shouldn't make out so much!!! :-[   feel better tho!""  
damn her for telling! lol

i have to get this out, bc its pissing me off.  this goes out to certain someone who thinks hes God's gift to me-fuck that..ive already got that gift and his name is BRIAN!  I dont care that u think that after only talking to me for 10 min u think that i should b w/u and that i should be single so u can be w/me.  that would NEVER happen u egotistical little shit.  i ask for something simple so all of a sudden i gotta put on a skimpy outfit and take a picture JUST for you?!?!  FUCK THAT!  WHO THE FUCK DO U THINK U ARE?!  And then u get completely pissed when I dont keep my promise?!?! well holy shit! what nerve i have to NOT take a special porno-like picture for someone that is NOT brian.  (take a number sweetiepie, u can get at the end of the line and stay there-bc ill keep pushing u back there)  oh this pisses me off sooo bad!  tell me how this makes sense:  u give me a stupid code u find on ur bottle cap and then i get all ""dolled up and put on a sexy outfit"" to take a picture just for u?!?  ill take a pic just for u, it'll be a close up of my middle finger.  kiss it jackass and keep dreaming..

ok now..im starting to cool off..that jsut really pisses me off-anyways, i really wanna feel better bc im so tired and my throat is swollen and my nose is stuffed...ahhh.  i hate this..second time this winter already...damn this!  grrr.. 

by the way, my bubs came out of the hospital last thursday, thanks for everyone who kept asking, it means a lot.

well im barely awake right now bc of my illness so i need to get..goodnight all"
"eventtime","2005-02-16 21:11:00"
"current_moodid","82"
"url","http://alicialee17.livejournal.com/3582.html"
"userid","460"
"itemid","12"
"event","Dear Phil,
Thank you so much for proving a standard point-Americans will constantly search for something to believe in, something to give them some ""certain-ty"" on any aspect, some gimmic to base something in their life off of.  Thank you for being that bastard, because America loves you.  So much so that we've based an entire day on it.  Dear Phil, you suck and I can't wait til someone runs over your face.  Not me, because my beautiful car is too good for that, but hopefully some smart kid on a tricycle or something.  yeah..that would rock!  See most people hate valentines day, not me, i HATE groundhog day.  And exactly whose nonbright idea was it to make a groundhog ""Ruler of the Weather""  HEY GENIUS! If you look at the damn calendar, WINTER IS OVER IN LIKE SIX WEEKS ANYWAY!! But no!!!!! We cant just let the changing of the moons tell us when winter is over...oooh HELL NO! that would be wayyyy too smart for americans!  We gotta have roadkill Phil come out of his mansion of a tree stump, look at a million drunk ppl and some fattys in top hats and run away!
I seriously wish that one day fat bastard phil would come out of his ""tree stump"" and look at the camera and just DIE!  What would that mean?  ""OH NO! Phil predicted armaggedon!!!""  The hell w/nostradomas, we've got Phil the f'in groundhog!! my God I hate STUPID ppl!! @#^&!#&@#

And you know what else bothers me, ppl who dont like valentines day.  Here let me describe them: when this day comes around ""I hate vday its soo stupid, i mean whats the point"" (WHAT THE FUCK IS THE POINT OF THE RODENT TELLING US WHEN THE WHITE STUFF WILL STOP FALLING?!)  You know, ive had MORE THAN MY SHARE of bad experiences w/guys, but i have NEVER hated valentines day!  I LOVE this day-its so perty! =)  I do feel bad for the ppl who hate it, i mean i feel bad for all of the bitter ppl consumed w/anger at the opposite sex.  Wonder why their still single?  Holy shit im a genius! maybe i should predict the weather, build me a damn mansion that looks like a tree stump and ill pop out ONCE a year!

Ok i dont want to rant anymore lol

I would like to thank matt and brent for getting me bottle caps:
fearlessPaz15: hey lish i have a bottle cap for u
Lisha Standish17: MATT I LOVE YOU!!
Lisha Standish17: OH MAN IM SO EXCITED NOW!!
fearlessPaz15: lol.  its no biggie.  anything for my buddy lish
Lisha Standish17: oh man u rock!!! matt i would give u a million hugs right now if i could!!!!!!!

I also have to say that Elzer HAS returned! weeeeeeeeeeeee! =)  And is also already stated that he will be on my summer team hooray! This guy...he just rocks so much.
elzerer: liiiish

Benjamin, my honeybee, so persistent to see to my happiness.  Your such a good friend ben.  I hope u never forget that!

OH MI!  How could I forget that Im expected to have a fan club at one of my games on sunday?  My fan club consists of Jeremy, Nick, Mick, Sean James(u cant just say his first name *s*), Ben, RYAN ORR!!, Jesse, and Kati.  I felt so loved.  They were planning on coming in shirtless (well not kati lol shes not drunk lol jk!) w/my name spelled out on their chests.  I had to explain why it wouldnt be kewl to do that in the rec center! lol but the fact that these guys would come from all over the area to see me...makes me feel so special..and loved.  Sean James texted me at 130am for directions..lol!!  I told Jeremy that they would freeze and he said, and I quote, ""We dont care, we're doing this for you.""  Yeah i almost cried..If you guys didnt know it already, you rock, and i love you!

Speaking of sundays, Boy voyage and good luck in VA!  Im gonna miss u bunches but i wish u all the luck!  also, as if no one knew this already, megan smiley is just THEE best.  I really think ppl should say it more!  You know, she's not mia hamm, but she is completely and totally dedicated and determined.  People may say that they ""love soccer or play soccer""..but you can tell, in her, the determination in each play she makes.  She tries so much and she'll b at the games when no one else will.  Im so glad that she's on my team.  And i LOVE talking to her on sundays (and having my butt poked..LOL) because it starts to feel like old times, when I had my best friend and other half with me.  I truly believe that she was the best friend that I ever lost.  I was telling brent the other day that i missed me and her being close.  sadly i guess things do happen..=(

brians cousin holly gave me hamsters..so now i am the owner of Chubaca (Chewy for short) and kitty.  Yes, kitty.  They're incredibly cute, even when me and kati had to scramble beneath my bed to catch them the other day because they got out! lol

Speaking of brian...i miss him..incredibly. 
No one told me
I was going to find you
Unexpected
What you did to my heart
When I lost hope
You were there to remind me
This is the start
I knew there was somebody somewhere
Like me alone in the dark
Now I know my dream will live on
I've been waiting so long
Nothing's gonna tear us apart
Brian has all of my beginnings..and hopefully..he holds all of my endings.  You just gotta realize that no matter how many times you get hurt, its all part of your journey..if you get off now, you'll never make it.  We're going on four years in april, each day I keep thinking-this could really be it.  Previous relationship go bad after a year or so...but four years and we laugh and talk like we've known each other forever but refreshes each day.  Tell me whose relationship does that?  (besides cody and shawna lol).  If you ask me how many times brian has made me cry, or wish i wasn't with him bc hes an ass, i would stand up to you face to face, look you in the eye, and tell you, ""never. Now ask me how many times hes made me smile, made me laugh, brighten my day, done something little to show his feelings, tells me how much he loves me or misses me..needs me.""  Id tell u, ""everyday""  So dont stand there and tell me good men dont exist, bc im dating one and hopefully, one day, more.  ""I look forward to coming home to you..""  yes, hes told me that...*sigh*
Brent: ""You have one of the few almost nonexistant good guys""
Jesse: ""Realize you have what we all want""
^this constantly runs through my mind
and other comments from jus and meg-i do appreciate what u say..thank u.

well all, i had to do this bc jeremy told me im two weeks overdue w/an update..lol.  
night all
<3"
"eventtime","2005-02-02 21:56:00"
"current_moodid","125"
"url","http://alicialee17.livejournal.com/3291.html"
"userid","460"
"itemid","11"
"event","I really loved this weekend:

Friday:
Stacey showed me a different way to 51 since the stupid flood is laughing at all of Pitts. right now.  I dont see any damn countries sending us money!! (insert bad words&#@$*(@#$)  Anyway, I saw one of the houses that the mudslide hit..it looked very crippled.  So sad.  Well I finally make it to Uniontown Mall where me and brian where meeting for dinner at the beanery.  We were standing there waiting for our thingy to go off and this guy comes up to us and just stands there.  I just look at the ground, waiting for him to ask Brian what the time is or something...but he just stands there.  I look up after a few seconds and no one says anything, he just stares at me.  Then I'm like, ""OMG, MARK!!"" *laughs*  Wow! I really didn't recognize him!  Neither did brian-wow.  So we chat for a while, I tell him my line of work and he bows down to me..lol.  So we chat a bit longer and then he is on his way.

Our movie was at 730 at the laurel mall and it was now 630.  I tell Brian to go in and take our name off bc there would be no way we'd make it.  So we settle for Rosa Pizza..which is quite yummy.  We then make our way to the movies.  I see Jess there and we say our ""hi""s and give our hugs.  Then the previews start.  I must say there are a lot of movies coming out w/the same special fx.  Not saying they are bad, they are quite good, and look awesome!  But anyway, the movie of choice that night was White Noise..freaking scared the crap out of me!! Most of you who know me are just laughing and saying ""anything scares u..and now u'll sleep w/the light on..""  All I have to say to that is..yeah, so? lol

After the movie I had to call Kati bc I was so excited/scared or something and I tell her about the movie. lol.  Then we head back to brians house for a while.  Me and brian beat the crap out of each other..well he didnt really beat me up..but i left marks on him.. sorry!  that guy is a saint! =)  Putting up w/me like he does! =)  I end up leaving and getting home around quarter til 1.



Then on Saturday I went to see Popop in the home w/bubs.  I havent seen him since before Christmas because I was sick.  I think he knew who I was for about a minute and a half..*sigh* ....
Then me and bubs headed to see my baby at work.  We stopped at CVS and I chatted w/brian while bubs looked around.  Then we walked over to Dollar General and I said hi to Kyle bc he was working as well.  Then I had a few things for Brian that I had to run back over to him.  

Then we headed back into Uniontown to eat at ENP.  We were gonna go to Ponderosa but I had to remind bubs that she was using that cane to get around and it would be very complicated to do the whole buffet thing.  So we ate at eat n park.  I must say, I did enjoy there chicken soup-but ima sucka for soup =)  Then we stopped at mcdonalds for some sandwhiches for my mom and dad.  We dropped them off at my house and then headed up to bubs for the night.  I gave pepper a bath..which was completely funny bc..well..u just have to know this cat.

Pepper has this thing where she likes to shove her head into the tissue box and run..very weird..HILARIOUS to see! LOL  Well the tissue box happened to be on the edge of the coffee stand.  She was walking across and noticed it.  She walked over to it, pushed her head in and ran right off of the stand..sooo funny! lol

I then got a call from brian and i talked to him until a little after midnight.



Then on sunday i went to my game.  we were doing soo well, but things happen and we lost.  But it was a great game.  In any case..I happen to have a very humorous group for my team..lol  
<blockquote>
Me: ""You make me wanna LaLa!"" 
Pat: ""I think that was better than Ashlee Simpson""

Pat:""His name is MatagascarAfricanamy""
Jess:""His name is Pancho?""
Me:""yes, just call him rain guard..""

Jess:""Take a lot of shots..""
Meg: ""..a lot of shots.."" *makes motion like shes taking a shot (alcohol)*

Me to Luke: ""I want u to go in for Brian""
Luke: ""Are you sure?  cuz, hes doing really good out there..""
^luke w/no belief in himself..lol

Steve:""Yeah we're doing really good this year..we just beat a team like 11-2""
Me: ""yeah yeah, talk up ur team""
Steve: ""but this green team beat us like 8-0 the other day!  Ive never been shut out!""
^poor cheese!  thats what u get for taking players away from me..lol
</blockquote>

I also chatted w/elzer for a bit bc i havent seen him since summer league.

After the game I realized Jess left w/o me getting to stop her.  So I called her and headed over her place since she lives right over the hill.  We exchanged presents, she got me the cutest sweater and camisole set!  She also got me this vanilla spray from B&B that smells oooh so delicous! She seemed to like what I got her and got kinda choked up at the picture I made.  Her mom really did and told me that I was a good friend to Jess.  I try to be, but shes such a great friend to begin with!  She really is the best!  Then he dad asked me if she was carrying her weight.  I said that she very much so was, bc I know she catches a lot of unnecessary flack about that.  She keeps up w/most of the guys in the league, let alone carry her own weight!

Then I head home to change and shower and back over to brians.  He beats me in ping pong and bc hes so mean he makes it so I always have 12 points before he really creams me!  booo!  But I won the gamecube game so yay for me!  Its like the first game ive won w/him in the whole time ive been w/him! lol!!

So before I leave I take a pic w/his family in front of their christmas tree and head out.  Then I head back up here to use my jewelry cleaner brians mom got me for christmas and update this thingy!

Thanks to Bodnar who is pretty much one of the only few who remembered to tell me Merry Christmas on the 7th.  Thanks, that does mean a lot to me.

And thanks to Orr who sent me a msg in hopes that I was feeling better!  You're so nice! =)

Brian also got me this kewl candle lighter w/the pivoting lighter thing..I LIKE TO READ DIRECTIONS! Im a manual reader, I'll read it cover to cover just bc i like doing it!  but brian and his dad made fun of me for reading directions for a lighter..LOL 

Well i really miss my baby and i cant stop thinking about him..just felt like letting all know that.  I miss u brian and i love u tons!!! *mwah!*xoxo!!!!!!

I need to head to bed now..goodnight all!"
"eventtime","2005-01-09 22:38:00"
"current_moodid","59"
"url","http://alicialee17.livejournal.com/2959.html"
"userid","460"
"itemid","10"
"event","oh man..i typed in the subject and i really dont feel like updating...hmmm.


However..i now must move on to my convos on AIM as of a few moments ago.
First off..ryan...most people of pittsburgh will kill you but I have to publish this:
<blockquote>Wimbly7: how bout them shitty steelers?
Wimbly7: i hope they lose in the 1st round :-D
Lisha Standish17: r u serious
Wimbly7: yes
Wimbly7: i don't like them
Wimbly7: besides...the patriots are going to win the superbowl 
Wimbly7: i think big ben gets too much credit and he's not that good
Wimbly7: and i'm tired of ppl saying how much better the steelers are than the patriots....but i guarantee if the patriots play the steelers again (and this time corey dillon and ty law both play) that the steelers are finished...they won't beat them again
Lisha Standish17: u know u could die in this town for saying that
Wimbly7: seriously...how else could the steelers beat the patriots?  could it be because the patriots were without their starting runningback and one of the best shutdown corner's in the league?....i believe so
Wimbly7: whenever i saw roethlisberger get injured...it brought a smile to my face and a YES! from my voice
</blockquote>

And my whole conversation w/justine could go in here..lol..because its full of my laughin at myself and her basically saying, ""ur stupid"" lol. well she didnt say that but i know thats what she was thinking!
<blockquote>
xthree3: oh oh and cows
xthree3: do they eat meat?!
xthree3: i'm so freaked out!
Lisha Standish17: i dont think so...i'd stay away from those certain cows if i were u....
xthree3: lol for real
xthree3: they probably have herpes or something
Lisha Standish17: watch for foaming at the mouth
Lisha Standish17: and red eyes
xthree3: that's the sign of herpes?
xthree3: oh man
xthree3: i might have them
Lisha Standish17: u foam at the mouth?
Lisha Standish17: thats rabies
xthree3: oh sweet!
xthree3: haha
</blockquote>

Next I have to pray for my dearest of buddies ryan orr.  He's so nice and deserves so much wonderful-ness.  I hope he realizes that now is so hard to grasp because its so real..but so much more is going to come.  No its not going to come right away and maybe it wont be explosive..but this isnt the end.  My best advice? Keep breathing, and if u need me to, I'll be the light until tomorrow's new blessing. That pretty much goes for everyone..but right now..its pointed to Orr.

Right now I'm thinking about this morning.  I was kinda worried about something about work..nothing big, but if you REALLY know me, then u know that I blow everything up when its something negative about me.  With this, I mean that I excessively worry about everything...<b>EVERYTHING</b>.  Being the complete sweetheart that he is, he called me early this morning to remind me NOT to worry.  It was comforting, as it always is, but Im the ultimate worrywart. Then when work was done he called me just to check to make sure there was nothing for me to worrying about..heh.  God, I dont think I could have ever asked for someone better.  I think Justine, in the sweetest comment, said it best, <i>""Be greatful for your man, because that's just so sweet! I shed a tear in happiness for you that you have such a great person to be with who is perfect for you.""</i>


Earlier I was feeling a little friend-deprived..but ive read through my past entries..i love you guys..u guys who comment and tell me what i NEED to hear..not just what i want to..i truly love u guys..for not being fake..for being so true and genuinely good people. for not being afraid to express urself about my journal and what u read..u guys keep me going!! Brian, jd, <b> kt, ur the best</b>, ORR, danielle!,jeremy, jesse, justine, seanjames-just to name the ppl that actually care enough to comment... and all my other friends..i love u too!  KATI RAYMOND I LOVE U! =)

Its almost the bedtime for ill lil chickies so I must sign off..ohh..doesn't that sick icon from the last entry look gross?  Its puking poop! eww! 

night all
heart ya!"
"eventtime","2005-01-04 20:06:00"
"current_moodid","39"
"url","http://alicialee17.livejournal.com/2685.html"
"userid","460"
"itemid","9"
"event","I am pretty sick of being sick.  i got sick on christmas eve and was pretty much dead the entire break.  So what did that mean?  It meant not being able to socialize at all.  Man I hate being sick, because my body has built up a deep immunity to pretty much all medicines on the account that about 85% of my life has been spent being intolerably sick.  This time was pretty bad though because I almost went to the ER about two or three times.  I even missed a soccer game...*sigh*

Throughout this time of being sick-my boyfriend has not let his sweet tendencies come to a halt.  In between my many naps and cough/choke attacks, he calls me to let me know he is outside my house w/some chicken soup from panera bread.  With just enough time to eat the soup and watch about five minues of tv, i start to lose my ability to keep my eyes open.  He pulls my legs straight so that Im layin on the couch, he tucks me in w/my blanket and pulls down the blinds.  He then kisses me on the forhead and says, ""im going to go now baby, u get some rest."" and leaves.  If I wasn't half dead, I could have cried at this..

On to another account of my hero in action.  He brings me over some wendys chicken strips and fries.  And, alas!, he has even gotten me ranch dressing-which he always jokes taht he would never touch the stuff-and brings a movie for us to watch.

I tell ya, now that im half able to recall this break, he truly is something else.

Thank you to benjamin, who MAILED me my christmas present!  what a great guy!  ive just been too toxicated/sleep/dead to call and thank him.

To continue, my new years was spent sleeping.  I watched some of the funny commercials, got a call at midnight from brian, then i fell back asleep just to wake up choking.  Ladies and gentlemen, I kid you not, I was sick.  

Im growing very tired-im surprised ive made it this far-ive got so much more to say, but it will have to wait, as im not back to my full writing abilities and am starting to fall asleep and I have work in the morning.

I hope everyone enjoyed their holidays.
xoxo
Your one and only
Lisha Lee =)
*in recovery* lol"
"eventtime","2005-01-02 22:51:00"
"current_moodid","82"
"url","http://alicialee17.livejournal.com/2547.html"
"userid","460"
"itemid","8"
"event","So it snowed the other night and i was so freaking excited i went outside and danced in my santa hat.  i know u care, and it was fun.

KATI CAME BACK TODAY! so now i could talk to something other than myself! =)  im so excited.  we didnt do too much the whole night.  well thats a lie.  i actually made food! edible food that is! and then we played some ddr-yeah we rock at that..pfft. LOL.  

But we decorated today!  yeah! the apartment has so many lights!  we seriously dont have to turn on the regular lights bc we have so many christmas lights! its so awesome! and our christmas tree is this fake tree...like big plant non pine tree christmas tree. LOL.  but it looks nice bc we decorated it! lol seriously, u should stop on over and check it out! 

im so happy right now!!

woah i couldnt sleep last night-yes, as i said w/orr-the darkness scares me.  but i had my stuffed attack dogs. lol.  and of course the trailer for the movie ""darkness"" had to come on a million times!! grrrr! so anyways..i woke up at 1pm!!! i NEVER do that! never!! .. never!! yikes!

well sean james totally blew me away today.  i must say that i completely appreciate his compliments toward me.  im sorry that my previous journal entry bothered him-but im glad he spoke to me about it.  hes so sweet. =)

so tonight's chat session rocked! lol.  it consisted of me, kati, sean james, jesse, and bodnar.  this..was awesome.. LOL.  needless to say we got off of the topic completely and on to the soon to be parties at 723 (me and kati's apartment)  sean james and jesse are quite looking forward to it..and being our cameramen and lighting directors..LOL

so i got to talk to brian for a bit today.  and i loved it and laughed a whole lot. but for some reason i was getting frustrated talking to him.  i dont know why..  im so weird.  i just thank my lucky stars that he chooses to stay w/me through everything i know i put him through.  

oh man, i so have to go to bed!! ahhh! im so tired too! im so not gonna be able to get up tomorrow! waaaa! lol

DECEMBER 19th @ 1pm = first indoor game woo!

night all
Happy Holidays!"
"eventtime","2004-12-13 00:02:00"
"current_moodid","49"
"url","http://alicialee17.livejournal.com/2275.html"
"userid","460"
"itemid","7"
