"names","values"
"itemid","170"
"event","I did it. I mothering fucking did it. Or I'm doing it. I don't know, either way, all I know is; it's been months since I've even checked my journal, and so much has changed, and I have never been so overjoyed. 

I have an album in the works. My first album. I am copyrighting and publishing my music so I can the green light to stations that have asked to play my music. I am playing paid gigs and talking to different studios and have a banjo player, guitarist/xylophone player/tambourine man/producer, voice coach, guitar teacher, and manager that I love endlessly. I'm writing my own material and performing it every week. I am taking cake classes at San Antonio College and committed to an internship I love and making plans to go on tour this summer. 

So i'll just come out and say it. I am a musician. I am a singer/songwriter who loves Americana and folk music and as far as i know I could do this for the rest of my life and never grow tired of it. I am finally dedicated and passionate about something again. All the while, living in San Antonio, Texas...cowboy boots and all. 

As fucked in the head as this all makes me sound, I have never been happier."
"eventtime","2007-09-05 00:20:00"
"url","http://alycat12.livejournal.com/43558.html"
"userid","571"
"itemid","161"
"event","[Xposted from another forum]
Someone told me a story the other day about how they used to be uptight, anal, pedantic, totally self-obsessed, and generally just a miserable person. Then they were diagnosed with cancer. It was curable, and she recovered, but she said it completely changed her life. She said:

""At that moment, when the doctor told me I had malignant cancer, it's like my entire life was crystallized, and I realized what mattered and what didn't, and all the mistakes I was making were completely clear to me. After I got over it, I stopped being the person I was, and became the person I wanted to be.""

I have heard this about a million times--how being diagnosed with a serious life-threatening illness or having a near death experience completely changed the way someone thought about their life. I stopped and tried to picture myself being diagnosed with malignant cancer--what would I do differently? How would I change? 

FOCUS: If you are up for it, try this exercise: Close your eyes and picture yourself in a doctors office. Really envision the whole thing; waiting in the outer room, wearing the gown, getting x-rays and MRI's, waiting for the doctor...and then having him tell you that you have been diagnosed with malignant cancer. It has a 75% chance of recovery, but you may very well die. Try to really get into the emotional mindset that comes with being diagnosed with a terminal illness. 

If you do that, there are two questions:

1. How would your life change?

2. Why are waiting for cancer to make those changes?
______________________________________________________

I read this thread yesterday, thought about the focus for a few minutes, got frustrated and just went to sleep. It's been reeling through my mind ever since. It's amazing how many times in the last year I've been forced to sit down and really reexamine different aspects of my life. Most of the time it comes in the form of a cold, hard slap in the face...but God knows I've needed it. 

By the time I graduated highschool I had my entire undergrad planned out. Exchange year in Turkey, study Arabic in Egypt, start Middle Eastern Studies at SLC, then Arabic again in Lebanon, year abroad in Egypt...bla, bla, bla. 

Well, fast forward to the end of last year, all is going as planned and I'm set for Lebanon. A month before I'm to leave I start having second thoughts. Two weeks later, I'm fucking petrified. Before I know it I'm absolutely dreading it. I finally realize that this perfect roadmap I had drawn on was caving in on me. Shit, all I really wanted to do was get a summer job and live on my own for a while. 

There was an obvious pattern in the choices I had been making. Escape, escape, escape. I would do just about anything to get as far away from Laredo as possible (both literally and figuratively speaking). Learning a foreign language was a great reason to run off to the country where it was spoken. My studies were so far removed from my life that I would have to move to the other side of the Atlantic to pursue them. 

So I didn't go to Lebanon. I moved to Austin and got a job canvassing. Then I started cocktailing. Would it look good on a resume? Not unless the job qualifications included ""awesome buttery nipples"". But was I enjoying it? Fuck yeah. It's good to know I can always fall back on 6th street for easy tips and cheap tequila. 

After a semester of rest I started getting ancy again. I don't know what was scarier; taking a risk in Austin or taking a risk in New York. I was terrified I would come back to SLC and hate it, but feared that if I didn't give it another change I would regret it down the line. In the end, I forced myself to come back because I was tired of running from the places that scared me. 

________________________________________________________________
FOCUS: Some good advice from the forum...

""Well, why don't I just go ahead and do what made me happy from the beginning? Why doesn't anyone? Because we're told to be reasonable, more like [insert authority figure name], conservative, etc. Just go back to the beginning and ask yourself, ""Minus my mother/father/teachers' expectations, what did I want to be?"" Figure it out, work your ass off to get it, and make yourself impervious to the, ""you don't have a real job[s],"" the ""you're having an early mid-life crisis[es],"" and the ""it will never work[s].""

But be prepared for the loneliness, as your family and friends disapprove of their formerly unhappy, malleable and dutiful chum stepping the fuck up and making his life his own. You are brave, sir, and I applaud you for having the audacity to think of your own happiness first. Socially, its radical."" 

----------------------------------------------------------

(1) Enough with keeping up appearances. I'd be on the first plane back to Austin. I'd take a light load in school. Maybe ACC at first, or transfer to Southwestern. I'd go back to focusing on theatre. Take voice & guitar lessons. Focus on developing all of the music I've started but never finished. Play tennis regularly again...fuck do I miss my backhand.

(2) Um, I have no idea what I'm doing? I'm scared shitless? I've yet to conquer my need to prove that I'm better than Laredo (whatever the fuck that means). I only do ""safe"" radical? I'm afraid all of this is just another escape? Is it just that I'm not trying hard enough? Seriously ok I have no fucking idea already. My hair hurts. 


....Anyone else want to take a crack at this?"
"eventtime","2007-03-28 09:11:00"
"url","http://alycat12.livejournal.com/41404.html"
"userid","571"
"itemid","159"
"event","Mkay. Time to post....

-My flight leaves in 6 hours. My room is trashed, I need to pack and shower and figure out which books I'm going to take home and let sit in my suitcase for the next two weeks.

-I have been drowning in Marx & Foucault all week. I could never read penal theory again and be the happiest person alive. Provided that i never go to jail.

-The cat my housemate found in Hill is still in her room. She left to California this morning. This really concerns me. 

-Luis, my on-again, off-again sweetheart of four years is being deployed to Afghanistan in July.  When I offered to give him a few lessons in Arabic today, he asked me how to say ""I don't want to die."" I was joking. He wasn't. 

-I hate the US Military. 

-Oh my God I just want to get home already so I can spoon all of my problems away."
"eventtime","2007-03-10 00:46:00"
"url","http://alycat12.livejournal.com/40727.html"
"userid","571"
"itemid","157"
"event","I have no words...

http://pc.ign.com/articles/745/745956p1.html

Left Behind: Eternal Forces 

November 14, 2006 - The video game industry is no stranger to controversy. Whether the waves are being made over sex, drugs or violence, it seems that there's always something on which legislators, lawyers and parent groups can hang their scorn. Games that promote lifestyles and behaviors that would be intolerable in the real world routinely come under attack for the influence they are believed to have on gamers.

Left Behind: Eternal Forces seemed like the perfect antidote to that. Nevertheless, this Christian-themed game, based on the popular book series about mankind's final days against the Antichrist, has inspired its own controversies. Some rejected the seeming intolerance inherent in the game's emphasis on converting non-believers. Some objected to what they perceived to be the game's exploitation of Christian theology. Misinformed or not, the controversy has definitely helped raise the visibility of this game and bring it to audiences it might never have reached otherwise.

In brief, the game follows the basic premise of the book. One day, all the true Christians vanished from the world. Though the authorities left on the Earth tried to explain this away as some freakish magnetic pulse, a small group of people suddenly realized that the Christians had been raptured up to Heaven. These new believers, those left behind, now find themselves fighting against the forces of the Antichrist who is building his world government on the bones on the United Nations.

The game lets players take charge of the new believers in the struggle in a standard real-time strategy format. New York City is your battleground and missionaries are your soldiers. You'll be fighting against the forces of the Antichrist -- secular recruiters, rock stars and cultists. Who comes out on top will depend on how well you use the resources at your disposal.

At the most basic level, the game is about using your disciple units to recruit more believers. These believers can then be sent to a variety of structures for training in other essential roles: they can become disciples themselves and go out to recruit more believers; they can become builders to buy and refit old buildings; they can become musicians to shift the allegiance of evil units to neutral; they can become soldiers or doctors to help on the frontlines when things get bloody. There are various tiers and upgrades to be found among each of the classes but the basic functions are still the same.

Although the buildings you own provide important resources like housing, food and cash, everything in the game revolves around the resource of spirit. Each unit has their own spirit ranking. You can increase it by praying or decrease it by killing other units. Raise the spirit of a neutral and he or she will join the good guys. Lower it and they'll take their part with the forces of evil.

The early missions focus on walking around and recruiting new units. As you gain more experience with the interface, you'll start to build your own infrastructure by taking over buildings in the city. You'll also come into conflict with the bad guys of the game, the Global Community Peacekeepers. Since they don't have to worry about their spirit rating dropping too low, they're not penalized for killing your units.

To keep the balance of power in your favor, you'll have to find non-violent ways to avoid getting killed. Your units will definitely fight back in a life or death situation but, for the most part, you want to either avoid your enemies or have a ready plan to convert to your side using musicians and disciples. This gets much harder as the game progresses.

There are some small problems with the overall interface. For one thing, your disciples seem to have a hard time selecting neutrals to convert. We frequently (and we mean frequently) had to click around and around just to get our disciples on task. Eventually, you'll stumble on the idea of setting your units to automatically use their powers but even this causes problems. The units just aren't smart enough to take any initiative here so you'll spend the majority of your time micromanaging the particulars rather than planning out your overall strategy.

Pathfinding is excellent when you're just moving down the street. Your units will occasionally walk right into a moving car but they always bounce right back and continue on their merry way. The problem arises when you give a unit an order and their path is blocked by something as simple as a lightpost or a mailbox or another unit. They sometimes simply can't find their way around these obstacles so you'll have to waste even more time leading them around by the hand. I've had units literally not be able to find their way across the street.

There are also some faults in the mission scripting. Nearly every mission requires you to build a bank before you do anything else but none of the missions actually tell you this. Instead, you'll be told via in-game dialogue and your objectives screen that you need to build a chapel right away. Once you build it, a window pops up telling you how stupid you were for not building a bank first and then asks you if you want to restart. Uh, excuse me?

Many missions also end if portions of your characters lose their faith and become neutral or evil. Where it might lead to some interesting back and forth action, it instead results in immediate mission failure. It certainly doesn't say much about the persistence of those who are left behind if they're willing to throw in the towel just because the enemy seduced away one of their believers.

Persistence will pay off for you, however, as you make your way through the missions. Succeed and you'll be rewarded not only with forward progress but with some interesting articles about God, the Bible and your place in the universe. The short articles are intended to stimulate thought and discussion about spiritual matters. The ones that place the argument in a historical or scientific framework are remarkably enlightening and compelling. Those that lean a bit more towards matters of opinion aren't quite as interesting or thought provoking.

In any case, the controversy about the game's message has been overinflated somewhat. Given the wide range of games that are inspired by religious, mythical and supernatural beliefs, it's interesting to see a game that presents the concepts of a modern religion like Christianity as core components of gameplay. True, the very idea that converting non-believers is the central activity in the game is likely to alienate some people but it really shouldn't be much of a surprise to people that a game with a picture of an angel and a warning about the antichrist on the box is going to have a Christian slant.

Still, even those gamers who appreciate the game's message will notice some uncomfortable inconsistencies. The game takes a firm stand about the righteous subject matter and gameplay and then lets the player turn around and play as the antichrist in multiplayer. While the variety is nice (or would be if there was anyone actually playing online), it tends to undercut the morality of the game's overall message. You can even add to that the mild traces of sexism arising from the gender qualifications for jobs -- ""Sorry, Sally. We'd love to convert you, but we only have room for one more believer and we all know girls can't build houses.""

The graphics are poor. Buildings are composed of simple polygon boxes with little ornamentation or style. You'll get the odd awning here and there, but for the most part, the buildings are flat and featureless. The textures are equally flat, even on the highest detail settings. The intricate designs on the front of a chapel are rendered with no more depth than you'd see on a cardboard cutout. Frequent repetition and flipping of tiles doesn't give the game much variety.

The only textures that look good are the high number of billboards and advertisements scattered throughout the city. While some gamers might be offended by the presence of these ads, they actually serve to make the game world feel a bit more real. Steam rises from grates in the streets, and adds to the overall realism of the environment. Buildings cast shadows on one another as well, which can reinforce the sense of scale here.

The character and vehicle models are a bit better but only because you don't get as close to them as you do to the buildings. Animations are reasonably convincing for the people, but the cars are laughable. They can only move forward in eight directions, so they're a blast to watch as they turn through intersections. Even more ridiculous, some vehicles will just spin all the way through the intersections.

Special effects on each character when using an ability are bright and effective. It would be nice, of course, if the different character types had a little more unique look. It's not always easy to tell which of the brown-haired guys in white shirts and vests are your believers and which ones are your musicians, for instance.

Left Behind's camera works reasonably well in light of the tremendous height of some of the buildings. The zoom and rotate function of the camera lets you see the action from just about any angle you want, and the buildings (almost always) fade to nothingness as the action moves behind them. We ran into a few instances where the camera just didn't want to cooperate. Backing up against the map edge usually leaves a sizable area beneath you that you can't see.

A wide range of voice actors have lent their talents to Left Behind's story but the quality leaves a bit to be desired. Awkward accents (the spunky New Yorker who wants to spread the ""troot"" is a nice touch) and a handful of unnatural readings definitely distract players from the action on the screen. The musical score is subtle but effective, lending an atmosphere to the game that always sits just outside of your awareness.

There are a lot of Christian rock acts featured in the clue screens between missions. While it's not everyone's cup of tea, the selections here are enjoyable and typical of the genre. The style of music, however, serve as an unintentionally amusing commentary on the game's decision to cast electric guitarists as the minions of evil on the Antichrist's side.

Finally, there are some basic functionality issues that continue to frustrate us. The game has crashed several times during loading screens. Given the interface frustrations that threaten the success of your mission, you're likely to be reloading the game a lot. Which means, at least in our experience, that you'll be doing a complete reboot just to get the game up and running again. We've also experienced a corrupted save file that, when we tried to load it, prompted the game to tell us that had a ""lost connection.""

Closing Comments
Ultimately, our opinion of this game is based less on the message it contains than the way it looks and plays. The basic design of the game is intriguing and worthy of a better treatment than it gets here. Fighting for and keeping recruits requires some thoughtful and persistent strategies and the fact that you have to do it without shooting or stabbing your enemies adds even more depth. Unfortunately, the inconsistent behavior of your recruits means you'll spend more time fighting the interface than the Antichrist"
"eventtime","2007-01-27 15:29:00"
"url","http://alycat12.livejournal.com/40416.html"
"userid","571"
"itemid","153"
"event","When was Spring Registration due? Today, Nov 21, 4pm. 
What time did I e-mail it in? Today, Nov 21, 4pm. On. the. dot. 

Some things never change."
"eventtime","2006-11-21 16:13:00"
"url","http://alycat12.livejournal.com/39351.html"
"userid","571"
"itemid","152"
"event","In two weeks I'll be 20 and I'm damn proud to say that I have never felt more accomplished in my life. I'm proud that I've made it this far. and that I finally gave myself a break. and that I refused to throw in the towel. and grew up so much these past few months. and most of all, that i've accepted the past, forgiven myself, and finally placed all the blame and guilt where it belongs: on him. 

I think I'm done here. I think I may be headed back to Sarah Lawrence in January. I think I could use some encouragment."
"eventtime","2006-11-10 05:47:00"
"url","http://alycat12.livejournal.com/38952.html"
"userid","571"
"itemid","148"
"event","""Experience is not what happens to a woman. It is what she does with what happens to her."" - Aldous Huxley"
"eventtime","2006-08-02 03:49:00"
"url","http://alycat12.livejournal.com/37922.html"
"userid","571"
"itemid","146"
"event","No, I am not in Lebanon."
"eventtime","2006-07-13 19:06:00"
"url","http://alycat12.livejournal.com/37572.html"
"userid","571"
"itemid","147"
"event","No, I am not in Lebanon. 

PS. Israel, what THE fuck?!!!!!"
"eventtime","2006-07-13 19:06:00"
"url","http://alycat12.livejournal.com/37636.html"
"userid","571"
"itemid","143"
"event","My legs are swollen, and my belly looks like a balloon. My back aches like all hell. It takes me 5 minutes just to get out of bed. 

I'm never getting pregnant."
"eventtime","2006-05-09 21:32:00"
"url","http://alycat12.livejournal.com/36818.html"
"userid","571"
"itemid","142"
"event","- Watch out Said; Aly's on an Adderall binge. Worked for about 10 hours or so last night. Managed to check out about 20 books on everything from lynguistic analysis to Zionism- and constructed my own psuedo-Evangelical Christian Orientalist theory. 

- I somehow managed to type out about 25 pages worth of notes/quotes/ideas for my paper within those 10 hours, yet failed to produce more than 4 pages of my first draft. Oh well, 9 more pages to go. 

- Had a conference with Kristin. Settled on switching to her as my don. Thankfully she likes what I've done with this paper and appears to be under the impression that I have my shit together (for teaching me how to bullshit like a motherfucker I will always be indebted to Extemporaneous Speaking). Apparently other kids in the class did too. If we have time next week she wants me to present my analysis of the Christian cartoons and early 20th century anti-Semitism.  And how neo-evangelists like Pat Robertson/Jerry Falwell/Billy Graham/Hal Lindsay are plotting to rule the world by way of 700 Club telethons. 

- I just sent in my deposit for the SINARC Intensive Arabic program at the Lebanese American University. I'm still pissed I'm not going to the AUB- mostly because of the private beach. Classes? What?! 

- Uh, I have to catch a train in 13 minutes so I can have the last of my bloodwork done. And call back the hospital to set a time for my surgery. And charge my phone. Oops. 

- Apparently Fawaz isn't going to be around at all next year. Kristin is currently looking for a replacement, which possibly means I may ACTUALLY be able to take a legit Mid. Eastern studies course next year. Please God let this be for real. 

- Ross Wade, where the hell are you? I went down to the PAC basement last night (God that sounds wrong)- the lights were all off and I highly doubt you were doing your conference work in the dark. YOU LIE!!! 

- This time tomorrow my parents will be in the city. I'm supposed to go meet them at the hotel. While I won't be able to transfer my 15 conference books to Manhattan, at least I can use my mom as a case-study. Yeah, she's just going to LOVE me after she hears about this. 

- Housing payments are due May 10. I never went to the lottery and I have no intentions of submitting the payment. Perfect way to back my parents into a corner. I NEED A DECENT SIZED CLOSET THAT DOESNT COLLAPSE ON A BI-WEEKLY BASIS GOD DAMNIT. 

- ISTANBUL, NO SLEEP!!"
"eventtime","2006-05-04 15:00:00"
"url","http://alycat12.livejournal.com/36381.html"
"userid","571"
"itemid","141"
"event","http://www.oneimage.org

[WARNING: Yet another source of entertainment that will result in hours of procrastination.]

HOW THE FUCK IS IT THAT I HAVE BEEN WORKING FOR FIVE HOURS AND HAVE ONLY PRODUCED A SEVEN PAGE OUTLINE?!!! HOW?!!!

All that my research has taught me is that conference work/Arabs/Muslims/Democrats/baby killers/political correctness(?)/Catholics = DEATH."
"eventtime","2006-05-03 22:10:00"
"current_moodid","47"
"url","http://alycat12.livejournal.com/36196.html"
"userid","571"
"itemid","139"
"event","The past couple of weeks I've been analyzing and overanalyzing my relationship (or lack there of) with my mother. I've ran thorugh the myriad of possiblities in my head and have come to no starteling conclusions. 

http://mediamatters.org/items/200603200013

I found this while doing some research for conference work. And all along I thought my FATHER was the man separating my mother and me. 
Go figure.

Then again, I guess it is the Father that separates us, so to speak. OK, no more Adderall for Aly."
"eventtime","2006-05-02 11:47:00"
"url","http://alycat12.livejournal.com/35659.html"
"userid","571"
"itemid","138"
"event","http://community.livejournal.com/sarahlawrence/784977.html?thread=5985361#t5985361

Priceless."
"eventtime","2006-04-27 13:53:00"
"url","http://alycat12.livejournal.com/35508.html"
"userid","571"
"itemid","137"
"event","The dates have been settled. 

April 26: Blood tests/physical evaluation for surgery clearance.

April 28: 5 pg paper for Kristin due

April 29: Tech for Dance show

April 30: Tech for Dance show

May 1: Surgery walkthrough/prep

May 2: Conference project presentation for Kristin

May ?: Mom & dad arrive in NYC

May 8: Surgery

May 12: 25 pg conference paper,  two 5pg book responses for Fawaz,  & 12 pg conference paper for Kristin due. 

April 26- May 12: Serious motherfucking spooning time with Lauren. 

Here we go again. Let the games begin."
"eventtime","2006-04-24 16:30:00"
