"names","values"
"event","weeeowweeowo 

i dunno if thats the day quil.
i have a small cold.

anyways.

im really proud of myself GUYS!
ive been going rock climbing twice a week.
or once.
but atleast once a week for a month now.

and today Justin and I were suppose to go on a snowboard shopping extravangaza cuz we plus like 14 other people are going to Big Bear on the 24th to the 27th, and we have no stuff.

so we go to R.E.I. and we see nothing there, but then we go over to the rock climbing area and I see these really awesome rock climbing shoes, but they are a little pricey...but Justin wanted to buy me a little chalk bag for when i climb and then i saw shoes that matched and I tried them on and I looooved them, and my best boyfriend ever bought them for me. 

so anyways....we leave and they opened or should i say re opened the indoor rock climbing gym right by REI and i wanted to try out my new shoes, and well Justin always wants to climb.

so we go :)
and I climbed...and I was sore cuz I went yesterday at the gym.
and my shoes are painful (they are suppose to be a little umcomfortable...like youre a ballerina)
and I'm scared of rock climbing gym cuz youre not on a rope so you either climb back down or jump down.
while at the gym gym...you are on a rope...so you just hop back down.

so I was practicing going up and trying to climb down before I went to the top.
and Justin helped a lot.

so I went almost to the top, and tried climbing back down...and slipped and totally fell Justin tried to catch me but it didnt work and, I'm okay except i hurt my knee. 

its so much FUN, but so SCARY.

so after I did my falling scene, and panicked for a bit i decided to try again, but my shoes were really starting to hurt, so I didnt so much after that.

but....
we are going back again TONIGHT!
he has do his taxes and stuff.
and after that if theres more time we are going back.

i know right.
i really enjoy it.
i suck but i cant wait to learn and get better.

and watching Justin is really fun, cuz he makes it look really easy.


so then we finally went and got snowboarding stuff.
all at one store with an awesome sale.
so YAY!

i also got my hair dyed.
and its weird.
it is brown and blonde and has like 4 bright red highlights.
it looks pointless.
i cant wait to change it.
i hate it.
i think im going to try on Monday to change it.

i hope I can.
just the highlights.

anyways.
i need to go eat and clean up my apt.
but thats the update.


oooooh. as for my last lj entry about the thing with my friend sara and I.
we did a lot of talking.
and theres a lot i can type, but basically

1. we love eachother.
2. we talked about how we felt about things.
3. we are going to try and be more supportive of what the other wants.
4. she is a really amazing friend.

theres a lot i can write on the subject.
things arent perfect.
and im not sure if they ever will be.
but perfect or not, i want her in my life.

update : on saturday i can get these stupid red highlights from my hair removed.
yay for alice!!!! she even said for free, and she didnt even do them.
she loves me.

yay cuz sat night is my friend simones bday dinner and stuff and my hair wont look like crap.

these are the stupid red highlights.
i asked for purplish brown and a gold highlights with a med/dark brown base.

and i got this :
<img src=""http://rachrachrach.smugmug.com/photos/53114904-M-0.jpg"">"
"eventtime","2006-01-19 18:17:00"
"url","http://angeltoes.livejournal.com/170950.html"
"userid","780"
"itemid","666"
"event","i completely and totally forgot to mention.

that i climbed 30 ft today at an indoor rock wall.
so scary.
for me.
i had lots of help from the workers there.
im going to be sore tomorrow.
but i went all the way to the top.

i cant wait to go again.

<img src=""http://alumweb.mit.edu/clubs/s-texas/doc/EventHighlights/RockClimb00/RockClimbing2000%2004.jpg""> its kinda like that.
my hands get so sweaty its hard to hold onto the grips.
i used so much chalk."
"eventtime","2006-01-09 19:53:00"
"url","http://angeltoes.livejournal.com/170751.html"
"userid","780"
"itemid","665"
"event","a picture post.
<lj-cut text=""the pictures and a realllly long story"">

so Justin and I decided to go feed ducks in the ghetto.

here they are.
<img src=""http://rachrachrach.smugmug.com/photos/51779408-M.jpg"">
they look so god sent.

we put bread on the back of a duck to try and see him get it (he was mean to the other ducks)
<img src=""http://rachrachrach.smugmug.com/photos/51779415-M.jpg"">

little did he know his friend was going to snatch it
<img src=""http://rachrachrach.smugmug.com/photos/51779412-M.jpg"">

he looks at us afterwards sad so we give him a piece of bread
<img src=""http://rachrachrach.smugmug.com/photos/51779419-M.jpg"">

then we drove to the beach
and justin doesnt like the ocean water.
but he put his feet in there for me.
because its my favorite.

and then we took a few photos.
<img src=""http://rachrachrach.smugmug.com/photos/51779426-M.jpg"">
his lips look non existent while mine look huge.
(hes a good kisser i swear, i just didnt take the photo at the right time)
<img src=""http://rachrachrach.smugmug.com/photos/51779422-M.jpg""> i was sleepy.

then we drove back to his apt, and i took 2 silly photos of him.
<img src=""http://rachrachrach.smugmug.com/photos/51779433-M.jpg"">
and i tried to make this one artsy
<img src=""http://rachrachrach.smugmug.com/photos/51779405-M.jpg"">

so yeah.


right now, im in a confused mood.
not over a boy.
but over a friend.
my friend sara.

lately her and I.
i dont know......are so far apart now.
I dont blame her.
I dont blame me.
I blame us.

my side of the story is understandable and so is hers.
and it doesnt even matter.
i just want things to get better.

i never had a friend like her.
she is such a caring and amazing friend.
and at the same time.
she expects a lot a lot a looooot from me.
and I can understand that...but at the same time....she cant get mad at me when im not up to par.

she says I dont make an effort, and she even understands why (because i feel it wont matter)
she basically thinks.
I'm all about Justin.
and...well...I am a lot about him, but not nearly as much as she thinks.

I remmeber her and I use to have mondays for us.
ive been willing the last few mondays (not including the holiday mondays)
but she has had plans.
or she was angry with me.
or something came up.
we try and reschedule but our schedules dont work.

and today i tried.
but she was busy, but i also understand why i wasnt invited because we need to talk alone before we hang out with friends together.

so saturday we are going to have brunch and talk.
im going to put my heart into it.
and really listen to her.

we had one good day a few weeks ago.
we just went xmas shopping and hanging out.
and i wish i could have days like that back with her.

i dont even know the problem.
except things have changed in our lives.
she is kinda dating justins bestfriend/roommate adam
so we see eachother a lot, but dont really get sara and rachel time.

she says, i dont make an effort to hang out with her and adam or invite them places with justin and i .
and its not that I dont want to, its just i figure they are already busy, because they arent at the apartment.
if they were there, of course id invite them.
and we discussed that, and I invite her to things more or what not.
its not that we really do that many things also.
Justin gets off work at like 8 and by then all we do is eat?
and sara has already aten by then.
is aten a word?

anyways.
I remember like we went and ate without them and sara was upset, so then we invited them out to coffee and they said sure, but they never showed up...and i was a little upset but if the tables were turned I know sara would have been really angry. we didnt even get a phone call.

I just dont want to upset her anymore.
but i wish she didnt get upset so easily.

on sunday.
we all went out to eat, and she was telling a story, and while she was talking, I interuppted her and started talking to Justin and she was realllllly upset. and I can understand that. but for some reason I didnt realize she was talking.

so I went to the bathroom and she came to, and told me ""Im really mad at you btw, for interuppting me"" and in my head i'm like oh god shes mad at me again (because last weekend she was upset with me too and then the following week to, i cant even remember why, she wasnt even sure why I think). 

so I told her I didnt realize she was talking....and she goes oh thanks....thanks...
and she said ""you dont make an effort, when im with you two i feel like im just hanging out with people who i dont know, who are in ther own world""

she says I dont talk to the group.
I just talk to justin.

but i feel like i do TALK!
to her and adam and other people.

I remmeber at the little xmas gathering we had.
I barely talked to Justin all night.
I was with sara and shanda the whole night basically.

and then she blamed me for things, i didnt think were true.
like me getting mad at her for going to ikea without me, when her and adam went.
I wasnt upset at all?

and i just couldnt handle it so i walked away.
so i walk back to the table with where our boyfriends are, and pay and leave  (sara is kinda dating adam, but its easier to say boyfriends) and we are in the car and adam says ""can you take us back to the apt, we are going to take two diff cars to the car show""

and so we drop them off.
and justin looks at me all confused.
and i tell him what just happened in the bathroom.
and hes really sincere and cute about it.

but yeah....

i just feel like all the effort i do put in doesnt matter, because eventually ill fuck up.
and i get it now, because i do that exact thing to every boyfriend i ever had.

so maybe this is a life lesson.
for me.

to 1. become a better listner 
and 2. be more open minded and realize they arent doing it on purpose.

things for the past few months have been off and on with sara and I.
and i fucking hate it.
one day its good, few days its bad one day its great.
rinse and repeat.

I dont see why its so complicated.
I love her, I want her to be happy.
I want her to realize, I want to see her more often or...I want to see her and other people that arent our boyfriends.
I want her to realize i know i havent been a good listener and I'm working on it.
I want her to realize, im jealous of her and how she has so many friends and how outgoing she is.
I want her to realize, I think she is an amazing friend and I owe so much to her.
I want her to realize, that I'm not trying to be a bad friend, and I know she isnt either.
I want us to realize how to fix whatever it all is.
I want us to be seerah and rachel again.
not everyday.
but very fucking often.


i hope all the above is realized soon.
i guess thats all."
"eventtime","2006-01-09 18:29:00"
"url","http://angeltoes.livejournal.com/170247.html"
"userid","780"
"itemid","664"
"event","its been such a long time since i gave an actual update.
i think i just shouldnt.

last night, my other cat pigeon (the one who chaz took when we broke up) had to be put down.
she had a mass and she was suffering, and chaz did the right thing.
its really sad and sucky.
she was an awesome cat, she tolerated me well.
she was so sweet.
we got her in July of 2003.
she was homeless basically and looking really frail.
so we took her in and rescued her.
she loved Chaz from the first moment.
she followed him evvverrrywhere he went and always had to sit on his lap or right next to him.
it was really cute and annoying.
she never quite loved me like that, but it was okay.
hah.
she was adorable.
and she will be loved muchly in kitty heaven.

as for my christmas.
it was really good.
I had 3 christmaseseses.

xmas eve I was at saras moms house and ate some really yummy food and got to hang out with sara and co.
and then xmas day I was at Justins parents house allll day.
but it was really fun.
I like his family a lot.
his sisters are so funny.
and his mom is super sweet and his dad is a big cornball.
but its fun.
when we were opening gifts we kept going ""OOOOHH AHHHH""
and his sister kept going ""its a christmas miracle!!!!!""
and it followed along with anything it could, we would say ""OMG its a christmas miraccccllleee""

then we went and saw narnia with his sister and sisters boyfriend.
i liked it for the most part.

then on Monday was christmas with the friends.
and we all opened gifts and then got food.
and then that night people came over.
and we went to shakeys to get pizza.
and played on the xbox 360.
we did mad libs.
it was fun just hanging out.

I got lots of gifts.
especailly blankets!!!
i got 4 this christmas
one from my mom, one from justins mom, one from justin and one from my brother.
I feel blessed :)

I got pretty artwork for my apartment from Sara.
random gifts from Adam, but it was funny because we did similar things for one another.
Justin got me a blanket and my favorite drink without having to mix it, and he wanted to get me something 'special' but he couldnt find it and he wont tell me what it is, cuz he is still going to get it.
Justins mom and dad got me candy and random cute things, like fuzzy socks and pjs and even q tips LOL.
Justins sister made me a scarf, i was like woooooooooooooooooow. I dont think i ever had anyone make me a scarf so its really special to me, and its super pretty.
and his other sister whom I never met got me this awesome hoodie.
i felt a little bad because i didnt plan on getting them gifts really.
I only met one sister once and never the other.

I'm going to get his sister Amanda something soon.
she loves anything pink and red kitchen applicances.
as for his other sister Audra, (who made the scarve), and I kinda last minuted her gift, and I feel awful, but she seemed to like it. I got the info from her myspace on what she likes.
im so 2005 :P

i also got money, and my brother and fiance got me a dvd player and lavendar stuff and i got earrings from saras mom, and just some more things like a kitty calendar with bad cats.

everyone seemed to like the presents i got them.
I got sara a lava lamp.
a really awesome one.
and i got justin a penguin tie (he hearts penguins) its not a cheesy one.
its pinstripe silk and it has a penguin on the bottom like outlined threaded on to it, sara and I got him a penguin alcholol shaker, i got him a chia pet, a gift certificate to his fav deli, and adam, sara and I got him a gym membership for 3 months.
I got justins mom, these really cute heart shaped measuring spoons and justins dad a pen that laughs at him.

so yeah.
theres the update.

im going to miss pigeon.
and all the happiness she brought to chaz, and chaz brought her.
i hope she finds mimi and spud in kitty heaven.
they can all hang out and meow and poop all day in heaven."
"eventtime","2005-12-29 10:34:00"
"url","http://angeltoes.livejournal.com/170146.html"
"userid","780"
"itemid","663"
"event","eventually ill do a real update but for now i just want to say

I HAVE THE BEST BOYFRIEND EVER!!!!
i could go on and on, but i would be annoyed with my friends if they did this, so if you want to know why just ask.
but heres a few reasons why

every morning that i wake up by him he mentions something about me being beautiful.
he tells everyone im the greatest.
he says hes so lucky and he doesnt understand how anyone has ever let me go before.
are you gagging yet?
wehaveamazingsexseriously.
k enough.

umm...my only fear is when things are really good, im worried that something will go wrong.
however im going to see Penny today and give her, her xmas gift and talk to her about this fear, and hopefully she can give me some insight.


and...yay for tonight my friend saras friend adams release party.


p.s. finals time is killing me.
p.p.s. i love my ipod nano."
"eventtime","2005-12-10 11:17:00"
"url","http://angeltoes.livejournal.com/169837.html"
"userid","780"
"itemid","662"
"event","brb i got to pee (11:36:14 AM): i just had the creepiest encounter at the laundromat
adam l scott (11:36:26 AM): tell me about it
brb i got to pee (11:39:44 AM): well last week when i wasa there, there was this lady there and the laundromat was full and i remmeber this one lady wanted to use the dryer underneath hers and she flipped out on her and was like theres another one over there use that one i wont move over so you can put your clothes in and i was just in shock....but the lady managed to get her clothes in, well this time she was here again and everything was fine until some persons kid came up to her an d she screamed youre gun na get hurt someone please take care of your child...and i just watched and then she looks at me after the mom gets her chilkd she looks in my direction and says have you catched any demons lately? and i look behind me cuz im like wtf and she goes YOU! and then just stares at me and i stare at her....and i was like wtf....she wouldnt stop staring at me...and then when i was gewtting ready to leave i ask her what she meant and she looks at me doesnt say anything and then hisses at me. it freaked me out i was shaking
adam l scott (11:40:51 AM): ROFLMAO"
"eventtime","2005-12-02 11:42:00"
"url","http://angeltoes.livejournal.com/169722.html"
"userid","780"
"itemid","661"
"event","so happy.
the weather.
the life.
the love.
the health.

seriously.
tonight adam, sara, justin and I are going to decorate the apartment all christmas-y.
and im going to have lots of sex with my boyfriend underneath the tree.
even though we wont have a tree till sunday.
we'll pretend.
im cool like that.

i also talked to my Dad on the phone for a looooong time today.
very odd. but very comforting.

this is all for now."
"eventtime","2005-12-01 19:56:00"
"url","http://angeltoes.livejournal.com/169404.html"
"userid","780"
"itemid","660"
"event","yay for having a boyfriend whose dad is a programmer for disney because that means free admission to disneyland.
we're going tomorrow.
yaaaaaaaaaaaaaaaaaaaaaaaaaaaaaaaaaay."
"eventtime","2005-11-26 18:33:00"
"url","http://angeltoes.livejournal.com/169097.html"
"userid","780"
"itemid","659"
"event","im gunna get fat :P

i just had a mini thanksgiving dinner at Justins parents house.
it was goooooooood.
I like his family a loooot.
they are so funny and so good natured and im just really comfortable around them.
Justin was scared to ask me to come cuz he thought I was going to say no. lol


now I need to get ready for my other thanksgiving dinner at Saras moms.
Justin couldnt go to this one, cuz Saras mom said there were to many people annnnd....because of Adam and Justin were both there together it would be the ""adam and justin show""???
but I'm excited to meet Saras family and hang out with good friends and meet new people.
So I'm gunna go eat there and hang out for a bit and then go and visit my boyfriend again.
Its been an ""us"" day.
im liking it a lot.
butgodwehavesomuchsexitsfuckinginsane.
inthebestwaypossiblemayiadd.
and we cleaned his apartment.
annnnd we hung out did cute things cuz we're cute like that.

anyway I need to call my parents and wish them a Happy Thanksgiving.
and I need to go take a shower...I hoooooppe the water is warm. It wasnt earlier.

k. 
Happy Thanksgiving!


p.s. I think I'm going to go see Wallace and Gromit today with Justin.
I want to go see RENT with him, but I want him to see the play first."
"eventtime","2005-11-24 15:46:00"
"url","http://angeltoes.livejournal.com/168934.html"
"userid","780"
"itemid","658"
"event","Let's see:

1) When you look at yourself in the mirror, what's the first thing you look at? my hair or my eyes.

2) How much cash do you have on you? $1 soon to be $50 more.

3) What's a word that rhymes with ""TEST""? quest

4) Favorite plant? tulips and daisys

5) Who is the 4th person on your missed call list on your cell
phone? simone

6) What is your main ring tone on your phone? death cab

7) What shirt are you wearing? justins brown hoodie. im freezing i dont get it. its 82 degrees outside.

8) Do you ""label"" yourself, could you? im a girl. is that good enough?

9) Name brand of your shoes currently wearing? none.

10) Bright or Dark Room? i like deep colors but that stand out.

11) What do you think about the person who took this survey before you? shes adorable.

12) Ever spilled the beans? hah.

13) What were you doing at 3am last night? sleeping, i went to sleep around 1 but then woke up again at around 4:00 to pee out all the alcholol.

14) What did your last text message you received on your cell phone say? Justin - work is going well thank you. but i do miss you very much so. (Justin)

15) Do you ever click on ""Pop Ups"" or Banners? by acccident.

16) What's a saying that you say a lot? awwwwwwh.

17) Who told you they loved you last? my mom i think.

18) Last furry thing you touched? my baby titus.

19) How many hours a week do you work? depends.

20) How many rolls of film do you need to get developed? zerrro.

21)Favorite age you have been so far? 23

22) Your worst enemy? Myself 

23) What is your current desktop picture? a pretty dove someone drew.

24) What was the last thing you said to someone? ""thank you so much"" yay chinese food.

25) If you had to choose between a million dollars or to be able to change a major regret? i dont have any major regrets.
so show me the money."
"eventtime","2005-11-19 15:30:00"
"url","http://angeltoes.livejournal.com/168488.html"
"userid","780"
"itemid","657"
"event","im cold.
its like 79 and im freezing.

anyway.
last night was another awesome night.

Sara, Adam. Simone, Justin and I went to bucca's and ate a loooot of foood.
and hung out and talked.

then we went back to Adam and Justins and I proceeded to have some shots of our homemade otterpops.
I chase them with cream soda.

then we all kinda hung out and then i fell asleep.
ohyeahtherewaslotsofsexyesterday.
goodfuckingamazingsex.

enough said?
i think so.

here are photos.
and no lj cut isnt my friend.

<img src=""http://rachrachrach.smugmug.com/photos/45118117-M.jpg""> Justins sleepy @ the laundromat and I look dazed.
<img src=""http://rachrachrach.smugmug.com/photos/43852983-M.jpg""> titus being artsy
<img src=""http://rachrachrach.smugmug.com/photos/42755226-M.jpg""> adam and sara
<img src=""http://rachrachrach.smugmug.com/photos/45118121-M.jpg""> me kissing justin...he looks like hes gunna cry. 

hes taking me on a date tomorrow! 
be jealous.

im still cold.

and toooonight.
i hope its fun.
im not 100% sure what im doing.
i think im seeing my friend aryn."
"eventtime","2005-11-19 12:03:00"
"url","http://angeltoes.livejournal.com/168352.html"
"userid","780"
"itemid","656"
"event","yay.

hah.

im lame.

but im happpppy.

im waiting for my ride to bucca de beppos.
hurry up.
hes a lagger.
my boyfriend lags.

he was late to the laundromat.
late to feeding ducks.
and late now.

but its okay cuz i adore him.
a ton.

my hair looks cute.
i should take a photo but im to lazy.

k i need to pee real bad all of a sudden so bye."
"eventtime","2005-11-18 19:30:00"
"url","http://angeltoes.livejournal.com/168087.html"
"userid","780"
