"names","values"
"event","So I&#39;ve been stupid busy lately and here we go.<br /><br /><b><u>Friday, November 11:</u></b><ul><li>Observe Remembrance Day service</li><li>Pack for family weekend in the big smoke</li><li>Meet the Creature with one of the kids&#39;s teachers</li><li>Take bus to Toronto; check into hotel; Pizza Pizza in room</li><li>Fighting head cold</li></ul><p><b><u>Saturday, November 12:</u></b></p><ul><li>Present M. with array of birthday presents acquired from ThinkGeek; he is very happy</li><li>Take kids swimming in hotel; pull neck</li><li>Thai Express noodle lunch</li><li>Shopping in the Beach; many books bought at Book City, sampled pricey cupcakes, visited Ends and got Albrecht&#39;s watch fixed while slobbering over some nice&nbsp;garnet and amethyst rings</li><li>Steaks at Canyon Creek; had a really crappy dessert coffee. It had Goldschlager and Irish Whiskey and it was just nasty. Harsh and bitter.</li><li>David and M.&nbsp;go to the game and watch&nbsp;the Leafs lose to the Sens; I take E. to the hotel playroom and watch Cloudy with a Chance of Meatballs while she plays with every toy in the place</li><li>Head cold continues; not feeling too good</li></ul><p><u><b>Sunday, November 13:</b></u></p><ul><li>Gamely attempt to conduct more shopping but epic fail as too tired</li><li>E. not eating well as she is sick too</li><li>Get early bus back home</li><li>Order Chinese food</li><li>Visit Staples and get&nbsp;10 colour copies of my Pattern Recognition paper</li><li>Pack for 3 trips: Dallas meetings; family visit and Kingdom A&amp;S. I won&#39;t see Guelph again until 7:30 pm Sunday, November 20</li><li>Decide NOT to pack Scroll of Honour as it will have to sit in an empty car for a week at the airport.</li></ul><p><b><u>Monday, November 14:</u></b></p><ul><li>5:30 am get up and head for airport. Forced to park on roof.</li><li>Go through airport security; 7 lines of anxious cattle</li><li>9:25 am flight departs for Dallas</li><li>During flight sketch&nbsp;10 design concepts for TE Septentria&#39;s Boke of Memories while politely fending off overly friendly person in next seat. Tiny plane.</li><li>Land and head directly to corporate office. Hot and humid; feels like late June</li><li>Conduct meetings and try to do regular work in gaps</li><li>Check into hotel; eat TexMex at hotel sports bar while watching 1st half of football game</li></ul><p><b><u>Tuesday, November 15:</u></b></p><ul><li>Very full day of meetings</li><li>Ordered to eat&nbsp;at&nbsp;premium steakhouse&nbsp;and enjoy myself. Take it literally :-D</li><li>Read KA&amp;S documentation</li></ul><p><u><b>Wednesday, November 16:</b></u></p><ul><li>More meetings</li><li>Weather cooler now, TG</li><li>Accidentally discomfited&nbsp;someone I thought was impenetrable. Good thing though. Go me!</li><li>Very nice Italian dinner with opposite number</li><li>Read more KA&amp;S documentation</li></ul><p><b><u>Thursday, November 17:</u></b></p><ul><li>Even more meetings</li><li>Long end-of-day session</li><li>Eat at sports bar and watch more football. Really tired of Tex-Mex now.</li></ul><p><b><u>Friday, November 18:</u></b></p><ul><li>12:25 plane back to Toronto. Security both ends and another 7-row cattle herding exercise</li><li>5 pm land; race to roof of parking lot to retrieve parking stub that I forgot in car so I can pay downstairs</li><li>Begin long drive to Gananoque</li><li>9:00 pm arrive Gananoque. Pre-packing was successful - didn&#39;t forget anything for the family.</li><li>Eat quick McDonald&#39;s dinner and spend rest of evening chatting and&nbsp;assembling&nbsp;copies of documentation</li></ul><p><b><u>Saturday, November 19:</u></b></p><ul><li>Download Albrecht&#39;s paper and bring to computer shop so I can print copies for KA&amp;S</li><li>Zoom to the event site. Forgot cash; stop at handy gas station</li><li>Put on garb, unfortunately miss most of Keja&#39;s charge to the judges but then this is my 8th year judging KA&amp;S/Pent so hopefully I know the drill by now</li><li>Put out copies of Albrecht&#39;s paper and mine on the table</li><li>Judge. I think I had 8-9 assignments plus the Pent entrants. Only 3 this year as two had to withdraw due to life. Actually an easier KA&amp;S than most, yay! Last year I judged&nbsp;14&nbsp;entries plus Pent. Really enjoyed one of the Arabic food entries, chicken breast in a mustard sauce with pomegranate seeds that was quite yummy. Saw two first-time scroll entries that were quite exciting with impressive scope for beginners, hope they keep on scribing. Had a chance to enjoy Kat&#39;s beautiful middle-class&nbsp;Elizabethan ensemble. Congratulations to our Pent winner - loved the nettle theme, yummy meat pudding in a turnip, pale pink madder and daffodil yellow linen clothes, naalbinding and research paper. I also totally coveted Beaudoin&#39;s ruby red&nbsp;bottle of mead but I guess my hints weren&#39;t big enough</li><li>Managed to eat a decent lunch (yay lunchtable that let me sit down with them!). I was starting to get the shakes and realized I hadn&#39;t had breakfast.</li><li>Collect HE Rachael&#39;s lovely contribution to the Scroll of Honour - just a beautiful piece based on a&nbsp;moroccan red Arabian book&nbsp;binding just covered in madly ornate&nbsp;Sumi goldwork... Finally have a piece of her work in the SoH!</li><li>Court. Aeneas&#39;s Hammer was bestowed! :-D And then Albrecht&#39;s paper won his category! His first A&amp;S competition. I was thrilled to have a beautiful prize to take home to him - a lovely brocade pilgrim&#39;s bag by Adrielle enclosing a leather bound blank book by Tarian!&nbsp;Call Albrecht with the good news as soon as Court is over, then rush back to Gan for roast beef dinner with potatoes and salad and&nbsp;brownies to follow :-)</li><li>Over the day I also managed to sell two copies of my Pattern Recognition paper for $8 each (just trying to recoup my&nbsp;printing and&nbsp;binding costs). I have some more copies available for sale as it&#39;s a useful guide to take along to the fabric store.</li><li>After dinner <i>chez</i> Gan, find myself nodding on the couch next to the dog. Haul myself to bed along with a quartet of Giles annuals, a pint of iced tea and other comforts. Crash.</li></ul><p><b><u>Sunday, November 20:</u></b></p><ul><li>Sit around a bit eating and reading. Do a bunch of errands with family, then pack up the car with gifts from the family and head back to Guelph</li><li>Complete drive in 4.5 parsecs, I mean hours, which is excellent time</li><li>Eat while Albrecht unloads the car, not a small task</li><li>And get ready for regular work on Monday</li></ul><p>Next week I have to go to Winnipeg for quarterly meetings. More family stuff out there. Also Albrecht&#39;s family is coming down late next week while I&#39;m still away. So we kind of have to get our Xmas act together before Tuesday next week and kill two family birds with one stone.<br /><br />And I have a scribal assignment I need to finish before next Tuesday. However the wording is taken care of and I was able to brainstorm a nice design on Thursday night while at the sports bar.<br /><br />To step back a few weeks, when I was assigned to scribe the Thorbjorn&#39;s Hammer award for HE Aeneas Oakhammer it was almost a no-brainer for me to choose the Mammen axe head, which is heavily decorated with niello knotwork. It turned out fairly well - I was pleased.<br /><br />After Winnipeg the next big thing is Calvert&#39;s elevation, but for that all I have to do is drive, dress up, smile and bring scotch. Unless I&#39;m voluntold otherwise.</p>"
"eventtime","2011-11-21 21:40:00"
"url","http://asagormsdottir.livejournal.com/28808.html"
"userid","1023"
"itemid","111"
"event","<p>Up to my usual nonsense.<br /><br />Invited an SCA friend&nbsp;over this weekend to work on her first medieval-style dress. A couple of weeks ago we went to Fabricland and she found deals on a dark teal blue faux dupioni and a pearl grey tulle for overlay.<br /><br />Something folks tend to forget after a few years in the SCA is that deep yearning to look like a princess. And not with a boughten dress either, but one you&#39;ve sweated and worried over, your first real home made dress. I have seen&nbsp;veterans faced with an eager new person try very hard to push them away from &quot;fantasy crap&quot; into more appropriate silhouettes and fabrics, but it can be&nbsp;self-defeating. The person may go along with the more experienced&nbsp;suggestions, but be vaguely dissatisfied and disappointed with the results.&nbsp;Many women have a vision or visions of their perfect dress and the sooner they can get out there and try to make it the way <i>they</i> see it the happier everyone will be.<br /><br />As far back&nbsp;as grade 5, maybe&nbsp;earlier, I drew my perfect dress as a (crushed) royal blue velvet dress with square neckline, dropped waistline and full skirt. I was lucky that when I eventually found the SCA I also found a person who was willing to make my idea with very little alteration other than that I could not afford blue velvet and instead got some blue polyester weave that was actually very hard-wearing and is probably still out there&nbsp;if not&nbsp;in the Gold Key in the sky.<br /><br />But before that dress, which I wore happily for years,&nbsp;I found some sparkly purple and silver crap, sewed it together by hand into a travesty of a Florentine gown and wore it with pride (and scuffed black pumps, alas) for several months until the silver started to wash off. I still have it in my drawer. The colours were just like a silk-screened scarf, that soft blurred water-colour&nbsp;of pansies in&nbsp;rain. And, bless them, no one said a nasty thing.<br /><br />You kind of have to get it out of your system.<br /><br />Tomorrow we are having some folks over for dinner and a chat so we can understand some stuff better and get&nbsp;our innings in privacy without being shouted down. Nicolaa said once that&nbsp;the SCA has systemic communication problems: boy, does it ever. And I&#39;m not even talking about the issues down the street; this is a whole different kettle of fish.<br /><br />The good part, for me, is that I don&#39;t feel punched in the gut by this week&#39;s events. I feel that I can continue to play my game according to my terms whether or not certain other things change or not. I wish to protect those who may be unknowingly hurt by the crap going on, and hopefully all will be well, but even if it isn&#39;t I am pretty sure I will still be on a fairly even keel.<br /><br />I am so in love with the Lost in Translation soundtrack. And with Debussy&#39;s Clair de Lune. And with Leonard Cohen&#39;s voice.&nbsp;I even love Kung Fu Panda&#39;s music (Oogwey Ascends). Something about the haunting Asian tonal scale. Such rich, eloquent, accepting sorrow.<br /><br /><a href=""http://www.youtube.com/watch?v=YVYQcGQpyoM"">http://www.youtube.com/watch?v=YVYQcGQpyoM</a><br /><br />I am reminded of a jewelled piece I saw at the Maharajah exhibit at the ROM earlier this year. It was a small ruby and gold&nbsp;sculpture of a (presumably) Hindu goddess. This very&nbsp;small piece, hidden in a niche in the exhibition, somehow <i>breathed</i> the same protective devotion and awe that I would consciously <i>project</i>&nbsp;upon a sacred piece&nbsp;from my own religion. It must have been loved and cherished for centuries. How can I say it? I had no trouble identifying it as something deserving&nbsp;my spiritual respect although it is not from my faith.<br /><br />We have been having a lot of fog lately. It was -5C in Milton Friday at 8:12 am. The fog is different every day. Beckoning halls of mist: that, as you advance, diminish.<br /><br />I often wonder if I will enter another world when my car drives into heavy fog. And then wonder how I will get back. Or if the world will be of my own devising and will let me bring in my loved ones, a distant golden manor, surrounded by gardens and sweet music.</p>Good Lord, I don&#39;t remember Lost in Translation including Rick James&#39; &quot;Love Gun&quot; before! Must get Albrecht to buy some tight gold satin pants.<br /><br />I spent a small fortune on ThinkGeek today. Birthdays and Christmas to take care of. We have mondo plans for next weekend which are being kept secret from The Boy.<br /><br />Also there is far too little&nbsp;rum in the house. Again.<br /><br />I really need to do some scroll layouts for the Boke of Memories. Have a bunch of ideas in my head to play out. I&#39;ve been fabric-focussed lately (we organized all the bins last weekend) and all the bogged-down projects are now sitting in a blanket chest in front of the couch. It&#39;s full. So theoretically that means I need to finish some of them before I start others. At least I know where they all are. Let&#39;s see what they are:<br /><ul><li>Albrecht&#39;s black velvet brocade suit of clothes (about 2/3 done)</li><li>My reversible Tudor dress in crimson red silk with black accents that reverses to grass-green brocade with cream dupioni silk (about 1/2 done)</li><li>My reed corset (about 1/3 done)</li><li>Albrecht&#39;s purple wool hosen (about 1/2 done several years ago but then the moths got at some of it)</li><li>Albrecht&#39;s linen shirt with blackwork (about 1/2 done but the proportions are terrible&nbsp;and the blackwork minimal. In fact the blackwork was so hard on my eyesight I&#39;ve done nothing on it since M was a baby - yes)</li><li>Somebody else&#39;s 2/3 done project that they would like me to help with (kind of a guilt transfer)</li><li>Albrecht&#39;s brand-new doublet and slops in wool and linen (fully cut out but not yet assembled)</li></ul><p>And I&#39;ve forgotten what else is in there.</p><p>A couple of weeks ago I showed someone how to make a simple half circle cloak. I didn&#39;t have a measuring tape with me so we used a long piece of cord he had in his backpack to describe a half-circle. I helped him pin the beginning of the hem and make a few stitches, then let him at it. He came back this week with a fully functional cloak, hood and closure. He was so proud of himself. It was great. He even finished it in time for Hallowe&#39;en!<br /><br />So next weekend is a big family deal. Then I fly down south for a week. As soon as I land on Friday afternoon I need to drive to Gan (KA&amp;S is the next day), so I need to ensure the car is properly packed before I go to the airport a week Monday. Then I&#39;m back for a week. Then I go out west for most of a week, then Suzanne comes down, and then the following weekend we&#39;re driving to Calvert&#39;s Pelican ceremony in Buffalo (what to wear? oh what to wear??) and then it&#39;s time to get ready for Xmas. At least the vacation allotment restarts Jan. 1.</p>"
"eventtime","2011-11-05 21:10:00"
"current_moodid","57"
"url","http://asagormsdottir.livejournal.com/28535.html"
"userid","1023"
"itemid","110"
"event","Just got through a big week! And no temper tantrums yet! (knock on wood)

Crown was on Saturday. Mega Practice was on Sunday. A&amp;S/Post Rev was on Sunday. 5 house guests. No waiting, I mean resting. We love having friends over and feeding them. With Albrecht&#39;s work schedule we try to maximize our weekend opportunities, but we almost bit off more than we could chew.

We had already arranged to hold a Fencing/Dance mega practice in der Welfengau on the Sunday. And we hadn&#39;t an A&amp;S Sunday in a few months so I offered to hold one, as a kind of post rev after the Mega Practice.

We heard our&nbsp;dear friends from Skrael needed crash space for Crown. We love to have them over, so we arranged to put the 3 of them upstairs. Then Archibald and Jocelyn needed space, so we assigned them to the living room. Meanwhile we found out that the shower in M&#39;s bathroom had suddenly lost all water pressure, so the push was on to get that repaired before Friday.

And much cleaning was on the agenda as well. We continue to cull stuff post-toddler and I had bags and boxes to get out the door.

Here is how last week read, not including our regular work and family commitments. Throughout Albrecht was cleaning like crazy.

Tuesday night: Albrecht taught Heraldry/Persona Names at der Welfengau. I dropped off stuff at Value Village, got gas, retrieved the extra van seats from the storage locker, and bought new pillows at Wal-Mart. Most of it while E was asleep in her car seat. Thank heaven, no crying.

Wednesday night: Fabricland trip in a drenching&nbsp;cold rain. Only one person of the 4 expected showed up, alas, but I got them into some nice fabric for a 14th century -esque ensemble. Fabricland was having a buy 1, get 2 metres free, so I collected a lovely, subtle chocolate plaid wool to make Albrecht a new doublet and slops. It worked out to $8/metre. A really nice fabric. Compile the 11 separate sections of Pattern paper into single Word document (290 MB) and copy to thumb drive so I can later print it at Staples. Swear repeatedly at ancient laptop.

Thursday night: Albrecht working. Groceries, including supplies for our house guests, Mega Practice commissariat stuff, and ingredients for the A&amp;S/Post Rev. Managed to stay under household budget somehow.

Friday night: Albrecht working. Plumber comes and fixes water supply. Very tidy hole around taps, cover with plastic sheeting until they can replace the tile. Buy new shower curtain (as old one has been shredded by cats) and dark red flannel bedding (score a sale!) and more commissariat supplies. Get&nbsp;cash. Cut and sew big sleeves for latest houppelande. Finished! (Though I still want to cut strips of dark red silk to decorate&nbsp;the centre seams. J calls. Packed Scroll of Honour and my illumination binder for the A&amp;S roundtable. Packed my in-progress apron dress and sewing basket. Skrael friends arrive a little after midnight just&nbsp;beat&nbsp;and crawl into bed.

Saturday: Albrecht working. Pick up 3 der Welfengau ladies and drive them to event. Help orient them during the day. Exhibit Scroll of Honour in the blessedly warm upstairs room. Fell half a seam on apron dress using dark red wool laceweight yarn. der Welfengau ladies try out dancing! :-) Watch second half of tournament. Wow! Pretty intense! Edward the Red wins! Attend Court. We had 9 people from der Welfengau present. TE Ramshaven recognize our newbies! :-D Drive the ladies home to Guelph. Scarf down delicious bowl of pork and noodle stir fry prepared by wonderful Albrecht. Jocelyn and Archibald arrive. Lucia and her ladies arrive. She mentions bunz is playing with pigments, so I grab some of my new dark blue lapis and throw it in a baggie for her to turn into ultramarine. People are tired and everyone goes to bed pretty quick.

Sunday: Smack arm really hard trying to come down the stairs quietly at 7:30 am, waking up Archibald. Make tea/coffee and breakfast for guests. Drive Albrecht, fencing equipment and supplies to Mega Practice at the University. Freaking cold at 9 am, only +2C and frost on cars. Zoom back, do Tim&#39;s run&nbsp;and cook&nbsp;more breakfasts as others wake up. Eat breakfast myself. Enjoy leisurely bitch session with Lucia et al (Thank you!) until they need to get on the road.

Start cleaning and cooking for A&amp;S/Post Rev. Bake chocolate cake for Black Forest Trifle. Devin arrives and starts work on the Persian coat for Niall. Cook filling and assemble mega lasagne. H calls. Too busy to talk with her long but hopefully she did not feel blown off. Play assorted music, get a little weepy but not too much. Assemble trifle and chill in fridge. Make breading for chicken thighs. Discover&nbsp;covered bowl of grey turkey bits in fridge, throw out contents. Developing slow burn. Albrecht calls, will be ready to come back soon. Food is in oven when I leave to get him, I turn down heat, but unfortunately it dried out a little&nbsp;before we got back. Crap! Still quite good but it would have been so much better.

When we arrive 2 ladies are already there for the A&amp;S and Devin has supplied them from the library. Awesome! Other folks arrive and we scarf down lots of food. Devin gets through a huge amount of her caftan project. Other ladies find ideas in books and work on finestrella sleeves. Watch the new Robin Hood. I am exhausted, leafing through book on old English needlework and idly noting author&#39;s poor opinion of American quilting. Silently tell long-dead author to go f___ themself. Go upstairs and lie down on E&#39;s bed and wait for movie to be over so I can drive folks home (bus service ends at 6 pm on Sunday here). Doze off. Albrecht wakes me up and I take 4 people home. Gas tank is almost dry. It&#39;s 10 pm. I go back home and go to bed.

Today I reconciled a massive project and got most of the way through a monthly report. Ate satisfying dinner of leftover lasagne and trifle. Mmmmm. Next stop: Hallowe&#39;en."
"eventtime","2011-10-24 20:16:00"
"url","http://asagormsdottir.livejournal.com/28300.html"
"userid","1023"
"itemid","108"
"event","I run into the Virtues discussion fairly regularly but never feel&nbsp;part of the picture because the moral priorities&nbsp;I seek&nbsp;don&#39;t seem to really fit the list. Once I heard about the Norse list I felt a little better (thanks Hector for that Ursus article)&nbsp;but I&#39;m not 100% sure my virtues have a home.

So here&#39;s my take:

Hard Work
No matter what, if I work hard I know I will get there. I don&#39;t respect it when people&nbsp;go part way and then languidly fall back in feigned exhaustion. Hard work is a virtue. Its&nbsp;crucible of self-denial&nbsp;proves my commitment.

Love
I think love is too easily dismissed and limited in scope to&nbsp;spousal&nbsp;and close family relationships. I think real love for friends and colleagues is possible and inspiring. Love makes burdens light and helps make it easier to see and do what is right.

Passion
I feel strongly, and as a frequently intuitive person I believe it is a strength.&nbsp;To be sensitive to beauty and goodness, to shed tears over evil and injustice, and to harmess&nbsp;that&nbsp;energy to drive my response is not, to me, a weakness. I don&#39;t strike blindly but I bear the emotion like a flag before my eyes. You can&#39;t write poetry without passion.

Independence/self-reliance
Doing things alone proves my worth and ability to do them at all. Yes, I know how to be a team player. And I know how to take things under my wing and be responsible for them and make them happen.

Faith and Hope
To me these are almost the same. Faith requires a future to have a point. And hope opens the door.

Loyalty
This is more often disparaged than used, because it ties you to someone or something who may not return the favour. But to date the work I have done in the name of loyalty has not repaid me ill. Loyalty lets me pass over the rough spots without bailing. It can be a necessary bridge of tolerance.

Courage
This I think everyone can agree on.
It&#39;s telling my husband everything will be all right while I am rolled into surgery for an emergency c-section. It&#39;s promising to teach a class somewhere in Ohio to people I have never met. It&#39;s receiving friends&nbsp;at my father&#39;s funeral with my smile in place for the sake of my mother."
"eventtime","2011-10-02 19:56:00"
"url","http://asagormsdottir.livejournal.com/27680.html"
"userid","1023"
"itemid","107"
