"names","values"
"event","ok heres the day. i think it was ok for the most part. i mean, ya know, it was decent at first. i mean, i've never gotten so much homework in one night in my frickin LIFE, but its not like i'm gonna do it anyways. but besides that, it was managable.

so, whatever. i managed to make it through the day. and then i took the bus home. a girl on the bus did taro cards for me. interestingly, they were VERY true. my past was that i was benefitting and that i like had something i really wanted (NICK), my present was like losing something and going crazy and disappointment (NICK DUMPING ME), and my future was basically about giving up hope and that i won't get what i want. which just seems so realistic to me. its a little scary.

anyways, i went and hung out with jake for a while after that. i went home around 5 and got ready and got dropped off at Molls. We hung out and then i ate and she went to voice lessons so me and her sister watched ""gilmore girls"". and then molls came home and we went to the game. 

so the game. it was interesting. everything sorta sucks at the presiding moment. because ok. i like nolan. i will not deny that. but i do NOT want to hurt anyone at all. seriously i have no intention of being with him if its going to hurt any of my friends. if they are not ok with me being with him or liking him, then i will easily fix that. i just dont want anyone getting mad at me over a boy. i just want to talk to anyone who has a problem with it so i know if they will manage with me possibly ever going out with him or if they are completely against it, because it would make this whole process a LOT easier. but idk, me and nolan tried to talk and that didn't work out so good, so hopefully we can figure some crap out later sometime.

i like him alot guys. i really do. hes sweet and nice, hes fun to be with, hes a major stud, he makes me smile no matter what, and he makes me forget about nick. i have yet to find another guy that does that for me, so that must mean he's special. i really hope something can eventually happen between us. i guess we'll have to see!

alright. now i'm sorta just bumming out. i've got like soooo much homework its psycho. but idc, i dont want to do it. i really just DON'T feel like it. so idc. i'll just copy someones or something. 

and i'm kind of sad honestly. i talked to nick last night on the phone. i tried to tell him how i feel, sort of. but everything i said went in one ear and out the other. 

idk, feeling like this makes it hard to want to do much of anything. i can't concentrate anymore enough to do my damn homework. i can't really concentrate to do anything at all anymore. i hate that feeling. i just wish i could do SOMETHING to fix this bs. like either forget him completely, or just lose my feelings for him all together. ugh.

here are all the things i am feeling like right now:
i am hungry. i am cranky.
i am freezing. i am blah.
i am sore. i am disappointed.
i am aggravated. i am exhausted.
i am rejected. i am dreading h/w.
i am blank. i am gloomy.
i am frustrated. i am depressed.
i am numb. i am unsatisfied.
i am sad. i am cynical.
i am guilty. i am pessimistic.
i am bitchy. i am unhopeful.
i am lost. i am wishing.
i am desperate. i am stressed.
i am psycho. i am confused.
i am jealous. i am overworked.
i am alittle angry. i am betrayed.
i am crappy. i am lonely.
i am crushed. i am missing him...

I NEED TO GET OVER ITTTT!!! geesh.

oh well, i like nolan. that makes me feel better :)

k i'm leaving. dan rocks! he is a cool kid lol and hes very nice. i'm sorry i told today dan :( i hope you forgive me! jessica and david are going out! yessss! i'm so happy for the both of them! hehe and SAM AND MOLLY ARE GOING OUT! yaaaahooooooo! isn't that awesome?! i'm so proud lol. i hope i get a boyfriend soon :(

ok ttyl. leave comments. PLEASE. 

xoxo &hearts; ashlee"
"eventtime","2004-10-26 22:11:00"
"current_moodid","54"
"url","http://ashleemarie22x.livejournal.com/4702.html"
"userid","1050"
"itemid","17"
"event","well. i'm crabby. idc this is all so retarded.

well lets see. i'm so far behind is school thats its turned like depressing. i don't WANT to do my work because i don't FEEL like it because when your pissed or sad, you really don't FEEL like doing anything. its kind of funny to me that i could still be sad.. to this day.. about something that happened months ago.

i am so frustrated with everything right now. 

i don't know what is wrong with me! something must be.
i'm going crazy. thats it. i'm going completely psycho.

i don't know what to do anymore. everything is just going all so wrong. love is TORTURE. i swear to god i don't understand. because he is a diiiiiiickhead! HOW CAN A DICKHEAD BE SO PERFECT IN MY EYES?! :-\

this was over. over 6 months ago. yet that bastard won't go away. its stuck in my head. and it won't go away. its funny because i get all excited and i like someone else soooo much and then when it actually gets to a point where something might happen... i freeze up. and i start trying to find each and every fault in the person i ""like"". and then, i slowly like them less. i blame every bit of it on that stupid bastard. fucking over 6 fucking months ago. grrrrrrrrrrr.

anyways i'm calling him to talk to him. cuz i think he should know. not like he'll give a fucking shit anyways. but hey, i mise well tell him. 

fuck this shit.

bye"
"eventtime","2004-10-25 22:15:00"
"current_moodid","7"
"url","http://ashleemarie22x.livejournal.com/4405.html"
"userid","1050"
"itemid","16"
"event","hey there babes and studs!

MOLLY GOT HOME TODAY! WOOOOHOOOOO! lol i'm very happy.
she called me and told me all about her wonderful trip.
IT SOUNDED SO FUN!!!!!!! no fair!!!!!!! lol

right now i'm dying my hair AGAIN. lol i had bad roots so i'm redying it again. BLONNNNDE. lol of course. so yeah! thats about all i've got to say.

i have alot of homework. UGH! i should probably do it. lol. we'll see.

x's and o's! love you guys!
LOVE ALWAYS &hearts; ASHLEE"
"eventtime","2004-10-24 19:22:00"
"current_moodid","52"
"url","http://ashleemarie22x.livejournal.com/4269.html"
"userid","1050"
"itemid","15"
"event","wow. i said love 19 times in the previous entry. if you counted different, leave me a comment and tell me what you got. lol god i MUST be bored if i'm counting words. 

well i'm going to bed. i'm tired
g'night dears. x's and o's! love you!
&hearts; ashlee"
"eventtime","2004-10-24 02:08:00"
"current_moodid","31"
"url","http://ashleemarie22x.livejournal.com/3954.html"
"userid","1050"
"itemid","14"
"event","well the wedding. it was fun. the food kicked ASSSS. oh man. i ate waaaay alot of food. lol and then i danced with my grandma and my mom. we did the chicken dance - haha. and i slow danced with my grandpapa. that was cute. so yup. for the most part, the wedding.. it was fun.

i don't like weddings though. i decided that. i really like seeing ppl that love eachother. cuz love is like the best feeling in the whole world. but i can't  help but think that they are gonna lose it anyways. sometimes i wonder if love can actually last forever. idk it seems to me like all couples run into their problems and slowly drift apart. i guess only the lucky ones get to experience true, longlasting love.

i guess weddings make me sad. they make me think about what i could have right now that i don't. and i hate that. becuz i don't want to think about that. but weddings make me think that way. about the plans i made for my future... how many kids we were going to have, where we were going to live, what our wedding would be like... weddings make me go back and think about nick. i don't like to think about nick. but thats what weddings do to me. and because of nick, i now found it hard to like weddings. becuz i always think that they will break up anyways. nick took the fun out of weddings for me. i guess he really took the fun out of a lot of things for me. and in same ways, i hate him for that. for lying to me. for pretending he loved me. it only made it harder. sometimes i think i want to just go back and just say no from the get-go. i don't know if that would have been a good idea or not. i guess i will never know. and i guess i will never know where me and nick could be today if we were still together. because we won't be together. ever again. and i guess that fact won't get through my head. no matter how much i think i'm over him, it seems to me that i still can't get him out of my head. god i hate that feeling.

but the good part... is that i have finally found someone who makes me forget about nick. and so. hopefully something happens with this someone. cuz obviously hes special if he takes nick completely out of my mind. and like all my friends have been telling me, thats exactly what i need right now. 

so anyways. back to the wedding. it was fun for the most part. and when i got home from the wedding, i was bored. so i watched ""love actually"". again. for like the 45th time. lol i love that movie. its so cute.

i was writting down quotes from the movie. because that whole movie is like just adorable and there are some really cute quotes so i wrote some of them down.

that movie is one of the best in the whole world. you laugh, you cry, you get mad, you feel bad... you smile, you get warm feeling inside... its just a great movie. 

i guess i am addicted to love and everything that has to do with love. i believe in everything to do with true love and i believe that we all have that perfect person. i think that only the lucky ones actually find it though. because most of the time, people are just out to marry any old person that comes along. but i won't do that. i'm a true romantic. i will find my one and only. because i believe there is one out there. there is that person that i will never get bored with. the guy who makes everyday brighter and somehow makes me love him more everyday as time goes by. i'll find him. maybe i already have. i guess i don't know right now. but i know hes out there.  

anyways that movie is really good for you ppl that are like me and think like me lol. 

well right now, i think i'm love sick. i hate it. there is nothing worse then the agony of having a crush on someone. its like torture. because when your crushing, nothing is actually going on at the presiding moment. so you have to work for it. and that makes it torture. its hard to like someone when you don't really know if they like you back or not. but i guess everything can't always go your way. sometimes someone can see love in something that someone else just doesn't see. love and liking and crushing is confusing... but it also requires patience. so we'll see what happens. 

anyways i got this idea to write down everything i would want in my perfect guy. i figure before i get a boyfriend, i can consult my list to make sure the guy i'm going for has at least half the qualities i want in my perfect guy. becuz i'm super picky when it comes to picking guys and so maybe my list will help! so yeah i made a list. i have like 35 things on there. i figure i'll prolly end up with alot more. i'll just add more as i think of them. so hopefully that list can help me in the future!

well. this is an interesting entry. its confusing. lol oh well. i'm bored. well i should go. i'll go to bed or something. tomorrow we're doing a tit fest at 3. yahoooooo. i'm excited. lol we're seeing ""napolean dynomite"" at 3 and then we're eatin out at tanners. its gonna be a blasssst!

i figured out that i have an obsession with typing alot of letters in words. geesh. i do that alot. lol i think i just realized that. hmm. lol

anyways i'm gonna go. i'm bored and tired. so i'll talk to everyone tomorrow. i have a lot of homework. oh well screw it lol i'm bored of school. k i'm leaving. i keep saying i'm leaving and i don't. but now i am.

oh and molly comes home tomorrow! woooohoooo

ok. &hearts; you. ttyl.

lOvE ashleeeeeeeeeeeeeee
(there i go with the lots of letters thing again. lol)

p.s. i love sarah and kelli because they are cool and called me at the wedding today. lol no one else did cuz they don't love me enough! so screw you guys! lol i put in my away message to call me if you love me! and those 2 are the only ones that did! how mean of all the rest of you. maybe if you love me enough, you'll be nice and call me tomorrow to cheer me up. :)"
"eventtime","2004-10-24 01:16:00"
"current_moodid","97"
"url","http://ashleemarie22x.livejournal.com/3758.html"
"userid","1050"
"itemid","13"
"event","hello there! well i'm going to a wedding today! thats like my plans for the whooooole day! lol so yup. thats all i really have to say! please call my cell phone so i'm not totally bored. i will love you dearly if you do. lol so please call me. PLEEEEEEEEASE.

ok i'm gonna go! i have to leave in like a half an hr and i still need to pick out clothes. lol

ttyl! x's and o's

LOVE ASH! &hearts;"
"eventtime","2004-10-23 13:24:00"
"current_moodid","126"
"url","http://ashleemarie22x.livejournal.com/3471.html"
"userid","1050"
"itemid","12"
"event","hey babes and studs! well. tonight i saw ""the grudge"" and holy crap was it scary. lol i almost peed my pants. oh man. lol so if you see it, beware! you WILL scream! lol

soooo! the movie was fun. i sat by nolan and kerry. we sqooshed ourselves in the 2 seater haha. it was fun. we were all soooo scared! oh man lol. and god was it funny to hear nolan scream. lmao. but it was fun.

well. thats about all i can really say in here! 

i love you all! xoxo

and yes. i like a guy. and no. if i haven't told you who he is then you aren't gonna find out. but yes. i'm hoping it goes somewhere. and no. i don't want people to be mad at me for it. :-\ its a confusing situation.

alright. i have to go. leave me comments if you want!

love always and forever &hearts;&hearts;&hearts;&hearts;&hearts;&hearts; ashleeeeeee"
"eventtime","2004-10-22 23:42:00"
"current_moodid","125"
"url","http://ashleemarie22x.livejournal.com/3146.html"
"userid","1050"
"itemid","11"
"event","heyyyyy! 

i just got back from nolans! that was fun! lol i met his friend dan and yeah it was fun. they made bridget a giant card for her birthday but shhh dont tell her til she sees it! lol and mike was there but then he had to leave to watch disney movies with his cousin! hehe cuteness... so yeah that was really fun! but i had to go cuz he had to eat :( oh well hopefully we'll hang out more later.

sooooo besides going to nolans, i sat on my butt and watched degrassi all day. lol god i love having tivo. it saves all my episodes and plus, i could NEVER get sick of degrassi. lol

well tonight i'm either going to see ""the grudge"" at 7:20 or i'm going to jordan's with a bunch of ppl. i'm hoping i can drag nolan with me to jordans! lol cuz then he can meet the sophomores, but i guess we'll see what happens.

k thats all i really have to say!

love you guys! xoxoxoxoxooxxoxo
i miss molly! :( lol

&hearts; LOVE ASHLEE &hearts;"
"eventtime","2004-10-22 17:52:00"
"current_moodid","59"
"url","http://ashleemarie22x.livejournal.com/3003.html"
"userid","1050"
"itemid","10"
"event","hey guys and gals. 
well i am in a bad mood. i'm tired and cranky. 
so here i am to vent my problems. here goes:

i hate boys. idk what to do anymore about any of them. they are all too confusing. i mean, gosh. idk. sometimes i really wonder what the HELL goes on inside their heads?!

nick. he gets to me. i don't even know why. i keep asking myself what this thing i have for him really is? because i can't tell if i still have feelings there or if it is just the fact that i'm not over him yet. or maybe i just don't know how to act around him. thats another thing it could be. thats what i keep thinking. i don't really know what it is. sometimes, i wonder if life would be easier if i just told him that he has a choice: i'm either in his life as a girlfriend or out of it completely. because i don't think there is an in-between for us. i don't think its possible for us to ever have a friendship without those feelings coming every once in a while. so maybe its time we just stopped all of this. 

i guess i really do wonder if he needs me. maybe i am an essential part of his life. because it seems as though everytime i try to run, SOMETHING pulls me back. i wonder where that feeling comes from. and why i have it. 

you know, i really thought i was over this stuff. honestly. i mean maybe i really am. i can't even tell anymore. because if i think about it, i generally assume that i just don't know how to act around nick anymore. i honestly think i'm over him.

then again, what if i'm lying to myself?

i can't tell if i have feelings for him or not. 
and now hes being nice to me.
thats not helping.

i wish there was a simple solution. either i'm in or i'm out. thats what i want. i can't keep living confused and i can't keep thinking things that aren't there. maybe its time i let it all go... the love, the friendship, the everything. 

i need to think more. but i think that is where this is going to have to go. because i can't live like this anymore. especially since i like another guy. alot. this whole nick thing needs to go away completely. and then i am free to do what i want to with the other guy. i like him so much. that i know for sure. 

its funny how i'm so positive i like this other guy... yet i can't even tell if i have feelings for nick?

you'd think after loving someone for 2 years, you'd learn to know what true feelings feel like.

hmmm.

anyways i'm confused. so i'm venting.

me and molly  never went tping. thats ok though; she was a tired little girl. lol i stayed up til 6 making pictures on her Adobe thing. that was fun. they are pretty too. and then we watched a movie in the morning and chilled out. so i had a blaaaast.

and molly is friends with jessica again. THANK GOD. that was getting confusing. i'm  happy i'm not involved with the confusion of that anymore! and i'm happy they got their best buddies back! :)

ok i'm gonna go. my night got all screwed up. i got invited to a bunch of places but i guess my ass didn't leave the computer chair to go to any of the places. oopsies.

ttyl-&hearts;-xoxo-&hearts;-ashlee

if you have advice for me, please leave a comment.
that would be greatly appreciated."
"eventtime","2004-10-21 22:54:00"
"current_moodid","92"
"url","http://ashleemarie22x.livejournal.com/2732.html"
"userid","1050"
"itemid","9"
"event","hey all you babes and studs! i'm at the coolest girl ever's house... MOLLY AKHAVAN! 

tonight we are gonna go tping. yahooooo! 

she made me this cool icon i have. and she redid my colors for me cuz i'm too blonde to figure out how to do it. and we had a good long talk about BOYS! so that is always good.

the game was fun! 28-3! yay! we actually WON. and i had a coffee that i SHARED with jessica mcintyre... she is so lucky lol! i do NOT share so she is one lucky gal! that was the highlight of my day. haha.

oh and as you all know i did NOT go to school today because i am a giant skipper. lol thats ok though i had fun sitting on my ass at home and sleeping :-\ yeah right. lol oh well i slept for like 14 hrs so i'm like wide awake now! sooooo yup!

omg i like this guy so frickin much. arg. i'm so excited though. about something. so YEAH. next subject!

idk what to really say! me and molly have a song! its cool! lol here is part of it:

1 and 2 and 3 and 4 and get them sit ups right and
Tuck your tummy tight and do your crunches like this
Give head, stop breathe, get up, check your weave
Don't drop the blunt and disrespect the weed
Pick up your son and don't disrespect your seed
It's a party tonight and ooh she's so excited
Tell me who's invited: you, your friends and my dick
What's scary to me is Henny makes girls look like Halle Berry to me
So excuse me miss, I forgot your name
Thank you, God bless you, good night I came..
I came...

haha so yeah! thats our awwwwwesome song! ye yeah! lol and ummm now we are just chillin! and we're gonna go tping at 4! soooo yup! sorry if we get ur house! muahahahahaha...

okie dokie then i should probably go. 

i am having many boy troubles right now. i am sure most of you know what that is like. but it sucks so bad. arg. i'm cranky and frustrated. guys are retarded. idk what to do... ARG! ok i'm done

LOVE YOU ALL! xoxoxoxoxoxo --- <3 looooooooooove ashlee! <3 ---

p.s. you know, i am still taking applications for boyfriends. lol."
"eventtime","2004-10-21 02:32:00"
"current_moodid","98"
"url","http://ashleemarie22x.livejournal.com/2338.html"
"userid","1050"
"itemid","8"
"event","alright well i guess i'm not going to school at ALL because my stupid black shirt that i was wearing today for the retarded veterans day program fuckin ripped! ARG! and now i can't find anything else to frickin wear thats clean! and the stupid veterans day thing is starting like RIGHT NOW! sooo screw it. i'm gonna say i am PUKING or something and i'm at home sick. this is retarded. i was excited to sing at that damn thing too. GRRRRRRRR! ok ok i'm gonna go do something so i don't have to sit around all flippin day. i'll see everyone at the damn game tonight! ttyl byes!

:::..LOVE ASHLEE..:::"
"eventtime","2004-10-20 10:24:00"
"current_moodid","8"
"url","http://ashleemarie22x.livejournal.com/2225.html"
"userid","1050"
"itemid","7"
"event","hey! lol well ok its 9:34 and i forgot to wake up for school this morning! :-\ uh oh. i gotta be at that veterans day program in like frickin 40 min! ahhhh ok i better get ready. ta ta!"
"eventtime","2004-10-20 09:34:00"
"current_moodid","49"
"url","http://ashleemarie22x.livejournal.com/1939.html"
"userid","1050"
"itemid","6"
"event","hey! alrighty well today was very...odd. jake and willet left without me this morning (FUCKERS lol) so jakes dad had to give me a ride. i was supposed to have a peer mediation meeting in the morning but idk, she like wasn't there and there was a staff meeting so i didn't go. first hour we went outside and my teacher is psycho. second hour was boring. third hour i sung. lunch was nothing new. fourth hour was very boring. and by that time, the day was over! lol so yeah it was a boring day. but then after school i hung out with nick. and that was just weird but ok. he came over and we were bored for a while and i made him watch degrassi with me lol and then we talked about a buncha stuff for like an hour, just like talked about stuff thats going on. and then we decided we were gonna go do something, so we went to olive garden and ate dinner! we didn't have enough money so then his dad had to bring money up there lol it was kind of embarassing. then we ran across the highway (nicks shoe fell off in the process lol) and then we went to the mall! and we saw michelle and alyssa so that was cool. then we went to hot topic and looked at band shirts and stuff. then we went to the halloween store and beat eachother up with swords. and then we went to spencers and i knocked this thing off the shelf and we laughed for like 10 minutes lol. and THEN we went to the food court (which they are remodeling) to see thanh danh who works at the chinese food place! lol so that was cool. and THEN we went to best buy. and that was fun, we played video games and played piano and looked at movies and cds and junk and played with stereos. and then we sat on the bench outside of best buy for like 20 min then we decided to go home lol. and then nick came over and played with the light switches for like 20 min and then he left. so yeah. that was my ODD day. idk the whole concept of me and nick hanging out was weird. i mean we ate at OLIVE GARDEN, the place we used to go for anniversaries and stuff. idk its so weird. but hes over me, and i'm just his friend. and i think thats hard for me to comprehend. because for some damn reason i keep thinking that hes acting like he likes me. maybe he does it every once in a while cuz hes not used to acting any other way, but idk it just seems to me like he acts like he likes me. maybe its just not right if we hang out anymore. i dont think i'll ever understand the fact that hes over me. i'm not saying i like him. i'm just saying that i don't know how to act around him. idk its so weird. i wish this could all be easier. i mean idk he kept calling me darling and he kept flirting with me and stuff. it just makes everything even worse when he does that kind of stuff. because then that leads me to believe something might happen and then i just get shot down again. he did tell me he was sorry for everything though so that was nice. i think i might hold off on me and nick's ""friendship"" but we'll see. anyways this is getting WAY long so i will go. ttyl! leave me a comment if ya feel like it!!! love you! byes

*<> lOvE aShLeE <>*

p.s. if you've ever heard the song ""6,8,12"" by brian mcknight... it says ""its been 6 months, 8 days, 12 hours since you went away"" and well today was my 6 months, 8 days, 12 hours since nick left. that made things even harder."
"eventtime","2004-10-19 10:34:00"
"current_moodid","47"
"url","http://ashleemarie22x.livejournal.com/1590.html"
"userid","1050"
"itemid","5"
"event","i forgot to study for a.p. test. i'm screwed. UGHHHHHHH! i'm so overwhelmed and frusterated and CONFUSED!!!!!!!!!!! ugh. ok ttyl bye."
"eventtime","2004-10-18 23:39:00"
"current_moodid","47"
"url","http://ashleemarie22x.livejournal.com/1319.html"
"userid","1050"
"itemid","4"
