"names","values"
"event","i am hoping you will give me a treat tonight
i can never tell when you are in the mood for it
i am happily surprised, you're intending on giving me what i crave
i feel the switch within you flip, and you are prepared to be mean

you push yourself into me, hard, rough
and oh, does it hurt
i gasp and pant and whimper
this is going to be painful

you are so excited that your cock is hurting me
that deep from within pain, dulled by the endorphines raging in my bloodstream
i cannot help but be loud, the pain is so exquisite
you are getting angry, i'm going to wake someone...
""do I need to gag you?!?"" you ask, the irritation obvious in your voice
i try to be quiet, but the gasps are louder than i intend
frustrated, you reach below and find a handkerchief
making a gag for your loud lady

you reach down as well and grab your whip
i feel the hard, round handle rubbing against my ass and back
i am hoping you will hurt me with it, and indeed, you do
you are hitting me hard, leaving red marks, i'm sure
the pain is beautiful
please, my lord, more, more...

i can feel you are about to cum, your muscles tense, turn rigid
i can't wait to feel you pulsing inside me
filling me to the brim, leaning against me as your muscles cry for relief
i am panting, thanking you through the gag

my lord amazes me, hurts me, pleases me, keeps me whole
i crave him every minute i am awake
crave his hands touching me
his lips kissing me
his teeth biting me
his fingers, pulling my hair
or clawing my shoulders
his hips, pounding against mine
his cock, tearing me to shreds

i crave him
endlessly, i crave him"
"eventtime","2003-04-14 14:37:00"
"current_moodid","119"
"url","http://blackmorning.livejournal.com/2980.html"
"userid","1767"
"itemid","10"
"event","i am dressed tonight for you, my love
the dress wraps me, holds me, encircles my body as i hope you will later
i see flashes of us, in passion
and i look forward to the nighttime adventures to follow

i am made up for you tonight, my love
i hope i please you
i want to be everything for you

i know that you will be stunning
you will take my breath away with your beauty
you will stare at me with those eyes and i will fall
i will be weak on my knees, trembling before you
everything you say will be my every want to do for you

i will pine and ache and want
and you will be in control, and i will love it all the more
you will deny me, and i will have to try again, try harder
be better next time...

to prove my worth to you"
"eventtime","2003-04-10 16:55:00"
"url","http://blackmorning.livejournal.com/2720.html"
"userid","1767"
"itemid","9"
"event","we are fucking like lions - hard, fast, loud
i am provoking, making him show his dominance
i am making my lord prove himself,
being obstinant and playing dom for a minute to get his retribution
his punishment is always smooth and sweet

'you are mine, and you know it'
his voice alone could make me come again and again
he talks and i can feel the heat and wetness building
just listening to him makes me pant and lose control
i will do whatever it is he asks of me

and with a shock, he grabs my hair and pulls
he is fucking me hard and fast and i am screaming for him
calling his name and telling him i'm his
oh, the sweet reward of punishment

he is ready, and he comes all over me
i lay there in the dark, feeding myself from my reward
and we both slip into the oblivion of sleep

only to have another go 'round in the morn."
"eventtime","2003-03-23 08:57:00"
"current_moodid","17"
"url","http://blackmorning.livejournal.com/2508.html"
"userid","1767"
"itemid","8"
"event","the touch
of my lover's lips against mine
causes fires within my body
my whole self is burning for him

oh to be able to hold the contact a second longer...
for certain, the world will end around us.
for certain, the world will end around us."
"eventtime","2003-03-18 23:31:00"
"current_moodid","39"
"url","http://blackmorning.livejournal.com/2075.html"
"userid","1767"
"itemid","7"
"event","not much to say tonight, but someone stirred a thought in the fetishconfess community.

being written on...
i never thought of it as a turn-on before my lover came along
i'd had lovers previously, tracing words on my back with their fingers, and i remember enjoying the touch

but this last time
my lover
took a pen
and wrote his name across my back
i was his

and he wrote it there for all to see

the pen, the ball point, felt sharp on my skin, and i loved it
and then knowing... that he had written something there, and seeing his reaction to his own writing

it turned me on even more to know he'd written that i was his...
for i am...
...helplessly, hopelessly, happily

his"
"eventtime","2003-03-16 03:32:00"
"current_moodid","107"
"url","http://blackmorning.livejournal.com/1881.html"
"userid","1767"
