"names","values"
"itemid","30"
"event","I am officially done with the public education system. Tomorrow night I walk across stage and then I'm off into the wild blue yonder.

Sorta.

Today was everywhere, one minute everything is hilarious and the next everything just hits you. Sucks.

I slept in this morning, finally rolling out of bed in time to get to school for the Art Potfolio exam. While Melcher was flying around chasing her Applied Arts students I got out an art smock that I had decorated the night before with fabric paint. Everyone signed it and we presented it to her and yeah, she cried.

Yeah. Actually there was a lot of crying today. Everyone's final art composition was really... emotional. All of us really put some serious expression into our projects, whether we realized it at the time or not. It sorta brought out some of the stuff people have been dealing with lately.

And that's probably what got me into this melancholy mood. Thinking about how some of my friends go through so much pain, it really makes me sad. I always wish there is something more I can do, because sitting back and watching is the worst thing in the world for me.

Well, it wasn't a throughly depressing day. After Art Portfolio got out, me and Melissa were intending to head to Webb's for lunch. And halfway there, guess what. Yeah, me carrying my huge purse, yearbook, lots of junk AND a huge oil painting - It starts to POUR on us. We thought we could sprint to Webb's before it got bad. Oh no. We got a block before we were soaked. HAHAHA. So we laughed, took off our shoes and ran up and down the block with our faces towards the sky.

After a while the rain slowed down. We called Melissa's dad to pick us up. At her house we ate lunch and I dried my clothes.

Then it was back to school for everyone. Graduation practice was being held in the stuffy field house. We lined up, practiced plenty of ""square turns"" and standing up and sitting down and so forth. We received our caps and gowns and instructions of when and where and what to do. And all that fun.

And of course they showed the senior slide show. I didnt cry, it was mostly pictures of the same 10 girls in all the pictures. There were a few of me, Erica and Sabrina which I have no idea where they dug up from. But then, out of the blue, they showed this one picture of us kids, back in the day. We were at J. E. Jones Elementary, in fourth grade. It was one of the last days of the year, after they planted the memorial tree. And our little nine and ten-year selves had gather tiny pebbles under the tree to spell out the name: Jenny.

I know it all happened a long time ago, but that one really choked me up.

So yeah. I guess I'm done. I keep forgetting that school is out, I'm finished, I'm free. I just keep feeling like something is holding me back."
"eventtime","2004-06-14 17:15:00"
"current_moodid","39"
"url","http://celerystick2004.livejournal.com/7760.html"
"userid","2624"
"itemid","29"
"event","Closet Classics. 1000 North Ave. Yellow 1950's Vintage Strapless Sun Dress. 

$12

Wow. I am speechless. :-D

Bodice is ribbed and fits *perfectly.* Skirt full from waist to knees. Has NO stains, but the fabric is wrinkled and there are two parts of the hem that are falling out. No biggie, I sent it to the dry cleaners and my dress will be cleaned and repaired for $6. To finish it off I am adding a broad white ribbon around the waist and a flower pin on the top left corner. Excellent.

So today was a good day. I started out the day by being yelled at by Mrs. W, about nothing (wow, big surprise). By third hour, I was watching Pirates of the Caribbean in AP English. Funny, am I the only one in the world who sees the unimaginative and predictable plot and lack of characterization in this movie? Probably.

So lunch. Haha. I love lunches this year, every day is crazy and hilarious. I am really going to miss these times. Going to Adamchkz for sandwiches. Paying in pennies at McDonalds. Sitting on the curb outside of Pick N Save, eating little loaves of bread. And then there's always the parking lot, which I am quite sure there is no equal in strange happenings. Good times.

Man I was getting all nostalgic today. I gave Cassi a ride home and we started talking about the infamous sophomore sleepovers. And when we used to all go to KMart and do crazy stuff because, in Cassi's words ""what else is there to do in Cudahy?"" And plus, what could be more fun than walking around with underwear over your clothes in the middle of a store?

Tehehe.

Okay so this weekend was weird. Me and Debbi went to go see HP3 on Friday. It was a good movie, not like Academy Award Nominee material, but better than the first two.

Saturday pretty much rocked. I got up and went to my summer volunteer orientation. Pretty much everyone from last summer was there so it was cool. I am SO PSYCHED! :-D

So Saturday afternoon I get the final word on the Chicago trip. Me and Debbi's moms talked and I found out that it is certain Debbi can't go. She has a military physical thing, which is very important, right in the middle of the planned Chicago trip. I am really bummed out right now about this. And because half the invited people can't come, I am sorta canceling it for now. Sadness. :(

Well Saturday night I was feeling really weird. Like bummed out by the Chicago thing, and excited for summer, and nostalgic about school ending, and anxious about college. So I did what I have not done in a long time. Threw on my roller blades and bladed out to the cemetery.

I bladed around for 'bout and hour and a half. Just had to clear my mind. I love being in this cemetery, 'cause in the city its the only actual quite you can find. And I forgot how great it is to blade. Can't believe that back in the day I was such a blader freak. Haha.

Man this post is just rambles. Sorry all. I gotta get off to somewhat prepare a speech on how a specific piece of literature influence my life. Adios."
"eventtime","2004-06-07 21:27:00"
"current_moodid","60"
"url","http://celerystick2004.livejournal.com/7591.html"
"userid","2624"
"itemid","28"
"event","<u>my vintageous adventures</u>

yeah. so. Yesterday, my mom was all like ""let's go shopping."" This being an extremely rare thing coming from my mom, i quickly agreed and we went.

I told her that I wanted to look for a vintage dress for my graduation. I looked up some local vintage stores and found that there are several in M'waukee, mostly down on Brady Street. Sounded like a plan.

Woa.

Brady Street is like, so not M'waukee. Its extremely up-to-date, very boutique-tea house-used bookstore-vintagaeous sort of place. I mean, there were awesome little cafes with people outside at small rusty tables drinking lattes and angsty looking college guys sitting on orange crates singing the blues. IN M'WAUKEE?!?

Yes way.

Anyhoo, I explored (sort of in a daze) Dragonfly Vintage. Oh wow. I wanted to buy everything. But could not. Alas.

Oh yeah, funny story. I went to Brady Street originally to go to this shop called Closet Classics. On the internet it said it was on 932 E. Brady. It was no where to be found. I looked it up in the phone book, where a new address, over on Water St., was listed. After driving there we only found an empty building. So we gave up, drove back on North ave towards our house.

And guess what. We got lost on a back road and ran into ... Closet Classics. On 1000 North Ave. I was all like ""Yesss! Finally"" I jumped out of the car, ran to the door just in time for the employee inside to turn the locks and close the door. It was 7:02. Closed. Bummer.

Anyways. Today I continued my thrify-ness. After school I walked to Value Village and met up with Sami, Alely and Adrianna. Haha. Two of them had only been vintaging once before and Alely was a VVV (ask me about that one) So it was very funny.

Lets see. I walked away with a pretty good haul: 1 yellow ""ozone girl scouts camp"" tee, 1 blue ""milwaukee french immersion school"" tee, 1 purple ""PPT-the place to be"" tee, one old black pullover sweater and *giggle* 3 awesome-in-the-extreme button pins (""Educate, don't Alienate;"" ""Gordon Family Tree;"" and ""Homer cares about you!"")

Woa. I almost forgot about this. During 2nd hour Spanish class, me, Savannah and She'maiah (the only seniors in the class) all sat down when suddenly everyone was looking at us. Turns out all the sophomores and juniors in the class organized a surprise graduation fiesta thing-a-ma-bob for us. Weird. I mean it was really nice but I've barely talked to any of the people in that class all year. They all chipped in money to buy us presents, a card and an Dairy Queen Cake. Sweet deal I guess.

Whew. I'm tired. Ack I have four more days of being a senior. Then final exams, but I only have to come for 2 days of those. Wow.

Going to go see HP3 tomorrow. They got a new director, new screen play and new Dumbledore. Hmmm. We'll see.

EDIT: Oh yeah, I got my Art Splash photos back from Walgreens a few weeks ago. I actually got as far as scanning a few of them and uploading them to photobucket. Go take a <a href=""http://img53.photobucket.com/albums/v163/celessa/Photos/"" target=""newwindow"">looksie</a>. Oh yeah, I'll add more later, including the one of Jerry taking his eyebrows together."
"eventtime","2004-06-03 20:57:00"
"current_moodid","90"
"url","http://celerystick2004.livejournal.com/7183.html"
"userid","2624"
"itemid","27"
"event","Woo. I'm beat. I'm sitting here all tired and cold-like with a runny nose. Not fun.

Yeesh. Friday was crazy. I woke up early, still feeling sick but I had to go to school for the award ceremony thing. So I get all fancied up in shoes a size too small, and my hair foofy in the extreme. And them I go to school and sit on stage with bout 30 others for the 2-hour ceremony. I received two awards and was feeling sorta spiffy and i just walked off stage when the choir teacher stopped me. ""You shouldn't have been chewing gum,"" she says. ""It looked really tacky and everyone could see it.""

We-elll. Talk about smashing you flat.

So after a wonderful *that was sarcastic* morning I was in a really bad mood. I had Jenny's party to go to and I was soo beyond tired. To add to that I was somehow losing my voice.

Haha. It actually didn't matter anyway. I had soooo much fun at Jenny's. After I got there, we (me, Jenny, Anna, Brandon and Kyle) all hung out for a while.

And then the Hughes arrived.

Dan, Samuel, Jon and Patrick. Josh and KT. And of course Abby. Haha. When they are all together it is a riot. They are an awesome set of people.

Well pretty soon we decided to take a little trip to the park a block away. Haha. I wore a vintage 60's long satin pink skirt. To the park. With my t-shirt and flipflops. And I climbed over a fence.

Oh man. I climbed halfway up the fence, lost my shoes. Started laughing so hard I almost fell off. Got halfway over and had a hysterical laughing fit because the skirt was snagged and I was stuck. HAHAHA. Well Josh came over and tried to lift me down. Abby was standing behind me laughing her head off and I was just like ""No no no."" Because I'm stubborn and wanted to get down by myself!

Well the rest of the evening was crazy. We actually went and played on the playground. Just like the old days. Haha. Good times.

I stayed over at Jenny's house Friday night and most of Saturday. Saturday morning me Jenny and Anna were bored so we decided to go shopping. LOL. The 99 Cents store. Good deals, man.

Okay. I hafta get off and actually do my Social Studies Project. And my Art History Project. Ugg. 7 more days."
"eventtime","2004-05-30 15:36:00"
"current_moodid","8"
"url","http://celerystick2004.livejournal.com/7031.html"
"userid","2624"
"itemid","26"
"event","So today. Rushed as usually, with the normal amount of craziness and so forth.

And then the hair shin dig.

So I have been wanting to cut my hair, and to donate it to <a href=""http://www.locksoflove.org/"">Locks of Love</a>, since the beginning of the year. And then a few weeks ago Katrina was all like ""so do you wanna cut your hair for Locks of Love?"" Eh. Why not? 

By this afternoon, this thing had grown into a sorta major hair-cutting-donating-etc event. When I arrived at the designated room, about 20 people were standing around. Alothough only four girls were signed up to donate hair, I guess everyone wanted to watch. By the time everyone arrived (10 girls turned out to chop their hair) about 40 students, teachers, parents and total strangers had crowded into the small classroom to watch. I didn't think it was all that interesting to see, but just like everything else, Cudahy makes it into a sporting event. Upon each scissor snip, they broke out into cheers.

Anyway, after sitting in front of all these people and chopping my hair and receiving more cheers (did we make a touchdown or something?) I grabbed my bag and headed out. I told Debbi to pick me up at the corner of Somers and Lake Shore Drive and sure 'nough, she and Scott were waiting there for me.

So we pile in the car and drive across town to this place to get fitted for Johanna's 
wedding. Since the wedding is going to be medieval, we all get these renaissance-looking dresses and stuff. Its pretty crazy but it will be fun. Just ask Debbi what my role is. Haha.

After I get home, eat and go online I realize that I have to do something with my hair. Its really uneven. So I call up a near-by hair salon and look up bus routes. 'Cuz I'm a vehicle-less bum. Hehe. Anyway, after running across Capitol (four-way major road) to catch my bus I made it to Cost Cutters alive.

Hmm. I almost sorta liked my hair right after it was cut. It was really silky and crunky looking, but totally uneven. Now its shorter, poofy and wavy. No me gusta. Hopefully after I wash and dry and straighten it, it will be better.

We'll see."
"eventtime","2004-05-26 21:56:00"
"current_moodid","51"
"url","http://celerystick2004.livejournal.com/6846.html"
"userid","2624"
"itemid","25"
"event","Tired. Today was a blur. I got a lot done. Which is good. Went for a volunteer interview. Good. Got home. Watched TV for two hours. Hmmm.

I need to get moving and stop slacking off.

Weekend went by fast. Friday and Saturday were crazy. And then Sunday. Sundays always sorta catch me by surprise. Things catch up with my mind and I always start thinking too hard about things that hurt.

And then I realize that I'm almost crying in the back of the church on a Sunday.

Gotta stop doing that.

Well I have to get more stuff done. *Stares at wall for fifteen seconds without moving* Yes, ahem. I need. to get. stuff. done. *Still not moving.*

Ahh well.

<i>If there is one person you can't stop thinking about, post this same exact sentence in your journal.</I> And its not who you think."
"eventtime","2004-05-24 21:09:00"
"current_moodid","76"
"url","http://celerystick2004.livejournal.com/6571.html"
"userid","2624"
"itemid","24"
"event","Ack I am sooo tired. I woke up and it was 12:15. In the AFTERNOON. I have not slept in that long in about six years.

So we (we being me, Ryan, Scott and Debbi) all went out to go see Shrek 2 last night. That is an awesome movie. Haha I was just dying laughing. Tehehe. Those movies are major crazy and then they just get so random. (Umm make that tyzo!)

Anyways, we all went back to Debbi's place at like 11:00. Debbi has this weird game where you ask ""either or"" questions. For example, one question was: would you rather: a) drink the liquid out of a full garbage bag or b) chew on a hairy substance found in the couch. Well that was a pretty mild one. Haha. Wow. Things got interesting...

This afternoon after I returned home I went to WalMart with my mom. I bought a nice black and white striped sheer-ish shirt, some earrings, sunglasses and body spray. Yeesh. I just borrowed 20 bucks from her and now I spent another 20 bucks. Ack. I need to stop spending so much. I don't even have a job.

On a happier note, I finally turned in my job application! Yay! I'm (hopefully!) going to be a waitress at Mama's Italian Cuisine on Burleigh St. So if I get the job, and you happen to be on the northwest side of Milwaukee this summer, come and eat there (and leave me a big tip!) :-D

Oh wow. I totally forgot to start writing my graduation announecment letter thingers today. I need to write and send them all out to relatives in the hope that they will send presents in the form of cash. I am already behind on doing this. Ahh, manana.

I don't have much else to talk about. I hit up Value Village the other day (Friday?) and got some sweet pinstripe tailored-looking pants and a very 80's-licious skirt. Now I just need some pink ribbon and some stilettos and I'm good to go.

Later gator(s)."
"eventtime","2004-05-22 22:26:00"
"current_moodid","51"
"url","http://celerystick2004.livejournal.com/6312.html"
"userid","2624"
"itemid","23"
"event","They found a body by the lake in back of Sheriden pond today. Its sorta unnerving. You hear all the creepy tales and urban legends and then something happens. Makes you feel much more aware and yet totally vulnerable.

My day was considerably happier than most, probably resulting from a wonderful discovery first hour that Mrs. W would not be at school today. I practically hugged the sub, I was so happy that Mrs. W *aka el dictator* was not there to criticize me. :-D

Hmmm. After taking a makeup test for Economics sixth hour ( I failed. Miserably :( ), I was in a really bad mood. So I went back to art class. I was just looking for a pencil when I noticed that someone had left a fundraiser bag of candy on my desk. Hmm. So of course I ate most of it. I left a note on the bag that said ""Thanks!"" So we'll see.

Jumping back to the weekend. Well I was sitting by my parents and some of their friends when they start talking about houses. I wasn't really listening until one of the family friends asks me when we were planning on moving. Obviously I realized I had missed something. Turns out my parents have been looking at a house in Cudahy and seem to have forgotten to tell me. Everyone else knew: my best friend, my neighbor, people at my church. Just not me. Figures.

So afterschool I finally got around to scanning some of my sketchbook! YES! I know, I can't believe it either. I went over to the Public library and used their scanner and here is the <a href=""http://img53.photobucket.com/albums/v163/celessa/Sketchbook/"" target=""newwindow"">results</a>.

Renaissance Awards ceremony tomorrow. 17 more days left of school. Wow.

EDIT: I changed the information of the ""body-finding"" business. She was in the lake, not the pond. And she was an old lady who had alzheimers. Sad."
"eventtime","2004-05-19 17:02:00"
"current_moodid","121"
"url","http://celerystick2004.livejournal.com/5893.html"
"userid","2624"
"itemid","22"
"event","I hate Mondays. Blah. Anyways. First hour I managed to get through okay :-D I found out I had to interview Mr. Valedictorian. I was lazy and wrote up an interview sheet instead, so that he could fill it out himself. 

I thought he would take it seriously. I guess not.

On questions such as ""How do you feel being at the top of your graduating class"" he wrote ""I feel like spaghetti."" Okay, I admit, it was funny at first everyone had a laugh, but then... I mean come on. This is the valedictorian. By the time he was done his answers included memoirs of Ms. OB as the most influential teacher (yeah right!), wishing he had walked to class backward everyday, and attributing his success to ""pure dumb luck.""

Whatever.

Lunch was minimal, because I only had 1.35 in change. I bought a can of V8 (yummy!) and a Milky Way, which probably overrode any healthiness from the V8.

Art Class included a (more than usual) crabby Melch, crabby Tasha and in general a lot of crabbiness. Me and Tasha continued our argument over which piece of art was older: The bust of Julius Caesar or the bust of Constantine. I told her Julius Caesar was older. I was right.

Hmm. Just checked my stocks. DFS stocks just went down by twenty five cents per share. Bummer."
"eventtime","2004-05-17 15:47:00"
"current_moodid","114"
"url","http://celerystick2004.livejournal.com/5763.html"
"userid","2624"
"itemid","21"
"event","JULY:
Fun to be with / Secretive / Difficult to fathom and to be understood / Quiet unless excited or tensed / Takes pride in oneself / Has reputation / Easily consoled / Honest  / Concerned about people's feelings / Tactful / Friendly / Approachable / Emotional temperamental and unpredictable / <i>Moody and easily hurt</i> / Witty and sparkly / Not revengeful / <i>Forgiving but never forgets</i> / Dislikes nonsensical and unnecessary things / Guides others physically and mentally / Sensitive and forms impressions carefully / Caring and loving / Treats others equally / Strong sense of sympathy / Wary and sharp / <i>Judges people through observations</i> / Hardworking / No difficulties in studying / Loves to be alone / <i>Always broods about the past and the old friends</i> / Likes to be quiet / Homely person / <i>Waits for friends</i> / Never looks for friends / Not aggressive unless provoked / <i>Prone to having stomach and dieting problems</i> / Loves to be loved. <i>Easily hurt but takes long to recover</i>
<br><br><font size=""-1""><a href=""http://quizilla.com/users/ebonylady/quizzes/What%20does%20your%20birth%20month%20say%20about%20you%3F/"">What does your birth month say about you?</a></font><BR> <font size=""-3"">brought to you by <a href=""http://quizilla.com"">Quizilla</a></font>

Yeah that just about covers it. 'Cept for the studying part. I have horrible studying habits. :) Thanks for sending this to me, Jenny!"
"eventtime","2004-05-15 22:35:00"
"current_moodid","49"
"url","http://celerystick2004.livejournal.com/5405.html"
"userid","2624"
"itemid","20"
"event","I actually stopped and counted the number of *normal* classes I've had during this week. The amount was somewhere around three or four. Weird.

So the shadowing thing didn't work. Waaa. :( But after I got to school, (late) I went to the office to drop off my bag of donations for the troops in Iraq. I found out that the secretaries were having this little drive to collect items to send to Ms. Pyzack (who normally is the school's speech teacher but has been sent off to Iraq) who will distribute them.

Well the little drive was no longer little. Word got out and people brought in TONS of stuff. It was very cool, so I got that little ""journalism scoop"" lightbulb go off in my brain. I ran and grabbed the camera and a notebook so I could jot down a few facts and quotes from the secretary. Regardless of what Ms. W thinks, I do work very hard in that class.

Because I am in a good mood, I am not even going to talk about how *She* sunk to a new low today in her never-ending psycho-ness. :-) See, I am totally getting off this subject now.

So yeah.

I went to a baseball game today! Woooo Brewers! Ahem. Well after getting there, we had to walk like forever just to get to the stadium. Lots of people. And while I was trying to find the right entrance to the stadium, I ran into Kevin! (?) Totally weird! And the strange what-are-you-doing-here sort of running-intos kept continuing. We then ran into this Shane guy who graduated from my school last year and has known my mom for a long time.

Woa. Speaking of weird stuff. I have been getting quite a few mysterious letters lately! Not all from one person either. Yesterday I got this letter from a little girl at the Spanish elementary school. Today I walked into my dad's shop and there was an envelope addressed to me with no return address on the door. Later I got a small hand-written envelope (again with no return address) in my mailbox. The address originally said Oak Creek but was crossed off with a magic marker and in its place Milwaukee was written.

Wow I just totally got off the topic! I am so random today. Anyhoo. Back to the game. After the third inning me and my sister went to go get food. Since it was ""Roll Back the Clock"" day, all the food was like super cheap. This little dude came out of the kitchen with a box full of dollar hotdogs and was like completely attacked by a mob of hungry people. Haha.

Anyway after 45 minutes in line for hot dogs and 3 innings later we came back to our seats. That was when this Shane guy, who I guess now works at Miller Park, came over to say hello. Well that was a long hello. He just kept hanging out there talking to us for the rest of the game. Hmmm. I didnt really know him that well so I didnt talk to him much. Plus I was busy trying to spot one of those cotton candy people.

Funny story. Well with all the crazy-ness and hungry people, there was like no food left. Me and my sister REALLY wanted cotton candy. So we started using some binoculars and scanning the crowd. We spotted a cotton candy dude like across the park and two levels down. We were so there. Hahaha We actually raced over there. After searching around for another 10 minutes we spotted her. This girl had like four candy things left and people were all calling out to buy 'em. So we almost attacked her in our mad attempt to secure our cotton candy. We fought this lady for the last two bags of it (the girl selling the candy looked ready to cry) but we got the Cotton Candy!!!

Hmmm. I meant to do a SHORT post. Did not happen again. I must work on this. Adios all.

P.S. People who read my journal (I know you exist somewhere!) please post a comment or something :-D It will make me happy. Yay!"
"eventtime","2004-05-14 23:16:00"
"current_moodid","59"
"url","http://celerystick2004.livejournal.com/5186.html"
"userid","2624"
"itemid","19"
