"names","values"
"itemid","7"
"event","[poem] [02-03-05]

<b><u>pester</u></b>

please don't ask me questions
which require me to think.
i'm very much afraid of such,
and presently am on the brink

of finding out exactly who
i maybe need to be.
your constant pester party
tends to try and stifle me,

for by asking me your questions,
and by telling me your plans
which will someday sanctify me
from my head's most dismal lands,

all the silent time i've taken
to erase my misery
is bled by your fixation
with the better part of me.

so please don't ask me questions
which require me to think,
for you see i'm much too fragile
to risk falling off the subtle brink

of finding out exactly who
i think i'm s'posed to be;
where at least i know for certain
that you cannot pester me."
"eventtime","2006-10-11 22:31:00"
"current_moodid","24"
"url","http://crippled-lion.livejournal.com/1892.html"
"userid","3293"
"itemid","6"
"event","[poem] [12-22-04]
[original note on fp: <i>I am Joy; Charlie is a fictional character of mine who lives in my head and probably lectures me without my knowing.</i>]

<b><u>Eraser</u></b>

Eraser dust is everywhere,
speckling empty everything,
gone to eye but not to mind,
my mind remembers everything.

Charlie calls me out from hiding,
""Joy has all the evidence,
life is meant for more than dying!""
Can't remember what it meant.

Dust to dust in cloudy poison,
I am more than pencil lead,
lost in tree compressed to paper,
words of wonder fading dead.
(Eraser dust is in my head.)

=-=-=
<i>Skipped a day posting there because I've been inexplicably depressed. Oh, well.</i>"
"eventtime","2006-10-10 09:30:00"
"current_moodid","14"
"url","http://crippled-lion.livejournal.com/1648.html"
"userid","3293"
"itemid","5"
"event","[poem] [02-05-05]
[Charlie Clark is my fictional character and muse of several years. I will try to present a character synopsis soon.]

<b><u>Melissa</u></b>
(or To My Love Across the Hall)
by Charles R. Clark

She sits in silence, for I look and see her
through the peep-holes in her mind.
She speaks a thousand words which fall
to earth and never make it to my ears.

She sits in silence, twirls her thumbs
in nervous segregation, wanting needing being
something that I never was and something
that I think I need or want or seek to be.

She doesn't know how much she gets to me.

Why don't the stars come dance for her?
Fill her bedroom with illumination made
to burn the brightest man, but gently
rock to sleep her sort of perfect angel?

The moon and sun that dance within
her eyes would feel at home and sparkle,
lead to laughter and rejoice in twilight,
take to dancing, lead her limbs about
in perfect splendor, flood my mind
with visions through the peep-holes
in my mind, invite me in and touch my
burning face; she doesn't know I've
dreamed her in this place!! She doesn't know...

She doesn't know how much she gets to me.

She sits in silence, smiles at me from her
hidden place where no one ever seeks to go.
I want to see this place, I want to know.
Her words are lost on simple minds like mine.

I think too much about her, wish and wonder --
as she walks and talks and thinks that she's alive.
But I know better, for I watch her as she
never moves, and never speaks, and never lives...

She never knows how much I get to her."
"eventtime","2006-10-08 01:28:00"
"current_moodid","10"
"url","http://crippled-lion.livejournal.com/1484.html"
"userid","3293"
"itemid","4"
"event","[song lyrics] [07-06-05]
[inspiration: angus montier in the movie home fries, though you are probably best off not knowing that]

<b><u>on nepotism, necromania, and the hovering lobster</u></b>

disjointed,
you give me strings that i may move.
satisfy my cravings,
put me in the mood.
watch me dance disjointedly.
the name that you anointed me
has died too soon.

forgive me, mother,
dissect father.
(count the bullets in his brain.)
i love you, love you once upon a time.
you hold me softly, wasn't i just fine...?
(insane.)

<i>i am unique, i am the chosen one.
please don't speak, i'm not in need of one
word from you, thought you believed in me.
never true, you only needed me.
stick the stinger further down my throat,
and i guess that's all we wrote.</i>

enamored.
confused, don't cut the strings away.
i like the feel of you,
the memories we play.
can't you see how awkwardly
i count the steps you force on me?
(they end too soon.)

forgive me, brother,
unfit mother.
(faulty wires save the pain.)
i knew you, i knew me once upon a time...
i need held softly, make-believe is fine.

(fine one day --
the next day,
let's go insane.)

<i>you're not unique, you're not the chosen one.
listen, please, you're not the only one
speaking codes, no one believes in me.
love them more, nobody needing me.
place the poison deeper in my brain --
is this the way you make me sane?</i>

(count the raisins in my cereal,
all the steps i took to school,
all the times i needed you --
looking through, i'm losing you,
am i the only one you fooled?)

<i>foolish, foolish me -- i live insanity...</i>

<i>i am unique, i am the chosen one.
please don't speak, i'm not in need of one
word from you, thought you believed in me.
never true, you only needed me.
stick the stinger further down my throat,
and i guess that's all we wrote.</i>

last drop of blood, that's all that's written,
i'm forgiven, loved, forgiven,
mercy cries for me, does mercy cry for you?

please remember me, for i have died too soon."
"eventtime","2006-10-07 00:04:00"
"url","http://crippled-lion.livejournal.com/1091.html"
"userid","3293"
"itemid","3"
"event","[song lyrics] [08-30-06]

<b><u>real</u></b>

fade away, now, nobody wants a broken toy
a plaything, no batteries nor puppet strings
bruised and bleeding
lost stuffing, button eyes that never see

<i>were you ever there for me
whoever you are?
i'm degraded, useless, wasted
were you me all along?

it's enough to drive me crazy
if my mind was more than fleece
if my feet were made for walking
maybe I would be, I would be...</i>

so i wake up in pain and insecurity
i cry out through painted lips, nobody hears me
empty mem'ries
no endings, only false realities

<i>were you ever there for me
whoever you are?
i'm degraded, useless, wasted
were you me all along?

it's enough to drive me crazy
if my mind was more than fleece
if my feet were made for walking
maybe I would be, I would be...</i>

real - like the air around me, filling empty lungs
real - like the time spent dreaming i could be someone
real - i'm alone inside a crowd of those alive
real though they may be, they're just as dead as me, inside...
just as make-believe

<i>were you ever there for me
whoever you are?
i'm degraded, useless, wasted
were you me all along?

it's enough to drive me crazy
if my mind was more than fleece
if my feet were made for walking
maybe I would be, I would be...</i>

real...maybe i could be real...
maybe i could be real...
maybe i could be"
"eventtime","2006-10-06 23:36:00"
"url","http://crippled-lion.livejournal.com/795.html"
"userid","3293"
