"names","values"
"itemid","2"
"event","My name is Joy, and I created this journal a long time ago to hold my writings, but I'm just getting around to using it. For the time being most of what I post here will probably be past works. If you'd like to visit my very boring, fannish-rambly, unpretty, uninteresting primary journal (friends only): <lj user=""jinglejangle85"">.

Statistics and useless information: Joy.21.Iowa,USA.poet.lyricist.mainly-rare-fandom-ficcer.

(For future reference: my username/journal title refer to The Crippled Lion, a wonderful song by Michael Nesmith. My icon is Peter Tork. Yes, a Monkees fan.)

Promises to myself:
1) I will post at least once a week.
2) I will actually start back with my various fiction and fanfic projects, and will share them here.

Thanks for reading. &hearts;"
"eventtime","2007-11-30 22:51:00"
"url","http://crippled-lion.livejournal.com/683.html"
"userid","3293"
"itemid","24"
"event","[poem] [12-12-04]
[Written...way before that. An old one.]

<b><u>Building Castles</u></b>

He plays with invisible building blocks,
creating castles in his head,
to keep his stolen jewels within,
and fill his halls with cherubim.
To dance a tune as yet unknown,
and sit upon his fading thrown,
and let his dwindling kingdom know
that they aren't ready, yet, to go.
And when the villagers depart,
the blocks, and he, so weak of heart...
What happens when the castle falls?
The jewels turn sand, the music palls,
and left is man in corner there,
so indiscreetly unaware,
with building blocks in hand and mind;
the ones that only dreams can bind."
"eventtime","2006-12-17 23:14:00"
"url","http://crippled-lion.livejournal.com/6309.html"
"userid","3293"
"itemid","23"
"event","[poem] [12-13-04]
[Probably older than that. It certainly <i>feels</i> older than that.]

<b><u>You Are Unreal</u></b>

My mind was filled with awe today,
I saw the glowing emerald leaves
that shelter you, all heralding,
and softly cover up your dreams.

You are unreal to me, you know,
and every time you look my way
I find it hard to mutter through
the juvenile games you play.

Your peek-a-boo with emerald leaves,
and branches that don't show your charm,
but liken you to devil's own,
and make the masses quite alarmed.

In time I pray of loving you,
without these thoughts of killing you,
and not because I'm needing you,
but just because I'm real to you.

But you, you are unreal to me,
and little more than I can see
is beckoning my wake and call,
I'll let you in, I'll take you all."
"eventtime","2006-12-08 19:09:00"
"url","http://crippled-lion.livejournal.com/5919.html"
"userid","3293"
"itemid","8"
"event","[poem] [12-22-04]

<b><u>most wickedly</u></b> or <b><u>herrulek</u></b>

wicked is as wicked does,
yet wicked is as wicked hopes to be.
you surround me, embrace me, encase me...
inside my head (where you can scarcely breathe
nor think to comfort me).
teeth of too-white fantasy
embrace your smile, tongue-in-cheek,
yet seldom are your wicked thoughts
revealed in holeless riddles.
raven-haired monstrosity
which scarcely mirrors reality
of addle-minded boredom sensuality.
turn you off as quickly as you turn me on,
inside my head or in the halls with lights all on,
it seems to me you're one thing when you want to be.
embrace, encase, surround and show its face to me.
i want to feel it comfort me...
most wickedly.

=-=-=
Once in awhile fictional crushes become poetry. Sad but true. (In other words, don't bother wondering what ""herrulek"" means if you don't already know.)"
"eventtime","2006-12-07 01:23:00"
"url","http://crippled-lion.livejournal.com/2247.html"
"userid","3293"
"itemid","22"
"event","[poem] [12-22-04]

<b><u>numb</u></b>

when everything hurts, nothing hurts.
i am numb.
touch me, and if it stings me,
i am not quite numb enough.
these words are make believe.
my lips and fingers can not move.
i have only thoughts.
my thoughts are numb.
they sipped my head of novocaine.
(skip the needle, skip the pain.)

you feel so nice.
how do you feel?"
"eventtime","2006-11-28 01:55:00"
"url","http://crippled-lion.livejournal.com/5734.html"
"userid","3293"
"itemid","21"
"event","[lyrics] [01-09-05]
[Song written to coincide with an, as of yet, incomplete Archie fic.]

<u><b>Farewell or Fade Forever</b></u>

When we were young,
it never really seemed to matter what would be.
Endlessly, relentlessly, we bathed in sun.
And all those words
which were spoken hard and sharp...
did you know you broke my heart?
I just held on tight and waited for another one.
For another one.

<i>Farewell or fade forever
into your endless night.
I might miss you for awhile, but it's all right.
Is it goodbye or see you later?
How will I know if you survive?
Is this farewell or fade forever?
It's all right.
Oh, it's all right.</i>

The years have gone
way too fast for us to notice anything
that might have been a little tragic or forlorn.
And all those times
you were never on my side,
let's just pretend I never tried.
I just held on tight and waited for another one.
For another one...

And did you cry
when you said that you were leaving all those things
that didn't mean a single bit to you at all?
I bet you lied.
You're not as strong as you believe;
I'm getting harder to deceive.
Drop your lines, you know I just can't take another one.
Not another one.

<i>Farewell or fade forever
into your endless night.
I might miss you for awhile, but it's all right.
Is it goodbye or see you later?
How will I know if you survive?
Is this farewell or fade forever?
It's all right.
Oh, it's all right.</i>

(All right.)
You came to me, needed me, what was I to do with you?
Let you go; let you be; can't imagine life without you.
You made me see myself in such a different light...
and now it's down to this and no, I know it can't be right...
but if I have to let you go, believe me, you'd better know,
we will never be apart. You'll be in my heart.

<i>Farewell or fade forever
into your endless night.
I might miss you for awhile, but it's all right.
Is it goodbye or see you later?
How will I know if you survive?
Is this farewell or fade forever?
It's all right.
Oh, it's all right.</i>"
"eventtime","2006-11-27 21:27:00"
"url","http://crippled-lion.livejournal.com/5427.html"
"userid","3293"
"itemid","20"
"event","[poem] [01-09-05]

<b><u>touch</u></b>

your fingers yearn to touch me,
secrete romance and stick to my
body, climb and jump and crawl
while rain succumbs to healing heat
in this hidden, longing, lonely forest.

i used to watch you silently from
crevices inside your mind, the
places where you didn't want to be.
the places that you seemed to
leave for me.
i'd touch you from the inside,
wanting, needing, pleading
for the outside, but you never
noticed me.
then suddenly -- it seems as though
i've trickled to the floor in front
of you, and all the love i feel for you
is written on my face with glitter
clung to super glue.

this somehow captures you.

for now, your fingers idle here
among my thoughts of you,
they stick and slide and find
a heated wonderland of time
and hope and prayer and
baited breath which dreamt
of only you and now you're here.

the crevices inside your mind
remind you now that i had made
a home within the darkened
corners there -- you're well aware.

with tainted breath and words you
whisper momentary thoughts of
passion, ""you needed me...
you know i needed you.""

and silently i speak to you,
repeat the phrase in glitter
clung to super glue, my love
unending, recognized and
held so true --

but love, to
you, is chopped in little pieces
and dispensed when needed,
find the egg and crack it open,
blissful ignorance and pleasure
in a bit of candy.

i am candy; i am lonely; i will wait
until you understand.
i am honest; need you truly; i will
let you touch my wonderland.

four letters form my word for you,
for me you have but three --
for now, i let it be.

the super glue and glitter wait for me."
"eventtime","2006-11-18 01:02:00"
"url","http://crippled-lion.livejournal.com/5139.html"
"userid","3293"
"itemid","18"
"event","<i>So much for every day! Maybe I could actually stick to every week?</i>

[poem] [12-22-04]

(for Charlie)

<b>Mind Games</b>

Calling me away from someplace I
Have never been, my mind wraps
Around my ugly fingers and
Reminds my heart of fading beauty.
""Let it be."" I stumble. ""Let it go.""
Everything old is new to me...eternally,
So that nothing comforts me.
Riots line my streets and curse me,
Angered proclamations claim me,
""You and you and all of you!
Make you dance, we're strong as you...
Or stronger!"" My mind betrays me,
New and ugly fingers laugh my name.
Does it comfort me this way?
Can the chaos mind games play?
Losing seems more old than new.
A simple string of distant beauty.
Reality calls gingerly, away, away,
Keep away from here, I beg of y--"
"eventtime","2006-11-10 03:23:00"
"url","http://crippled-lion.livejournal.com/4851.html"
"userid","3293"
"itemid","17"
"event","<i>Well...color me silly for such a long break in posting. Or dense. Sillydense.</i>

[poem] [01-23-05]

<b><u>Shallow Boy</u></b>

""It's hard to write a poem,"" says he,
""when I'm so shallow. I want
to speak in riddles of how beautiful
and wonderful you are;
I should tell you soon how much
I love you, top to bottom,
cover it in rhyme and pretty words
which taste like cherries on your tongue.""

You know he means it
when he says - or tries to say -
he loves you.
But he gets tongue-tied easily.
His words express a visionary
sense of density.

""It's hard to write a song,"" says he,
""when I'm so shallow. I want
to sing a melody full-drunk
in sensitivity you've given me;
I should tell you soon that I
can't sing, so you won't cry
when voices crack and crumble,
though they try to cry your name.""

It seems he means it
when he says - or tries to say -
you're different.
A million girls are good for
random pretty body parts
and broken halos which
he sucks like candy in the dark.

""You're an angel. Did I ever tell you
you're an angel? I should probably
tell you you're an angel.""

Is your halo broken yet?
Did you trip and fall on his
ego, on his pride or shallow
sense of love and lust?

You know he means it
when he says he loves you.

But she was pretty;
he was weak;
misplaced the words he meant to speak...
and love is lost on very shallow boys."
"eventtime","2006-10-26 23:17:00"
"url","http://crippled-lion.livejournal.com/4415.html"
"userid","3293"
"itemid","16"
"event","[poem] [4-6-05]

<b><u>on the art of sap</u></b>

I do not write
sappy love poems
for people I will
never really know.

This is not a sappy love poem,
and I will never really know you.

I will never really love you.

You stand in shallow light.
You stand and hold out
bleeding fingertips --
you dim away from sight.

You dim like shallow dreams.

Dreams of you in summer sun,
with whipped cream memories
and unconscious thoughts of me.
I stood in places you would never be --
you sucked my fingers in and
made them bleed.

You wrote me
sappy
love
poems.

You wrote me
sonnets,
each line
a piece of you,
but never
a piece of
me.

And so, these dreams,
these licorice and Mellow Yellow
memories of you,
fade into burning, churning paper
and words which wreak of
egocentric sympathy.

Did you ever really think of me?

Or was I a part of you so readily,
like hands or feet or lovely
blonde hair whipped by summer wind?

Will I believe these foolish stakes again?
My odds were never worth these
fingers, bleeding, numb and traveling
towards a stark reality of sap and ecstasy.

And so I sit and write myself a love poem,
and fill it with sap and drivel, believing
for a moment that I am truly loved --
by whom, I do not know.

If by myself, I don't know what I'll do.
I thought I needed you.

But I will never need
somebody who I never
really
knew.

And I will never need
somebody who resembles
memories
and
shallow
dreams
of you.

Death to the sap...discover what is true."
"eventtime","2006-10-22 20:08:00"
"current_moodid","25"
"url","http://crippled-lion.livejournal.com/4351.html"
"userid","3293"
"itemid","15"
"event","[fanfic - WKRP] [2-13-05]

I feel like posting something other than poetry, today. This is a little shortfic that I wrote a long time ago, the first WKRP-related anything I actually finished. It is a brief piece regarding Herb Tarlek's daughter, Bunny.

<lj-cut text=""I Brake For Bunny"">

<hr color=""black"">

<u><b>I Brake For Bunny</b></u>

Bunny Tarlek was a dainty thing, her hair pulled about in pigtails with glasses nearly too big for her face; her mommy had told her once that the glasses would probably be permanent, but that if her daddy ever got up the money for her braces and her glasses chanced to break, she might just have to squint for awhile. As for Bunny, she didn't mind the glasses, and she wouldn't mind the braces...she was a cheerful child in many ways, and seldom let the world - or her correctional machinery - bother her.

The start of school had almost ruined this for her, as she came into constant teasing. Emmy and Roger were the worst. Roger was a general name-caller: four-eyes, donkey-lips, that sort of thing. As for Emmy, a year older than Bunny and a might bit bigger, she had declared one day that her father worked for Cincinnati's number-one radio station, WPIG, and that her father said that Bunny's father was an imbecile, and that he'd killed all kinds of turkeys and ducks and was apt to kill again.

Bunny had fought the accusations, knowing that they were true. Mommy, of course, hardly ever let Daddy down about those ""poor defenseless ducks,"" and as for the turkeys, all the local and a few national television stations had covered the atrocity - her daddy took up channel-changing at a rapid pace. Upon her questioning this he explained to her, ""If I want to look like an idiot in my own house I can do a good enough job of it myself.""

But still, she fought. After a week of school she came home and declared proudly to Mommy, ""I hit a PIG today!"" and her mother, confused a moment, murmured something about ducks, before realizing just what was going on, and she yelled, ""Herb, get in here! Your daughter is beating up your competitors!""

Bunny had received the standard talk about backing away from a bully, which her daddy seemed to mumble through in a confused sort of manner upon urging from mommy, and he finished as thus: ""And you just...you shouldn't hit people, Bunny, because they might hit you back or discredit your reputation. Do you understand?""

""Yes, Daddy."" She kissed him, and ran outside to play, leaving her parents to remain motionless and pondersome for some time. Finally they spoke to one another:

""Herb, for heaven's sake, is that the way you give a speech?""

""Well, I...what was I supposed to say? My son already plays with dolls, and now my daughter is beating up kids at school!""

""That's entirely beside the point."" She sat on the sofa beside her husband, adjusting his hair out of instinct. ""Bunny is very sensitive, Herb.""

""I know that.""

""I worry sometimes about what you say to the children when I'm gone!"" She sighed heavily, forgetting his hair. ""I mean, if this is how you handle bullies, then what on earth did you say to her about the frog?""

Bunny entered the living room to a silent Mommy and Daddy. She had only been outside for a moment, but already she was covered in a musty, dirty shell. She smiled. ""Herb the Third and me was playing. I won!"" And she ran off.

For a moment all was still; and then Herb Tarlek stood slowly, his wife Lucille following his lead. And he said: ""I'll...tend to Little Herb.""

""And I'll explain to Bunny that you don't know anything about handling bullies.""

Herb flinched at this, but within the moment, both parents were running, yelling their children's names, in a ritualistic fashion brought on by daily catastrophes. Bunny was found playing with Greenpeace II in her room, happy as a clam, and as for Herb the Third, he had been laying silently, carelessly in the dirt in the backyard until his father picked him up, handed him a doll which had landed several feet away, and brought him in for dinner.

As punishment, Bunny was not allowed dessert; she only ate that which Herb the Third couldn't finish, and Herb the Third hadn't been very hungry that night.

At least she'd learned her lesson.

-------------------------------------------

References:
(Turkeys Away) Herb helped Arthur Carlson throw live turkeys out of a helicopter one Thanksgiving as a promotional stunt.
(Real Families) In this episode we learn that Herb once ran a promotion in which he placed live ducks in a store window and made them dance with a hot plate. Also, we discover that Herb the Third is fond of dolls.
(Frog Story) Herb accidentally killed Bunny's pet frog, Greenpeace, by spray painting him pink. She has a new frog by the end of the episode.

<hr color=""black"">

I had considered a ""bring your kid to work day"" or some such scenario, because I find the idea of Bunny Tarlek interacting with the staff a bit delicious, but I wonder if this is just <i>too</i> obscure for anybody to care about. Still, because I am so unreasonably fond of Herb, his children seem to have slipped vaguely into the heart of the piece I am writing, so I'm satisfied.

</lj-cut>"
"eventtime","2006-10-20 03:28:00"
"url","http://crippled-lion.livejournal.com/3977.html"
"userid","3293"
"itemid","14"
"event","[poem] [05-23-05]

<b><u>Valentine</u></b>

Hero-worship is reserved for
teenaged pin-up idols with their
dimples, prefect hair and muscled flesh.
You missed the age of
s h a l l o w i d o l a t i o n.
I love you not in breathless adoration.
Celebrity ... ""who on who"" and hissing
gossip slip beneath thoughts of
a good woman and children with their
sippy-cups and semi-famous father.
And thus you soon explode in cryptic laughter.
Subtle manchild brain cells take to dancing.
And you, encased in love past pin-up idol falsehoods,
Do not need my simple, raving valentine.
It's enough for me to watch you smile --
and know you'll never know."
"eventtime","2006-10-19 00:00:00"
"url","http://crippled-lion.livejournal.com/3617.html"
"userid","3293"
"itemid","13"
"event","[poem] [07-15-05]
[here was my original note: <i>This is what happens when I sit down to write something entirely random, see what develops, and then don't go back to edit it. This appears to have something to do with one of my favorite shows, Three's Company. Sort of. I'm in love with Larry Dallas. Hee.</i> // I believe I was also half asleep at the time I wrote this.]

<b><u>TV is Company</u></b>

Television shows echo memories of friends I've never had.
Jack and Janet used to say to me, ""We're all you have.""

(She's crazy, very much so, have you heard so, you've been told so.)

Movies always end too soon, the hero wins and pretty villains die.
But always with a twinkle in their eye. (They've killed a few.)
And something tells me tv, if it never ends, shall try to marry you.

(For I'm a bachelorette, and tv is as far as marriage gets.)

Behold! Undaunted by the light! Sleep here with me tonight!
Oh Larry with the bitter tongue and perfect curls,
With chest hair fine and lemons which impress the girls,
""It's real Corinthian leather."" (And vegans beg but needn't choose.)

Where movies have an ending, go on living someplace boring,
Television ends with nothing, leaves one hanging, lest we choose to never
See the elder versions of the characters who sleep with us at night.
But then again that's something of a fallacy, the sleeping isn't right.

I mean to say that sometimes I forget to feel perplexed by Somers'
Money issues; Chrissy, oh my dear, you precious thing, you died too soon.
Imagination cannot bring you back and that's too bad, because the tv set
Forgives and lets me guess at lovely things that you might do.

Jack Tripper died; thereafter, John, and thus I cried.

Imagination traps reality, or vice versa,
and I ramble hidden words which never mean a thing.

The light and empty bed are comforting."
"eventtime","2006-10-18 16:23:00"
"current_moodid","25"
"url","http://crippled-lion.livejournal.com/3460.html"
"userid","3293"
"itemid","12"
"event","-----
<i>note: So, FictionPress has been under renovations, thus no copy-and-paste, thus I've been too lazy to post over the last few days. Just wanting to note that I haven't abandoned this journal already, or anything of the like. So here's a couple of small somethings for now, as I'm too fed up to go over anything else.</i>
-----

[poem] [12-13-04]

<b><u>boscartoon</u></b>

your eyes bug
like a demon
high on bosco
and too many
saturday morning cartoons

five a.m. does not exist on weekdays

=-=-=

[poem] [12-13-04]

<b><u>yeah, him</u></b>

sweet and sour cherry flavored
sucker sticks to girls like
flies to melted chocolate
summer sunshine happy trail mix"
"eventtime","2006-10-17 20:38:00"
"url","http://crippled-lion.livejournal.com/3190.html"
"userid","3293"
"itemid","10"
"event","[song lyrics] [08-01-06]
[And now it will be stuck in my head again, as it often is. I am considering recording some of my songs, with no music, and sticking them someplace password protected for the few people who may be interested in the melodies.]

<b><u>Pretty Good Odds (Snowball's Chance in Hell)</u></b>

Tryin' to remember what I forgot yesterday
But I can't think clear when heaven's this near
Tryin' to discover all the secrets you keep covered
But it's way too late, can't concentrate

Never had a snowball's chance in hell (no!)
Never really came across so well (no!)
Mm, you make me shiver, watch your body quiver
Turn me down again, turn around and then

<i>It's true, I needed you to help me see myself
I know you've gotta go real soon
And still I hope you will reconsider us together
We two have a snowball's chance in hell
But those are pretty good odds for me</i>

Never met a failure that I couldn't compensate
So just mark this down as another lost round
Settin' me on fire, day old booze and cheap desire
If you'd just give in, I could finally win

Tell me how in hell to make you mine
Baby you and me would work out fine
Mm, you m-m-make me shudder, I don't want no other
Lover on my arm, honey what's the harm?

<i>It's true, I needed you to help me see myself
I know you've gotta go real soon
And still I hope you will reconsider us together
We two have a snowball's chance in hell
But those are pretty good odds for me</i>

You, with your patent smile
Teasing me all the while
Dreams of fingers in your hair
Midnight madness takes me there
Nobody can discourage me
I'm gonna getcha anyway
Might as well just play along

<i>It's true, I need you to help me see myself
I know you've gotta go real soon
And still I hope you will reconsider us together
We two have a snowball's chance in hell
But those are pretty good odds for me</i>"
"eventtime","2006-10-13 00:00:00"
"url","http://crippled-lion.livejournal.com/2573.html"
"userid","3293"
"itemid","9"
"event","[song lyrics] [01-19-05]
[Inspired by The Great Gatsby, with a good number of direct references.]

<b><u>Gatsby</u></b>

You know, Jay, it's been such a long time.
Was I your Daisy in some long forgotten dream?
Well I've been walking through my mind,
it's getting very hard to find what used to be.

Was I just your beautiful little fool?
Was there some make-believe you needed me to play?
Well all these lines are getting crossed,
I've come to find I've probably lost what used to be.

And if you spoke to me, I couldn't hear you.
Too busy loving you to ever risk getting near you.

<i>I've been everywhere, seen everything, done everything -- but you were never there.
Whisper in my ears and tell me that you always thought of me.
Can't you see, I'm too beautiful to care,
I just make believe you're always gonna be my great Gatsby.</i>

Did you grasp that dream that you held in me?
Well you never saw the light fading away.
Tried all those short-cuts in your mind,
finding nothing new and plenty old to say.

You know it makes me cry just to look at you.
We've lost the freshest, lost the best we ever had --
it seems our memories are clear
but I can't spend forever here, it's just too sad.

And if you looked at me, I couldn't see you.
Too busy loving you to really...know you at all...

<i>I've been everywhere, seen everything, done everything -- but you were never there.
Whisper in my ears and tell me that you always thought of me.
Can't you see, I'm too beautiful to care,
I just make believe you're always gonna be my great Gatsby.</i>

It seems that everything...must end in suffering...
I know you cared for me, and I for you.
But tragic sympathy...cannot keep you and me
together anymore...
It takes two to make an accident happen,
better get away fast, 'fore we realize it's you and I.

<i>I've been everywhere, seen everything, done everything -- but you were never there.
Whisper in my ears and tell me that you always thought of me.
Can't you see, I'm too beautiful to care,
I just make believe you're always gonna be my great Gatsby.</i>

My great Gatsby.
(How could you be...) my great Gatsby.
(Can't you see...) I just make believe...
(How could you be...) my great Gatsby.
(Can't you see...) I just make believe...

That you will always be...that you will always be...
You will always be...my great Gatsby."
"eventtime","2006-10-12 16:08:00"
"url","http://crippled-lion.livejournal.com/2425.html"
"userid","3293"
