"names","values"
"event","pretty run of the mill day today, but I make something out of each one of them. we only have so many during the summer to use.

Today I woke up at the early hour of 11:30 am, latest in months. I love sleeping in because I never get to do it. ever. ""It's always something"" as my father says. I walked to caddying and on my way there Mike picked me up and dropped me off at icc. Thanks Mike, that helped out a lot. I'll repay that favor to you in several ways.

I didn't get out today, again, which was not entirely bad because I would have had to deal with the rain. I did however get to hear about Derek and Rob's drinking escapades, for like already the 10th time this year. Today I learned all the local spots to pick up liquor so if any of you need to get hookups, I have them all. I especially liked the description of a place called JR - a place ""so ghetto that when you go to buy a 6 pack they take a twelve pack, cut it in half, and tape up the ripped end"". 

I watched Harry Potter today - that's one fine video but like Lord of the Rings I would like it more if had read the books. However, that doesn't really bother me, because I can only have so many obsessions and reading fantasy books isn't on that list right now, although if I had infinite time there's not a doubt I would play ALL the final fantasies and read ALL the books and all that because I like that entire culture a lot.

The band concert was good, albeit being out of tune and lacking rhythmic synchrony at times. I had I think 4 solos and they were really exposed. People told me I did a pretty good job so I felt satisfied.

I also received a letter from the fire department today commending my good job putting out the blaze in the basement. (sounds like a title of a bad horror book, ""the blaze in the basement""). I'm going to bed early tonight because I'm going to get up around 6:30 tomorrow so I can get some exercise in and go to a garage sale before I caddy.

I've been thinking about this for a while...my next post will be called ""The Absurdity of Atheism"" in which I will argue that it's not possible to lead one's life on ""pure reason"" or ""believing in nothing"" or ""trusting nobody"" or any of that. Please read it, I'm not going to go on a big ""PRAISE GOD!!!"" or fundamentalist rant. Y'all might be surprised at what I have to say.

""albright"" - Lani (allison I miss you!!)"
"eventtime","2002-06-13 23:09:00"
"url","http://eldavido.livejournal.com/4534.html"
"userid","4466"
"itemid","16"
"event","Today was another day which sets the standard for good days, sort of like the barbecue. It's not that it was like the best day of my life, but I just wish that when I want to hang out with friends they would all just get along and have a good time like Teresa and I did today.

Last night I watched Hannibal. In a nutshell, holy crap - it's not often that you get to witness a person scalp another alive and make the scalpee eat their own brain tissue. wow. I had had the idea of taking a little trip downtown for a while and actually I had seen Melly at the video store. She told me that Teresa was probably the only one free for today. I had an orthodontist appointment so I took the day off from caddying - first day off this year! yeah for going every day!

Today I took the train with Teresa to Chi-town for some Children's Museum action. Although it might not seem that such a trip would be interesting or have any sort of point, we had a great time. It all started with our talk on the train, followed by my romp through the fountain at Navy Pier - I felt a bit daring so I decided to run through the fountain while it wasn't going and see if I could make it through without getting blasted. I handed my keys, visor and wallet to Teresa and just up and did it. Great stuff.

Next we walked into the pier. I jumped over a black railing that gave Teresa a considerable bit of trouble. I have been saying over the past few days ""It's really funny to see small things have to work really hard to achieve the same effect as big things working only moderately."" Several prominent examples include the Toyota, what a little car - has to rev up to like 7000 rpm just to do what a v8 can comfortably do at like 3500 rpm. Also, Teresa pulling hemp string and her trying to jump the fence in the middle of the road are pretty good examples.

We went into the place and did pretty much everything. She pretty much hit the bases in her post.

First we looked at kids' dreams in life. That was really fun. Some of them were really lofty, others, really strange such as the one she mentions about ""I want to be a girl because I am a boy"" (she felt pretty sorry for that kid) and some just downright nice. I especially remember the one about the kid that said ""I want to be the best engineer. To start, I need to learn how to measure and to add and do other math."" (good old physics)

Next came the tinkertoys ""wake up the bear"" thing. We had to invent a machine to wave up a bear when the alarm went off. Wouldn't you know, I tried to construct a camshaft out of Tinkertoy parts. I was less than successful but had a good time doing it. In that same area, you could take Velcro parts and put them together any way you want to try to make a flying machine. The idea was to get the machine to stay in the air as long as possible when dropped from like 100 feet in the air. They had a little timer. We had a real problem making one of these things because ours was too wide.

After that, I think we went to the archaeological dig place. In this place, they had a stack of about 20 boxes out on the floor and you had to fit them all into a truck. I laughed a lot because every kid that tried to do it forgot this one box labeled ""Kitchen Supplies"", the biggest one of all. They would all think they had gotten it and yell ""darn!"" when they realized they had forgotten. I went over, helped load the boxes, and smacked my head <b>good</b> on the top of the truck, all to Teresa's amusement. Also, while we were there, the two of us just sat for a while watching the kids. One of them got scared of my glance and ran to hide behind a lady sitting on the edge of the dig pit. I kept looking that way and saw the poor kid glance around his ""shield"" and put his head back away when he saw I was still looking in his general direction.

Next we went to the anti-discrimination place, and then just sat on some benches for a while. I specifically remember this slide you slide down that makes a bunch of musical notes sound when you go down it. We both went down it and loved it. Also, I remember a chair that had three guitar strings on it that Teresa tried to play a song on, but couldn't manage it.

We then went to the water place. From making dams to locks to floaring boats, and playing with the water wheel and the fountains, it was a really good time. I think Teresa is interested in PVC creations now so I think I have a birthday gift idea for her but I'm not so sure when I will need that valuable piece of information.

Right before we checked out I stood under this little bridge like a troll and shook it when the kids came across. I'm sure they had no idea what to think but I had fun nonetheless.

I brought a bag full of dinner mints and Teresa kept taking them from me. Sometimes she would ask me politely, other times just demand them...but she ate them all by the end of the train ride. I picked up some Green Tea and the two of us found our way home. No, I did not take a weird route to the train.

I took her home and we had to break in, great fun that was. She said she would buy me Jones soda for taking her today. Good trade I think.

Next I went to Melanie's violin recital. Even though I fell asleep during the first half of the program (DOH) I managed to stay awake for the second half and see Melanie, Stephanie, Amenta, Irene Chiang, and some other very good players. After that Jenny, Heather, Melanie, Grandma, Mom and Dad went to some restaurant in Orland and ate quality food. I need to get more sleep at night so I can stay awake for concerts.

I came home, watched the end of Star Wars Episode 1 with my brother, and am now going to bed."
"eventtime","2002-06-13 01:31:00"
"current_moodid","44"
"url","http://eldavido.livejournal.com/4237.html"
"userid","4466"
"itemid","15"
"event","As another page turns I realize that I am getting really tired of my routine. However, I think that being bored is like the worst condition a person can ever affect onto themselves (and yes I agree with the idea that people bore themselves) so I try to find some things to do. Here's another few days in the life of a quasi-geeky kid:

The Michigan trip was really nice. I got back with Jeff and just sat around for like a few hours. I really needed sleep. After that, went to Mike's to watch bootlegged Lord of the Rings, which I hadn't seen yet. I think if I get the time I'm gonna read those books because they seem pretty good but I can't find the time just yet.

I got pissed off because the solar eclipse which I mentioned in a previous post was blocked by the clouds. I went to go get tacos for my family and what do you know, you'd think the heavens were opening up again. I walked (ran actually) from the car which I had parked particularly close to taco bell on halstead and I was totally soaked in the time it takes to get from the car to the place, that sucked a bit.

Tony at icc called me and told me to be in at around 12 so I went to caddy today about about 12. On my way there (35 minute walk but I love it) I happened to run into Engel on his bike who told me his car broke, probably as a result of a slipped timing belt. Timing belts are the thing that link the main drivetrain of the car to the valve lifters, which control when the fuel goes into the cylinders and the exhaust goes out. They only cost a few dollars but if it breaks the car just stops dead because the valves won't open and shut.

I also got speaker carpet today at Music in Motion before I caddied to carpet the unmade subwoofer on my porch. I got a big honkin piece of carpet, now I have to figure out a way to put it on.

I walked into idlewild with a jones root beer in my hand, which btw I don't like so much, I prefer the cherry and others which Mike says he specifically does not like. They all asked me if I had a beer in my hands. I could tell about a mile from the club walking that that would happen. I told them yes and they all were like ""let me get some"". great kids.

The morally upstanding activity of the day was pitching quarters for $1 to a line created by a shadow. Some kids all stood about 25 feet away from the line and whoever threw the quarter closer to the line won. It's really funny to me how particular people get when money is involved. More than once, we had to walk off and measure distances to the line when the pitches were close. It's so funny to see the ""regular folk"" try to make argments about standards and references of measurement. They never really get anywhere arguing, just go around in circles.

Which reminds me, there is an article in Newsweek about Urban Debate Leagues and how they help academic achievement. The article specifically mentions a case called DUBs which I had the pleasure of debating this year and won to. Good times.

Later I went to my brother's soccer game at Woodborough park. I was an official timekeeper because I was the only one there that had a suitable watch. I love soccer, especially not-so-competitive park district soccer. Just a bunch of kids coming out to have some fun together doing something that they all more or less like. I also had the pleasure of overhearing some real stereotypical soccer mom conversations that made me think of Allison's constant slams to soccer moms. I laughed on the inside.

I went to community band tonight with my brother. I played myself once with these really exposed solos that I messed up. I'm talking a group of 100 and zero other people are playing, that takes some gusto to execute. I feel happy that none of them were particularly hard.

Matt and the rest are all still in Michigan. I sort of wish I was there but tomorrow is setting up to be a good day so maybe not.

Remember that book? Goodnight world? That's what I'm saying right now. Goodnight starts, goodnight moon, goodnight world.

ps I need a new picture. Any ideas?"
"eventtime","2002-06-12 01:50:00"
"current_moodid","30"
"url","http://eldavido.livejournal.com/3990.html"
"userid","4466"
"itemid","14"
"event","HEY HEY everyone...sorry to forget to post this before...but there is another really cool astronomical event happening tonight: a partial solar eclipse! not a simple lunar eclipse, but a solar eclipse, meaning the moon blocks the sun. another one won't be happening for the US until 2005 so get outside and have a look!

details: begins at 19:28:12 central daylight time (00:28:12 gmt) - sun's altitude 9 degrees
maximim area eclipsed at 20:09:54 (01:09:54 gmt) - altitude 2 degrees (go somewhere without trees or get on top of something)
ends at 20:21:35 when the sun reaches 0 degrees altitude

all of this is from <A HREF=""http://sunearth.gsfc.nasa.gov/eclipse/ASE2002/ASE2002city1/ASE2002city1.html"">NASA</a> so if you are in michigan reading this or elsewhere, look up times for your city.

hope you all enjoy this. don't look straight at the sun, use a projection system of some sort to do this, or project the image onto a screen using binoculars/telescope"
"eventtime","2002-06-10 16:53:00"
"url","http://eldavido.livejournal.com/3658.html"
"userid","4466"
"itemid","13"
"event","These last few days have been nice. 

First of all, I can relate to Allison a lot with my whole fire story. I think the most important lesson that you can learn from these sort of freak accidental occurrences is that stuff happens, and there might be something that you don't expect at all, 0% expectation, and it just comes out of nowhere. Take that as you will.

I caddied on Sunday and then visited Dan for a while. I drove by and saw a big canopy in his driveway and learned that his sister Kel (another one of the people that is my brother's age and went to Hart) was having a graduation party. Another part of my recent life that I can remember.

I felt ""as tired as nobody's business"" (Matt Kahle-ism there) so I decided to just sit in Dan's basement...we watched the rescuers down under. What a cool Disney movie. I think that Disney videos seem really stupid at first, but when you get older, you understand more of the little innuendos present and other small intricacies you didn't get earlier. Also, his basement was air-conditioned, which is key.

Dan told me that he was going to Michigan for a week or so with Kahle, and invited me to go. So I went to visit Rende for a while, because I hadn't seen her in like 4 days and she's right in the hood. We had a good time. Some of the more memorable parts of my stay over there include making the necklaces, looking at some of her earlier pictures, and talking to Nat and her husband. How funny. For a while it was sort of guys pick on girls then girls pick on guys, then we all made fun of Teresa and then everyone picked on me for a while. Just remember, it's all out of love. However, I specifically remember when Nat said to me, 

N: You better pick your words carefully, she's a speech student.
T: He is too.
D: Yeah I am, I debate.
N: Oh god, you would love dad.
D: Why's that?
Nat's husband: because you and him both go BLAH BLAH BLAH...BLAH BLAH BLAH...BLAH BLAH BLAH (he continues about a minute)

Later, Nat learns that I was in band because I asked about a picture given to Teresa by Nicki...I was like ""Hey, that's the Xi'An Garden Hotel, why do you have that"". Nat says ""Wait, you're in band too? A speech student that's in band? What is this - you're a nerd? You're a geek - but you can't be, you look too good to be a geek""

That amused me, she said I was too good looking to be a geek. I'm still smiling on the inside.

So later I went to Michigan with Matt's mom and Amanda Kahle, we talked all the way there. I finally got there and then spent the night up in the loft that Melanie and I spent that long time together in, and that I slept in previously. We stargazed on the pontoon, and waveran/jetski'd in the morning, and I left with Jeff at 1pm. Perfect trip: go, sleep, have some fun, lay around outside, and get rid of my awful farmer's tan.

So now I'm home again and I need to finish that subwoofer box on my porch. Anybody know where Brian is? Tell him to call me if you see him. Perhaps I will come out tonight, but I'm fairly blown so probably not.

next time: ""science and reason as absolutes?"""
"eventtime","2002-06-10 16:08:00"
"current_moodid","31"
"url","http://eldavido.livejournal.com/3573.html"
"userid","4466"
"itemid","11"
"event","As much as I'm a fan of bikerides, in some cases walking places is definitely the more fulfilling art. It's much slower, and allows you to observe things you would never see otherwise.

Once when asked, ""What did you do for three hours?"" when he was with his girlfriend-at-the-time Marissa Riormayer, Dan responded ""We made muffins"". As Melissa puts it, ""classic"". However, it would seem that another contender has entered the ring for most classic excuse. After I got done at Idlewild, I decided to make a stop at a <i>very</i> in-the-way place, and I was disappointed to find that the person who I was looking for was busy getting chocolate chips from her significant other. Although I was directed to go down there to see her, I thought better of it - and let me tell you, I walked up the road and didn't see anyone pass by for at least ten minutes. However, I don't blame her, because it's not every day that a girl gets to get chocolate chips from her man.

(Sorry, I had to, I laughed all the way home because of that. ""Getting chocolate chips""...)

Later, I walked down Willow Road and saw a bare lot where Living Springs Church had sat for my entire life. It was so strange, I came around the corner expecting to see something in this spot but I just saw the clear blue sky - and an enormous pile of rubble that made me realize how much stuff it actually takes to make a building. Wow.

On that same trip, (this is best if you picture it I think) I was walking and this huge dog comes up and starts to bark at me. I of course looked on, mostly curious at first. However, the thing seemed really mean and as I walked by, it followed me along the fence. The key element here is that the owners' yard is split in half by the garage. So basicaly, the yard is a big rectangle with a garage that is placed exactly in the middle on the long side, which divided the yard into two more or less square regions on each side of the garage. Well, I walked past the garage, and apparently the dog had learned that when people start to go past the garage, he can meet them if he tears around the back of the garage as fast as possible. The dog ran around as fast as it could, but I decided to play a little trick on the dog by hiding between the two cars parked in front of the garage. When the dog ran to greet me, I think the thing belt bewildered as hell because I had basically just up ad disappeared. Then it went nuts. It started running all over the place and barking and then whimpering until the owners got so mad they came out of the house and put it in its cage back inside. I felt sort of good that my little trick got my antagonist in trouble.

On my way home, I saw Brad Clifford (old college guy I used to be friends with), Henry the Asian, and a few other people that I know. I also saw my mom barelling down 183rd Street. The light had changed to red and I tried to run out into the lane and jump into the car, but she didn't see me and I was standing in the middle of 183rd Street with oncoming traffic everywhere. Disaster.

The last really eventful thing was when I took my brother Brian to ""FV"" (family video, he kept saying, ""Dave, when are you gonna take us to FV?!?!"" and punching me). We were standing in line ready to pay for our movies, Mothman Prophecies and K-Pax, and this lady at the counter went totally ape on me. She was about 2 feet away from me, so I set my videos on the counter and she's like ""ITS CALLED PERSONAL SPACE. GET BACK FROM ME. NOW"" Umm, ok...but it's sort of hard not to egg people on that just snap on you for no reason whatsoever, so I said, ""Ok, all you have to do is just ask politely and I would be happy to step back."" She then grumbles to the 25ish cashier, ""Kids these days, they need to learn RESPECT"" and then rolls out. I talked to the cashier about (sidenote: she was pretty hot) the lady, and she told me that the lady was being a PIA to her as well. She laughed it off and gave me a certain video that my bro's report card A's weren't supposed to be able to get for free...I love working the system.

Well that's another day in the life of David, hope you had fun reading it."
"eventtime","2002-06-07 20:23:00"
"current_moodid","44"
"url","http://eldavido.livejournal.com/3026.html"
"userid","4466"
"itemid","10"
