"names","values"
"event","Another day that just feels complete.

I am stupid for waking up exactly 33 minutes before I had to be at school for a debate meeting, and also blew my chance to get a phone, oops. Anyway, I saw my man jb (debate coach with the jetta, coolest person ever), Arrivo, Lars, and Dylan for the first time in a goodly while.

After that went to caddy, sat around for a while but made an ""ace"" with Najman, Stravoupolis, and two other guys. Now interestingly enough Stravoupolis quit the club two years ago and I was one of his last caddies before he quit and we talked about the last time he golfed. He is this huge Greek dude with slicked hair and also a major gambler. Those guys are a lot of fun to caddy for but you really have to work hard.

Hence, the reason I didn't come out tonight: I was entirely not awake enough after two nights of staying up way too late. Michigan took it out of me, in fact, I was really sore in my upper body from my ""thrashing"" behind the boat, and plus my tiredness from two nights. Night one: the pontoon boat, night two: talking to Melanie on AIM until 3:09am last night about the ways of the Chinese for her upcoming trip.

eVeRMeLoDi0Us: little david on my right shoulder says
eVeRMeLoDi0Us: ""melanie should think carefully before she goes off rattling""

How can you not love her to death?

I dropped cash money today, $521.30 to be exact, for tickets. They fall slightly short of Weezer-quality but close - section 103 (middle front in pavilion at tweeter) row DD. I purchased 8 of them and am selling them for $65/ticket. The concert is Area 2 featuring Moby, Blue Man Group, Busta Rhymes, DJ Tiesto, DJ Dan, and many others. On 8 April 2002 3pm - I'm not sure how you all like Moby but Jenny Anderson and Heather and them love all of those artists so they will come for sure. Also Dana said maybe and I think Dan will want to go. Let me know if you're interested. I love the techno and instrumental scene for all of you that don't know and this concert is going to rule. They even threw in Busta, sweeeet.

I think that's all for today, tomorrow is going to be a long one with senior pictures, caddying, and several not-worth-mentioning things. By the way, I still miss Teresa, Scott, TJ, Adam, Justin, Mike, Jeneane, and everyone, so I'll probably see you all tomorrow if that's possible. Goodnight kids."
"eventtime","2002-07-16 23:33:00"
"url","http://eldavido.livejournal.com/9565.html"
"userid","4466"
"itemid","36"
"event","The last time I saw anyone out of the people likely to read this was when I saw Mike in the Miata on Saturday. 6:30 AM caddy, done early. Anyway, I tried to make friendly conversation, and asked him something to the tune of what's up. He responded with ""I can't really tell you"".

So the dilemma: do I take the red pill, or the blue pill? Do I choose ignorance, or knowledge of my condition, and the world around me?

I bet any one of you will be hard pressed to think of the last time I made a decision like this. I firmly believe in most of the things Plato said and one of the central tenets of his philosophy is that knowledge breaks the bonds of ignorance, man's worst evil. Therefore, I can count the number of situations I might choose ignorance to knowledge on one hand.

I am ignorant of what is going on between many people right now. Perhaps it's not even happening any more, or maybe is raging full blast. The only thing I really know is that melissa IMed me two nights ago, and when I asked her what's up, she told me ""a whole ton of problems that I don't want to talk about"".

Even though this goes against what I think is best, I'm going to choose to remain ignorant about what's going on with this group, at least for now. Mike thinks that it's better that I not know, Melissa agrees, and those are about the only people that I have intereacted with at all over the past few days out of all of you. All I'm saying is that if you think it's strange that I'm not around, consider my position here. I am told by two people that huge amounts of conflict/strife is going on and that I need not be involved. I take their word for it, and back off. 

Now maybe all of this has ended, but it's very hard to be friends with people that feel that for whatever reason, I shouldn't know about parts of their lives. I'm not hurt or offended by that, because I trust all of you, but it just makes things very unapproachable. So I'll wait to be called if something fun is about to go down. After all, I hate to have to interrupt Mike's dinners night after night and continue to chew up his cell phone minutes to invite myself places with all of you. I like being with you all and I miss it a lot.

""In other news"" (-teresa) I walked over to Dan's house after caddying Sunday, and was greeted by Tony, Dan, Kurt, Matt, and Nick Engel playing Risk in Dan's basement. I decided to go to Michigan with them, and subsequently left at 6pm with Nick and Matt's mom for White Pigeon. I returned today at 6:15, making the entire trip just over 24 hours.

Highlights from the trip:

1. Tubing behind the pontoon. A massive boat pulling Engel and/or Dan who are practically mounting me on a tube hardly bigger than a desk chair. Later, I went solo on the tube for over 20 minutes, with sadistic Kurt at the wheel of the boat. I once was in a turn for three minutes. This ended when I was so tired I just rolled off the tube and swam back to the boat, and Dan pulled me up by the shoulder straps of the life jacket.
2. We watched Swordfish on Matt's mom's laptop on the pontoon. I was designated in charge of getting the laptop down to the boat, but since I don't know the property that well, took a nasty fall down about seven steps in the dark, but the laptop never even touched the ground. Mad props to me (is that allowable to give onself props?)
3. Dan took a 360 on the waverunner at almost 40 mph and threw me about nine feet, feet over head into the water at that speed. He said the ""ski"" felt quite ""unloaded"" after I was off.
4. Dan, stepping off the boat, managed to go not onto but fully through the pier with his left foot. That was quite a site to see.
5. My DRY sleeping bag found itself in the water, curtesy of Nick Engel, at approximately 9:15 PM CDT. He claims it just ""rolled off the pier"" at about that time. Yeah right, I had to hang the thing up and let it dry overnight after that number.
6. I slept on the pontoon with the other 5 people, that was absolutely amazing. I dragged down a futon matress, a pillow, and a SLEEPING BAG, not that that last item did me any good, in one trip (wow, that was a PItA). I slept more comfortably than I ever had away from home with my setup out there, and warm as well.
7. After going to bed I woke up breifly at 6:30AM. I had my watch right next to my head so I would know. I heard people dragging a ladder over my head and trying to start the engine of the boat. I was sleeping on the part in front of the front doors and there was a lot of traffic but I just went back to bed.

At precisely 6:44 am Matt Kahle was standing on the pier over yonder with the keys and the paddles in his hand yelling that it's time for me to get up. I didn't really care that they had shoved me off from the pier and that I was drifting in the middle of the lake without the key, because it's his boat, and I wanted more sleep. They all thought it was pretty funny though, I laughed with them once I was back in.

Today was Jenny's birthday and I spent the night with Melanie, Heather, Jenny, and some others including Engel. I had a great time there, although I somewhat wonder why the Mich. crew plus some stopped by for like 5 minutes then left. Jenny sure didn't appreciate that, although I tried to convince her that by just stopping by they're better off than not having come at all.

Now I'm talking to Melanie about her China trip. I'm going to miss her a lot, and she me too...

eVeRMeLoDi0Us: me so crazy;-)
eVeRMeLoDi0Us: im already homesick
Pastymeat: see, you just love us [jenny and me]
eVeRMeLoDi0Us: ja, i do!

This is going to be a long night."
"eventtime","2002-07-16 01:41:00"
"current_moodid","30"
"url","http://eldavido.livejournal.com/9452.html"
"userid","4466"
"itemid","34"
"event","As fate would have it (I don't actually believe in fate at all) I didn't do any of the things I thought I might do on Saturday night. 

When I drove back to my grandparents' house in the Heights, they had people over. I talked with all of them for a while, then called Melanie. Kristen Rooke had IMed me just before I got off after writing that post on lj and reminded me about her graduation party, to be held at Iron's Oaks Saturday night at 7:30. I ended up taking Melanie to the party as a replacement for Kurt, who she asked me for. Kurt was in Michigan.

The two of us stayed at the party for a while. I ended up going at around 8:15 and I saw a bunch of Kristen's friends, and some others, including the veritable Andy Gleason, Dan Dominick, Chrissy Martinez my horn-playing buddy, and that entire group. Amar also showed up because I told him we were going.

It was ok for a while, but when it got to the point that more than half the party was outside trying to be covert about their liquor drinking I decided that Melanie and I were going to leave. I had a sip of Mike's with Andy out back, then we said our goodbyes and left.

What happened next, I never would have imagined. I got one of my ""ideas"" just as we were leaving, and I decided that since I had a car, I would take Melanie back out to the Heights. There we could do such things as see the ghetto carnival (""Crossroads Fest"" as it was called), see the kids with the subwoofer box go bumping down the street, see about a thousand and one fireworks get shot off, and just watch things happen.

As it turns out, we had a ""standard length conversation"" which for the two of us lasts about two hours and 45 minutes. Other examples of this include the loft conversation after prom, and various talks at Apollo Park. Anyway, I got to the house at about 9:50 and we left at like 12:25. Totally out of control length to do nothing else but sit on a roof, but I had a great time doing it. In fact, sitting with Melanie is one of my most favorite things to do, even though she unconditionally refuses to give any of me or my friends massages, which needs to cease, because she's very good at it. And no, nothing ""happened""; I know that will come up from someone.

Sunday came around with my grandfather yelling ""5:30, FALL IN!"" at the top of his lungs through the door to my aunt Jane's old room at the top of the stairs. Holy crap - the man can't hear, and when I told him I didn't need to wake up until 6:30 I wasn't that mad. I tried to tell him that I didn't need to get up yet, and that I had set an alarm clock that I found in the room, but he didn't yet have his hearing aid in, so just went downstairs and cooked some sausages ont the stove. When I heard the stairs to the 2nd level begin to creek again at 5:40 I decided that it was totally helpless, and just got up, making for 9 hours of total sleep over the Saturday and Sunday I was there. Sure, it's easy for him to go to bed at that hour, he goes to sleep at 8pm...

I discussed the Evans Scholarship with some people at icc then caddied. Next thing I knew I was on my way out to the lakehouse with my other (mom's) grandparents. My brother had gotten my dad to buy a lot of fireworks and hence continued the tradition of the around-4th of July fireworks show off of our pier on Lake Dale Carlia in Lowell, Indiana.

The next thing I knew AFTER that was that my dad was shaking me to get up early to leave for Turkey Run State Park, in Midwest Indiana. I went swimming there, and had a funny experience. Continuing from the Chicago trip, I made a point of talking to random strangers. Some kids were playing catch with a seal ball in the pool at Turkey Run and they were with two girls, one of which was exceedingly hot. They told me the girls were ""family friends"". The two guys had just graduated high school (Illinois, actually) and their parents had come out with some of their parents' friends and brought their kids. The guys were just out of high school, and they kept flirting with the girls. The girls seemed totally tired of it so eventually they got up and left, and the guys followed them out of the pool, back to their campsite. The guys asked me how old I thought the girls were - about 20. I learned that they were 15 and 14. Wow. (""Reverse Asian complex"" - how come Asian people always look younger than they are? someone asked melanie if she was over 13 when we went to Charlie's Angels once - both 15 at the time...haha) The guys basically told me, not in these words, that they needed justification for their liking of the girls, and I was it. How much is too much to go after though? I guess two years is acceptable, but three years is pushing it.

I later learned that a youth group from our area was staying at the park with us. I saw an HF girl - actually my dad did first - and he asked her if she knew me (wasn't there at the time). I knew her, only by face though. She is going to be a sophmore, has black curly hair, was in the musical, and darker skin. I can't think of her name but she plays soccer. Alas, life goes on.

Tuesday: We left Turkey Run for Indianapolis. We had planned to go to the Indianapolis Zoo, but due to the rain I almost got my family to go to the Children's Museum of Indianapolis, which is unconditionally the coolest museum ever. Oh well, I got to see giraffes and lemurs and lions and plenty of birds. I also learned while I was there that ""gentoo"" is a type of penguin. The only context I had ever heard ""gentoo"" in was the name of a linux distro. You know you're a geek when the computer meaning of a word is clearer than the ""real"" meaning. I didn't know that a ""Gentoo"" was right up there with a King Penguin, but I sure did know about Gentoo Linux.

As fate would have it (I don't actually believe in fate at all) I didn't do any of the things I thought I might do on Saturday night. 

When I drove back to my grandparents' house in the Heights, they had people over. I talked with all of them for a while, then called Melanie. Kristen Rooke had IMed me just before I got off after writing that post on lj and reminded me about her graduation party, to be held at Iron's Oaks Saturday night at 7:30. I ended up taking Melanie to the party as a replacement for Kurt, who she asked me for. Kurt was in Michigan.

The two of us stayed at the party for a while. I ended up going at around 8:15 and I saw a bunch of Kristen's friends, and some others, including the veritable Andy Gleason, Dan Dominick, Chrissy Martinez my horn-playing buddy, and that entire group. Amar also showed up because I told him we were going.

It was ok for a while, but when it got to the point that more than half the party was outside trying to be covert about their liquor drinking I decided that Melanie and I were going to leave. I had a sip of Mike's with Andy out back, then we said our goodbyes and left.

What happened next, I never would have imagined. I got one of my ""ideas"" just as we were leaving, and I decided that since I had a car, I would take Melanie back out to the Heights. There we could do such things as see the ghetto carnival (""Crossroads Fest"" as it was called), see the kids with the subwoofer box go bumping down the street, see about a thousand and one fireworks get shot off, and just watch things happen.

As it turns out, we had a ""standard length conversation"" which for the two of us lasts about two hours and 45 minutes. Other examples of this include the loft conversation after prom, and various talks at Apollo Park. Anyway, I got to the house at about 9:50 and we left at like 12:25. Totally out of control length to do nothing else but sit on a roof, but I had a great time doing it. In fact, sitting with Melanie is one of my most favorite things to do, even though she unconditionally refuses to give any of me or my friends massages, which needs to cease, because she's very good at it. And no, nothing ""happened""; I know that will come up from someone.

Sunday came around with my grandfather yelling ""5:30, FALL IN!"" at the top of his lungs through the door to my aunt Jane's old room at the top of the stairs. Holy crap - the man can't hear, and when I told him I didn't need to wake up until 6:30 I wasn't that mad. I tried to tell him that I didn't need to get up yet, and that I had set an alarm clock that I found in the room, but he didn't yet have his hearing aid in, so just went downstairs and cooked some sausages ont the stove. When I heard the stairs to the 2nd level begin to creek again at 5:40 I decided that it was totally helpless, and just got up, making for 9 hours of total sleep over the Saturday and Sunday I was there. Sure, it's easy for him to go to bed at that hour, he goes to sleep at 8pm...

I discussed the Evans Scholarship with some people at icc then caddied. Next thing I knew I was on my way out to the lakehouse with my other (mom's) grandparents. My brother had gotten my dad to buy a lot of fireworks and hence continued the tradition of the around-4th of July fireworks show off of our pier on Lake Dale Carlia in Lowell, Indiana.

The next thing I knew AFTER that was that my dad was shaking me to get up early to leave for Turkey Run State Park, in Midwest Indiana. I went swimming there, and had a funny experience. Continuing from the Chicago trip, I made a point of talking to random strangers. Some kids were playing catch with a seal ball in the pool at Turkey Run and they were with two girls, one of which was exceedingly hot. They told me the girls were ""family friends"". The two guys had just graduated high school (Illinois, actually) and their parents had come out with some of their parents' friends and brought their kids. The guys were just out of high school, and they kept flirting with the girls. The girls seemed totally tired of it so eventually they got up and left, and the guys followed them out of the pool, back to their campsite. The guys asked me how old I thought the girls were - about 20. I learned that they were 15 and 14. Wow. (""Reverse Asian complex"" - how come Asian people always look younger than they are? someone asked melanie if she was over 13 when we went to Charlie's Angels once - both 15 at the time...haha) The guys basically told me, not in these words, that they needed justification for their liking of the girls, and I was it. How much is too much to go after though? I guess two years is acceptable, but three years is pushing it.

I later learned that a youth group from our area was staying at the park with us. I saw an HF girl - actually my dad did first - and he asked her if she knew me (wasn't there at the time). I knew her, only by face though. She is going to be a sophmore, has black curly hair, was in the musical, and darker skin. I can't think of her name but she plays soccer. Alas, life goes on.

Tuesday: We left Turkey Run for Indianapolis. We had planned to go to the Indianapolis Zoo, but due to the rain I almost got my family to go to the Children's Museum of Indianapolis, which is unconditionally the coolest museum ever. Oh well, I got to see giraffes and lemurs and lions and plenty of birds. I also learned while I was there that ""gentoo"" is a type of penguin. The only context I had ever heard ""gentoo"" in was the name of a linux distro. You know you're a geek when the computer meaning of a word is clearer than the ""real"" meaning. I didn't know that a ""Gentoo"" was right up there with a King Penguin, but I sure did know about Gentoo Linux.

After the zoo, we headed off to Dayton, OH. I have seen many towns with illegitmate claims to fame; stupid things such as ""the biggest ball of yarn lives here"", however, Dayton does have a ""legitimate"" claim to fame, being that it is the home of Wilbur and Orville Wright. Today I went to WPAFB, the main local attraction. Those letters stand for Wright-Patterson Air Force Base. Their relationship with WPAFB is somewhat similar to O'Hare for us: ""The temperatre is 90 officially at Wright-Patterson."" Even though I have been there before, it was cool to be on a active air force base. This strange, monotonous announcer kept coming on the intercom saying, ""six twenty three, eleven L"". It was the strangest thing, and I had no idea if that was some sort of code to indicate there were terrorists on the base, or what had happened. I think the mere fact that it <i>could</i> happen, of all places where I was, intrigued me the most.

So here I am, 6:27 local time (5:27 back at home) and I just ate four helpings of complimentary nachos and cheese, salsa, and sprite. I love Homewood Suites. By the way, isn't that a cool name for a hotel? I'm not sure what I will have for dinner tonight, or when I will have it, but I am feeling great now, and I am going to run later. I also am going to write to Judy, and watch more TV - last night was the end of Austin Powers II and Airplane (Judy's favorite movie I think). The 15th is Jenn'y birthday so if you know her well wnough to get her a gift, don't forget. Be back Friday y'all, and I'm going to be on later tonight.

Thanks for reading, as always, and I am going upstairs. Albrecht"
"eventtime","2002-07-10 18:08:00"
"url","http://eldavido.livejournal.com/8864.html"
"userid","4466"
"itemid","33"
