"names","values"
"event","I finally got out today, after my two day break from activity. That's my club, and I love it. I caddied for Pietrowski, Aleman, Bonner, and Nichols. I made some money, finally.

I got done with that at 2:30. Oops, actually 1:30, somehow my watch picked up exactly one hour when I was on the course. It had to happen between the time I was on the bench to the time I was coming in, because it said the right time when I went out. I felt very confused, for the second time in a few days, the first being the box incident. Confusion is not good, it makes me look very awkward and screw stuff up.

Brian and Toni stopped over today. I felt loved, they took me to McDonald's and Toni bought me a McFlurry. I saw this ad for 19.99/mo cell service that I NEED to get because as I'm sure all of you know, the phone here is always busy. I'm going to try to get that and see how it all works out.

My brother's friends were over, they watched the end of The Fast and the Furious that I had rented, and then Air Force One, which I liked a lot, although I did not see the whole movie.

The original plan was to go mini-golfing. I have tried to do this no less than three times now. I really want to go, but each time something comes up. So, hoping that the third time was the charm, TJ and me came up with a list of people to call. The only people that could go: Adam, TJ, me, and later, sort of, Teresa. We ended up not going because we didn't have a large enough group. We decided to go ""kidnap"" Teresa as per Adam and my plan when we saw Scott, Melissa, and Teresa at the door. We went with them to Zarlengo's. I decided to be a ruffian and throw pennies at the Monte out the side of the Echo on the way there. Also, mad props to TJ for letting me drive, although I did mess up once. I am slowly getting better and better, although I'm still not good enough.

We got out ice cream and went to TJ's, lots of Renaissance-fair moon-chair (like that rhyme?) spinning, and playing with ""Stupid Pete"", the dog that eats thin air.

There was a party at Andy's Reich's (""Reich"" as in the ""third reich"", right NHS announcer guy?) house. Everyone there was going to get totally trashed so I decided not to go, but Mike wanted me to pick him up so I went home early. Adam removed his car from the driveway, and I took the Honda, but Mike had already left. Another considerable misunderstanding took place on both sides, and Mike and I cleared it up.

I had a lot of time left before I had to be home; I had promised Melanie I would visit her before her 10 day UCLA hiatus (although would it really be a hiatus? a hiatus is a pause, and she's certainly going to do more there then she does here, so maybe here is the hiatus from UCLA action) about which she says, ""David, I'm getting shipped out west to play doctor for a week"". She wrote me an email:

<blockquote>""...hope the speakers are coming along nicely, and remember- if you're ever out moping and groping over a rained out caddying opportunity, i'm probably sitting out in sunny Cali soakin up some sun. that or looking at some totally decked out hospital ward. or checkin out charles lamb lookalikes down UCLA, all in their suitjacket ensembles, nicely bronzed and collars included. either or, that's what i say. hehe. now doesn't that make you feel better dave?...""</blockquote>The little visit turned out being a lot more than that. Judy asked me out of the blue if she could cut my hair. I felt a bit uneasy but went ahead with it. I can't believe how tolerant Melanie's parents were of us, all having a hair-cutting in their house at like 12:15. It amazed me. Again, I felt loved for Judy, Melanie, and Jenny caring about my hair so much. I think it looks decent but I need a second opinion on this.

I got home around 12:30. I took the Accord without asking, but I think my father remains beautifully oblivious to both of these facts because I was quite careful with the car going in/out and he was asleep when I got home.

This morning I got up at 5:30 expecting to caddy. I felt sick in my stomach so I stayed home. Here I am, chilling for a day. Tomorrow I want to help Melissa set up her trampoline, finish the subwoofer, and maybe go out at night after I go to church (haven't been there in over a month from caddying). I guess I'm basically out of commission for today but we'll see about tonight. No promises though."
"eventtime","2002-06-23 14:10:00"
"url","http://eldavido.livejournal.com/6432.html"
"userid","4466"
"itemid","24"
"event","This day marks the second day in the ""I didn't get out because my country club sucks"" saga. Got there 9:45, stayed until just before 1:00, and watched four groups go off today. A whopping four groups of golfers. Frankly I don't understand how that place manages to stay in business but I suppose that is of little consequence to me.

I rode out in the Accord today and gave caddies a ride home: Geoff Hoffman (G-off phonetically), Jeff Anderson, and Pat Meinke came with me. All good kids, all younger kids, all stopped at White Hen.

I watched Pi today. However, I was tired for whatever reason and fell asleep halfway through it. Not that I found the movie uninteresting, I just couldn't keep my eyelids open through the end of it.

After that, I spent some time with Divya college-prepping her laptop. Configured her netcard, DHCP, and some other stuff. We went to Best Buy to get some cat5 cable. She got disks and two cd's. While we were there, I saw Sharon Pan. Good old Sharon Pan. She reminds me of my days of sitting in fifth period math with Kurt, Megan, Amar, Lev, Adam, TJ, Kathy, Stephanie, Adrianne, Megan D, Mary...I can almost remember the entire class if I had time.

While we were in the store her ""boyfriend"" ""Little Levie"" called her. She took a lot of grief from me, and from a cashier at the store, for being Lev's girlfriend. I know I probably shouldn't have been mean to her but I did fix her computer so I can take some liberty.

Later I went home and picked up Kurt Zoellick, we watched the Fast and the Furious on the system. I always love that movie. I just took the kid home and here I am.

It's pretty absurd how scattered a lot of my guys are. The MKs are in Michigan together, Dan is on vacation, and Kurt is visiting family right now. Melanie is about to leave for camp, as is Divya, and Scott is still in Wisconsin. I guess Teresa isn't really one of my guys but she is occupying / occupied by Charlie this evening. I paid a little visit to Melissa today...was it you guys that I saw at the corner of Flossmoor and Dixie today on the way to Idy? I think so, but Melissa didn't ask her mom because she preferred to stay outside and talk to Kurt and me than go back inside.

Brian, if you're reading this which is unlikely, I desire a call sometime tomorrow after about 2 so that we can finish the subwoofer. Also, Kralovec has made it clear to me that he desires another ""speaker party"" so possibly you can get started on that effort.

Teresa, I know you might have gotten this by email, but read my reply to your last comment. I hope it cheers you up a bit - and please reset the time on your computer unless you like posting to lj in the future, and making comments before the original posts go up. It confuses me a lot. You confuse me in general.

RF logistics will be put together by TJ and me by Tuesday or Wednesday probably, I want to make this a good trip so figure out who is going and who can drive. That's about all for now, ""peace out my homeslices"" - arrivo

PS this 8th grade Burger King-whore from Kralovec's is still hitting on me, umm this is really strange (ask me later)"
"eventtime","2002-06-22 00:33:00"
"current_moodid","87"
"url","http://eldavido.livejournal.com/6157.html"
"userid","4466"
"itemid","23"
"event","My head is about to explode. It's so funny how it works around here (my house). Everyone has their little agenda and if each and every thing on every person's little list isn't ticked off by the end of the day, it's a major catastrophe. Let's start with my brother.

He just got this new toy called a Neo Jukebox. The best way I can describe it is a 10gb hard drive with an MP3 player and an LCD display strapped onto it. It connects to the computer via USB. Well Windows 2000 with its ""new and improved"" driver model and permission structure has screwed me over again, causing much grief. I cannot, for the life of me, get the thing to work. Of course, I haven't <i>really</i> tried yet, by that I mean spending an hour or more totally dedicated to that, but that might have to come, come real soon.

Then there's my mom. I accidentally took home the wrong towel today from the Habben's. My towel is a sort of soft, cushy teal affair with yellow and green on it. (I suspect that I left it over there, but if anybody knows where it is, please tell me.) My mom got so mad at me for not bringing home the towel. I the too-honest Dave told her, ""Mom, I simply fail to see how you can get so worked up over a towel. I don't give a hoot about the thing; I can't bring myself to care. However, as a personal favor to you, I will get it, since I know that for whatever reason it means to much to you."" That one left her hanging for a while. My towel is ""shaneil teal"" according to my mom. It's a towel...

Then there's me. Trying to carry on too many concurrent AIM conversations, check my email, read livejournals, look at slashdot, and read the news. I am probably the worst. I feel incomplete if I do not do each and every one of those things if I knew that I had time to, so I spend the longest time online doing all of them. That's why I'm always on kids.

Today the pool was pretty good. I also played at the Irwin Center, and failed to get out caddying. and did my water works thing. I started to watch Mission: Impossible on the new system, but almost fell asleep when I realized that I need to get more sleep at night.

That's what I'm going to do right now."
"eventtime","2002-06-21 01:16:00"
"current_moodid","90"
"url","http://eldavido.livejournal.com/6017.html"
"userid","4466"
"itemid","22"
"event","Everyone reading this, I am going running today at Millennium park. I think I'm going to do about a mile and half, but I'm going to start right around 5:55 so that the water will turn on there just as I am finishing my run, and I can get really wet right after I do it.

Come to millennium park today at 6pm to join the fun. I have band at 7:10ish so I will have to leave but come for a while and bring friends. Sorry about the short notice.

...music on 9 speakers (now in the basement) is awesome"
"eventtime","2002-06-20 14:01:00"
"url","http://eldavido.livejournal.com/5689.html"
"userid","4466"
"itemid","21"
"event","Through the good graces of TJ Carr, his minivan, and some good planning skills by others, I went to Buca tonight. I still can't remember what the last name of the place is - di Bepo? Did I get that right? Anyway, it was Teresa, Adam Habben, (thanks Teresa about last night on AIM- you know what for) me, Mike Nyberg, TJ,. and Jeanine. Overall quite a good time, although the bill came to $80. That's so much money for six people to go to dinner. I caddied today and made $50 so I was able to pay it, but still, that's a lot of money.

Today when I caddied I had some cool guys - Glascoe, DiGiovanni, and that crew. On the 9th hole, I picked up some divot mix to fill in a divot on the tee box the guy made from teeing off. The divot mix is placed with a little shovel that gets left inside of the container with the mix. I leveled off the shovel and he thought I looked like I was mixing some cake so he said, ""A bit more than a tablespoon there, David?"" I felt slick so I responded, ""Yes, in fact, it's a <i>tee</i>spoon."" TJ, you were very right when you said I think of a lot of stupid stuff caddying.

Today we went to Best Buy in the morning to get a lot of equipment. We now are the proud owners of a 32"" non-hidef TV (dang it) with component video all the way through, and a pretty good stock issue A/V receiver. Stuff looks so good with component. It's a shame that Dan had to leave on vacation today or else I would show it to him, because he wanted to see it. The next big task it to figure out how to position everything in the room to minimize standing wave and wall reflection and other such ""audible anomalies"", so I turn to harman.com, the parent company of such biggies like JBL, Infinity, dbx, AKG, Crown, and harman/kardon. In other words, the entire pro audio industry short of Shure, Peavey, and Fender.

I watched Fantasia 2000 on the TV. I especially like the sketches for Rhapsody in Blue, Firebird Suite, and, as always, the Sorcerer's Apprentice. I sort of want to have a ton of people over to watch it but my basement is painstakingly small, so scratch that idea.

Tomorrow I will answer the phone at 8:30 so I can learn about the committee I am on to select a new band director for HF. I have responsibility...cool. I guess that means I'm going to get up and caddy early too, which means I will get a lot of time in the afternoon. Band tomorrow at 7:30 Irwin Center, then perhaps I will get to drive a car with a new clutch in it.

Which reminds me, Mike, I need that win2k ""SERVER"" cd if you can. Just throw up a response if it's ok and when I can come, I'll copy it and have it back the same day. Sooner is better.

Survey question of the night: name your favorite cheap thing to do (<$10/person) that's fun for groups. Mine would have to be minature golf. What do you all think would be fun?

<b>mike needs to beat kahle. needs to beat kahle.</b>"
"eventtime","2002-06-19 23:58:00"
"url","http://eldavido.livejournal.com/5463.html"
"userid","4466"
"itemid","20"
"event","Hello night.

I woke up today at 9:05. I had to be at icc at 10:00 for the daily routine. Getting up that late was a problem because I generally walk there and it's about a 35 minute haul to get where I go, so I had not enough time to eat a proper breakfast and all the things I like to do before I caddy. I ended up riding a bike with alignment so bad the front wheel probably had an inch or more of play between the maximum leftly and rightly wobble. That's really bad. Seriously, I think that bike is just going to fall out from under me some day. I'll just be riding along when the rim of the tire just bends in half and I fall off the side and get injured really badly, and that will be that.

On a lighter note, I locked the bike to the fence along Idlewild and walked into the club, exactly on time. Nice. Today I caddied for Mr. Jacobs. It was a typical disaster round. The man brought three guests that almost never play golf so not only did I have to chase their shots around everywhere, but one guy lost a pitching wedge. He said he lost it somewhere between the 12th and 18th holes. So, I had to take a golf cart (in violation of the unconditional rule that caddies don't drive carts) back six holes, and ask seven groups behind us, if they had seen a club. All of them said no. We spent almost an hour looking for the club in total and simply could not find it. (Although while we were looking I did hear the ice cream truck come down Teresa's street playing Pop Goes the Weasel hehe) I ended up making $55 which is less than I wanted to, but I'm happy that the guy did not take out something that clearly was not my fault on the caddy, like many other adults might.

I'm happy that I'm seeing a lot of quality people this summer. It keeps me in touch with the fact that not every person in the world practices the Derek Schultz routine of going home every day after caddying and smoking a bowl, followed by smoking ""about half a pack, maybe a pack on good days"" of cigarettes in an hour, and then getting drunk, every day. Every day of his life this kid does these things. It's interesting because after a while, if you don't see much else, you start to think that that's normal, and think about doing it yourself. That's what happened to me last summer.

I just watched the movie ""All the President's Men"". It's about Watergate, and the very risky reporting done about it during the early to mid 70's. I really liked it a lot. Now, I'm going to watch 13 days, and maybe some other older political stuff. I have the video for like a week so if anyone else wants it, feel free to stop by when I'm home or just ask me and I'll give it to whoever asks me.

I was thinking about getting a Geo Metro because I saw an ad for one really cheap. I read about this car. It's the best good crappy car ever. It has a whopping 1.0 liter inline 3 engine, with 76 hp. It weighs 2000 lbs and achieves a top speed of a little less than 110 mph with its whopping 2000 lbs of weight. This thing could rival Kurt's MGB if it only was made to be cool with neons and such. However, being as it was an automatic, and the guy wanted too much for it compared to Kelly Blue Book price, I decided not to get it. Anyway, ""It's a Geo!!"" - Dan Ratko

I'm looking forward to tomorrow at Buca with TJ although I'm told that some of you can't come because of work. Oh well, that just means that TJ and I will get to be beef eaters together (well mostly him but somewhat me too) and have a lot of food in a small amount of time. I really would like people to go so please come. I'm also looking forward to the Renaissance fair trip and the great america trip (if it goes off). I'll tell Kralovec and kids about rf tomorrow.

To leave off, I will tell of Fabricio Franco. He is a caddy who we all call ""Faab"" (you know, it rhymes with Saab). Over the last couple of days I have observed Faab drive to icc in a z24 Chevy Cavalier. Faab is a young'n, only about 15. I asked how he drives - he says he just does. The car is not insured, he does not have a license, but he still takes the liberty to drive. Only two moving violations so far, and each one pushes his year of legal attainment of license back about a year or two (18 now I think, maybe higher) but he still drives it. What a funny kid."
"eventtime","2002-06-19 02:03:00"
"url","http://eldavido.livejournal.com/5203.html"
"userid","4466"
"itemid","19"
"event","Movies: American Beauty, Vanilla Sky
People: Melanie today, Melissa Saturday, Kristen Rooke last night

I think I need to see Kathy Michelmore. My mom is really annoying me right now by asking me 1000 questions while I am trying to write this entry, so I can't think.

Here are some thoughts I have been having over the last few days

- renaissance fair: that looks pretty good. consider me in but I'm still not ready to front the cash yet hehe
- should I get a geo metro? its a real piece of crap car but I saw it for $1200 and in pretty good condition too, I could fix it up but I think that's too much money to pay
- Melissa and Teresa make way too much money for the work that they do.
- I wish Scott was home so we could finish our conversation
- I have felt really antisocial and depressed over the last few days. I'm not really sure why but I think that a trip of some sort needs to be planned. I think that perhaps some sort of sporting event might be a good idea. Otherwise, there are many things to do that don't involve that, but renaissance fair might just occupy this particular niche.
- I need to get a phone - anyone know of cheap cell service that I can get? My brother is online here ALL THE TIME and I can't handle it anymore. We aren't going to get broadband because it's too expensive and I want a phone anyway
- I want to get another cat. Especially after reading all the other posts, I realize that I miss my cat
- Melissa has Scott's rabbit in her backyard. What a funny little thing it is. It just hops around and when Smelly tries to pick it up, it tries to jump out of her arms and she says ""Please don't escape rabbit."" Sounds sort of like Elmer Fudd when you think about it. ""Please don't escape""
- I need to make more money. This caddying job has been crappy. Oh well, it's going to pick up as soon as it gets to be July and also when the weather is better.
- I ate a Choco Taco today. I don't so much like them but I can see how Brian might

btw, how is the move Brian?

Buca Wednesday? I haven't seen you in a while TJ, I think since the barbecue - I would like to go if that would be possible.

Tomorrow I caddy at 11 so figure on my being home at 5:30. I have band from 7:30-9:30 but if anyone wants to go out after that think something up and it'll go down.

I have no idea why I am depressed. I think it might be a chemical imbalance or something. I think I just need to go to bed and forget about all of this.

Oh yeah, that whole mess with debate still hasn't been resolved, Josh and HF crew think I'm going when I don't think that I am. Plus Aaron Kall of the institute called me and personally asked me to attend because I ""did pretty well at several TOC-quality tournaments"" (toc = tournament of champions, long story)

What do all of you do for cheap quick happiness? I need some of that. I expect like a lot of replies to this because I asked a lot of questions. Pour your hearts out y'all.

al-brakt (lani pronunciation)"
"eventtime","2002-06-17 22:12:00"
"url","http://eldavido.livejournal.com/5108.html"
"userid","4466"
"itemid","18"
"event","Friday got off to a good start when I took a bike ride in the morning because I couldn't fall back asleep. Other than that the day was kind of a disaster on two fronts.

The first of the two was the disastrously bad weather we experienced. I was set to caddy that day when I looked to the west and saw this storm cloud the size of Texas approaching icc. Great, right? Well not so much for me, as storm clouds interrupt the cash flow. So I had to stay poor although I did get to watch a very cool-looking storm from minimal cover and for quite a while, almost two hours.

I think the members had caught on that we were going to have a storm that day so play was slow. Friday some of the regulars of icc decided to compare what kinds of condoms they use, and what size. Anyone there could have predicted what happened next. Derek blew up the condom and Billy Bunn put it in the back of a golf cart. We kept trying to make it obvious and obnoxious and get a reaction out of the members when they just saw this big inflated condom blowing around on the grounds of the club, but it failed because the thing was a bit overinflated and popped. Hence the end of this chapter of caddy mayhem.

That night was spent at Josh's house, partly in his attic. I liked going over there. It was a pretty good sized crowd but nobody was acting really stupid or out of control which was a plus. I hate to see Josh get in trouble for having something screwed up. Props to Nichols though for having us all over. I had to get out of Nick's civic ""birth style"" (Jeff Ehman) through the driver's side rear window, that was a chore.

Saturday 5:30 came way too early. I got out to caddy today at 7:10 - in other words EARLY. NICE. I had Bruno, Dandino and Narcissi. Bruno acts somewhat perverted for a 60 year old man but he still is funny. From ""What's that yardage marker say David? Does it say 'TOO FAR'?"" Also some other things like ""Mario, you suck. Just face it, you're doing a crappy job of impersonating a golfer"". There were others but I can't remember them right now.

I finished at 11, about to pick up a second round at 11:50 - I visited Teresa because she practically lives on the grounds. We talked for a while until Nat came out and offered us drinks. ""Lemonade? Margaritas? What would y'all like today?"" We talked a lot about construction and garbage picking. I also saw Charlie drive by - whadup g?

Watched Blackhawk Down with Dan - I love that movie, especially the part at the end when the Pakistanis hand the water to the crew on trays.

If anyone has any plans for tonight call me right quick and something will go down."
"eventtime","2002-06-15 15:17:00"
"url","http://eldavido.livejournal.com/4792.html"
"userid","4466"
"itemid","17"
