"names","values"
"event","It's been a while since I updated this thing but I've been busy. Chillin w/ my g/f and the Fam. Its all good jus chillin out drinkin and smokin. Doin it the right way. Well Thanksgiving will be entertaining. Drinkin and smokin and livin w/ my friends. Hurrah. Well back to the town to see whats good. Aight lata ya'll. Peace to the Family and my friends."
"eventtime","2005-11-23 12:45:00"
"current_moodid","58"
"url","http://ffsgriff.livejournal.com/17047.html"
"userid","5051"
"itemid","65"
"event","<div align=center><form name=""quizform"" target=""_new"" action=""http://www.kwiz.biz/showquiz.php?quizid=18962"" method=""post"">
<table border=1 bordercolor=#000000 bgcolor=""#FB6A6A"" cellspacing=0 cellpadding=2>
<tr><td colspan=2 align=center bgcolor='681200'><a href='http://www.kwiz.biz/showquiz.php?quizid=18962' target='_new' style='text-decoration: none;'><font style='color : #ffffff; font-family : Arial, Helvetica, sans-serif;' color= '#ffffff'><b>What kind of God are you?</b></a></font></td></tr>
<tr><td><font style='color : #000000; font-family : Arial, Helvetica, sans-serif;'>Name </td><td bgcolor='#FFCCDC'><input type='text' name='in0' size='32' maxlength='64' value='FFSgriff'></td></tr><tr><td><font style='color : #000000; font-family : Arial, Helvetica, sans-serif;'>DOB </td><td bgcolor='#FFCCDC'><input type='text' name='in1' size='32' maxlength='64' value='03/08/1986'></td></tr><tr><td><font style='color : #000000; font-family : Arial, Helvetica, sans-serif;'>Favourite Color </td><td bgcolor='#FFCCDC'><input type='text' name='in2' size='32' maxlength='64' value='Black'></td></tr><tr><td><font style='color : #000000; font-family : Arial, Helvetica, sans-serif;'><b>You earthly time was spent</b> </td><td bgcolor='#FFCCDC'><font style='color : #000000; font-family : Arial, Helvetica, sans-serif;'><b>Supplanting kingdoms, punishing tyrants and levelling the empires of the wicked with the breath of your nostrils</b></font></td></tr><tr><td><font style='color : #000000; font-family : Arial, Helvetica, sans-serif;'><b>Your throne is</b> </td><td bgcolor='#FFCCDC'><font style='color : #000000; font-family : Arial, Helvetica, sans-serif;'><b>fashioned from thorns and human femurs, surrounded by writhing, howling servants, with a footstool of souls on the sizzling shores of the Lake of Fire</b></font></td></tr><tr><td><font style='color : #000000; font-family : Arial, Helvetica, sans-serif;'><b>You wear</b> </td><td bgcolor='#FFCCDC'><font style='color : #000000; font-family : Arial, Helvetica, sans-serif;'><b>Golden, breathtaking robes, girded in the middle with silver chains</b></font></td></tr><tr><td><font style='color : #000000; font-family : Arial, Helvetica, sans-serif;'><b>Your Godly superpower is</b> </td><td bgcolor='#FFCCDC'><font style='color : #000000; font-family : Arial, Helvetica, sans-serif;'><b>Complete dominance and sovereignty over time and space and the infallible right to do with both as you please</b></font></td></tr><tr><td colspan=2 align=center bgcolor=#681200><input type=""submit"" name=""submit"" value=""Try Your Answers!""></td></tr>
<tr><td colspan=2 align=center><font size=-1 style='color : #000000; font-family : Arial, Helvetica, sans-serif;'><B>This <A href=""http://www.kwiz.biz/"" style='color : #000000;'><font style='color : #000000;' color=black>Quiz</font></a> by <a href='http://www.kwiz.biz/userprofile.php?userid=29502'><font style='color : #000000;' color='#000000'>pelagicboreas</font></a> - Taken 73995 Times.<img src=""http://images.kwiz.biz/kwizcount.gif"" width=""1"" height=""1"" border=0>
</font></a></b></font></td></tr></table><font style='font-family : Arial, Helvetica, sans-serif; font-size: 9pt;'><A href='http://www.kwiz.biz/simplesurveys/paid-surveys.php' style='text-decoration: none;'>Easy Money from Home! Get your share!</a></font></div>
</form>"
"eventtime","2005-11-09 12:28:00"
"current_moodid","17"
"url","http://ffsgriff.livejournal.com/16670.html"
"userid","5051"
"itemid","64"
"event","I don't know life is fun as hell. Gotta call the navy back tomorrow and get that shit done wit. Its been a fucking balst jus chillin wit my peoples and my girl. Relaxin smokin drinkin doing our thing. Its all good aight I'm jus to stoned and tired to keep writing right now so Peace I'm out catch ya'll in morning."
"eventtime","2005-11-05 03:13:00"
"url","http://ffsgriff.livejournal.com/16493.html"
"userid","5051"
"itemid","63"
"event","It's a high society It's time for some realization, Not fueled by media manipulations But the manifestation of the last generation, legalization Fuck your pensions if you're paid, pay attention Teachers of this land, yo your all on detention You failed to mention about this everyday struggle, Placed me in a bubble but it popped on the double, Now your in trouble cuz I'm older now I'm bolder now, Bitch, I'm a soldier now Been raised to blaze in the simple place, Like a greyhound's race to brace this of disgrace I've seen people starved till there no life left, I've seen heads kicked in for the words that they said Police crackin skulls with no questions asked, A suicidal shot from a shotgun blast It didn't have nothing to do with the hoes that they popped in here It didn't have shit to do with the ones that they dropped in here It didn't have nothing to do with the land that got stole believe me motherfucker, I see right through your mind control I won't drown, drown, drown in your society High times, it's a high society Lies, lies everyone keeps tryin me Why wont they just let me be? It's a high society First of all lets get this straight, this systems full of shit, They say ""In God we trust"", your a fuckin hypocrite Crooked politicians lying out their ass Money hungry whores behind the doors smokin grass No trust in the nation, trust in the nation Spending all the money on the fucking immigration Walls caving in it's getting hard to breathe 51-50's what this system's done to me! Money don't mean shit to me, it grows on evil trees It breaks up families, it's more like a disease Cuz it's tension, did I mention it's the governments invention, Dollar dollar bill ya'll Currency a money dollar for 20 bucks, You can make somebody's daughter suck a (hooker-holla?) Turn a boy into a baller, watch his chips stack taller, Dollar dollar bill ya'll You'll see all or nothin in this game of survival Gots hustlers holdin on to the scams, They can (watch?) their bible But I'm viable for me to stay tribal, And keep making these flows undeniable But its viable for me to stay tribal, And keep making these flows undeniable I won't drown, drown, drown in your society High times, it's a high society Lies, lies everyone keeps tryin me Why wont they just let me be? It's a high society Now a nation that's stolen, can never be golden Compassion's not true in, in this (shallow amount?) of ruin. Modern industry, the industrial complex A system of no balance, and not enough checks Disease bred, transmitted through sex Revelation (to for wishin'?) Can you pay the tuition? Can you make the grade ? Is life really all about getting paid? Money can't buy nothing buried in a grave Slave driven, unforgiven The more you make, the better your livin' So it's all role-playin, playing roles, grave diggers diggin' holes Genetics strange, passed down through years of pain So the cure you seek for the mentally weak is just the norm As we weather the storm, so it's conform or suffer"
"eventtime","2005-10-27 14:02:00"
"url","http://ffsgriff.livejournal.com/16172.html"
"userid","5051"
"itemid","62"
"event","Well I have been living at Ramapo for a lil while now. Its all good but I need to go home for a lil bit and see the rest of my peeps. I am officialy joining the navy. I took the test and can get any muthafucking job I want. Howver, I have to go back in two weeks cuz I am 45 lbs. overweight but I might have to go back later than that if I test positive for drugs. Its all good though either way I will be sworn in sometime before the holidays. In other news, Life is good. My friends are with me, my girl is by my side, and I know that no matter what happens they will always be here with me. I know the heading said goood times but I must also drop one thing in here jus cuz of the date.


REST IN PEACE
ANTHONY M. AMATO
BELOVED FRIEND, SON, AND BROTHER
1985-2000"
"eventtime","2005-10-21 09:08:00"
"url","http://ffsgriff.livejournal.com/16106.html"
"userid","5051"
"itemid","61"
"event","Sitting here typing
lonely I feel
without you by my side

Aight short and sweet. Whats good ya'll? Life's funny ain't it. You find people and things you would never want to give up for the world but jus at the point where you are going to have to give everything up in order to live. Huh? I don't know why but somehow it all seems ok now. I don't really want to join the navy and if I could find somewhere to live and a place to work near my friends it would be wonderful. However, since that does not seem possible at this moment in time I am going to sit here and just entertain myself till I have to go. Well, that seems to be that although I do feel the unrequited need to post the names of the new and improved Family and say wassup to my homies:

THE FAMILY
Tina
Bridgette
Craig
TJ
Leeat
Randall
Jocelyn
Kendall"
"eventtime","2005-10-14 06:00:00"
"current_moodid","101"
"url","http://ffsgriff.livejournal.com/15736.html"
"userid","5051"
"itemid","60"
"event","Six 30 packs, Miller Lite 
One 30 pack, Miller Genuine Draft 
Eight 12 packs, Yuengling 
Two 12 pack, Killian's Red 
Two bottles Smirnoff vodka 
One bottle, Georgy vodka 
One bottle, Grey Goose Citron vodka 
One bottle, everclear 
Five bottles, Jack Daniels 
One bottle, spiced Jamaican rum 
One bottle, Malibu Coconut rum 
One bottle, coconut Jamaican rum 
One bottle, Southern Comfort 
One bottle, Captain Morgan's rum 
One bottle, Jaegermeister 
One bottle, Bacardi Limon 
One bottle, unflavored rum 
One bottle, Jose Cuervo tequila 
One bottle, Jim Beam 
One bottle Johnny Walker Red

Good bless our livers. For we shall continue drinking till there is no semblence of anything left. We shall drink to the end. Beyond that very fun times here at Ramapo as I begin the work of getting and staying off the narcotic that is Ramapo. Also, funny little story for ya'll when I see ya'll. Peace.
10/10/05 yeah baby good day."
"eventtime","2005-10-10 10:04:00"
"url","http://ffsgriff.livejournal.com/15411.html"
"userid","5051"
"itemid","59"
"event","LIFE what a funny thing we drink and drink and fuck and drink and get high and do all of the other fun things in life that would kill normal people. but the mos important thing is we are all friends and we are all enjoying
 ourselves immensly.nothing like a good party on another note I did finally figure out i'm going to join the navy as a way out of bergenfield. it does kind of suck but i have to do what i have to do."
"eventtime","2005-10-07 21:17:00"
"url","http://ffsgriff.livejournal.com/15155.html"
"userid","5051"
"itemid","58"
"event","(Violent J) 
Let me ask you this about this life we live 
And let me try to swerve some of this attention you give 
To them distant ass relatives over in Ham dinner 
If they really miss you so much 
Why don't they just call a (Muthafucka) 
If you wasn't blood, would you still have love? 
Or infact does the blood make you think you have to love? 
Look I probably love my family more then anybody here 
But my homies are family too 
Third cousins get outta here 
Who was you with when you got tatoos? 
Who was you tripping with when you did them mushrooms? 
Who the fuck threw up all over your car? 
And then felt worse then you about that shit in the morning? (Friends ya'll) 

(Shaggy 2 Dope) 
Who loaned ya money, homie? 
Who owes ya cash? 
Who taught you how to use a bong for the grass? 
I don't know much but I gotta assume 
When ya hit ya first neden, ya homies was in the other room 

(Chorus) 
We talkn' about HOMIES HOMIES!!! (Talkn' about those dogs of life!) 
Our muthafucking HOMIES HOMIES!!! (We throwin' up Clown Love signs!) 
Real juggalo HOMIES HOMIES!!! (Talk about those dogs of life!) 
HOMIES HOMIES (Man that's my dogg) 

(Violent J) 
Have you ever had a job that you truly dispise? 
Like I dunno maybe dishwashing or fuckin flipping fries 
Then you got this boss who thinks he's the don mega 
Cause he the head manager Cheap chili fry maker
All you could vision is ya'll beating him down 
Your homies standing on his back while your kicking his head around 
But responsibility is there, I can't lie tho 
I would a been plucked his fucking eyeball out with a chicken bone 
Crazy as fuck I'll rip your peircings off 
And now my homies are holding me back so I don't look soft 

(Shaggy 2 Dope) 
When you snuck the car out who did you get? 
And when you got colour, who you blame that shit? 
Who you relax around and scratch yo balls? 
Homies, were talking about like you and yours! 

(Chorus) 
We talkn' about HOMIES HOMIES!!! (Talkn' about the dogs of life!) 
Our muthafucking HOMIES HOMIES!!! (We throwin' up Clown Love signs!) 
Real juggalo HOMIES HOMIES!!! (Talk about those dogs of life!) 
HOMIES HOMIES (Man that's my dogg) 
If ya don't like me ya can Fuck Off!! (Got a bullet for every one)
If ya don't like me ya can Fuck Off!! (Got a bullet for every one)

(Jamie Madrox) 
Me and my homies stay tight like a noose 
And if you step to one of us you betta step to the whole crew 
I never knew that I could depend 
That I could have some friends that's down til the very end 
Well that's my home boys, excuse me, my family 
And when we conquer the world 
We macking on the galaxy cause the skys the limit 
And we ain't finished 
And if my homies gonna ride ya know I'm with it 

(Monoxide Child) 
Puff it and pass it and I give it to my homies ya'll 
Hit it and quit it and then I give it to my homies ya'll 
I got the world around my finger with my homies ya'll 
And everything is obsilete unless I hear my homies call 
We worldwide, were homies across the planet 
Sticking together like zippers on Michael Jackson's 'Beat It' jacket 
They got my back like a tat for that, I love ya'll 
Hanging till we old and grey like grandpa (Psychopathic) 

(Chorus) 
HOMIES HOMIES!!! (Talk about those dogs of life!) 
My muthafucking HOMIES HOMIES!!! (Be throwing up Clown Love signs!) 
We are juggalo HOMIES HOMIES!!! (Talk about those dogs of life!) 
(Juggalo homies)HOMIES HOMIES (hey hey hey) 
If ya don't like me ya can Fuck Off!! (Got a bullet for every one)
If ya don't like me ya can Fuck Off!! (Got a bullet for every one)
If ya don't like me ya can Fuck Off!! (Got a bullet for every one)
If ya don't like me ya can Fuck Off!! Fuck Off!!! Fuck Off!!! 
(Anybody Killa going off) 
My mothafukin HOMIES HOMIES!!! (Talk about those dogs of mine!) 
We are juggalo HOMIES HOMIES!!! (Be throwing up Clown Love signs!) 
(Juggalo homies) HOMIES HOMIES!!! (Talk about those dogs of mine!) 
(Eastside, Westside!)HOMIES HOMIES 
If ya don't like me ya can Fuck Off!! (Got a bullet for every one)
If ya don't like me ya can Fuck Off!! (Got a bullet for every one)
If ya don't like me ya can Fuck Off!! (Got a bullet for every one)
If ya don't like me ya can Fuck Off!! Fuck Off!!! Fuck Off!!! 
(ICP and Twiztid giving props)
 
Jus feelin love for my homies figured I'd drop all ya'll a line. Aight I'll catch youse lata its ciggy time."
"eventtime","2005-10-04 10:53:00"
"url","http://ffsgriff.livejournal.com/14923.html"
"userid","5051"
"itemid","57"
"event","I want everybody listening now to say this
Twiztid is the muthafucking shit
And everybody else who feels that I'm a little out of line
Come see me when you hitting rewind and you will find
That I'm an ex-con serial killa axe wielding for real-a big gorilla
As I walk in the shadow of death
I bitch slap his ass and then I light a cigarette
I told you all I'm addicted to drugs and weird sex
And putting holes in the back of your neck carnival reject
Respect like you do to don dada when you see me give your boy a holler
Got the world in a shock collar like a rotweiler on the loose 
Running trains on your girls caboose
Don't believe in the truce we gonna fight until somebody here dies
I been here since 1865 and no lies

[Chorus]
This is the story of our lives
Come and take a look at my eyes
Keep it real and tell me no lies
We've been waiting for you
Here we go
This is the story of our lives
Come and take a look at my eyes
Keep it real and tell me no lies
We've been waiting for you

[Jamie Madrox]
We came through the door kicking that bitch off the hinge
We was knocking but wouldn't nobody let us in
It's the incredible edible white chocolate rappers
We came on the scene busting the cabbage patch backwards
D-I-T-Z-I-W-T we were born connected at the hip like Siamese twins
We coming out with the underground sound 
And one finger on each hand and you can count them

[Monoxide]
Fuck everybody here man it's not about them
And tucked inside of my bag is a problem
Underground feel the ground shake
Feel it vibrate watch your girl gyrate
We can move the whole world if we choose
But instead we kick the wickedest blues
And I refuse to lose the demographic of the people
Who choose to put there hearts inside the black magic

[Chorus]
This is the story of our lives
Come and take a look at my eyes
Keep it real and tell me no lies
We've been waiting for you
Here we go
This is the story of our lives
Come and take a look at my eyes
Keep it real and tell me no lies
We've been waiting for you

[Jamie Madrox]
We write voodoo sayings on the fronts of t-shirts
So that when people read 'em they will become creatures
Twiztid still coming with the ultra man flow
That'll linger in your brain and constantly echo
We ain't in it to be rich we're in it to reach folks
And change life and put you up on shit you ain't know
That's about it you're in the midst of some maniacs
Who will unload a microphone on your dome as if it's a gat
So conceal the unreal if the fruit is mass appeal
We're the worms eating our way from under the apple peal
With all juice and no pulp fiction
No dollar ninety nine a minute for our predictions
We smash mics like with the rhymes we recite
Keep this mutha fucka hype from now till sunlight
Now do you really need a shovel to dig it
And with a flip of a coin we can be righteous or wicked

[Chorus]
This is the story of our lives
Come and take a look at my eyes
Keep it real and tell me no lies
We've been waiting for you
Here we go
This is the story of our lives
Come and take a look at my eyes
Keep it real and tell me no lies
We've been waiting for you

We've been waiting for you 

We've been waiting for you 

We've been waiting for you 

We've been waiting for you 

I've come to the realization that I'm out of options and of time.  I'm not left with a whole hell of alot.
This shits wack. Whoever would think I'd be longing for the days back on the street etching out a living that made me hard. I sold my soul, smoked weed and drank. That shits cool and all but I have nothing to do now my options are left to the navy and the guard. Neither of which I really want to do. I jus wanna make some bills and chill illin style like we used to. For now I'm limited to using song lyrics to express my views so the first is good and the second one here is better expressing how I'm feeling and how I need to get away
""U Don't Wanna B Like Me""
(You dont wanna be like me) 
[Monoxide Child]
I can walk on water and freeze it on step one 
And then I'll stick my finger in it and melt it like it was hot sun 

[Jamie Madrox]
Well I can turn your adam's apple into apple juice 
Start to strangle mothafuckas till their face turn blue 

[Monoxide Child]
I can be the world's greatest serial killer of all time 
And I'll end your fucking life at the drop of a dime 

[Jamie Madrox]
I can float above the clouds, way up in the sky 
And it's my choice if I live or die 

[Monoxide Child]
Or I can be the strange pizza man that always knocks twice 
And when you open up your door I give your mothafucking neck a slice 

[Jamie Madrox]
I can take a million dollars and just throw it away 
Cause it'll never replace a single ounce of my sanity 

[Monoxide Child]
I can be the last angel standing on top of the hill 
Or the green demon waiting on your window sill 

[Jamie Madrox]
And I can become an icon for the oppressed 
Cause their hearts still beating in their unforgiven chest 

[Chorus x2]
You Don't wanna be like (Me) 
Don't wanna be like 
You Don't Wanna be like (Me) 
Don't wanna be like 
And this is the mind of a serial killa 

[Jamie Madrox]
I can buy a shotgun from Target with attempts to set it off 
I can load that bitch in the parking lot and shoot that shit off 

[Monoxide Child]
And I can be the book of the dead, a vampire or a demon 
But either way your fucked, cause when I leave your not breathing 

[Jamie Madrox]
Well I can part the sea with the wand of a wizard 
And turn a hot day into a windy blizzard 

[Monoxide Child]
I can be an axe in the backs of people who wanna trash talk 
And leave your body slaughtered all over your momma's sidewalk 

[Jamie Madrox]
I can disappear into the air like a phantom in the night 
And I can die if I'm exposed to excessive sunlight 

[Monoxide Child]
And I can show you how to dig a bitches grave in less then 20 seconds 
And I'll shove that bitch in there and let her family get to guessing 

[Jamie Madrox]
I can grab you out of your world and show you horrible things 
And I can show you the terror that curiosity brings 

[Monoxide Child]
And I can be the last straw, that puts you over the edge 
And leaves eleven at your work place dead 

[Chorus x2]
You Don't wanna be like (Me) 
Don't wanna be like 
You Don't Wanna be like (Me) 
Don't wanna be like 
And this is the mind of a serial killa 

You 
Me 
You 
And this is the mind of a serial killa 
You 
Me 
You 
And this is the mind..."
"eventtime","2005-10-01 15:53:00"
"url","http://ffsgriff.livejournal.com/14805.html"
"userid","5051"
"itemid","56"
"event","SGXigJlzIHRoZSB3b2xmIHNjcmVhbWluZw0KTG9uZWx5IGluIHRoZSBuaWdodA0KSGXigJlzIHRoZSBibG9vZCBzdGFpbg0KT24gdGhlIHN0YWdlcCBoZeKAmXMgdGhlIHRlYXIgaW4geW91ciBleWUNCkJlZW4gdGVtcHRlZCBieSBoaXMgbGllDQpIZeKAmXMgdGhlIGtuaWZlIGluIHlvdXIgYmFjaw0KSGXigJlzIHJhZ2UNCkhl4oCZcyB0aGUgcmF6b3IgdG8gdGhlIGtuaWZlDQpPaCBsb25lbHkgaXMgb3VyIGxpdmVzDQpNeSBoZWFk4oCZcyBzcGlubmlu4oCZDQpSb3VuZCBhbmQgcm91bmQNCkJ1dCBpbiBzZWFzb25zIG9mIHdpdGhlcg0KV2XigJlsbCBzdGFuZCBhbmQgZGVsaXZlcg0KQmUgc3Ryb25nIGFuZCBsYXVnaCBhbmQuLi4uLi4NClNob3V0IGF0IHRoZSBkZXZpbA0KDQpIZeKAmWxsIGJlIHRoZSBsb3ZlIGluIHlvdXIgZXllcw0KSGXigJlsbCBiZSB0aGUgYmxvb2QNCkJldHdlZW4geW91ciB0aGlnaHMNCkFuZCB0aGVuIGhhdmUgeW91IHNjcmVhbQ0KRm9yIG1vcmUNCkhl4oCZbGwgcHV0IHN0cmVuZ3RoDQpUbyB0aGUgdGVzdA0KSGXigJlsbCBwdXQgdGhlIHRocmlsbA0KQmFjayBpbiBiZWQNClN1cmUgeW914oCZdmUgaGVhcmQNCkl0IGFsbCBiZWZvcmUNCkhl4oCZbGwgYmUgdGhlIHJpc2sgaW4gdGhlIGtpc3MNCk1pZ2h0IGJlIGFuZ2VyIG9uIHlvdXIgbGlwcw0KTWlnaHQgcnVuIHNjYXJlZA0KRm9yIHRoZSBkb29yDQpCdXQgaW4gc2Vhc29ucyBvZiB3aXRoZXINCldl4oCZbGwgc3RhbmQgYW5kIGRlbGl2ZXINCkJlIHN0cm9uZyBhbmQgbGF1Z2ggYW5kLi4NClNob3V0IGF0IHRoZSBkZXZpbA=="
"eventtime","2005-09-24 14:01:00"
"url","http://ffsgriff.livejournal.com/14549.html"
"userid","5051"
"itemid","55"
"event","The heading says it all. Funny story though people thought I'd been scratched by a cat yesterday and were wonderinf why I was so happy all day even though I worked for nine hours. Thanks Eros. Had an interesting meditation session yesterday. and Funny other story so Lurch and I were talking about my fun and he goes ""Damn TJ you've been drinking and getting laid alot...When I grow up I wanna be jus like you!!"""
"eventtime","2005-09-22 13:32:00"
"url","http://ffsgriff.livejournal.com/14315.html"
"userid","5051"
"itemid","54"
"event","yeah so I went to the po last night and got drunk as hell. I went to work and puked my brains out then got off work and went drinking again I love my motherfucking life. Thats the illest shit in the world. Plus I have danny London saying some ill shit to me here's what he said....DanNJ073: nice- wha' happened while I was away- you get any further with that Amanda chick?
DUMPLINGGRIFF: nah
DanNJ073: you've got a real gift w/ talkin to ladies, TJ, . Were you really drunk while talking, or was that all natural? Either way, you were real smooth, lol
DUMPLINGGRIFF: are u mocking me? or being serious I'm drunk a lil right now
DanNJ073: I'm serious man
DUMPLINGGRIFF: aight I wa drunk as hell but it is a natural thing for me
DanNJ073: I really admired how you were so natural while talking to her
DUMPLINGGRIFF: I try...I hate phony people so I always act real thats why I don't make bones about my pat I'll tell u everything about me and u can judge me for urself
DanNJ073: thats fersure. I learned more about your past durin that conversation then any other time. You've had quite a life
DUMPLINGGRIFF: yeah i'd say so but its aight I'm better for it than people that don't have balls to stand for something
DanNJ073: thats definitely true"
"eventtime","2005-09-18 00:21:00"
"url","http://ffsgriff.livejournal.com/13839.html"
"userid","5051"
"itemid","53"
"event","I'm Free I'm free. all the charges are dropped. I have nothing. I'm a free man now its time to celebrate. Peace ya'll"
"eventtime","2005-09-15 14:35:00"
"url","http://ffsgriff.livejournal.com/13797.html"
"userid","5051"
"itemid","52"
"event","No doubt. went up and partied at the Po this past weekend. Have new funny stories. Then came back. started working today buit there is one bad thing I had to shave off my goatee I now look like a little boy again."
"eventtime","2005-09-07 20:25:00"
