"names","values"
"itemid","186"
"event","We'll do it all
Everything
On our own.

We don't need
Anything
or anyone.

If I lay here,
If I just lay here
Would you lie with me
and just forget the world?

I don't quite know
How to say
How I feel.

Those three words
Are said too much,
They're not enough.

If I lay here
If I just lay here
Would you lie with me
and just forget the world.

Forget what we're told
before we get too old,
Show me a garden that's bursting into life.

Let's waste time
Chasing cars 
Around our heads."
"eventtime","2007-01-27 09:12:00"
"current_moodid","15"
"url","http://funsizefirst.livejournal.com/47786.html"
"userid","5449"
"itemid","185"
"event","I've packed a cooler and a change of clothes
Let's jump and see how far it goes
You got my heart and your daddy's boat
We got all night to make it float
We could sit on the shore, we could just be friends
Or we could jump in

Whole world could change in a minute
Just one kiss could stop this spinning
We could think it through
But I don't want to, if you don't want to
We could keep things just the same
Leave here the way we came, with nothing to lose
But I don't want to, if you don't want to

I got your ring around my neck
And a couple of nights I don't regret
You got a dream of a degree
And a shirt that smells like me
Yeah we both got dreams, we could chase alone
Or we could make our own

Whole world could change in a minute
Just one kiss could stop this spining
We could think it through
But I don't want to, if you don't want to
We could keep things just the same
Leave here the way we came, with nothing to lose
But I don't want to, if you don't want to

Never waste another day
Wonderin' what you threw away
Holdin me, holdin you
I don't want to, if you don't want to

We could keep things just the same
Leave here the way we came, with nothing to lose
But I don't want to, but you don't want to"
"eventtime","2007-01-04 02:21:00"
"url","http://funsizefirst.livejournal.com/47520.html"
"userid","5449"
"itemid","184"
"event","meglet116: im not so stupid steve
meglet116: hurt me once, shame on me
meglet116: hurt me twice 
meglet116: wait
meglet116: i fucked that up
steveruleworld: haha noob

How do you spell Irony?

One day left!"
"eventtime","2006-12-19 02:12:00"
"url","http://funsizefirst.livejournal.com/47140.html"
"userid","5449"
"itemid","183"
"event","<table width=350 align=center border=0 cellspacing=0 cellpadding=2><tr><td bgcolor=""#DEDEDE"" align=center><font face=""Georgia, Times New Roman, Times, serif"" style='color:black; font-size: 14pt;'><b>You Are 52% Pure</b></font></td></tr><tr><td bgcolor=""#EFEFEF""><center><img src=""http://images.blogthings.com/howpureareyouquiz/pure-3.jpg"" height=""100"" width=""100""></center><font color=""#000000"">
You're usually the typical girl or guy next door...
But you also have a secret naughty side!</font></td></tr></table><div align=""center""><a href=""http://www.blogthings.com/howpureareyouquiz/"">How Pure Are You?</a></div>"
"eventtime","2006-12-18 11:36:00"
"url","http://funsizefirst.livejournal.com/47074.html"
"userid","5449"
"itemid","182"
"event","Motivation would require exertion
motivation
I have none today. 
First you take a final test
until they're done you get no rest
final test
less is best.

(sung to the tune of the childhood song ""suffication, lack of ventilation..."" cause i'm that damn cool). So, I can predict the future. I predicted in my brain that the church would call me up, needing a soloist. I was damn close, Lauren called up saying they needed part II for silent night with her. My mom its going weep buckets becase ""its so beautiful to see sisters singing"" but frankly I am just glad I don't have to be Angel Gabriel anymore. One of the younger girls finally learned the lines.

I have a test tomorrow at 5, I am not studying but I am not stressed. I just want to go home. I want to sleep but I don't want to acomplish anything. Grawr. 

Red Rose tea has little figurines in British porcelain that you can collect. Now I have two; a little green owl and two little blue kitties."
"eventtime","2006-12-18 01:24:00"
"current_moodid","92"
"url","http://funsizefirst.livejournal.com/46672.html"
"userid","5449"
"itemid","181"
"event","Until I'm home. Last final is tomorrow, Spanish linguistics. At this point I am having a hard time caring, much less studying. I can't wait to get out of here for multiple reasons, including having been here since June, missing Shoreline, and being done dealing with unnecessary issues. Perhaps when I go home I will visit SW and maybe watch some basketball or go to the woodshop. I will need to pick up some new buddies since Brady won't see me, so my access to my friends last time I was home will be more limited.

Boys can be stupid, but for the most part they make good friends. I'll have to write about my random, spur-of-the-moment trip to Moneterey with Shawn on Friday night. It was fun, many wild adventures were had. 

I am ready to go back, and linguistics better be easy cause its getting increasinly hard to be motivated. Luckily my nice friend who works at Milano gives me the occasional discount which makes me motivated to study there!

btw to the people in glass houses: make sure your walls are noiseproof cause I don't wanna hear it."
"eventtime","2006-12-17 21:27:00"
"current_moodid","49"
"url","http://funsizefirst.livejournal.com/46372.html"
"userid","5449"
"itemid","180"
"event","Two down, two to go. 

Finals, the place where it's OK to finish first. (heh, I made that one up myself)

But seriously though, Freshmen (and Steve cause you didn't know any better) the FINALS backronym really isn't that funny. I like to make up fresher versions like ""Finally I Now Ascend the Ladder to Sonambulence"" or ""Frustratingly Intense New Analyses Lead to Slumber"".

I'm not doing poem of the week anymore. That's what happens when you can't write. Another conundrum: no cello. I can't play now because i'll disturb the housemates. I can't play during break because I won't have her. 

Today was Spanish 135 and I finished with an hour and a half to go, ka-ching. Steve asked if he needed to call the cops to report a rape....i said the test consented, it had just never seen the likes of me before! (har har) so it wasn't THAT easy of a test, I'm just that good of a writer. (again, har har)

So these days I've learned that if I don't like someone, all I have to do is not invite them to my birthday party. Everything you need to know you learned in kindergarten!

Hanukkah party on friday. All the cool people are going. I have one more test tomorrow, and one on monday, but in the meantime i'll be working for Sher a few last times to make some money. He's now on the fence about trying to decide whether or not to keep the store. Speaking of on the fence, if you know my sister, tell her to stay in school. No boyfriend is smart enough to know what his girlfriend should do with her life. 

So that is all! Read and tremble, peons, for I have returned! and this time i don't give a *$@& what none of y'all say ;)

Stay tuned."
"eventtime","2006-12-13 16:01:00"
"current_moodid","125"
"url","http://funsizefirst.livejournal.com/46147.html"
"userid","5449"
"itemid","179"
"event","and out the other side. As I write this, woodland creatures are running across my roof. I also saw a bird of prey with a pigeon in its fist today, that was cool. But right now I'm going to make like a quail and get shot by dick cheney. No, but thats what it could feel like. I think sleep is in order."
"eventtime","2006-11-30 17:13:00"
"current_moodid","40"
"url","http://funsizefirst.livejournal.com/46012.html"
"userid","5449"
"itemid","178"
"event","how emo....now i'm afraid. There's the reason i stopped doing this, i think."
"eventtime","2006-11-29 17:41:00"
"url","http://funsizefirst.livejournal.com/45693.html"
"userid","5449"
"itemid","177"
"event","Hi LiveJournal. My it's been a while. Things have changed a bit. 

Just testing the water. 

Hello bouncing green smilie."
"eventtime","2006-11-29 17:39:00"
"current_moodid","132"
"url","http://funsizefirst.livejournal.com/45329.html"
"userid","5449"
"itemid","176"
"event","Years grow shorter, not longer,
the more you've been on your own.
Feelin's for movin' grow stronger'
so you wonder why you ever go home,
wonder why you ever go home.

People are movin' so quickly.
Humor's in need of repair.
Same occupations and same obligations,
they've really got nothing to share,
like drivin' around with no spare.

River gets deeper not shallow,
the further you move down the stream.
Wonderin' if I can keep her as I
race to keep up with my dreams.
How they shine and glitter and gleam."
"eventtime","2006-06-07 13:58:00"
"current_moodid","30"
"url","http://funsizefirst.livejournal.com/45065.html"
"userid","5449"
"itemid","175"
"event","Alone in this house again tonight
I got the TV on, the sound turned down and a bottle of wine
There's pictures of you and I on the walls around me
The way that it was and could have been surrounds me
I'll never get over you walkin' away

I've never been the kind to ever let my feelings show
And I thought that bein' strong meant never losin' your
self-control
But I'm just drunk enough to let go of my pain
To hell with my pride, let it fall like rain
From my eyes
Tonight I wanna cry

Would it help if I turned a sad song on
""All By Myself"" would sure hit me hard now that you're gone
Or maybe unfold some old yellow lost love letters
It's gonna hurt bad before it gets better
But I'll never get over you by hidin' this way"
"eventtime","2006-05-09 00:40:00"
"url","http://funsizefirst.livejournal.com/44808.html"
"userid","5449"
"itemid","174"
"event","She put him out like the burnin' end of a midnight cigarette
She broke his heart he spent his whole life tryin' to forget
We watched him drink his pain away a little at a time
But he never could get drunk enough to get her off his mind
Until the night

He put that bottle to his head and pulled the trigger
And finally drank away her memory
Life is short but this time it was bigger
Than the strength he had to get up off his knees
We found him with his face down in the pillow
With a note that said I'll love her till I die
And when we buried him beneath the willow
The angels sang a whiskey lullaby

la la la la la la la

The rumors flew but nobody know how much she blamed herself
For years and years she tried to hide the whiskey on her breath
She finally drank her pain away a little at a time
But she never could get drunk enough to get him off her mind
Until the night

She put that bottle to her head and pulled the trigger
And finally drank away his memory
Life is short but this time it was bigger
Than the strength she had to get up off her knees
We found her with her face down in the pillow
Clinging to his picture for dear life
We laid her next to him beneath the willow
While the angels sang a whiskey lullaby

la la la la la la la
la la la la la la la"
"eventtime","2006-05-04 00:19:00"
"url","http://funsizefirst.livejournal.com/44773.html"
"userid","5449"
"itemid","173"
"event","V2hlbiBhbGwgb3VyIHRlYXJzIGhhdmUgcmVhY2hlZCB0aGUgc2VhDQpQYXJ0IG9mIHlvdSB3aWxsIGxpdmUgaW4gbWUNCldheSBkb3duIGRlZXAgaW5zaWRlIG15IGhlYXJ0DQpUaGUgZGF5cyBrZWVwIGNvbWluZyB3aXRob3V0IGZhaWwNCkEgbmV3IHdpbmQgaXMgZ29ubmEgZmluZCB5b3VyIHNhaWwNClRoYXTigJlzIHdoZXJlIHlvdXIgam91cm5leSBzdGFydHMNCg0KWW914oCZbGwgZmluZCBiZXR0ZXIgbG92ZQ0KU3Ryb25nIGFzIGl0IGV2ZXIgd2FzDQpEZWVwIGFzIHRoZSByaXZlciBydW5zDQpXYXJtIGFzIHRoZSBtb3JuaW5nIHN1bg0KUGxlYXNlIHJlbWVtYmVyIG1lDQoNCkp1c3QgbGlrZSB0aGUgd2F2ZXMgZG93biBieSB0aGUgc2hvcmUNCldl4oCZcmUgZ29ubmEga2VlcCBvbiBjb21pbmcgYmFjayBmb3IgbW9yZQ0K4oCZY2F1c2Ugd2UgZG9u4oCZdCBldmVyIHdhbm5hIHN0b3ANCk91dCBpbiB0aGlzIGJyYXZlIG5ldyB3b3JsZCB5b3Ugc2Vlaw0KT2ggdGhlIHZhbGxleXMgYW5kIHRoZSBwZWFrcw0KQW5kIEkgY2FuIHNlZSB5b3Ugb24gdGhlIHRvcA0KDQpZb3XigJlsbCBmaW5kIGJldHRlciBsb3ZlDQpTdHJvbmcgYXMgaXQgZXZlciB3YXMNCkRlZXAgYXMgdGhlIHJpdmVyIHJ1bnMNCldhcm0gYXMgdGhlIG1vcm5pbmcgc3VuDQpQbGVhc2UgcmVtZW1iZXIgbWUNCg0KUmVtZW1iZXIgbWUgd2hlbiB5b3XigJlyZSBvdXQgd2Fsa2lu4oCZDQpXaGVuIHRoZSBzbm93IGZhbGxzIGhpZ2ggb3V0c2lkZSB5b3VyIGRvb3INCkxhdGUgYXQgbmlnaHQgd2hlbiB5b3XigJlyZSBub3Qgc2xlZXBpbuKAmQ0KQW5kIG1vb25saWdodCBmYWxscyBhY3Jvc3MgeW91ciBmbG9vcg0KV2hlbiBJIGNhbuKAmXQgaHVydCB5b3UgYW55bW9yZQ0KDQpZb3XigJlsbCBmaW5kIGJldHRlciBsb3ZlDQpTdHJvbmcgYXMgaXQgZXZlciB3YXMNCkRlZXAgYXMgdGhlIHJpdmVyIHJ1bnMNCldhcm0gYXMgdGhlIG1vcm5pbmcgc3VuDQpQbGVhc2UgcmVtZW1iZXIgbWUNClBsZWFzZSByZW1lbWJlciBtZQ=="
"eventtime","2006-05-03 22:31:00"
"current_moodid","113"
"url","http://funsizefirst.livejournal.com/44476.html"
"userid","5449"
"itemid","172"
"event","OK.....Take a deep breath, here is my break:

Saturday: flight back, I managed to make friends with some guys from the 104th instructor brigade and sat by them on the plane. I crocheted this cute little teddy bear in blue and gold which spc warren kept playing with and *sniff* I accidentally left on the plane. I got home, ate delicious chicken, and hung out with Brady. 

Sunday: Church, it was nice to see everyone even if I stayed downstairs the whole time making my Ukranian egg. The process is really cool and I've done it enough that I finished the whole process in an hour. I'm awesome! I don't have a picture tho, sad sad. I was a dork and thought ""oh, its break, I wont need anything fancy to wear"" without realizing I would. DUR! I met lauren's new boyfriend, he's nice, much better than kevin, penisboy as I liked to call him. I managed to somehow get sick in the middle of this day somehow, a nice fever, and that kinda put a damper on my movie night, but not really. Brady and I rented Pride and Prejudice, and I was apparently pretty goofy on meds in the car and I was singing about how hot Kiera Knightley was. We went to QFC so I could be a lentbreaker because I really wanted soda and was being really whiny. Good movie though! I liked it.

Monday: Brady invited me to go to the symphony on wednesday, so I had to remedy the no-dressy-clothes by going to platos closet, my favorite thrift store. I got a skirt (which I am now wearing) for $12 and a dress for $6 and they are damn sexy! I hung out with Brady a little also. Afterwards I hung out with Joefoe at his frat--Phi Tau at UW--and met some of his bros, they were really nice. It was fun, I wished I had more time to do it!

Tuesday: Went running, which was nice. Nice easy shoreline run, ignored the hills, but it felt good anyhow. I was supposed to go to tea with my mom this day, but we had to postpone it to the next day. We also had dinner with grandma, and I hung out with Brady more. 

Wednesday: went to tea with my mom at the Queen Mary teahouse. It was awesome, we had formal high tea which was teapots of tea of our choice (I had Yerba Mate!) and all the cute little finger foods that you might imagine the Queen having. It was really nice, down in the nice suburban area north of Seattle. Today was also the symphony. Brady took me downtown, and after a short stint of being lost we found ourselves (literally, he didn't know where he was) in front of Benaroya hall. It's a nice place, we saw the Russian National Symphony play Tchaikovsky and Shastakovitch, which wasn't as good as you thought it would be. I guess they were better under the commies. It was a huge group, but we noticed arhythmic playing and a wierd disconnect between the strings and the winds and brass. 

Thursday: walked the doggie after sleeping in really late! Brady and I started to watching Saving Private Ryan but didn't finish. We didn't end up being able to finish it the entire time!

Friday: I woke up with this insane earache. Went running with the doggie again, down to Syre and then up the hill. On my way back I did a snot rocket and heard this voice saying ""theres a girl after my own heart!"" and this random guy complemented me on my snot ejection. Funny huh! Later I made dinner for the RJJs and had them over, Brady came eventually and we hung out and such. Rich and Dad are either getting senile or just need to argue. Rich is especially bad, I put solid evidence of my points in front of his face, timelines from my history class, and he just kept blustering. 

Saturday: This day was the apartment part at Melissa and Jeremy's new apartment! Their apartnemt was really nice and I am really jealous. The drive up was really nice and I have funny video of Brady being silly. We ate food and such, and played games. I sucked at Kings, stupid Brady was so mean to me with waterfall! However, I WON pyramids, hooah! (that's another thing, I picked up a lot of bradyisms) and was a champ in battle of the sexes until I got a headache. 

Sunday: Went to grandma's for a big dinner thing with a bunch of the family but only got to stay for a little bit. Brady came too, and I showed him all the cool things in grandma's house. They are so much cooler now that I appreciate them more, I hope I have time to go explore her house more now that I understand. Then Brady took me to the airport and I was on my way back to Berkeley. 

PS I couldn't bring my cello :-( But I might resurrect an old friend!"
"eventtime","2006-04-06 16:06:00"
"current_moodid","59"
"url","http://funsizefirst.livejournal.com/44048.html"
"userid","5449"
"itemid","171"
"event","Know how there is that song that reminds you of a specific person? Not even that it reminds you of them, its more than that, a very strong association between the song and the person so much that the association persists even after the people stop associating.

Ok. Can that song ever be someone else? I don't think so. I would like to hear what you think."
"eventtime","2006-03-23 13:25:00"
"current_moodid","92"
"url","http://funsizefirst.livejournal.com/44009.html"
"userid","5449"
"itemid","170"
"event","I was just looking at my ""friends from other schools"" section on facebook, aka people I knew from high school, and damn. Everyone looks really good. I know they are just facebook pictures and thats why people pick them, but everyone looks really different. At least, the girls do. Make up and hair and clothes and stuff. They look the same, but just, a lot like college students I guess, in the way that another student would expect someone attractive to look. The guys look mostly the same, just hotter (for the most part). Where are the people I used to know? That's a multiple part question in that none of us ever talk. Partially my fault because I don't do my half, but I've been over this, it was due to a lack of effort on both sides that I largely gave up. I came to the conclusion no one was really close enough to me for it to really matter to them or me. That and I look the same as I did in high school,or very nearly so. I'm still wearing the same clothes. Damn internet. 

That being said, the other day someone referred to facebook as ""fb"". That means 2 things; that its in current enough use and has become normalized enough to get an acroynm for aim; and that process is more for efficiency than in-group distinction. Calling it fb right away would have been a move to try and be cool, use lingo, all that. Hooray for the internet. 

Brady came and visited me this weekend. We went to San Fran and a St. Patty's day party at my house; if you want pictures just holler because I have given up on trying to lj them. Melissa, you almost gave it away but I didn't realize until after. It was a nice suprise but very hard to get used to the idea of him being there, just because the worlds are so completely separate. Damn distance. 

I'm going home next week, some of my friends on the quarter system just had their spring break, so I'm sad that I'm going to be missing my favorite form of encountering those people that I just bitched about not being able to talk to anymore: The QFC encounter. It's awesome, because theres nothing more expected than pleasentries, and sometimes people genuinely mean it (thank you Erika Leeland!). I'm not sure at this point how excited I am, because the break looks to be really more structured than I'd like. Hopefully I'll get a lot done. Oh, also, I'm staying in Bezerk over the summer, and taking Arabic 10. Hooray for distance."
"eventtime","2006-03-21 13:01:00"
"url","http://funsizefirst.livejournal.com/43767.html"
"userid","5449"
"itemid","169"
"event","In Chilton, a recent spate of limericks has snuck into use lately. Their observance confined to AIM, but is thought likely to spread to the surrounding populace. For instance:

I'm meeting with kids from linguistics,
I thought I might rhyme but missed it;
Now I'm pretty vexed,
Don't know what to say next
But you'll laugh when I end with ""fish sticks""

That one just makes me laugh. Ok, sorry for not posting in forever and ever (not like anyone REALLY pays attention, ha). I don't have an good excuse except my dire hatred of personal electronic media corners. Like MySpace, or wikipedia. Things that people pay attention to when they should be doing something productive like study or make friends! (winkwink) So, two weeks to go till break. In the meantime, a paper, a midterm, and a presentation are rearing their ugly, densely-toothed mugs into my peripheral vision. Spring break means Shoreline, whixh will be nice. I swear, I will go partake in the spring mating ritual that is vacation in Mexico one day, I just don't know when.

This weekend there be a day-late St. Patty's day celebration at my house on Saturday night at 11 pm. It'll go on 'till the wee hours, so wear your green. I fancy the drunken revelry in this city will be supreme this weekend.

The weather was beautiful today when I was out running errands. I took some pictures. I also have been eating large amounts of orange food. Cheddar, doritos, and popsicles to name a few. I hope the stains come off. In other news, the earth shattering feat of Megan winning at pool occurred not once but THREE TIMES on friday night. Thanks Steve for playing with me :-)

I joined a college bball pool on facebook, despite no real knowledge of it. Should be fun!

look for more limericks coming to a theatre near you."
"eventtime","2006-03-13 15:31:00"
"current_moodid","59"
"url","http://funsizefirst.livejournal.com/43281.html"
"userid","5449"
"itemid","168"
"event","This morning I had spanish 111b, which I speeded through (this fact worries me a little) but it really wasn't that difficult. I could have had more detail on the short answers I suppose. Yesterday I got my history midterm back (80, thats a solid-to-high-b) and my spanish paper, a B+. I would have liked an A, but I guess I'll have to work harder next time. 

Today I go to heavenly with Shawn for the weekend. It should be an awesome time skiing and hanging out. 

We are halfway through the semester already. Just a thought. Also, since when did sandwich bags get so small? To all you believers out there, happy lent. I know that we certainly are an underrepresented minority at Cal ;-)."
"eventtime","2006-03-03 11:50:00"
"current_moodid","113"
"url","http://funsizefirst.livejournal.com/43052.html"
"userid","5449"
"itemid","167"
"event","I'm going to CRP this weekend, in San Jose. It should be fun, I'm particularly looking forward to seeing my friends from other schools and (hopefully!!!) low-key partying. I'll be back on sunday, hopefully in time for some bowling with friends. This week was pretty good, drama aside. I learned an awesome game, its called ""speed quarters"", and its a riot. I also took care of business, and I'm thinking about going thrift store shopping next week. 

Call me. I can't put my # up because that's stupid, but you might just get a silly me on the other side (read: inebriated). That's that. 

*smile* it's Friday!! Whoop-de-doo!"
"eventtime","2006-02-24 14:33:00"
"current_moodid","31"
"url","http://funsizefirst.livejournal.com/42989.html"
"userid","5449"
"itemid","166"
"event","<center><table bgcolor=""#FFFF00"" border=1 width=""50%""><tr><td><center><font color=""#000000""><big>you are yellow</big><br>#FFFF00</font></center></td></tr><tr><td bgcolor=""#FFFFFF""><center><font color=""#000000"" size=-1><br>Your dominant hues are red and green, so you're definately not afraid to get in and stir things up. You have no time for most people's concerns, you'd rather analyze with your head than be held back by some random ""gut feeling"".<br><br>Your saturation level is very high - you are all about getting things done. The world may think you work too hard but you have a lot to show for it, and it keeps you going. You shouldn't be afraid to lead people, because if you're doing it, it'll be done right.<br><br>Your outlook on life is very bright. You are sunny and optimistic about life and others find it very encouraging, but remember to tone it down if you sense irritation.<br></font></center></td></tr><tr><td><center><a href=""http://spacefem.com/quizzes/colors"">the spacefem.com html color quiz</a></center></td></tr></table></center> 

For those of you just now joining us, yellow is my favorite color. :-)"
"eventtime","2006-02-21 18:07:00"
"url","http://funsizefirst.livejournal.com/42700.html"
"userid","5449"
"itemid","165"
