"names","values"
"event","does anyone else think there's something different between the general mourning of a relationship and the rejection/validation thing? well, the second part of that just got alot easier, which is good because i'm two months out from the break up.
i had to cut off talking to r a little over two weeks ago. i'd reached my limit, and he'd been progressively treating me poorly. but doing that felt like a whole new loss, and i felt extra bummed out. 
delena to the rescue. 
d came to town for the weekend, and we went out to watch improv and then karaoke. at the improv place was a really cute guy volunteering there as an usher. D's known him for four years, so he's not a crazy person. but he is 21, has never had a girlfriend, and is shipping off for navy basics 5 days before i graduate law school. delena didn't have to nudge either of us much; we hit it off pretty fast. anyway, he's very good looking (baseball body, blue-blue eyes, and lovely nose), and let's face it: i'm single and i'll do what i want. we saw eachother again later that weekend, and went for a walk through the park on a relatively warm evening, talking for almost 2hrs. 
we made plans for this weekend, and it was a blast. 
friday evening i took him to melissa's birthday party, and got to show him to my girlfriends and watch evil dead 2. he took me home, and when he left, he 'casually' left his hat for me to wear/borrow. :) we hungout again today: starting with the Spoo5k cemetery run, then indian buffet lunch, then trigun eps on the couch, then cute snuggles in my room, then grabbed sandwiches for dinner. he walked me to the door and kissed me good night. i think he will be the perfect rebound, especially if he keeps calling me gorgeous and saying i have beautiful eyes! oh, and he's always kissing the tip of my nose, which is also very cute.
he's going to take me paint-balling, and i'm going to be a hiking/running/workout buddy for him to get ready for basic this summer. his name is william."
"eventtime","2011-01-23 23:25:00"
"current_moodid","64"
"url","http://greysniperpoet.livejournal.com/129515.html"
"userid","5926"
"itemid","503"
"event","Winter break was lovely! the company was great. we cooked till the cows came home and crawled into the oven! i don't usually eat meat, but everyone else does, so over a week and a half we cooked: 16lbs turkey, 2 whole chickens, 8lbs of liver, 3lbs of bacon, and 20lbs of meatloaf! oy! let's just say i'm thoroughly meated-out!

we went out on snowy hikes: bowl and pitcher, dishman hills, and mount spokane (this one was snow shoes!!). saw the pony for the longest amount of time since we both left ks for grad school; it was much needed. before everyone descended it was just dad and i for a few days, which was great. i can't wait to purchase property so dad and i can live together! separate houses, of course. :) sweet brendan drove all the way from GA, and hit every patch of bad weather possible here and back. erika stayed the longest, and we had a great time with just the two of us around new years. 

after that the house emptied, jeff returned, and he and i dug into our moot court brief writing (i'm doing trademark, he's doing international). and that's where things have been until yesterday when the other roomies made it home. today is the first day of classes for my last law school semester; and i couldn't be more happy about finishing! my schedule looks great too, but busier than i had originally planned. 
grades from fall were satisfactory! i pulled a 3.57 for the semester, which puts me on the Dean's list again. highest grade: admiralty law! that's right, my international whaling regulation paper was a smash! ;) 

been missing ryan. his company can be hard to beat, and i had become used to talking to him regularly. it's a very very good thing that we're so far apart right now, because we would be spending time together if we were close and that would end badly. we've discussed how we're both glad for the distance because we are both adjusting to not being a couple. hopefully with time and distance we'll be ready for a solid friendship to start up in the summer. 
i've had a hard time understanding what i'm feeling about him alot of the time, and have been working on it in meditation. it's hard to believe that it's only been 1.5mo since we broke up! ryan even thought it'd already been 4 months, when we spoke around his birthday. he's going through a process too, which while understandable, part of me wants to scream, ""but isn't the point of you breaking up with me because you are 'over' me?"" of course, it's not that simple.
mostly i'm trying to actually process this transition without becoming bitter about romance. 

this semester, i have three classes, a trial set in march, and a moot court competition in feb. i'm also being a paid research assistant for a professor, and still doing club prez stuff. sunday's will be job hunt day as i plan my migration to chicago! 
anyway, that's me."
"eventtime","2011-01-11 09:25:00"
"current_moodid","43"
"url","http://greysniperpoet.livejournal.com/128995.html"
"userid","5926"
"itemid","502"
"event","Well, i took three finals and finished a 28 page paper about international whaling regulation this week. i am now officially done with my next to last set of finals. just one last semester of law school, and then, i might actually start calling myself a grownup.
missing friends and family. wish i had time to go visit everyone and call more often. i think that will be a big advantage to just having a day job, even if it's 60+hrs a week: it's less than law school. i get weak in the knees just thinking about having weekends again. a regular schedule = happiness. 
looking forward to getting alot done this break. the tree is up, and dad, pony, erika, and brendan will be joining me for a good 'ole family christmas. :) and i've decided to run a holiday-themed rpg with them while everyone's here! :D should be alot of fun.
feeling good about things in general, but i can certainly tell i'm going through an adjustment period. not that i've had much time free beyond studying, but i've been enjoying some increased solitude over finals. weekly solstice choir practice is really fun and cleansing!"
"eventtime","2010-12-11 19:59:00"
"current_moodid","125"
"url","http://greysniperpoet.livejournal.com/128513.html"
"userid","5926"
"itemid","500"
"event","it's taking me some time to decide where to start. things have been crazy busy. the spring semester ended very well; i was placed on the Dean's List for my good grades. Honduras for spring break was very rewarding. I made the highest score in International Intellectual Property, and the second highest score (1 of 2 A's in the entire class) in Constitutional Law II. Bam! My roommate Sean and i made a garden, worked-in over 20lbs of compost we had made over the year, and planted all sorts of things (tomatoes, tomatillos, swiss chard, zucchini, onions, carrots, sugar snap peas, radishes, corn, acorn squash, lettuce, and string beans). we left the watering up to rommie Jeff, because we both had summer externships. Summer was interesting. First, Ryan graduated, and moved to Madison, WI to study and take (and pass!) the bar. I went to Lawrence, KS to work in the Douglas County District Court with an excellent judge. 
R and I slugged our way through finals (we had two classes together), then hurriedly packed his stuff. he graduated the weekend after finals, his parents came in and packed like superheros, and I was able to work on packing my truck (Black Mamba)for the summer. three days after ryan's graduation, we both take off together in our vehicles, drive all day, and camp in a forrest north of Yellowstone. My cats have their own tent to play in, but go in the car to sleep in case of bears. that night suddenly became our 'last night' before we were officially in a long distance relationship. 
I stop at my dad's, stay the day and night, then make my way to Loveland where my Aunt Clara feeds me, and my Cousin Sarah shelters me, and it was lovely. Make it to KC, C's house to be specific. She was amazing enough to put up with my two cats on top of her two kittens (who recently turned 1 yr!) for the entire summer! *applause* I had an interesting summer in two homes: at C's in KC with the kitties on the weekend, and at Tuck's in Eudora for the work week. Before the heat advisories got crazy, i did some biking to work. it was nine miles one-way, and through a classic slice of Kansas: beautiful! I would shower in the female police officers' locker room and change for the day; hope that my biking clothes would dry out during the day, then put them back on and bike back when it got late enough to cool off. and yes, i still have my mountain bike, the Blue Mare. she's very ...sturdy. i've decided that when i get my first paycheck as an attorney, i will get myself a nice road bike: i'm really ready for the extra speed. :) 
it was nice hanging with T and C for the summer. there was alot of cooking. C and i were all about the veggies, T and i ended up being half and half (which worked out). i had my own room at both places, and the back and forth hopefully made me less of a burden. i had issues with my financial aid, and didn't receive my summer check until the day before i left Kansas. thankfully, i have the best dad in the world.
at court, i worked on some pretty interesting and intense cases. i watched a high publicity trial. it was a worthwhile experience. it was nice to work in lawrence, but i found that i did not have very much time to do the fun things that i had planned. i was able to go to pagan rituals with my group, and i did some house sitting at Cedar Springs: which was amazing! i learned so much this summer about gardening: i'm itching to start doing my own thing!
over the summer R and i managed to see eachother once a month. i got to see Madison (sweet town!) and show lawrence and Camp Gaia to him. he was able to meet alot of my friends, even a sauna pot luck was held. it was most excellent. when i left kansas at the end of the summer, the cats and i went up to madison for a few days (i biked, and he rented a canoe for us) then drove across to my dad's for a few more days (hiking and huckleberry picking). in case you are wondering: the cats have harnesses, and i loop their leashes through the passenger 'oh shit' bar. they can go where they want, except in my foot well. they were both very good travelers. 
everyone was happy to get home. J had done a great job watering the garden, and there were all sorts of things growing! we managed to get a TON of food from our garden over the last few months, and had been enjoying tomatoes until just last week. the cats, who had done very well the few times that i had taken them out to the farm and let them free-range for a day, started having more yard privileges, and i'll let them out during the day for sometimes up to an hour in the backyard by themselves. they chill, eat grass, and chase falling leaves or bugs. if they leave the back yard, they have to come inside. i always have to pick up chainsaw, but i can snap my fingers, and velcro will run inside because he doesn't want to be left alone. 
school started with a fury; particularly because i began my work on the Nat'l Health Care Moot Court Competition. we (team of three) had a month to research and write a supreme court-style brief. ours ended up being 60 pages long. it was intense. as soon as that was turned in, we had a month of oral argument practice for the Nov competition. during this semester, i also put in 20hrs every week in the clinic. i have a limited license to practice law in the state, and my professor supervisors assign me cases, and i do the legal work. we take low-income clients. i primarily do family law cases. i've taken depositions this semester, and had a motion hearing before a judge. for classes i'm taking: non-profits, patent prosecution, advanced trademark, and admiralty/maritime law (i have to write a 30 pg paper for that one: on whales!).
the long-distance relationship thing hasn't been going very well. we have seen eachother once in the last three months: that was for my cousin's wedding reception in kc. i flew into WI, watched R get sworn into the bar, we visited my Aunt Francie and Uncle Art, then drove down to KC for the weekend. it was nice to show him around, and even better to be with him. but when we're apart for more than a month, we seem to have a hard time feeling like we're even in a relationship. anyway, between his campaign work during the midterm election (and job hunt, and student loan payments on the horizon, and ect.), and my moot court competition R feels like he might be done with 'us'. this just happened in the last two weeks. he's been honest about his feelings, and is planning on flying over here next weekend so we can end things in person. i really couldn't ask for more. and it's not like he cheated on me or anything, like the d-bag. i've had a splendid and romantically-epic time over the last year and a half, and i hope we can have an equally amazing friendship. 
that's where i am now. i have started work on my second moot court competition (this time it's trademark!), and my admiralty paper is due in a couple of weeks. 
for christmas, looks like my dad, erika, and the pony will be joining me! :) i'm getting a tree and a turkey, and we'll hope for snow."
"eventtime","2010-11-14 11:07:00"
"current_moodid","43"
"url","http://greysniperpoet.livejournal.com/128242.html"
"userid","5926"
"itemid","499"
"event","Wow, it's been a LONG time since i've posted!! sorry, but fall semester was totally nuts! i was taking hard classes, working for a judge here at superior court, and still logging in time at the AG's. then as soon as finals were over, i hopped on a plane to KS and spend two wonderful weeks there with friends and family. i flew back to spokane for a couple of days, then hit the road with ryan and our friend sean for some lovely camping and hiking in the redwoods. and now the new semester is underway! i'm taking cool classes (constitutional law II, International IP, IP transactions and licensing, conflicts of law, professional responsibility, and good ole' legal research and writing) this semester, and only working at the AG's (the clerkship was only for a semester).

Still in the safe haus with my roomies, and it's great. the four of us have committed to the next year together as well, which will be swell. it's been nice to come home to people and the cats and to feel like it is my home as well as theirs. i'm still biking to and fro all the time, but with a new backpack that has more pockets and is water resistant! didn't take yoga AT ALL last semester (sad but true), but i'm taking it tues nights with ryan this semester, and it's lovely. 

had a birthday this week just past. i am officially 28. my birthday reminds me of my mother, for obvious reasons, and i wish that i could fill her in on everything i've been up to; i miss her terribly at times.

the cats are good. velcro has become more and more ""normal"", but i'm certain at this point that he's autistic (probably thanks to my d-bag ex who gave him kitty drugs when he was tiny and undeveloped mentally). fortunately, he's a cat, so it's not a huge disadvantage. my roommates love him, and he gets along with them in his own way. chainsaw is also good, and becoming quite clever with opening doors and hiding places. chainsaw gets along with my roommates as well, but his house nickname is ""fatty"", but (as his mother) i still don't see it. he loves ryan, though, and it's always cute when ryan comes over and chainsaw wants kisses from him. :)

and yes, ryan and i are great! :D i can't believe it's been ~10months since we started dating! he makes me incredibly happy on a regular basis, and i hope i do the same for him (i think i probably do). i'm trying not to worry too much about what will happen after he graduates this spring, because i have another year of law school one way or the other, but we're hoping it will work out with us together. i dunno, i may have found my hippie life partner, stay tuned!

what life have i outside of law school? besides occasional msgs or calls to friends and family, and LFD2 with crystal and the pony on friday nights, not much. for instance: i studied fri till 6, took a break till 11 (playing computer games), then read cases till ~130am; woke up at 9, and have been here at school working till about an hour ago when i became completely unmotivated. :P there will be a full day of studies tomorrow as well. /shrug/ this is my life. 

i hope ya'll are well, hope things are going great for you. if i haven't spoken with you in a while, forgive me and shoot me a line whenever!

oh, and i thought obama's state of the union was really good, but hated his environmental portion: nuclear, ""clean"" coal, biofuels, and offshore drilling?!?! who the hell are you kidding?! everytime i hear him say anything about the earth, i come away from it feeling like i've been listening to bush! eewww! i don't understand why he panders to the republicans when it's the environmentalist democrats who got him elected. it should be a top priority! ok, that's my 2cents."
"eventtime","2010-01-30 19:28:00"
"current_moodid","64"
"url","http://greysniperpoet.livejournal.com/127852.html"
"userid","5926"
"itemid","498"
"event","wow, my summer has been flow by in a very summery-type way. 
next week i take my final for federal indian law, then head out on a long road trip with ryan to stop at many national parks (great redwood, yosimite, death valley, grand canyon, and zion) for hiking and camping, and meeting his parents (eek).

my dad came to visit just after i moved into the house. we had a great time, but it was a short visit. then crystal came to visit for nearly a week, and that was a blast too. while she was in town we had our house party, and it was way fun. my roomie sean got a 16gal keg on amber ale from the local brew: northern lights. the next day there was 5gal left, which we proceeded to drink the next day in the lawn via beer pong with the sprinklers on. yay, summer! 

i've been biking hither and tither, and it has been grand. i love hoping on my bike in the morning and flying around town in warm-weather clothes. the low humidity of the area is nice because while the sun is super hot, the shade and the breeze are quite refreshing. river front park, the park in the middle of spokane abutting the north side of the downtown area, has always been a big part of my time here in spokane. i bike or walk through it every day practically to get to and from home, school, and work. the grass is well tended and it's lovely to head to a green and lush field after work, find some shade, and read. 

right around when i was moving i banged my left ankle on three separate occasions. it's still at least twice as big as my right ankle. i'm going to try to get it looked at before the trip since i'll be doing so much hiking. 

so, i'm in this house with three guys from school. so far so good. we've settled in for the most part, and the house is really cute. i've started a compost pile in the back and we've set up a clothesline and a bike lean-to. it's nice to live around others again, i haven't done it in while. and i've certainly never done the college house scene. i'm enjoying it. we live about 4 blocks from school, a block from a dive bar that does karaoke, and 200 yards from the grocery store. my summer class, which my roomie jeff is also in, is W R F from 530-830pm. on thurs nights (tonight) we've (about 8 of us; rommies plus other friends) gotten in the habit of going over for the karaoke night, taking turns buying cheap pitchers for eachother, some of us singing occasionally, then walking home. we don't have AC, and i live in the hottest room in the house, but i love it! all you need is a little fan blowing on you and it's just fine. i bring a sweater with me to work and school to hold off the unnatural cold. 

work at the attorney general's office has continued it's trend. my attorney let me write the persuasive memo in support of a motion for summary judgment in federal court! it was a TON of work in a short amount of time, but i got it done, AND i think i dd well! we have to file it next week! my attorney said from the beginning that we likely would have to go to trial on this (aka the motion for the summary judgment), but it will be close. so it's possible that i might convince a federal judge to go our way! 

oh, and i was awarded a scholorship for IP law, so that's pretty cool.

well, that's about all that's been going on with me. i hope ya'll are well! :)"
"eventtime","2009-07-30 17:56:00"
"current_moodid","64"
"url","http://greysniperpoet.livejournal.com/127606.html"
"userid","5926"
"itemid","497"
"event","ok, i've had my first full week of working at the attorney general's office. it's pretty sweet. people are nice and the work is pretty cool (i'm helping to defend the state from people who sue it). fridays are being devoted to lawnwork for my new landlady for some extra cash. in july i'll be taking federal indian law. 

my trip home and to the tetons was AMAZING! so much so that i felt completely out of place when i got back to spokane. i got my final grades. they were ok; except contracts for some reason--it killed my GPA! :( but summer class and classes in the fall should make things up. got re-connected with spokane by hanging with the puma posse (elena, lindsay, and melissa), and gettting to ride my bike again for the first time in two weeks! 

things continue to go well with ryan and i. it's funny (funny's not really the right word), i feel that i am a fairly well put-together person (as in: i know myself pretty well) except for this whole ""starting to build a serious relationship"" thing. it's like a muscle i haven't used since i was 18. i find myself reacting to a situation, but when i stop and think about it, i realize that my reaction has nothing to do with reality, but is more of a long-forgotten reflex. it's really strange! i'm learning who i am in this sphere of life, which is good, but it is also a challenge! ryan's been there every step of the way, being so understanding, wanting to talk about it, and letting me find what works for me (since i don't know and have been discovering it). he's just amazing. we're feeling out schedules right now: we want to see eachother several times a week, but not all the time (i love how independent we both are). it's such a contrast from perhaps having about 30min apart over the 5 days we were in the tetons together, which was great but is not how we want to run things all summer! anyway, so i'm discovering him and myself in all this and it's such a good thing. i really feel like we're doing this right, and i can't wait to see where it takes us. 

i have 20 days till i move into my new house with my new roomies. i'm really excited! but besides getting my boxes out of storage, i haven't started packing yet! i better get on that. ;) ok, i'm off to work outside today in comfy clothes (contrast from a/c and business suits the rest of the week). who knows what i'll get up to this weekend, except one day will be things i need to get done, and one day will be with my man (hiking and chillin no doubt).

i've posted picks from my trip on the blogspot (oasis pics link at the top of my lj), check them out if you like. love and hugs to all-a-ya'll. kansas peeps: i had a great time, and i miss you already. all other peeps: i hope to see you soon and send you mental hugs in the meantime. :)"
"eventtime","2009-06-12 08:36:00"
"current_moodid","125"
"url","http://greysniperpoet.livejournal.com/127280.html"
"userid","5926"
"itemid","496"
"event","ok, finals are over!! i've finished my first year of law school!! whew! i think it went well, but i won't know till grades get in at the beginning of june. 

i officially have a ""man"". he's in law school, focusing on environmental law, a hiker and biker, he's wonderful on the guitar, we've been on a blues kick together (i've been rocking the harmonica!). he's amazing and we resonate off eachother. i've basically been floating through these last 3-4 weeks. his name is ryan. 

i'm in kansas! i spent the weekend after finals finding a truck camper shell from a salvage yard--which is super sweet! then three days of driving to get here. it's camping this weekend, then chilling in ks in general till thurs when i head for the tetons. ryan's flying into the tetons on sat, and we're hanging out with my dad and going hiking then driving back together. we both are working at the washington state attorney general's office this summer. 

anyway, this was short and sweet. oh, and there are pics up on the blogspot if you want to check it out. wish you all well!"
"eventtime","2009-05-22 09:59:00"
"current_moodid","59"
"url","http://greysniperpoet.livejournal.com/127122.html"
"userid","5926"
"itemid","495"
"event","welcome to finals. 5 tests, 2 weeks, no life. well that's not entirely true, but close enough. it's a marathon to the finish line. i think the hardest part is productively studying right after a test (three-hr essays worth the entire grade), when your brain is mush.

took my first this morning: civil procedure. i think it went pretty well. 

i have some other awesome news, but it's not time to share it yet. all in good time. ;)

went out last weekend, drinking and dancing to blues was phenomenal."
"eventtime","2009-05-05 16:26:00"
"current_moodid","125"
"url","http://greysniperpoet.livejournal.com/126764.html"
"userid","5926"
"itemid","494"
