"names","values"
"itemid","17"
"event","""Breathe""

WOO!
WOO!
WOO!
BREATHE!

[Bridge]
One and then the two 
Two and then the three 
Three and then the four 
Then you gotta BREATHE 
One and then the two 
Two and then the three 
Three and then the four 
Then you gotta BREATHE 
Then you gotta (gasp)
Then you gotta (gasp)

[Hook I]
Yo these niggaz can't breathe when I come through, hum too 
Some shoes, gotta be 20 man 
It's not even funny they can't BREATHE 
The choke holds too tight 
The left looks too right 
You know what? You right 
These bitches can't BREATHE 

[Hook II]
Look look, they hearts racin'
They start chasin'
But I'm so fast when I blow past
That they can't BREATHE 
In the presence of the man 
Your future looks better than ya past if you present with the man 
You betta BREATHE 

You niggaz can't share my air 
Or walk a mile in the pair I wear 
And I'm gettin better year by year 
Like they say Juan do 
Cops couldn't smell me if you brought the canines through 
And I pace myself 
I know these money hungry bitches wanna taste my wealth 
But I keep em' on a diet 
Embrace they health 
Or either keep em' on a quiet 
And space myself 
And just take a deep breath 
I got em' grabbin' they chest 
Cuz it's hurtin' em' to see Fab in his best 
And they in they worst 
They rather see me lay in the hearse than lay in the back
And I ain't just layin a verse 
I'm sayin the facts 
I came back with some sicka stones 
That got these broke niggaz lookin at me like they chokin' on a chicken bone 
Every chick I bone 
Can't leave the dick alone 
So I know 
It's one of them everytime I flip my phone 

[BRIDGE] 

[HOOK I]

[HOOK II]

I see em on the block when I passes 
Lookin like they need oxygen mask-es 
I make it hard to BREATHE 
But I keep the glocks in the stashes 
Cuz the cops wanna lock and harass us 
And make it hard to BREATHE 
They has to react 
Like havin' a asthma attack 
When they see the plasma in back 
You dudes are wheezin' behind me 
My flow is like a coupe, breezin at 90 
That's the reason they signed me 
It's quick metaphors and hard punches on the cuts 
Feels somethin' like hard punches to the gut 
How I address the haters and under estimaters 
And ride up on them like they escalators 
They shook up and hooked up to respirators 
On they last breath talking to investigators 
I'm a breath of fresh air 
And a fresh pair 
Face it boo and do it till your face get blue 
And then BREATHE 

[BRIDGE] 

[HOOK I]

[HOOK II]

When the crew walk in it 
Pop a few corks in it 
As quick as a tick in a New York minute 
Catch a breath, fore u catch a left 
Even worse, catch a Tef 
Only way u catch a F 
To the A-B, its in the maybe 
Rollin with my baby 
Grippin on a toy that you won't find in +KayBee+ 
I rhyme slick on ya 
I'm a have to put the Heimlich on ya 
What you know bout lettin' dimes lick on ya?
While you inhale the weed 
And it won't stop till they inhale ya seed
And it don't stop I tell em' to breathe 
Like a doctor with a stethoscope 
I don't see no fuckin hope 
Unless these motherfuckers BREATHE 

Yeah, Brooklyn gotta
Uptown gotta
the Bronx gotta
Queens gotta
Staten Isle gotta
You niggas gotta
You bitches gotta
Everybody BREATHE 

One and then the two 
Two and then the three 
Three and then the four 
Then you gotta.. BREATHE
Then you gotta.. 
Then you gotta.. 
BREATHE
Oh* BREATHE
BREATHE 
Oh* BREATHE
BREATHE
BREATHE
Oh* BREATHE
BREATHE"
"eventtime","2004-10-04 14:22:00"
"current_moodid","113"
"url","http://headin-4-hell.livejournal.com/4436.html"
"userid","6157"
"itemid","15"
"event","I wanna know you name and
I wanna know if you gotta man (I wanna know)
I wanna know everything
I wanna ya number and if I can come over and
I wanna know what ya like
I wanna know so I can do it all night
But you're telling me I'm just a friend
You're telling me I'm just a friend

Oh baby you (oh baby you) 
Got what I need (got what I need)
But you say I'm just a friend (say I'm just a friend)
But you say I'm just a friend
Cos I can be your (cos I can be your)
Fantasy
But you say I'm just a friend (say I'm just a friend)
But you say I'm just a friend

I wanna know you in and out
I wanna know what you're all about (I wanna know)
I wanna know what makes you laugh
I wanna know about your past
I wanna know how you move
I wanna know so I can move too (I wanna know)
But you're telling me I'm just a friend
Telling me I'm just a friend

Oh baby you (oh baby you) 
Got what I need (got what I need, yeah)
But you say I'm just a friend (say I'm just a friend)
But you say I'm just a friend
Cos I can be your (girl I can be your)
Fantasy (fantasy, yeah)
But you say I'm just a friend (say I'm just a friend)
But you say I'm just a friend

(Woah oh baby you) Oh baby you 
Got what I need (got what I need, yeah)
But you say I'm just a friend (say I'm just a friend)
But you say I'm just a friend
(Woah) Cos I can be your 
Fantasy ( fantasy, yeah)
But you say I'm just a friend (but you say I'm just a friend, girl)
But you say I'm just a friend

(Oh, can you) Give me one reason why (why)
You wouldn't want this kinda guy
Cos I stay hip (??) I stay laced
And I know you know I'm fly
Girl, stop playing games wit me
And let's get it on tonight (tonight)
You got nothing to lose
Let me do what I do (what I do)
Oh baby you
Oh baby you
Got what I need (got what I need)
But you say I'm just a friend (say I'm just a friend)
But you say I'm just a friend
(Just wanna be your) Cos I can be your 
Fantasy (fantasy, girl)
But you say I'm just a friend (but you say )
But you say I'm just a friend

Oh baby you (oh baby you)
Got what I need (got what I need)
But you say I'm just a friend (say I'm just a friend)
But you say I'm just a friend (say I'm just a friend)
Cos I can be your 
Fantasy (Can I be your fantasy)
But you say I'm just a friend (Come on girl )
But you say I'm just a friend

You can call me anytime you like (oh anytime)
It doesn't matter day or night ( said it doesn't matter)
We can do whatever you (ohh)
Wanna do it's up to you
Don't fight the feeling that you feel (don't fight the feelin)
I can tell that its real (oh girl)
So won't you have me as your man
Why you say I'm just a friend

Oh baby you (oh baby you)
Got what I need 
But you say I'm just a friend 
But you say I'm just a friend 
Cos I can be your 
Fantasy (Can I be your ...I can be your fantasy)
But you say I'm just a friend 
But you say I'm just a friend (Mario...Mario ...)"
"eventtime","2004-09-07 18:08:00"
"current_moodid","9"
"url","http://headin-4-hell.livejournal.com/3905.html"
"userid","6157"
"itemid","14"
"event","[50 Cent]
Yeah, this somethin special y'know, somethin epic
Lloyd Banks, you know
Cause a nigga thuggin don't mean he don't
Don't wanna see you smile baby

[Intro: 50 Cent]
Wooo! I wanna be the reason you smile
I wanna be the reason you smi-ile
I wanna be the reason you smile
After you wipe away your tears and dry your eyes

[Verse One: Lloyd Banks]
I'm gettin the feelin you wanna take revenge
From the conversations we have and the way it ends
You wanna discuss me in front of your lady friends
That's why it's just me and my Mercedes Benz
It all depends, maybe if we make amends
We can start from scratch
Learn to control your temper and remarks in fact
We plan to be platonic with our hearts in tact
So everytime we seperate, somebody's marchin back
You're amazing in the sack
Eyes slanted like you're Asian, but you're black
God Bless whoever gave you alla that
If you seen her from the back
You'd understand why dis feel like that
And ain't a flaw to her toes, the Lord knows
Her pussy good enough to miss award shows
And I ain't gotta say nothin, she just knows
By the way I look at her to take off all her clothes
Up and down

[Chorus: Lloyd Banks + (50 Cent)]
Whenever I'm not around, and you feelin down
Let the thought of me be (I be the reason you smile)
I don't wanna see you frown, like them kids watch a clown
I wanna bring you joy and be (I be the reason you smile)
Baby, you know my style, you know how I get down
I provide by any means to be (I be the reason you smile)
We done been through ups and downs, had drama for a while
I'm just happy I'm around to be (I be the reason you smile)

[Verse Two: Lloyd Banks]
The main reason I been lookin at you pitiful
What about the half of this shit I done did to you
Violated and tip toed into a crib or two
I've come clean to be a bigger individual
Even though you're busy boo, the evening's when I visit you
Kinda makes me feel lucky, cause I see niggaz
when you tease 'em with your physical
She wanna rack up her brooms, I ain't got no more room left
Wild drama, section 8 princess
My foreign chick bad, but she been stressed
Cause it's hard to communicate
Cause she don't speak-a no english
I been around the world from state to state
But now I'm back bustin in your bathroom
Got you laughin in your shower cap, let's get it on
Cause I'm leavin in a hour, fly-through, don't matter she's mad
Even when I holla back
All I really need your attention for a while
And, I bet you I can make you smile

[Chorus - 2X]"
"eventtime","2004-07-09 01:20:00"
"current_moodid","16"
"url","http://headin-4-hell.livejournal.com/3623.html"
"userid","6157"
"itemid","13"
"event","[Eminem:] So I changed huh? You got a phone, pick it up, call me

[Chorus: Eminem] 
How come we dont even talk no more
And you dont even call no more
We dont barely keep in touch at all
And I dont even feel the same love when we hug no more
And I heard it through the grape vine we even beefin now
After all the years we been down
Aint no way no how, this bullshit can be true
We family and aint a damn thing changed, unless it's you

[Verse 1: Eminem]
So young, so full of life in vibrant side by side wherever you weres ridin i went
So close, almost on some bonnie and clyde shit
When ronnie died you weres right by my side with a sholder to cry on
Tissue to wipe my eyes, and a bucket to catch every tear i cried inside it
You even had the same type of childhood i did
Sometimes i just want to know why is it that you surcame to yours
And mine i survived it, you ran the streets, i 9 to 5'd it
We grew up, grew apart, as time went by us, then i blew up
To both yours and mine surprises
Now i feel the vibe i just cant describe it
As much as your pride tries to hide it
Your cold, you touch its like ice
In your eyes is the look of resenment
I can sense it, and i dont like it

[Chorus]

[Verse 2: Kon Artis]

It was my dream at first to be on spittin a verse
On my own album with a deal but shit got burst
So i came out i woulda killed a nigga first
Before i let him disrespect me and check me over some worste
Some bitch that i wasnt with i would hit her then quit
But you would pull a talk with her and tell her she was the shit
I told you dont get involved in it, you was smokin the chron with her
Comin out of the bar with her stumblin half drunk
Like yall was husband and wife or somethin
But me catchin you fuckin other niggers musta hurt you pride or somethin
Cuz you wont fuck at the mouth with people like you wanted with me
When all i tried to do was show your bitch was shifty
And ever since the fans and all the shit that i produced
You actin like i aint you man and lyin like she can't be loose
But i am really you friend, i'm jus trying to tell you the truth
But dont hate the game or the player
Cuz the one that is changing is you

[Chorus]

[Verse 3: Proof]

You're only at the top cuz my homie had to stop
Now we actin like i gotta live only for the block
Homies in the hood only she be on the tube
Only gossip on the porch get to speakin on who
Fools i used to rap with all expect magic
Like my finger get to snappin and *poof* it jus happen
But PROOF is jus actin out the party was stoned
Shady made it so my babys aint starvin at home
See the devil in you grin since the ghetto we been friends
Whenever real intelligence thats forever till the end
I be the hatred in your eyes and the satan in your lives
And wastin my times with these snakes in disguise
(how come) when you talk its with bitter is fight
And (how come) it's my fault for what you did with your life
And everytime i go to hear you and play you look away
We barely embrace, you can't even look me in my face.

[Chorus]"
"eventtime","2004-06-17 04:06:00"
"current_moodid","49"
"url","http://headin-4-hell.livejournal.com/3530.html"
"userid","6157"
"itemid","12"
"event","[Chorus]
I take a couple uppers
I down a couple downers
But nothing compares
To these blue and yellow purple pills
I been to mushroom mountain
Once or twice but who's countin'
But nothing compares
To these blue and yellow purple pills

[Eminem]
Cool, calm, just like my mom
With a couple of valium inside her palm
It's Mr. Mischief with a trick up his sleeve
To roll up on you like Christopher Reeves
I can't describe the vibe I get
When I drive by 6 people
And 5 I hit
Ah shit
I started a mosh pit
Squashed a bitch
And stomped the foster kids
These shrooms make me hallucinate
Then I sweat till I start losing weight
Till I see dumb shit start happenin'
Dumber than Vanilla Ice tryin to rap again
So bounce, bounce, c'mon bounce
I said c'mon bounce
Everybody in the house with a half an ounce
Not weed I meant coke dumb ass sit down
We don't bullshit, better ask around
D12 throws the bomb and's dashing town
Bizarre, your mom is passing out
Get her ass on the couch 'fore she crashes out

[Kon Artist & Kuniva]
Fuck that, someone help Denaun
He's upstairs naked with a weapon drawn
Hey Von
You see me stepping on these leprechauns?
It gotta be acid cuz the X is gone
Ya I took them all dog with some parmesian
And I think my arm is gone
It's probably numb
Young, dumb, and full of cumm
And I think he 'bout to swallow his tongue
Scary ass it was a false alarm
You think I'm 'bout to die when I just got on
So stop acting stupid
You so high
That you might wake up with a guy
On some new shit
I think I did too much
This substance equals cups
Red pills, blue pills, and green
Big pills (That's ill)
Mescaline

[Chorus]

[Hook]
Dirty Dozen
80 of us
Shady brothers
Ladies love us
That's why our baby mothers
Love us but they hate each other
They probably wanna take each other out
And date each other
Some-, something, something, something
Something, something, something, something

[Proof]
Pop pills
Pills I pop
Pop two pills
On stilts I walk
Snorted two lines that were filled with chalk
Thought it was Incredible I killed the Hulk
I wanna roll away
Like a rollerblade
Until my eyes roll back in my skull for days
And when I'm old and gray
Look for coke to smoke
I overdose 
When I pack up my nose with coke
*cough cough cough*
Am I supposed to choke
Had an accident when the Trojan broke
Ahh, poor baby
Born by whore lady
And I'm gonna strangle a - (You're crazy!)

[Swifty]
I pop four E's at one time
And I don't need water when I'm swallowing mine
(You got any shroom?)
Does Bizarre smoke crack?
We can't get job
Because our arms show tracks
Why the hell you niggas think I rap?
I do it just to get your company hijacked
If you like smack
Then I might too
(Swift, chill)
I just wanna get high like you
And I don't give a damn if they white or blue
Speed, shrooms, down the valiums
Even smoke weed outta vacuums
I just got some and I'm going back soon

[Chorus]

[Bizarre]
I'm at rave
Looking like a slave
High off chronic
Gin and tonic demonic
Body smelt like vomit
Pussy poppin', acid-dropping, dope heavy guy
Heroine mescaline pencilneck, wanna try 
Blue pills, golden seals
Got Bizarre actin' ill
Drugs kill (Yeah, right)
Bitch I'm for real
Shut your mouth you dirty slut
You know you want it in your butt
I'll put it in your cunt
Let Bizarre nutt

[Chorus]"
"eventtime","2004-06-16 11:06:00"
"current_moodid","31"
"url","http://headin-4-hell.livejournal.com/3205.html"
"userid","6157"
"itemid","11"
"event","yea well a friend just said they have been cuttin themselves and i promised to to tell any one so i wont cause no one reads my journal so y do i have one. hmm... a well to all u ppl who might look at this remember your reading a genuoisis work here lol. Oh well i can say wat eva i want cause no one will ever read this but me and my online friends who understand me (yes avery who understand me) well im bored and im gonna stop now after this last announcement, if ur ever bored check out this website   www.runescape.com  if u ever play it and get past the tutorial add southruler to ur friends list and talk to me if i am on. well peace out bitches."
"eventtime","2004-06-13 04:07:00"
"current_moodid","53"
"url","http://headin-4-hell.livejournal.com/2844.html"
"userid","6157"
"itemid","10"
"event","SLIPKNOT- WAIT AND BLEED


I've felt the hate rise up in me... 
Kneel down and clear the stone of leaves... 
I wander out where you can't see... 
Inside my shell, I wait and bleed... 

Goodbye! 

I wipe it off on tile, the light is brighter this time 
Everything is 3D blasphemy 
My eyes are red and gold, the hair is standing straight up 
This is not the way I pictured me 
I CAN'T CONTROL MY SHAKES! 
How the hell did I get here? 
Something about this, so very wrong... 
I have to laugh out loud, I wish I didn't like this 
Is it a dream or a memory? 

GET OUTTA MY HEAD CUZ I DON'T NEED THIS! 
Why I didn't I see this? 
I'm a victim - Manchurian Candidate 
I - HAVE - SINNED - BY - JUST 
Makin' my mind up and takin' your breath away 

GOODBYE! 

You haven't learned a thing 
I haven't changed a thing 
My flesh was in my bones 
The pain was always free 

I've felt the hate rise up in me... 
Kneel down and clear the stone of leaves... 
I wander out where you can't see... 
Inside my shell, I wait and bleed..."
"eventtime","2004-06-06 21:46:00"
"current_moodid","5"
"url","http://headin-4-hell.livejournal.com/2566.html"
"userid","6157"
"itemid","9"
"event","I push my fingers into my eyes... 
It's the only thing that slowly stops the ache... 
But it's made of all the things I have to take... 
Jesus, it never ends, it works it's way inside... 
If the pain goes on... 
Aaaaaaaah! 

I have screamed until my veins collapsed 
I've waited as my time's elapsed 
Now, All I do is live with so much fate 
I've wished for this, I've bitched at that 
I've left behind this little fact: 
You cannot kill what you did not create 
I've gotta say what I've gotta say 
And then I swear I'll go away 
But I can't promise you'll enjoy the noise 
I guess I'll save the best for last 
My future seems like one big past 
You're left with me 'cause you left me no choice 

I push my fingers into my eyes 
It's the only thing that slowly stops the ache 
If the pain goes on, 
I'm not gonna make it! 

Pull me back together 
Or separate the skin from bone 
Leave me all the Pieces, then you can leave me 
alone 
Tell me the reality is better than the dream 
But I found out the hard way, 
Nothing is what it seems! 

I push my fingers into my eyes 
It's the only thing that slowly stops the ache 
But it's made of all the thing I have to take 
Jesus, it never ends, it works it's way inside 
If the pain goes on, 
I'm not gonna make it! 

All I've got...all I've got is insane... 
All I've got...all I've got is insane... 
All I've got...all I've got is insane! 
All I've got...all I've got is insane! 

I push my fingers into my eyes 
It's the only thing that slowly stops the ache 
But it's made of all the thing I have to take 
Jesus, it never ends, it works it's way inside 
If the pain goes on, 
I'm not gonna make it!"
"eventtime","2004-06-04 17:39:00"
"current_moodid","5"
"url","http://headin-4-hell.livejournal.com/2328.html"
"userid","6157"
"itemid","8"
"event","MEMPHIS BLEEK

They Will Never Play Me

This for my thug, thug
Drug, drug
And guns, guns
Come on, come on
Come on, it's the ROC nigga
Yo, yo

Ayo niggas wanna hate me cause I run thugs
Show no love and my guns bust
And I got your bitch on my nuts and I push two trucks
You niggas out here gone do what?
Nothing but talk about it
You niggas ain't bout it, bout it
You see Bleek
J-I-G from the hat to sneaks
Dem them jordans but what's important
You niggers scheming
I told ya'll, I got my mind right
And my money right
I brought a new tech and believe my shit air right
The game nigga love it, leave it
It ain't gone change nigga
From my hood to your hood
This shit the same nigga
You see me hopping out
Coping that Belv
I ride for my family
Fuck could you tell me
Its ROC La Familia
No one down with us
No one ride with us
No one side with us
We came gunning
Busting fuck it, it aint nothing
I got mine now get yours
And nigga stop frontin'

[1] - Still these niggers hate me
But I sit back and laugh
I got cash, I play the back
And I be counting my math
And they will never play me
I got guns, I got ones, I got sons
I got niggas who could get that done

And still these niggers hate me
But I sit back and laugh
I got cash, I play the back
And I be counting my math
And they will never play me
I got guns, I got ones, I got sons
I got niggas who could get that done

Yo, ayo I get's it crunk with that pump
Or letting that pistol blow
Niggas hate but I'm sticking this dick down they bitches throat
I hear them saying
He only sold half a mill
You know what I'm saying nigga I spend half your deal
So go ahead with that dumb shit
I push tinted SUVs
Which is one bitch
With that fifth in just one clip
My fans asking me bleek, you dissing squads?
Ma im dissing everyone
And everyone feel they involve
Who ever hating
Contemplating about my situations
Wanna know my moves
Wanna find out if a nigga station
Wanna know the co'ds
Wanna know if I get low my company
Do I got chrome
Nigger don't compare me to Jay-Z
I pop my collar, hollar
All about the drama blowing scama
Pockets stay filled with that good marijuana
But you lames hating
Cause I'm in the lake on them daytons
Taking pictures, hitting switches
Pulling over bad bitches
I'm laying right
My dogs stay they eating right
Guns looking right
And dog I bust them right
For that brick
For that check
For that coke
For that flow
Dog I let's them go
Set up shop and blow"
"eventtime","2004-05-31 15:06:00"
"current_moodid","49"
"url","http://headin-4-hell.livejournal.com/2169.html"
"userid","6157"
"itemid","5"
"event","I'm so happy. Cause today I found my friends. 
They're in my head. I'm so ugly. But that's ok. 
'Cause so are you. We've broke our mirrors. 
Sunday morning. Is everyday for all I care. 
And I'm not scared. Light my candlrs. In a daze cause I've found god. 

Yeah (x bunch of times) 

I'm so lonely. And that's ok. 
I shaved my head. And I'm not sad. And just maybe. 
I'm to blame for all I've heard. And I'm not sure. 
I'm so excited. I can't wait to meet you there. 
And I don't care. I'm so horny. But that's ok. My will is good. 

Yeah (x bunch of times) 

(Chorus) I like it. I'm not gonna crack. 
I miss you. I'm not gonna crack. I love you. 
I'm not gonna crack. I kill you. I'm not gonna crack. (x2) 

I'm so happy. Cause today I found my friends. 
They're in my head. I'm so ugly. But that's ok. 
'Cause so are you. We've broke our mirrors. 
Sunday morning. Is everyday for all I care. 
And I'm not scared. Light my candlrs. 
In a daze cause I've found god. 

Yeah (x bunch times) 

(Chorus).."
"eventtime","2004-05-29 13:17:00"
"current_moodid","24"
"url","http://headin-4-hell.livejournal.com/1495.html"
"userid","6157"
"itemid","4"
"event","Rape me, Rape my friend 
Rape me, Rape me again 

I'm not the only one 
I'm not the only one 
I'm not the only one 
I'm not the only one 

Hate me, do it and do it again 
waste me, rape me my friend 

I'm not the only one 
I'm not the only one 
I'm not the only one 
I'm not the only one 

My favorite inside source 
i'll kiss your open sores 
I apperctiate your concern 
you'll always stink and burn 

Rape me, Rape me my friend 
Rape me, Rape me again 

I'm not the only one 
I'm not the only one 
I'm not the only one 
I'm not the only one 

Rape me (Rape me) 
Rape me (Rape me) 
Rape me (Rape me) 
Rape me (Rape me) 
Rape me (Rape me) 
Rape me (Rape me) 
Rape me (Rape me) 
Rape me (Rape me) 
Rape me (Rape me) 
Rape me (Rape me) 

Nirvana- Rape me"
"eventtime","2004-05-28 21:59:00"
"current_moodid","48"
"url","http://headin-4-hell.livejournal.com/1079.html"
"userid","6157"
"itemid","3"
"event","yo the stuff bellow is from run rabbit run by eminem."
"eventtime","2004-05-24 19:09:00"
"url","http://headin-4-hell.livejournal.com/904.html"
"userid","6157"
"itemid","2"
