"names","values"
"event","So I have one more final.  I'm like, supertired. So I may crawl in bed before I study.

My parents are on their way up to visit for the weekend. I really really wish I could just go home, at least for the weekend.  Everyone else is so excited for the summer, and I stay here for another 3 weeks, bummer.

Tomorrow is my little boy Ben's first birthday.  And he doesn't get to spend it with anyone. how sad.. This dog is a little menace- a holy terror.  I yelled at my mom for not bringing him with them on their journey to the North.

Me: Mom!  It's Ben's first birthday and nobodys there to celebrate with him.
She responds: Don't worry, I didn't tell him so he won't get sad.  We'll have a party when  you get home.
haha, love the mom

On a different note, we're getting a boat this summer.  Which I'm pretty psyched about.  The jetski is ready to go.  So the debate is between a little sport boat (4 passenger) and a bigger one (7 people holder) 
I don't care.  The bigger one will have a back so I can lay out on it.... ahhhhhhhhhhhh. homeeeee!  
a summer of boating, sun, some work when i have to, interning at the best news station in columbia, and wakeboarding til i cant anymore

did i mention i get to spend it all with my best friend too???!

on that note, time for a nap"
"eventtime","2005-05-06 18:58:00"
"current_moodid","120"
"url","http://ltlbamagrl.livejournal.com/1262.html"
"userid","9296"
"itemid","3"
"event","ok, maybe this is overkill, but seriously.  
i've never had sadder goodbyes... actually i have, but.  tonight sucked. i just wanted to snuggle with abear forever, haha. and she kicked me out, andddddd I WAS SOBER THIS TIME!  jeez 

Between Amy and Abear in bed tonight. 
britt's cracked out eyes
favie's weirdo laugh
and my freakin italian hands, and the ""dorothy""

oh man... you guys.  
definitely the best year here. 

make sure you i see your stupid faces tomorrow or i will make personal trips to stamford and west haven this weekend.
to kick your pooters

 
""There's a new wind blowing like I've never known.
I'm breathing deeper then I've ever done.
And it sure feels good to finally feel the way I do""

how did she put it????  .all thats left is white walls & crazy memories...till the fall...bittersweet goodbyes =(

<3 bitchesss"
"eventtime","2005-05-06 00:05:00"
"current_moodid","54"
"url","http://ltlbamagrl.livejournal.com/829.html"
"userid","9296"
"itemid","2"
"event","It was a cry-fest in 252 today.  Wow, I wasn't expecting it.  Abear's leaving tomorrow morning, and she's the one first one.  Amy goes Friday, and Britt leaves for a week- then she's back.  Thank God.
It'd probably be the longest month of my life if they were all leaving.
yeah, yeah, yeah.

I hate getting all mushy. I don't do that. I get mad, ha, yeah, more often than maybe I should.  But when I get upset, ewww.   


I get a lot of crap when I go home for turning into this ""yankee"", whatever.  I'm not even sure what it is.  To me it screams ignorance... but, its funny to listen to people at home tell me how i'm so terrible because i didn't come back to USC. Can I just tell you how glad I am I didn't go back???! Yeah, I wish I could go home whenever I wanted, for the weeekend... But GOD, I wonder who I would be if I hadn't stayed in Connecticut. 
People at home look at me like, what were you thinking???  And I laugh... I want to yell, ""ARE YOU KIDDING?! USC BLOWS, wait, all in state schools do"" Storrs isn't the greatest, but my friends in Storrs are.

Its funny how southerner's hate the North, but northerners laugh at us. 
Blah blah blah.  I love where I'm from, home is home, no matter where you're from. And no matter where you go, you always remember where you're from.  But I really think if I had stayed at Carolina I would have been absolutely miserable...  And if you know me, you know why.  I probably wouldn't have moved on with my life, at least for the moment. 

I want to go home so much, but.....  to be completely honest.  Home is depressing.  Everyone's the same.  Home is here now..  I'm not sure how I feel about that, but this is where I am most of the year.   
And this is where I'm happy.  wow..... never thought I'd say that-

OK< ENOUGH GUSH.  I have 2 hrs of the OC waiting on me.
PEACE OUT MOTHA"
"eventtime","2005-05-05 18:55:00"
"current_moodid","63"
"url","http://ltlbamagrl.livejournal.com/691.html"
"userid","9296"
"itemid","1"
"event","I think it's just one of those weeks everyone wishes was over.  I'm in the midst of finals, still have three more.  
And I'm not even excited that I'll be done.  I finish Saturday morning, and I start Research Methods (the worst class ever in COMMS) monday at 1.
hoorah

Overall the school year has been amazing. 
I've been pretty stressed the last couple of weeks, ha.  That's an understatement I guess. The other day I really needed to study, but I was a in a foul mood, and the only thing that cheered me up was packing, so thats what I did.

I'm going to miss a lot of people when I go home for the summer, but I can't wait to get home. a little more than 3 weeks!!!!


Greatest lesson learned this year: just laugh.
He who laughs, lasts."
"eventtime","2005-05-05 12:17:00"
"current_moodid","4"
"url","http://ltlbamagrl.livejournal.com/456.html"
"userid","9296"
