"names","values"
"itemid","33"
"event","It is a particular and discouraging habit of the Maywood Hall staircase to prefer alcohol almost exclusively over any other beverage.  I say this not because I disapprove of driving alcohol (I myself have been known to share jello shots with my legally mature friends), nor do I say this because I think it is wrong for staircases to consume food and drink.  I am bothered most by the manner in which the staircase presents itself late of a sunday night.

There are plenty of responsible drunks, taking their rum in selver flasks, clean shaven, neatly dressed, with only a slight gleam in their eye and a minor slurring of speech and general wobbliness to their motions giving evidence to thoir intoxicated interiors.  But this staircase -- and I'm speaking in particular of the one residing close by the main entrance to Maywood Hall -- this staircase is *not* such a drunk.  This staircase is somewhat of the sloppy sort, spilling its beer all over its steps, collecting fries and other remnants of disorderly trips to nearby Wendy's.  This staircase takes no pride in its appearance and even on weekdays is generally known to associate with the sort of people fathers try their hardest to keep their daughters from.

Let it be known that I do not dislike this staircase.  and while my visits may not be of the most prolonged sort, I do enjoy the company of this staircase (admittedly more so on its better days).  I don't believe the staircase is all bad.  It is just that it behaves a bit immature for its age and perhaps should consider seeking out new friends, ones who won't promote such disorderly and licentious behaviour.

When a staircase falls in with the wrong crowd, it is bound to make a few mistakes.  It is my opinion, however, that the overall comportment of this particular staircase suggests a deeper malaise.  Surely this staircase feels a certain dissatifaction with its life, and I do know that it has a hard time sleeping at night.  Indeed, it doesn't get out much at all.  It would not be surprising should this staircase fall into poor health.

It is our responsibility, as friends and companions of this staircase, to help it out in any way that we can.  Can we allow any member of our community to suffer such indignities as this staircase allows itself to perform upon its very own person?  Indeed we cannot.  It is up to each and every one of us to be friendly and kind toward our neighborhood staircase.  We must be careful not to jostle its arm at parties.  We must encourage it to give up littering and its other small vices.  We must teach it to wash itself daily, and exfoliate.

We can fill the staircase with renewed self confidence.  We can help it to wake up every morning clean and refreshed from a good night's sleep.  We can show it that daily hangovers do not need to be sufferend and that there is a better, more respectable life available for it if it would just spend a little more time considering how its appearance affects the people around it."
"eventtime","2004-12-13 04:30:00"
"current_moodid","107"
"url","http://navelofbacchus.livejournal.com/8454.html"
"userid","10791"
"itemid","32"
"event","Zach and I were sitting around yesterday, as we do sometimes, watching the Red Sox and contemplating orgies.  We found ourselves trying to determine what actually constitutes and orgy.  What basic rules have to be satisfied in order for an orgy to be happening?  We came up with the following postulates.

Four Postulates Constituting an Orgy
1. Minimum 4 people
2. A pairing of maximum 2 people on 1 other person according to the participants' sexual preferences must be possible.
3. If you avoid pleasuring or being pleasured by more than one person during the course of the orgy, you are not part of the orgy.
4. Any participant can be linked to any other by a chain of interaction, where each link in the chain is a person giving pleasure to or receiving pleasure from another, at some time.

Drafted by Zach Pardos and Greg Hollands with Contributions by Jesse, Mike,  Tim, and Corinne.

We think that these 4 rules are sufficient to define an orgy and differentiate between an orgy and other types of sexual activity.  I shall proceed now to explain each of the rules more in depth.

--Rule #1, Minimum 4 people--

a. One person masturbating does not constitute and orgy, ever.
b. Two people having sex or masturbating together or participating in some other sexual activity are not having an orgy.
c. Three people, whether it be one guy and two girls, or one girl and two guys, are having a three-some, not an orgy.  You may note that rule number two describes a ratio whereby an orgy may consist of a number of three-somes, however after much deliberation we have determined that one three-some in itself does not constitute an orgy.
d. Four people are the minimum number possible to create an orgy, but four people do not constitute an orgy in all situations.  One guy pleasuring 3 girls, supposing that the girls themselves are not pleasuring each other but are only pleasuring the guy, is not an orgy.  One girl and 3 guys is a gang bang not an orgy, unless some of the guys are bi and are interacting with each other in that way.  It is crucial that an orgy satisfy Rule #2, because that rule sets a certain ratio of possible interaction.  Without that interaction an orgy is not possible.  Four people can make an orgy in situations where there is a chain of interaction longer than 1 link between any two people.  A guy and 3 girls does constitute an orgy if at some point two of the girls are going at each other.    A situation where a girl is giving head and being fucked by two guys is not an orgy unless one of the guys is also interacting with another person, perhaps he himself is being fucked while he is fucking.  Two couples having sex next to each other do not constitute an orgy unless the couples interact sexually at some point, perhaps the girls would make out, hopefully going farther.

I'd like to point out here that our definition of an orgy does not specify which sexual acts are acceptable and which aren't.  It may be possible to envision an orgy according to our definition wherein no penetration is involved, only oral sex and kissing.  However, it is impossible for an orgy to be composed of only kissing if it is to comply with Rule #2.  A person cannot kiss two people at the same time.

e. It is easy to imagine how five people can constitute an orgy, and it has been suggested to us that 5 is the minimum number of people for an orgy.  Arguments have been raised that two couples switching partners are only swinging, and are not in fact having an orgy.  I disagree.  If the couples switch partners and then go and have 1-on-1 sex together, that is definitely swinging and not an orgy.  However, if the couples have sex next to each other and then switch partners without ceasing to have sex, it surely must be an orgy.  I think the important point to note here is that a number of people performing sexual acts upon one another each at a separate time, though perhaps in quick succession, does not constitute an orgy.  This is where Rule #3 comes into play.  If there are enough people that some are sitting out, then those people are required to go at each other if they are participating in the orgy.  To be there and not be willing to participate given the opportunity is to be leaving the orgy, if only temporarily.


--Rule #2, A pairing of maximum 2 people on 1 other person according to the participants' sexual preferences must be possible.--

This rule was originally conceived to avoid using a direct ratio of guys and girls.  It has expanded from the proposed 2/5 girls to 3/5 guys as a minimum of the number of girls required to avoid the gang bang scenario.  The idea is that people must be willing to interact with each other.  If you have 3 straight guys, 1 straight girl, and two lesbians, then you achieve the ratio but do not comply to our rule.  The lesbians would not interact with the straight guys and would not be part of the orgy.  The 3 straight guys would never interact with each other and a gang bang would ensue.  No matter what sexual preferences people have, it must be possible to pair them all up so that 2 people on 1 other person is the maximum.  While 3 on 1 or greater ratios are not disallowed in an orgy, in those situations the people participating would naturally be going at each other while they are going at that one favored individual.

In the case of a very large orgy, with perhaps over 30 people participating, it may not be easy to look at the group and apply this rule.  Surely the majority of the orgy would comply with this rule if it is to avoid becoming a series of gang bangs next to each other.  It is possible that a gang bang could exist within an orgy, however if this ratio is satisfied then for a solitary gang bang to occur then some one person, who could be pleasuring or being pleasured by one of the many that is going at that one, would either have to sit out for a bit, join in the gang bang in such a way that it becomes an orgy, or join another group and thus raising that group over the 2-on-1 cap.  It absolutely must be possible for everyone to be paired up in 2-on-1 maximum groupings at some point during the course of the orgy.  This does not preclude a chain of people interacting where a number of people are interacting with 2 others all together and intertwined in one large group.


--Rule #3, If you avoid pleasuring or being pleasured by more than one person, during the orgy, you are not part of the orgy.--

Originally we had a rule giving the maximum number of solitary masturbators at any given point, however we found that rule to be insufficient in the case of large orgies where solitary masturbators may not notice each other and not realize that they had opportunity to pleasure each other.  We created this rule to cover that situation.  It gets at the attitude the participants must have.  Everyone must be willing to have sex with anyone else that fits their preferences.  In the example of a guy going to an orgy with his girlfriend, if he has sex with only her while she participates with others, then it is unlikely that he is part of the orgy.  However, it may be the case that he never has the opportunity to pleasure or be pleasured by anyone else.  Perhaps they showed up late, or maybe there's an inordinate number of gay guys and lesbians.  Whatever the case, as long as he's willing and ready and isn't avoiding participation, then he can be considered part of the orgy, though he may not have participated as much as others have.


--Rule #4, Any participant can be linked to any other by a chain of interaction, where each link in the chain is a person giving pleasure to or receiving pleasure from another, at some time.--

Here, we were trying to avoid the possibility of multiple people having sex next to each other, or having multiple three-somes in close vicinity.  While this may occur at an orgy, the crucial difference is that at the orgy the participants of one group will switch up and participate with another group.  Because they switch partners, the interactions become more complex and various.  Indeed, there may even be a main orgy with a three-some next to it, although that three-some would not be part of the orgy unless some of the members participate in the main orgy.  Since one of the qualities of an orgy is that people switch partners, participants in an orgy should be able to be linked to each other by following the interactions between people as one would follow links on a chain.  You could list all the participants' names and draw lines between the people who have interacted with each other.  Picking any two people on that list, you must be able to follow the lines of interaction from the one to the other.

If two couples are having sex and then the girls start making out or pleasuring each other in some other way, then the guys are linked together via the girls though the guys may not have directly interacted with each other at all.  In this way, each two-some or three-some during the course of the orgy would be linked to the rest of the orgy by some or all of the members going and participating in other groupings within the orgy.


--
I think these 4 rules are sufficient to describe an orgy, however it is still possible that they may need refinement.  If you can think of an example which counters these rules, I encourage you to comment on it so that these rules may be improved."
"eventtime","2004-10-27 14:52:00"
"url","http://navelofbacchus.livejournal.com/8315.html"
"userid","10791"
"itemid","31"
"event","the following is an excerpt from a conversation that may show some sort of insight into my soul.  Then again, maybe it's just me babbling again.
note: this message has been modified for easier reading


sdnalloh (12:30:21 AM): and i was hanging out with a girl in a really fucking short skirt all day and now i'm horny as all hell, thus my cunt comment.

HonestIago6 is idle at 12:37:28 AM. 

sdnalloh (12:37:33 AM): awww man

Auto response from HonestIago6 (12:37:33 AM): I'd rather be in Chyna 

sdnalloh (12:37:41 AM): How can you leave me at a moment like this?  Now i'm gonna cry about how my friend mike doesn't love me, and i'll sob and sob, and then we'll have passionate hate-sex in the bathroom while i'm vomiting in the toilette.  I'll cook the solid chunks into the omlettes at breakfast the next morning, every bite full of runny half-digested lasagne.  Like christ on the cross, you will be crucified to your seat, spikes through your feet into the floor, your hands held similarly on each side of the plate.  Eat your food like an animal.  You won't be able to get up until you're done, but don't worry, you'll come back to life in a blissful reawakening as a highly evolved and violent man who's very fond of hammers and what they can do to the skulls of people who piss you off.

btw, i hope you don't mind that i'm getting out my aggression."
"eventtime","2004-07-12 00:47:00"
"current_moodid","17"
"url","http://navelofbacchus.livejournal.com/8080.html"
"userid","10791"
"itemid","30"
"event","i was playing monopoly with greg and asa in their tiny living room.  The room itself is a trap for spare energy.  Like a whirlpool it sucks you in and spins you around.  You get tangled in the threads of the couch.  your feet become trapped by the pressure between the table and the couches.  Unable to move, i floundered there amongst the empty cups, the ashtrays and the monopoly money.

Zach came and disturbed the room's delicate web.  He spilled the monopoly money and sapped our attention.  He wanted to go to the bar, but trapped as i was i could not extract myself from the room.  pleading loyalty to the board game i had caused, i explained that i could not leave until the game was done.  But Zach would not sit there and be caught in the room's nasty web.  He sat quietly and was gone.

In a three-way deal each of us had gained a monopoly, and by now we each had two.  Asa and Greg each had one of those dual-property monopolies around start, greg owning the more expensive of the two, and the game was locked tight in that final struggle either to build fast or be crushed. Soon enough i landed on Park Place, and not long after Asa too fell to Greg's corporate might.  

But we were still trapped in that godforsaken room.  A giant television commanded a focal point in the room.  The stereo's scratched cds kept skipping as muted music spilled densely into the air from behind cloth curtains.  I could do nothing but fidget, having now exhausted the mental stimulation of the room.  My thoughts were being slowly drained from me and i nodded my head as a slow stupor washed over me.  

Could it be that this is what it feels like for a fly as it lies trapped in the spider's web?  The room pulls you in, but it won't let you out.  What a well-designed web it is.    As my active mind slowly fades and is replaced by a complacent, accepting nothingness, i cannot help but think that this is exacty what the fly feels as the spider's poison seeps through its body.  Soon i will be numb and comatose, unable even to comprehend how my body is slowly becoming a spider's human milkshake.

Brandy came, her penciled eyelashes mocking me.  She moved her mouth, but i could not comprehend her words.  Save me, i pleaded with my eyes, i do not want to be devoured by this room.  She grabbed my wrist and pulled me up, out of the room.  Grateful, i provided only verbal protest, glad to be free at last from that horrible trap.  She dragged my by the arm out into the street.  There was zach, using his silence like a powerful magnet, but to me it could do nothing.  i had no outgoing talkativeness that his aura of receptiveness could catch ahold of.  Now that i was free of the room, i needed only to jumpstart my body.  I was like a morose mannequin, unable to interact socially, hardly able even to sustain a linear thought pattern.  I needed a conversation to catch my wandering mind.  I needed to listen and by listening be reminded of what it is to interact in this society i'd been pulled roughly out into.

From living room to car to barstool, i had been transplanted, the same plant in a new environment.  I saw the girls next to me at the back of the bar.  I knew what to do start a conversation, to maneuver onto the dance floor, to make her pretty face glow and her body to adjust itself to the binary cadence of the music, but i could not bring myself to break free of the cocoon that had enveloped me.  I could not push myself out beyond myself.  I could not free myself from the bonds that had seeped into my skin.  I could hardly even follow my physical movements as my mind struggled to acclimate itself to the loud, vibrant atmosphere of this Main Street dance hall.  I sipped my drink through the straw that had been given me and i looked about, through eyes that were not sure how to display themselves.

The girls had wandered off, and I was lost in my introverted world, sipping my drink as fast as i could, hoping the alcohol would give me that push i needed into the extroverted world.  I turned to my left, and zach was gone.  He'd wandered off onto the dance floor.  Brandy had begun talking to some guy.  I was stranded a barstool away from she who had uprooted me.  I was that sad man at the back of the bar drinking himself into oblivion.  I'd spilled on my shirt, my hair was messy, and i was wearing workboots on my feet.  I was not prepared for this situation in the least, and it showed remarkably.  

Brandy turned and saw me.  She motioned for me to sit on the seat next to her.  This is Tim, she said, and Tim proceeded to admonish her for leaving me all alone.  Soon enough, however, they were back into their private conversation and Zach had maneuvered me onto the dance floor.  Standing up, i began to bob my head, to bend my knees, to move my feet.  As my movements became more complex, so too did my thoughts become clearer.  I saw people moving around eachother, through eachother, sitting in corners talking, standing together in clumps.  But Zach continued to push his silent come-hither attitude. He would give to no one and would take from all.

I shared a dance with Brandy and then she turned to Tim.  It was time for me to leave.  Neither the alcohol nor the dancing could break my free of the bonds that had entangled me.  And so i began to walk.  With the cadence of my footsteps, my mind began to follow itself steadily through time.  A linear thought pattern appeared.  Confidently i walked on, watching the cars go by on the street.  The cops passed me and then turned around and passed me again.  i turned up a small side street and began going uphill, back toward that cagey house and near it my car.  A street sweeper was coming down the street toward me and i watched it as it passed.  

I sat down in the light by the side of the curb and contemplated the world.  my thoughts ranged from dentistry to optometry before the street sweeper came back up to my corner.  I waved as it headed off.  I'd found myself again.  I'd broken free of the bonds that had covered me.  I opened the windows and listened to the quiet night sounds as i drove slowly home down tree-lined streets."
"eventtime","2004-06-15 15:44:00"
"current_moodid","101"
"url","http://navelofbacchus.livejournal.com/7927.html"
"userid","10791"
"itemid","29"
"event","This year's Navel of Bacchus is being tentatively scheduled for the second week of august.  tell me what you think.

in case you dont' know what it is:
basically, i go up to my family's place in maine with some of my friends for a week.  All my friend are invited, and everyone is encouraged to bring others.  Use it as an excuse for a road trip if you want.  Of course, no one is obliged to stay the entire time, and some people choose to show up only for the last weekend.  My family's place is deep in the woods northwest of Augusta, in the little town of Rome in the Belgrade Lakes region.  The town boasts a general store, an auction house, and a volunteer fire department as well as numerous farm (note well the lack of a police force).  We stay in a spacious little house on the side of Little North Pond and spend our time hiking, boating, swimming, sailing, and doing various other outdoorsy summer things.  It's a great time.  This will be the Third Annual Navel of Bacchus Celebration.  Last year's experience was dubbed the Cranfasticon, and this year we will continue to carry on that title.

I hope to see everyone there.  If you can't make it (and even if you can) please respond and tell me what you think."
"eventtime","2004-05-20 11:07:00"
"current_moodid","4"
"url","http://navelofbacchus.livejournal.com/7608.html"
"userid","10791"
"itemid","28"
"event","I need to go.  I've been in this house for years and i just need to get out.  There are too many questions, too many deceptions.  An object at rest cannot wake in the morning.  An object in motion is not allowed to stay up all night.  There's too much driving, too much isolation, to much interaction.  Too much of the past comes out and speaks to me in the dark.  i need to go forward and never look back."
"eventtime","2004-05-20 01:28:00"
"current_moodid","127"
"url","http://navelofbacchus.livejournal.com/7253.html"
"userid","10791"
"itemid","27"
"event","Rising from the exertions of procrastinated late night work, one's stomach grumbles its impatience.  Amidst these lugubrations a respite is sorely needed, both for the mind and for the body.  Extended near inactivity requires a bit of stretching, and so one wanders through the building in search for a momentary diversion.  At the vending machine one finds the sought-after conversation, and amidst a slow stream of people coming and going a singular conversation begins.  A dialogue between two people is created, despite the steady replacement of the other side.  The sound of voices in frivolous conversation clears the mind and brightens the spirit, allowing one to return again to the drudgery of scholastic efforts."
"eventtime","2004-04-20 02:37:00"
"current_moodid","88"
"url","http://navelofbacchus.livejournal.com/7111.html"
"userid","10791"
"itemid","26"
"event","There are times when laziness overcomes a person.  Lying in bed will occupy the greatest portion of the day.  Only when the sun is sinking again will vertical movement once more occur.  Can there be any denying the rejuvinative effects of this leisure time?  It is soothing to lie cozy in bed, tied together in the tangles of sheets.

After a slow waking period consisting of hours of lazy movement, wakefulness returns again to the mind.  Rested and charged, a slow, organized energy builds.  There is a surprising amount of focus.  The mind encompasses a vast tract of time in it's thinking.

When an outside force enters this steady realm, it gets caught up in the slow diversity of action.  There can be no quick leaving, no sudden movement.  A myriad of small movements culminate in a greater and more profound final action."
"eventtime","2004-04-12 01:40:00"
"current_moodid","62"
"url","http://navelofbacchus.livejournal.com/6728.html"
"userid","10791"
"itemid","25"
"event","A private owner of a small-town store will keep the prices of his products low; he identifies with his customers and feels that it would be wrong to overcharge them, cheating them out of their money without their knowledge.  However, a store run by businessmen who set the prices without spending time helping in the day-to-day operations of the business will be more likely to cheat its customers.  These owners are more concerned with turning a profit than with providing a service.  They can buy in bulk at the lowest price and stock all their various stores with at prices slightly higher than the local store.  Even if they undercut the locals, their profits will be greater."
"eventtime","2004-03-28 23:14:00"
"current_moodid","10"
"url","http://navelofbacchus.livejournal.com/6606.html"
"userid","10791"
"itemid","24"
