"names","values"
"itemid","192"
"event","I know what you're doing, I see it all too clear
I only taste the saline when I kiss away your tears
You really had me going, wishing on a star
But the black holes that surround you are heavier by far
I believed in your confusion, you were so completely torn
It must have been that yesterday was the day that I was born
There's not much to examine, there's nothing left to hide
You really can't be serious if you have to ask me why
I say goodbye...

'Cause I am barely breathing
And I can't find the air
Don't know who I'm kidding
Imagining you care
And I could stand here waiting
A fool for another day
I don't suppose it's worth the price, worth the price
The price that I would pay

Everyone keeps asking, what's it all about?
I used to be so certain and I can't figure out
What is this attraction? I only feel the pain
There's nothing left to reason and only you to blame
Will it ever change?

'Cause I am barely breathing
And I can't find the air
Don't know who I'm kidding
Imagining you care
And I could stand here waiting
A fool for another day
I don't suppose it's worth the price, it's worth the price
The price that I would pay

But I'm thinking it over anyway, I'm thinking it over anyway

I've come to find, I may never know
Your changing mind, is it friend or foe?

I rise above, or sink below
With every time, you come and go
Please don't come and go

'Cause I am barely breathing
And I can't find the air
Don't know who I'm kidding
Imagining you care
And I could stand here waiting
A fool for another day
But I don't suppose it's worth the price, it's worth the price
The price that I would pay

But I'm thinking it over anyway...I'm thinking it over anyway

Well, I know what you're doing...I see it all too clear........."
"eventtime","2013-12-19 10:04:00"
"current_moodid","25"
"url","http://nocturnalmyrtle.livejournal.com/49229.html"
"userid","11085"
"itemid","191"
"event","I know this might sound weird, but i have never wanted someone I could not have. I mean I have liked one person or another, but it was not like I could not have had them if I had pushed the situation. But I have never liked someone and know that I can not be with them even if I pursued it. I feel so strange and dumb about this. 
That is all"
"eventtime","2013-08-15 21:57:00"
"url","http://nocturnalmyrtle.livejournal.com/48964.html"
"userid","11085"
"itemid","190"
"event","I've given up on love, for the time being"
"eventtime","2013-05-28 21:26:00"
"url","http://nocturnalmyrtle.livejournal.com/48724.html"
"userid","11085"
"itemid","189"
"event","I would like and watch Doctor Who more if he was attractive. 
I also like love stories, but my love life has never really been one of happy endings.  I have been disappointed many times, but mostly because I have tried this relationship with the same person.  Which equals to the same out come, no matter how many times you squeeze a lemon you will always get lemon juice.
Definition of a fool: doing the same process multiple times and expecting different results."
"eventtime","2013-05-19 11:58:00"
"current_moodid","55"
"url","http://nocturnalmyrtle.livejournal.com/48542.html"
"userid","11085"
"itemid","188"
"event",".......
Hot summer nights mid July
When you and I were forever wild
The crazy days, the city lights
The way you'd play with me like a child

Will you still love me when I'm no longer young and beautiful
Will you still love me when I got nothing but my aching soul
I know you will, I know you will
I know that you will
Will you still love me when I'm no longer beautiful

I've seen the world, lit it up as my stage now
Channeling angels in, the new age now
Hot summer days, rock and roll
The way you'd play for me at your show
And all the ways I got to know
Your pretty face and electric soul

Will you still love me when I'm no longer young and beautiful
Will you still love me when I got nothing but my aching soul
I know you will, I know you will
I know that you will
Will you still love me when I'm no longer beautiful

....

Oh that grace, oh that body
Oh that face makes me wanna party
He's my sun, he makes me shine like diamonds

Will you still love me when I'm no longer young and beautiful
Will you still love me when I got nothing but my aching soul
I know you will, I know you will
I know that you will
Will you still love me when I'm no longer beautiful
Will you still love me when I'm no longer beautiful
Will you still love me when I'm not young and beautiful"
"eventtime","2013-05-15 19:54:00"
"current_moodid","55"
"url","http://nocturnalmyrtle.livejournal.com/48165.html"
"userid","11085"
"itemid","187"
"event","Been watch a bit of Doctor Who, its not bad but I still trying to figure out if I like it.  Six/seven episodes in and I still not sure, its watchable I guess.  
So I am one year older, my life, its is strange.
If all goes well I should be in Italy in the fall, and I am also in 12,000 in debt.  Yeah that sucks.  
So I am still not with Angel.  I have not stopped loving him so that puts me in bind since he still wants to be with me.  It has been about five months since we broke up and the fact that he still wants to work things out impresses me.  But then again, he is still the douche that told me that he is going to get better with or without me, and that he was not going to wait forever.  
Ass.
Believe me I want him to continue seeking therapy, it was in such a lousy state when I was with him.  I don't know what is wrong with him.  Don't think I ever will find out what was wrong. 
He asked me if we could try to work things out earlier this month, I didn't want to. I don't know if that would be a good idea, I told him I still need more time to think about it.  The truth is that I need more time to repair all the damage he cause and it going to take some time.  He is not going to get better over night and I don't think I can handle him doing this to me again.  
I really don't want to go through all this shit with him again. There is no benefit as far as I can see.   
He can't promise me that things will get better, and he decimated all the hope I used to have for us together.  I am just so destroyed.  Can't he see that there is not much left.  
I am not young anymore. I don't want to go through all this bullshit for nothing. I am just so tried. I don't want to do this anymore.
I love him, but I need more time away from him. I need to fix me. 
I am so broken and he doesn't understand. He probability things I am being unfair.  
I don't think he really cares how his actions made me feel for the past two years. I don't want to go back to that. 
If it means giving up on the one person I have love for the last twelve years, then so be it.  
I am tried Angel, I don't have the heart to keep doing this to myself. 
If you really want me, you'll wait for as long as it takes.  It may even take a year.  If you don't want to wait. Then I don't mean that much to you in the first place.  In the end, you will be saving us both a lot of pain.  
If I am not worth waiting for, then you got the wrong girl.  

Me that one chick."
"eventtime","2013-04-27 23:40:00"
"current_moodid","39"
"url","http://nocturnalmyrtle.livejournal.com/47934.html"
"userid","11085"
"itemid","186"
"event","I have been watching romantic films again, which is something that I am sure is not good for me right now.  Fashion and I are on speaking terms now after almost two years of not speaking to each other.  
I am a little unstable right now. I am not quite sure what to do with myself right now.  What has just donned on me is that this whole time I have stressed how Angel is no good for me, well I just figured out that the same can be true of me.  That is to say that I am no good for Angel either.  It took him years to get me to trust him and now since he dashed well,  it would take more years to fix this.  Angel has shown that he is a unstable partner and who wants to have a child with someone like that.  I was not found of the idea oh having children and it is even worse now.  If we got back together like how he would want to, the whole child thing would be up in the air.  He also finds me lazy, and unreliable, which by the way sucks.  I am not what he wants, I am my own person with my own wants and dreams which do not include children. 
We both have very negative opinions of each other, what happen to loving someone for who they are? Well, that is very hard to do sometimes.  
I don't want to marry Angel. It would be a mistake on both ends.  He was right to doubt us, and I should have ended it sooner.  Do not live in fear of getting hurt again, because you will get hurt again. Everyone does not have a perfect somebody for them. It was naive of me to think that way. People are ugly stupid creatures, everyone is ugly inside. 
One has to be a little bit crazy to be happy in this world, lucky for me, that is exactly what I am. 
I dream of a love that is worth the pain.  A love where the good times out weigh the bad.  A love in which I do not have to spend the bulk of it wondering ""is it me?""  I am not perfect, no one is.  It is not as if I expect it, I just thought that being decent was something that was not that hard to be.  People however have a wonderful way of disappointing me.  
I am stubborn, childish, overweight, bitchy, lazy, fiery temper when I allow myself to come to a boil, dependent on others, and lacking in ambition. 
I am giving to a fault, loving to a fault, enabling to a fault, devoted to a fault, and can be docile to a fault.  
28 years and my life is just beginning, it may not impress Angel, but it doesn't need to.  
Going to dance with myself"
"eventtime","2013-02-25 21:38:00"
"current_moodid","1"
"url","http://nocturnalmyrtle.livejournal.com/47742.html"
"userid","11085"
"itemid","185"
"event","Why has loving you always caused me so much pain? You say that you love me, but could not bear being with me.  You say you want to marry me, but dislike my things in your home. You tell me that you miss me, but in the end you wouldn't let me touch you.  How much rejection and pain you have cause, do you not think I have suffered enough? You are alone, you do not wish to trust your family and your friends have always been shit.  They never really cared about you, I knew this for a long time.  Those people whom only wanted used you, those are the people you choose over me.  Now you see that they don't care and you are lost, but still stay with them.  You choose shit instead of love, you deserve them. We could have been a family, you ruined everything. How dare you come to me, you think just with a sorry, it would fix everything.  You say 'I said I was sorry, now get over it, its no big deal.'  Oh yes, the one who causes the pain is so keen on forgetting and moving on.  But what about me? Do my feelings mean so little to you that all the years of hurt should just be over looked with an ""I'm sorry.""  I want to hate you, but I find that so hard to do even now.  I loved you so much, and love you still but you are not worthy of being loved by me.  It may take me years but I will move on with my life.  I so wanted to make a home with you, but you ruined it! I suffer because you are an uncaring asshole! I was there for you, and you pushed me away.  I was foolish to believe that someone who could not even make himself happy could bring any joy to another. If all goes well I will be gone in six months, and if I learn to live on my own, I will leave.  I will move out of your reach, and hope never to see you again.  I have been too kind to you, you know this.  You are a liar, a coward, a manipulator, insensitive SOB. 

May you get everything you deserve"
"eventtime","2013-02-21 22:59:00"
"url","http://nocturnalmyrtle.livejournal.com/47604.html"
"userid","11085"
"itemid","184"
"event","No chocolate covered strawberries.  No amount of words can express my disappointment. There was a 90% chance that I was not going to get any, but still had the 10% of hope that I would.  No Christmas present or strawberries, men suck! I hope you day turns out shitty! No, I don't mean that, just uneventful.  (Angel) As for everyone else, I hope you had a great week and have a better weekend! I know I will :D"
"eventtime","2013-02-14 18:55:00"
"url","http://nocturnalmyrtle.livejournal.com/47136.html"
"userid","11085"
"itemid","183"
"event","It has gotten to the point where I am thinking about the good times and not all the reasons as to why I broke up with Angel in the first place.  Mommydearest tells me that this will pass and then I will feel nothing. My cousin whom was cheated on believes that Angel was cheating on me, I told her I have no proof of this.  She asked me what I believe and I said that I don't think so, but hell I could be wrong.  It's not like he was incapable of doing it, he is a selfish and stupid kind of guy.  From what my cousin has been telling me, Angel sure as hell sounds like he was cheating on me.  I had asked if he had/was after the break up but he insisted that he had been faithful to me.  My answer at the time was ""I don't except you to be honest about this ever."" He wanted to continue the relationship with me so I doubt that he would confess such a thing at that moment.  If he was it would sure as hell make this getting over him a lot easier.  But all I have gotten from him since we broke up is that he misses me and wants to make amends for the pain that he caused.  Yes nice sentiments, you know when they could have been useful, six months ago.  Better yet, a year ago when I asked you to get counseling, or how about after making me cry, again, and again, and again for all those months.  Mommydearest tells me that he did not realize my value till I was gone.  How about he didn't realize my value after he found out that none of his friends gave a shit about him.  Oh that I was the only one that kept putting up with his shit and loved him even after he was so distant with me.   He ruined us by behaving like an asshole.  I have given him too many chances and way too much of my time, I can not do this anymore.  I have to move on.  I can't be stupid anymore hoping that he will be better next time around.  If he really cared about me and my feeling, our relationship, he would have gotten help a long time ago.  Not just wait till I leave him.  I love Angel so much, but he is just a bad person for me.  He is no good, and that will never change because it has not in the twelve years that I have known him.  Every time he has come back, that I have let him back into my life, there are promises that it won't be like the last time.  It may have been four/five years but god how he likes to fuck things up with me.  
You have had you last chance with me Angle.
You ruined it, get better for yourself.  Hopefully you don't fuck over your next relationship the way you did with ours.  
My answer is no, and it is going to stay 'NO'
You had countless of chances with me, and you manage to fuck up each and everyone of them.  You are going to have to live with the consequences of your actions. 
May you be happy one day, as I hope to one day be.

Should have been doing my homework"
"eventtime","2013-02-03 21:16:00"
"current_moodid","2"
"url","http://nocturnalmyrtle.livejournal.com/46896.html"
"userid","11085"
"itemid","182"
"event","I miss my Teddy :(
I am going to be alone on Valentines day for the first time in four years. I know that it is weeks away but my little sister thought to mention it to me this weekend.  
I miss him, but it will go away.  It is not as bad as it was when I first ended it in November.  Time will pass and both of us will move on.  It is just sad, I wanted to married this man, he put me through so much and it was he who was not sure about us.  Now I am twenty-eight and alone.  From the look of things I may not find another partner till my early thirties, and if I do get married it won't be till I am in my late thirties early forties.
I am the end of my line."
"eventtime","2013-01-16 18:36:00"
"url","http://nocturnalmyrtle.livejournal.com/46686.html"
"userid","11085"
"itemid","181"
"event","<i>What a fool I was, what dominated fool 
To think that you were the Earth and sky</i> 
<i>What a fool I was, what an elevated fool 
What a mutton-headed dote was I</i>

No, my reverberating friend
You are not a beginning and the end

There'll be spring every year without you 
England still will be here without you 
There'll be fruit on the tree 
And a shore by the sea 
There'll be crumpets and tea without you

<b>Art and music will thrive without you</b> 
..... 
And there still will be rain on that plain down in Spain 
Even that will remain without you, 
<b>I can do without you</b>

You, dear friend, who taught so well 
You can go to (<b>Hell</b>)

They can still rule the land without you 
Windsor Castle will stand without you 
And without much ado we can 
All muddle through without you

Without you pulling it the tide comes in 
Without your twirling it, the Earth can spin 
Without your pushing them, the clouds roll by 
If they can do without you, <b>ducky,</b> 
<b>so can I</b>

<b>I shall not feel alone without you 
I can stand on my own without you 
So go back in your shell</b> 
<b>I can do bloody well without (you)!</b>

MY FAIR LADY - WITHOUT YOU 
Edited to fit my needs lol"
"eventtime","2012-12-21 22:28:00"
"url","http://nocturnalmyrtle.livejournal.com/46580.html"
"userid","11085"
"itemid","180"
"event","I have been watching Under the Tuscan Sun more often lately, this can't be good sign.  
""You will get over this, you will, one day you will be happy again."" 
I have a cold right now, feel tried and lonely and then again I want to be alone.  I don't want to keep pretending to be happy/okay.  I just miss him so much, I know I had every reason to end it with him, but that still does not stop me from missing him. 
What do you do when the person you thought you were going to marry tells you that he doesn't want to.  I yearn for him, but he just didn't want me.  I don't like rejection, and this is the worse kind.  He tells me that he loves me and he will never love anyone as much as he does me.  Oh yeah that I deserve better, that I was really good to him, that he loves and misses me so much, then why after all of this was he still not sure.  I don't understand.  I did nothing wrong.  I was so giving. 
""What is it about love that makes us so stupid?...Why can't [you] just let it go?""
I want to be happy."
"eventtime","2012-12-18 21:02:00"
"url","http://nocturnalmyrtle.livejournal.com/46249.html"
"userid","11085"
"itemid","179"
"event","Life just sucks sometimes
My sister is wreak
My other sister is not leaving the nest
I dumped my boyfriend after things weren't working out for a few months, then he tells me he was thinking about marrying.  Apparently he got scared and I have to deal with the fact that my boyfriend of four years could not see himself working out with me long term.  Oh but he says that he will always love me.  Great! What am I supposed to do with that information? 
This and finals
I am just so tried, I have not had enough sleep for a while now, I am sad and lonely every now and then.  It erks me to have to think about how one day I will have to start all over again with someone new.  This is bullshit.
I have my whole life ahead of me, but right now I am not feeling so good.
I have so much to look forward to next year, I graduate and if all goes well I will be living in Italy for about four to five months.  
I have so much to look forward to, but really, right now, I feel really low.  I am so sad sometimes.  
Everyone I know has problems that seem a lot worse then mine. (okay maybe one of them is just young) I just have to hold it in all the time.  No one ever really lets me cry it out, they don't want to see me bawling, but what if a good cry is all I need? Just sit there and pat my head and stay hey ""I know it hurts, its alright, let it go, you are going to be okay"" 
I am pissed, sad, lonely, tried and I get paid very little so I can't even buy myself stuff to make me feel good.  Like really expensive chocolates, sweet wines, movies, fancy clothing, you know shit I really don't need.  
The only way I cheer myself up is making other people smile.  I make jokes (they are not good ones) I act silly, bring candy and cookies to work.  I fine it easier to spend on others than myself. 
Just really over it, not this year, but just how I am.  
Winter is Coming"
"eventtime","2012-12-13 22:34:00"
"url","http://nocturnalmyrtle.livejournal.com/46024.html"
"userid","11085"
"itemid","178"
"event","I broke up with Angel again"
"eventtime","2012-11-30 00:43:00"
"url","http://nocturnalmyrtle.livejournal.com/45801.html"
"userid","11085"
"itemid","177"
"event","I've never had high expectations of myself, so I am not one to say ""look at how I wasted my life."" I have not done much, but I have done more than what most of my family would have deemed possible for someone like me.  I am a success because of my family deemed me incompetent.  Kinda of sad really.  

I find myself in place surrounded by drowning people, and I have just only learned how to swim
I want to stop and save them, but I know they will only drag me down with them
It is hard for me to leave them there, there are some whom I really wish I could save
But I must keep swimming, I don't know where I am going, only that I must keep moving
I venture out in to the unknown, unsure of myself, it is a vast ocean
Only time will tell whether or not I find land or drown

I am 28 years old and my life feels like it is just starting.  I am moving into adulthood, college is coming to an end, and my time in limbo is almost up.  
I am scared, I have never really done anything on my own, now I am looking at studying in another country for six months, and moving to another state for a masters.  I am opening up myself to new experiences and poverty.

Live your life, regret nothing!"
"eventtime","2012-09-07 07:27:00"
"current_moodid","30"
"url","http://nocturnalmyrtle.livejournal.com/45527.html"
"userid","11085"
"itemid","176"
