"names","values"
"event","i was reading xiaxue's blog post on the passing of her hammie. suddenly i thot of my own hammie - pokka

she was adorable.. and like wat xiaxue said previously she couldn't imagine how one can bond with a hammie. apparently she has and i haf. i think my hammie, pokka was one of the longest pet i had.. i was the sole caretaker of her..

i cleaned her cage, bought her food and her cage stuffing. i gave her treats like chocolate and yoghurt (after i finish, i leave a dollop on my spoon and feed it to her).. she laps it all up! =)  i loved her dearly becos she doesnt bite me and allows me to handle her anyhow. =p  so i like to cup her in my hands and rub her soft fur. and kiss her! hee hee!

and she's the best companion when it comes to exam period! cos she'll be mostly awake.. hahaha! so when i burn the midnight oil, i'll bring her into my bedroom so she can accompany me.. halfway thru my revision, i'll take a break and play with her.. otherwise she will be running on her wheel.. it makes me less lonely.

i still remember when she passed away.. for abt 2 weeks, she started eating less and was noticeably less active.. she just looked sickly so i had the feeling dat she did not haf long to live.. i remember it was nov 2004 when i was cramming for my uni papers, fearing that she might just leave without me knowing.. i determinedly brought the cage into my room despite my mum saying dat its not hygenic.

i saw her breathing hard inside the cage and was so heartbroken.. i gently stroked her and told her to leave if she's finding it difficult. i told her how much i loved her and how great a pet she was.. while stroking her, she just stopped breathing. i was so upset.. must haf cried buckets! 

but in another assuring way, its like she heard me and i couldn't be more happy dat i got to accompany her before she passed away. =(  

after she breathed her last, i laid her in a box filled with soft tissue. i placed the box in a clear plastic bag and vacumn-packed it. yupss... cos i din want those insects to come bother my hammie. i want her to still be a whole. i then got my brother to accompany me downstairs to dig a hole so i could bury her. i couldn't bear to throw her in the rubbish chute as she's too precious to me.

i think her body is still dere today.. in dat small plot of flowerbed. to date, she remains as one of my most favoured pets. =)

i would love to own a pet again and i would. i think its very important for kids to love animals.. so that they grow up to be loving beings. like moi! =p"
"eventtime","2010-09-17 10:18:00"
"current_moodid","131"
"url","http://pinklolli.livejournal.com/238272.html"
"userid","11930"
"itemid","929"
"event","had a real pleasant surprise last evening! =)

was gonna meet my family at tamp mall for dinner and we were slightly late. upon reaching tamp mall, he said he wanted to go ntuc and i kept badgering him for the reason.. cos we were oredi late. he asked me where was ntuc and i pointed the direction out to him and he asked if i wanted to stay on the spot to wait for him. i agreed cos it was crowded.. and soon, i saw him walking towards me with a smile on his face and hand behind his back.. i thot he bought something for me to eat. hahaha!

but i got an even sweeter surprise! i got this!

<a href=""http://s21.photobucket.com/albums/b262/pinklolli/?action=view&current=photo-80.jpg"" target=""_blank""><img src=""http://i21.photobucket.com/albums/b262/pinklolli/photo-80.jpg"" border=""0"" alt=""Photobucket""></a>

i went ""huh? for wat?"" hahaha.. he jokingly said how come whenever he gives me surprise i always go ""huh""?? cos when he proposed, dat was the first word i uttered too! hahaha! he revealed it was for our 1st wedding anniversary! but lunar date - eighth day of the eighth mth

tee hee.. i couldn't stop grinning afterwards.. =p

i love him more especially in moments like these! romantic boy ~ kekekeke! but he's usually vy affectionate towards me which i love too.. =p  

dere is this thing bothering me too.. i'm afraid of how having a baby will affect the dynamics of our current relationship.. i wanna remain the same with him! as lovey-dovey and mushy as we are now! i still wanna be the ""main attraction"" in his life! =s

really can't take it if there are huge changes.. =(  but i shall not let baby ""take over"" either.. haha! there are many women who let children become the focus of their lives.. its not wrong but i feel dat the husband shld not be neglected either.. 

after all, its us both who will walk the rest of our lives together.. after the children gets married etc.. 

*shhhh* but i do kinda regret a bit abt not waiting a bit longer to start a family.. when i think abt it now, i realised we're probably gonna spent 1 married year alone only.. altho we pak tor for almost 3 years.. but its not the same cos we weren't staying together and hence, unable to do more coupley stuff.

but of cos i still want our lil one! perhaps i'm worrying too much.. hee.. 

dat day someone asked if i'm expecting boy or girl (quite a common qn these days) and i answered girl. he said girl good, next time get a boy so can haf one of each. i replied ""we can't choose them, they choose us"". it was a straight-from-heart kind of answer.. and i thot i made pretty good sense! hahaha!

so our lil gal chose us at this time so its definitely fate.."
"eventtime","2010-09-16 10:40:00"
"current_moodid","14"
"url","http://pinklolli.livejournal.com/238076.html"
"userid","11930"
"itemid","928"
"event","had another lousy nite of sleep. i think its gonna be this way till indefinitely... =s  one of the forum mummies say its training for the nites when baby is out. ha.... 

sigh.. i tried gg to bed ard 11pm.. he wasn't home yet, was out networking with some pple at clarke quay. he mentioned he was tired and i was afraid he might drink.. but i still nodded off and woke up ard 1am.. he still wasn't home.. but i din msg him cos usually after 2am, then i will be more worried.. so i thot nvm. i fell back to sleep and he came back shortly after.. 

woke up at 5am to pee.. and couldnt really go back to sleep.. i probably spent the time daydreaming and zoning in and out. =(  i fell asleep just when my alarm rang. #$@#%^$

my dear hubby came to work with me.. he must be really tired too.. cos he has had late nites for the last 2 nites. =s  heartpain to see him working so hard! sigh.. but tonight will be an earlier nite for us i hope. meeting my family for dinner as its my bro's bday.. gg seoul garden! kinda looking forward to it.. it was the hip place to eat at when i was back in sec sch and jc. but afterwards, the lack of variety and price kinda got to me. wasn't worth it.. ntg much to eat for wat i'm paying. so i think i haven been dere for 8 years? hahahaha! really long time anyway.. 

rainy morning is making me even sleepier... sobs. i wanna haf a good nite's rest! 

shall i take mc tmr and nua at home? super tempted.... doing pedicure in the evening tmr. =)  

supposedly meeting the guys on fri nite.. but they are meeting ard 8pm.. will i be too tired?

sat i've got a gf's wedding. hence, i decided to do my nails this thurs! kekeke.. still got package mah. =_+   

oso lots of ""preparation"" work to be done for myself.. i'll go for another pedi in 2 weeks time (after this thur's appt) but will not apply nail polish! cos i heard from some mommies in the forum dat they will usually remove nail polish of mommies during delivery as nails can help the doc gauge the condition of the mommy.. so must haf clean nails.

and i intend to go for B wax next thurs.. =p  the last time i did it was quite some time ago.. i din remember it hurting badly.. still tolerable.. so i wanna do it so that post-delivery, it will be cleaner <i>down dere</i>. =)
and oso not ticklish for baby when she comes out. muhahahaha! so yah.. some concerns of doing B wax at tis point is inducing contractions.. cos if too painful, one might haf early contractions. so one reason of me doing next week is also cos i dont wanna haf too early contractions. choy~ actually the waxing itself is not dat pain.. its when they try to clean the area up by using tweezers. =_= any stray hair dat wasnt pulled out cleanly. 

and oh yup, i washed my darling lil bub's discharge clothes over last weekend.. not alot. =p  but i was still pretty excited to wash and hang it out to dry! too cute! 

here's a pic! i only washed her romper, bib, 2 caps, mittens & booties, tummy wrap, a swaddler, a blankie.

<a href=""http://s21.photobucket.com/albums/b262/pinklolli/?action=view&current=photo-79.jpg"" target=""_blank""><img src=""http://i21.photobucket.com/albums/b262/pinklolli/photo-79.jpg"" border=""0"" alt=""Photobucket""></a>

will wash the rest over this weekend or next if good weather permits. =)  cot's coming and once its here, i will start arranging the baby's essentials! OMG! its really happening ne~"
"eventtime","2010-09-15 10:53:00"
"current_moodid","109"
"url","http://pinklolli.livejournal.com/237669.html"
"userid","11930"
"itemid","927"
"event","3 more weeks to start of full term, 6 more weeks to end of full term =p

the reality of having a baby gal is becoming a glaring one.. we'll soon haf our own little ""doll"" to take care of. =p

recently i've been feeling physically weaker.. as the tummy gets heavier, i feel lots more tired. and these few days, my calves already start feeling tight in the morning! by the time i reach home, my lower back is aching and so are my feet. when i walk, i really haf to take it slower.. =s

the feeling is quite sian. like this morning i had to take the train to office, it was so warm and dere i was, waddling... by the time i reached office, i was in foul mood. cos the tummy was really weighing me down.. there is this tightness in tummy that makes me unable to stand straight up. really shagged!

sigh.. but haf to remind myself dat i gotta hang on for few more weeks.. but then the delivery part scares me so. =(  so dilemma! hahaha!

sigh... really in not much mood to work liao.. these 2 weeks have been busy cos my boss is not ard and i gotta take care of my own daily operational work, plus some projects like the audit and last-min problems dat my staff face.. and i haf to leave by 6pm. so i've been feeling this stress.. 

feel like taking mc tmr.. i've got internal audit on the 17th (fri) so thurs better not take leave.. then only choice is tmr.. but is my bro's birthday and i still gotta meet my family at tamp mall. =s

i really wanna take leave soon!!! but i can't! i'm on leave next thurs.. which will be a busy day itself.. gynea appt in the morning, meeting pj ard 11am..shop shop then we'll be having high tea. baby cot will be delivered on same day as well.. =) looking forward to cot's delivery! 

then end of the mth is our busy period so we seldom get to take leave.. after which, one of my colleagues, Ann will be on leave for 3 days. either she or me has to be around.. so if she's not here, i haf to be in office. then my next leave will be 8th oct. 

following dat week, will be the actual audit week so we'll need to ensure everything is in place.. by then its mid of oct! if i really dont birth by then, i'll start my maternity leave on 20th oct.. cos 18th and 19th, Ann is on leave.. =_=  so i must wait another 5 weeks before i can start my maternity leave. SOBS! I fear i cant take it physically.. feel like just lying in bed the whole time nowadays.. i dont wish to be stressed at work or as long as they dont disturb me and i just finish my own work first. 

to add to it, these few nites, i noticed i'm becoming an even lighter sleeper! nowadays when he comes in the room to check on me ( cos i sleep first), i'm awake cos i was oredi half-awake! cham~~ insomnia really.. SOBS!
nowadays when i feel xin ku, i pity myself. =s  one will tend to have this ""oh i'm so poor thing"" mentality cos its not easy. 

but i must JIA YOU! now's not the time to give up."
"eventtime","2010-09-14 13:39:00"
"current_moodid","14"
"url","http://pinklolli.livejournal.com/237449.html"
"userid","11930"
"itemid","926"
"event","went to the gynae's today.

my lil gal is now abt 2.3kg! =) her growth seems to have stablized.. grew abt 300g since 2 weeks ago.. if this continues, she shld be slightly past 3kg upon birth! i think abt 3.3kg is good. =p  got a colleague who's more petite than me gave birth to a bb gal 3.53kg! so i guess i haf ntg to worry abt! tee hee...

and........... we managed to get 4D scans of her! =) happs!

initially she was shy, she kept her face turned away and her little hands were covering the face.. =s   my gynae had to keep nudging my tummy in a bid to get her to shift her hands which she finally did after abt 10 mins. dat was when we cld start taking satisfactory facial shots. 

here's one of her with her hands covering her face!

<a href=""http://s21.photobucket.com/albums/b262/pinklolli/?action=view&current=photo-76.jpg"" target=""_blank""><img src=""http://i21.photobucket.com/albums/b262/pinklolli/photo-76.jpg"" border=""0"" alt=""Photobucket""></a>

this is her suckling her finger / thumb (can't really tell cos still bit fuzzy)

<a href=""http://s21.photobucket.com/albums/b262/pinklolli/?action=view&current=photo-78.jpg"" target=""_blank""><img src=""http://i21.photobucket.com/albums/b262/pinklolli/photo-78.jpg"" border=""0"" alt=""Photobucket""></a>

i think she looks like daddy.. hahaha.. perhaps its the nose. =p

but still her features can change.. only from 6 mths onwards, they grow into a more permanent look i feel.. =) the first 3 mths usually change vy fast. oh well! glad my lil gal decided to cooperate (after much nudging) today after all! =)

the clinic has given me the admission letter today (yuppy!) cos i haf less than a mth to full term so there <i>might</i> be a chance of delivering early oct. nervous after getting the letter cos it definitely feels even more real! and i've been advised to prepare my hospital bag oredi. =_=  i was just gonna do so.. need to go pick up some necessities soonish!

and oh! its confirmed i'll be doing confinement at current place (dancing for joy in my heart) but then we'll have to pay off 2 mths mortgage for current place exclusive of our usual mthly contribution. =( 

but bo bianz... just hope everything goes smoothly for us. *fingers and toes crossed*"
"eventtime","2010-09-09 16:27:00"
"current_moodid","15"
"url","http://pinklolli.livejournal.com/237220.html"
"userid","11930"
"itemid","925"
"event","we're now contemplating moving into the new place right after i deliver (if logistically possible)... means i will doing confinement at the new place.

it makes more sense if we can move in earlier so that our current place can be rented out earlier so that we do not have to pay an extra mth's mortgage. but of cos lots of complicated planning if we choose to do so.

gonna get the keys for the new place from the lawyer tmr... so this weekend we can start noting down the defects. after which we haf to confirm with designer on the final design of our place.. and then they can start on the reno works and complete within 3-4 weeks. 

however i forsee that if we wanna move in right after i deliver, time is kinda tight. cos starting from this weekend, we prob need at least 5-6 weeks before the new place is fit for moving in. by then i will be in the 37th / 38th week, so there is really a possible chance i might deliver anytime then.

there are other little things like packing, moving of certain furniture over ne? its not gonna be an easy task. sigh.. 

we've bought a new tv (LED! super sleek) , new washer and microwave for our new place. why? cos to remove the current tv is not exactly ABC easy, gotta get someone to dismantle it and reinstall at new place which wld cost easily $200. =_+  we got a new washer cos we wanted a quieter one. as for the microwave, the new place doesnt haf one! we bought a built-in one but he's thinking of switching it with the current one. hee.. bigger mah.

to save costs, we're gonna move over the current sofa, fridge, dining set, sound system, my serta mattress (i lurve it! am glad we spent bit more on the mattress back then) and possibly the coffee table as well. so this means we need to get replacements for all these items as well. cheaper ones of cos! hahaha! super budget-constraint! no point in letting our tenants enjoy good furniture while we take lousy furniture mah.. =p

sigh.. the reluctance to leave current place is coming back. when i saw the layout of the place, i oredi sian. now we haf to spend a bomb to alter it into a more livable place. =_=  

hate the kitchen, so little cabinets and squeezy dat we haf to add new ones...and the bathtub in the master is totally redundant. so small, how to use so we've gotta spend money to hack it all away and make good the area. these 2 areas oredi gonna cost us almost $10k. super annoyed. we oredi tried so hard to cut down on the stuff dat we need to do.. and now we're toying with the idea of not adding a mirror at the foyer (like current place) and doing a concealed wall for the living room (cos the stupid common toilet door faces the living room), these 2 items add up to almost $5k. its definitely a huge sum for us at this point. GRRR. why the house cannot be designed better!!!

anyway enuf of dat house.. 

============================================================================

i woke up at 515 am for a pee pee and then i found myself to be hungry. weird! but i resisted to even drink milk cos i was too lazy to get up. in the end, i just laid in bed till my alarm rang. 

so this morning i'm feeling vy tired.. -_-   with tiny eyes. and i feel a headache coming on too. sigh... jialat. dunno izzit cos of my poor rest last nite, dat i'm feeling the heaviness of the tummy so early in the morning.. my waddle is getting more pronunced. 

and bloody hell, its raining heavily at my office here. super wish i was still tucked in bed! sniff~

sigh... i'm gettin impatient abt baby's delivery date. but definitely i gotta hang in dere till 37th week so she'll be full term and major organs all developed. i'm just sooo tired of all the aches and weight dat i have to lug ard. =s  

guilty mommy. bad mommy. but really not easy ne..."
"eventtime","2010-09-08 10:28:00"
"current_moodid","14"
"url","http://pinklolli.livejournal.com/236922.html"
"userid","11930"
"itemid","924"
"event","actually there is a different way of counting.. i can also say i'm in my 34th week.. cos today is the day i crossed the 33rd week of pregnancy.. =)  getting more excited and scared as the weeks pass.. =p  i'm really quite scared u know.. not kidding abt it. when i think of the image of delivery, my heart stops for a beat and i banish the thot to the back of my mind once again. i haf to remind myself its a must to go through this and i will. 

even told my lil one dat i'm scared too.. haha! and best if she cooperates to give me a fast and as painless as possible labour. ^^ with the condition dat she comes into the world healthy and safe of cos. so many worries but i'm trying not to think too much at this point.

ytd i went to look for a little cap for her homecoming trip. =) i settled for something so-so cos not alot of choices.. i will be bringing her clothes to be blessed. =p so i need to prepare a set of clothes for her.. 

this is the most simple and nicest cap i could find at kiddyland

<a href=""http://s21.photobucket.com/albums/b262/pinklolli/?action=view&current=photo-75.jpg"" target=""_blank""><img src=""http://i21.photobucket.com/albums/b262/pinklolli/photo-75.jpg"" border=""0"" alt=""Photobucket""></a>

and i went to look at receiving blankies too (the blankie used to wrap newborns when they return home) and i spotted a cute pink minnie mouse one. actually i oredi haf a swaddle kind (oso in pink) but pj suggested i get a trad one in case the other gets dirty. basically a swaddle wrap is used to wrap the baby's arms and legs so they are cosily tucked in, and its the short-cut version of the trad receiving wrap. i was contemplating if i shld get it but the shopaholic in me gave in! the reason i gave myself was dat when she gets a bit older, i will let her use as a real blankie. hahaha! i wouldnt feel safe to cover newborn with blankie in case she messes up the blankie and covers her own face.

so i got it!

<a href=""http://s21.photobucket.com/albums/b262/pinklolli/?action=view&current=photo-73.jpg"" target=""_blank""><img src=""http://i21.photobucket.com/albums/b262/pinklolli/photo-73.jpg"" border=""0"" alt=""Photobucket""></a>

and i chanced upon this romper too! damn! i told myself to stop buying oredi.. =s  but too cute to resist. polkie dots again with an ice cream cone (my fav snack!) 

<a href=""http://s21.photobucket.com/albums/b262/pinklolli/?action=view&current=photo-74.jpg"" target=""_blank""><img src=""http://i21.photobucket.com/albums/b262/pinklolli/photo-74.jpg"" border=""0"" alt=""Photobucket""></a>


actually i wanted to get another 2-piece white set..which looks innocent and sweet.. but i decided not to over-indulge in shopping so i only chose the romper. =)  still got some will power left ne~!

i'm now awaiting 1 romper, 1 dress, 4 pairs of socks and 2 pants i ordered online for her. =)

dat day i took out all the clothes i bought for her.. actually not alot either lah. i counted quite happily and excitedly

- abt 10 (0-3 mths) pieces
- abt 5 (3-6 mths) pieces
- abt 7 (6-9 mths) pieces
- 3 to 4 pieces of above 9mths

datz a rough estimate cos i can't recall totally either.. i will supposedly get some hand-me downs from his nephew and cousin's son. but those clothes will be more boy-ish.. those can wear at home. but if someone visits us or when we go out, i'll let her wear those i bought! =) much prettier... 

i'm guessing baby's clothes will be washed every 2 to 3 days, so the ones i bought plus some hand-me downs shld be quite sufficient?"
"eventtime","2010-09-07 11:09:00"
"current_moodid","15"
"url","http://pinklolli.livejournal.com/236704.html"
"userid","11930"
"itemid","923"
