"names","values"
"itemid","941"
"event","i had a superb time!

my man had booked a room at MBS for our anniversary! so happs! he had wanted to surprise me but he told me ahead just in case we wanted to bring Alyssa along. and we did! 

we did contemplate abt bringing her cos i wasn't sure if we cld enjoy ourselves or would we be ""burdened"".. hee hee..

the weekend was a smooth one i would say.. =) i woke up early cos Alyssa did.. =_="" but i slinged her and we went to the market to get breakfast for her daddy dearest.. came home and it was only 8am. gosh.

waited for her daddy to wake up ard 9am.. then she was feeling sleepy so i put her to bed.. was just nice! me and him had a leisurely breakfast.. i bathed and we watched ""the incredibles"" togets.. she woke up ard 11am.. gave her a bath and we played for while.. and ard 130pm we left to go out.. he had wanted to drop by the tailor's to get some stuff.

we arrived at MBS slightly after 3pm.. we topped up to get a city view room! but as it wasn't ready yet.. we walked ard for bit before finally going up to our room on the 21th floor at 430pm.. the room was gorgeous with an even more gorgeous view! the bathroom was huge with a tub big enough for two!

Lil Alyssa was so excited when we put her down on the sofa.. i felt so happy to see her huge smiles and laughs! bouncing up and down! =D
We had decided to go for the buffet dinner..but since it started at 6pm we went to the skypark on 57th level.. it was awfully hot and crowded so we stayed awhile.. went down to the hotel and had our dinner.. pricey but alot of variety! 

after dinner we went up to the room anticipating to watch the race at 8pm.. hahaha! but only then did we realised that the relay match starts at 10pm..but no prob! so we gave our girl a bath.. and we played ard for while before settling her to bed. after which we had some couple time! =D  But due to the comfortable bed and conditions... we fell asleep by 11pm! muahahaha!
but of cos we did take in the breathtaking night views of the city.. really special and nice~ directly opp the fullerton hotel.. nice view to fall asleep to!

next morning! Alyssa slept pretty much like a baby (pun intended) and only woke up ard 645am.. which was pretty much her usual wake up time.. but after her milk she actually fell back to sleep! hee! joy for me! i woke up 20 mins to 9am while she and her daddy continued sleeping.. i had thot we needed to check up at noon and we still wanted to swim so i was afraid we would not have enuf time mah.. turns out i busied myself for ntg.. he extended the checkout to 2pm.

well.. so while i was preparing the luggage and her drinking water i woke them up.. haha! so we changed and went UP to the pool! the pool was really really beautiful and it helped dat it wasnt crowded ard 10am.. so we enjoyed our first family swim dere.. again as long as it was swimming or water-related, Alyssa was duper happy. and as long as she is happy, we're happy too!

after a fantastic swim, we were starving! me and the man.. after we went back to the room, we gave her a bath and fed her milk whilst we took quick turns to take a bath and get ready to go for some food! 

we went coffeebean for breakfast and i had the breakfast platter! yummilicious! he had pasta.. haha cos it was ard 1130am... after dat, we shopped around and had intended to leave ard 3pm cos dat was when the 24 hr valet carpark charges ended.. however, 2 of his frens were dere.. so we met 1 of them before checking out.. after checking out, he wanted to check the floating LV.. so we decided to forget the charges and stayed on for more shoppin!

by 430pm, exhaustion set in so we decided to go off.. but at this time, another of his fren called and wanted to meet up for coffee.. he wanted to treat us.. so we ended up having an early dinner at the hotel! by the time we left, it was 7pm! and at 7pm, the first fren we met had wanted to give us free walkabout F1 tickets! hahahaa! but me and the hubby were oredi too tired.. besides Alyssa was with us.. we wanted to go home, give her a bath and relax oredi.. so we forgo his kind invite..

our weekend trip was really fun! and am so proud of lil Alyssa cos she is super adaptive! even till now, when i leave for work, she doesnt cry.. which is both a relief and a disappointment.. haha!

but i definitely can't wait for the next hotel stay! i wanna go back to MBS! perhaps end of the year? *winks*"
"eventtime","2011-09-26 09:50:00"
"current_moodid","15"
"url","http://pinklolli.livejournal.com/240955.html"
"userid","11930"
"itemid","940"
"event","as i type out the title i realise i'm soon gonna hit the big 3-0! Datz another topic for another day or days. ha!

i'm very happy to announce that my lil princess will soon turn 1 next mth! gonna be 11 mths old next mon actually. =D  She's a such a darling girl who amuses us with her antics everyday.. always feel so happy to see her! she's a precious gift to my hubby & i.

we look forward to celebrating her 1st birthday on 15 oct! i'm more excited than she is! have ordered the party stuff. yay!

she can walk with support and someone holding her hands.. she is still abit afraid to walk on her own.. but its ok. =D i wont push her.. just let her be confident on her own.. although! she can already stand unassisted on her own for at least half a min.. =p

on the love front, all is sweet with me & my hubby. i'm a fortunate girl. even tho my man has a bit of a temper but dere is no denying that he is absolutely sweet to me on most days. i am glad he is an affectionate person. i love dat aspect of him. =)

on the career front - a SWITCH! finally! i've taken the first step! i tendered on 1st sept and my last day will be 30th sept. datz in 2 weeks, yo! am a bit sad to leave this place but i am much more hopeful and excited abt the new job! i do hope the staff will be as friendly and co-operative as my current team (on most days) =p  Countdown begins!

In the past few months, there has been a few life-changing events among my frens.. some are sad and some happy news! but ultimately i hope that things will pick up and be better for all!

toodles~ itz back to work for me."
"eventtime","2011-09-15 14:40:00"
"current_moodid","64"
"url","http://pinklolli.livejournal.com/240655.html"
"userid","11930"
"itemid","939"
"event","been a year since i updated! wahahhaha! 

feels so foreign in this cyberspace.. kekeke.. lame!

its one of the rare moments when i'm actually free in office! WOOO!

but still, i can't do a lengthy post. =p

updates:

my darling alyssa is now 6.5 months old.. and she's growing up well! very happy to report that! =) she's really adorable (a child is no matter wat to the parent! indulge me!) and she is sitting well and has started grabbing things. lil miss curious is the apt nick for her! hahaha! but no matter!

Me and my hubby are still as lovey.. hahaha! but more tiffs tho.. =(  but thankfully we always make up. =) will work on giving him more TLC.. overall we still get some couple time so its not too bad.

gg for a 15-day trip to Paris, Rome and Athens from 19 may onwards.. GOSH! I REALLY CANT PICTURE HOW MUCH I'M GONNA MISS ALYSSA!!!!!! NO HUGGING, SMELLING AND SEEING HER FOR 15 DAYS. SOBZZZZZ.... i am telling myself to be brave... pls let the 2 weeks be over soon and dat she will recognise us when we're back. PRETTY PLEASEEEEEEE!

on the job front, itz currently abt the same. (but i hope not for long!) i've been tasked to take over my boss... but am keen in this position i applied for recently. PLEASE LET ME GET THE JOB! PRETTY PLEASE!

All is well on family front and i hope it continues to stay that way."
"eventtime","2011-05-06 17:01:00"
"current_moodid","68"
"url","http://pinklolli.livejournal.com/240458.html"
"userid","11930"
"itemid","938"
"event","alyssa is now 4 mths 5 days. *gosh* each time i look at her i marvel at how fast time flies! she was still a lil bub 4 mths ago and now.. bigger baby. hahaha!

she did her first flip on tummy on 2nd feb (few days short of 3.5 mths) very proud of her! =) and best thing was i got to witness it. i was disappointed dat i might miss out on events like these but thankfully i got to see it.

she's now more responsive and can grasp things (which she tries to put in her mouth)  the fun part now is to watch her learn new things. but of we haf to watch her more carefully cos she flips once we lay her anywhere. =_=

2 weeks ago she started coughing so it was quite tiring to look after her at nite. cos each time she coughed, i'll be worried she'll choke. thankfully her cough has improved abit. =)

now i'm always looking forward to the weekends when i can spend time with her and my man. =) i really enjoy gg out with them even tho its tiring and i haf to bring along alot of things. hahaha.. 

another of my close fren is preggy! great news.. hee hee.. now dat i'm *ahem* a mummy, i can understand the bliss and joy (and the occasional frustration)  of having a child. sometimes i wish she can grow bit slower so dat i haf more time to see her grow. =)

altho i love alyssa loads, i'm not very sure if i want a 2nd kid. primary reason is i dont wish to go thru the pregnancy, confinement and stress of losing weight. 2nd time round i haf even less confidence.. besides, having to pay for 2 kids is not cheap nor. ^-^  hence the hesistation. of cos my hubby wants. typical. sigh... but i'm definitely not thinking of anymore ""creation"" until 2012. i wanna rest and enjoy my time with alyssa.

each time i look at her sleep, i'll smile. just seeing her sleeping makes me feel contented. and when i see her with her daddy, i'll feel even happier. so i guess its true a child can bond a couple even more... =)"
"eventtime","2011-02-24 09:41:00"
"current_moodid","64"
"url","http://pinklolli.livejournal.com/240243.html"
"userid","11930"
"itemid","937"
"event","wow... been like what? almost 5 mths since my last post. =p

can't blame me.. been occupied with the new member of our small little family.

today marks the day dat i return to work. mistakenly too. =_= hahaha! but i too lazy to summarise.

well the past few mths for me haf been many emotions. BUT! mainly great! =D

i've got a new gal to play with.. ever since my confinement lady left, i've been assigned her new caretaker. hee hee.. and i think i did a great job considering its my first attempt.. i'm still constantly adjusting to her, and her to me.

guess we're pretty lucky dat she's quite easy to care for. but again, their patterns change.. like for the last 3 nites, she hasnt slept through the nite as easily. boooo.. cld it be she knows dat i'm gg to work? sigh...

being a mother is different and not so different either. i still feel the same! act the same and love pretty much the same stuff.. except i haf an additional role.. 

having her been in our lives for 3 mths 1 week, i would say our relationship is still strong.. she adds a lil fun in our lives.. even till now when i look at her, it feels amazing that she's a combination of us. how she has grown from a 1cm cell to the present stage.. 

starting work poses new challenges.. and i'll not get to see my lil gal. =(  i may not get to see her many firsts.. but life is such. but i'm grateful to be where i am and to have what i have now. 

Oooo.. will miss her funny expressions esp when she sleeps. she can whimper or chuckle in her slp.. really fun to watch! and when she yawns.. itz super adorable! she'll end it off with her own sounds.. and when she sneeze too. =)

of cos, taking care of her has its not-so-nice moments like when she's crying and struggling during her cranky hr. ya.. not so nice.. hahaha!

overall, motherhood has been vy enriching... everything has been worth it. since the moment i found out i was pregnant. =D"
"eventtime","2011-01-26 18:40:00"
"current_moodid","86"
"url","http://pinklolli.livejournal.com/239974.html"
"userid","11930"
"itemid","936"
"event","With our lil one on 18th oct! Hee.. Yup. 

Went to see my gynae ytd and routine scan shows dat she's oredi approx 3.4kg which is above average since I've got abt 2 wks to my EDD. Dr suggested inducing as he's concerned abt a too big baby for natural delivery.. =p I've been drinking more full cream milk lately cos bb was only 2.5kg 3 weeks back & I felt her growth was bit slow so worried. But turns out she's doing better this week plus!

Anyway we discussed the date w Dr & between ourselves to arrive on 18th oct.. So likely I'll deliver on 18th or 19th (my dad's & ann's bday) depending on my labour progress. I'll be seeing my Dr on Monday 230pm..by the time I'm warded shld b 4-ish? Gosh!! Nervous lor!!

Dr discouraged hot date like 20/10/2010 as there are mote scheduled c-sec ops on the day..in event dat I wld need an emergency c-sec, he doesn't want my safety to be compromised as manpower is likely to be tight.. The hubbs wanted ytd or today but Dr said if labour drags to weekend it'll b additional cost. =_= plus his surgeries are all scheduled on fri afternoons & he prefers dat his patients don't induce on fri as he doesn't wanna haf to worry abt me and the planned surgery.. So yah lor.. So we decided on 18th! I quite like the date lah.. Now we haf to 'convince' our lil princess to stay in till then! =) 

I had the worst pelvic pain last nite.. Her weight rested on my vagina & butt area so one will perpetually feel this pokey feeling alternatively on these 2 areas. Sobs! And when she shifts her head I feel a jab of pain in the vagina area. Quite xinku.. Last nite I oso had pain similar to menstrual cramp in my lower right side.. Worried me!! Cos we planning to see her on 18th or 19th mah! But the pain was gone in middle of nite.. But will try to rest more on bed..so ironic! The days before ytd I was anxiously looking out for signs but now dat a date has been set for inducing we rather wait.. Haha! Was hoping me & the hubbs can go for movie & bit more dating.. ^*^

I haven told all my frens abt me inducing yet cos dunno wanna gif another false alarm.. Haha! But Monday shld be the real deal. But shall wait till my labor is bit more progressed! Really scared, nervous and yet excited too! There will definitely be a huge huge HUGE learning curve ahead of us! 

Quite worried abt breast-feeding too.. I mean it's good for baby & weight loss..but I'm worried my supply might not be ideal.. Or baby doesn't like to latch etc.. And the fact dat my breasts will no longer be 'mine'! So weird!!!

Sigh but for now I only wish to see a cute & healthy lil girl! Datz the most impt for us... =) looking forward to her first cry! (altho I hope she cooperates & doesn't cry much after..tee hee)"
"eventtime","2010-10-15 09:42:00"
"url","http://pinklolli.livejournal.com/239707.html"
"userid","11930"
"itemid","935"
"event","I guess it's clear 10/10/10 wasn't her preferred choice.. What now? 20/10/10? Haha! 

Still counting down albeit nervousness starting up again (delivery pain & all the whatsoever)!

Anyways I got more shopping done today!! Muhahaha! Ying is back in town finally and she visited me at home today! =) we shopped for bit too! Baby Alyssa has another romper set, top, minnie mouse pj set & new cardi to her collection! Hee hee! Oh & a baby book to record her growing up years thanks to aunty Ying! Am vy happie w today's buys & gifts! 

But I really can't walk for more than 2 hrs these days cos my back will start aching. Sniff. 

=p"
"eventtime","2010-10-13 00:25:00"
"url","http://pinklolli.livejournal.com/239481.html"
"userid","11930"
"itemid","934"
"event","The thot of myself being ""alone"" in this pregnancy arose again. 

Not dat the hubbs isn't loving or helpful or doesn't take care of me.. But I realize we missed out a crucial bonding chance. We shld haf attended pre-natal lessons togets while we cld. But previously I thot itz mostly a waste of our time.

Looking back I regretted it. It wld haf made the hubbs understand more abt pregnancy, my changes & preparing for the new family member. Sometimes I wish he cld be more involved in the knowledge-sense. I wld be able to discuss w him on pregnancy topics. Most of the time I find myself feeding him info.. Which I'm not sure if he gets. =s 

Again I can't fault him entirely cos I do understand he's generally busy & I shld haf been more sure or insistent.. Oh well.. We can only play by ear oredi.. >_<"
"eventtime","2010-10-10 16:01:00"
"url","http://pinklolli.livejournal.com/239209.html"
"userid","11930"
"itemid","933"
"event","Cos it means the hubbs has more time with me! =s

Being on maternity leave has been mostly boring for me cos I'm home alone 90% of the time! From the moment I get up to the time I sleep. =(  it's gettin to this preggie woman, ME! 

Due to the hubbs's job nature, it's inevitable.. Sometime I really wish I haf a hubby who has the same working hours as me... But I do not. It's not a sad thing per se but something I've to adapt to. I think I've been vy independent & sensible when it comes to this. I mean, it's great to haf ur own place & do things at ur own pace. But it gets pretty lonely after sometime..2-3 days of such long days can make one feel miserable.. In my case I even haf to da bao my own meals (I usually go down to get dinner, lunch is a more simple affair of cornflakes w milku. Breakfast is sometimes bought by my MIL) & having meals alone, watching tv alone (I even wanted to talk to the person in the tv show just now! Haha!) 

However my hubbs is pretty appreciative of my independence & understanding which is a consolation itself. And he has the habit of calling me often or msging.. This is a relief of cos.. Otherwise I'll feel like totally alone. :/ I guess in my current state, there is a natural tendency to be even more doted & pampered on.. Sigh.. I wish so. But the hubbs has been mostly great! Hee hee.. He's still sweet towards me.. (he better be right?! After all I'm baking his 'bun') 

I just wanted to rant/whine tonight cos tonight I don't feel 100% ok., but still alright.. Just needed to get this off my chest cos I got bitten by the lonely bug. =(

Well weekend is here! Hope I can haf agoodone!"
"eventtime","2010-10-09 00:25:00"
"url","http://pinklolli.livejournal.com/239088.html"
"userid","11930"
"itemid","932"
"event","Well.. We've finally come so far! Today I'm 37wk2days preggie.. Our lil gal is finally considered full term & shld be a well-developed baby.. Datz by far the most reassuring.. =)

Since my discharge last last fri, the past few week or so, we've been mentally prepared for baby to be out anytime soon.. Looks like we're still waiting.. >_< I'm guessing we'll just get more impatient as this drags on.. It is a dilemma thingy for me as I haf to go through the delivery process before I can see her.

Yup..... Still super scared of the pain to come! I even had 3 dreams of my doctor so far! I din dream abt the baby's delivery process per se but it all has something to do with the baby.. Hahaha! I'm now even more likely to take epidural altho my hubbs has been trying to convince me not to. But I feel more confident if I had this choice.. So I'm gonna use it when needed, datz for sure!

Baby's stuff are better prepared which is a relief.. =) I think we prepared most of what we shld? So this time round we wld definitely be better.. Haha! Now we're oredi bit impatient.. The last time dr did a VE for me was last Monday & I was 2cm dilated.. Wonder why last thurs & today he did not check me? But it's a relief cos oso bloody uncomfy & pain. This morning I asked dr if baby is engaged (for delivery I meant) & he said oredi engaged so I cld probably give birth anytime soon.. Ookkk.. Means still gotta wait lor! It's the suspense datz gettin intolerable.. Like when or how?' I prefer a 'show' which in preggie terms means a bloody discharge..similar to start of menses but definitely not vy heavy.. I feel it's less drama than having the waterbag burst! =p I'll prob haf time to go salon to wash my hair & bathe before ""checking in""!

Baby weighs about 3.15 kg as of today.. Lil bit heavy since I don't know when I'll be popping? in 2 days or 2 weeks time. I better monitor my sugar intake these few days too. =)

Daddy has the date 10/10/10 in mind but we'll let our lil princess decide of cos!"
"eventtime","2010-10-07 18:01:00"
"url","http://pinklolli.livejournal.com/238817.html"
"userid","11930"
"itemid","931"
"event","tuesday started off as normal as normal could be. =_=

dat morning we left for office togets.. was abt 45 mins late for work cos of traffic jam.. other than dat, it was a innocent day off to work.

however whilst in the car, i started realising i keep feeling the tightening of tummy regularly like every 5-10 mins which was a first! at first i thot it cld be the false contractions commonly known as braxton hicks.. i think from the time i got on the car, it started or as far as i cld remember.. it continued till abt 11am.. and i started feeling bit uneasy.. asked pj and she suggested i call the clinic even tho my contractions haf no pain or backache.. i decided not to take the chance and called my doc shortly after. 

upon hearing abt my condition,the nurse told me not to wait and just come in to see my dr. i was huh! orh.. so luckily hubby was still in office so he sent me over. upon reachinig the clinic, they put me on this CTG machine for half hr which measures baby's heartbeat and frequency of contractions.

after which Dr did a VE for me. stands for vaginal examination! OUCH! hahaha! and found me to be 1cm dilated.. said i shld get admitted right away and i was HUHHHHH!! so scared! cos i read from forum, even a mummy at 2cm dilation was allowed to go home first.. and i had to be admitted dere and then! u shld see the faces of both us at dat moment! hahaha!

and then they gave me an injection on my buttock. sobs! pain pain... Dr said it was for baby's lungs in case baby decides to come out these few days.. the injection will help baby's lungs to mature faster.. i had to take a 2nd dose of injection 12 hrs later..

so anyway they called for a wheelchair to bring me up to the delivery suite.. =_=  and once there, we panicked and informed our family and frens cos we really thot i was gonna deliver anytime within 2 days.. hahahaha! forgive the first-time parents. =p

so for next 3 days, i was warded.. initially was afraid on the first day especially since i heard 2 mummies doing their delivery.. the first one was scary! hahahah! made my body go all soft when i heard her screaming.. so i din slp well the first nite.. in fact not sure if i did! was just a bundle of nerves especially when he wasn't in hospital cos he had to tie up some loose ends at work and get my hospital stuff.. i hadn't packed anything at all! but he did great.. i was just nervous dat he wouldnt be back on time if i really was gonna deliver.

2nd day, both of us calmed down as Dr had found i remained dilated at 1cm.. contractions weren't as regular.. so i settled down to a routine whereby the nurse came in 3 times a day to connect me to the CTG machine to monitor me and baby.. baby was especially active in hospital i felt.. but after 3 nights of stay, Dr finally allowed me to go home! cos contractions were irregular and not frequent plus i was still 1cm dilated..

so home sweet home for us! totally glad to be home! i think baby too.. she's more ""quiet"" perhaps more relaxed? since i am too? UGH... hate staying in hospital..

my hubbs has been really sweet and it has been tough for him, he has had to juggle some appts, take care of me... accompany me and also, help his parents in moving the house.. physically he is exhasusted. i think for previous 3 nites, he barely slept 3 hrs each nite and still had to run errands the whole day.. he wasn't in hospital with me all the time but he still made the effort to so i thot he was sweet. =) i mean its his duty too... but at this moment, he just has too much on his plate.. so i kinda understand he can't be with me all the time.

so here i am, back at home. i haven recovered my energy back completely but definitely some! i tidied up baby's room just now.. her cot is here! to see it finally in the room is such a joy. hee hee.. just feel happy.. joy of first-time parent! like vy cute lo! can imagine a baby inside.. kekeke.. so i'm probably gonna put on the bedsheet once its properly dried and air-ed. i've also tidied up my hospital bag..

so i think the next time i go into hospital i wouldn't be so lost and panicky! good for the hubbs too.. hahaha!

now we'll just wait for our lil one's arrival.. its good she has decided  to stay in a bi longer since she'll be a borderline premmie if she's out now.. but dr has said at wk 35, most babies do not have to stay in incubators.. they are mostly developed just smaller than normal.. 

i've got 10 days to reach full term of 37 wks.. so i hope she will continue to grow well! not sure when she will come out.. within 2 weeks? since i'm 1cm dilated.. hmm! but now dilemma cos means i haf to go thru delivery pain.. yikes! =p"
"eventtime","2010-09-25 12:42:00"
"current_moodid","122"
"url","http://pinklolli.livejournal.com/238581.html"
"userid","11930"
"itemid","930"
