"names","values"
"itemid","25"
"event","In which Raymond contemplates a serious decision for the first time in...ever.

Hello, The Internet. You might not know this, but since the start of May of this year I have been living in Downtown Toronto and working at what is supposed to be my last co-op placement of my last year of my sub par community college based education. 

The job has been awesome, and while my hilarious plan to have a ""Summer of George"" (LIKE FROM SEINFELD LOL) has pretty much consistently turned into a ""Summer of Raymond gets his ass kicked by Real Life"", it has actually been a really good experience for me considering I have, for most of my life, been pretty much a lazy waste of a person. I've learned lots about taking care of myself, grown to appreciate what I have instead of resenting what I don't, and thought hard about a bunch of things that people my age have probably already considered and done or not done a half dozen times by now. In short I am finally working towards manifesting all the anxiety I have about growing up and starting to actually do it instead.

I fully intend to MAKE IT HAPPEN.

My job was not at all what I expected it to be when it started. I have made a pretty relentless string of horrible jokes about how my career choice resembles the movie Office Space over the past 5 or 6 years, and this one has been no exception.I may or may not have even known exactly what my job function was for almost the first two months. I literally sit at a desk all day adding and removing access for bank employees all over Canada. Sometimes I add new hires. Sometimes I terminate people. It is usally somewhere in the middle. I make a mistake? There is a guy who's job it is to tell us we fucked up. So sometimes I fix mistakes.

But the job has basically been boiled down to me clicking a string of buttons and typing a whole lot.  And using the enter key on the numpad for some reason. Hard Enter can hard suck my nuts. But the people are pretty awesome. The guy in the cubicle next to me tells me to fuck off all the time, and we flip each other off a lot. The lady in the cubicle across from me shares crackers and I learn valuable future parenting tips from listening to her yell at her son on the phone. The girl that trained me makes fun of me, but never gets mad when I accidentally stare at her boobs.  Them, along with the rest of the security admin team keep saying I should try and get hired on full time after the summer. That it will get really busy and they will need me.

Getting hired fulltime was way up there on my ""List of Goals"" for the summer. But so was getting my CCNA. So was losing 30 pounds and picking up programming again. So was having friends and going to concerts and all sorts of other shit that working full time has left me too tired to do.

I am kind of all over the place here, but I think that is the point. Basically my mind is in two places right now, and I literally have two entirely different choices for what comes next. Lauren and I have been talking lots about our future together, and my ""fallback"" plan back in May when I wrote the ridiculous list of goals, was to head to school with her every day (more or less) and spend the time she was in class getting shit done that I actually want to get done. Going to the gym, studying for my CCNA in the library. Building web sites for both her and myself. Reading a whole fuck lot and basically making up a little bit for those long dark years where my head lived up my ass. My plan was to even start blogging about it and use that as a jumping point for building up my web development skills so I can make Lauren a fancy site once she starts doing Graphic Design crap. The closer we have been getting to the end of the summer, the more likely is has seemed that this plan will be what turns into reality.

But then! Today! I got offered another placement for another 4 months in another department within the bank that deals way more with hands on server (Unix!) and networking and scripting stuff, which I am really interested in learning more about. I thought my decision was made for me when my coordinator from school confirmed that no, I am not eligible for a student work term when I am no longer a student. But my employer's student coordinator actually came back and said they have made exceptions in the past, and she had asked the managers of this new placement for special permission to hire me. Which I have not heard back about yet. This would mean another 4 months in the city as a corporate drone. Is it stupid to not feel ready to work fulltime yet? I am dumb for being so torn up about this, because I know either decision can be hugely beneficial to me. But damnit, this is livejournal! If I wasn't at least a little bit melodramatic in every post then what would be the fucking point! 

TO SUM IT UP:

If you want to move home with your beloved girlfriend and devote 4 months to focusing on things in a way you may never again get the chance to, turn to page 46!

If you want to live in Toronto for another 4 months and get hands on experience in a way more technical placement even though you don't know where you will live or how much your aforementioned girlfriend will hate you, turn to page 125!

If you DON'T want to get eaten by a dragon, DON'T turn to page 104!"
"eventtime","2009-07-23 21:10:00"
"url","http://raymondmoses.livejournal.com/6650.html"
"userid","12637"
"itemid","24"
"event","1. When was the last time you were ""Raymond Drunk""?

I try not to drink all that much anymore because it usually leads to this, so the instances of me getting hammered drunk have greatly reduced over the last little while. That being said I am still pretty much socially retarded, so most times I go somewhere where there are: other people I don't know, booze and no Lauren it is pretty much bound to happen. The last time I did was a month or so ago at my buddy's girlfriend's birthday dealie. It was myself, him, his lady and a bunch of her annoying friends. I definitely got hammered drunk, stole her ""IT'S MY BIRTHDAY!"" pin and did hardcore style twostepping when they tried to get me to dance.
I also got up and left for pita pit when we got back from the bar without telling anyone and told the girl working at pita pit that ""I liked how she had boobs"". 
I lose at life!

2. Does it ever bum you out when we tease you all the time?

Hahaha no way, I like to know when I suck.

3. Are you done with all those comics yet, I have so many more?

I have hit a rut on Starman! I am on the second or third chapter of the second one though and I'm starting to get more into it. Just that and Astro City to go so I will try to work on it - I can't believe I never got into comics before though, one of the things I am most psyched about for once I move to Toronto is being like a 30ish minute walk from the Silver Snail.

4. What was the best concert you ever saw?

This question is harrrrd. It has been a few years since I even went to a show, so my memories have gotten a bit hazy since then. I think best overall would probably be Radiohead at the Skydome in uhh..I forget, just after Hail to the Thief came out. They played for 2 and a half hours and then I went home and masturbated for at least that long. Shows I miss the most though are the hardcore shows with a bunch of different bands. I really miss the atmosphere and energy from those shows. My favourite one of those was seeing Blacklisted and Down to Nothing at Sneaky Dee's. They are both still two of my favourite bands.

5. Will you send me a naked picture of yourself?

Yes - but I am going to get Lauren to photoshop my wang so it's huge.

hahaha....also, I am not posting it on livejournal, I need your email."
"eventtime","2009-03-26 20:15:00"
"url","http://raymondmoses.livejournal.com/6376.html"
"userid","12637"
"itemid","23"
"event","My memory is perforated.
Dotted lines around my favourite images punch holes through the the days where my head was anywhere but floating free above the clouds.

I want your eyes to read the thoughts I cannot speak. Be my empty vessel and let me pour into you. Fill yourself with the words I wish I had, the things I wish I did. See the person I could have been. Tremble at this beast of potential, skeletal remains long bleached by the sun. Believe in the ghost of my confidence, balanced squarely on the shoulders of your faith. Pull the words from my lips and the strength from my guts. Let's feast on the entrails of frowns and regret.


School is almost over! Co-op is almost started!

I should be asleep!

I use livejournal for totally self indulgent purposes!
yay!"
"eventtime","2007-04-11 01:48:00"
"url","http://raymondmoses.livejournal.com/6045.html"
"userid","12637"
"itemid","22"
"event","Yeah so I got breathalized tonight.

I know I don't usually tell any sort of story very often when I write in this thing, but tonight was a fucking story and a half.

For starters I have basically decided that the only reason I go to bars with my friends is because that's where my friends are going...I'm trying to drink less so I almost never get drunk anymore and just kind of hang in the background while more or less everyone drinks. That being said tonight was pretty much the same deal...A friend from school owed me a gram from a previous evening, and he finally gave it to me today at school. That's fine. Me being me I smoked a couple joints and had another joint left in a container I had. This is important background information.

Actually, let's go back. I woke up this morning at 6:30am so I could get ready and be at class for 8am. I learned subnetting, did math homework and listened to my linux teacher read from a text book. Still no police involved. Things are still fine here. After my first block of class, Lauren and I met up to rent movies for an upcoming lazy day and also eat food. After food I had to go back do a presentation in my ghetto communications class (pseudo english for ESL and retards, I didn't write no stinkin' placement test!) I talked for twice as long as the minimum because I definitely thought I didn't have enough of a presentation and my on the spot filler evidently overcompensated huge. Sweet. Despite being long, I have no complaints about my day at this point.

I happened to be on the phone as I was leaving my school parking lot, which I need a pass to get out of. This means that I only have one hand and some cards in my wallet end up on the floor of the car. I think I pick them all up before driving away. I am wrong. This is obvious foreshadowing.

SKIP AHEAD SKIP AHEAD SKIP AHEAD

In the downtime, things you need to know:
1. I rolled 3 smaaaall joints and smoked almost 2 over the course of the evening.
2. I begrudgingly drank ONE beer.
3. This is the important one and makes me have spooky-esque thoughts: Before leaving the library to do my presentation, I make use of someone who hasn't logged off of the school network's print credits. I e-mail my assignment to myself with the subject ""THIS IS BAD KARMA"", and use the print credits anyway.

My friends get drunk. High fives are had, pool is played  and for some reason bandanas are worn.I am now half asleep and on my way home. Skipping further ahead, I am roughly < 2 minutes from my house and going a bit (like 10-20km) over 100 because like I said, I'm close to home and want to go to sleep. I make note of a car's headlights as I speed past the road immediately before the one that my house is on.
Immediately after turning onto my road, the car turns out to be, in fact, of the police variety.
I shit my pants.
The guy comes to the window and asks for my licence. Great. I look through my wallet and hand it to him.
1. It's not my G, for some reason I have not gotten rid of my G2 (I think it's because I'm retarded)
2. I can't find my G anywhere in my wallet.
He asks me if I've had anything to drink. I tell the truth: one beer. He decides this is enough to breathalyze me. I am unshaken-- having already figuratively and almost literally shit my pants, I didn't think this could be much worse.
I am wrong.
I completely forget about my drug paraphanelia- container with joint and 2 roaches in it, rolling machine and papers. The officer does not and asks me what's in my pocket.
I tell the truth. He takes everything.
I blow in the breathalyzer and somehow blow a zero. The lady officer who gave me the test says she has never seen anyone who admitted to drinking (ONE FRIGGIN BEER) blow a 0.0 before.
I shit my pants again but for opposite reasons.
I have awkward banter with officer about my drug habits.
He tells me a criminal offence would ruin my chances of employment.
I nod. They let me go.
I get home and find my G on the floor under my seat."
"eventtime","2007-04-05 02:42:00"
"url","http://raymondmoses.livejournal.com/5819.html"
"userid","12637"
"itemid","21"
"event","Sometimes I read the things I wrote weeks, months, years ago and wonder who that person is and whether or not I've ever actually been myself. I feel like I sift through the thoughts I've lost for glimpses of someone I can never actually be. I question my motivations and am not frightened by the complete lack thereof. Rather I take comfort in my lack of faith. I am strengthened by my throws of apathy and the uneasy comfort of a stomach forever twisted by the anxious desire to be so much more than a part of a society that I am at once chained to and ashamed to belong to.

...yeah, I ran out of steam there.

----SEGUE SEGUE SEGUE SEGUE SEGUE----

Let's blink our way into the future, an entire generation passing itself by while the universe rubs its tired eyes...Stumbles in the dark as our temporary solutions give way to permanent problems.
We cannot know the truth but that does not wash down the lies that take comfort in the ease at which they pass through lips and into ears, into minds. We process everything but question nothing. The revolution has came and gone a thousand times, throwing itself again and again into the rocks, like the relentless assault of a seething ocean. Our heroes splash helpless against their targets while our villains readily walk the line between martyr and scapegoat. Lives so afraid of apocalypse that they unwittingly bring it upon themselves."
"eventtime","2007-03-24 02:37:00"
"current_moodid","87"
"url","http://raymondmoses.livejournal.com/5602.html"
"userid","12637"
"itemid","20"
"event","but it beats the hell out of myspace...and also, facebook.

Alot of crap has happened since the last time I wrote up in this bitch, but I'm still kind of at a loss as to what to write...

Montreal was lots of fun. The roadtrip part was kind of lacking on accounta we weren't on the road for all that much of it, compared to the length of the trip at least. But I'd like to think we met at least part of the recommended triply intake of adventure. Seeing Montreal and pretending I know French was fun too. Lauren and I got hammered and took lots of pictures. We went to Ottawa too, where I was supposed to meet up with a friend I knew from Toronto...except for the part where Lauren's friends roommates told him I wasn't there. Yeah, that part was heavily rooted in suck. But we made it home and neither of us even died!

About two weeks after that, I went to Baltimore with Jen (who sucks) and some people from high school (who don't suck, but even if they did...It would be like they didn't compared to Jen, who, as noted..sucks). This is a trip that was definitely rife with peril and adventure! Some highlights include:
- A random ""Did we get all the drug paraphenalia out of the car?"" inquiry resulting in a heated search of the car and luckily catching the last exit before the border so we could ditch the pipe that I dug out of the glove compartment.
- Upon being pulled over at the border for Jen's car to be searched, realizing that our search was poorly done when a douchebag american asked me ""what i flushed"".
-They found another pipe anyway. hahaha.
-DFD owns my nuts...I got drunk and had good talks and good times and we didnt get shot even though we walked through the ""ghetto for real""

I am coming back to this entry after giving up on writing halfway through! Tying up loose ends = baltimore was sweet!

The past month a whole lot of nothing all that significant has happened. I'm sort of struggling at school, but it's more a result of apathy/""why don't i just play wow?!"" than not really getting the material....procrastination and general responsibility shirking is like the core of who I am! Working on finding a co-op right now though, so hopefully the efforts at desuckifying surrounded those efforts will pull me out of lazytown.

RayFed (is it funny:clever or funny:retarded when I do that?) OUT"
"eventtime","2007-02-18 20:35:00"
"url","http://raymondmoses.livejournal.com/5152.html"
"userid","12637"
"itemid","19"
"event","It was new years! woo!....yeah, sort of. I went to a bar downtown with some friends and ferried people back and forth from the bar instead of drinking for some reason, it was still fun...ish, it's kind of a precursor to something sweet!
Operation: Not Dying in Montreal
Wednesday morning Lauren and I are taking a road trip to Poutineland USA(actually in Canada) with big plans for cheap adventures. I haven't been on a road trip since uh...whenever the last time I went to New Brunswick with my parents, which was at least 3 years ago.

Also this will be the first time I've gone on a road trip with anyone who wasn't my parents. Lauren and I might hate each other by the time we get there...but poutine is the cure for things like that...and if it isn't at least I got abandoned in a place with lots of strippers. After a day or two in Montreal (we haven't decided...we're staying at the roughly 8 star resort ""Le Travelodge"" the first night at least) we're heading to Ottawa for a day and then back in time to hopefully wow it up for a day or two before it's back to school.

I might be going on another road trip with Jen to see DFD's last show, my credit card is maxed out and the ticketmaster outlet in barrie doesn't sell them because it's in baltimore...soo I have to figure that out before the show buuuuut..yeah!

I read something someone else wrote randomly on the internet tonight and it made me write in my journal.

At our worst we find our best.
Shining failure brought to it's feet by the steady hand of a shattered absolution,
a hope that begrudgingly refuses to let go.
Every moment of relapse accompanied by the ghost of second chances.
The redeeming pang of,
""Still time to get it right, still time to set things straight.""
It's the certainty of the dawn that drags us through the night."
"eventtime","2007-01-02 02:49:00"
"url","http://raymondmoses.livejournal.com/5044.html"
"userid","12637"
"itemid","18"
"event","and it's probably the best gift I've got since the last one that I don't have anymore for reasons I'm embarassed to get into.

I went to church this morning with my dad. It made me sad, and it made me happy.
I spent alot of the time I was there wondering if these people would love each other if Jesus didn't tell them to...It's a kinda jaded viewpoint to take I guess, but like...it seems like so many religious people live their lives so religiously that they're almost missing the point. At the same time I believe more things now than I have since I was like 12, so it was a good chance to think about some stuff like that. Except I forgot when to kneel...good thing they ring that bell.

It wasnt a good or bad christmas. it was just christmas, and i'm glad it's over. I'm still awake for some reason but probably by the time I wake up half my family will be here and I will wish I wasn't.

here are some things I wrote in yon journal that I wish I could express conversationally to certain people that I might never actually talk to again.

Drag me to my future with the practiced aggression of deliberate loss of control.
Kicking and screaming, my eyes are focused on blurry vision and a life half lived.
We are innocent victims who saw all of this coming.
A steady descent into a waking dream that only ends when you close your eyes and plead for sleep that never comes.
We walk in the moments buried beneath our tired eyes, bathing in the volumes of subtext we keep secret between the lines.
Caught on that hook, all efforts at happiness shred themselves on a stubborness that knows nothing but commitment to itself.

and this one is about the best friend i never had.

Write me off like somehow it matters, like somewhere along the line we were digging this hole together.
Like somehow I'm losing something that gave back more than I put in.
When really, this is reciprocation. The equation is finally reversed and the bullshit will cancel itself out.
Somewhere along the line I was more than just there. I was better than that shit up your nose or all the fucking lies that you told.
Because the truth is I dig my own holes and even if you were ever in there with me, even for a second, I can't let myself pretend I was ever anything more than a way to pass the time.
No love lost.
I'm pawning those memories for a shot at self respect.
Keep my name on your tongue, because someday I want you to choke on it."
"eventtime","2006-12-26 08:00:00"
"current_moodid","87"
"url","http://raymondmoses.livejournal.com/4836.html"
"userid","12637"
"itemid","17"
"event","Being burnt out on wow a little bit and trying to quit smoking pot I've been working on finding other things to keep me busy....So I tried writing a bit more today...Dunno if I like it or not...the rhyming in the last dealie was the first time i ever really tried to rhyme at all, cause I used to be vehemently against it...but that's just the way it came out I guess, anyway more crap what I done wrote!


I have watched my promising future fade into hopeless past as I pushed these broken memories from my mind a blackout at a time. My fear of hope has chased it into no tomorrow. A world of promise devoid of motivation, vast potential squandered in a sea of apathy. My optimism has given way to love of failure.


We should be outraged but our shiny faces smile and our clocks go right on punching while our lives go right on sucking and your wives go right on fucking. There is nothing left of happiness but the ghost of precious moments, fleeting glimpses into forgotten childhood. Draw a noose around your neck or bite the barrel of a gun, tired old analogies hammer in just how far we all have come.

So where's our anger, what will it take? A thousand more cries of 'it's too late'? We chastise our youth and ignore the old, bitter lives growing cold, cold, cold. We only feel this way because of what we've lost, stubborn refusal to pay uncertain costs. Swallow your ego and open your heart, somewhere you're still the same person you were from the start."
"eventtime","2006-11-15 16:37:00"
"current_moodid","84"
"url","http://raymondmoses.livejournal.com/4387.html"
"userid","12637"
"itemid","16"
"event","draw a line through the things that made you happy, the things that made you sad.
a giant strike through everything you ever thought you had. a line across those faces you only thought you knew, we're crossing out the memories of lives burnt out too soon. bitter lines block out days when we knew better and nights spent chasing dreams, the days when friends could still be everything they seemed. A line to chase away the same new beginnings with their tired old endings. A line across every failed attempt, every abandoned plan, every second chance. Block out that lingering past and erase our shitty future. Draw a line through your fears and your ego, a line through your love, lust and libido. A line through selfish pride, anger and remorse. Draw lines through those around you until it can't get any worse.


....I got the new(est) blacklisted cd finally and the lyrics are making me want to write stuff. I love writing but I'm pretty self conscious I guess...so like, while I'm writing I'm all like ""you suck raymond, way to suck"" and I think I try too hard and that might end up making it suck more. Regardless of that I still like posting it on the internet....I think it's because whether or not I'm good at it or people like it, writing is one of the only things that, when I'm doing it...I feel like I'm supposed to be doing it...like sometimes it just comes out and it makes me feel better.

Another thing about this band is listening to them makes me really wish I was in a band...a hardcore band probably cause they're the most fun for me live. I feel like that when I listen to hardcore pretty much all the time, but these guys make me feel like I could do it. Minus the part where I don't know anything about making music, other than that though....totally do-able."
"eventtime","2006-11-13 14:23:00"
"current_moodid","4"
"url","http://raymondmoses.livejournal.com/4254.html"
"userid","12637"
"itemid","15"
"event","we are bound by our nature but not restricted to it.

Do I know what this means?
probably not entirely! but it crawled into my head either way and i don't like writing as much as i like typing soooo
the end."
"eventtime","2006-10-25 23:28:00"
"url","http://raymondmoses.livejournal.com/3865.html"
"userid","12637"
"itemid","14"
