"names","values"
"event","Consult not your fears but your hopes and dreams.

Think not about your frustrations, but about your unfulfilled potential. 

Concern yourself not with what you tried and failed in, but with what is still possible for you to do. 

Forget about all the reasons why something may not work. You only need to find one good reason why it will. 

Others can stop you temporarily -- you are the only one who can do it permanently. 

Happiness cannot be traveled to, owned, earned, worn or consumed. Happiness is the spiritual experience of living every minute with love, grace and gratitude. The happiness of your life depends upon the quality of your thoughts. 

Until you are happy with who you are, you will never be happy with what you have.

If you can imagine it you can achieve it. If you can dream it, you can become it. 

Find arms that will hold you at your weakest, eyes that will see you at your ugliest and a heart that will love you at your worst.

Once you have found that, you have found TRUE LOVE!  

The brightest future will always be based on a forgotten past. 

You can't go on well in life until you let go of your past failures and heartaches. 

You make me smile for no reason whatsoever, you make me laugh at the funniest things, but most of all you make me love you when I should not be loving you at all.

What's the sign that a person really loves you? It's not the things he gives you like flowers or kisses... it's the things the person doesn't give you... like tears in your eyes and pain in your heart. 

Love is not destroyed by a single failure or won by a single caress. It's a lifetime venture in which we are always learning, discovering and growing. 

Love is the triumph of imagination over intelligence. When you experience love for the first time, real love, you live a  new life;one that you never knew existed before."
"eventtime","2004-01-18 23:08:00"
"current_moodid","109"
"url","http://resistenza.livejournal.com/3709.html"
"userid","12792"
"itemid","13"
"event","yep, my thumb ring that ive worn since the summer after my freshman year... has broke. it's been cracked for a few weeks now, but today i noticed that it is no longer shaped like a (FULL) circle anymore. will need to get that fixed asap. 

i just got home today from austin. while driving down hwy 71, i got pulled over by a state trooper going the opposite direction... i was going 88, but luckily he let me go after i explained why i was in a hurry. see, it was my grandparent's 50th anniversary and the party started at 5:30. dad asked me to bring my camera and take pictures of the event, but i didn't have much time to haul ass to houston because my car wouldn't start. it's been doing that for the last few days - which i will get checked out on monday morning because i've got to get the oil changed at dad's office, do some work for him, and of course see whats up with my car. so once i finally got it to start, i left austin about almost 4pm. yep, so that left me about an hour and a half to get to houston when it takes a little over two hours. *knocks on wood* i need to stop speeding. 3 tickets in 7 months is too much. 87, 83, and 48mph.. jeez. i really love the thrill of driving fast though. i heard this quote one day by mario andretti... goes something along the lines of, ""if everything seems under control, you're just not driving fast enough."" 

haha anyway, i arrived at MY house at exactly 5:30, and rushed to get my camera bag and left to my grandparents... but it's a bit far. took me about 20-25 to get there, but i had to stop at the store to get some 400 film. i only had 100, 200, and scala.. so yeah, that took a couple minutes. arrived at my grandparent's house in tomball at just about 6pm. i walk in, and my aunt vicki - who was in the kitchen - says shhh sshh.. my grandparents were JUST about to start doing their vows to each other... it was sweet. i wish i could understand what they were saying though. it's like wow.. because they've been married for 50 years, and throughout those years, they had 4 children, and ehh... 12 grandchildren- i think? it was nice to see the familia again. saw some other people i hadnt seen in YEARS.... holy cow.. i saw anthony!! the last time i saw him... he was like.. not even 10! i think he was like 7 or so the last time i saw him.. and he's now 16 years old. all grown up. for a minute, i didn't recognize him, but after a few seconds of analyzing his face, i realized it was him. he's my aunt's (by marriage) brother's wife's son.... i think? also saw his little brother, and new sister that i never met. and this other guy donny and his son (i forgot his name?) whom ive not seen for maybe almost 10 years as well.  the last time i saw his son, he was a baby. and now he's just about tyler's age. all of my kiddie cousins are so tall and grown up.. it's scary. jessica is fucking taller than me!!!! and she's only like 15. she's gorgeous though. long long long blonde hair.  i was disappointed i didn't get to see katie. wasn't there... ohhh ya, celeste was SOOO adorable in her little pink dress. everybody was dressed up nice.. was kinda weird seeing all my little cousins all dressed up. after about 3 hours at the party, we left.  ty wanted to ride with me, so during the whole drive home, he was singing at the top of his lungs to every song on linkin park's meteora cd. he loves linkin park so much. used to always listen to their hybrid theory cd, but since nick got him the new one for christmas, now he listens to that one all the damn time. we had the music on pretty loud, so ty would ask me ""can you feel it?"" ""feel this.. feel this"" made me feel the vibrations on the armrest on my door. he was insane though, opening the window - hey, its like 40 degrees outside! but we compromised... by opening the moonroof bc the passenger window down was too fucking cold.  i need to see ty more often because its the only way he will sign. he doesn't have anybody to sign to or practice with so he starts to forget after a while.. practice makes perfect, i tell him. so when im around him, i make him practice. oooh - i gave ty a wedgie about 50 times during the party. why? because he kept on hitting me. i told him, each time you hit me.. you get a wedgie, period. so.. of course, he hits me.. wedgie.  hit, wedgie.  i think he LIKES it. :)   dad thinks so too. 

haha ok enough about the party. my week in austin was pretty good. was very different from the week before. i stayed at nick's apt and slept in mike's room since he was out of state on vacation in colorado with his family. comfy bed, i must say. me and ryan have hung out quite a lot. he's a really nice guy. it was the first time i had really met him. i met mike a while back when we went out to eat at bone daddy's, and had heard nick talk about ryan because of this girl they both liked, kayla... so i finally met him earlier this week. we went out to play pool one night - because he wanted to see if he could beat me. waiiiiit, i just realized something. i met ryan before! like a few weeks ago. mike, ryan, and i ate at double daves and played pool. me and ryan teamed against mike and crushed his ass. ok, now i remember. so correction- this was the 2nd time i met him.. but the first that i really hung out with him and got to know him. also went to a little houseparty with him and met up with nick. met this girl nick told me about with cankles. she didn't look like it, but i cant see. she had on jeans. the whole night, i was signing and signing. ryan and this other guy, chip were like in awe. chip- he is pretty good at understanding me- but im sure reading lips, not my signs. he is SO curious about sign language and always asks nick how to sign this and that. i love it when hearing people take interest in ASL and/or the deaf culture. hmm, lets see what else i did. ah yeah, i visisted meggie at her new apartment. it looks cute. pulled an all nighter and left her place at like 7am. man, i have got to STOP doing this. i seriously need to change my body clock. i am tired of staying up so late and getting up so late. wonder if that could be why im so tired and weak all the time? have got to start getting up early so i will be real tired and sleep earlier at night. hmm what else... went to acc and tried to get registered for classes, but could not because i had to take the compass test before i could register for classes. but by the time i got the results from the test, it would be too late to register. so, if i do end up moving to austin, my classes will be online because i am already registered for 4 classes at hcc. may add one more. dont know for sure yet. did not really do any job hunting because last week i actually started thinking... is austin where i really want to be? because now, im not so sure. i know it is where i want to end up living when i settle down and start my own family, but is it what i want right now? i dont know. dad's really pushing me to move. better job opportunities. better school opportunities. my friends are there. school in austin is out of the picture now though. still need that job. i have very little money to spend every month and am tired of it. honestly, i miss going to work and getting dirty everyday. i miss doing all the paperwork on the cars. i miss talking and having fun with some of my co-workers. i miss it.. because i quit. i shouldn't have. oh well. hmm, i also hung out with micha a little bit throughout the week. last night, went to tsd for the basketball games. that was weird! i havent been in seeger gym since homecoming of '02. been quite a while. saw ms fortney!! finally! saw ms deleonardis again. didnt get to see sean mcgrath :( i miss that fella. saw some other old tsd students.. met some new ones. oh ya, saw danieeeee!!! we had a long long good talk about a lot of things.. she is so grown up now. i am proud of her. she has done quite a bit of growing up over the last few years. she said to me that i sort of fill in lake's shoes when she's not around. i had to nag at her a little bit yesterday, because lake's not there to do it. she's gotta have someone to look out for her. hopefully lake will come to her senses and realize what she is doing. what lake is doing now, i think she will learn a lot from. i just hope she wakes up, sooner rather than later. after the game at tsd, we went to kelly and jacob's. danie wanted to join me with mike. we ended up drinking beer and playing card drinking games. learned a new game- egyptian war. love it already. after like an hour of playing or so, mike was like come here (outside to the patio) and when i open the back door.... guess who is sitting there? eli. 

i just took a look at him and walked back in the apt. i was actually kind of pissed, but at the same time surprised and happy to see him. im always happy to see him, but it pissed me off last night because we were smoking earlier and i was drinking. i dont like him seeing me drink or smoke. i dont like him seeing me high or drunk. after the last time he saw me stoned, i said to myself, he will never see me smoke again bc im never going to smoke in front of him again... and i got upset because he saw me. we talked alone for a little bit and then we took danie home cos she had to be home at two. we watched some televizzle and then went out to magnolia's cafe. i was still half mad, half happy with him. happy, because he's here with me. mad, because we didn't have the talk i wanted to have for the last two weeks. but the night ended good. got a goodnight kiss on my forehead. 

i am feeling a bit better now that we have talked some. that boy. uuugggghhh. he amazes me sometimes. the things he says. his bluntness. interesting conversation we had tonight. hmm, well it is now 5 minutes to 5 and i am done with typing. i have a lot of things on my mind, still, but i dont want to get into it and give everyone the benefit of knowing all of my thoughts at the moment. 

off to attempt to catch some sweet zzz's. 

qotd: ""shit, whitney, you scared me!"" - mom, when i woke her up. 

xoxo."
"eventtime","2004-01-11 03:46:00"
"current_moodid","48"
"url","http://resistenza.livejournal.com/3410.html"
"userid","12792"
"itemid","12"
"event","has a nice ring to it, doesn't it? two thousand four. 

ahh, i am finally back in houston. spent a week in austin. was supposed to be looking for a job, but pratically bummed around during the day and then going out at night. did not get any job hunting done, but i did get an appointment with a temp agency this week. hey! little progress is better than no progress at all!! i will be going back to austin tomorrow after i go to HCC to get my college transcript, if they are even open. i need to register for school so fucking bad, because classes start at acc next week. hopefully, i'll be able to get into classes. if not, internet classes will have to do. i don't like them, but sometimes it's the last option. id rather be taking them online, than not taking any classes at all. 

this week in austin was very relaxing. again, i got to see some old friends - which is always good. finally got to see teara and spend some time with her. i hadn't seen her since nye last year, so its been quite a while. she held onto this picture of tyler that i apparently left over at her house a (VERY) long time ago or something.. she had told me about it a few months ago so i told her to hold onto it til we saw one another again... and i see the picture, and its this OLD OLD pic of ty when he was just born. he was probably a month old, if even that old. i had completely forgotten about that picture because i hadnt seen it in so long. when i first got the pic from her, we went out to eat at magnolia's cafe (my first time- not bad) when i was in my car, i compared the two pics of ty at 1 mo. old to the one of his school picture for this year-- he's 9 now!! he still has his chipmunk cheeks :D still has his strawberry bottom chin, and the same nose. so cute!! 

anyways, on new years eve, we went to america's party. it was so packed there. a lot of people left early to go to 6th street though. saw a lot of people i thought id never see again. reggie started a fight with gilly, but it was quickly ended. the cops came later, saying for everyone to go inside - a lot of people were outside in the front by the parking lot. everything was cool though. after 12, we left. wanted to go to 6th st. as well, but we stopped by kelly's apt first. there were 7 people in my little ass car. dont forget that it's a geo prizm!! tiny little car. but somehow we managed to fit eli, sergei in the front, with jake, teara, megan, and angela in the back. i dont know how we did it, but we did it! :)  a lot of people from america's party ended up at kelly's as well. we all finally left around 4something in the morning. sweet zzz's. i didn't get much done in austin that i wanted to get done.. which was to visit nick, mike, and ryan. look for a jobby job. use my slr cam and finish up some of that scala film. go to amy's ice cream. register at acc. although i did not get these stuff done, some good things did happen. i got to see eli, finally!! hey, its been almost three months!! got to spend some time with him. i got to eat at sandy's. ive not been there in so fucking long. got to go to boyz cellar like two nights, i think. and i got to see everyone! i got to see laura and hay's apartment for the first time. oh ya, i did get to try austin's lemon pepper chicken @ wing stop. houston's better. loaded with more flavor. yummy. 

seeing eli on sunday in houston was great! he and i had planned to go to the houston aquarium, but as it was getting late, i had my mom call him on my cell phone to see how far he was from here.... they talked for about a minute or two. she hung up and said, ""he's not coming. he had to turn around. there was bad traffic in la grange that was backed up for miles.""  i was like, awww. my heart sank. earlier that day, i was grinning from ear to ear, so eager and excited for him to arrive... and then just like that, my smile was gone. i went into my room, and dad came in and said, ""you left your car lights on.""  im like, *thinking* ""no way, i just got home like 45 minutes ago, and i KNOW i did not leave them on."" so im like ehh?? ok.... so i get my keys to go check.  mom and dad are like standing near the doorway/foyer and mom looks out the window (apparently to check whether my lights are on or not) and i open the door. i turn around facing my stepdad, and i say.. i know i did not leave them on.

i turn around.... and there is eli. :) :)

bam, just like that, all smiles again!! gave him a huge hug and we talked inside for a few and then headed off to the aquarium. funny thing is it's right by i45 and is SO visible to everybody who passes it... but i dont think anybody knows how the fuck to find it. since it is in downtown houston, many of the roads were one-way streets, so we were literally going in circles, getting lost, figuring our way there, getting lost again, figuring it.. lost.. and then finally finding it. on the outside, it looks awesome. looks fuckin huge inside.. we go in, look at fishies, and eli tells me which ones are which. i was pretty much his student for the next hour or so. we got to pet these tiny little stingrays.  their ""skin"" is soooo soft and slimey, but theyre so cute. there was this little glass dome inside the tank, but i didn't notice that there was a little kid in there looking at the fish from ""underwater"". and i go hey!! theres a kid! how the fuck?  and eli points to where the kid accessed it.. and im like, hey, i wanna go under there!! so i wait for the kid to get out, and eli's thinking that im crazy, but im like hey... why the fuck not?? :) so i get to my knees and hands and crawl under.  it was so FUCKING TINY... but it was cool seeing stingrays swim at eye-level, and on top of me. i got out after a min and then eli went under there... haha. and then, the aquarium was over... we were like, ""Wtf? that's it!?!?"" cos it was a lot smaller than we thought.. and we figured it out- one floor, aquarium. 2nd and third floors, restaurant. 
yep, that explains it.  afterwards, we went to the hard rock cafe, but it was soooo quiet in there considering the fact it was like 10pm on a sunday. we talked, chilled, and ate. after that, he went back home to austin. 

it was great to finally see him. i kept on telling him not to cut his hair, cos it looks sooooo adorable. its getting quite long now, and since its curly, im like ooh la la. 

since the 30th of last month, i feel different. things have happened since then.. :)

qotd: an honest voice is louder than a crowd's. 

xoxo."
"eventtime","2004-01-05 01:48:00"
"current_moodid","15"
"url","http://resistenza.livejournal.com/3074.html"
"userid","12792"
"itemid","11"
"event","damn, its been a long time since i have updated my LJ.  whats new with me since i last typed up something in here? hmm.. oh ya, school's done. finalllly! this was a fucken long ass semester and im so glad its over. i also went to austin for nearly a week and got to see a lot of old friends. its always good to see everyone. it was really great being out of houston for a week. i got to do one of the things i wanted to do during my visit in austin and that was to go to the 37th street lights show thingy. after begging and convincing mike to go with me, we finally went. i told him he would like it and wouldnt be disappointed, but he was like.. no, its just lights!! im like cmon, just wait n see see. ah, and sure enough, it was awesome. i dont think it was as good as the last time i went there, but the lights were still incredible.  i would love to live on a street like that, where all the neighbors agreed to light up their house with millions of lights. mike thought it was cool too, so mission accomplished. since i have been back in houston, i have finished up my shopping and only have one more thing to get tomorrow- for nick.  i also have to get my other set of parents something as well, but i have until friday to do so, bc we aren't celebrating our christmas until saturday. 2 nights ago was dtec's christmas party and it was actually fun.  last year's kinda sucked bc it was organized by this bitch at work, lacee. the party was too.... how do i put it? too ""nice"". just too boring. but this year's party, organized by my daddy, was mucho more fun. there was dancing, and it was very laid back. everyone seemed to really enjoy themselves. some people had a little too much fun. a lot of booze involved. :) and now tonight, when i finish this up, im going to ANOTHER christmas party, at my dad's house. we do this every year- fry turkeys and have all the neighbors and some friends over for more booze and fried turkey, of course. daddy says gonna be fun. i guess ill be the judge of that when i haul my ass over there. 

anyways, here's a little something from my other journal, so i dont have to type it all up all over again. thank goodness for copy + paste!! :D  

shit, two more days until christmas.  and then in just about a week and a half, the year is going to be over. like i have said before, time is really flying by so fast and i dont even know where it goes.  hmm.. right now, life is really shitty for me. im just so unhappy here. im tired of being in houston, and when i go to austin, im so much happier.  although im not completely happy, things are better there than they are here.  i know that in order to be totally happy, i have to let go of things in my past and move on. i have a lot of things to figure out. a lot of thinking to do.  i need to figure out who i am as a person and who i want to be.  right now, im just so scared of living.  im not saying i want to die, because i dont, but life scares me. i feel like i need to move away, somewhere far away and be on my own for a couple of months or even a year.  i need to discover myself and experience life away from everybody i know and love. 

last night really sucked because of what happened with a certain person. im just going to call him sulley. (and why sulley? bc its the first thing i see when i turn my PC on- wallpaper pic of sulley and boo from monsters, inc.)   i did something really stupid 2 nights ago and i told sulley about it last night because i didnt want him to not know.  it was eating me up so bad. i couldnt get it off of my mind.  sulley's really REALLY good at making me feel guilty.  i already was feeling really bad and ashamed of what i did, but he made it so much worse.  i guess i got what i deserved though.  i told myself a long time ago i would never cry over a guy. i didn't want to cry, but it was soo hard to keep myself from allowing these tears roll down my cheeks, staining my skin with the pain that they hold. it got me thinking about a lot of things, like how the hell do other people do it without it bothering them? doesn't it eat away at them?! how can they live with that guilt? funny thing is sulley and i aren't even together, but i couldn't not tell him. it hurt too much to lead him on thinking everything was ""perfect"".  everything about that night, i totally regret. but when i think about it, i think of it as a mistake that i learned something from. being so inexperienced with relationships, this was a wake up call. it has taught me that even if you're not with somebody, but but you care about them, then dont do something stupid to fuck it up.  i am so much more aware now that i have felt these emotions and caused pain not just for him, but for myself as well.  to be honest, i am starting to wonder if i even deserve him.  he's such a wonderful person and i feel that he deserves someone better. i feel like if somwehere in the future we were to go out, i think i would tell him no, even though i want him so much. 

yeah.. fuck.  

well.. now that this is out, im feeling a TAD TAD TAD bit better. i know im not going to feel better for a while, but its my problem to deal with. 

QOTD: Why can't we get all the people together in the world that we really like and then just stay together? I guess that wouldn't work. Someone would leave. Someone always leaves and then we have to say good-bye. I hate good-byes. I know what I need. I need more hellos. 
-Snoopy.

xoxo."
"eventtime","2003-12-23 19:12:00"
"current_moodid","111"
"url","http://resistenza.livejournal.com/2936.html"
"userid","12792"
"itemid","10"
"event","Guinness. My goodness my guinness. You are dark and<br>mysterious. There is something people just<br>can't describe about you, besides that you love<br>head.  You are a good one, but can only be<br>handled by a small percentage of the population<br>(unless you're in Ireland).
<br><br><font size=""-1""><a href=""http://quizilla.com/users/beermakesmefeelgood/quizzes/Which%20Beer%20are%20you%3F/"">Which Beer are you?</a></font><BR> <font size=""-3"">brought to you by <a href=""http://quizilla.com"">Quizilla</a></font>


thats a helluva beer."
"eventtime","2003-12-10 22:41:00"
"current_moodid","33"
"url","http://resistenza.livejournal.com/2812.html"
"userid","12792"
"itemid","9"
