"names","values"
"itemid","79"
"event","Let it be known to anyone reading....


WE NEED A CAR!!!!! PLEASE!

Anyone who knows anyone that has a decent car for sale on the inexpensive side...please let us know.


Thank you, that is all."
"eventtime","2004-03-11 22:40:00"
"url","http://rkitten27.livejournal.com/20344.html"
"userid","12898"
"itemid","78"
"event","I apparently answered my own question...I have just set up a paid account. Anyone who has me listed as friend on this username will need to add the new one...weirdodragoncat.

I will still post to this account but infrequently. weirdodragoncat will be the one I post regularly to from now on.

Thanks"
"eventtime","2004-03-09 21:46:00"
"current_moodid","90"
"url","http://rkitten27.livejournal.com/20003.html"
"userid","12898"
"itemid","77"
"event","I find that my current user name that I use for...well everything, no longer suits me. Unfortunately, the process to change it on livejournal is complicated. I am uncertain if I should pay the fee to change the current user name or if I should just get a new account altogether.

Anyone have any thoughts on this?"
"eventtime","2004-03-09 20:05:00"
"current_moodid","30"
"url","http://rkitten27.livejournal.com/19752.html"
"userid","12898"
"itemid","76"
"event","<center><a href=""http://paradox.of.arden.tripod.com/quiz/princess/index.html"" target=""new""><img src=""http://fuzzy.snakeden.org/images/buttercup.jpg"" border=0 alt=""Buttercup""></a><br><br><a href=""http://paradox.of.arden.tripod.com/quiz/princess/index.html"" target=""new"">Which Princess Bride Character are You?</a><br>this quiz was made by <a href=""http://www.livejournal.com/users/mamaslyth"">mysti</a></center>"
"eventtime","2004-03-08 23:17:00"
"current_moodid","44"
"url","http://rkitten27.livejournal.com/19631.html"
"userid","12898"
"itemid","75"
"event","I meant to post yesterday but unfortunately came down sick. I'm still feeling weak and am trying to take it easy today.

Saturday started out sucky but got better. I had to work (that was a big part of the sucky factor) and worse, I had a meeting once the bank was closed. That was boring because it was stuff I already knew so it mostly just wasted my time. Then I left to get to the BART train. Michael called and told me that he wasn't doing well without his meds and did I bring them. This was good to know since usually he has a bad habit of not telling me how he's feeling until after he's already blown up at me.
Saturday evening was wonderful...
I had invited my new german friend to come and play at a party I was going to. He brought his violet wand set with him and we got to play with that a bit. It had been a REALLY long time since I'd played with one of those (for those who don't know, a violet wand is an electricity play toy). I ended up expending quite a bit of energy at said party and ended up with a bit of an energy hangover the next day. 
I initially thought my feeling crappy was due to the expended energy from the previous night but now know it was a combination of that and the illness that I had felt trying to come on Friday. Just when I thought I was starting to feel better Sunday evening, I started to feel super crappy again. I decided to lay down on the couch. Victoria snuggled with me and Frank (my cat) lay on me as well. 
Michael came home and I guess because he was tired and not feeling up to playing caretaker..snapped at me. I naturally did not react well. Fortunately what normally would have escalated into a full blown fight just tapered off with me crawling into bed to watch TV. 
I think I sweated out most of what was making me feel crappy last night.
I still felt weak this morning and it was a MAJOR effort to walk to work. I got there late. Not that it mattered...our computers were down. The only things we could do were straight deposits and payments. I really hate having to tell people the same thing several times. 
I ended up leaving work early. I am now home and trying to take it easy."
"eventtime","2004-03-08 13:34:00"
"url","http://rkitten27.livejournal.com/19377.html"
"userid","12898"
"itemid","74"
"event","The day before I went on vacation to Indiana, I had to go get bloodwork done for my doctor. I wasn't able to find time to do it sooner.
I showed up at the lab having done the requisite fast (anyone who knows me well knows that me having not eaten is a SCARY thing...bitchiness ensues quickly). There was no one waiting and only one person (man) working at the time. He takes my info and a few minutes later calls me into a room. I proceed to tell him what I tell every lab person thats ever tried to draw my blood: get it from the top of my hand since the veins are easier to find and less painful for me. I tell him that theres no point in trying to find a vein in my arm as they are usually too deep to find easily. After making one severely half-assed attempt to draw from my hand (he didn't even try to stick me there), he says he's going to draw from the inside wrist. I immediately say 'NO! That will hurt like hell and the veins are likely to collapse too easily that way'. Does he listen? NO! Istead, because I dared to attempt to stand up for myself, he claims I'm being abusive and that he's refusing to do the test. This sets off a panic reflex in me and I start crying. He goes back to his desk, gets on the phone, and proceeds to ignore me crying hysterically for the next 10-15min. I had to beg him to do the test (I wasn't going to even be in the state for the next 2 weeks and I had a doctor appt. 4 days after I got back). The entire process was completely degrading and humiliating. He did indeed attempt to draw from my inside wrists...and it did in fact hurt like a motherfucker...and of course the veins collapsed (just like I said they would). He got some blood and said he was going to send it in and maybe there would be enough to do the test. I left hurting and emotionally drained and having to be at work not long after.
The next day, I started to develop what would turn into nasty purple and blue bruises on my wrists which would last for about a week.
The best part of all this? Apparently the labass botched the test so badly that my doctor called my house and then my work in a panic. She kept asking how was I feeling, was I in pain, dizzy, bleeding...etc. I did not understand until she said that the results of the test were SO BAD that if they had been accurate, I would have needed to be in the hospital. I ended up having to tell her that I was going on my vacation anyway and that I understood it would be AMA and that I would take full responsibility.
I felt just fine the entire trip.
Today I went back to that same lab fully intending to have it out with them. Turns out that particular labass is no longer with them! Yay! I don't know if he quit or was fired but at least he won't be hurting anyone else at that lab. And to make up for all that headache even more....the lady who took his place was an absolute sweetheart and did everything she could to make me more comfortable.
I'm still not happy about having to go back and re-do the test but at least that ass-master wasn't there. That made my day.

That took up a good portion of my Friday. The rest of the day was drama-filled as well. 
Michael had trouble navigating public transit and ended up throwing a tantrum about it. After a long period of not answering his phone and not hearing from him...he cooled down and made it to the RabbitWarren. I showed up about an hour or so later. I think I got there too late to be of much help.

Bonus that made my day end beautifully tho....I left RabbitWarren with girlfriend, took her out to dinner, came back to my place and had great sex. Yay! Happy ending to otherwise sucky day."
"eventtime","2004-03-05 23:43:00"
"current_moodid","64"
"url","http://rkitten27.livejournal.com/19100.html"
"userid","12898"
"itemid","73"
"event","Layer.one
Name: Rachael Annastasia Bradshaw
Birthdate: June 5th, 1972
Birthplace: Santa Cruz, CA
Current location: Richmond, CA
Eyes: Hazel
Hair: Currently, burgundy red
Height: 5' 6""
Righty or Lefty: Lefty
Zodiac Sign: Gemini

Layer.two
Your heritage: maternal grandmother from England, paternal heritage is Swedish I believe.
Your weakness: nasty temper
Your shoes you wore today: Black leather Mary Jane style flats.
Your fears: being alone/abandoned
Your perfect pizza: Cheese,  pepperoni, and black olives.
Goal you'd like to achieve: get back to drawing regularly, buy a house, get a better job

Layer.three
Your thoughts first waking up: murfle...light, bad...more sleep. 
Your best physical feature: my legs
Your bedtime: When I get too tired to work any more.
Your most missed memory: seeing my mother regularly
Layer.four
Pepsi or Coke: Root Beer
McDonald's or Burger King: No.
Single or group dates: Yes.
Adidas or Nike: no.
Lipton Ice Tea or Nestea: Earl Grey or other good quality highly caffinated tea with milk and sugar
Chocolate or vanilla: Chocolate, dark
Cappuccino or coffee: No thanks.

Layer.five 
Smoke: No. sensitive to cigarette smoke, cigar and pipe smoke will make me physically ill
Cuss: fuck yes.
Sing: usually when no one else is around since I'm rather self consious about how I sound.
Take showers daily: almost every day.
Have a crush: A few.
Think you've been in love: I love a lot.
Want to go college: I may go back someday
Want to get married: Already have one husband. 
Believe in yourself: Yes, mostly.
Get motion sickness: not anymore thankfully (I used to get car sick)
Think you're attractive: Usually.
Think you're a health freak: No, but I would like to be healthier.
Get along with your parents: for the most part. 
Like thunderstorms: not really

Layer.six - in the past months
Gone to the mall: Yes
Eaten an entire box of Oreos: no
Eaten sushi: yes
Been on stage: dancing at a goth club (no room on dance floor).
Gone skating: No.
Made homemade cookies: helped a bit making cookies at holiday time
Gone skinny dipping: Hot tubs only but sadly not recently.
Dyed your hair: oh yes.
Stolen anything: have in past (distant past) but not in recent years

Layer.seven - ever.
Been trashed or extremely intoxicated: Yes, but not in a long time. 
Been called a tease: Oh yes.
Got beaten up: Yes.(again, long time ago)

Layer.nine - In a guy/girl... 
Best eye color: any color...I like intense, piercing eyes that seem to look right through you.
Best hair color: All kinds...
Short or long hair: long hair is my preference but sometimes short is ok
Height: Doesn't actually matter, but tend to prefer tall men. height on women doesn't matter to me
Layer.ten
Number of drugs taken illegally: 2, rarely.
Number of people I could trust with my life: seven
Number of CDs that I own: 700+ and still growing
Number of piercings: 4 in one ear, 3 in the other, right eyebrow, tongue, left nipple (closed up tho :( ).
Number of tattoos: one..right outer thigh.
Number of times my name's been in the news: to my knowledge...twice. both times as a child.
Number of scars on my body: 3 that are noticeable
Number of things in my past that I regret.: none anymore...I used to regret how a past relationship ended but have since delt with that and moved on."
"eventtime","2004-03-03 01:24:00"
"current_moodid","101"
"url","http://rkitten27.livejournal.com/18938.html"
"userid","12898"
"itemid","72"
"event","Its been some time since I posted anything...

I've had a lot to deal with lately.

Recently I went on vacation with Michael and Victoria to Indiana to see our friend/my sweetie. Michael and Victoria stayed for one week and I stayed an additional week without them. Overall it was a good trip. I broke a few barriers regarding my relations with women...this was good, very good ;)
There was some drama towards the end of the trip that led to a REALLY long late night talk with Indiana sweetie (yes, I'm leaving out their name intentionally in case anyone's been wondering). This made me realize that there are a number of aspects to my relationship with Michael that need to change/need work.

I am now in the process of starting that work...its going to be hard but hopefully there will be some lasting change this time."
"eventtime","2004-03-03 01:18:00"
"current_moodid","101"
"url","http://rkitten27.livejournal.com/18534.html"
"userid","12898"
"itemid","71"
"event","Last night I felt somewhat depressed even though I was at one of my favorite places. I thought I'd missed an opportunity and was feeling sad about it.
I clarified things today and the opportunity was not missed after all. I feel better.

I still feel stunned and sad about a friends recent troubles in relation to their child. I suppose I'll continue to feel that until that situation resolves itself for the positive.

My work environment is likely to improve soon. An opportunity presented itself to me on Friday and I now may have the chance to transfer to another branch. Yay! This would also get me mostly full time hours. Yay!


I think I'll type more later...."
"eventtime","2004-01-20 22:57:00"
"current_moodid","96"
"url","http://rkitten27.livejournal.com/18275.html"
"userid","12898"
"itemid","70"
"event","ick...

I had to stay home from work today. I woke up feeling like shit. I didn't think I'd be very useful to anyone if I showed up. I spent most of the day sleeping and woke up with a headache for my trouble.

On a positive note...

I spent an enjoyable evening at a friends house in Concord. We watched 'League of Extraordinary Gentlemen'. We shared artwork and talked (mostly about art related topics). Its nice to have another fellow artist to talk to. I don't get that often. 
I'm still uncertain how to approach my attraction to him tho...
I'm not sure where he stands on relationship/involvements and don't want to cross any lines. I guess I'll just continue as I am....being his friend, no expectations. If anything is to go beyond that...it will in its own time."
"eventtime","2004-01-06 17:23:00"
"current_moodid","82"
"url","http://rkitten27.livejournal.com/18017.html"
"userid","12898"
"itemid","69"
"event","This does not surprise me....

<img src=""http://images.quizilla.com/E/eveningmist23/1065747567_esdolphins.jpg"" border=""0"" alt=""water""><br>Your element is Water. You are a deep person and a<br>good communicator. Incredibably loving and<br>loyal when your trust is gained and you are<br>fairly mature.Myterious to the utmost water is<br>in everything. One can be an Ocean or a river<br>but nobody truly knows you.
<br><br><a href=""http://quizilla.com/users/eveningmist23/quizzes/What's%20your%20element/""> <font size=""-1"">What's your element</font></a><BR> <font size=""-3"">brought to you by <a href=""http://quizilla.com"">Quizilla</a></font>"
"eventtime","2004-01-01 18:52:00"
"current_moodid","64"
"url","http://rkitten27.livejournal.com/17827.html"
"userid","12898"
"itemid","68"
"event","just when i think it will be over and we can get back to our regularly scheduled lives....

Michael got into an accident with the rental car today. Thankfully he's ok but the car is not. Now we have more insurance shit to deal with. Meh.

Suddenly I don't feel much in a party mood.

I was sitting outside work waiting to be picked up when a car drove by playing a song with a line that goes ""dont start no shit, wont be no shit""
Boy does that sum up my mood."
"eventtime","2003-12-31 14:21:00"
"current_moodid","23"
"url","http://rkitten27.livejournal.com/17498.html"
"userid","12898"
"itemid","67"
"event","Our apartment building has a new owner now. Despite initial misgivings, I have to admit I'm impressed with how fast a repairman was dispatched to fix a leaky window and broken heater (the window was recent due to the heavy rains but the heater had been broken since we moved in). He did some work on the window and the heater. We now have heat! Yay! 

I am feeling somewhat sad right now tho...
A friend of mine is hurting and seems to have been for some time. My immediate instinct is to reach out and attempt to heal some of the hurt but I don't want my intentions misinterpreted. What to do...what to do...
It complicates matters somewhat that I'm also attracted to this person. I think I need to think some and figure out whats going on in my head. My thoughts are all jumbled right now."
"eventtime","2003-12-30 22:58:00"
"current_moodid","6"
"url","http://rkitten27.livejournal.com/17232.html"
"userid","12898"
"itemid","66"
"event","i realize this is probably to much info for some people but....

i ealy hate ""that time of the month""

michael has some weird thing about it and as a result, i get no sex.  grrrrr"
"eventtime","2003-12-27 00:53:00"
"url","http://rkitten27.livejournal.com/16905.html"
"userid","12898"
"itemid","65"
"event","What is your Full Name? Rachael Annastasia Bradshaw

What Color Trousers are you wearing now? Red flannel PJ pants with a snowman and snowflake 
print

What are you listening to now? ""XXX"" on TV 

What are the last 2 digits of your phone number? 85

What was the last thing you ate? Banana Cream pie

If you were a crayon what color would you be? Purple

How is the weather right now? cloudy and threatening rain

Last person you talked to on the phone? Someone I care a great deal about

The first thing you notice about the opposite sex? first physical thing I notice is usually hair, I also notice a certain variety of aura/magnetism about a person thats really hard for me to describe ...basically, if you either have it or have seen it...you know what I'm talking about

Do you like the person who sent this to you? yes, and am attracted to

How are you today? Doing better than earlier...I had some personal drama to deal with 

Favorite Drink? Earl Grey tea

Alcoholic drink? Melon Ball 

Favorite sports? Does figure skating count as a sport. If not, 
none...I'm not into sports

Hair Color: Red

Eye Color: Hazel

Do you wear contacts? No 

Siblings: None by blood. 1 adopted sister: Dawn

Favorite month: December...I really enjoy holiday time and being able to be giving to my friends and family

Favorite food: Pasta with Pesto, Clam Chowder, Ribs (I don't have just one favorite food)

Last Movie you watched? Kimberly: Princess of Pain

What book are you reading? Alien Ink: the FBI's war on freedom of expression 
by Natalie Robins & Big Secrets by William 
Poundstone

Favorite day of the year? Valentine's Day

Are you too shy to ask someone out? no

Summer or Winter? Winter, I deal with cold a lot better than I do heat 

Hugs or Kisses? yes

Chocolate or Vanilla? Chocolate! DARK!

Do you want your friends to write back? sure, why not 

Who is most likely to respond? I would say my sweetie in Indiana but he's not been on LJ for awhile (computer problems)

Who is least likely to respond? most of the people on my friends list

What do you usually do when have absolutely nothing to do? Play Neopets

What is on your mouse pad? Hello Kitty

Favorite Board Game? I don't have a favorite board game, my favorite 
game is Uno

What did you do last night? web surfing

Favorite Smell? Polo mens cologne 

Can you touch your nose with your tongue? No. 

What inspires you? Art, Beauty, Intense emotion

Buttered, plain or salted popcorn? Buttered.

Favorite flower? Peach roses 

What is the first thing you think of when you wake up in the morning? I don't want to go to work

What do you keep under your bed? nothing...we have drawers along the sides that hold clothing 

When is your birthday? June 5th."
"eventtime","2003-11-08 02:07:00"
"current_moodid","44"
"url","http://rkitten27.livejournal.com/16686.html"
"userid","12898"
"itemid","64"
"event","Tonight I went to my first ever bachelorette party. It was for one of my co-workers who's getting married in November. One of our other co-workers arranged the whole party with a lady who does sex toy parties. She came and showed off her products and we played a couple of goofy games.
That was cool but not the highlight of the evening. That part came later with the stripper that was hired for the party. He was SERIOUSLY hot! Oh my god. By the time he was done with his routine, I felt like I needed a cold shower! Definitely an entertaining way to spend a portion of the day."
"eventtime","2003-10-25 22:17:00"
"current_moodid","17"
"url","http://rkitten27.livejournal.com/16555.html"
"userid","12898"
"itemid","63"
"event","Being sick sucks!

I discovered I have Strep the other day and I can't do anything about it till Monday (the earliest I could get an appt.). I slept till almost 1:30pm today. I guess I needed it.
My throat hurts.

*bleah*"
"eventtime","2003-10-18 23:08:00"
"current_moodid","82"
"url","http://rkitten27.livejournal.com/16150.html"
"userid","12898"
"itemid","62"
"event","I know everyone has heard of writers block...I have artists block.
I've been trying to draw for several days now and no matter how many scribbles I put to paper, everything seems to suck and I erase it all.
I know there are images in my head that want to come out but I don't know why they aren't.
Typically my best inspirations for artistic expression have been intense feelings of depression or love. For the last month, I've been feeling intense feelings of love. Normally this would spark something and I'd grab pencil and paper and something interesting would appear. Nothing. More nothing.
I guess I'm just going to have to keep trying. I'm not normally good with words. I can't write flowery poetry or intense love letters. The only way that my feelings of love can truly come accross is if I can draw them. I have to make this happen."
"eventtime","2003-10-17 22:13:00"
"current_moodid","47"
"url","http://rkitten27.livejournal.com/15993.html"
"userid","12898"
"itemid","61"
"event","I have stuff written on paper about my trip but for some reason, I'm having trouble writing in LiveJournal about it. I don't think my written word lends itself well to LJ.

Well, anyway...my trip can be summed up in two words - absolutely amazing!

Indiana itself is pretty nondescript but thats not what I was there for. I went there to visit someone who's been a longtime friend and recently became much more. The anticipation leading up to us seeing each other again was very intense for me. Once I did see him waiting outside the security area, it took all my willpower to resist dragging him off into a dark corner. Unfortunately there were friends with him so that had to wait. We spent the rest of the evening driving around trying to find somewhere to go and not having any luck.
One down side to the trip was having to deal with his ex-girlfriend (one of the friends who met me at the airport) who apparently has yet to be over him. Almost all weekend long, she kept throwing attitude my direction like he belonged to her and I was trying to ""steal"" him away. It was pretty stupid and he's pretty pissed at her for it. I did not like feeling like I had to walk on eggshells around her. I basically had to wait until she wasn't in the room before I could show any level of affection towards him. I was relieved when she'd finally go home for the day.
It didn't take long after she was gone before we were all over each other. It's been quite a while since I've had chemistry THAT good with someone. Words are just not adequate to describe the experience. All weekend, we just didn't seem to be able to get enough of each other.
It was absolutely heartwrenching to have to leave Monday. Once I parted from him and went through security, I just wanted to cry. I was pretty depressed for a while after and the only thing that kept my sanity was listening to music and writing in a notebook.
I'm a bit less sad now but I miss him terribly. I'm already trying to make plans to go back when I get my next vacation time. Eventually, he's planning on moving back to CA but thats going to take time and he says he still has things to do in Indiana. We'll just have to wait and see what happens."
"eventtime","2003-10-15 20:14:00"
"url","http://rkitten27.livejournal.com/15642.html"
"userid","12898"
"itemid","60"
"event","I'm leaving for Indiana today at 2:40pm and will be back Monday late."
"eventtime","2003-10-10 08:34:00"
"current_moodid","41"
"url","http://rkitten27.livejournal.com/15451.html"
"userid","12898"
"itemid","59"
