"names","values"
"event","I watch the spoon dance across the tile and land next to Mr. Ghost. He looks at me quite quizzical and then reaches down for the spoon and walks over. 
""I think you dropped this"" He says dropping back on to my tray. Right into the middle of my salad, mind you. I'm not going to be even begin to touch that salad, God knows whats on that floor and the last time someone cleaned it.
""Yeah, Thanks, I guess its that whole gravity thing again"" I say with a sarcastic sigh, but Mr. Ghost thought this was absolutely hilarious and started laughing out of control. He keels over onto the floor rolling on the ground laughing. Mr. Ghost is such a character, but I can't even begin to smile. He notices that and gets up and goes back to his food. My stomach is still hungry but I don't want to eat the floor salad, so I just roll over and watch the hallway. My eyes get heavy and I begin to drift off to sleep. All I can remember is hearing the chewing from Mr. Ghost  and the soft hum of electricity. 

I stir awake in the middle of the night and move my hand under my head. This usually wouldn't be that big of a deal, but the fact that I can do it means my restraints are gone. I sit up in my bed and look at my wrist, they are a little rough from all of the struggle, but I'm going to be just fine. The room is painted with a cool midnight blue as street lights bleed through the window blinds. The soft glow of LEDs and the same soft hum of electricity have always been comforting when I awake in a hospital. Looking over to Mr. Ghost's bed, I can see him sitting up in bed with his eyes wide open. They look a little hazy but they are staring right at me, or at least in my general direction. 
""Ummm, hello"" I whisper. 
Nothing. Not even a stir, just sitting there staring. The look on his face, I can't really place it. It looks like a mixture of fear, unbelief, and confusion. I try again.
""Hello"" a little louder now, but still nothing. 
""Hello"" I say in a normal voice.
""Hello"" returns a voice, not of Mr. Ghost, but of a female voice, it was Mary's voice. 
I turn towards the doorway and standing in the door way is Mary, with her smile. 
""I'm glad to see you're awake, you hardly touched your food."" 
""I had troubles eating it, but I'll be fine now."" I hold up my unshackled wrist. 
She does her little laugh and begins to make a notion of leaving. I want her to stay so I just blurt out.
""Is he ok?"" I nod to Mr. Ghost. 
""Oh him, hun, he always sleeps like that. Its creepy at first, kind of like that Edgar Allen Poe story, you know, the one with the eye? but after a while, you get used to it. He will be like that to morning"" 
I know the story she is talking about, it is one of my favorites. I want her to stay and talk for it will be hours before I can fall asleep. My brain was awake and the only way to shut it down would be some meds or some Jack Daniels and I don't think I will be able to get either. 
""Can you stay and talk with me for a bit, I don't think I will be falling back asleep tonight."" 
""Sure I can stay for a while, let me go check up on a few other patients and then I'll be back.""
She leaves the doorway and the door slowly closes. I get this fear that she just said that to leave and she isn't coming back. I always worry about that. Whenever someone says they are going to be ""back"". I never believe them. I always think that they are just trying to get away from me, I'm some kind of hindrance.  I begin to feel worse, when I hear Mr. Ghost stirring a bit. I look over and he is still staring back at me. It is incredibly creepy. In fact it chills me right down to the bones. I now can understand what Poe was talking about, but it hasn't drove me that crazy yet. My anxiety keeps raising and raising as each second passes and she isn't back yet. Self-doubt and self harm begins to enter my thoughts. Inadequacy begins to set in. But as soon as my pity party starts, the door is creaked open and Mary slips through the crack. A sigh escapes my lips, but I hope it wasn't loud enough that she could hear it. She smiles and sits in the chair next to me. She is holding a cup of coffee and the smell makes my stomach begin to turn. I still don't know what to say, so I just being to talk. 
""So I bet you're wondering why I am here""
""Not really, I can read your case file""
I'm an idiot. A complete idiot.
""But you can go ahead and talk about it if you want""
""Well the case files are wrong, I'm really the extremely rich king of a small middle east country and I'm in here as part of a protection program.""
""I see, well your highness, I'm so sorry we have treated you so badly""
""Rightfully so, you will be forgiven, you will at least, but Ted, I don't know about him.""
She laughs and I smile. I haven't had a real friend in such a time. Well I guess I can't jump to the conclusion that we are friends. She probably is only doing this out of pity, she is only doing this because I'm such a screw up and she can see it. I mean come on, she can see my files, why would she WANT to spend time with a waste of time like me. 
""So your highness, is there a real reason why you're here.""
""Only if you'll tell me why you're here""
""I'm here because I need work some extra hours to make some ends meet. It's hard being a single mother, to raise a child and to keep a head.""
""It's even harder to be a crazy person."" I say with a smile, but I fear she didn't get that humor. 
""I'm here because I was found with a stomach full of anti depressants and a handle of Jack. I was not really trying to kill myself, I just wanted to sleep. I wanted to escape. See the problem with me, Well not the only problem, but a major one is, that I can't sleep. I don't sleep. I wish I could, but my brain, its hardwire to keep thinking and thinking about things. Then when I want it to be quite, it just keeps going off about how worthless I am. How I am a failure. It's like my parents are living inside my head. I try to drown them out, but I can't. I try to escape, but I can't get away. It's really a nightmare. I can't stand it. I just wish I was a robot and I had a button I could press to shut down.""
I look down at my hands on my laps. I can't make eye contact with her. I know she is judging me, right now she is placing me somewhere on her crazy scale. I can feel it. The judgments, the speculation's, I can feel them. 
""That would suck, I hate my parents and not mention they were overweight, so that would be a heavy load to carry all the time.""
I smile and look over, she smiles back. 
""I've been in and out hospitals my whole life. My parents are rich, made big money in real state and the stocks. So they just keep giving me money. It's like they think that they can buy a cure for whats happening to me. I haven't talked to them since I left when I was 18. The only time I see their name is when they are putting more money into my account. I have tried to talk to them, but I'm just a failure in their eyes, a disgrace, a lost assets. I keep trying to get on my feet, to do something for them, but alas, I'll never be good enough. I'll never be successful, I've been labeled a lost asset and thats all that I am.""
I don't even know why I am saying this stuff, why I am confessing my personal life to this complete stranger. I look down again but out of the corner of my eye, I can see her smile. 
""You know, I think it's good that you are here. I know that I am happy. I haven't seen Mr. Troube this happy in a long time.""
Mr. Troube, oh. Mr. Ghost. 
""I actually have been calling him Mr. Ghost because of his thinness and paleness. I swear if I didn't hear him breathing, I would think he was a ghost.""
She has a light hearted laugh and agrees.
""Mr. Ghost, I like that.""
""What do you mean you haven't see him this happy?""
""Most of this roommates don't pay attention to him, they find him annoying or just to weird to deal with, and Lord knows the staff doesn't like him. I think it is a mixture of fear and well, pity for him. Me myself, I kind of like him.""
I could understand how people could see he was annoying, but that doesn't mean he should be treated any different. I never understood that. To me, he has been the most genuine roommate I have ever had. 
""Can you tell me what he is in here for?"" I ask.
""Well I'm not suppose to, but better you hear it from me, who will tell you the truth and not what they think happened..."""
"eventtime","2007-01-18 09:30:00"
"url","http://sci-normal.livejournal.com/1979.html"
"userid","13395"
"itemid","6"
"event","I stare down at my food. With spoon in hand I try the impossible of eating salad. I can't really get the food into my mouth effectively without it sliding off. This has to be a humorous sight because Mr. Ghost has stopped eating and now watching, intently I might add. He laughs as I try to get more the a leaf of lettuce in my mouth and the frustrations on my face. I begin to grab at it, but the restraints still hold my hands to far. Frustrated, I throw my plastic spoon across the floor."
"eventtime","2007-01-03 16:58:00"
"url","http://sci-normal.livejournal.com/1618.html"
"userid","13395"
"itemid","5"
"event","She walked out of the door with a smile.
""You don't love her, do you?"" Mr. Ghost interjects, it seems a defensiveness in his voice. 
""I don't know, maybe? why what is it to you?"" 
""Nothing at all Mark, Marky Mark. Mark the Shark, Stark Mark. Fe fi fo Fark.""
""Stop that""
Now I suddenly regret telling Mr. Ghost my name. Really regret it. 
He seems to have lost his adoration for name calling and slumps back into his bed. He begins to look out the window. I really want to ask him about his comments earlier, but he breaks the silence first. 
""You shouldn't of gotten the salad, green is an ugly color.""
""Well, the stain on your shirt begs to differ"" I point to the jell-o stain on his shirt, he looks down. 
""So it is, such an ugly color."" 
""Isn't green considered the color of living things? Like plants and new grass? shouldn't green be a beautiful color?""
""But green is also the color of mold, decay and eventually death. Have you ever seen a rotting corpse. It's skin a sickly pale green. It almost makes you want to throw up, in fact it does right now, the smell so fragrant in my nose.""
What has he seen? How does he know these things. Mr. Ghost is concerning me now, in fact for the first time, I see his eyes become very pensive and sullen looking. A lone tear runs down the side of his cheek, whatever he is thinking about right now, I can feel it pulling down my heart too.
""You're right, green is an ugly color, so what did you get to eat?""
""The salad""
A faint smile comes across my face and I see the corner of his mouth rise to exposes a little smile. 
Down the hall I can hear the sound and clank of the dinner cart coming. After being around these types of places for a while, you can hear different sounds and know exactly what they are. The sound of the emergency buzzer and the sound of the staff running to help the person. Sounds of parts of the staff laughing at something, sometimes a joke, but sometimes its a person, you can usually sense that in the laugh. The sound of a gurney going by, the moan of its occupant. 
The clank of the dinner cart is right outside of our door and I see two people come in. One is Mary, who looks over to smile at me. The other is a man with a big white bandage on his hand. This must be Ted. I suddenly feel very awkward and I can feel the glance of his eyes. 
""Oh, Ted, he isn't going to bite you again, I told you he is a nice guy, not some kind of animal""
""Yah, Ted, I am sorry""
He kind of grunts and gets the food out of the cart. He walks over and places a tray in front of Mr. Ghost. Mary grabs a tray and brings it over to the table in front of me. She then makes some slack on my restraints, so I can eat effectively. 
""I told them to give you a light dressing, since you're watching your calories and all.""
She smiles again and then gets out a spoon, a plastic one. I pick it up and look at it very quizzically.  She kind of got the expression on my face.
""I know, I tried to get you something else, but any patient who has hand an episode has to have plastic utensils, I'm sorry""
""Don't apologize for the rules, Mary, especially to patient.""
Ted looks at me with a disdain. I try to advert the glaze, but I can still feel him burning a whole into the side of my head. 
""Ted, that is uncalled for, I apologize for Ted too, he isn't the happiest now that you took his lover away from him"" 
I chuckled at the joke, but I feel like Mary, Ted and I were the only ones who got it, poor Mr. Ghost. His face was covered in ranch anyways and his current thoughts were on dismantling this salad. 
Both Ted and Mary get back behind the cart and begin to push it out. 
""We'll be back to pick up the dishes in a bit, I hope you enjoy your meals, the both of you""
""thakney youesws"" Mr. Ghost mumbles with a mouth of lettuces."
"eventtime","2007-01-03 14:35:00"
"url","http://sci-normal.livejournal.com/1387.html"
"userid","13395"
"itemid","4"
"event","There was a slight tug in my stomach, I am hungry. The struggle and fight had wasted what was left of my energy and even though I slept, my body still needed food. 
""Did I sleep through lunch?"" 
This question seemed silly to me, for I could smell lunch on Mr. Ghost breathe. Broiled chicken and steam vegetables. And from the green stain on Mr. Ghost gown, it seems that there was lime jell-o. I like lime jell-o. Damn alarm clock and damn self destructive nature. 
""Yes, but you will be asked about dinner too, I feel like you should ask the man for the rest of his hand for dinner, maybe that and some fava beans?""
""But I doubt they have any nice chianti..""
We both grinned. Mr. Ghost has become quite the entertainer. I shift my weight in the bed and the tug of the restraints begin to dig into my ankles, this is uncomfortable. My headaches and so does the rest of my body, moving my arm over I notice a band aid from the shot. With so many shots into that arm, I feel like I should have a scar by now. Soon enough, the skin will be so callous and think, what are they going to do? 
""Do you dream?""
I shift my head back to see Mr. Ghost, staring intently. He looks like he is looking at something behind me, I turn to see, that he is really staring at nothing.
""I do dream, but what do you dream?""
""I don't sleep enough to dream, it seems like the only time I can crash, is off of alcohol or just being strung out, and of course the medicated sleeps here, so I guess I don't remember if I dream or not, but I guess I do. I don't know, I mean I dream about becoming things, like aspirations, but do I dream when I close my eyes, like sleep dreams, I don't know.""
There is a silence between us, I know that I over analyzed the question, I tend to do that, but I also know that he was wanting me to ask him about his dreams. I don't want to, but like a begging dog, I'm a sucker. 
""What do you dream about?""
""Well sleep dream, I dream about leaving my body and going somewhere else. All I've ever known for the last 10 years, is the off-white color of hospital walls and hallways. The cheap taste of microwaved food and stale water. When I sleep dream, I get to leave this place and visit North Africa, China, the Great Wall, Disneyland. But aspiration dream? I guess, I dream of being normal. So then I could leave this off-white prison.""
I want to pry more into this, but he lies down into his bed and looks away. I think I struck a nerve, or caused him too. He looks like a child, who wants to leave the room, but can't, he is too scared. Understanding has never been one of my best qualities, but it is easy for me to see, that he is scared. The room begins to cool off into a calm quiet. I'm getting sleepy, the lack of food is taking its toll. 
A female nurse enters. She is slightly attractive, 5'5ish brown hair, hazel eyed. She looks worn out, like she has been chasing something all day and has now given up and decided to wait around for it to come home, perhaps a chicken or a cow, I am hungry, I hope they come home soon. 
""What can I do for you, hun?"" she smiles at me, to put me at ease, but I can notice that she is glancing at my restraints and timidly moves out of my reach. 
""I don't suppose you got the keys for these things?"" I try to put forth my most attractive smile, try to be suave, think Humphrey Bogart. 
She nervously laughs and says something about maybe tomorrow, if I am good, they will take them off of me.
""I heard you have quite the nasty bite? Poor Ted, he had to get stitches.""
I hear a loud chuckle come from Mr. Ghost bed and the nurse turns to him and smiles. 
""I didn't mean to bite him so hard, I just wanted some help with a ringing in my head, then they all get aggressive and hold me down and put their hand of my mouth, I guess I just reacted, thats all...will you tell him I am sorry?"" 
""Sure, hun.""
Hearing use the word hun, makes me feel endeared.
""Well, what would you like to eat for dinner?""
""Do I get a menu? do you have any duck or perhaps a nice NY strip?""
She laughs at my humble attempt at humor, I hope she isn't patronizing me, my natural urge is to second guess her, but I stay quiet. 
""No, hun, we got nice breaded chicken or a nice chicken salad?""
So the chicken did come home, my stomach does flips in excitement.
""I'll have the chicken salad, trying to watch those calories.""
I move to pat myself on the stomach, but my wrist are restrained. 
I see her first legitimate smile, I impressed her. She turns to walk out the door and I calmly ask. 
""Excuse me, whats your name?""
""Mary"" yells Mr. Ghost from under his sheets. She laughs again and points to her name tag. Where it clearly says Mary and has a picture of her smiling. It was her fake smile, not the real one, not the one I just got.
""And what is yours?""
I turn to Mr. Ghost to see if he was going to yell it out, but he got out of the sheets and looked to listen. He didn't know my name. I guess that make sense, I never gave it to him. 
""My name is Mark."" 
She smiles and begins to walk for the door.
""Oh and Mary, I think I love you.""
She smiles again, her real one.
""Of course you do."""
"eventtime","2007-01-03 11:12:00"
"url","http://sci-normal.livejournal.com/1031.html"
"userid","13395"
"itemid","3"
"event","4oCcWW91IG5lZWQgdG8gd2FrZSB1cCwgbGlmZSBpcyBib3Jpbmcgd2l0aG91dCB5b3Uu4oCdDQpXYXMgSSBkcmVhbWluZyBhZ2Fpbj8gV2hhdCB3YXMgdGhpcyB2b2ljZT8gV2hvIHdhcyBpdD8gVXBvbiBmdXJ0aGVyIHRob3VnaHQsIEkgcmVtZW1iZXJlZCB3aGVyZSBJIHdhcyBhbmQgaXQgd2FzIE1yLiBHaG9zdCBhZ2Fpbi4gIEkgdHVybm92ZXIgaW4gYmVkIGFuZCBzbGlnaHRseSBvcGVuIG15IGV5ZXMgdG8gc2VlIGEgYnJpZ2h0IGZhY2Ugbm90IHR3byBpbmNoZXMgZnJvbSBteSBmYWNlLiBJIGp1bXAgYW5kIG15IGJvZHkgam9sdHMgaW4gcGFpbnMgYW5kIGFjaGVzLiBNci4gR2hvc3TigJlzIGZhY2UgaXMgcmlnaHQgaW4gZnJvbnQgb2YgbWUsIHNvIG11Y2ggdGhhdCBJIGNhbiB0YXN0ZSBoaXMgZm9vZCBvbiBoaXMgYnJlYXRoLiANCuKAnFdoeSBhcmUgeW91IGRvaW5nIHRoYXQ/4oCdIEkgeWVsbGVkLCBidXQgbXkgdm9pY2UgaXMgc3RpbGwgc2NyYXRjaHkgZnJvbSB0aGUgc2xlZXAuIA0K4oCcSSBhbSB0cnlpbmcgdG8gd2FrZSB5b3UsIGJlZm9yZSB0aGV5IGRvLuKAnQ0K4oCcV2hhdCB0aGUgaGVsbD/igJ0NCk1yLiBHaG9zdCBpcyByZWFsbHkgZ2V0dGluZyB0byBiZSBvbiBteSBuZXJ2ZXMuIEkgZmVlbCBzb21ldGhpbmcgdHVnZ2luZyBhdCBteSB3cmlzdCBhbmQgSSBub3RpY2UgdGhhdCB0aGUgYm95cyBpbiB3aGl0ZSBoYWQgcGxhY2VkIHJlc3RyYWludHMgb24gbWUuIFRoaXMgYWx3YXlzIG1ha2VzIG1lIGxhdWdoOyBsZWF2ZSBpdCB0byB0aGUgc3lzdGVtIHRvIHNhdmUgeW91IGZyb20geW91cnNlbGYuIFdhbGtpbmcgYXJvdW5kIGFzIGEgcG9ldGljYWwgZGFuZ2VyLCBub3QgdG8gYW55b25lLCBidXQgeW91cnNlbGYhIEkgdGhpbmsgdGhleSBhcmUganVzdCBrZWVwaW5nIG1lIGFyb3VuZCwgc28gSSBjYW4ga2VlcCBwYXlpbmcgdGhlbSBmb3IgdGhpcyBob3NwaXRhbCByb29tLiBMZWF2ZSBpdCB0byBjYXBpdGFsaXN0IEFtZXJpY2EsIGRvbuKAmXQga2lsbCB5b3Vyc2VsZiwgd2UgY2Fu4oCZdCBnZXQgbW9uZXkgZnJvbSBhIGRlYWQgZ3V5ISBJIHB1bGwgYXQgdGhlIHJlc3RyYWludHMgdG8gc2VlIGhvdyBtdWNoIG1vdmVtZW50IHRoZXkgZ2F2ZSBtZSwgd2hpY2ggd2FzbuKAmXQgbXVjaC4gDQrigJxJIHRyaWVkIHRvIHRlbGwgdGhlbSBub3QgdG9vLCBJIHRvbGQgdGhlbSB5b3Ugd2VyZW7igJl0IGRhbmdlcm91cy4gQnV0IHlvdSBkaWQgYml0ZSB0aGUgbWFu4oCZcyBoYW5kLCBhbmQgbGV0IG1lIHRlbGwgeW91LCBpdCB3YXMgdmljaW91cyBsb29raW5nLCB5b3UgZ290IHF1aXRlIHRoZSBiaXRlLiBJIGFza2VkIHRoZSBtYW4sIGlmIEkgd2VyZSB0byBwdXQgbXkgaGFuZCBpbiBoaXMgbW91dGgsIHdvdWxkIGhlIG5vdCBiaXRlIGl0IHRvbz8gSXTigJlzIGp1c3QgcHVyZSBhbmltYWwgaW5zdGluY3QsIGFuZCB0aGF0IHlvdSBhcmUgbm8gbW9yZSBvZiBhbmltYWwgdGhlbiBoZSBpcy4gSGUgZGlkbuKAmXQgbGlrZSB0aGlzIGNvbW1lbnQgYW5kIHRvbGQgbWUgdG8gYmUgcXVpdGUsIGluIHdoaWNoIEkgY2FsbGVkIGhpbSBhIGh5cG9jcml0ZSBhbmQgdG9sZCBoaW0gdGhhdCBoZSBjYW4gdGFrZSBteSBuZXh0IHJvdW5kIG9mIG1lZHMsIHRvIGN1cnZlIGhpcyBhbmdlciBhbmQgYWdncmVzc2lvbiBwcm9ibGVtcy7igJ0NCkkgZ290IHRvIGhhbmQgaXQgdG8gTXIuIEdob3N0LCBoZSBkb2VzIGVudGVydGFpbiBtZSBzb21ldGltZXMuIEFtb25nIHRoZSBhbm5veWluZyBtb21lbnRzIGhlIGhhcyBoaXMgbW9tZW50cyB3aGVyZSBoZSBkb2VzIG1ha2UgbWUgbGF1Z2guIEkgc21pbGUgYXQgaGltIGZvciBzb21lIGFmZmlybWF0aW9uIG9mIGhpcyBkZWZlbmRpbmcgbWUsIHNob3dpbmcgaGltIGEgc21hbGwgdGhhbmsgeW91LiBIaXMgZmFjZSBsaWdodHMgdXAgYW5kIEkgY2FuIHNlZSB0aGF0IGhlIGVuam95cyB0aGUga2luZCB0aGFuayB5b3Ugb2YgYSBzbWlyay4gQXQgdGhhdCBtb21lbnQgSSBjYW4gc2VlIHRoYXQgTXIuIEdob3N0IHdhcyBoYXBweSBhbmQgSSBndWVzcyB0aGF0IG1hZGUgYSBzbWFsbCBwYXJ0IG9mIG1lIGhhcHB5IHRvby4="
"eventtime","2006-10-09 09:52:00"
"url","http://sci-normal.livejournal.com/845.html"
"userid","13395"
"itemid","2"
