"names","values"
"itemid","13"
"event","She was the prettiest nurse so far. In fact, I looked away right as she came in, so that she wouldn't notice my gaze. Mr. Ghost had obliviously noticed it because he felt like it was the right time to say.
""She is pretty, don't you think darky marky?""
""I refuse to acknowledge you, with your name calling."" I say back, still staring straight down. 
""Oooh, now he is showing off for you."" 
""SHUT UP"" I grumble to him, I wonder if she is finding this funny.
""Mark? I need you to come with me."" 
""Ooooh, looks like someone has a date now..."" taunts Mr. Ghost
""When she says turn your head and cough, give her a kiss."" He adds in as I crawl out of bed. 
I look over at him and give a nice cold stare, but there is just his face smiling back at me. The tile is cold on my feet and I always feel so uncomfortable walking in a gown. Afraid that it is going to fly up or the starchy feel against my skin. It feels like I am wearing a gown made out of a paper bag. I look up at the nurse to give her affirmation that I am ready to follow her and begin to walk with her. She tries to make some small talk.
""So do you enjoy Mr. Troube?""
""Yeah, for the most part, he has his ups and downs.""
""Oh, I wouldn't be able too, he is just so annoying and did you hear he asked Callie to marry him?""
""Yeah, I was there."" 
Poor, Mr. Ghost. I wonder if he knows that he is such a joke to the rest of the staff? I bet you he doesn't. He seems so naive sometimes. 
""So if you don't mind me asking, where are we going?""
""Well, I'm taking you down to a group session for people struggling with depression.""
""What?"" I saw and stop walking. I feel like a kid in the midst of finding out he is really going to the dentist and not his favorite ice cream shop. 
""We need to see if you are getting better, Mark.""
""I don't think putting me with a bunch of crazy people is going to help me. I'm sorry but I don't want to hear about how much people's lives suck. I have enough suck in my own life to deal with, not the shame and guilt of other peoples lives."" Now I'm really upset.
""You still need to go and try it, who knows you might find something out about yourself.""
Yeah, find out that I hate the people in this world even more. That is the only good thing about group. It affirms my hate for the other people in this world. 
I continue to walk with this new nurse. I want to ask her for her name, but with the recent conversation and me acting like a two year old, I decided this isn't the right time. I walk into an empty room filled with a couple people. The chairs are all in a circle with an empty one for me. 
""Hello everyone, sorry to interrupt, this is Mark. He will be joining you today.""
""Hello, Mark."" are scattered from different mouths. It's weird to hear 4 different people say a chorus of your name back to you. 
""Mark you can sit next to, Bob and Will."" says a man in a suit. I'm assuming he is the therapist. He has the look of a therapist. The middle aged, pushed back hair, looking through gold rimmed glasses, and stress lines. Also he has  therapist eyes."
"eventtime","2007-07-16 19:12:00"
"url","http://sci-normal.livejournal.com/3436.html"
"userid","13395"
"itemid","12"
"event","Breakfast was good. My stomach finally would quite down and my body has some fuel to move. Mr. Ghost was escorted out of the room not much after breakfast, so now it's just me in here. I guess this is one of those times that I am supposed to be introspective. I'm supposed to think about why I am here, why I tried to 'sleep' as I called it when I was talking to Mary. Mary, I wonder where she went too. I'm sure she is at home, she doesn't live here, well like I do. So why did I want to kill myself? I don't know. There is never a simple answer for that question. It's always complicated. No it's not. I wanted to die. It's not that complicated. Well I don't know. I guess it could be. It's hard for me to explain. I mean, who I am explain it to anyways. It's just me here. No one to answer to. My parents left me, I don't have any friends. It's just me and myself. I like it that way. That way, I don't have to answer to anyone. I wonder how long they are going to keep me here. Penned up. Saving me from myself. I'm supposed to be getting better. Is this getting better? Look at me I'm talking to myself. I guess thats better, then talking to myself out loud. I'm not that crazy yet. 

I turn around in bed and watch the daylight. I don't really have the energy to get up and move around, so I just lie there. Why did Mr. Ghost have to go? It's so quite around here with out his breathing or annoying question asking. I think I miss him. Ha, I can't believe I just thought that. I miss Mr. Ghost.

I guess, someone must of been paying attention because at that moment he walks about into the room. He actually seems to be bounding into the room. Happy as ever. 

""What are you so happy about?""
""I had a major break through today, in my group session.""
""Oh really? and what was that?""
""I'm a crazy person."" He says with a smile. 
""Well, I could of told you that.""
""But realizing you have a problem is the first step to enlightenment."" He says with a certain sneer. He walks over to the window that I am staring out. 
""It is kind of a gray day isn't it?"" I say to him.
""Gray, now there is a good color. I like gray."" 
I forgot he had a thing with colors. 
""Why do you like gray, it's so depressing...so bland, so boring.""
""But elephants are gray and there is nothing bland or boring about them.""
""How many elephants have you talked too?"" I ask with a smile.
""A lot, I'm a crazy person remember?"" He answers and walks back into his bed.
I should of saw that coming. I would of carried on our conversation more but just then another new nurse walked into our room."
"eventtime","2007-07-15 14:34:00"
"url","http://sci-normal.livejournal.com/3176.html"
"userid","13395"
"itemid","11"
"event","She leered back at me and I just stuck out my tounge, I know, childish, but I think I am allowed to be right now. 
""Hun, you need to be eat'n somethin'"" 
""Ok, what do you have?""
""Well, lemme think here, we got eggs, pancakes, waffles, and toast.""
""I'll take some pancakes, please, just make sure you don't just give me a spoon this time""
""I'll see what I can do for you hun."" 
""thank you, ma'am""
The nurse turns and starts to walk out of the room. 
""Oh, Nurse, what's your name?""
Mr. Ghost blurts out. 
""Oh it's Callie""
She says as she turns around, then turns back to the door and starts to leave again.
""Oh Callie, I think I love you""
Says Mr. Ghost, while staring at me. I turn to him and smile. I think Mr. Ghost is trying to mock me right now. Figures. 
Callie looks taken back by the comment and continues to walk out of the door. 
""Why did you have to go and do that?"" I ask Mr. Ghost.
""It worked so well for you, I thought I might try it."" 
""What do you mean, it worked so well for me?""
""I saw you talking to Mary last night, she came into see you. That usually doesn't happen.""
Either my stomach is hungry or is it just the nerves. Maybe Mr. Ghost was awake while we were talking, how awkward would of that had to been for him? To have to go through that again, but have it being told by someone else... That had to be... I don't know. I feel like I should ask him about what he might of heard, but it isn't my place, is it? I don't know. I try to strain a smile. 
""It's ok, I know what you guys were talking about"" He says as he adverts my gaze to the window. The blinds have been pulled up and it seems like a cloudy day. It looks like it might rain. 
""Oh you do?"" I say with a sullen stutter. 
""You were talking about how much she wants me"" He turns to me with a giant grin. 
It's in that moment that I know, wheither not he had heard what we were talking about it, that it wasn't going to be a problem. 
""Yeah, she told me she had something for balding guys, that takes me out of her league"" I reach up and pull on a tuft of my hair. 
""Well, I don't know if I would call me balding, I would say, I'm getting more... aerodynamic."" 
Ha, aerodynamic? I can just picture Mr. Ghost flying through the air, hospital gown flailing in the wind. Off to go save some kitten stuck in a tree or help old ladies across the street. 
I hear the familiar clatter of the on coming kitchen cart. I sit up in bed, the movement makes me kind of woozy. I need to get some food into my stomach.  
Soon Callie comes through the door, along with another attendee I haven't met yet. It's a male one, with a scruffy beard and shaggy hair. A grim expression is on his face, Mr. Ghost notices this and asks.
""Whats wrong paul buyon, did babe get away?""
Callie chuckles to herself, but Mr. Buyon doesn't seem to impressed. He places a plate in front of me and then places a plastic fork and a plastic knife in front of me. 
""He can't have the knife"" Callie says and reaches and takes it from my plate. 
""I could do just as much damage with a fork, that I could with a knife."" I mutter.
""Good thinking"" says Mr. Buyon and he takes the fork from my plates and puts down a spoon. 
Not this again.
Callie takes a plate and places it in front of Mr. Ghost. He smiles at her.
""Callie, I think you should marry me. I'm really a rich man, who just likes to pretend he is crazy, but seeing your beautiful face, I just need to get out of here. We would never have to work again, come on, Marry me.""
Mr. Ghost has a pleading look on his face, he clasps his hands and moves them back and forth. Callie looks at him and smiles. She holds up her left hand and shines a ring at Mr. Ghost. 
""I'm sorry darling, but I don't think my Billy would very much appreciate that."" 
""Well, he can come along, we will need someone to be our servant.""
He is persistent I'll give Mr. Ghost that. 
Callie laughs, I imagine she is thinking about her husbands reaction to all of this. Or maybe she is laughing at the proposal that was just made.
""Well, I'll talk to him about it tonight and see what he thinks.""
""Ok, remember, no more work.""
He smiles at her and her and Mr. Buyon make their way for the door.
""NO MORE WORK"" blurts out Mr. Ghost. 
Faintly I can hear the laughter of Callie and a soft grunt of Mr. Buyon as he pushes the cart further down the hall. 
Mr. Ghost gets up and walks over to me. 
""You think she is going to say yes?""
""I'm sure that this Billy is an understanding man, so I'm sure by this time tomorrow you will be on your way to India.""
""No, I don't like India, I would rather go to New Jersey.""
What? Is he talking about?
Mr. Ghost looks at my plate.
""Your food looks sad...""
I look down to see a stack of pancakes and a slab of butter and some syrup packets. 
""What are you talking about? it's excited it gets to be eaten, by me!""
""No, this is excitement""
He takes the butter into his hands and splits it into two and places them on the pancake. Then he takes the packets and makes a smile below the two pieces of butter. He just formed a face on my pancakes. 
""Now it's a happy face pancake, I think I'll call him Fred.""
""What you can't name my food, now I feel like I can't eat him. It's a person. Ahh. You're ruining it for me!"" I say while staring at Fred. 
""Enjoy your cannibalism..."" Says Mr. Ghost as he turns around and heads for his bed.
I take my spoon and cut into Fred's face.
""Poor Fred"" says Mr. Ghost."
"eventtime","2007-07-14 13:46:00"
"url","http://sci-normal.livejournal.com/2941.html"
"userid","13395"
"itemid","10"
"event","Night passed its time and my mind wandered, what am I doing here? Its these times at nights, when everyones mind has shut off, that mind keeps going and wondering. Why is it that I always end up here? In a hospital bed, feeling sorry for myself, I should be healthy by now. Why can't I just flip a switch like everyone else? Why can't it just be that easy? I press my mind harder and harder for answers, but the strain just gives me a headache.  I rest back into my stiff hospital bed and once again stare out at the lone street lamp. I can begin to see the sun rising, finally some morning. I can finally talk to people again. 

I hear a rustling next to me and see Mr. Ghost blinking his eyes and staring at me, not with the creepy eyes, but with eyes of endearment. 
""Don't you sleep?"" He said with a yawn. He stretches his arms and makes some kind of grunt.
""Not really, I don't sleep to much and when I did, its most likely because I medicated myself to sleep.""
""Oh I used to do that for years, then I tried yoga and well that pretty much changed my life."" He said  this with a smile and I didn't know if he was serious or not. It gave me hope that even people like Mr. Ghost can have some sort of humor. They make the day lighter.
A nurse came in, checking up on us and seeing what we would like for breakfast. Mr. Ghost pretended he was at some sidewalk cafe in France and spoke some broken French to the Nurse.
""J'ai besoin des oeufs"" 
She smiled at him and told him, she'll put some eggs on for him. She turned to me and I told her I wasn't hungry.
""But sweet'heart, you haven't slept all night... you must be hungry...""
""Not really, I usually eat about one meal a day, it's cheaper""
""But you ain't payin' for this food, hun""
""Oh I'm not"" I tired to put as much sarcasm into each word as possible."
"eventtime","2007-04-17 09:12:00"
"url","http://sci-normal.livejournal.com/2580.html"
"userid","13395"
"itemid","9"
"event","Turning over and over again, trying to get comfortable. How does one learn to pray? I have never really believed in a God too much. I have been to churches before, but it was usually for the warmth and the coffee. Sometimes, just going to cry too. When you cry at church, people really care. It has always been funny to me, if I were hunched over and crying in the streets (which has happened to me times a many) they would walk right by, but now that I am in their church and crying, they want to help. They offer their friendship. I guess the building matters to some. But where do I start? Do I need to address God, I mean, why would even God want to hear from me. I have nothing to offer him. This is where I always run into problems. I can't begin to talk to a person that I don't even know exists and beyond that even cares for me. But I have to remember, this isn't about me, this is about Mr. Ghost. He is the one who needs this, not me. So I close my eyes and fold my hands, I feel like a fool. God, Lord, Savior, Jesus, Big man upstairs, who ever or whatever name you go by, I know that I can't saying, nor am I good enough to really talk to you, but this isn't about me, it's about Mr. Ghost, I mean, ... I can't remember his name now... oh you know who I mean. He has had a hard life, well I know there are probably people with worse lives and you are off helping them, but if you got sometime, He could use some help. I know that I am no one to ask, or even if you are listening, I feel foolish. Do I need to be kneeling for this? I don't even know why I am doing this. Oh I'm sorry. Yes so help Mr. Ghost, thank you. amen. or whatever I say."
"eventtime","2007-02-22 09:45:00"
"url","http://sci-normal.livejournal.com/2507.html"
"userid","13395"
"itemid","8"
"event","""He lived with an abusive alcoholic for a father. He would be constantly spending the families money on alcohol and women, then come home and beat his mother for not having any money to buy food. They would constantly fight and yell, but I guess, he just got used to it. Well whenever it got really bad, his mother would always yell at him to go hide in the underneath the stairs closet space. He was small enough that he would be able to fit and he wouldn't have to worry about his father coming in there after him. One night, before his father returned, his mother told him to start hiding now and no matter what happens that she loved him. He was really to young to understand what was going on, but he hid anyways. Well, this is where all the speculation happens, but his mother tried to kill his father when he got home. She was tired of the abuse and knew that if she didn't try it first, she or her son, would end up dead. Well when the father came home, he wasn't drunk, as usual. His mother tried to attack him with a knife and got one good shot in, but he was the bigger of the two and fought her off. She got knocked off her feet and he raped and stabbed her to death. I know that he had to be able to hear the yelling, but his mother told him to be quiet and he always did what mother told him too. Well, what happens next, is the disturbing part and the most sad. The father in a state of panic and shock of what happened, took the now dead body of his wife and hid it the only place he thought no one would look, in the under the stairs closet. He took the body and shoved it in there, the kid didn't say a word, not even a peep. I guess he knew if he were to say something, he could end up dead, so he just hid in there as his mothers dead body was pushed in there right next to him. Then his father closed the door and moved a chest in front of the opening. The kid had to try to get out, he had to push up against the door, but there was no way, he wasn't strong enough.  Well after about a week of her missing, the police showed up and searched the house. They moved the chest, they opened the door. They found the dead body of his mother and what else they found surprised them. It was her son, white as a ghost and unable to talk. He had been in such a state of shock for so long. The trial made the news and soon enough this little boy was everywhere, on TV's and newspaper. He couldn't understand why, it all reminded him of being in the closet and having to relive it, so eventually he left his foster home and well, ended up on the streets. He came to this hospital about 20 years ago, at the age of 15.  We have tried and tried to put him in a home, but he always wants to come back here. He says he can only stay here. So we have let him. And for the last 6 years I have worked here, I have never seen him take to a person like he has to you. Most people once they find out his story, treat him differently, but you, well you treat him like a friend. So please keep it this way and you can't tell anyone I said anything about it. Please don't...""
""I won't."" Is all I can squeeze out of my throat. I take a look at Mr. Ghost and I see him still staring back. That creepy and eerie stare. What must he have seen in that closet for a week, what must he have gone through. I feel bad now, I feel sorrow, here I am, complaining about my life, my self destructive nature and here is a man, who did nothing, nothing and yet something so horrible has happened to him, that he now sleeps with his eyes open. I don't know if I believe in God, never really gave much thought to it, but right now, I feel like I should pray for some sleep for Mr. Ghost. Would God listen to the prayer of some nonbeliever if it was for a man who has suffered as Mr. Ghost, I don't know. 
""Well, after that upbeat bed time story, I got to get back to my rounds, I'll come check back up on you in a bit."" Mary gets up and leaves. I nod to acknowledge her leaving, but that is about all I can do. 
How could a man have gone through that? I roll over onto my side and look out the shaded window. The yellow glow of the street light and the cars driving by, I begin to think, how my life is nothing compared to the suffering of one person, but yet, Mr. Ghost seems so normal to me, I wish I could talk to him about it, but I also need to treat him the same. I roll over again and sit up. Looking at him straight in the eye, I say. 
""Mr. Ghost, I know you're sleeping and you can't hear me, but I wanted to tell you, well I'm here for you, as a friend and well as your room mate. I'm here for you, I'll be praying for you.""
The last bit sounds so lame and patronizing, but I guess, it gives me comfort, that I am actually trying to help him. Laying back down, I try to think about how I am going to have to learn how to pray."
"eventtime","2007-01-23 09:33:00"
"url","http://sci-normal.livejournal.com/2224.html"
"userid","13395"
"itemid","7"
