"names","values"
"event","<b>Title: ""Once Was Lost"" -- Part Four of Four</b>
<b>Author:</b>  <lj user=""sky_walking"">
<b>Rating:</b>  NC-17
<b>Pairing:</b>  Anakin/Obi-Wan (There is Anakin/Padme in here, but it's supportive.)
<b>Summary:</b>  In this galaxy, Anakin defeated Obi-Wan at Mustafar, but turned away from the dark side four years ago to save his children.  Though reconciled with his wife and trying to recover from the madness of the dark side, his relationship with Obi-Wan remains strained and unresolved.  Can they become friends again or perhaps something more?
<b>Warnings:</b>  Post-RotS AU, Slash
<b>Disclaimer:</b>  Star Wars belongs to George Lucas. We're not affiliated with him, just having fun with his Jedi.
<b>Notes:</b>  Please see <a href=""http://sky-walking.livejournal.com/768.html"">Part One</a> for full notes.  For <lj user=""brynneeryn"">.  Well, now we're finished.  Thank you everyone for your comments.  We're still quite surprised by the reception, but appreciate it.  This part is just over 4400 words.

==> <a href=""http://sky-walking.livejournal.com/tag/once+was+lost"">Read all previous parts here!</a>

<lj-cut text=""Obi-Wan pulled back from the kiss after what seemed like a brief eternity."">
Obi-Wan pulled back from the kiss after what seemed like a brief eternity. He stared at Anakin's mouth, smiling softly. They were quiet for a long moment, with nothing but the gentle rhythmic crash of the waves against the shore and the soft breath of the wind to break their silence. Anakin shivered after a moment, feeling a bit chilled by the cool water swirling around his bare ankles.

""Well. This is awkward,"" said Obi-Wan, chuckling softly and pulling away. The large moon was high in the clear night sky, putting silver around the edges of everything Anakin could see, leaving strange shadows on Obi-Wan's bearded face.

Anakin took Obi-Wan's left hand in his own and tugged.  ""Let's go back to the house."" It was nice, just to be able to touch Obi-Wan. They had been apart, physically and mentally, too long.

Obi-Wan glanced back at the ocean stretching out behind them, then nodded, almost shyly. He followed Anakin's lead, pausing only to make sure they picked up their boots.  Anakin never let go of Obi-Wan's hand, even when he wound up walking awkwardly backward up the kitchen stairs. Instead, he just smiled at Obi-Wan, enjoying himself too much to care about little things like not being able to see where he was going. Besides, his awareness of the Force prevented him from falling. When they got inside the house, Anakin pulled Obi-Wan close for another kiss.

Obi-Wan kissed back slowly, winding the folds of Anakin's blue tunic around his fingers. He drew back for a breath, taking a moment before speaking. ""This might be a little fast...""

""Hmm?"" Anakin murmured, looking at Obi-Wan with more happiness than he had in years. He tilted his head, a half-smile curving his lips.

""I said... this might be going a little fast."" Obi-Wan's lips hovered near Anakin's, his eyes bright and blue as he stared at him meaningfully.

""Did you want to stop?"" Anakin wasn't going to jeopardize this fragile peace between them by doing anything Obi-Wan didn't want.

""I'm not... sure.""

Anakin leaned forward and brushed his lips against Obi-Wan's. ""I don't want to. But I can wait.""

Obi-Wan kissed him again, surprisingly gentle but for the scratch of his beard. ""This just seems so sudden, though I suppose it really isn't.""

Anakin stroked Obi-Wan's face. ""No, but we can go slow anyway."" It would actually be a pleasure to take his time, to learn Obi-Wan's body and mind even more intimately than he had before, when they'd been only friends.

""Slow would be... nice,"" Obi-Wan whispered. His fingers ran over Anakin's face and neck, meeting him for another kiss, sliding his tongue into Anakin's mouth.

Anakin's tongue slid against Obi-Wan's. He settled one hand on Obi-Wan's hip and cupped the back of Obi-Wan's neck with the other. He knew they wanted to go slow, but he was getting hard just from this. The feeling of Obi-Wan against him soothed parts of him he hadn't realized were hurting.

To Anakin's surprise, Obi-Wan murmured, ""It's not very comfortable to do this against a kitchen counter,"" between kisses.

Anakin tightened his grip on Obi-Wan's hip. ""Did you have another location in mind?""

""Maybe someplace softer..."" Obi-Wan smiled against Anakin's mouth, his beard tickling Anakin's chin. ""I am an old man, you know.""

""Mmm,"" Anakin said, ""I can think of just the place."" He rubbed himself against Obi-Wan once before detaching himself just enough to start walking them to the bedroom. He froze when he realized Luke was standing in the doorway, eyes wide.

""Daddy? Ben?""

It was like walking into a freezing cold shower. Obi-Wan detached himself immediately, and despite the dark of the kitchen, his face was red as a crimberry.  ""Luke,"" he said, his voice somewhat strangled. He bent down until he was eye level with the boy, using the Force to flip on the kitchen lights. ""What's wrong?""

""I wanted a glass of water,"" Luke said, clutching his stuffed bantha. He paused for a second, frowning. ""Are you and Daddy going to be like Daddy and Mommy?""

Obi-Wan's mouth worked, but no sound came out. He eventually closed it, swallowing rapidly.

Anakin stepped forward and picked Luke up, supporting him with one hand while looking for a glass with the other. ""Not quite,"" he told Luke. ""Mommy will still be Mommy, and I will still love her, but Ben and I are going to love each other, too. Okay?""

Luke nodded solemnly, apparently finding nothing out of the ordinary about this arrangement. He limply kicked his legs, waiting as Anakin found a glass in the cabinet, then maneuvered it under the water dispenser, filling it up. When he handed it to Luke, Luke only smiled and sipped at the water, holding onto the glass with both hands.

Anakin smiled back and ruffled Luke's hair. ""Let's get you back to bed."" He looked up at Obi-Wan, still smiling.

Obi-Wan was still blushing, but he'd stood up, busying himself with straightening out his clothing. ""I -- I'm going to head back to the compound. I do have classes to run tomorrow. I can come back in a few days."" He was obviously speaking to Anakin, but looking at Luke.

""We'll be waiting for you,"" Anakin said warmly.

Luke waved. ""Bye, Ben.""

""Good-bye, both of you.""

Obi-Wan smiled and slinked out, his face still flushed with embarrassment.

Luke finished his glass of water and smiled at Anakin. ""Ben gets funny when people kiss him, Daddy. Just so's you know,"" he said solemnly.

Anakin took the glass of water from Luke and put it on the counter. He would wash it in the morning. ""I know. He'll get better. I promise."" He ruffled Luke's hair again.

Luke smiled again, his small face lighting up, and he rested his head against Anakin's shoulder, allowing himself to be carried off to bed.

<center>~~~~~~</center>

Obi-Wan didn't return for three days, and then only to pick up Luke and Leia for their training. He seemed strangely shy again, though not necessarily distant. Anakin asked him to come back that evening, and Obi-Wan promised he would, after dinner.

Almost as if on cue, just as Anakin was cleaning up after his evening meal, he heard the hum of a speeder outside.  It abruptly shut off. There was a knock on the front door only a few moments later.  Anakin opened the door, torn between anticipation and anxiety. He knew Obi-Wan wanted this as much as he did, but Obi-Wan could have changed his mind. So much had happened between them that it was entirely possible.

""Hi.""

""Hello,"" said Obi-Wan, smiling a bit, though he didn't quite meet Anakin's gaze. He shifted awkwardly from foot to foot. ""How are you?""

""Good,"" Anakin said, unsure of what to do. ""Did you want to come in?"" He stepped back, giving Obi-Wan room to enter the house if he wanted to.

""Of course."" Obi-Wan breezed past Anakin into the sitting room, walking lightly and stiffly, making sure not to touch Anakin. He kept his gaze neutral, flicking around the room as he entered. He paused, then: ""Luke and Leia are doing well. Master Yoda would like for you and Padme to seriously consider letting them become Padawans.""

""I..."" Anakin wasn't sure what to say. He had to discuss this with Padme, of course, but his feelings on the twins becoming Jedi were mixed. ""You won't take them away from us?""

""Of course not. Little would change. Master Yoda feels the Jedi Order failed by not changing, when the Sith had. He feels strength could be found through family and attachments, but we should teach control and resistance to the dark side.""

""Good."" Anakin's deepest, and only, fear was in losing his children. They were the center of his life. ""I'll talk to Padme, but if that's what they want..."" Anakin trailed off, sighing.

""It is up to the four of you. Master Yoda is eager to train them, as am I, but... it is up to you. Yoda is also very interested in taking Leia as his apprentice.""

Anakin had to laugh at that. He tried to imagine Leia and Yoda paired and could not. They were far too different. ""I'll talk to Padme,"" he repeated, and tentatively stepped closer to Obi-Wan.

Obi-Wan tensed slightly. ""And I think I'd like to train Luke,"" he said quietly. ""I think I could help him better than I did you.""

Once again, Anakin found himself lost for words. After what had happened between himself and Obi-Wan, he was afraid. At the same time, he knew Obi-Wan had changed as much in the past five years as he himself had. Obi-Wan was probably right.

""Yes,"" he said. ""But let me help? A little?"" Anakin knew they would never allow him to take a Padawan, but he wanted to help train his children.

""Of course. They're still your children. Things are different now. For all the Jedi. There might have even been some good from what happened.""

Anakin lowered his eyes and looked away from Obi-Wan. ""We can only hope.""

""Your children gave you hope. They gave me hope. They gave Padme hope. And they even gave Yoda hope. Hope is important.""

""Yes,"" Anakin breathed, moving closer to Obi-Wan. ""And so is love.""

Obi-Wan finally met Anakin's gaze, his expression full of an intensity and passion he rarely displayed. ""Yes.""

Anakin took Obi-Wan's gaze as a sign that his advances were welcome and pulled Obi-Wan into a soft kiss. Obi-Wan's lips were warm and dry, and the scratch of his beard was pleasant.  Obi-Wan kissed back after a moment's hesitance, reaching up to stroke Anakin's face. His fingers felt moist, probably from his palms sweating. It seemed odd that Obi-Wan was nervous for his palms to sweat.

Anakin tangled his fingers in Obi-Wan's hair, drawing out the kiss. Eventually, he pulled back to study Obi-Wan's face. ""All right?""

Obi-Wan's eyes were half-lidded, a soft smile on his lips. ""Yes. Very much so,"" he whispered, then kissed Anakin again, clutching Anakin's face.

Anakin melted into Obi-Wan. It was possible he wanted to hold that well-loved body to him forever, but the demands of biology interfered. ""Mmm. Bed?""

Obi-Wan pulled back a little, licking his lips. He stared at a point past Anakin's shoulder as he spoke. ""Are you sure?"" he asked.

Anakin had considered this long and hard, and had realized that he trusted Obi-Wan. Real trust, this time. There was no fear in him now. He took Obi-Wan's chin in his hand and made Obi-Wan look him in the eye. ""Yes.""

Obi-Wan smiled, taking Anakin gently by the hand, heading down the narrow, darkened hallway to his bedroom. He still looked shy, but... happy.  Anakin was smiling, too, as they entered the dark bedroom. Everything smelled fresh and clean, as Anakin had changed the sheets just that morning, and the white walls and sheets looked blue in the starlight streaming in through the window over the wide bed.

""Love you,"" Anakin murmured into Obi-Wan's ear.

""Love you, too,"" said Obi-Wan, very quietly, turning to kiss Anakin again, trailing his fingers over the sides of Anakin's face. ""Do you... know what you want to do...?"" he asked delicately between kisses.

""Not really,"" Anakin said. He hadn't really thought about that. ""I thought you..."" Anakin didn't think he had a right to make demands of Obi-Wan. Obi-Wan should make demands of him.

""What?"" asked Obi-Wan quietly, pulling back to look at him curiously.

""You decide."" Anakin was the one being shy now. ""You have the experience.""

Obi-Wan's smile was brief. ""Not much, I'm afraid."" He ran his fingers through Anakin's hair. ""I don't want to... press anything.""

""You can,"" Anakin insisted. ""I trust you.""

Obi-Wan looked a little perplexed. ""This won't work if this isn't mutual."" He licked his lips, beard twitching, and leaned forward to kiss Anakin again. ""We'll just... take this slowly.""

Anakin returned the kiss, gently pressing his tongue against Obi-Wan's lips. Padme had taught him how to kiss, and for that, he was grateful.  Obi-Wan's tongue met Anakin's, sliding against it. He tasted of tea. Anakin slid his hands down Obi-Wan's body, wanting to feel skin. It had been a long time since he had been this close to Obi-Wan, and he had missed it.  Obi-Wan awkwardly tried to lead them to the bed without breaking the kiss.  Anakin managed to follow Obi-Wan's lead to the bed, despite the fact that he was fiddling with the ties of Obi-Wan's sash. Obi-Wan was wearing too many clothes.

Obi-Wan paused when their legs bumped against the bed. He grabbed Anakin's hand, forcing him to stop for a moment, holding his gaze. ""If you don't like something I do, tell me. I'll do the same. This is for both of us.""

Anakin nodded slowly. As much as he wanted Obi-Wan to have charge of this, he also knew that they had to talk to each other if it was going to work. ""Yes.""

""Good."" Obi-Wan's hands glided down to Anakin's waist. He lifted up the edge of the dark tunic, lightly stroking the skin he found underneath.  Anakin's skin felt electrified as Obi-Wan touched him. There was no doubt about whether he would be able to do this now; he was quite hard. He succeeded in opening Obi-Wan's tunic, breath hitching as he ran his hands over Obi-Wan's smooth skin.

Obi-Wan let out a puff of air, shivering a little at the touch. He'd run both hands under Anakin's tunic now, stroking Anakin's chest and belly, lifting Anakin's tunic up to explore his upper torso.  Anakin made a small sound, his body singing. This was almost better than Padme, because this was new, and strange, and <i>Obi-Wan</i>. He pushed Obi-Wan's tunic off his shoulders, desperate to see.

Obi-Wan was more slender than Anakin had supposed underneath all his tunics, but still well-muscled by years of combat training. His skin was pale, shining in the starlight. He shrugged his tunics completely off, then reached out to tug Anakin's tunic off, urging his arms upwards.  Anakin allowed Obi-Wan to pull his tunics off, but he was distracted by staring at Obi-Wan. He hadn't seen Obi-Wan unclothed in a long time, and he had forgotten how beautiful Obi-Wan could be.

Obi-Wan pulled Anakin close, the bare skin of their chests meeting in a mild jolt of heat. ""What's wrong?"" asked Obi-Wan, his voice breathy.

""Nothing,"" Anakin said, his voice shaky. ""You're so gorgeous.""

Obi-Wan smiled. ""Perhaps. But I think you're more so,"" he said softly, kissing Anakin's chin, his hands sliding up and down Anakin's back, over his shoulder blades.

Anakin caressed Obi-Wan's flanks. Obi-Wan's skin was hot to the touch, and softer than Anakin had expected. He petted Obi-Wan's belly.  Obi-Wan had put a little weight during his middle age, his waist a bit soft and thick, though quite pleasantly so. Obi-Wan slid his hands down to the waistband of Anakin's trousers, hooking his fingers around them, pulling them down Anakin's hips slightly and then pausing.

""It's all right,"" Anakin whispered. ""Go on."" He moved his own hands to Obi-Wan's hips, sliding them into Obi-Wan's leggings.

Trembling a little, Obi-Wan slid Anakin's trousers off his hips, until they slid down his legs into a puddle at Anakin's ankles with a loud rustle of cloth. Obi-Wan gently rested his palms against Anakin's hips, hovering for a moment before skin met skin.  Anakin's cock was hard, and light glinted off the drop of moisture at the tip. Anakin liked the way Obi-Wan's hands felt against him, and wished they would move. He started pushing Obi-Wan's leggings down, wanting them to be on equal footing.

Obi-Wan removed his hands long enough to help Anakin with his leggings and take his boots off. He wasn't meeting Anakin's gaze, staring at the pile of clothes on the floor as he gestured at the bed. ""We should at least make this comfortable,"" he said.

Anakin was a little worried about the fact that Obi-Wan wouldn't meet his eyes. ""Yes,"" he said, climbing on the bed and extending his hand for Obi-Wan to join him.

Obi-Wan took his hand and slid onto the bed next to him. He finally met Anakin's gaze as their naked bodies together, and to Anakin's relief, he simply looked nervous. He kissed Anakin again, his arms wrapping around him.  Anakin made a noise in his throat as their bodies met, cocks brushing against each other. This felt so easy with Obi-Wan. They were where they were supposed to be, and it felt good.

Lying comfortably against Anakin, Obi-Wan nuzzled against Anakin's neck, his hands rubbing over Anakin's back, his hair, his shoulders, and after some hesitation, reaching down to cup his ass.  Anakin licked Obi-Wan's ear, tasting the shell. His only reaction to the movement of Obi-Wan's hands was to move closer to Obi-Wan. Obi-Wan made a very soft noise, gently kneading the flesh under his hands, pressing Anakin against him even more tightly, his hard cock digging into Anakin's left hip.  Anakin practically purred with contentment, and rubbed himself against Obi-Wan's cock. He wanted Obi-Wan to feel good. He deserved it.

Obi-Wan moved up to kiss the corner of Anakin's jaw. ""I forgot how good it feels to be so close to someone, but it's always better when you're with someone you love,"" he whispered.

""Mmm,"" Anakin said. ""I want you to feel good."" He caressed Obi-Wan's back and ran his hands over Obi-Wan's ass. ""Tell me what you want.""

""This is fine."" Obi-Wan kissed him again. ""Whatever you're comfortable with.""

Anakin explored the inside of Obi-Wan's mouth for a moment before answering. ""Can I see you?""

Obi-Wan's eyebrow quirked. ""See me?"" he asked blankly.

""I want to look at you. I like looking at you.""

Obi-Wan laid back on the mattress, tilting his head. ""If you want.""

Anakin swept his gaze over Obi-Wan's body, admiring how the moonlight played over it. He followed the light dusting of hair on Obi-Wan's belly down to Obi-Wan's cock. It was thick and slightly curved. Obi-Wan's foreskin had retracted to reveal the swollen head. Anakin reached out and wrapped his hand around it, stroking lightly. It was a little strange to touch another man's cock, but he liked it. 

Obi-Wan's breath hitched. He propped himself up one elbow, breathing heavily, reaching up to stroke Anakin's face with his free hand.  Anakin kept stroking, running his thumb along the underside of Obi-Wan's cock, tracing the vein. This was so very different from Padme, and yet, it felt just the same in some ways.

Obi-Wan's eyes fluttered, his fingers stilling on Anakin's cheek. ""I'm going to come very soon if you keep doing that, Anakin,"" he whispered, his voice labored.

Anakin leaned forward and kissed Obi-Wan, his hand still on Obi-Wan's cock. ""Did you want me to stop?""

Obi-Wan kissed back, his lip movements sloppy. He ran his fingers through Anakin's hair, panting a little. ""Not really. I'm just... you might want to stop...""

""No, I don't,"" Anakin said with a smile, tightening his grip a little. He squeezed the head of Obi-Wan's cock. ""I want you to come.""

""Ah!"" Obi-Wan bucked a little and smiled up at Anakin. ""I'd say you're heading in the right direction,"" he murmured, kissing Anakin again, rather fiercely.

Anakin kissed back with equal ferocity, his hand never stilling. He brushed his fingers over the head of Obi-Wan's cock, and played with the foreskin. He also cradled Obi-Wan's balls, liking the weight of them.

Obi-Wan fell back against the mattress, his head arched back to reveal his pale throat, stark against the dark bristles on his bearded chin. ""I... Anakin,"" he gurgled, suddenly reaching down to seize the head of his cock as he came, his body spasming.

Anakin felt Obi-Wan's warm come splatter on his belly, and it felt good. He kept stroking Obi-Wan until he finished, loving the look of pleasure on Obi-Wan's face.   Obi-Wan shuddered one last time and lay still, staring up at Anakin, trying to catch his breath. He sat up after a moment, wiping his sticky fingers off on the sheets before running them over Anakin's face as he kissed him again.

Anakin returned the kiss and nuzzled Obi-Wan's face. ""Have fun?"" he whispered.

""Yes,"" Obi-Wan whispered, pulling back to kiss Anakin's neck. ""Now it's your turn.""

""Hmm?"" Anakin said, raising an eyebrow. He had a feeling Obi-Wan had something planned.

Obi-Wan smiled, rolling them over to press Anakin against the mattress. ""Just lie still. I've wanted to do this for a long time."" He kissed Anakin one last time, then slid down his body.

Anakin was beginning to get an idea of what Obi-Wan was planning, and it aroused him even more than he had been before. On top of that, Obi-Wan had said he had been wanting this for a long time. Anakin gave a pleasurable shiver at the thought.

Obi-Wan stopped at Anakin's hips, gently stroking Anakin's cock once, holding it up so he could gently lick the head of it.  Anakin whimpered. Padme had done this to him often, but it was so much more erotic with Obi-Wan. It was only through force of will that he didn't buck into Obi-Wan's mouth.  Obi-Wan delicately explored Anakin's cock with his tongue, tracing the wrinkles of flesh, veins on the underside, the slit at the tip of Anakin's cock. Just when Anakin thought he could take no more, Obi-Wan fit most of Anakin's length into his warm mouth and sucked.

Anakin groaned and clutched at the sheets. ""Obi-Wan,"" he panted, ""cl-close...""

Obi-Wan bent over Anakin, gripping Anakin's hips as if they were hand-holds, sucking harder than Anakin could recall anyone ever sucking on him, encouraging him to come with a press of his tongue along the underside of Anakin's cock.  Unable to hold out any longer, Anakin came with a yell, his orgasm intense. He could feel Obi-Wan swallowing around him, feeding into the wave of pleasure that overwhelmed him. Obi-Wan sucked on him until he was done, then patiently licked him clean, massaging Anakin's hips.

Obi-Wan sat up, tossing his head back, his hair sliding across his face.  ""All right?"" he asked with a rather smug smile.

Unable to speak, Anakin pulled Obi-Wan forward for a lingering kiss. He felt utterly limp and content. Obi-Wan kissed back, sliding up to move next to Anakin again. he was far more relaxed than before, even hooking his leg around Anakin's. He ran a hand down Anakin's cheek to his neck, then slid down to stroke Anakin's chest.

""That was nice,"" Obi-Wan whispered when he came up for air, his eyes bright in the darkness of the room.

""That was wonderful,"" Anakin corrected. He ran his hands over Obi-Wan's back. ""You're good it.""

Obi-Wan settled back, pulling himself up to rest his head on the pillows, dragging Anakin up with him. He held Anakin close, burying his face in his hair, breathing deeply. ""I told you. I've wanted to do it for a long time,"" he said quietly, pressing his cheek against the top of Anakin's head. ""It <i>was</i> wonderful.""

Anakin pressed Obi-Wan against him, not needing words to express himself. They drifted off to sleep together, holding each other tightly, happier than they'd been in years.

<center>~~~~~~</center>

Luke scratched at his new Padawan braid. He wasn't sure why Daddy had changed his mind about letting him and Leia become Padawans, but he thought it might have something to do with Daddy and Ben kissing. They'd been doing it for months now, though, of course, they weren't kissing now.  They were both were sitting on a blanket farther up the beach with Mommy, deep in conversation.

It was a bright, sunny day, with no clouds in the blue sky.  Luke felt warm and peaceful standing in the sun, watching Mommy and Daddy and Ben, soaking up their joy through the Force.  There were still many times when Daddy was sad and guilty, and people still argued, but it didn't seem as often. Luke wasn't sure what the three of them did at night when locked away in Daddy's bedroom, but it seemed to make them all happier.  He could sense the changes between them, how they'd all connected.

Something wet hit the back of his neck and Luke whirled around to see Leia giggling. ""Hey!""

Leia had fistfuls of wet sand, grinning at Luke from the water's edge. Her braided hair was soaked, almost looking black, and her eyes sparkled. She seemed a little more peaceful since Master Yoda had started training her, though she was still a pain. Luke was rather happy he got Ben to train him; Ben was much nicer and easier to understand.

""Why you staring at Mommy and Daddy and Ben?"" she asked. ""They're just gonna all start kissing and being <i>boring</i> again!""

""Kissing is icky,"" Luke agreed. He thought about throwing sand at Leia and decided it would be better if he went in the water. She couldn't get him with sand there. ""But sisters are ickier!"" He dashed for the water before Leia could throw more sand.

""You take that back!"" Leia screeched, running after him. Though she was smaller, she managed to get the best of him, grabbing his arm and kissing him wetly on the cheek. ""Ha! I win!""

""EW!"" Luke yelled, scrubbing at his cheek. ""That's gross!""  He really couldn't understand why Daddy would want to kiss Mommy and Ben. Grown-ups were <i>weird</i>.

""Luke! Leia! Come inside now. We're going to have dinner,"" called Mommy, standing up from the blanket. She brushed sand off her green skirts, flicking some of it Ben's face as he looked up at her. He laughed and brushed it off, smiling brightly. He turned back to Daddy, speaking quietly.

Leia let Luke go and ran forward, pausing once she left the water.  She tugged on the straps of her white bathing suit. ""C'mon, Luke! What are you waiting for?"" she asked.

""For you to get out of the way, monkey face!"" Luke ran past Leia, sticking his tongue out. He wanted to be the first one to the house so he could sit between Ben and Daddy at dinner. They smiled at each other a lot more now, and it made him happy. 

Luke wasn't always sure what Mommy and Daddy and Ben were doing, but he knew it was a good thing.


<i>The End.</i></lj-cut>"
