"names","values"
"itemid","6"
