"names","values"
"eventtime","2006-03-20 08:16:00"
"url","http://sky-walking.livejournal.com/1573.html"
"userid","14083"
"itemid","5"
"event","<b>Title: ""Once Was Lost"" -- Part Three of Four</b>
<b>Author:</b>  <lj user=""sky_walking"">
<b>Rating:</b>  PG  (Will be NC-17 by final part.)
<b>Pairing:</b>  Anakin/Obi-Wan (There is Anakin/Padme in here, but it's supportive.)
<b>Summary:</b>  In this galaxy, Anakin defeated Obi-Wan at Mustafar, but turned away from the dark side four years ago to save his children.  Though reconciled with his wife and trying to recover from the madness of the dark side, his relationship with Obi-Wan remains strained and unresolved.  Can they become friends again or perhaps something more?
<b>Warnings:</b>  Post-RotS AU, Slash
<b>Disclaimer:</b>  Star Wars belongs to George Lucas. We're not affiliated with him, just having fun with his Jedi.
<b>Notes:</b>  Please see <a href=""http://sky-walking.livejournal.com/768.html"">Part One</a> for full notes.  For <lj user=""brynneeryn"">.  We apologize again for the delays real life has caused for this part, however the fourth and final part will be out in a few days.  This part is a little less than 3400 words.

==> <a href=""http://sky-walking.livejournal.com/tag/once+was+lost"">Read all previous parts here!</a>

<lj-cut text=""Everyone was leaving Anakin, it seemed."">
Everyone was leaving Anakin, it seemed.

Obi-Wan had taken the twins back to the Jedi compound to train with Yoda yesterday evening, which had given Anakin and Padme time to be alone.  Though he missed his children, spending time alone with his wife had been reinvigorating.  She reminded him why he'd turned away from the dark side, and why he continued to live, even though it hurt so much.

It was mid-morning, the sun perched in a perfectly blue sky.  A light wind ruffled the sands on the beach outside Anakin's house, the distant cries of gulls floating in the open window of his white bedroom.  Padme was packing to leave, muttering to herself as she fluttered about the room, lifting up their baubles for her jewelry or rummaging though drawers in the nonak-wood dressers.  Anakin tried to help, with mixed results. He had learned about the intricacies of her wardrobe over the years, but he was no handmaiden.

""Are you sure you're all right with this?""

Padme paused, then reached over to take her bodice out of Anakin's hands and slip it properly into the bag. She smiled at him. ""I'm not sure. I mean, I'm not stupid. I knew you loved Obi-Wan from the moment I met you again -- you were trying too hard to get both our attention. But I... I can't be with you all the time. Neither can he. We already share you. I just... I just don't want this to get weird. Weirder. Besides, Anakin, you have to realize he might not want to. He probably won't want to.""

""I promise this won't be strange. Neither of you tends toward jealousy, and I know you are both very different."" Anakin paused and looked down, his face half-shadowed. ""If he doesn't want to, I won't press. I don't have the right.""

""Expressing romantic interest in him isn't going to fix anything between you. It's going to take more than that, Anakin. You know that.""

""I know. I'm just not sure where to start. I hurt him so much.""

Padme stroked his face, smiling softly. ""Just, whatever you do, mean it. Insincerity or even trying to make up for what you did won't work with him. He's moved past it as much as he's able.""

""I do mean everything I do. He doesn't believe me."" Anakin kissed Padme's hand. ""Do you really think he's moved on?""

""I think so. It's been four years, and most of those he's spent helping you. I think he's just -- oh, Anakin, I knew about him the whole time, but he never knew about <i>me</i>.""

""I didn't mean to hurt him. I was afraid of what he would do. He could have destroyed us."" Anakin exhaled, looking at the carpeted floor. ""Like I almost did.""

Padme shook her head. ""Your problem was that you didn't fully trust him. And he fully trusted you. Now, that has reversed. And with good cause.""

Anakin nodded. ""He needs to see he can trust me. How can I show him that?""

""I... don't know that you can. Not like that. What trust he will give you, you've already earned."" Padme squeezed Anakin's hands, her brown eyes bright in the sunlight. ""Just... be yourself, Anakin. Don't try so hard.""

Anakin squeezed back, then took his wife in his arms. She always knew what to do and say, even when he didn't.

Padme wrapped her arms around him. ""I'll try to talk to Obi-Wan. I'm just going to let him know my side. I just want for all of us to be happy, that's all. Together.""

""Thank you,"" Anakin whispered. ""For everything. I love you.""

Padme rested her face against his chest, and Anakin could see her still smiling when looked down at her. ""I love you, too, Anakin. I don't know what I'd do without you. I'm so glad you came back to me.""

""I'm glad, too. I prefer loving you like this."" He didn't need to mention the alternate; Padme had suffered it more that he had.

Padme looked up at him. ""I'd like all three of us to be happy, at least a little."" She kissed Anakin's fingers.

""So would I,"" Anakin said, leaning down to kiss her. They stood like that for a moment before noises at the front door told them that Obi-Wan had arrived with the twins. ""Looks like we'd better hurry.""

Padme smiled and grabbed a couple of her bags, while Anakin picked up the rest. He nearly threw out his back and couldn't recall such a workout in recent memory, but he managed to stumble out into the hall after Padme, who walked with her usual grace and composure.  The narrow hallway gave way to the small sitting room, where Anakin took a moment to catch his breath, wondering if Padme had stuffed a bantha in her bags.

The twins seized on her the moment they appeared. ""Mama!"" they cried in unison, running over to her.  They buried their faces in her thick yellow skirts as Padme dropepd her bags and bent down to hug them.

Anakin took a moment to set down a few of Padme's bags before looking up. Obi-Wan was standing in the doorway, eyes firmly fixed in the middle distance.  He shifted his gaze to the twins. ""Were you good for Master Yoda?"" he asked.

""I was,"" piped up Luke, as Padme picked him up her arms. She and Luke had bonded more closely than Anakin had ever expected, being similar in temperament. ""Leia wasn't.""

Leia glared at her brother, then let go of her mother and ran straight for Obi-Wan, who gently picked her up. She started sobbing into his shoulder, and he stroked her braided hair, his beard twitching.

Anakin wasn't sure whether to be amused at the twins' antics or miffed that he had been ignored. ""What happened?"" He directed the question at Obi-Wan, even if he didn't make eye contact.

Obi-Wan looked over at Padme as he answered. ""Leia decided she didn't need to listen to Master Yoda. She refused to meditate or study and shouted at him when he told her to calm down. He ignored her, so she became even angrier, and tried to throw something at him. He floated her up to the rafters, and she had to sit up there all day. I think she's learned her lesson about anger and violence now.""

""I just wanted to play with my training saber,"" sobbed Leia, clutching Obi-Wan's beige robes with her chubby little fists, shaking.

""Leia, you need to be patient. I'm sure if you had done what Yoda asked, he would have let you play."" Anakin tried to ignore the irony of giving this advice, his tone heavy. ""Bad things happen when you take what you want.""

Obi-Wan glanced over at Anakin, his expression now very serious. When Anakin met his gaze, he looked away, stroking Leia's hair. She gulped a bit, peeking at Anakin from Obi-Wan's shoulder, watching him thoughtfully, trailing her small fingers through Obi-Wan's beard now.

Anakin stepped closer to Obi-Wan, eyes focused on Leia. ""Leia, sweetie, people listen to you better if you ask nicely. Hurting people never makes anything better. Your daddy learned that the hard way.""

She watched Anakin with very large brown eyes, then hid her face. ""I don't like the rafters,"" she whined.

Obi-Wan kept his gaze on Leia, silent and sorrowful. Padme walked up, smiling over at Obi-Wan and patting her daughter on the back. ""It'll be all right. You'll learn, darling.""

Anakin stroked Leia's hair, his hand covering almost her entire head. ""If you're good, you won't have to go up there any more.""

Leia looked up at Obi-Wan, petting his beard again, her eyes very wide. It was almost like they held some sort of silent conversation, for Obi-Wan nodded at her and then she turned and held her arms out for Anakin to take her.

Anakin wrapped his arms around her, cradling her. ""You're a good girl, I know it,"" he whispered.  He looked up at Obi-Wan and thanked him silently. ""Do you want to go say goodbye to Mama?""

Leia kissed Anakin wetly on the cheek and then nodded silently. Padme handed Luke to Obi-Wan and took Leia in her arms, crushing her tightly and kissing her on the forehead. Leia giggled.  Anakin leaned over to kiss Padme, trapping Leia between them. She giggled more.

""Will you be all right at the spaceport?"" asked Anakin. ""I can watch the twins while Obi-Wan drops you off.""

Padme cast a thoughtful glance at Obi-Wan. ""That's a good idea. Luke, Leia, give Mommy kisses good-bye."" She set Leia down and took turns smothering Luke and Leia in affection that they were still young enough to fully appreciate.

Luke sniffled a little bit when she pulled back. ""When are you coming back, Mommy?""

""A month at the latest. Don't worry, sweetie. I promise I'll come back."" Padme kissed both Luke and Leia again, then picked up her bags, standing up to kiss Anakin.  When they were done, Obi-Wan took Padme's bags from Anakin without meeting his eyes.

""Mast- Obi-Wan, can we talk later?"" Anakin wasn't going to let this fester, like he had so many other things. ""We need to continue our conversation from the other night.""

Obi-Wan stared at Anakin's collar, rather than Anakin's face. He took a deep breath. ""I'll come back with a few supplies,"" was all he said, his voice clipped. He headed out the door. Padme glanced at Anakin, mouthing an ""I love you"" before following out, blowing kisses at the twins.

Anakin returned Padme's gesture before looking at his children. ""What do you two want for lunch?""

They looked at each other and burst into tears.  Anakin sighed.  This was going to be a long day.

<center>~~~~~~</center>

Obi-Wan returned that evening, after dinner, the whirring noise of a speeder engine announcing his arrival. The twins were watching one of their HoloNet shows in the sitting room, talking to each other in their secret language.  They both lay on their stomachs, passing sweets from the box Anakin had given them to each other, their legs sticking up into the air.  Anakin smiled at them and walked out the kitchen door into the cool night air.

The moon was high in the sky, and the ocean lapped calmly at the shore. Obi-Wan pulled out a few boxes and crates from the back of the speeder, sweat dripping down his face.  Anakin walked over to the speeder and silently began helping Obi-Wan with the boxes. It was the least he could do now, and he enjoyed it. It was <i>normal</i>.

Obi-Wan looked in his direction, though he still avoided meeting Anakin's eyes. He carried what he had of the boxes and crates to the kitchen door without a single word. The wind ruffled his hair, the strands of gray gleaming silver in the moonlight.  Anakin brought his own boxes over and maneuvered everything so he could open the door for both of them. He walked into the brightly-lit kitchen and set his things down, waiting for Obi-Wan, wondering if talking to Obi-Wan tonight was going to be as difficult as it seemed.  Obi-Wan walked in and set the boxes and crates down. He didn't say anything, but he unloaded them, peering around the counters to see the twins in the sitting room, wrapped up in their show and each other.

Anakin set his boxes on the kitchen table and began unpacking. ""Did you talk to Padme?"" he asked softly.

Obi-Wan paused for a moment, then resumed storing boxes of food in Anakin's cupboards. ""I did,"" he said carefully.

""Then you understand,"" Anakin said. ""She knows. She doesn't mind.""

""Doesn't mind <i>what?</i>"" Obi-Wan spun on Anakin, a box of pasta still in his hand. ""Anakin, this is insane.""

""Why?"" Anakin asked. ""What's wrong with it?""

Obi-Wan's voice rose with each word he spoke. ""I don't know what crazy delusions you've got in your --""

""Ben?""

Obi-Wan froze, and Anakin looked past him to see Luke standing in the doorway to the kitchen, staring at them with wide blue eyes. They sparkled with what Anakin realized were tears.

""Please don't fight.""

Leia barreled past Luke and right to Obi-Wan's legs, wrapping herself around him. ""Don't be mad, Ben. Please don't leave. I'll be a good girl,"" she said, her high-pitched voice muffled by his pants.

Obi-Wan picked her up, glaring at Anakin before reaching out to ruffle Luke's hair. ""I'm not mad at either of you. Come along. Let's get you both to bed. It's late.""

Anakin reached down and picked Luke up, following Obi-Wan's lead to the twins' bedroom. He spent the trip whispering reassurances to Luke and stroking his back.  Luke made a wordless noise, settling comfortably in Anakin's arms, his small fingers winding in Anakin's long blond hair.  Once they reached the twins' room, the long process of getting Luke and Leia to sleep began. It took two stories from Obi-Wan and one from Anakin before the twins fell asleep.  Somehow, Anakin and Obi-Wan did this without looking at each other.

Anakin left the room before Obi-Wan did and waiting for him in the hallway. He didn't waste time when Obi-Wan walked out, the bedroom door sliding closed behind him with a soft hiss.

""I think you were in the middle of calling me delusional?""

""Let's at least have this conversation outside, where your children can't hear us and think we're speaking of them.""

Obi-Wan brushed past Anakin and walked out of the house, his steps sharp and quick. Outside, the night breeze ruffled both his and Anakin's hair, bringing the smell of salt and the ocean. The waves gently washed onto the shore, a rhythmic crashing sound that was half-disconcerting and half-soothing to a desert rat like Anakin.

Obi-Wan didn't stop by the small garden Padme had insisted Anakin build outside the house, nor even by his speeder. He walked all the way to the water, taking off his boots as he walked, leaving them abandoned in the sand. His footprints quickly filled with water, foot-shaped indentations stretching across the beach until he finally reached the water's edge.  He didn't stop until he was ankle-deep and the bottom of his pants was soaked. He seemed to relax a little then.  The moonlight glistened off the waves and his hair, making him seem like a young man.

Anakin took off his boots, but he didn't go any closer than the water's edge. While he could swim, and did, he preferred to stay out of the water unless he had to. Of course, the twins tended to insist he swim with them, but that was different.  That was for <i>them</i>.

Obi-Wan half-turned to face Anakin, his profile silver in the moonlight. ""It's not as simple as you want it to be,"" he said, his voice surprisingly clear, but under control now.

""How so?"" Anakin asked. He didn't understand what was so difficult for Obi-Wan to grasp.

""You just want me to forgive you, and you think by trying to convince me to be your lover, that everything that tore us apart would magically disappear. It doesn't work like that.""

That hurt. Anakin knew he deserved it, but it still caused his chest to ache. ""No, that's not it."" Anakin swallowed hard, trying to find the words to explain. ""I want you as a lover because I love you. Whether you forgive me is your business."" It hurt even more to say that, but Anakin had realized that he couldn't, and wouldn't, make Obi-Wan do anything, and so he had to live with whatever decision Obi-Wan came to. He looked up at the stars. They always had been the steadiest things in his life. ""I want to fix us, but I know that will take time.""

Obi-Wan's eyes were surprisingly bright, and Anakin remember how much Obi-Wan had always seemed at home by the water, at night, in the breeze. ""Why do you think that would fix us, Anakin? What makes you even think it would work? That I would even want it? That <i>you</i> would really want it?""

""I do want this. And you might. I know you want me, if nothing else."" He paused, running his tongue along the inside of his lips. ""I don't think this alone will fix us, but it's a start. It's more than what we've been doing.""

""<i>Want</i> you -- Anakin. You were my <i>apprentice</i>. My charge, my ward, and later my partner. We are -- were -- Jedi. Whatever being a Jedi means now, which isn't the same.  Any feelings we might have possessed, individually or together, had to be kept under control.""

""And now? You said you loved me. I could see that you didn't mean platonically.  I'm not <i>stupid</i>.""

Obi-Wan hung his head, turning away from Anakin. ""That was my shame, my weakness. You needn't try to placate me about it. Nor do you need to put yourself in a position to jeopardize not only your marriage, but all the work we've done to bring you to this point by starting a relationship you personally have no interest in.""

Anakin waded into the surf and put his arms around Obi-Wan. ""I'm not lying. I do want this. I am interested."" He clasped his hands in Obi-Wan's tunic, determined to hold him close as long as he could.

Obi-Wan tensed, but didn't pull away. He turned to look at Anakin, eyes still luminous. ""Anakin, I do love you. I can say that now. But this is not even a start at fixing anything. It's a start of something else -- of a relationship we never had before.""

Anakin nodded. ""I understand. If you want to wait until we've fixed things..."" He spoke slowly, rubbing Obi-Wan's shoulders, trying to help him relax.  He would prefer a healthy friendship with Obi-Wan to all the sex in the galaxy, but he wasn't sure if that was even possible.

""I thought we already had. As much as we could.""

Anakin hung his head. It was perfectly fair for Obi-Wan to say that, as much as Anakin wished it weren't true. ""I suppose we have.""

""I don't want to destroy the progress you've made. There are more things to consider than just you and me.""

""I'm not going to go back to what I was. I have too much to lose. And I don't want to be anything but honest with you.""

Obi-Wan was quiet for a long time, staring at Anakin's chin, rather than him. His voice was soft when he finally spoke. ""Padme said we'd always shared you."" It wasn't a question, but there seemed to be one behind it.

""You did. I always loved you. I was afraid to tell you, though. I could tell Padme, but I didn't think you would understand.""

""And you think it would be so easy now? That we would all get along perfectly? That changing everything we've become accustomed to -- again -- would never cause jealousy or confusion between the three of us?"" Obi-Wan's lips were very close now, his warm breath washing over Anakin's chin as the cool water swirled around their ankles.  ""Anakin, you didn't even like me visiting her as a friend.""

""Now we can tell the truth. We don't have to hide from each other. We all know what's happening. And I love you both equally."" Anakin didn't dare move, afraid of spooking Obi-Wan.

""You're not the man you used to be, but I wonder if you're the man I thought you were.""

Anakin didn't know how to answer that. He wasn't sure who Obi-Wan had thought he was, and how that differed from who he had been. He didn't know anything anymore, beyond that he loved is family: Padme, Luke, Leia, and Obi-Wan.

Anakin felt something soft trailing over his cheekbones and started when he realized it was Obi-Wan's finger. ""We could... start something new...."" whispered Obi-Wan.

""Yes,"" Anakin breathed, leaning forward. He pressed his lips to Obi-Wan's. The moment stretched forever, perfect and sweet.


<a href=""http://sky-walking.livejournal.com/1573.html""><i>Concluded in Part Four!</i></a></lj-cut>"
"eventtime","2006-03-17 07:10:00"
"url","http://sky-walking.livejournal.com/1314.html"
"userid","14083"
"itemid","4"
