"names","values"
"itemid","118"
"event","<p><font size=""4"">&nbsp;&nbsp;&nbsp;&nbsp;&nbsp;&nbsp;&nbsp;&nbsp;</font><font size=""5""> </font><font size=""4"">All Real Person stories are&nbsp;<br />&nbsp;&nbsp;&nbsp;&nbsp;&nbsp;&nbsp;&nbsp;&nbsp;&nbsp;&nbsp;&nbsp;&nbsp;&nbsp;&nbsp; 'FRIENDS ONLY'<br />&nbsp;&nbsp;<br />I think I've added everybody who wanted&nbsp;<br />to be added. Please comment if I missed<br />anybody.</font></p>"
"eventtime","2007-11-09 22:38:00"
"url","http://stonestepper.livejournal.com/30271.html"
"userid","14766"
"itemid","89"
