"names","values"
"event","<font size=""3"">THE EROMENOS

CHAPTER&nbsp;THREE</font>
<div class=""ljcut"">
<font size=""3"">Dinner was a festive affair that evening. The teachers sat at their own tables at the end of the hall. Windows and doors were open to let the evening air cool the occupants. Hephaestion didn&#39;t always sit with Alexander, but that evening he did. He could tell the prince was excited about something. He hoped it was good news for them. Hephaestion did not hold out for true emancipation, but he could always dream. His friends from Athens didn&#39;t seem to be as upset as Hephaestion was about their predicament. Maybe they were happy to get away from their families. So was Hephaestion for that matter. He wished he could be like Alexander&#39;s friends. Free young men, ready to take on the world. That should have been the life for him too. If his father had just held out. He would have offered his skills to King Phillip without being indentured to some rich man. Right now, Alexander seemed to be his only hope. 

Alexander put his hand under the table to&nbsp;surreptitiously run the back of his fingers down Hephaestion&#39;s thigh.

&quot;You are not eating, Phai. Do you want my apple?

&quot;No Alexander, you need to eat more fruit yourself. Why does there always have to be so much meat?

&quot;Shh, the boys of Macedon will be angry if they hear you,&quot; Alexander giggled. Hephaestion was funny in his ways sometimes, But Alexander loved him all the more for it. &quot;Lets go to our room. I have much to tell you.&quot;

The two boys got up to leave. Alexander was staring at Hephaestion&#39;s backside, but he wasn&#39;t to preoccupied to nab Ptolemys apple that he had put aside. Ptolemy didn&#39;t like them, and Hephaestion might be grateful later.

&quot;Your father bought me? My fathers sworn enemy. But why? Did he say?&quot; They had just sat down on Alexander&#39;s bed and Hephaestion was told the news.

&quot;He wanted to give your father a final blow. I am sorry, Hephaestion. My father is a man of war, and your father fought him all the way.&quot;

&quot;I don&#39;t blame your father for that. I just don&#39;t believe it. He paid an&nbsp;exorbitant amount for me. Alexander, you know more. What is it?&quot;

&quot;He saw you. By God Hephaestion, it seems even my father is not immune to your charms. He thought you were incredibly beautiful and he wanted you.&quot;

Hephaestion put his hands over his face. He started to tremble.

&quot;Oh Ale&#39; not your own father. I can&#39;t lay with my own love&#39;s father.&quot;

&quot;Hephaestion, that is my best news. I told father that we were in love and asked him to gift you to me. Hephaestion, he agreed. He said yes.&quot;

&quot;So I will belong to you.?&quot;

&quot;You already belong to me.&quot;

&quot;My heart belongs to you. My soul belongs to you. My body is yours to desire. You own me in so many ways. But I do not want to be your property. When will he gift me to you?&quot;

&quot;Not until you are eighteen. He says it is the law.&quot;

&quot;He could do it now. He&nbsp;*is* &nbsp;the law. What is to stop him from changing his mind? He could take me any time he wants to, and there is nothing we can do about it.&quot;

&quot;He won&#39;t. He will be honorable to the pledge he gave me.&quot;

&quot;What did you agree to, Alexander?&quot;

&quot;I just told him I would be a good son. Honor him. Maybe take his side against Mother sometimes. He did not ask for much.&quot; He has been in love with Cleitus for twenty years. He respects true love.&quot;

&quot;Cleitus? The man who came with him today?&quot;

&quot;Yes, Cleitus has been like a second father to me, they are so close. He is several years younger then my father. I don&#39;t remember a time when they haven&#39;t been together. He was mad at my father for buying you.&quot;

&quot;He is very handsome. I wonder why your father would desire me, when he has Cleitus.&quot;

&quot;Because you are young and pretty, and he is old.&quot;

&quot;He can&#39;t be much more then thirty. You will still love me when we are thirty, won&#39;t you Alexander?&quot;

&quot;I will love you my entire life. I just don&#39;t like you thinking my fathers lover is handsome.&quot;

&quot;You are jealous. Ale&#39;s jealous.&quot;

&quot;Stop it. I am not.&quot;

&quot;Good, because how could the person who owns my soul be jealous of the person who has just my passing thought.&quot;

&quot;I love you, Hephaestion.&quot;

&quot;I love you. I wish My father had given me some money. I would like to buy you a gift sometime.&quot;

&quot;You are all the gift I will ever need.&quot; Alexander said, reminding himself to buy Hephaestion a gift. He had never thought of that. But, he would like to give his lover things. To see his joy.

&quot;Not for three more years.&quot;

&quot;You are my gift now. A gift from Zeus himself. Any other gift will always pale in comparison to my most valued treasure. And speaking of gifts, it is my mothers birthday in two weeks. My father told me to invite all my friends. I would like you to go, Hephaestion. My father said it is alright, as long as we keep things private.&quot;

&quot;I would like to see your home. My friends, are they invited.?&quot;

&quot;You all are.&quot;

&quot;Do we bring her anything?&quot;

&quot;No, but I need to figure out a gift to give her. She has everything, and she is never satisfied.&quot;

&quot;What does she like?&quot;

&quot;Snakes. She likes snakes.&quot;

&quot;How about a picture. A picture of you and your mother and a snake.&quot;

&quot;How am I going to get that. I know of no artists in Macedon.&quot;

&quot;I can draw quite well. And if I have time I can mix colors and paint it. I will somehow need to see your mother before hand.&quot;

&quot;Hephaestion, it&#39;s too much. It would be a gift from you. Not myself.&quot;

&quot;Then pay me. Commission me to paint your mothers picture with her beloved son.&quot;

&quot;I keep finding things out about you. You speak a million languages. Now you are an artist.&quot;

&quot;I have sketches here that I have done. Do you want to see?&quot;

&quot;Very much.&quot; Alexander watched Hephaestion bend over his trunk in order to search for sketch tablets. He nearly moaned when he saw Hephaestion&#39;s bottom. He wanted the other boy so badly. He was sick with love for him. He didn&#39;t want to rush his friend, but he wanted more then kisses and sucking each others cock. Although Hephaestion had not only gotten really good at it, he seemed to love it too. 

&quot;Here&#39;s one.&quot;

Alexander dutifully opened the book and got a huge surprise. Hephaestion <i>was</i> a true artist. There were a few pictures of a group of people he assumed were Hephaestion&#39;s family. One picture Hephaestion even put himself in the picture. He was standing with his arms outstretched, reaching&nbsp;towards his family, who had their backs turned to him. It was a sad picture. There was one of Alexander and Cassander kicking a ball. There was a picture of Domine looking at the sky as if held all the secrets. Alexander turned the page, and saw himself staring back. It was Alexander looking at Hephaestion in the mirror. It was very beautiful. There was one more picture. It was Alexander again. Naked, laying in the grass beside the lake. His body looked strong and muscled. His head was tipped back a little bit, and his lips parted. It was an erotic picture.

&quot;You have made me look so beautiful.&quot;

&quot;You are beautiful, Alexander. I draw what I see.&quot;

&quot;I want you to draw yourself like this. And different ways also. I want pictures of you. I will pay you.&quot;

&quot;Buy my paper, and my quills, and that is all. That can be my gift to you. Why would you want pictures of me?&quot;

&quot;Because I hate when you are out of my sight. This way I can always see you.&quot;

&quot;I hope we are always together. Alexander, &nbsp;when your father gifts me to you,&nbsp; you are going to free me, right?&quot;

&quot;I don&#39;t know if it&#39;s allowed.&quot; Alexander felt guilty. He would value his own freedom. But would Hephaestion suddenly pull away from him if he was allowed his. He liked Hephaestion&#39;s dependency. &quot;Would it be so bad for you if it&#39;s not allowed? It wouldn&#39;t make to much of a difference.&quot;

&quot;It would to me Alexander. I don&#39;t want your friends to mock me for being a slave. I am smart, and I can help you when you are king. I want to journey the world at your side. I want to be worthy of you. I want to be your equal. If it is allowed, you are going to free me aren&#39;t you?&quot;

&quot;Yes, I will free you.&quot; Alexander was suddenly chilled. He was scared of his emotions. What if Hephaestion were to leave him if Alexander made him mad. What would make him stay if he were free to go. He was scared that he had lied to his lover. Maybe he could tell him that it was not allowed. He knew that Hephaestion was his equal. But if Hephaestion belonged to Alexander it would keep others from thinking they might have a chance with his lover. He wished Hephaestion had never brought up that question.

&quot;I will love you forever, Alexander. In freeing me I will always belong to you. Thank you, my prince. You have loved me, and fought to save me. No man could ever ask for more.&quot;

Alexander leaned in to kiss Hephaestion. He wanted more. Needed more.

&quot;Let me make love to you tonight. I will make it so good for us.&quot;

&quot;Mm, yes.&quot;

Alexander stood up before Hephaestion and stripped himself. He loved seeing Hephaestion&#39;s eyes go wide. The first time he had seen Alexanders cock, it scared him a little. Now he was so ready for it. Alexander lifted the chiton over Hephaestion&#39;s head. He was naked underneath. They had both gone to the public bath before supper.

&quot;I love you,&quot; Alexander said upon seeing his lovers naked body. He kissed Hephaestion on his open lips, sliding his tongue inside, tasting him,&nbsp;inhaling him, becoming apart of him. &quot;I love you,&quot; Alexander said, when he kissed Hephaestion&#39;s neck, sucking a little on the sensitive flesh. Earlier that week, Alexander had witnessed two slaves making love in the stables. He called it making love, because that&#39;s what it was. What he had seen, he wanted to try with Hephaestion. He gently pushed Hephaestion so that he would roll over and lay on his stomach. &quot;I love you,&quot; Alexander said as he kissed his lovers back. Sliding his tongue over his warmed skin. He touched Hephaestion&#39;s bottom, squeezing the small muscled cheeks, opening them to gaze for the first time on the opening of Hephaestion&#39;s body. The opening that soon would become the link to make the two become one forever. &quot;I love you,&quot; Alexander said, as he put his tongue to the portal, holding Hephaestion down when he threatened to jump off the bed. He licked his lover, knowing he would never do this to any other man. Only Hephaestion. Always Hephaestion. He oiled his erection, ready to be inside his lover. But he wanted Hephaestion to be ready for him. &quot;I love you,&quot; he said as he slid his finger inside his lover, soon adding another. Hephaestion was moaning and crying out. Alexander loved the sound, wanting nothing more then to make his lover cry out his pleasure. Hephaestion&#39;s lust filled voice only spurred Alexander on. He licked back up Hephaestion&#39;s back, sucking once more on his neck. &quot;I love you,&quot; he said once more,&nbsp; pushing his cock into Hephaestion&#39;s passage. So tight. So wet and hot. Alexander stopped for a moment, for himself as well as for Hephaestion. The&nbsp;pleasure was almost to much. To good. He almost exploded from just entering his lover. He started to move, upset because he didn&#39;t think he would last long. He buried his face in Hephaestion&#39;s hair,&nbsp;&nbsp;inhaling his scent, concentrating on the pure enjoyment of being inside his&nbsp; soulmate. He reached under Hephaestion to touch his leaking member, to bring Hephaestion to&nbsp;fulfillment. He wanted to bring Hephaestion to completion without touching him, but he was afraid he wouldn&#39;t last. Hephaestion came into his hand, crying out Alexander&#39;s name. The pulsing&nbsp;vice on Alexanders cock brought him to his own completion. &quot;I love you,&quot; he cried, pumping his juices into his lover, to finally lay spent. His weight on his lovers back. He rolled off and Hephaestion buried himself in Alexander&#39;s arms.

Hephaestion wrapped his arms around Alexanders shoulders, throwing a leg over his hip. He thrust his face into Alexanders neck, breathing in his scent. He trembled from the aftermath of his first time. So happy it was Alexander. Happy that Alexander was holding him tightly, knowing it was what Hephaestion needed. Finally Hephaestion looked up at his lover, his blue eyes beautiful, and his lashes wet with tears. &quot;I love you, Alexander.&quot;

Alexander smiled a joyous smile. Looking upon this man made him feel great. As if nobody else ever got to gaze upon such beauty. He felt god-like from Hephaestion&#39;s love.

&quot;Ale&#39;, I wish I could kiss you and see you when we make love.&quot;

&quot;We can do it from the front.&quot; &nbsp;Alexander laughed, holding Hephaestion tighter to him.. He felt so much more experienced then his lover. It made him feel good that he was the only one Hephaestion would ever know. &quot;There are all kinds of ways for us to make love.&quot;

&quot;Alexander, can we do it again?&quot;

Alexander grinned. He could surely last longer a second time.</font>
</div>"
"eventtime","2006-06-27 13:23:00"
"url","http://stonestepper.livejournal.com/8215.html"
"userid","14766"
"itemid","31"
