"names","values"
"event","Same old start to a same old day.just work up raised up my car so when it snows it won't get stuck or so i won't be plowing the snow with the front of the car.there really ain't shit happening except i dyded my hair blonde in stead of always looking at black i needed a change.yestreday just went be my friend joes house and smoked some weed.Then after Chris left joe and me just sat there and talked about heartbreak.He knows how I feel.So that was cool.Shit I need to find a job soon because I'm sick of feeling like a dumbass at the Gay ass Eggstore.I'm so sick of that place it is so pointless working there.espically when U have a dumbass manger named Annette she is so fucking stupid.I swear she acts like a teenage girl and shes like 40 or something.(its time to grow up.)shit.well got to get ready to go to hell.oh yeah heres a little song that describes I think of how my parents are.This song is totally how i feel and it does make me want to cry.Cause this is actually how it is in my life.

Smile Empty Soul-Silhouettes
silhouettes above the cradle hold me down
they won't let me go the wrong way
my mother taught me all the fables, told me how
in the end all the sinners have to pay 
but...

i don't wanna live like my mother
i don't wanna let fear rule my life
and i don't wanna live like my father
i don't wanna give up before i die

he worked so hard his bones are breaking
he wore them down but long ago he lost the feeling
his good intentions leave me shaking, show me how
i don't ever want to end up like he did
and...

i don't wanna live like my mother
i don't wanna let fear rule my life
and i don't wanna live like my father
i don't wanna give up before i die

when i have kids
i won't put any chains on their wrists, i won't
i'll tell them this
there's nothing in this world that you can't be if you want it enough"
"eventtime","2003-12-05 13:40:00"
"current_moodid","92"
"url","http://talonawd0630.livejournal.com/2138.html"
"userid","15215"
"itemid","7"
"event","This song Makes me think of my angel I'll love U always

""How Can I Live""

I am so alike you,
In so many ways.
I know I'm just a copy,
That carries on the stain.

But, We make the same mistakes.
Cause, We are one in the same.
But, We leave behind the stain.
I cannot seperate.

All that lies in me,
All that dies in me.
How can I live without you?
All that lies in me,
All that dies in me.
How can I live without you?

I am your mirror image,
I'm all you left behind.
You made me what I am,
Then who the Hell am I?

But, We make the same mistakes.
Cause, We are one in the same.
But, We leave behind the stain.
I cannot seperate.

All that lies in me,
All that dies in me.
How can I live without you?
All that lies in me,
All that dies in me.
How can I live without you?

Why, you're nor guess or forget,
I know that our lives are the same,
Maybe we've got,
Just a guessing game,
A dirty stain,
That I cannot play.
But I follow your steps,
In the same way that you just walked away,
And blocked the way through.
I...will...not...live!

Do you think of me?
Do you dream of me?
I always dream about you.

Do you think of me?
Do you dream of me?
I always dream about you.

All that lies in me,
All that dies in me.
How can I live without you?
All that lies in me,
All that dies in me.
How can I live without you?"
"eventtime","2003-12-01 13:34:00"
"url","http://talonawd0630.livejournal.com/1869.html"
"userid","15215"
"itemid","6"
"event","Yes I have finally got my password because i did forget it.Anyways alot of shit has gone wrong in two weeks.1st my girlfriend broke up with me.Then my grandma dided.but the funny part was i cared more about losing my girlfriend then about my grandma sick huh.but i miss the hell out of my girl.Its weird just one day your fine next day its all over not even with a wink.I swear I don't understand it y can't I just have a real good realtionship liie we had.No they always have to break up with me what the fuck.I never did anything wrong to her.I always treated her the greatest.i miss her so much.We still see each which i love to do.But i miss calling her my girlfriend and feeling proud thats she my girlfriend.I just don't know.I swear I hope that evryone that ever said oh u two won't last and this and that and all the people against us our happy because we are not toghether anymore.I swear y can't i just be happy.I don't undertsand it i'm going to be alone the rest of my life I know it.I do everything right and it still doesn't work.I just wish she could just give us one more chance.I know I messed up a few things and I know what I did wrong and I just wish I could have one more chance but that will never happen.Sometimes when I'm eating I just lose my hunger because I just start thinking of her this is hard.I sometimes wonder if she thinks this way.Our does she just hide it.I don't know.My friends even said she is a great girl.I swear if I could start all over again with her I would because it was the greatest year I ever had because it was with her.I always had so much fun when I was around her,talkinmg to her everything.We were so happy together.I just wish I could have her back."
"eventtime","2003-12-01 13:10:00"
"current_moodid","9"
"url","http://talonawd0630.livejournal.com/1715.html"
"userid","15215"
"itemid","5"
"event","Yes I'm glad this week has finally come to a conclusion.But the best part is i only have ten days of school left and I'm out.I can finally take a good week to get some much needed sleep.Then find a job.I haven't wrote in this shit for a whole week because I never have time.Anyways,after i get the school and work day down I get to see my beautiful angel.Shes so sweet sometimes espically leaving me sweet voice messages at 1:30 in the morning.I heard it in school and it really did make my day.I found another thing out that being a shop manger is a head ache.Stupid asses don't listen to u when u say get the car out now.No they say yeah sure and just keep working on the car.Its pretty aggravating.Other than that the new Korn cd comes out in like 2 or 3 weeks it's going to be great.Yesterday my angel and I watched the movie Finding Nemo.Its a pretty cool movie.Not bad.Then after it was over she was playing her game and I fell asleep, but she woke me up by jumpin on her bed and lying on top of me.It was fun.Well I'm gald the weekend is here so I can get some rest."
"eventtime","2003-11-07 22:51:00"
"current_moodid","14"
"url","http://talonawd0630.livejournal.com/1445.html"
"userid","15215"
"itemid","4"
"event","the rest of my sunday was great.after i got out of the hell hole I visited my girlfriend at work on her break.i went by my friends house and she bought me a 40.Afterwards my angel got out of work early so I went their she thaught me how to make marconni and cheese.we ate and sat their and cuddled while watching Mr.Bean.I swear I wish I didn't have to leave because I was so cormoftable lying theri next to her, but I did because i got to get up to a shitty ass Monday, and can't stay by her house all night which sucks.Yay!!!!!"
"eventtime","2003-11-02 22:46:00"
"current_moodid","125"
"url","http://talonawd0630.livejournal.com/1135.html"
"userid","15215"
"itemid","3"
"event","this thing is pissing me off"
"eventtime","2003-11-02 15:57:00"
"current_moodid","24"
"url","http://talonawd0630.livejournal.com/775.html"
"userid","15215"
"itemid","1"
"event","yeah today got up early to meet christina at church.it was boring but i like to go for her.then i just came home because she went to work.had to listen to my stupid ass mom and heaven forbid gods sees that i sinned.yeah whatever.i was going to work on my talon but i'm too damn tired from working all week.that takes alot out of u.but 3 weeks and i'm out of school can't wait.finally i'll have a good paying job.but other than that i'm just waiting for my angel to get off work."
"eventtime","2003-11-02 15:27:00"
"current_moodid","109"
"url","http://talonawd0630.livejournal.com/467.html"
"userid","15215"
