"names","values"
"itemid","42"
"event","well haven't updated this in a while,but anyways guess I will now.1st off I'm blown out of my mind right now ha!Funny but anyways since I've turned 21 Nothing but party.Its fricken awesome usually hang out with the crew,but now more other people thatI have started to hang out with.yeah its cool.Well in sept I totaled My Civic.I hit a pole at about 50 m.p.h and that was it could have been killed but guess I was lucky.Drove it away and that was it for that.I miss that car.BUt on the bright side I now own a 2000 acura Integra GSR.A car that I have always wanted and now own.Its basically the same thing as my civic expect its a hatchback,black,n the best part has a bigger motor and still revs out to 8200 rpm.yeah so that i a big positive.Still workin at the same place,but thinkin of other things have not made up my mind.I bought the movie Devils Rejects and it is raw ass hell.If u want to see a good movie see that.I also have a diffeent taste in music.I have gotten more into hardcore n screamo,emo.I have really opened up to those types of bands.I not really in like rock and just heavy.I don't even listen to that shit anymore.Well things change.THe new system of a down fuckin rocks few more days till the next one comes out can't wait.FRiday tom which fuckin rocks off for the weekend!That means party.Well thats bout it 4 now that  Ican think of.That was really hard to do."
"eventtime","2005-11-17 19:22:00"
"current_moodid","16"
"url","http://talonawd0630.livejournal.com/11002.html"
"userid","15215"
"itemid","41"
"event","well i haven't updated in awhile.Well what else is new.so neways i've been workin and shit.Just got off my vacation actually.Was fun drank every day w the niggas.went to six flags w joe and juiced it over there too.Good times.Before that pulled a couple all-nighters I love those.They are fucking awesome.Finally got with another girl.it was entertaining(fun)Actually felt good.I have gauged my ear out to a 10g.I could finally put bad ass earings in it.Gauged my eyebrow to 14g.Just couldn't see it before.Here it is the fucking greatest thing in the world.Got the left side of my lip peirced.I have wanted it for so long i finally got it 2 weeks ago.Its my fav peircing.Went to Indiana to get fireworks n my b-day is in 3 weeks 21 baby.CLubs and shows and all kinds of neat shit will be happening.nobody is even goin to read this fucking thing.I don't care the new system of a down cd fucking rocks i love it.Fucking Joe hit my car so I have a fucked up passenger door now.But the insurance is taking care of it.I got new rims springs and shit.FUcking new rims look pimp on that bitch.One more thing I want to clear up.U know waht is bs is gettin blamed for something I didn't even do.Situation between agnes and x-tina.I told Chris what it said but u know what agnes din't even like u before that all she did was talk shit bout u.How she thinks she is beter than everybody now since she has a fat ass garbage man finance.Oh and she makes a bunch of money a week who gives a shit.Thats why AGnes doesn't like u cause all u did when u talked to her was brag.So u know what its your fault.U brought it upon yourself.Evreything always.Thats why we are broken up cause of u.Thats why we had problems cause of u.Like a fucking gnat at a bbq.I've realized u always made small problems bigger.U know what oh my god I could talk to people like so easy now.I'm a totally new person>I was an asshole to my friends family and everything 4 u.I'm sorry i'm writing this late but I finally want to speak out I was fucking depressed for months.Over u.I did everything right always.So to end that u caused agnes not to like u.I had nothing to do with it hate me 4-ever do what u got to do.HAve fun get married in 2 months.I'll be living life up while you have a lame ass life.W ur kids and your fat husband.On your wedding day you'll be driving in a garabage truck w cans hanging off the back ahhahahahahahahahahahhhhhhhhhhhhhhhhhhhhhhhahhahhahahhhhh.Oh well.Peace out enjoy being a lame.=)




System of A down
""Revenga""

Poisoning a drink, Bleeding in a sink 
Choking with a link, Killing with a stink 
Just your mother's 
HO 
Bleeding in a sink, Poisoning a drink 
Burning up 
My sweet Clementine 

Trampling a shrink, Bleeding in a sink 
Halleluiah wink , Getting on the brink 
Just your mother's 
HO 

Halleluiah wink, Murdering a shrink 
Burning up 

On my sweet revenge 
Will be yours for the taking 
It's in the making baby, aaaaaahhh 
My sweet revenge 
Will be yours, for the taking 
It's in the making baby, aaaaaahhh 

Killing with a stink, Bleeding in a sink 
Poisoning a drink, Getting on the brink 
Just you mother's 
HO 
Bleeding in a sink, Trampling a shrink 
Burning up 
My sweet Clementine 

Poisoning a drink, Bleeding in a sink 
Choking with a link, Killing with a stink 
Just you mother's 
HO 

Poisoning a drink, Bleeding in a sink 
Burning up
On my sweet revenge 
Will be yours, for the taking 
It's in the making baby, aaaaahhh
My sweet revenge 
Will be yours, for the taking 
It's in the making baby, aaaaahhh

I saw her laugh 
Then she said, ""Go Away"" 
I saw her laugh 
Then she said, then she said, 
""Go away, away"" 

My sweet revenge 
Will be yours for the taking 
It's in the making baby

My sweet revenge 
Will be yours it's in the making 
It's in the takin, making, baking, taking, faking 
HO 
My sweet Clementine 
HO 
Shoulda been could been 
Woulda been would been you 
Shoulda been could been 
Woulda been would been you"
"eventtime","2005-06-21 19:10:00"
"current_moodid","90"
"url","http://talonawd0630.livejournal.com/10640.html"
"userid","15215"
"itemid","40"
"event","From Autumn To Ashes
 Autumns Monologue

Oh why cant I be what you need 
a new improved version of me 
but i'm nothing so good 
no i'm nothing 
just bones, a lonely ghost burning down songs
of violence of love and of sorrow 
i beg for just one more tomorrow 
where you hold me down fold me in 
deep deep deep in the heart of your sins 

I break in two over you 
I break in two 
And each piece of me dies 
And only you can give the breath of life 
But you dont see me, you dont... 

here i'm in between darkness and light 
bleached and blinded by these nights 
where im tossing and tortured til dawn 
by you, visions of you then youre gone 
the shock lifts the red from my face 
when i hear someone's taking my place 
how could love be so thoughtless, so cruel 
when all, all that i did was for you 

i break in two over you 
i break in two 
and each piece of me dies 
and only you can give the breath of life 
but you dont see me you dont.. 

i break in two over you 
i break in two 
and each piece of me dies 
and only you can give the breath of life 
but you dont see me you don't... 

i break in two over you 
i break in two over you, over you 
i break in two 
i would break in two for you 
now you see me 
now you don't 
now you need me 
now you don't"
"eventtime","2005-04-06 19:51:00"
"url","http://talonawd0630.livejournal.com/10355.html"
"userid","15215"
"itemid","39"
"event","This is the perfect song to describe how I feel bout the X
THursday
Understanding in a Car Crash



Splintered piece of glass falls in the seat and gets caught 
These broken windows, open locks, reminders of the youth we lost 
In trying so hard to look away from you 
We followed white lines to the sunset 
I crash my car everyday the same way 

Time to let this pass 
(the time it takes, the time it takes to let go) 
Time runs through our veins 
(it starts and stops and starts and stops again) 
We don't stand a chance in this threadbare time 
(the time it takes, the time it takes to let go) 
Time to let this pass 
(the time it takes, the time it takes to let go) 

Staring at the setting sun 
No reason to come back again 
The twlight world in blue and white 
The needle and the damage done 

I dont want to feel this way forever 
A dead letter marked return to sender 

Broken watch you gave me turns into compass 
It's two hands still point to the same time 12:03, our last goodbye 

So push the seats back a little further 
I can see the headlights coming 
So push the seats back a little further 
Roll the windows down and take a breath 
I can see the headlights coming 
They paint the world in red and broken glass 

Time to let this pass 
(the time it takes, the time it takes to let go) 
Time runs through our veins 
(it starts and stops and starts and stops again) 
We don't stand a chance in this threadbare time 
(the time it takes, the time it takes to let go) 
Time to let this pass 
(the time it takes, the time it takes to let go) 

Staring at the setting sun 
No reason to come back again 
The twlight world in blue and white 
The needle and the damage done 

I dont want to feel this way forever 
A dead letter marked return to sender 

The spinning hubcaps set the tempo for the music of a broken window 
With the cameras on the cameras click 
We open up the lens and can't stop 

Staring at the setting sun 
No reason to come back again 
The twlight world in blue and white 
The needle and the damage done 

I dont want to feel this way forever 

when the lights are on the cameras click
we open up the lens to broken glass
(and it's over in a flash)

Staring at the setting sun 
No reason to come back again 
The twlight world in blue and white 
The needle and the damage done 

I don't want to feel this way forever
a dead letter marked return to sender

(I'll never understand,
Understanding in a car crash)

In a crash"
"eventtime","2005-02-28 12:01:00"
"current_moodid","48"
"url","http://talonawd0630.livejournal.com/10085.html"
"userid","15215"
"itemid","38"
"event","Well life still sucks.Meet a fat ass bitch yeah.It was so fucking disgusting almost threw up right there.I at 1st tryed to text my friend joe and was goin to tell him call me and say ur in jail so i have to pick u up then but it didn't work so i told this fat ass bitch i got to go like right now and pick up my friend and later.Oh but it was a horrible experience.Well work still sucks but maybe i'll be doing brakes soon more money yeah!!.Hung out with my friend from work his g/f and two other girls went downtown and shit.It was pretty fun.but other than that smoking pot is always fun.The funniest part is no one is going to even read this lol.Well in conclusion life is gay.I sometimes wonder if i'd be better off dead the world would be such a better place.

Taking Back Sunday""Cute Without The 'E' 

Your lipstick, his collar.. don't bother Angel
I know exactly what goes on

When everything you'll get is
everything that you've wanted, princess
(well which would you prefer)
My finger on the trigger, or
(me face down, down across your floor)
Me face down, down across your floor
(me face down, down across your floor)
Well just so long as this thing's loaded

And will you tell all your friends
you've got your gun to my head
This all was only wishful thinkin,
this all was only wishful thinkin
And will you tell all your friends
you've got your gun to my head
This all was only wishful thinkin,
this all was only wishful thinkin
let's go...

Don't bother trying to explain Angel
I know exactly what goes on when you're on and
How about I'm outside of your window
(how about I'm outside of your window)
Watchin him keep the details covered
You're such a sucker (you're such a sucker)
for a sweet talker, yeah

And will you tell all your friends
you've got your gun to my head
This all was only wishful thinkin,
this all was only wishful thinkin
(the only thing that I regret is that I, I never let you hold me back)
And will you tell all your friends
you've got your gun to my head
This all was only wishful thinkin,
this all was only wishful thinkin

Hoping for the best just hoping nothing happens
A thousand clever lines unread on clever napkins
I will never ask if you don't ever tell me
I know you well enough to know you never loved me
Hoping for the best just hoping nothing happens
A thousand clever lines unread on clever napkins
I will never ask if you don't ever tell me
I know you well enough to know you never loved me
Hoping for the best just hoping nothing happens
A thousand clever lines unread on clever napkins
I will never ask if you don't ever tell me
I know you well enough to know...

Why can't I feel anything
from anyone other than you?
Why can't I feel anything
from anyone other than you?

And all of this was all your fault
And all of this

(I stay jealous)
I stay wrecked and jealous for this,
for this simple reason
I just need to keep you in mind
as something larger than life
(she'll destroy us all before she's through
and find a way to blame somebody else)
I stay wrecked and jealous for this,
for this simple reason
I just need to keep you in mind
as something larger than life
(she'll destroy us all before she's through
and find a way to blame somebody else)
I stay wrecked and jealous for this,
for this simple reason
I just need to keep you in mind
as something larger than life!"
"eventtime","2005-02-21 11:11:00"
"current_moodid","12"
"url","http://talonawd0630.livejournal.com/9793.html"
"userid","15215"
"itemid","37"
"event","guess this song really came through for us



    STATIC LULLABY

""The Shooting Star That Destroyed Us""

A star up in the sky 
A Poem to the dead
Let this mistake 
Bring a vivid crystal to her eyes 
So drain out my lungs 
Before the fluid brings a choke 
I can not inhale the sparkle of your voice 

A star up in the sky 
A Poem to the dead 
Let this mistake 
Bring a vivid crystal to her eyes 
So drain out my lungs 
Before the fluid brings a choke 
I can not inhale the sparkle of your voice 

Let me walk on high wire of rusty nails 
While barefoot shedding the flesh of our existence 

I wanted to break the fall

A star up in the sky 
A poem to the dead
Let this mistake 
Bring a vivid crystal to her eyes 
So drain out my lungs 
Before the fluid brings a choke 
I can not inhale the sparkle of your voice 

Now's the time 
Now's the time 

The more I try 
The more I lose 
But today 
Will you remember me ? 

But today 
Will you remember me ? 
But today 
Your eyes 

Your eyes 
They shine 
Your eyes 

Your eyes 
They shine 
Your eyes 

Your eyes 
They shine 
Your eyes 

Your eyes 
They shine 
Your eyes 

Your eyes 

Your eyes 
They shine 
Your eyes 

Walking home 
Street lights go out 

Walking home 
Street lights go out 

A star up in the sky 
A poem to the dead
Let this mistake 
Bring a vivid crystal to her eyes 
So drain out my lungs 
Before the fluid brings a choke 
I can not inhale the sparkle of your voice"
"eventtime","2005-01-22 22:55:00"
"url","http://talonawd0630.livejournal.com/9563.html"
"userid","15215"
"itemid","36"
"event","Well as life goes on.Hate the snow my buddy and I said fuck work today lets move to cali and sell drugs to live out there haha.Rick hes awesome hung out with him last night and went to my other friends show.which i as suppose to meet one of his g/fs friends at but she never showed which sucked,but rick and I had a great time it was fucking hilarious.The last week or so I have benn depressed not very hungry,waking up while sleeping,saddden at work.It just sucks.I wish somone was living with me but i'm not even goin there.Life those suck, (just whats the point).There is this one girl I so want to go out with.I don't know last couple days shes been on my mind,and I just completely forget about things,and I'm happier,but I don't know her that well.I just want something to work.Don't want to end up like Annette on a coach drinking vodka lonely.Which is my biggest fear being lonely 4-ever I would not be able to take it.I would rather be dead.Right now I have noone to talk to ever.No one to have fun with I'm just a lame ass sitting at home always just drinking and smoking weed its pathetic I'm home right now.Why god does this have to happen to me everyone is so happy and have someone.I'm just by myself it sucks so bad.I'm far from lonely but its all that I got.Just wish I had someone there for me again.No one cares.no one to share my thoughts and secrets with.No one to play games we made up.No one to look forward to in the morniing when I wake up.No one right next to me.no one holding my hand.no more passionate kisses to share on special momnets or just to say I love you again to someone would be great.I never even got to see how the outfit looked that I helped pick out.No one to make laugh.No one to drive with.passenger seat is lonely.Everything is put away hidden in the back of my mind deep done inside.Noone to complain about gay ass stupid fucking mom bitching about the gayest shit.no one to help decorate my room.no one to share memroies with.no one to look in there eyes and see that shine.no one to hold.no one to tell it will be ok.no one to be there for.no one to encourage me.the empty feeling is still there.I'm lost with you.its just a tragedy.


3. Ain't Love Grand-Atreyu

It's so hard to see when your eyes are rolling in the back of your head 
It's even harder to speak when everything you say just comes out wrong 

Gutted like a pig, all you want is the world to bleed, someone somewhere stole your desire 
The pain akin to, being punched in the throat, and stabbed in the chest 

You would rather bleed than be without her 
Gone are the tender whispers dancing in your ears 
Replaced with lackluster memories you cry, your screams play in your empty room 

It's so hard to see when your eyes are rolling in the back of your head 
It's even harder to speak when everything you say just comes out wrong 

Your bed swallows you whole as the days bleed together, torment on the lips 
Of a loved one, and if you try hard enough,
you can almost taste her, feel her pass and 
Scream, OH GOD WHY ME

You would rather bleed than be without her 
Gone are the tender whispers dancing in your ears 
Replaced with lackluster memories you cry, your screams play in your empty room

It's so hard to see when your eyes are rolling in the back of your head 
It's even harder to speak when everything you say just comes out wrong"
"eventtime","2005-01-22 21:59:00"
"url","http://talonawd0630.livejournal.com/9434.html"
"userid","15215"
"itemid","35"
"event","well anyways 2 and a half years and its over.It bother me like the 1st day and after that it was like whatever who cares.It was done to many times i don't really care anymore.but i am really enjoying myself hanging out with old friends i haven't even talked to in years.Finally got the guts to ask for this hot girls number at walgreens and totally got it.i was very proud and very erratic.But who really cares.I'm not in a rush for a girlfriend,but i will find one and this time I will know for sure if shes right or not no more stupid mistakes.no more taking back after wrong has been done.Just Have fun and don't ahve to hear no nagging,bossing,being broke not what i don't want to do anymore.Its great.This is a good song that sums up all of my feelings



                                             ""The Used""
                                            ""Bulimic""

From the way that you acted
to the way that I felt it
It wasn't worth my time
and now it's sad cause all I missed
wasn't that good to begin with
and now that I've started you begging 
saying things that you don't mean
it isn't worth my time
a line's a dime a million times
and I'm about to see all of them 

Goodbye to you, goodbye to you
you're taking up my time 

You call my name when I wake up 
to see things go your way
I'm coughing up my time
each drag's a drop of blood a grain
a minute of my life
it's all I've got just to stay down
why the fuck am I still down
I'm hoarding all that's mine
each time I let just one slip by
I'm wasting what is mine

I'm about to see a million things
I thought I'd never see before and I
I'm about to do all of the things 
I've dreamed of and
I don't even miss you at all"
"eventtime","2005-01-15 22:54:00"
"url","http://talonawd0630.livejournal.com/8981.html"
"userid","15215"
"itemid","34"
"event","Well I havent wrote in this journal in a long ass time anywas here goes.Wll I'm still with my beautiful angel.We are a little sketchy now,but I know we can pull thru.I have to work on some things that I know I can fix.I love her with my whole heart, and I know I want this to work. I really truly love her,cause losing her would be like losing a part of myself. On the job side I have now been working at Wilrae for 8 months I do like it. Although I have been thinking ""Is this what I really want to be doing forever.I came to a conclusion that I don't.I want to go back to school, and get into photography.I need to research it though.Since I haven't updated in awhile I know have found a car to replace my Eagle Talon Tsi.I now own a 2000 Honda Civic Si.I like it way more than my old car.It still needs a tune up,but with the Christmas holiday I have to wait which sucks. I got a iguana 3 months ago which I am happy to say he is alive and healthy. The new house I am living in is alot better than where I use to live.Though the convience of things being close is non-exsitant its still ok.Espically now that my angel sleeps over at my house alot more.We spend almost every weekend together(all night and all day) which is awesome. On a very sad note.It is a sad day.Dimebag Darrell guitarist of ""Pantera"" was killed last night. It is so fucked up how it happened. I thought it was suppose to be safe at shows. Its crazy he was killed right on stage. He was a all time great guirtarist that will be missed.So smoke a dimebag for him.anyways thats about it for now I will update more often now since my sister gave my livejournAL a new look because she is awesome.

cool song read the lyircs and think about its about how America really is
""Rammstein""-English translation
""AMerika""
We're all living in America
America is wonderful
We're all living in America
America, America 

When there's dancing I want to lead
even if you're whirling around alone
Let yourselves be controlled a little
I'll show you how it really goes
We're making a nice round dance
Freedom is playing on all violins
Music is coming out of the White House
and Mickey Mouse is standing in front of Paris

We're all living in America
America is wonderful
We're all living in America
America, America

I know moves that are very useful
and I will protect you from missteps
And whoever doesn't want to dance at the end
doesn't know yet that they must
We're making a nice round dance
I will show you the way
Santa Claus is coming to Africa
and Mickey Mouse is standing in front of Paris

We're all living in America
America is wonderful
We're all living in America
America, America

We're all living in America
Coca-Cola, Wonderbra
We're all living in America
America, America

This is not a love song
This is not a love song
I don't sing my mother tongue
No, This is not a love song

We're all living in America
America is wonderful
We're all living in America
America, America

We're all living in America
Coca-Cola, sometimes war
We're all living in America
America, America"
"eventtime","2004-12-09 20:41:00"
"current_moodid","25"
"url","http://talonawd0630.livejournal.com/8937.html"
"userid","15215"
"itemid","33"
"event","well yesterday was my birthday.I am 20 wow.but anyways my angel woke me up by texting me happy birthday after I got off woek she took me out to dinner and we just chilled by my house it was so much fun.She made me so happy like she always does.Its funny because we think like alot alike.I would say I was thinking of something today and she'd be like yeah me to.Shes so special to me anyways.I've just been working and thats bout it."
"eventtime","2004-07-14 22:43:00"
"url","http://talonawd0630.livejournal.com/8530.html"
"userid","15215"
"itemid","32"
"event","Well this whole week wasn't bad but still sucked in a way.laste week my job was busy as shit,this week slow.oh well what can u do.I did find something out which made me glad in a way.like in 2 more weeks or a week and a half my wonderful girlfriend and mine 2 year anniversity.Thtas a long time but I have loved every second of it.I was goin to seriously buy her a ring,but i don't have no credit which really sucks balls and pisses me off.I need to build credit.Things u have to do when u get older.Its not high school no more no shit.I'm like in the real world now.Still trying to get over it haha.Well I had a good week and thats bout it see you whenever I feel like updating"
"eventtime","2004-06-19 00:26:00"
"current_moodid","126"
"url","http://talonawd0630.livejournal.com/8272.html"
"userid","15215"
"itemid","31"
