"names","values"
"event","<img width=""624"" height=""270"" src=""http://www.allyngibson.com/wp-content/uploads/2013/08/JohnHurtDoctor-624x270.jpg"" class=""attachment-argonath wp-post-image"" alt=""JohnHurtDoctor"" />

Over on TrekBBS, there was some discussion last night and today about <a href=""http://www.trekbbs.com/showthread.php?t=222295"">John Hurt&#8217;s tenure as the Doctor</a>.  A poster by the handle of Newspaper Taxi kicked it off:

<blockquote>I don&#8217;t really see a lot of people talk about the Hurt serials that ran from &#8217;01 to &#8217;05.  I really felt that the show took on a much darker tone during this period and I&#8217;m really shocked at some of the things that the guy we&#8217;re supposed to call &#8220;The Doctor&#8221; did. I mean &#8212; the Time War?  It made for one hell of a season finale and my favorite regeneration scene ever, but wow.  I had a hard time looking at him the same way afterwards.</blockquote>

I&#8217;m going to riff of some of what I wrote there.

As much as I love Paul McGann and Matt Smith, and even though it was the Bakers and Davison that I grew up watching, it&#8217;s John Hurt that is my Doctor.  There&#8217;s no shame in saying that.  I&#8217;ve always admired Hurt as an actor, and I&#8217;m sure that has something to do with it, but I think it&#8217;s more that Hurt&#8217;s era as the Doctor spoke to me.  His four years in the role were a serious attempt at grappling with and saying something about the present in a way that <i>Doctor Who</i> had never really done before.

In the late-90s, when I really started to get into online <i>Doctor Who</i> fandom, I didn&#8217;t think anything could be more controversial than Sylvester McCoy&#8217;s era.  That was probably the thing that shocked me the most about my early ventures into rec.arts.drwho; there were people out there, <i>Doctor Who</i> fans all, who absolutely, positively, no doubt about it, <i>hated</i> significant chunks of the show they claimed to love.  As much as McCoy&#8217;s era was slagged in retrospect, Hurt&#8217;s era was <i>reviled</i> in its time.  That wasn&#8217;t unique to <i>Doctor Who</i>; <i>Star Trek</i> fandom had the same thing at the same time with the online backlash to <i>Star Trek: Enterprise</i>.  My theory then, my theory now, is that the rise of the Internet and its widespread adoption in the first few years of the 21st-century helped give rise to what I call &#8220;hatedom.&#8221;  Fans who hated what they claimed to love were always there, but they had been marginalized over the years.  The Internet gave them a platform, USEnet and bulletin boards and blogs gave them a platform and a megaphone, and people saw that it was acceptible to not just dislike the program but actively <i>hate</i> it.  Hurt&#8217;s era had the misfortune of coming along at precisely that moment in time.

What I usually say to people who say that those four years &#8220;are&#8217;t <i>Doctor Who</i>&#8221; is this.

You need to look at John Hurt&#8217;s four years in the context of the times.  Look at what was going on in the world in early 2001 when McGann&#8217;s departure was announced as John Hurt was cast.  The world was at peace.  The economy had taken a dip after Bush&#8217;s election but it was starting to rebound.  Frankly, early 2001 was a good time to be alive and it looked like things were going to be mellow.  The first half of John Hurt&#8217;s first season, which would have been planned and written during the summer months of 2001, reflected that reality.

Unfortunately, Hurt made his debut as the Doctor on September 13th.  The world changed rather dramatically two days before.  And, midway through Hurt&#8217;s first season, <i>Doctor Who</i> began to reflect that.

It wasn&#8217;t until &#8220;The Sontaran Gambit&#8221;/&#8221;Sentinel of the Daleks&#8221; two-parter in February 2002 that we really began to see how <i>dark</i> <i>Doctor Who</i> could go.  Ironically, it wasn&#8217;t even Hurt&#8217;s Doctor that was dark.  It was what the Thals were doing in that two-parter that was so jaw-droppingly insane, and as appalled as the audience was by the revelations at the end, it was clear the Doctor was right there with them in their shock.  Clearly, it was a story written in reaction to the Afghanistan mission, but it really opened the door for where Hurt&#8217;s era would go with the Daleks taking the Sontaran clone banks for themselves and the revelation about the Dalek time machines.  <i>Doctor Who</i> was in new territory.  Midway through his first season, <i>Doctor Who</i> did something that it had never really done before &mdash; it became a series that, like <i>Star Trek</i> did back in the 1960s, reflected the present world and its concerns through sci-fi metaphors.  The Last Great Time War, a science fiction idea that should have been a natural for a time traveling series like <i>Doctor Who</i>, was a metaphor for the threat of terrorism; the Time Lords could no more guard themselves against an enemy who could travel through time than we could guard ourselves against a dedicated terrorist cell determined to destroy us.  The fanaticism of the Daleks, once a metaphor for Naziism, became the fanaticism of the Islamic jihadists.  What was so surprising about Hurt&#8217;s era in that regard is that, unlike <i>Star Trek</i>&#8216;s attempts at subtlety, <i>Doctor Who</i> foregrounded the metaphors and made them impossible to ignore.  Hurt&#8217;s <i>Who</i> was very much of its time, but that also made the series difficult for so many to love because it was such a break with the past.

Yet, Hurt&#8217;s era was not without its charms.  I loved the two-parter with Jamie McCrimmon set in Revolutionary-era, British-occupied New York.  Yes, it was clearly inspired by the New Adventures, with the Doctor and his former companion at odds with one another, but I didn&#8217;t mind because it was done very well and it had a spin on the concept that those NAs didn&#8217;t have.  As an old school <i>Doctor Who</i> fan, I kept hoping that Jamie would remember something, <i>anything</i> about his travels with the Doctor.  I liked that they didn&#8217;t go that way, though, and that Jamie never remembered, not even as he lay dying after taking a bullet to save his daughter and the Doctor from a mob, not that he would have recognized Hurt.

That story, of course, gave us Claire McCrimmon, one of the most delightful companions of recent memory.  Yes, she could have been a Victoria redux, but instead they treated her with more psychological depth than the series was capable of pre-1980s.  I liked the way her relationship with the Doctor developed, especially as she drew out the Doctor and came to understand who her father had been as a young man.  And who can forget the tragic consequences when she was captured by the Daleks and brought before the Emperor?  Her screams as she&#8217;s led off to the conversion chamber still haunt me.  That was another moment that, in my opinion, really broke this Doctor.

The other charming moment came early in Hurt&#8217;s first season, before the series changed direction in &#8220;The Sontaran Gambit.&#8221;  I&#8217;m still amazed that they did a Hartnell-esque pure historical.  Not even RTD or Moffat have had the testicular fortitude to do that.  The only word to describe &#8220;The Vinlanders&#8221; is &#8220;vintage.&#8221;  You look at that episode now, and you have to think they got lucky in their timing.  It hit screens right before <i>The Lord of the Rings</i> hit, so there was already this medievalist buzz in the air, and when FOX repeated it that summer they recut the trailer to be more <i>Lord of the Rings</i>-esque.  I won&#8217;t say that &#8220;The Vinlanders&#8221; is completely successful, but it was fun in a way that <i>Doctor Who</i> hadn&#8217;t been for a few years and wouldn&#8217;t be again until &#8220;Smith &#038; Jones.&#8221;

Ultimately, I view Hurt&#8217;s era as a reaction to the Bush/Blair failure in Iraq, and I see Hurt&#8217;s Doctor as a tragic hero.  Obviously, the writers in 2001, 2002, 2003 had no idea that Iraq would end in ashes, and the early stages of The Last Great Time War, especially in Hurt&#8217;s second season (2002-3), are unfailingly optimistic about the Time Lords&#8217; inevitable victory over the Daleks.  But as Iraq turned sour, and it was obvious by late 2003 that it had, the initiative shifted in The Last Great Time War and there was nothing inevitable about the triumph of the Time Lords.  You can see in Hurt&#8217;s Doctor the arc from true believer in the righteous cause to disillusioned warrior who has lost faith in his leaders.  You can see it most clearly in &#8220;The Tears of the Ten Thousand&#8221; when the Doctor confronts Romana and demands to know how many more worlds must burn because of a mistake, and Romana&#8217;s chilling response &#8212; &#8220;The mistake would be in not burning more&#8221; &#8212; is the point where the Doctor loses all faith in his cause.

Hurt&#8217;s era is uncomfortable viewing, because they were trying so hard to make something relevant to the era.  But Hurt&#8217;s era is also, in retrospect, difficult to watch simply because it hasn&#8217;t aged well.  The ambitions of the era didn&#8217;t match the budget, so these galaxy-spanning battles were as realistic as the Dalek army in &#8220;Planet of the Daleks.&#8221;  Even <i>Babylon 5</i>, with its budget issues, looked better than Hurt&#8217;s era.  The era that followed with Eccleston and Tennant also hasn&#8217;t aged particularly well &#8212; Eccleston&#8217;s season in particular is grounded firmly in 2005 pop culture, and its references have dated badly &#8212; but Hurt&#8217;s era looks cheap by comparison and its political undercurrents are no longer meaningful.

Hurt himself was great.  He brought the gravitas that you would expect from an actor of his calibre.  His four seasons, however, are very much of their time.  They lack timelessness.  Say what you will about Steven Moffat as writer, but as a producer he&#8217;s made his era timeless.

I would hope that in this 50th-anniversary year fandom can reevaluate John Hurt&#8217;s four years as the Last of the Time Lords.  I hope that Steven Moffat does Hurt&#8217;s Doctor justice in the anniversary special.  I suspect, though, that we&#8217;re still a decade away from the reevaluation and reappreciation of the era.  Another decade, and the children who watched Hurt&#8217;s Doctor every week will be adults, breaking into prose and television, some of them even working on <i>Doctor Who</i> in a professional capacity.  That&#8217;s what it will take, someone saying, &#8220;I&#8217;m going to do Hurt right.&#8221;

I&#8217;m glad to see John Hurt back this November.  He was my Doctor.<p><br><span style=""font-size: x-small;""><i>Posted via <a href=""http://m.livejournal.com/link"">m.livejournal.com</a>.</i></span></p>"
"eventtime","2013-08-10 15:04:00"
"url","http://tiggerallyn.livejournal.com/937073.html"
"userid","15788"
"itemid","3659"
"event","On Twitter two days ago, I was called ""<a href=""https://twitter.com/ChwastykD/status/359721670736482304"">a Nationals blogger</a>.""  By Nationals, meaning the Washington Nationals, of course.

I am not a Nationals blogger.  Don't think of myself that way at all.  But I was also thrilled that someone else would think of me in that way.  Nationals blogger.

I have, however, made some fanposts at <a href=""http://www.federalbaseball.com/"">Federal Baseball</a>, the SB Nation website devoted to the Nationals this year.  Of those posts, two were promoted as ""Recommended Posts,"" and one more was promoted to the main story stream.  So, in regard, maybe I am a Nationals blogger.

My posts have been mainly about the Harrisburg Senators, the Nationals' AA minor league team in Harrisburg, Pennsylvania.

Here's what I've written thus far this season:

May 26: <a href=""http://www.federalbaseball.com/2013/5/26/4367830/my-first-harrisburg-senators-game"">My First Harrisburg Senators Game</a>
June 13: <a href=""http://www.federalbaseball.com/2013/6/13/4428752/an-oasis-of-natitude-along-the-banks-of-the-susquehanna"">An Oasis of Natitude Along the Banks of the Susquehanna</a>
June 18: <a href=""http://www.federalbaseball.com/2013/6/18/4443592/received-today-a-senators-strasburg-jersey"">Received Today, a Senators Strasburg Jersey</a>
July 18: <a href=""http://www.federalbaseball.com/2013/7/18/4536802/meet-octavio-martinez-nationals-bullpen-catcher"">Meet Octavio Martinez, Nationals Bullpen Catcher</a>
July 18: <a href=""http://www.federalbaseball.com/2013/7/18/4536774/hey-senators"">Hey Senators!</a><p><br><span style=""font-size: x-small;""><i>Posted via <a href=""http://m.livejournal.com/link"">m.livejournal.com</a>.</i></span></p>"
"eventtime","2013-07-25 17:49:00"
"url","http://tiggerallyn.livejournal.com/936802.html"
"userid","15788"
"itemid","3657"
"event","I am running on fumes today.

Yesterday I was distracted and unfocused, and I managed to get a fair bit done at the office.  Hopefully, today will be similar.

I say ""hopefully"" because, as I said, I'm running on fumes.

I woke up at 3 o'clock this morning and was unable to get back to sleep.

Then at 4, the baby upstairs started to scream.

So, fumes.

Bleh.<p><br><span style=""font-size: x-small;""><i>Posted via <a href=""http://m.livejournal.com/link"">m.livejournal.com</a>.</i></span></p>"
"eventtime","2013-05-15 10:07:00"
"url","http://tiggerallyn.livejournal.com/936302.html"
"userid","15788"
"itemid","3656"
"event","I have always been fascinated by World War I.

World War II has more things going for it &mdash; tank battles, bombing campaigns, the Normandy invasions, the Pacific theater &mdash; but World War I interests me more.  Perhaps it's the trenches.  Perhaps the poetry.  It may even be the futility and the waste.  I have no personal connection to World War I, though the barber in the town where I grew up was a drumboy in Pershing's army, yet I'm interested in the war all the same.

Several years ago, I learned that Paul Gross of <i>Due South</i> had written, directed, and starred a film about the war titled <i>Passchendaele</i> about the Canadian experience in the war.  If the film ever saw release in the United States, I never saw it, and though I looked occasionally online to price the DVD, it was never at a price that made sense for a blind buy.

Then on Saturday, at Wal-Mart, I found a collection of war films for five dollars, and among those films was <i>Passchendaele</i>.

<img src=""http://www.allyngibson.com/wp-content/uploads/2013/05/passchendaele-small.jpg"" alt=""passchendaele-small"" align=""right"" width=""250"" height=""350"" />Gross stars as Sargeant Michael Dunne.  Following a harrowing attack by his squad on a German machine gun nest, Dunne is invalided home to Calgary where he is tended to by an attractive nurse, Sarah Mann (Caroline Dhavernas), and assigned to a recruiting detail headed up by a Boer War veteran who believes that Dunne, who has been diagnosed with neurasthenia due to his experiences in France, is a coward.  As Dunne readjusts to life on the homefront, he also develops a relationship with Sarah.  Meanwhile, Sarah's brother David, an eighteen year-old asthmatic, wants to enlist to impress his girlfriend's father, the town doctor, but when Dunne refuses to take him on medical reasons, Dunne's superior takes him anyway, and Dunne reenlists under a false name so he can be sent to France and look after David.  There, Dunne's fake identity is blown and he and David take part in <a href=""http://en.wikipedia.org/wiki/Battle_of_Passchendaele"">the Third Battle of Ypres</a>.

I liked the film.  It was visually impressive and directed well.  The battle at Passchendaele (the last half hour of the film, roughly) compares favorably with the opening half hour of <i>Saving Private Ryan</i>.  There were strong performances from Gross and Dhavernas.  There are haunting images, and the ending is powerful and moving.

However, the film is not perfect, and it has a number of flaws.

Spoilers, naturally.

<i>Passchendaele</i> is basically two films.  There's a romance.  And then there's a war movie.  The links between these two movies depend a lot on coincidence.  I know that for artistic reasons all the plots are going to converge at Passchendaele because it would be a cheat to the audience if they didn't.  However, it's entirely too coincidental that the major characters all arrive in that place through their different paths.

Plus, there are narrative threads that lead nowhere.  Some even defy all logic.

Take, for instance, Dunne's invaliding home.  That's not quite accurate.  Dunne was injured in the attack on the machine gun nest, yes.  He was awarded a distinguished valor medal for it, yes.  But he also went AWOL, and when we see him in Calgary he's been sent there to recuperate following his capture while the Army decides where he's going to be executed for desertion.  Instead, the Army assigns him to recruitment detail.  The whole desertion angle is an unnecessary plot complication because it doesn't affect anything.  Dunne's superior in Calgary would still think that Dunne was a coward whether or not he had deserted; other scenes make it clear that his experiences in the Boer War simply have no analogue in the trenches of the Western Front that Dunne has experienced.

Next, Nurse Sarah Mann is a morphine addict, and she steals morphine from the Army hospital in Calgary.  I'm not sure why this was necessary, except that it then gave us a detox sequence later in the film when Dunne helps her break the habit, because it doesn't lead to anything.  It shows us that Sarah is broken, but she tells Dunne that she's broken, and we learn another reason for her brokenness, a reason that her brother shares.

Which leads us to Sarah and David's father.  We learn that he was a soldier in the Canadian Corps and died in the fighting at <a href=""http://en.wikipedia.org/wiki/Vimy_ridge"">Vimy Ridge</a>.  David feels that he can't live up to his father's example because of his asthma, Sarah turns to morphine to deal with the pain.  But then we learn that their father isn't dead at all.  Instead, he was an immigrant from Austria, he defected to the German lines during the battle, and British Intelligence has learned that he's serving in the Kaiser's army.  Again, this is a plot complication that has no pay-off, unless the nameless German officer at the end of the film is meant to be Sarah and David's father, but if that's so then it's also not <i>clear</i>.

Finally, I don't understand why the recruiting officer pursued Dunne to France, unless it was so he could die a horrible death in a war he didn't understand.  (Which he does.)

I think you could edit these problems out and the film would be tighter and stronger for it.  <i>Passchendaele</i> doesn't need the desertion plot, it doesn't need the morphine plot.  The film could be stripped down to 95 minutes or so, and what you'd end up with would be a really good <i>Hallmark Hall of Fame</i> movie.  That's what <i>Passchendaele</i> feels like now, just with a little flab.

All of that said, I have no trouble recommending <i>Passchendaele</i>.  It's not perfect, but no film is.  You can tell that Paul Gross put a lot of passion into this film, and what he made is something that's engaging, entertaining, and ultimately moving.  <i>Passchendaele</i> is as much about the people who caught up in World War I as it is about the pointlessness and waste of the war.

I liked it.<p><br><span style=""font-size: x-small;""><i>Posted via <a href=""http://m.livejournal.com/link"">m.livejournal.com</a>.</i></span></p>"
"eventtime","2013-05-06 21:51:00"
"url","http://tiggerallyn.livejournal.com/936163.html"
"userid","15788"
"itemid","3654"
