"names","values"
"event","The tenth anniversary of the Iraq War has been on the minds of many in the past two weeks.  Some who supported the war at the time have said that they were deeply wrong.  Some who supported the war at the time fail to recognize that it was a collosal, world historical mistake.

Last week I wrote an e-mail to <a href=""http://dish.andrewsullivan.com/"">Andrew Sullivan</a>.  He was one of those who supported the war in 2002 and 2003, and who turned against the war when it dragged on and the reasons for the war were shown to be nothing more than smoke and mirrors.

<a href="" 
http://dish.andrewsullivan.com/2013/03/22/flies-collecting-on-a-wound/"">Sullian wrote</a>: ""In the summer of 2000, when I foolishly found myself wanting Al Gore to lose (Excelsior!), it was not a strong emotion. In the campaign, Gore was the advocate for a larger defense budget and [George W.] Bush was all about being a 'humble' nation. I figured there wasn't much difference between them (and I still think Gore would have launched the Iraq War as well).""

I have to ask.  What would the <i>causus belli</i> have been for Gore in this alternate history?
 
That's not an idle question.  I've seen others make the same argument -- that there would have been an Iraq War under President Gore (as I recall, <i>The American Prospect</i> ran an article on the very thing at the time) -- but no one ever stops to explain how they get from Point A (President Gore) to Point Z (Iraq War).  It's simply accepted.
 
But it's unlikely.
 
True, it's difficult to argue the counter-factual, Niall Ferguson's attempts to argue history by counter-factual be damned.  But there is evidence in the behaviors of the early Bush administration that led us to Iraq in 2003 that simply wouldn't have been present in a Gore administration.
 
Gore wouldn't have been surrounded at the highest levels of his administration with the Cheney/Rumsfeld/Wolfowitz cabal.  These players would have been at the same level as they were in the late Clinton administration when they sent Clinton a letter demanding military action in Iraq.  In other words, they would have been nothing more than pundits looking for an outlet for their aggressions.
 
Gore wouldn't have dismissed the plans developed by Clinton to retaliate against al-Qaeda after the USS Cole bombing.  Clinton had a plan drawn up.  The plan was given to the incoming Bush administration because Clinton did not want to gift his successor an ongoing military operation in the same way that he had been ""gifted"" Somalia by his predecessor.  The plan was subsequently dismissed by the Bush administration and never implemented.
 
Gore wouldn't have shifted the national security focus in early 2001 from terrorism to the Russians as Bush did.  Richard Clarke wouldn't have been shoved to the side as he was in the Bush administration, where counter-terrorism efforts were shunted aside in favor of nuclear missile defense and repudiating the ABM treaty.
 
Gore, if given a Presidential Daily Briefing titled ""Bin Laden determined to strike in US,"" would not have been likely to then tell his briefer that he had ""covered [his] ass.""  Gore had been through the first World Trade Center bombing as part of the Clinton administration.  Gore had first-hand knowledge that terrorism was the threat facing the country.
 
In short, Gore would have made vastly different decisions in the crucial months of early 2001.  I don't think it's too far to argue that a strike on al-Qaeda in early 2001 in retaliation for the Cole would have rattled the leadership.
 
I would even argue that 9/11 wouldn't have happened in a Gore administration.  I'm on shakier ground here, I admit, but a Gore administration would have kept the pressure on al-Qaeda instead of giving al-Qaeda room to breathe in those early months of 2001.
 
In my mind, <i>Bush v. Gore</i> proves Leibniz wrong.  We don't live in the best of all possible worlds.  A world without 9/11, a world with Afghanistan and Iraq is a better world, a far preferable world than this one.
 
I wonder if the five justices who installed Bush in the Oval Office with <i>Bush v. Gore</i>, especially Sandra Day O'Connor and Anthony Kennedy, have ever recognized that they have the blood of the last decade on their hands.
 
Somehow, I doubt it.<p><br><span style=""font-size: x-small;""><i>Posted via <a href=""http://m.livejournal.com/link"">m.livejournal.com</a>.</i></span></p>"
"eventtime","2013-03-25 14:35:00"
"url","http://tiggerallyn.livejournal.com/934098.html"
"userid","15788"
"itemid","3647"
"event","To get to Shamrock Fest, I had to navigate a phalanx of Bible-thumpers.

<a href=""http://shamrockfest.com/"">Shamrock Fest</a> is an Irish and Celtic music festival held annually at RFK Stadium, and the organizers recommend that people take the DC Metro to reach the music festival.  You take the Blue or Orange line, disembark at the Stadium-Armory stop, climb the steps, and walk about two blocks to reach Shamrock Fest.  The past years, as you stepped off the Metro stairs and onto the street, you would be assaulted by street vendors hocking t-shirts, hats, sunglasses, all sorts of stuff St. Patrick's Day related.  My first year I bought a Dropkick Murphys t-shirt from the street vendors for about ten dollars.

This year, the street vendors were joined by a church.

There were people reading from the Bible.  There were people handing out tracts.  There were people preaching the evils of drinking and fornication.  Every few feet, you would be assailed on one side by a street vendor and his St. Patrick's Day wares, and on the other side by ""Sinners in the Hands of an Angry God.""

The dichotomy was amazing.  And amusing.  My probability of drinking was 100% (even at the brutal alcohol prices of Shamrock Fest), my probability of fornication, like my probability of buying anything from the street vendors, was 0%.

Of course, to reach the point of running the gauntlet I had to get to RFK.  And the trick there was in deciding what to wear.

It was snowing in Pennsylvania when I woke.  I checked the weather forecast for DC, and they were calling for mid-50s and a 70% chance of rain.  I would want something rainproof, then.  I opted for something heavier, a ski jacket I had picked up on clearance at Wal-Mart last month, because my other rainproof jacket isn't at all warm.

And, of course, I went as the Batman of Ireland.

<img src=""https://pbs.twimg.com/media/BFe4ls_CIAAKwE0.jpg"" style=""width: 100%; max-width: 100%; height: auto;"" border=""1"" />

Well, no, not really.  There isn't a Batman of Ireland in the Batmen of Many Nations and Batman, Inc.

Graphitti Designs sold a ""Celtic Batman Symbol"" t-shirt a few years ago.  And for inexplicable reasons (because I really don't need more t-shirts), I bought it.  The shirt seemed appropriate; I don't own anything green, and my only St. Patrick's Day-specific apparel are my St. Patrick's Day Chicago Cubs and Washington Nationals baseball caps.

Thus, I was outfitted.

I made better time than I thought I would, and I was through the gate at 1:30.

There were four bands I wanted to see.  In order, they were:
<ol><li><a href=""http://www.carbonleaf.com/"">Carbon Leaf</a></li>
<li><a href=""http://www.murderthestout.com/"">Murder the Stout</a></li>
<li><a href=""http://www.barleyjuice.com/"">Barleyjuice</a></li>
<li><a href=""http://themahones.ca/home.php"">The Mahones</a></li></ol>

Plus, I wanted to catch several other acts, like Baltimore's <a href=""http://gaelicmishap.com/"">Gaelic Mishap</a>.  But those were the main four.  However, Murder the Stout and Barleyjuice overlapped by half an hour, and The Mahones were closing out the festival and whether or not I saw them was going to depend on the weather and how I was feeling.

The band schedule didn't seem as packed as previous years, with several local-ish bands not on the schedule.

I caught bits of most of the Irish music sets, even though that meant a lot of walking from the Guinness Irish Village stage to the Miller Lite/Angry Orchard stages.  I saw none of the alt rock sets on the GoCity and Marathon stages.

The sun came out about two o'clock, and I'd say it reached the low 60s.  I took the jacket off and tied the arms around my waist.  It wasn't the <i>prettiest</i> looking way of wearing it, but it was easier than carrying it.  And when it started raining later and the temperature dropped, I put the jacket back on and didn't take it off.

The two sets I saw all of were Murder the Stout and Carbon Leaf.

I'm not sure when or how I heard of Murder the Stout, but I bought their self-titled 2006 CD (physical) and their new EP (digital) last year, and I was looking forward to seeing them.  I decided to skip most of the Barleyjuice set (since I've seen them several times now) to catch all of the Murder the Stout set, and I was glad I did.  At their merchandise table, they were selling a set of the new EP and frontman Hugh Morrison's CD, <i>Robbie Burns Rocks</i>, for ten dollars, so I picked up both.  The thing was, I wasn't sure if the EP I bought yesterday was the same thing as the EP I bought digitally last year.  I didn't know until I got home last night and was able to compare.  A little while later, after the Carbon Leaf set, Murder the Stout was hanging out at their merchandise table, and the entire band autographed the CD slipcase for me.

<img src=""https://pbs.twimg.com/media/BFkcXi8CEAASScy.jpg"" style=""width: 100%; max-width: 100%; height: auto;"" border=""1"" />

Silly me should have asked Hugh to autograph <i>Robbie Burns Rocks</i>.  Ah, hindsight.

After Murder the Stout, I went down to the Miller Lite/Angry Orchard stages and caught the end of the Barleyjuice set and found a good place for the Carbon Leaf set.  (These two stages were adjacent so that while one back was performing, another band could set up for their set on the other stage.  And one didn't really need to move to see both stages.)

Carbon Leaf is a band that I've followed since I was a student at the University of Richmond; they played a Kappa Alpha party in the autumn of 1997 (where I bought their first album, <i>Meander</i>), and they played the Cellar, the Richmond campus bar, about once a month (where their lead singer, Barry, gave me a copy of their second album, <i>Shadows in the Banquet Hall</i>, because I enthusiastically applauded their cover of John Denver's ""Country Roads"").  After I left Richmond, I didn't see them live again I moved to Raleigh and they played a free concert downtown after the release of their fifth studio album, <i>Indian Summer</i>.

Carbon Leaf's set was weighted toward their new album, <i>Ghost Dragon Attacks Castle</i>, plus they played old favorites like ""Life Less Ordinary"" from <i>Indian Summer</i>, ""Shine,"" ""The Boxer,"" and ""Desperation song"" from <i>Echo Echo</i> and ""Home"" and ""American Tale"" from <i>Ether-Electrified Porch Music</i>.  It was a tight and energetic set, and the audience was enthusiastic.  The sky clouded over during the set and it started to rain during ""Desperation Song"" (which was ironic, because there's a line in the song about ""will you stay through the pouring rain"").  There was crowd surfing and there was slam dancing in the crowd, two things that until I saw them last year I never, ever would have expected at a Carbon Leaf gig.

As I did last year, I bought a soundboard recording of the set on a USB stick from the band's merchandise table.  The sound mix could have been better balanced (the vocals are mixed down, while the drums and bass are mixed up), but it's a nice artifact to have. :)

After a beer, I wandered back down to the Miller Lite/Angry Orchard area, and I saw that the band was signing autographs.  While I didn't need any Carbon Leaf CDs, not even <i>Ghost Dragon</i> (I have one of the autographed limited editions the band sold through their website), I did ask them if they would autograph <i>Celtic Pink Ribbon II</i>, a compilation of Celtic-inspired music and bands that raises money for breast cancer awareness and cure.  And they did.  I high-fived guitarist Terry Clark.  I shook singer Barry Privett's hand.  It was a fun little moment.

<img src=""https://pbs.twimg.com/media/BFkc8KxCQAAmEz3.jpg"" style=""width: 100%; max-width: 100%; height: auto;"" border=""1"" />

And then I had my third and final beer of Shamrock Fest.  As I've mentioned in years past, at Shamrock Fest you buy beer tickets.  The first year I attended, beer tickets for four for twenty.  Last year and this year, they were three for twenty.  Yes, nearly seven dollars for a beer in a plastic cup.  On the plus side, that limits consumption; no one is going to want to spend forty dollars for six beers.  On the minus side, that also limits consumption; maybe I wanted four beers and not three.

Last year there were beer lines.  (That is, lines to get beer.)  This year, I didn't notice any.

Actually, this year I would say that attendence was down significantly from last year and the year before.  The weather didn't keep people away last year.  I don't know if the lack of a ""name"" band like Dropkick Murphys this year was a determining factor.  Or it could be the prices; prices on tickets ratchet up as the festival approaches, so what someone might do at $25 dollars will be out of their price range at $40.  Honestly, though, I don't know why attendence was down.  It just felt like a noticeably smaller crowd this year.

I watched a little of the next few acts &mdash; the <a href=""http://www.thescreamingorphans.com/"">Screaming Orphans</a> (an Irish four-piece who remind me of The Corrs), <a href=""http://www.celkilt.com/"">Celkilt</a> (a French band), and the <a href=""http://thefightingjamesons.com/"">Fighting Jamesons</a> (a Virginia-based Celtic rock band).

The sun went down during the Celkilt set.

<img src=""https://pbs.twimg.com/media/BFkdK55CEAAOtjx.jpg"" style=""width: 100%; max-width: 100%; height: auto;"" border=""1"" />

I did not, however, stay for the Mahones.

The rain stopped shortly after the Carbon Leaf set.  However, after the rain came high winds and plunging temperatures.  Even in the heavier ski jacket, I was <i>cold</i> and my feet and lower back hurt.  The sun had gone down, and I left at 7:30.

Like last year, I snagged the commemorative cup as I left.  People who buy the higher-priced VIP ticket receive a special plastic commemorative cup.  As the crowd thinned out, people left them behind.  Maybe they dropped them on the ground and didn't bother picking them up.  Maybe they tossed them in the garbage.  Maybe they got stomped on by the crowd in front of the stages.  In any case, they were there for the picking.  I only intended to pick up one.  I ended up taking home three.  And yes, I washed them thoroughly when I got home; total strangers had used two of them to drink.  (The second one I picked up, frankly, appeared not to have been used at all.)

I had a fun time.  I felt a little sunburned.

I'll go again next year. :)<p><br><span style=""font-size: x-small;""><i>Posted via <a href=""http://m.livejournal.com/link"">m.livejournal.com</a>.</i></span></p>"
"eventtime","2013-03-18 13:33:00"
"url","http://tiggerallyn.livejournal.com/933850.html"
"userid","15788"
"itemid","3646"
"event","Sometime around three o'clock last night, thanks to a wellspring of activity from my upstairs neighbors, I woke in the middle of an utterly insane dream.

I was either watching or was a part of a David E. Kelley legal drama.

It starred Camryn Manheim, formerly of <i>The Practice</i>.  She had a much younger female associate who I really only remember as having long hair.  And Jimmy Smits was an opposing attorney.

The case that Manheim and her associate were involved with involved the <a href=""http://en.wikipedia.org/wiki/Holy_Prepuce"">Holy Prepuce</a>.  (Please.  Click that link.  It will blow your mind that there is/was such a thing.  Or that anyone <i>cared</i>.)

Basically, their client was being sued for fraud by Smits because the Holy Prepuce that he had apparently sold to someone was not the genuine article.

Their defense was mindblowing.

Of course the Holy Prepuce that was sold wasn't genuine, because everyone knows that the real Holy Prepuce ascended into the skies and became Saturn's rings.  They actually called a theologian to the stand to make that very argument &mdash; Saturn's rings come from the Holy Prepuce.  And Smits brought on an astronomer to testify that, no, Saturn's rings are ancient and have nothing to do with the relics of Jesus.

So then it became this whole astronomy-versus-theology thing.

And, of course, being a David E. Kelley series, Camryn Manheim and her associate successfully convinced a jury that no, there was no fraud involved in the sale of the Holy Prepuce.

Where do these ideas come from?  The story's fairly logical, when you stop to think about it, but why would I be dreaming about <i>that</i>?<p><br><span style=""font-size: x-small;""><i>Posted via <a href=""http://m.livejournal.com/link"">m.livejournal.com</a>.</i></span></p>"
"eventtime","2013-03-12 12:31:00"
"url","http://tiggerallyn.livejournal.com/933602.html"
"userid","15788"
"itemid","3645"
"event","I received a credit card offer in the mail yesterday.

I receive these from time to time.  I'll open the letters, read them, study the terms, and then recycle them.  It's a good system, it serves me well.

Today, though, I responded to one.

It's for an offer from <a href=""https://www.creditonebank.com/"">CreditOne Bank</a>.

The terms were rediculous.  An insanely high APR, plus an annual fee of $99.  I'd call it usurious, but that would be an insult to loan sharks everywhere.

I cut up the application and the sample credit card they sent and put it in the postage paid envelope.  Along with the following note:

<blockquote>Thank you for the offer, but I have to decline.  Your terms amount of a financial rectal probe and someone would have to be a hapless moron to accept them.

Therefore, I am wasting your time (since you're reading this) and your money (since you so kindly sent me a prepaid envelope) just so I can say that I don't want your fiscal colonoscopy.

Begone!

All the best,

Allyn

P.S.  Thanks for throwing this away for me.  I really appreciate it.</blockquote>

I realize that some hapless form processor in El Paso, Texas will get this at the end of the week and my message of defiance will go unheard.

But sometimes you just have to say the things that go unheard.<p><br><span style=""font-size: x-small;""><i>Posted via <a href=""http://m.livejournal.com/link"">m.livejournal.com</a>.</i></span></p>"
"eventtime","2013-02-26 12:42:00"
"url","http://tiggerallyn.livejournal.com/933325.html"
"userid","15788"
"itemid","3644"
"event","It's been too long since Carbon Leaf's last album.

How do you count their last album?  Their last release was 2011's <i>Live, Acoustic, and In Cinemascope!</i>, which, as you can tell from the title, is an acoustic live album.  <i>How the West Was One</i> and <i>Christmas Child</i>, both 2010, were longer than EPs but shorter than LPs.  I guess that makes 2009's <i>Nothing Rhymes With Woman</i> the last full length album.

Well, this week they released <i>Ghost Dragon Attacks Castle</i>.  They had announced another title for the album, ""The Lord of the Rings of the Trees,"" but this new album is that.

And it's very, very good.  I love it.

<i>Ghost Dragon</i> hearkens back to their earlier sound.  On Twitter I've seen it compared to their third album, <i>Ether-Electified Porch Music</i>, but I'm reminded far more of 2001's <i>Echo Echo</i>.  Either way, the album has more of a Celtic/folky feel and less of the alt-indie feel that recent albums have had.

Also this week, the band released <a href=""http://www.noisetrade.com/carbonleaf/the-noisetrade-sampler"">a free sampler</a> through NoiseTrade.  <i>The NoiseTrade Sampler</i> has 18 tracks &mdash; two from <i>Ghost Dragon</i>, <i>Echo Echo</i>'s ""The Boxer,"" a couple of tracks from <i>How the West Was One</i>, and a veritable slew of live tracks ranging from <i>Live, Acoustic</i> to rare, unreleased live cuts.  And it's free.

Did I mention that it's free? :)

Carbon Leaf is a band that's been a part of my life since college, quite literally.  The first time I saw them was at a KA party at the University of Richmond.  I bought their first album there, and the band actually gave me the second during a gig at The Cellar, Richmond's on campus bar.  In the last decade I've only seen them live three times (soon to be four &mdash; they're performing at Shamrock Fest next month).  I love the music.

And if you want to know where my short story ""Make-Believe"" came from, download the sampler &mdash; Carbon Leaf's song ""November (Make Believe)"" was an influence.

Give the sampler a try.  It's free, and you're sure to like it. :)

What are you still reading this for?  Go!  Download!<p><br><span style=""font-size: x-small;""><i>Posted via <a href=""http://m.livejournal.com/link"">m.livejournal.com</a>.</i></span></p>"
"eventtime","2013-02-23 19:33:00"
"url","http://tiggerallyn.livejournal.com/932996.html"
"userid","15788"
"itemid","3643"
"event","As people who follow me on Twitter know, I watch <i>Elementary</i>, CBS's ""Sherlock Holmes in present day New York City"" series.  I've gone from liking it (and calling it ""<i>House</i> with murders"") to really enjoying it.

There are people who won't watch it because they think it's a <i>Sherlock</i> rip-off or because they cast Lucy Liu as Watson or because it's set in New York or because it isn't really Sherlock Holmes.

Is it a <i>Sherlock</i> rip-off?  I'd argue that it's not; <i>Sherlock</i> gave CBS proof that the concept of ""Sherlock Holmes in the present day"" works, they tried to buy the concept from Steven Moffat, but CBS had also commissioned several scripts for a ""Sherlock Holmes in the present day"" series in the past decade that never made it to pilot.

Lucy Liu?  She plays an interesting character who happens to be named Watson and was a doctor, but otherwise she's not very Watsonesque.  The character is interesting, however.  There's backstory there, and I hope the series explores it.

New York City?  Sherlock Holmes always loved America.  Something like a quarter of the stories in the Canon have an American connection.

Sherlock Holmes himself?  I find Jonny Lee Miller's character recognizeable as Holmes.  The personality traits of Arthur Conan Doyle's character are there in Miller's portrayal.  He veers more toward the eccentric side of the character (like Robert Downey Jr.'s version in the Guy Ritchie films) and has better social skills than Benedict Cumberbatch's Holmes or Hugh Laurie's House.  Miller's Holmes is still an insensitive jerk, but in his default state he's not an outright asshole.

All of that said, I'm not going to get into a <i>Sherlock</i> vs. <i>Elementary</i> fight.  Such a fight honestly doesn't interest me. :)

However, the last few episodes of <i>Elementary</i> planted an interesting idea in my head.

It will never, ever happen, but I would <b>love</b> to see <i>Sherlock</i> and <i>Elementary</i> do a script swap.

Back in the 50s and 60s, American television was filled with westerns.  It wasn't unusual for a script for one series to be recycled and shot, largely unchanged, for an entirely different series.  Names would be changed, settings would be updated, the script would be made to fit the new series.  I don't know why westerns did this.  Maybe it was because the premises were similar.  Maybe it was for economic reasons, maybe it was cheaper to rewritng an existing script than to write a new script from the ground up.  Whatever the reason, I've always thought it was interesting that television scripts were swapped around in this way.

<i>Sherlock</i> and <i>Elementary</i> have similar premises &mdash; Sherlock Holmes is alive and active in the present day.  Their scripts would be ""swappable.""  The cities would have to be changed, obviously.  A <i>Sherlock</i> script would lose Lestrade and add Gregson as it made the trans-Atlantic crossing to <i>Elementary</i> and vice versa.  Some things wouldn't carry over, like Joan Watson's sober companion routine, and Lestrade's associates would be compressed down into Detective Bell most likely.  Scripts were swapped, they weren't <i>unchanged</i>.

Suffice it to say, I'd love to see Cumberbatch and Martin Freeman tackle, say, ""The Red Team"" on <i>Sherlock</i> or Jonny Lee Miller deal with ""A Scandal in Belgravia"" on <i>Elementary</i>.  Okay, maybe ""Belgravia"" wouldn't work on <i>Elementary</i> because the two series have divergent views on Irene Adler, but as I said, the scripts wouldn't be shot for the other series unchanged.  Cumberbatch would be able to play the character work that Miller is getting on <i>Elementary</i>, Liu would find new facets to Watson that she's not getting currently as a sober companion.

It won't happen, I know.  It's a silly idea, I freely admit it.

But my, wouldn't it be fun? :)<p><br><span style=""font-size: x-small;""><i>Posted via <a href=""http://m.livejournal.com/link"">m.livejournal.com</a>.</i></span></p>"
"eventtime","2013-02-12 12:28:00"
"url","http://tiggerallyn.livejournal.com/932610.html"
"userid","15788"
"itemid","3642"
