"names","values"
"event","<b>Star Trek: The Next Generation/Doctor Who: Assimilation<sup>2</sup> #8</b>
IDW Publishing
Written by Scott & David Tipton
Pencils by Gordon Purcell
Watercolors by J.K. Woodward

<img src=""http://www.allyngibson.net/graphics/stdw8.jpg"" height=""360"" width=""237"" class=""alignright"" align=""right"" />Ten months ago, IDW Publishing announced the comic book I'd waited most of my life to read &mdash; a <a href=""http://www.allyngibson.net/?p=6324""><i>Star Trek</i>/<i>Doctor Who</i> crossover</a>.  Yesterday, I read the eighth and final issue.

The best thing I can say?  The damn thing is over.

Oh, you're expecting me to say more than that.  I was hoping that would have sufficed.

When last we left our heroes, a Cyberfleet was en route to the Borg's space in the Delta Quadrant.  With the <i>Enterprise</i>-D in pursuit, a small group traveled to the Cybership in the Doctor's TARDIS.  There, Amy and Rory joined a security detail lead by Worf, who showed them how to use phasers, while the Doctor, joined by Picard and Data, went in search of the Cyberleader.  But the separate teams found themselves endangered by armies of Cybermen!

Which brings me to the final issue.

It's not very good.

It suffers from a frequent <i>Doctor Who</i> finale problem &mdash; the conclusion is achieved in the least interesting way possible, and everything you expect to happen does.  You expect the Doctor to confront the Cyberleader and outwit him.  You expect the Borg Conduit to turn on his seeming allies.  You expect a quiet denouement as the heroes say their farewells and return to their respective continuities.

But you also expect to be <i>surprised</i>.  And that's the thing that this issue &mdash; and <i>Star Trek: The Next Generation</i>/<i>Doctor Who</i> &mdash; never achieved.  I never felt surprised.

Instead I felt disappointed.

The series did not end <i>exactly</i> <a href=""http://www.allyngibson.net/?p=6722"">the way I thought it would</a> six weeks ago, but I was pretty close in my guess.  The story tied into <i>Star Trek: First Contact</i>, but not in the way I expected it to.  And the Doctor had a different choice from the <i>Enterprise</i> crew for a possible TARDIS traveler than I guessed.  Still, it ended largely as I thought it would, and the previous issues had given me no reason to expect otherwise.

Yes, this is going to turn into more of a generalized litany of woe lodged against the series rather than a specific takedown of the final issue.  But if you're reading this, chances are you aren't interested in the final issue on its own, you really want to know what the story as a whole was like.

Which brings me back to, ""It's not very good.""

It's easy to guess what the elevator pitch for this series was &mdash; ""The TARDIS lands on the <i>Enterprise</i>, and the Doctor and Picard team up to fight their deadliest enemies!""  Conceptually, that should have worked.

The execution left much to be desired.

I don't know if the rumors of behind-the-scenes turmoil are true.  Personally, I doubt that Tony Lee's departure after issue #4 affected the series in any significant way as there would have been an outline that CBS and the BBC would have signed off on in the development process.  Plus, the series was already mediocre to that point, as I explained at length in <a href=""http://www.allyngibson.net/?p=6613"">my review of issue #4</a>.  In short, while there may have been lines of dialogue in the latter half that would have been written differently with Lee's input, I feel confident that we read the story that IDW set out to tell eight months ago.

The thing I I <i>do</i> know is that Scott and David Tipton had no grasp of what <i>Doctor Who</i> was or how its storytelling worked.  They treated the Doctor as if he were simply a guest star in a <i>Star Trek: The Next Generation</i> story, with Amy and Rory as unimportant associates.

<i>Doctor Who</i> is capable of being a <i>lot</i> of things.  The TARDIS and the <i>Enterprise</i> could easily have ended up at the same planet and the two casts could have been involved in the same adventure, much as we saw in the flashback sequence in issue #3.  However, it occurs to me the simplest way of handling the crossover (from a <i>Doctor Who</i> perspective) would be as a ""base under siege"" story, albeit one where the base (in this case, the <i>Enterprise</i>), is a mobile weapons and exploration platform.

However the merging of the two franchises was done for the purposes of the story, the Tiptons needed to find a way of integrating Amy and Rory into the story.  What they failed to recognize is that, in modern <i>Doctor Who</i>, the companions are as important as the Doctor.  They are expository characters, yes, but they're also characters that have emotional and narrative arcs that as just as significant as the Doctor's.  In this story, however, they had no role at all, much to its detriment.  Perhaps they could have been endangered as a catalyst for the Doctor's involvement.  (I thought early on that the Borg would have captured and assimilated Rory, and I was disappointed when it didn't happen.)  Or, there could have been a moment where Rory needed to use his medical skills; perhaps if the <i>Enterprise</i> were attacked Rory would have to assist in Sickbay as casualties came in, perhaps even bonding with an injured child aboard the ship.  But Amy needed to have a role as well.  Perhaps her natural tourist instincts, which got Team TARDIS in trouble in episodes like ""The Beast Below"" or ""The Vampires of Venice,"" would endanger the Doctor or the <i>Enterprise</i>.  Or perhaps she simply needed to be the Doctor's conscience and hold him back from a devastating decision.  But these things didn't happen.  Instead, Amy and Rory were nothing more than window dressing.  AS I said a long time ago, ""If this were the episode 'Sarek,' then Amy and Rory are as useful as Ki Mendrossen.""

However, the Tiptons' treatment of <i>Star Trek: The Next Generation</i> was no better.  They have the reputation of being IDW's ""good"" <i>Star Trek</i> writers, and based on things like <i>Klingons: Blood Will Tell</i> and <i>Mirror Images</i>, it's not an undeserved reputation.  Those are good series, and I recommend them both; the former is a look at <i>Star Trek</i> (in particular, several episodes of the original series) through Klingon eyes, while the latter is a story about the Kirk and Pike of the Mirror Universe.  When this series was announced, I wrote in a comment <a href=""http://www.allyngibson.net/?p=6324"">to a blog post I made</a> that ""Based on the Tiptons' previous <i>Star Trek</i> work, I have a hunch that this story could tread on some interesting psychological territory.""  It didn't.

That was the least of their <i>Star Trek</i> problems.  Psychological depth is nice, but more important is getting the characterizations right, which they consistently failed to do.  For a story that was ostensibly set during the fifth season of <i>Star Trek: The Next Generation</i>, the characters behaved more like their older and more cynical movie-era counterparts, particularly Picard.  But throughout the series there were moments where the <i>Star Trek</i> regulars spoke or behaved oddly.  (A scene of Crusher and Troi with Amy and Rory midway through the series is perhaps the most egregious example.)  The Tiptons seemed not to ""get"" Picard and his crew.

Assuming that the Tiptons had been able to deal with all of this &mdash; better integration of the two universes, roles for Amy and Rory, characterization &mdash; they still needed to execute a good story.  They didn't.

First, I have no doubt that the eight issues will read well in a single sitting, and when IDW publishes a single-volume hardcover of the series next year I'll add it to my collection.  In single issues, however, this was a dire read.  It wasn't just that the pacing was languid.  It was that they failed to understand that an eight-part story needs seven cliffhangers.  At the end of every issue, the reader needed to say, ""Damn, what's going to happen next?""  There needed to be rising action, increasing tension, and unbelievable plot twists.  Instead, we got limp endings to most issues.  Putting the Doctor on the verge of meeting Guinan at the end of issue #3 is not a gripping cliffhanger.  Heck, it wouldn't even have sufficed for a commercial break.  This story &mdash; really, <i>any</i> multi-part story arc &mdash; needed to work as eight individual issues, and it didn't.

Second, just because <i>Star Trek: The Next Generation</i> was frequently a dull, talky television series, the comic book didn't need to be.  The story felt drawn out and stretched to no good effect.  In Bilbo Baggins' words, it was like too little butter spread across too much bread.  In the pages of <i>Doctor Who Magazine</i>, this story could have been told in a four-part comic strip of eight pages each.  More happens in ""The Iron Legion"" or ""The Flood"" than happens in <i>Assimilation2</i>.  Heck, I'd even argue that more happens in the single issue stories ""The Time of My Life"" or ""The Professor, the Queen, and the Bookshop"" than happened here.  <i>Assimilation2</i> was the Parkinson Principle applied to comic book writing &mdash; the narrative expanded to fill the space allotted.

Third, too much of the story relied upon exposition.  Even in the final issue, we had important points made through expository dialogue.  If it's not the Cyberleader explaining his plan or Riker talking about the best friend we never knew he had, it's the Doctor explaining how the TARDIS works or what will happen when the TARDIS leaves the <i>Star Trek</i> universe.  The problem is these characters are <i>do</i>ers.  They have ships, they go out and find information.  It shouldn't simply be handed to them.

Fourth, the story lacked a sense of jeopardy throughout.  The Borg-Cybermen alliance was never anything more than a conceptual threat, even in the final issue when the Doctor and Picard confront the oddly chatty Cyberleader.  I didn't feel like the characters were ever in danger or that they would have to sacrifice something to achieve victory.

<i>Star Trek: The Next Generation/Doctor Who: Assimilation<sup>2</sup></i> suffered from two failures &mdash; a conceptual failure and an execution failure.  I wanted to read this story for a long time.  I couldn't have imagined ten months ago that it would be so crushingly disappointing.  This story could have gone places and done amazing things.  Instead, it treated its concept &mdash; the union of two of the most famous science-fiction franchises into a single story &mdash; as a sufficient reason to be.  A disappointing series ended on a mediocre note, and I voted for <i>Assimilation2</i> in <a href=""http://www.bleedingcool.com/2012/12/16/most-disappointing-in-a-bad-way-comic-for-2012/"">Bleeding Cool's Most Disappointing (In A Bad Way) Comic For 2012 poll</a>.

The best thing I can say is that it's over.  That there should have been another way.  And that I sincerely hope nothing like this ever happens again."
"eventtime","2012-12-21 08:45:00"
"url","http://tiggerallyn.livejournal.com/930124.html"
"userid","15788"
"itemid","3632"
"event","QSBmZXcgd2Vla3MgYWdvIGEgZnJpZW5kIG9mIG1pbmUgZnJvbSBjb2xsZWdlIHdyb3RlIG1lLg0KDQpTaGUgd2FzIGhhdmluZyBhIGNyaXNpcyBvZiBmYWl0aC4gIFRoZXJlIGhhZCBiZWVuIGEgcGFydGljdWxhcmx5IGhvcnJpZmljIG11cmRlciBvZiBjaGlsZHJlbiBzb21ld2hlcmUsIGFuZCBzaGUgKHRoZSBtb3RoZXIgb2YgdHdvIHNtYWxsIGNoaWxkcmVuKSB3YXMgaGF2aW5nIGEgZGlmZmljdWx0IHRpbWUgcmVjb25jaWxpbmcgaGVyIGZhaXRoIGluIGEgbG92aW5nIGdvZCB3aXRoIHRoZSBpbmRpZmZlcmVudCBnb2QgdGhhdCB3b3VsZCBhbGxvdyB0ZXJyaWJsZSBldmlsIHRvIGhhcHBlbi4gIFNoZSB3YXMgZmluZGluZyBhdGhlaXNtIGFwcGVhbGluZy4NCg0KSSB3cm90ZSBoZXIgYmFjayBhdCBzb21lIGxlbmd0aC4gICJZb3UncmUgd3Jlc3RsaW5nIHdpdGggdGhlIFByb2JsZW0gb2YgRXZpbCwiIEkgYmVnYW4sIGFuZCB0aGVuIEkgdGFsa2VkIHRocm91Z2ggc29tZSBvZiB0aGUgaXNzdWVzLiAgSWYgZ29kIGxvdmVzIGhpcyBjcmVhdGlvbnMsIHRoZW4gd2h5IGRvZXMgZ29kIGFsbG93IHRoZW0gdG8gc3VmZmVyPyAgSWYgZ29kIGlzIG9tbmlwb3RlbnQgYW5kIG9tbmlzY2llbnQsIHRoZW4gd2h5IGRvIGV2aWwgYWN0cyBoYXBwZW4/ICBJZiBnb2QgYWxsb3dzIGV2aWwgYW5kIHN1ZmZlcmluZywgdGhlbiB3aGF0IG1ha2VzIGhpbSB3b3J0aHkgb2Ygd29yc2hpcD8gIFRoZXNlIHF1ZXN0aW9ucyBsZWFkIGludG8gc29tZSB1bmNvbWZvcnRhYmxlIHRlcnJpdG9yeS4gIFRoZSBsb3ZpbmcsIHBlcnNvbmFsIGdvZCBvZiB0aGUgTmV3IFRlc3RhbWVudCBjb2xsaWRlcyB3aXRoIHRoZSBoYXJzaCBsaWdodCBvZiByZWFsaXR5LCBhbmQgcmVhbGl0eSBjb21lcyBvdXQgb24gdG9wLg0KDQpJbiB0aGUgd2FrZSBvZiB5ZXN0ZXJkYXkncyBtYXNzYWNyZSBhdCBhbiBlbGVtZW50YXJ5IHNjaG9vbCBpbiBOZXd0b3duLCBDb25uZWN0aWN1dCwgSSBpbWFnaW5lIHRoZXJlIGFyZSBtYW55IENocmlzdGlhbnMgdG9kYXkgd3Jlc3RsaW5nIHdpdGggdGhlIFByb2JsZW0gb2YgRXZpbC4gIFR3ZW50eS1zaXggcGVvcGxlIGRpZWQsIHR3ZW50eSBvZiB0aGVtIGtpbmRlcmfDpHJ0bmVycyAmbWRhc2g7IGFuZCBpdCBoYXBwZW5lZCBvbiB0aGVpciBnb2QncyB3YXRjaC4gIEhlIGFsbG93ZWQgaXQgdG8gaGFwcGVuLg0KDQpTb21lLCBsaWtlIE1pa2UgSHVja2FiZWUgYW5kIEJyeWFuIEZpc2NoZXIsIGFyZSB0ZWxsaW5nIHRoZW1zZWx2ZXMgYW5kIHRoZWlyIGZvbGxvd2VycyBhIGNvbWZvcnRpbmcgbGllLCB0aGF0IHRoZSBzY2hvb2wgc2hvb3RpbmcgaGFwcGVuZWQgYW5kIHRoZSBjaGlsZHJlbiBkaWVkIGJlY2F1c2Ugd2UgZG9uJ3QgYWxsb3cgc2Nob29sLXNhbmN0aW9uZWQgcHJheWVyLCBiZWNhdXNlIHRoZSByZWFsaXR5IG9mIHRoaXMgJm1kYXNoOyBhbmQgYW55IHNlbnNlbGVzcyB0cmFnZWR5ICZtZGFzaDsgaXMgdG9vIGhvcnJpYmxlIGZvciB0aGVtIHRvIGNvbnRlbXBsYXRlIC0tIHRoYXQgaWYgdGhlcmUgaXMgYSBnb2QsIGhlJ3Mgbm90IHRoZSBsb3ZpbmcgZ29kIHRoYXQgdGhlIGZhaXRoZnVsIGJlbGlldmUgaGltIHRvIGJlLCB0aGF0IGhlJ3MgY2FsbG91cyBhbmQgaW5kaWZmZXJlbnQgdG8gaGlzIGNyZWF0aW9uLCBhbmQgaGUgc2ltcGx5IGRvZXNuJ3QgZ2l2ZSBhIGRhbW4uICBUaGV5IGhhdmUgdG8gaW52ZW50IGEgcmVhc29uIHRvIGV4Y3VzZSBnb2QncyBhYnNlbmNlIGluIHRoZSBwcmVzZW5jZSBvZiBldmlsLiAgVGhleSBoYXZlIHRvIGdpdmUgdGhlbXNlbHZlcyBhIHJlYXNvbiB0byBhY2NlcHQgdGhhdCB0aGVpciBvbW5pc2NpZW50IGFuZCBvbW5pcG90ZW50IGdvZCBpcyBpbmRpZmZlcmVudCBhbmQgaW1wb3RlbnQuDQoNCkFuZCBzbyB0aGV5IGludmVudCB0aGUgY29tZm9ydGluZyBsaWUsIGFuZCB0aGV5IHRlbGwgdGhlbXNlbHZlcyBpdCdzIHRydWUuICBUaGV5IHRlbGwgdGhlbXNlbHZlcyBpdCdzIHRydWUgdG9kYXkuICBUaGV5IHRvbGQgdGhlbXNlbHZlcyBpdCB3YXMgdHJ1ZSB3aGVuIHRoZSBOYXppcyBzbGF1Z2h0ZXJlZCB0aGUgSmV3cyBvciB0aGUgaGlqYWNrZXJzIGZsZXcgcGxhbmVzIGludG8gdGhlIFR3aW4gVG93ZXJzIG9yIGEgZ3VubWFuIGJyb2tlIGludG8gYSBtb3ZpZSB0aGVhdGVyIGluIENvbG9yYWRvLiAgVGhleSB3aWxsIHRlbGwgdGhlbXNlbHZlcyBpdCdzIHRydWUgd2hlbiB0aGUgbmV4dCBzZW5zZWxlc3MgYW5kIGhvcnJpZmljIG91dHJhZ2UgaGFwcGVucyB0b21vcnJvdyBvciBuZXh0IHdlZWsgb3IgbmV4dCBtb250aC4gIEJ1dCB0ZWxsaW5nIHRoZW1zZWx2ZXMgdGhhdCBkb2Vzbid0IG1ha2UgaXQgdHJ1ZS4NCg0KVGhlIGNvbWZvcnRpbmcgbGllIGlzIGFsd2F5cyBlYXNpZXIgdGhhbiB0aGUgaG9uZXN0IHRydXRoICZtZGFzaDsgdGhhdCBpZiB0aGVyZSBpcyBhIGdvZCwgaGUganVzdCBkb2Vzbid0IGdpdmUgYSBmdWNrLg=="
"eventtime","2012-12-15 11:14:00"
"url","http://tiggerallyn.livejournal.com/930018.html"
"userid","15788"
"itemid","3631"
"event","An extract from a parchment found in the ruins of Skaro in the 38th-century:

""And there were in the same country Kaleds abiding in the wastelands, keeping watch over their mutants by night. And, lo, Nyder came upon them, and the glory of the Lord Davros shone round about them: and they were sore afraid. And Nyder said unto them, Fear not: for, behold, I bring you evil tidings of terrible joy, which shall be to all Skaro. For unto you is created this day in the Kaled Dome a Saviour, which is the Dalek Mk. I Travel Machine. And this shall be a sign unto you; Ye shall find the Dalek attached to power umbilicals, powering up in a Davros' laboratory. And suddenly there was with Nyder a multitude of Kaleks praising Davros, and saying, Glory to Davros in the highest, and on Skaro war, genocide toward Thals.""

<img src=""http://sphotos-a.xx.fbcdn.net/hphotos-prn1/29621_565980326749332_30499269_n.jpg"">

The important question, of course, is whether or not it likes plum pudding..."
"eventtime","2012-12-07 07:52:00"
"url","http://tiggerallyn.livejournal.com/929597.html"
"userid","15788"
"itemid","3630"
"event","I mentioned a few days ago that I was putting together an Angel Tree package at the office.  I talked about that <a href=""http://www.allyngibson.net/?p=6752"">here</a>.

Tonight I finished wrapping the thing, and tomorrow I'm going to take it to the office.  MY work will be done.

The tag I picked off the tree was for a seven year-old boy.  He wanted LEGO, cars, and wrestling men.  The tag also indicated his clothing sizes.

I set myself a budget &mdash; 40 dollars.  I came in under that budget.

The hardest thing to find turned out to be the first thing I settled upon.  He wanted LEGO and cars, and I thought that Hasbro's KRE-O <i>Transformers Optimus Prime</i> (small size, not the big size) would be pretty cool.  It's knock-off LEGO, true, but it's also really well made.  I should know, I have one at the office; Optimus has teamed up with the Cybermen to oversee their conversion complex.  Anyway, it took some hunting to find this, which surprised me because it used to be everywhere.

<img src=""http://sphotos-a.xx.fbcdn.net/hphotos-ash4/479965_10151357047545482_2070350499_n.jpg"" style=""width: 400px; height: auto;"" />

I bought some more knock-off LEGO.  These Best-Lock car sets were two dollars each at Rite Aid.

<img src=""http://sphotos-b.xx.fbcdn.net/hphotos-ash4/300040_10151357047535482_82559804_n.jpg"" style=""width: 400px; height: auto;"" />

However, don't think he wasn't getting some real LEGO!  Target offered this LEGO <i>Batmobile</i> set for four dollars, and I picked up a Batman action figure, too.  Kids like Batman. :)

<img src=""http://sphotos-b.xx.fbcdn.net/hphotos-ash4/483436_10151357047655482_1552169443_n.jpg"" style=""width: 400px; height: auto;"" />

I also picked up some <i>Spider-Man</i> stuff &mdash; a puzzle and some flying discs &mdash; at Dollar Tree:

<img src=""http://sphotos-a.xx.fbcdn.net/hphotos-prn1/21652_10151357047730482_958999421_n.jpg"" style=""width: 400px; height: auto;"" />

He could use clothes, so I picked up two shirts at Target.  I don't know what colors work for him.  I picked colors I would wear.

<img src=""http://sphotos-a.xx.fbcdn.net/hphotos-snc7/320544_10151357047705482_642665397_n.jpg"" style=""width:400px; height: auto;"" />

And he could use some reading material, too!  I had two copies of this book for some reason.  I suspect I received one at the office for some reason or another.  In any event, he can give it a good home.  It's LEGO, it has a minifig, and it's vibrant and colorful.

<img src=""http://sphotos-b.xx.fbcdn.net/hphotos-prn1/68478_10151357047775482_2088691355_n.jpg"" style=""width: 400px; height: auto;"" />

I wrote a letter to the little boy from Julenissen, Norway's Christmas Gnome.  We know him as Santa Claus, of course.  It was fun to write, and Julenissen talks about a lot of things.  He doesn't live at the North Pole &mdash; there's nothing there but ice &mdash; but he and his Elves, Dwarves, and Gnomes do live in a mighty castle (Slott Julenissen) north of the Arctic Circle in northern Norway.  Julenissen had a lot to say, five pages worth!

<img src=""http://sphotos-b.xx.fbcdn.net/hphotos-ash3/67778_10151357047800482_569923439_n.jpg"" style=""width: 400px; height: auto;"" />

Here's the pile of wrapped packages:

<img src=""http://sphotos-b.xx.fbcdn.net/hphotos-ash4/252351_10151357047810482_1126806165_n.jpg"" style=""width: 400px; height: auto;"" />

The package has been repacked:

<img src=""http://sphotos-a.xx.fbcdn.net/hphotos-ash3/556879_10151357047850482_1802012598_n.jpg"" style=""width: 400px; height: auto;"" />

There it is.  All wrapped and ready to go to the office tomorrow:

<img src=""http://sphotos-a.xx.fbcdn.net/hphotos-snc7/380945_10151357047920482_382470897_n.jpg"" style=""width: 400px; height: auto;"" />

On Christmas morning, he'll unwrap the big box, open it, and discover lots of other things inside.

That's going to be awesome.  I hope he has a great Christmas.  And if he has little brothers and sisters, I hope he shares.  (Julenissen in his letter tells him he needs to share.)

There you have it &mdash; my first-ever Angel Tree package. :)"
"eventtime","2012-12-03 23:35:00"
"url","http://tiggerallyn.livejournal.com/929399.html"
"userid","15788"
"itemid","3629"
"event","Every Christmas at work, the company puts up an Angel Tree.

This year, I took a tag off the tree.  It was the first time I had done so, as therein hangs a tale.

This is the first year that the company put an Angel Tree in ths sixth floor lobby.  In years previous, the Angel Tree went in the third floor lobby.  People who work on the sixth floor generally don't have to visit the third floor and vice versa.  While I was interested in doing the Angel Tree in years past, invariably by the time I knew the tree was up all the Angels had been taken.

This year they put Angel Trees on both the third <i>and</i> sixth floors.

Tally-ho!

I am shopping for a seven year-old boy.  The tag has his clothing sizes, and it tells me that he wants ""wrestling men"" and ""Legos"" (<i>sic</i>).

I considered putting it back last week when I found out that my housing situation is going to change <i>very</i> soon now, but then I thought about it and realized I was being selfish.

I've given this a lot of thought.

He's going to get a shirt.  I'm not sure what kind of shirt.  He's a kid.  Kids can use clothes.

He's going to get a book.  Don't worry, it's age appropriate.

He's going to get some LEGO-type stuff.  I hunted for the <i>KRE-O Transformers: Optimus Prime</i> set.  No, not the big one.  The one that goes for about ten dollars.  I have this myself (there are pictures of it on Facebook; Optimus Prime is working with the Cybermen), and it's a really nice set.  It's not LEGO, but it's just as good.  He's also going to get a LEGO Batmobile set I saw at Target.  It was about five dollars, it comes in a plastic bag.  Kids like Batman.

And he's going to get a letter from Santa Claus.

One of my favorite Tolkien books is <i>The Father Christmas Letters</i>.  It's a collection of the letters that Tolkien, writing as Father Christmas, sent to his children in the 1920s and 1930s.

I'm writing something in imitation of that.  I can't draw for toffee, so it's unlikely to be illustrated, but I did start writing it yesterday.  What I have isn't great &mdash; the idea is right, but the execution of the idea right now isn't there &mdash; but there's time to make it so.

The idea is this.  Every year, children write Santa Claus letters.  And every year, Santa writes a few special children letters in return.  This particular year, the Angel is receiving a letter.

I've had fun playing around with this.

I have to turn the package in on Thursday.  I plan to wrap each item individually, then put them all inside another box, then wrap that and slap the label on it.

That's the idea.

I'd best take another crack at that letter from Santa Claus.  Or, rather, Julenissen.  My Santa Claus is Norse and lives in Lapland. :)"
"eventtime","2012-11-30 21:23:00"
"url","http://tiggerallyn.livejournal.com/929223.html"
"userid","15788"
"itemid","3628"
"event","This afternoon I went through a stack of fundraising appeals I've received in the mail in the last month.  When I go through my mail, if it's obviously a fundraiser from someone that I've not given money to in the past, the envelope goes unopened in a pile until the pile is twenty pieces high or so.

Today was ""clean up the pile"" day.

By that, I mean that I open the envelope, take a quick look to see who it's from and what they want (usually, the first paragraph of the letter is all the read it gets), and if there's something in the envelope &mdash; cards, notepads, nickels, mailing labels &mdash; that goes in a separate pile.  If the appeal interests me, it goes in one pile.  If it doesn't interest me at all, it goes in another pile of papers to be recycled.

I think I have enough mailing labels now to last the next five years.  I also have some interesting Christmas cards to use if I'm so inclined.

The only appeal that caught my interest?  It came from the Alzheimer's Association, Greater Maryland Chapter.

""Dear Mr. Gibson,"" the letter began, ""Can you imagine how emotionally difficult the holidays can be for people with Alzheimer's disease, and their families?""

The comma was unnecessary.  The whole letter is a grammatical nightmare.

But, yes, Cass Naugle, I can imagine.  I can imagine indeed what the holidays are like for those who suffer from dementia and whose who love and care for them.  And, to be frank, I really needed the rest of this letter seven years ago.  It would have been... helpful.

They're not asking for a lot, and I'll see about sending them a little spare money this week.

The rest of the fundraising appeals, however, are getting recycled.  Sorry, just the way it works."
"eventtime","2012-11-25 22:24:00"
"url","http://tiggerallyn.livejournal.com/928920.html"
"userid","15788"
"itemid","3627"
