"names","values"
"itemid","3673"
"event","This weekend I sat down and did something I never do &mdash; I wrote out New Year's Resolutions.

I've never been the resolution-y type.  I'd occasionally make a list, and it would be a vague list &mdash; write more, exercise more.

This time, I sat down and asked myself, ""What am I trying to accomplish?  What do I want to do?  What will make my life measurably better?""

I came up with some ideas.  I wrote them down.  I came up with some more ideas.  I wrote those down, too.  I typed them up.  I reordered them.  I rewrote a few.  Then I formatted the list for printing, picking some suitably appropriate fonts.

Here's the list:

<blockquote>1.&nbsp;&nbsp;&nbsp;Write 1,000 words per day.&nbsp; <b>Note: </b>Things that do not count: work writing, blog posts, forum posts, e-mails.
2.&nbsp;&nbsp;&nbsp;Make at least 3 blog posts per week.&nbsp; <b>Note:</b> Link Round-Ups do not count, nor do Tweet compilations.
3.&nbsp;&nbsp;&nbsp;Leave the cubicle every day for lunch.&nbsp; Do not eat lunch at the desk.&nbsp; Do not work through lunch.&nbsp; Take a book to read.&nbsp; Write in a notebook.
4.&nbsp;&nbsp;&nbsp;Leave work at work.&nbsp; If deadlines are missed, deadlines are missed.
5.&nbsp;&nbsp;&nbsp;Eat breakfast daily.
6.&nbsp;&nbsp;&nbsp;Pack a lunch each workday.
7.&nbsp;&nbsp;&nbsp;Walk three days a week, no matter the weather, no matter the time, unless there is snow on the ground.
8.&nbsp;&nbsp;&nbsp;Set the alarm clock for 6 o&#39;clock every morning.&nbsp; Saturday and Sunday are exceptions.
9.&nbsp;&nbsp;&nbsp;Make the bed every morning.
10.&nbsp;&nbsp;Shave thrice weekly.
11.&nbsp;&nbsp;Submit one job application or resume each week.
12.&nbsp;&nbsp;Develop a podcast to launch in the spring.
13.&nbsp;&nbsp;Code new front page for website by April.
14.&nbsp;&nbsp;Resume and complete <i>The Misadventures Project</i>.
15.&nbsp;&nbsp;Work through the <i>One Minute Gaelic</i> podcast, and continue with <i>Teach Yourself Gaelic</i>.
16.&nbsp;&nbsp;Reread <i>The Lord of the Rings</i> and the Lankhmar series, for possible blog series.
17.&nbsp;&nbsp;Listen to <i>The Lost Lennon Tapes</i> episodes, also for possible blog series.</blockquote>

I'm going to print out three copies.  One I will hang in the office at home.  One I will hang in my kitchen.  And one I will hang in my cubicle at work.  The idea is that they'll always be somewhere where I can see them, read them, think about them, and internalize them.

Some of these may seem like lifehacks.  I don't eat breakfast every day.  I don't usually make my bed; as someone who lives alone, I don't usually see the point.  I don't shave because I don't deal with the public anymore; why be presentable?  I want to implement and reinforce better behavior on my part.

Toward the end, I name some specific things that I want to complete or embark upon.  Some are projects that I began and then lost interest in.  Some are things that I've wanted to do but have never started.  I wrote them down to keep myself accountable.

Yes, I really do want to learn Scots Gaelic.  I got far enough into the <i>One Minute Gaelic</i> podcast that I can understand a little of the Gaelic used in Starz's <i>Outlander</i>.

Tomorrow after work, I'll stop at Target or Office Max and pick up a daily planner where I can track my progress on these.  And, if more ideas occur to me as the year wears on, I can write them down.

That's the plan.

If you have any questions on any of these, please ask."
"eventtime","2016-01-03 17:13:00"
"url","http://tiggerallyn.livejournal.com/940519.html"
"userid","15788"
"itemid","3671"
"event","Last week was... not the best.

I should clarify. It wasn&#39;t <i>bad</i>. It was simply stressful. And hectic. And tense. And all of the things that a week that where the catalog and orders go to press usually is.

Thankfully, the week ended with the Nerd Prom &mdash; the Employee Appreciation Party (or the Christmas Party) &mdash; and after the week that had been, the Nerd Prom was muchly needed.

Last week, the Christmas tree in the office lobby was put up, and it was decorated, as it always is, with stockings for the Salvation Army&#39;s Angel Tree program.

I did the Angel Tree for the first time three years ago &mdash; <a href=""http://www.allyngibson.com/?p=6757"">and enjoyed it</a> &mdash; but for various reasons, mainly not checking the tree at the right time, I didn&#39;t the last two years.

As I walked past the tree Wednesday afternoon &mdash; or was it Tuesday? &mdash; I looked at the stockings on the tree, saw one for a &quot;Boy Age 7,&quot; and took it. My week had been overwhelming to some extent, and the thought of helping someone who needed help I saw as a way of balancing the karmic scales.

(Yes, <a href=""https://libcom.org/library/starvation-army-twelve-reasons-reject-salvation-army"">the Salvation Army sucks</a>, and there are sound reasons for never, ever associating with them, but there&#39;s also a seven year-old boy who needs something for Christmas. I can overlook the Salvation Army&#39;s problematic aspects if I can use them to help a person.)

Unlike three years ago, where I had a hang tag that had a short want list and clothing sizes, all I had to go on this year was &quot;Boy Age 7.&quot; I then got some clarification from Human Resources about whether or not I had to use the stocking; after all, <a href=""http://www.allyngibson.com/?p=6757"">three years ago I didn&#39;t</a>. I was told that I could put anything in whatever I wanted; the little bit to identify the recipient was all that was necessary, and it needed to be visible. I could work with that.<lj-cut>

Clothing was out &mdash; I had no idea what size to buy for, and I didn&#39;t want to take a chance of buying the wrong size. &quot;A gift receipt!&quot; you&#39;re thinking, and I considered that, but then I thought through the problem &mdash; would this child have an adult who able and willing to go to the store I bought the clothing from to exchange it? I sadly realized that wasn&#39;t an assumption I could make.

I settled on following the gameplan from three years ago &mdash; buy a bunch of small, inexpensive stuff, wrap it individually, then box it in a Diamond shipping box and wrap that.

Let&#39;s see what I did.

<img alt=""20151208_195057"" class=""aligncenter size-overhang wp-image-29656"" src=""http://www.allyngibson.com/wp-content/uploads/2015/12/20151208_195057-720x540.jpg"" />

That&#39;s the stuff, except for three things that I left on my coffee table, pre-wrapping.

<img alt=""20151208_195339"" class=""aligncenter size-overhang wp-image-29657"" src=""http://www.allyngibson.com/wp-content/uploads/2015/12/20151208_195339-720x540.jpg"" />

I decided early on that I wanted to get my Angel Tree recipient some coloring books. And I did &mdash; I found two at Ollie&#39;s Bargain Outlet that I thought would work. One was a Spider-Man coloring book, the other was a <i>Star Wars Rebels</i> coloring book. Coloring books require crayons, so I picked up a box of crayons at Big Lots Saturday night before the Nerd Prom.

<img alt=""20151208_200002"" class=""aligncenter size-overhang wp-image-29658"" src=""http://www.allyngibson.com/wp-content/uploads/2015/12/20151208_200002-720x540.jpg"" />

Also picked up at Big Lots on Saturday night, this set of <i>Batman</i>-themed Hot Wheels cars!

<img alt=""20151208_200951"" class=""aligncenter size-overhang wp-image-29659"" src=""http://www.allyngibson.com/wp-content/uploads/2015/12/20151208_200951-720x540.jpg"" />

Friday morning I stopped at Target before work to buy Coldplay&#39;s newest (and possibly final) album, <i>A Head Full of Dreams</i>. I saw this LEGO set and picked it up at the same time. (It also almost got put back when I couldn&#39;t find the Coldplay album. I <i>eventually</i> located it; even though it was release day, it had been banished to the back of an endcap. Thank you, Coldplay, for being there!)

<img alt=""20151208_202035"" class=""aligncenter size-overhang wp-image-29661"" src=""http://www.allyngibson.com/wp-content/uploads/2015/12/20151208_202035-720x540.jpg"" />

I thought my recipient needed puzzles. I bought three. One was a lenticular <i>Avengers</i> puzzle, and then I bought these two <i>Star Wars</i> puzzles.

<img alt=""20151208_202806"" class=""aligncenter size-overhang wp-image-29662"" src=""http://www.allyngibson.com/wp-content/uploads/2015/12/20151208_202806-720x540.jpg"" />

I wanted to give him a book of some sort, but I had no idea what to give him. (For Christmas when I was seven, my parents gave me a copy of Carl Sagan&#39;s <i>Cosmos</i>. The year before, so when I was six, or it may actually have been the year before, they gave me <i>The Chronicles of Narnia</i>. These weren&#39;t helpful touchpoints.)

I saw this book, <i>The Peter Yarrow Songbook: Favorite Folk Songs</i>, at Ollie&#39;s, and I was instantly taken by it. It&#39;s a picture book, and two dozen classic folk songs are printed and illustrated. Plus, there&#39;s a CD of Peter Yarrow (the Peter of Peter, Paul, and Mary) performing the song. It, too, was the sort of thing my parents would have given me at that age.

Not pictured, I also bought a book on the Smurfs at Ollies. It was a cute introduction to the characters.

<img alt=""20151208_201723"" class=""aligncenter size-overhang wp-image-29660"" src=""http://www.allyngibson.com/wp-content/uploads/2015/12/20151208_201723-720x540.jpg"" />

This I pulled from my personal collection. Patrick Mconnell&#39;s <i>Mutts</i>, which chronicles the adventures of the cat Mooch and the dog Earl, is one of my favorite comic strips, and it would be the right speed for a seven year-old.

Not pictured, there was also a <i>Transformers</i> calendar that I bought at Dollar Tree. Also not pictured (and not wrapped, because there was no good way to wrap it) was the first issue of Titan Magazines&#39; <i>Star Wars Rebels</i> magazine; this was left on the giveaway table at the office a few weeks ago, and I decided to pass it on.

<img alt=""20151208_210057"" class=""aligncenter size-overhang wp-image-29663"" src=""http://www.allyngibson.com/wp-content/uploads/2015/12/20151208_210057-720x540.jpg"" />

And here&#39;s the resulting wrapped packages.

I then sat down and wrote out by hand a short letter from Santa Claus to the little boy about the important things in life. Then I discovered that I no longer have any idea how to write the word &quot;Santa&quot; in cursive. (I can do my signature. Otherwise, I&#39;ve forgotten cursive altogether.)

<img alt=""20151208_210323"" class=""aligncenter size-overhang wp-image-29664"" src=""http://www.allyngibson.com/wp-content/uploads/2015/12/20151208_210323-720x540.jpg"" />

I didn&#39;t have a lot of room left over, and I couldn&#39;t have fit anything else into the box even if I&#39;d wanted to.

<img alt=""20151208_211621"" class=""aligncenter size-overhang wp-image-29667"" src=""http://www.allyngibson.com/wp-content/uploads/2015/12/20151208_211621-720x540.jpg"" />

I taped up the box then wrapped it in <i>A Charlie Brown Christmas</i> paper that I <i>also</i> bought at Big Lots on Saturday night.

This morning I took the box into work, taped the necessary identifying materials to one side, and turned the package over to Human Resources.

There&#39;s stuff there that I&#39;m sure he&#39;ll enjoy. :)

I can&#39;t fix the world. Sometimes, in my darker moments, I&#39;m not even sure I can fix myself. I can make things better for one person, though, at least for one day. I&#39;ll count that as a win.

Merry Christmas, little boy. :)</lj-cut>"
"eventtime","2015-12-09 21:26:00"
"url","http://tiggerallyn.livejournal.com/939850.html"
"userid","15788"
"itemid","3668"
"event","PHA+WWVzdGVyZGF5IGV2ZW5pbmcgSSB3ZW50IHRvIHRoZSBCQU0hIChmb3JtZXJseSBCb29rcyBhIE1pbGxpb24pIG5lYXIgWW9yayBHYWxsZXJpYSwgbm90IGZvciBhbnkgcGFydGljdWxhciByZWFzb24sIGp1c3QgdG8gZ2V0IGF3YXkgZnJvbSB0aGUgZ2xvb20gYW5kIHRoZSBtdWNrIHRoYXQgaGFkIGJlZW4gYWxsIGRheSBTYXR1cmRheSB0aGFua3MgdG8gdGhlIHJhaW4gYnJvdWdodCBieSBIdXJyaWNhbmUgSm9hcXVpbi48L3A+DQo8cD48aW1nIHNyYz0iaHR0cDovL3d3dy5hbGx5bmdpYnNvbi5jb20vd3AtY29udGVudC91cGxvYWRzLzIwMTUvMTAvdGhlcGVhbnV0c21vdmllLW5vdmVsaXphdGlvbi00MzB4NjQwLmpwZyIgYWx0PSJ0aGVwZWFudXRzbW92aWUtbm92ZWxpemF0aW9uIiB3aWR0aD0iMzAwIiBoZWlnaHQ9IjQ0NiIgYWxpZ249InJpZ2h0IiBjbGFzcz0iYWxpZ25yaWdodCBzaXplLWxhcmdlIHdwLWltYWdlLTI5MjMzIiAvPlRoZXJlIEkgZm91bmQgYSBtb3N0IHVuZXhwZWN0ZWQgYm9vayAmbWRhc2g7IDxpPlRoZSBQZWFudXRzIE1vdmllIE1vdmllIE5vdmVsaXphdGlvbjwvaT4sIGFkYXB0ZWQgYnkgY2hpbGRyZW5zIGJvb2sgYXV0aG9yIDxhIGhyZWY9Imh0dHA6Ly93d3cudHJhY2V5d2VzdC5jb20vIj5UcmFjZXkgV2VzdDwvYT4uJm5ic3A7IChUaGUgZG91YmxlICYjODIyMDtNb3ZpZSYjODIyMTsgaW4gdGhlIHRpdGxlIGlzIG5vdCBhIHR5cG8gb24gbXkgcGFydDsgdGhhdCYjODIxNztzIHdoYXQgaXQgcmVhZHMgb24gdGhlIGNvdmVyIGFuZCB0aGUgc3BpbmUuKTwvcD4NCjxwPkkmIzgyMTc7bSBub3QgZ29pbmcgdG8gY3JpdGlxdWUgdGhlIGJvb2ssIHBlciBzZTsgSSYjODIxNzttIHdlbGwgYmV5b25kIHRoZSBhZ2Ugb2YgdGhlIGJvb2smIzgyMTc7cyBpbnRlbmRlZCBhdWRpZW5jZSwgYW5kIGFueSBjcml0aXF1ZSB3b3VsZCBiZSBicmluZ2luZyBhIGZvcnR5c29tZXRoaW5nJiM4MjE3O3MgcGVyc3BlY3RpdmUgb24gYW5kIGV4cGVjdGF0aW9ucyBvZiBmaWN0aW9uIHRvIGEgd29yayB0aGF0IGRvZXNuJiM4MjE3O3QgZGVzZXJ2ZSB0aGF0IHR5cGUgb2Ygc2NydXRpbnkuJm5ic3A7IEkgZGlkIGZlZWwgc29tZXRoaW5nJmhlbGxpcDsgPGk+c3RyYW5nZTwvaT4gYWJvdXQgcmVhZGluZyB0aGlzIGJvb2sgYW5kIGVuZ2FnaW5nIHdpdGggdGhlIDxpPlBlYW51dHM8L2k+IGNoYXJhY3RlcnMgdGhyb3VnaCBwcm9zZSwgYnV0IHRoYXQmIzgyMTc7cyBteSBjb25kaXRpb25pbmcgYW5kIGV4cGVjdGF0aW9ucyBib3JuIG9mIG5lYXJseSBmb3VyIGRlY2FkZXMgb2YgcmVhZGluZyB0aGVzZSBjaGFyYWN0ZXJzIGluIGNvbWljIHN0cmlwcyBvciB3YXRjaGluZyB0aGVtIG9uIHRlbGV2aXNpb24uJm5ic3A7IFdoZW4gSSB3YXMgaW4gc2Vjb25kIG9yIGZvdXJ0aCBncmFkZSAoSSBza2lwcGVkIHRoaXJkKSwgdGhpcyB3b3VsZCBoYXZlIGJlZW4gbXkgc3BlZWQuJm5ic3A7IChPciBtYXliZSBub3QuJm5ic3A7IEkgd2FzIHJlYWRpbmcgQXJ0aHVyIEMuIENsYXJrZSBhbmQgUm9iZXJ0IEhlaW5sZWluIGFuZCBTaXIgQXJ0aHVyIENvbmFuIERveWxlIGJ5IGZvdXJ0aCBncmFkZSwgYW5kIEkmIzgyMTc7ZCBhbHJlYWR5IGJlZW4gdG8gTmFybmlhIGFuZCBNaWRkbGUtRWFydGguKSAgQW5kIHRoZSBib29rIHNob3VsZCByZWFsbHkgYmUgbG9va2VkIGF0IGluIHRoYXQgd2F5LiZuYnNwOyBJdCYjODIxNztzIGEgYm9vayBmb3Iga2lkcy4gPGltZyBzcmM9Imh0dHA6Ly93d3cuYWxseW5naWJzb24uY29tL3dwLWNvbnRlbnQvcGx1Z2lucy9jbGFzc2ljLXNtaWxpZXMvaW1nL2ljb25fc21pbGUuZ2lmIiBhbHQ9IjopIiBjbGFzcz0id3Atc21pbGV5IiAvPjwvcD4NCjxwPlRoZSBpbXBvcnRhbnQgdGhpbmcgdG8gc2F5IGFib3V0IDxpPlRoZSBQZWFudXRzIE1vdmllPC9pPiBub3ZlbGl6YXRpb24gaXMgdGhhdCBpdCYjODIxNztzIGVudGVydGFpbmluZyBhbmQgdGhlIGJvb2sgaXMgZnJlcXVlbnRseSBsYXVnaC1vdXQtbG91ZCBmdW5ueS4mbmJzcDsgV2VzdCB0YWtlcyB1cyBpbnNpZGUgdGhlIHBzeWNoZXMgb2YgQ2hhcmxpZSBCcm93biBhbmQgU25vb3B5LCBhbmQgc2hlIG1ha2VzIHVzIGZlZWwgZm9yIGdvb2Qgb2wmIzgyMTc7IENoYXJsaWUgQnJvd24uJm5ic3A7IFRoZSBwcm9zZSBpc24mIzgyMTc7dCBjb21wbGljYXRlZCwgdGhlIGNoYXJhY3RlcnMgYmVoYXZlIGV4YWN0bHkgYXMgdGhleSBzaG91bGQsIGFuZCB0aGUgc2Vuc2Ugb2YgbWVsYW5jaG9seSB0aGF0IHBlcnZhZGVzIDxpPlBlYW51dHM8L2k+IGlzIHByZXNlbnQuJm5ic3A7IEZvciB0aGUgZWxlbWVudGFyeSBzY2hvb2wgcmVhZGVyIHdobyBrbm93cyBDaGFybGllIEJyb3duIGFuZCB0aGUgZ2FuZyBmcm9tIHRoZSBhbmltYXRlZCBzcGVjaWFscywgPGk+VGhlIFBlYW51dHMgTW92aWUgTW92aWUgTm92ZWxpemF0aW9uPC9pPiB3b3VsZCBiZSBhIGxvdmVseSBpbnRyb2R1Y3Rpb24gdG8gdGhlIGNoYXJhY3RlcnMuPC9wPg0KPHA+VGhhdCBvdXQgb2YgdGhlIHdheSwgSSB3YW50IHRvIHRha2Ugc29tZSB0aW1lIGFuZCBkaXNjdXNzIHRoZSA8aT5zdG9yeTwvaT4sIHdoaWNoIGlzbiYjODIxNzt0IFdlc3QmIzgyMTc7cyBwdXJ2aWV3OyBzaGUgd29ya2VkIHdpdGggdGhlIHNjcmlwdCBzaGUgd2FzIGdpdmVuLiZuYnNwOyBXaGF0IGZvbGxvd3Mgd2lsbCBiZSBzcG9pbGVycywgYW5kIEkmIzgyMTc7bGwgbGVhdmUgYW4gTEogY3V0IGZvciB0aG9zZSB3aG8gd2lzaCB0byBzdG9wIHJlYWRpbmcmIzgyMzA7PC9wPg0KPGxqLWN1dD4NCjxwPkJhY2sgaW4gSnVuZSwgRk9YIHJlbGVhc2VkIGEgdHJhaWxlciBmb3IgdGhlIGZpbG0gdGhhdCBnYXZlIHNvbWUgaGludHMgYWJvdXQgdGhlIGZpbG0mIzgyMTc7cyBzdG9yeS4mbmJzcDsgTGV0IG1lIHF1b3RlIGZyb20gPGEgaHJlZj0iaHR0cDovL3d3dy5hbGx5bmdpYnNvbi5jb20vP3A9MjkxMTMiPnRoZSBibG9nIHBvc3Q8L2E+IEkgd3JvdGUgYWJvdXQgaXQ6PC9wPg0KPGJsb2NrcXVvdGU+PHA+TXkgcmVhZCBvbiB0aGUgdHJhaWxlciBpcyB0aGF0IHRoaXMgaXMgYW4gb3JpZ2luIHN0b3J5IG9mIHNvcnRzICZtZGFzaDsgdGhlIG9yaWdpbiBvZiBDaGFybGllIEJyb3du4oCZcyB1bnJlcXVpdGVkIGNydXNoIG9uIHRoZSBMaXR0bGUgUmVkLUhhaXJlZCBHaXJsLiZuYnNwOyBBIG5ldyBnaXJsIG1vdmVzIGludG8gQ2hhcmxpZSBCcm93buKAmXMgbmVpZ2hib3Job29kLCBzaGXigJlzIHNlZW4gYSBmZXcgdGltZXMgaW4gc2hhZG93cyBvciBhdCBhIGRpc3RhbmNlIGluIHRoZSB0cmFpbGVyLCBubyBtYXR0ZXIgd2hhdCBoZSBkb2VzIENoYXJsaWUgQnJvd24gY2Fu4oCZdCB3b3JrIHVwIHRoZSBuZXJ2ZSB0byB0YWxrIHRvIGhlciwgc2hlIGhhcyByZWQgaGFpci4mbmJzcDsgU2VlbXMgc3RyYWlnaHRmb3J3YXJkIHRvIG1lLjwvcD48L2Jsb2NrcXVvdGU+DQo8cD5BbHNvLCB0aGVyZSB3ZXJlIHNvbWUgdGhpbmdzIGluIHRoZSB0cmFpbGVyIHRoYXQgc3RydWNrIG1lIGFzIG5vdCBxdWl0ZSByaWdodDo8L3A+DQo8YmxvY2txdW90ZT48cD5TaGVybXnigJlzIHByZXNlbmNlIGFsb25nc2lkZSBQZXBwZXJtaW50IFBhdHR5IGFuZCBGcmFua2xpbiBpcyBhaGlzdG9yaWNhbCAoU2hlcm15IGRpc2FwcGVhcmVkIGZyb20gQ2hhcmxlcyBTY2h1bHrigJlzIHN0cmlwIGFib3V0IHRoZSBzYW1lIHRpbWUgdGhleSB3ZXJlIGludHJvZHVjZWQpLiZuYnNwOyBXZSBhbHNvIHNlZSB0aGF0IFBlcHBlcm1pbnQgUGF0dHksIE1hcmNpZSwgYW5kIEZyYW5rbGluIGFwcGFyZW50bHkgYXR0ZW5kIENoYXJsaWUgQnJvd27igJlzIHNjaG9vbCAodGhleSBkaWRu4oCZdCAmbWRhc2g7IHRoZXkgd2VyZSBmcm9tIHRoZSBvdGhlciBzaWRlIG9mIHRvd24gYW5kIGF0dGVuZGVkIGEgZGlmZmVyZW50IHNjaG9vbCksIGFuZCBMaW51cyBhcHBlYXJzIHRvIGJlIGluIHRoZSBzYW1lIGNsYXNzIGFzIENoYXJsaWUgQnJvd24gKGhlIHdhc27igJl0ICZtZGFzaDsgaGUgd2FzIGEgeWVhciBvciB0d28gYmVoaW5kIENoYXJsaWUgQnJvd24pLjwvcD48L2Jsb2NrcXVvdGU+DQo8cD48aW1nIHNyYz0iaHR0cDovL3d3dy5hbGx5bmdpYnNvbi5jb20vd3AtY29udGVudC91cGxvYWRzLzIwMTUvMTAvdGhlcGVhbnV0c21vdmllLXByb2ZpbGUtNjQweDY0MC5qcGciIGFsdD0idGhlcGVhbnV0c21vdmllLXByb2ZpbGUiIGFsaWduPSJyaWdodCIgaGVpZ2h0PSIzMDAiIHdpZHRoPSIzMDAiIGNsYXNzPSJhbGlnbmxlZnQgc2l6ZS1sYXJnZSB3cC1pbWFnZS0yOTIzNCIgLz5UaGVzZSBzdXBwb3NpdGlvbnMgYXJlIGFic29sdXRlbHkgYWNjdXJhdGUuPC9wPg0KPHA+VGhlIHN0b3J5IGhhcyBhbiBBLXBsb3QvQi1wbG90IHN0cnVjdHVyZSwgbGlrZSB0aGUgYmVzdCAoYW5kIHdvcnN0KSBvZiA8aT5TdGFyIFRyZWs6IFRoZSBOZXh0IEdlbmVyYXRpb248L2k+LiZuYnNwOyBJbiB0aGUgQS1wbG90LCBDaGFybGllIEJyb3duIGhhcyBhIGNydXNoIG9uIGhpcyBuZXcgbmVpZ2hib3IgYWNyb3NzIHRoZSBzdHJlZXQsIHRoZSBMaXR0bGUgUmVkLUhhaXJlZCBHaXJsLiZuYnNwOyBJbiB0aGUgQi1wbG90LCBTbm9vcHkgZmluZHMgYSB0eXBld3JpdGVyIGFuZCBzdGFydHMgd3JpdGluZyB0aGUgR3JlYXQgQW1lcmljYW4gTm92ZWwsIGEgd2FyIHN0b3J5IGFib3V0IHRoZSBXb3JsZCBXYXIgSSBGbHlpbmcgQWNlIGFuZCBoaXMgbG92ZSBvZiB0aGUgRnJlbmNoIHBvb2RsZSBhdmlhdHJpeCwgRmlmaS4mbmJzcDsgVGhlIHN0b3J5IGlzbiYjODIxNzt0IGp1c3QgJiM4MjIwO3RoZSBvcmlnaW4gb2YgQ2hhcmxpZSBCcm93buKAmXMgdW5yZXF1aXRlZCBjcnVzaCBvbiB0aGUgTGl0dGxlIFJlZC1IYWlyZWQgR2lybCYjODIyMTs7IGl0JiM4MjE3O3MgYWxzbyB0aGUgb3JpZ2luIG9mIFNub29weSBhcyB0aGUgR3JlYXQgQW1lcmljYW4gTm92ZWxpc3QuJm5ic3A7IFRoZXNlIHBsb3RzIHJlaW5mb3JjZSBvbmUgYW5vdGhlciwgYnV0IHRoZXkgZG9uJiM4MjE3O3QgdGllIHRvZ2V0aGVyLjwvcD4NCjxwPkFuZCB5ZXMsIHRoZXJlJiM4MjE3O3MgYSBzdHJhbmdlLCBhaGlzdG9yaWNhbCBtaXggb2YgPGk+UGVhbnV0czwvaT4gY2hhcmFjdGVycyBpbiB0aGUgZmlsbS4mbmJzcDsgUGVwcGVybWludCBQYXR0eSwgTWFyY2llLCBhbmQgRnJhbmtsaW4sIHdobyBhdHRlbmQgYSBzY2hvb2wgb24gdGhlIG90aGVyIHNpZGUgb2YgdG93biwgYXJlIHBhcnQgb2YgQ2hhcmxpZSBCcm93biYjODIxNztzIGNsYXNzLCBhbG9uZyB3aXRoIExpbnVzIGFuZCBTaGVybXksIGFuZCB0aGVpciB0ZWFjaGVyIGlzIE1pc3MgT3RobWFyLjwvcD4NCjxwPkkgdW5kZXJzdGFuZCB0aGUgY3JlYXRpdmUgZGVjaXNpb24gdGhhdCBsZWQgdG8gc29tZXRoaW5nIGxpa2UgdGhhdCAmbWRhc2g7IGl0JiM4MjE3O3MgZWFzaWVyIHRvIHB1dCBhbGwgb2YgdGhlIGNoYXJhY3RlcnMgaW4gdGhlIHNhbWUgc2Nob29sIGFuZCB0aGUgc2FtZSBjbGFzc3Jvb20gYmVjYXVzZSBpdCBhZmZvcmRzIG1vcmUgb3Bwb3J0dW5pdGllcyB0byB1c2UgdGhlIGNoYXJhY3RlcnMgYW5kIGhhdmUgdGhlbSBpbnRlcmFjdC48L3A+DQo8cD5CdXQgSSBjYW4mIzgyMTc7dCB1bmRlcnN0YW5kIHdoeSBTaGVybXkgd2FzIHVzZWQgYXQgPGk+YWxsPC9pPi4mbmJzcDsgSGUgaXMsIGF0IGJlc3QsIHB1cmUgZmFuLXNlcnZpY2UgYmVjYXVzZSBoZSBkb2VzbiYjODIxNzt0IGRvIGEgc2luZ2xlIHRoaW5nIGluIHRoZSBzdG9yeS4mbmJzcDsgRG9uJiM4MjE3O3QgbWlzdW5kZXJzdGFuZCBtZSwgSSBkb24mIzgyMTc7dCBoYXZlIGl0IG91dCBmb3IgU2hlcm15LCBidXQgaGUgY2Vhc2VkIGJlaW5nIGEgbWFqb3IgY2hhcmFjdGVyIGEgZGVjYWRlIGJlZm9yZSBJIHdhcyBib3JuLCBhbmQgaGlzIHBlYWsgbW9tZW50IHdhcyBwcm9iYWJseSAmIzgyMjA7SSYjODIxNzttIGFsd2F5cyBhIHNoZXBoZXJkJiM4MjIxOyBpbiA8aT5BIENoYXJsaWUgQnJvd24gQ2hyaXN0bWFzPC9pPi4mbmJzcDsgVW5sZXNzIHRoZXJlJiM4MjE3O3MgYSByZWFzb24gb3V0c2lkZSB0aGlzIHN0b3J5IGZvciBoaXMgYXBwZWFyYW5jZSAmbWRhc2g7IHN1Y2ggYXMsICYjODIyMDtTaGVybXkgd2FzIHNlY3JldGx5IENoYXJsZXMgU2NodWx6JiM4MjE3O3MgZmF2b3JpdGUgY2hhcmFjdGVyIGFuZCBoZSBhbHdheXMgcmVncmV0dGVkIG5vdCBkb2luZyBtb3JlIHdpdGggaGltJiM4MjIxOyAmbWRhc2g7IGhlIGNvdWxkIGhhdmUgYmVlbiBkaXNwZW5zZWQgd2l0aCBlbnRpcmVseS48L3A+DQo8cD5BcyBmb3IgdGhlIHRvbmUsIHRoZSBzdG9yeSBnZXRzIGl0IHJpZ2h0JiM4MjMwOyB1bnRpbCB0aGUgZW5kaW5nLiZuYnNwOyBUaHJvdWdob3V0LCBDaGFybGllIEJyb3duIGlzIGZhY2VkIHdpdGggYSBwcm9ibGVtICZtZGFzaDsgaG93IHRvIHdvcmsgdXAgdGhlIGNvdXJhZ2UgdG8gaGF2ZSBhIGNvbnZlcnNhdGlvbiB3aXRoIHRoZSBMaXR0bGUgUmVkLUhhaXJlZCBHaXJsICZtZGFzaDsgYW5kIGhlIGNvbWVzIDxpPmNsb3NlPC9pPiB0byBzdXJtb3VudGluZyB0aGUgY2hhbGxlbmdlLCBvbmx5IHRvIGZhaWwgKGluIGhpcyBtaW5kKSBpbiBhbiBlbWJhcmFzc2luZyBhbmQgcHVibGljIHdheSwgdGltZSBhbmQgYWdhaW4sIGFuZCBoZSYjODIxNztzIHJlbWluZGVkIG9mIHRoYXQgZmFjdCBieSBoaXMgZXJzdHdoaWxlIGZyaWVuZHMuJm5ic3A7IFRoYXQmIzgyMTc7cyBjbGFzc2ljIDxpPlBlYW51dHM8L2k+LiZuYnNwOyBCdXQgdGhlIGVuZGluZyBvd2VzIG1vcmUgdG8gcm9tLWNvbSBjbGljaGVzIHRoYW4gPGk+UGVhbnV0czwvaT4sIGFuZCB0aGUgcmVhY3Rpb24gYnkgdGhlIGNoYXJhY3RlcnMgdG8gdGhlIGVuZGluZyBpcyBub3QgPGk+UGVhbnV0czwvaT4gYXQgYWxsLiZuYnNwOyBVbmxlc3MsIHRoaXJ0eSBzZWNvbmRzIGFmdGVyIHRoZSBlbmQgaXQgYWxsIGJsb3dzIHVwIGluIENoYXJsaWUgQnJvd24mIzgyMTc7cyBmYWNlLCB0aGF0IGlzLjwvcD4NCjxwPkZvciBhIG5ldyBhdWRpZW5jZSwgSSB0aGluayB0aGUgZmlsbSB3aWxsIHdvcmsuJm5ic3A7IFRoZXkmIzgyMTc7cmUgbm90IGdvaW5nIHRvIGJlIG5pdHBpY2t5IGFib3V0IGhvdyBpdCBkb2VzbiYjODIxNzt0ICYjODIyMDtmaXQuJiM4MjIxOyZuYnNwOyBUaGV5JiM4MjE3O3JlIGdvaW5nIHRvIHNlZSBhIHN0b3J5IGFib3V0IG92ZXJjb21pbmcgbGlmZSYjODIxNztzIG9ic3RhY2xlcyBhbmQgbGVhcm5pbmcgZnJvbSB0aGUgcHJvY2VzcyBzdGFycmluZyBhIGdyb3VwIG9mIGNoYXJhY3RlcnMgdGhhdCB0aGV5JiM4MjE3O3JlIHByb2JhYmx5IGEgbGl0dGxlIGZhbWlsaWFyIHdpdGguJm5ic3A7IFRoZSBzdG9yeSBkb2VzIHdvcmsgb24gaXRzIG93biB0ZXJtcy48L3A+DQo8cD5Gb3IgYSBsb25nLXRpbWUgPGk+UGVhbnV0czwvaT4gZmFuIG9mIGNvbWljcyBhbmQgYW5pbWF0aW9uIGxpa2UgbXlzZWxmLCBpdCB3aWxsIHByb2JhYmx5IGJlIGJlc3QgdG8gdGhpbmsgb2YgdGhpcyBhcyBhIHJlYm9vdCwgbGlrZSBCcmlhbiBNaWNoYWVsIEJlbmRpcyBhbmQgTWFyayBCYWdsZXkmIzgyMTc7cyA8aT5VbHRpbWF0ZSBTcGlkZXItTWFuPC9pPiBvciBKLkouIEFicmFtcyYjODIxNzsgPGk+U3RhciBUcmVrPC9pPiwgYWxiZWl0IGEgcmVib290IHdpdGhvdXQgZGVjb21wcmVzc2lvbiBhbmQgbGVucyBmbGFyZS4mbmJzcDsgSSBmdWxseSBleHBlY3QgdG8gYmUgZW50ZXJ0YWluZWQgYnkgdGhlIGZpbG0uJm5ic3A7IEFzIEkgc2FpZCwgdGhlIHN0b3J5IDxpPmRvZXM8L2k+IHdvcmsuJm5ic3A7IEl0JiM4MjE3O3Mgbm90IGVudGlyZWx5IHRydWUgdG8gQ2hhcmxlcyBTY2h1bHomIzgyMTc7cyA8aT5QZWFudXRzPC9pPiwgYnV0IGFzIHRoZSBmaWxtIHNwb29scyBhbmQgdGhlIHN0b3J5IHVuZm9sZHMgSSBkb24mIzgyMTc7dCB0aGluayBJJiM4MjE3O2xsIG5vdGljZS4mbmJzcDsgSSYjODIxNztsbCBqdXN0IGVuam95IHRoZSA5MCBtaW51dGVzIHdpdGggQ2hhcmxpZSBCcm93biBhbmQgdGhlIGdhbmcuPC9wPjwvbGotY3V0Pg=="
"eventtime","2015-10-04 12:38:00"
"url","http://tiggerallyn.livejournal.com/939233.html"
"userid","15788"
"itemid","3667"
