"names","values"
"itemid","39"
"event","My Dreams are starting to manifest inside of my head
They keep getting darkier and more vibrant..
I drempt that I was part of the Cia or something like that
in a suit with weapons to kill. I remember going around in some wierd building
almost like a prision but not. Look for someting. 
But it was like out of a horror movie. but not quite
the building was well lit
everything was a baby blue colour rust spots
some green mold
there were just shallow pools of water in the middle of rooms giant..
well not giant bout the size of a underground swimming pool.but only like 6 inches deep sort of thing
they were clear. could see every little crack in the bottom of the pool.
Me and my team keep going deeper. Pipes filled the celing. They were black and brown..
dirty pipes dripping gross brown water from the seems.
There was no sounds exept for our foot steps as we made our way down the long hallway. this are was much much darker. dimly lit. we made it to another set of rooms. this time bodies lay everywhere
but not human. none of them were alive. they were all pasty white..their veins blue sticking out...dead..
the room did not smell thou..we made our way back up into a loading dock. there were probably 12 loading docks.. there was a huge parking lot blocking them..they haddent been used in years..
we made our way to a black car. guns were bein distributed. the area was heavily populated. a fence between two buildings held people back..they had a barrle with fire..it was the middle of the day in the summer. we were all dressed in black it was scorching hot but i did not feel the heat. too many things going on in my mind. i asked if i could have a gun. they nodded. i must have been new.

they passed me a gun and as we walked to a new building an appartment building me and one other guy passed a vehical with a man who looked at us with an evil grin. my partner kept walking. an old lady passed and obsturcted my view..as i caught glimse of the man he was pulling up a weapon. I shot him dead in place..it was all in slow motion like the moment would last forever in my mind. He was my first kill.

Then i found myself alone in the appartment. It was dimly lit again...this time the hallway was a puke green colour almost the celing seemed as if it bled black downt he walls. there was a massive vent above my head. A Snake came towards me through the hallways. probably 30ft long. I stood there I have seen him before in many of my other dreams. This time thou it was differnt.. He did not try and kill me. He only stared into my eyes then flew un into the vent above. He lowered down a cardbord box. probably a foot and half cubed. It was all battered. A single rope holding the weatherd top closed. I didnt know what to think of this box..all confused..i took it back into my dim appartment. closed the door. I passed by my white ancient fridge. I slowly oped the box...and that is the end..
I can not remember what else happened.
My Dreams...What do they mean..
Why do they haunt me."
"eventtime","2005-10-02 12:29:00"
"url","http://tribalwarrior08.livejournal.com/10175.html"
"userid","16030"
"itemid","38"
"event","Breath in little boy. 
Breath in.
Take in one last breath.
Feel the sweet taste of the nights dew on the tip of your lips.
Feel it all slipping away.
Its all going now.
Watch your eyes roll into your skull.
Watch your legs collaps under your dead weight.
The love of your life ripping out your very soul.
Such a bitter sweet symphony.
Such sights to see you only left with darkness.
Love is so fake.
Cry out your withered life out.
Cry out for that last hope.
Did you actually think it would come?
Pitiful boy.
Pitiful."
"eventtime","2005-09-25 21:42:00"
"url","http://tribalwarrior08.livejournal.com/9975.html"
"userid","16030"
"itemid","37"
"event","Waiting.
Soul searching.
Lost in a black forest, only known as my heart.
Weary from the walk.
Back and forth.
Digging my grave.
Wearing down life.
Age fades from my face.
Young and restless.
Dreams are forgotten.
Where have I been?
Where am I going?
Open hands begging for mercy.
Lost am I with out my creation.
Bleeding for answers.
None will follow.
Save me.
Please.
Save me."
"eventtime","2005-08-29 20:16:00"
"url","http://tribalwarrior08.livejournal.com/9688.html"
"userid","16030"
"itemid","36"
"event","Bleeding eyes scream out confessions of a broken heart
Flowing words ramble on into nonsence
Anger exudes from the pours of my skin
Wrap my soul in this broken world
See how far my blood can flow
Dragging this knife called love against my skin
Penetrating the very innards of my soul
Ripping my life appart
Slivering my soul
Take me out of my missery
This is my final bout
This is the out that I have dreamed of
Put that bullet called life and burry it into my mind
Finish off what dreams have set to do
End my existance
Finish life."
"eventtime","2005-08-28 15:04:00"
"url","http://tribalwarrior08.livejournal.com/9437.html"
"userid","16030"
"itemid","35"
"event","Empty tear flow from my broken eyes
Dreaming once of beinging the world to you
That knight in shining armour.
That boy holding the red red rose
standing at your front door

my head is bowed down
my eyes ask for forgiveness
i stare into your crying eyes
lost and along i find myself on the curb of life

I dream of the night
where i can hold you in my arms
wispering sweet nothings
loving your breath on my lips

remembering that first kiss
is all i have in life
the times we shared
the times we havnt
im lost with out you

I lye in bed alone and unforgiven
I feel for you but you are not by my side
I can not live this life
not with out the love of my life

dreaming of a new tommorow
i find myself in a black hole
come dig me out of my grave
bring me back to life

I sing this song
no words can describe my hurt
my tears fall my voice shallow
lost with out you dreaming of you

please come find me
i need your love in my life
i can not live with out my drug
my dirty little whore."
"eventtime","2005-08-23 10:33:00"
"url","http://tribalwarrior08.livejournal.com/9101.html"
"userid","16030"
"itemid","34"
"event","It feels as if my life is draining the souls of the ones around me
I am eating the life of the people i care about
Stealing their souls for my petty dreams
Ripping their bodies limb from limb

Dripping emotions held by a fear of falling
Tears of blood dripping down my finger tips
Lifeless love,
Forsaken hope.

My dreams have turned black and haunt my mind
My hope is fading and a new tommorow never comes
Hopes are forgotten
Dreams are dead.

I need To break out of my mold. 
I need to break out of my body.
I need to break out of my life.
I need to break out of my soul.

I dream of flying
But my wings are torn
I hope for sunlight
But only black comes.

I hope For light.
But it is eaten by hatred.

I can not break this dream I call life
I can not shake this hold on my heart.
Some one safe my from the epitimy of my soul
Some one take me to the haven.

Tears of heartach flow down
My blood is as wine.
My body turned to bread.
Only the wine has turned sour
and the bread has gone moldy.

Hope fades......"
"eventtime","2005-08-08 15:19:00"
"url","http://tribalwarrior08.livejournal.com/8717.html"
"userid","16030"
"itemid","33"
"event","Slit wrists
Bleeding confessions

Its almost a dream world, I feel like im floating around dead looking down upon a world that is decaying and slowly molding. Death is all my weary eyes seems to see as of late. My dreams are getting more frequent...if you could call them dreams...nightmares seem to fit the discription a little better. It feels like my life is draining out of my veins. My soul is drying out. No matter how much water i take in i feel like im decomposing. I cant breath. Im suffocating in this body. i want to break free of my life no matter the cost. I need to feel again. Cutting makes me feel alive. watching my blood drip down my finger tips. Watching the non-existant life that i am living draining away. I need to live again. I need to feel again. No matter the cost. No matter what i do. I need to break free. These chains are becomming unbearable. I cant lift the weight any more. My body is weak. Death seems like the only out. I just want to get out of this. Break free from this. Someday.."
"eventtime","2005-07-19 22:13:00"
"url","http://tribalwarrior08.livejournal.com/8642.html"
"userid","16030"
"itemid","32"
"event","My head is all fucked up yet again. Gawd I should make a fucking show outta my life. I swear it would be a fucking hit. Lets see how Josh fucks up his life again. Gah. I just dont know what to do any more. Like seriously. Where am I going? What am I doing with myself? Im 19 AND IM FUCKING WASTING AWAY ON THIS FUCKING PLANET!!! My skin is dripping from my decaying bones. My eyes are burning with the sin of this life that we drive to destroy ourselves. My body is bleeding the blood that keeps life. I CANT TAKE IT!! WHAT THE FUCK!!! GEEEEEZ SOME ONE PUT ME OUT OF MY FUCKING MISSARY!!! I JUST NEED TO DIE!

Fuck it"
"eventtime","2005-06-07 00:29:00"
"url","http://tribalwarrior08.livejournal.com/8270.html"
"userid","16030"
"itemid","31"
"event","Somedays seem easier than the rest.
One breath is deeper than another.
One life is shorter than a dream.

My life seems to be torn appart right now. My dreams are fading and my hope is deminishing into dust. Where am I going? What am I doing? Im so lost, my heart is so black....I need to breath again..Im being suffocated...Life is ending yet beginning. All I want is to be free and be happy...maybe that simple dream is too much for the world that we live in today"
"eventtime","2005-05-30 01:55:00"
"url","http://tribalwarrior08.livejournal.com/7984.html"
"userid","16030"
"itemid","30"
"event","The Burning Soul Letting Of Lights Of The Heavens
Instant Weakness Burns Through A Tormented Soul
Free From The Depths Of The Oceans Black Cold Waters
Finaly A Dream Of A Hope Sprouted In A Hopeless Body
Anxiously Awaiting The Dream Of Tommorow
New Life Opens Through The Earth
Yearning For The Sun's Warmth On Cold Skin

Days Lead On Never Ending
Always Waiting For A New Tommorow To Come
Wanting To Hold The Life Of Dreams
Never Wanting To Be Left Cold and Alone Again

Begining Of Life
Ever Dream Of Hope
Revenge Never Comes
Going To Dream Of A New Tommorow"
"eventtime","2005-05-19 23:13:00"
"url","http://tribalwarrior08.livejournal.com/7870.html"
"userid","16030"
"itemid","29"
"event","Forgotten breath....dwelles on an empty soul, torn together by the high and low of every aspect.
Twisted mind altered by words of the unspoken, left with a feeling of bitter hope.
Torn appart by the immages of the past, shattered dreams, broken lives.
Shallow life lead by an even more shallow cacoon.
Empty of all light that one burned inside of a hope.
Where has this dream dissapeared to. Why.? 
Do I even bother dreaming of a hope.
Do I even wish for a life of dreams.
Foolish, hopes.
I want to go back, back to the day of dreams.
I want to fly back home to where I belong.
Mabey its in my hopes and dreams my soul emptys itself into an epitmy of lostness.
Take one more breath.......still noting....still just here...nothing more..noting less...
Do I hope to fullfill myself one moon from now.....one blue blue moon...
I shout my shallow voice thru the mountains once lived on
Please someone reach out to me....
Please someone refill my dreams....
I cant live this empty life any more...
I cant live this empty life any more...
Knowing there is more....
Dreaming about the more there is...
Please.....
I need...
A dream.
....."
"eventtime","2005-04-08 01:30:00"
"url","http://tribalwarrior08.livejournal.com/7463.html"
"userid","16030"
"itemid","28"
"event","Take one deep breath in and step out of your body to see whats real and whats not..
See where your life is taking you and where you want to go..then look at where you are...
Is this where you really wanna be...is this really wanna be what your doing..
Taking a life....the sad sorrow that follows...another lost soul..
The empty beats of a lifeless heart....
The shadows of the epidimy of a black soul....with eyes burning red with hate.."
"eventtime","2005-01-29 22:02:00"
"url","http://tribalwarrior08.livejournal.com/7208.html"
"userid","16030"
"itemid","27"
"event","To dream of a perfect world is beyond the wildest hopes of an inocent childs heart. I saw the pain the hurt the anger. I saw it all in a feeble hope to dream a dream. To hope a hopless hope. Whats the point. The world is full of death. Full of bleak trust. Death blanketed with a lost hope. My eyes bleed tears of wretched heart ach. What The FUCK!!!

WHY THE FUCK IS THERE SO MUCH HURT!! WHY THE FUCK TAKE ANOTHER BREATH!! WHY THE FUCK GO ON!! WHY!!

You see love fall in an instant. Break down and destroy a life. WHY THE FUCK TO I DESTROY THE ONES I HOLD CLOSE!! WHY THE FUCK DO I DO IT!! WHY DO I LOVE!! DO I LIVE TO LOVE AND KILL!! WHERE AM I GOING WHAT AM I DOING WHERE IS THE HOPE WHERE IS THE LOVE WHERE IS MY DREAM WHERE CAN I FEEL AT HOME!!!

why is it that my soul is so broken. Why is it that my life is so dead. My soul shattered my heart bleeding. I cant stand the heart ach. I dont want to feel the pain. I DONT WANT TO SEE THE TEARS! I DONT WANT TO FEEL ALL THE ACH!! I'VE HAD ENOUGH OF IT!! I'VE HAD ENOUGH OF THE BLACKENING HEARTS OF THE DEPRIVED LIVES!! WHAT THE FUCK ARE WE ALL FUCKING DOING!! THIS IS ALL FUCKING STUPID!! WERE ALL THROWING ARE FUCKING LIVES AWAY WRAPPED UP IN OUR OWN FUCK EPIDIMY! TIE IT ALL UP WITH A FUCKING BOW LOOK THERES A PRESENT TO GIVE OUR FUCKING KIDS! OUT OWN DEMISE!

I hate living the lie. I dont want to wake up to tommorow. I dont want to see another day of waste. Of a life gone. FUCK THIS!"
"eventtime","2005-01-21 03:38:00"
"url","http://tribalwarrior08.livejournal.com/6931.html"
"userid","16030"
"itemid","26"
"event","Meow"
"eventtime","2004-11-18 17:26:00"
"url","http://tribalwarrior08.livejournal.com/6797.html"
"userid","16030"
"itemid","25"
"event","Why am I haunted by these immages in my head....That dream...it wont go away....i remember it so clearly....i was watching like a computer screan and my vision just kinda morphed into it as if my eyes were the camera taping this. There was this mand in a green room i remember with either a green or brown carpet. A computer to one side and a brown book shelf on the other side full of text books of sum sort. He was sitting on a brown computer chair infront of his window. It was large. He was all taped up. Head to toe. Was at first struggling. I thought maybe he was like being attacked by someone. But then he satarted to push the chair out of the window. He managed to pull back and i saw his face. his eyes. It was a release...It hurt so bad...I heard screams as i heard the drop. but for some reason he just climbed back up into the window and then i woke up.... I hate my life"
"eventtime","2004-11-07 15:11:00"
"url","http://tribalwarrior08.livejournal.com/6610.html"
"userid","16030"
"itemid","24"
"event","All I have to say, is that I'm sick and tired of all this bull shit. Oh and the funnest thing is my name right now...

               o0 Suicide Pills: Their Magically Delicious 0o

     And to whoever has something to say about that, well you can put that in your pipe and smoke it .l..

     I feel like Im a fucking droid and I've had enough of this fucking shit I mean really. I don't want to live with this fucking shit any more. I mean I seriously would rather take a knife and cave a sweet design in myself than go on living this same retarded life, day by day the same old shit. Yah hey if I wanted to do that they hey I would become a fucking cow. Yay atleast I would have a release and I would make all the little kids happy by eating me at fucking Mc Donalds. Yay hey lets feed the fat kids. Were all going to be fucking blimps because yah lets fucking supersize it. Oh well I mean with Bush back in charge we might as well because when the world wars start up again were all going to be blown to fucking hell. I mean might as well plum ourselves up for the rats that are going to be eating our mortified bodies afterwards. I mean if were going to be happy they might as well be. It seems like the only lodgical thing to do.

     I think I need to get out of this place. Its really getting to me. I want to do someting with myself, but theres noting to do. Well I mean I could be out there gettin a trade or soemting but I dont know it doesnt float my boat. Gotta get out there do someting. Get into a punk band. Hit it off maybe go and travle the world. Or atleast get the fuck out of Kamloops. I think I would much rather do anyting else, rather than work here at Mc Dicks. Fuck I am really starting to hate it there. Im getting migranes left right and center. Fucking stress is going through the roof. Mmmm take a mental health leave. Or call in dead one day. Yah because Suicide Pills right. Maybe someday just to keep myself sane. HA! yes. There we go its my way to keep myself sane. Suicide pills allll the way. Well atleast I know I wont have to worry about makeing people happy anymore. I mean Fuck I am who i fucking am. If you dont fucking like it you can fucking just sit on your own fucking finger and rotate cauz im fucking me. I mean fuckidy fuck fuck fuck. Fuck fuck fuck fuck fuck fuck fuck fuck fuck fuck fuck fuck. And if you havent gotten the point yet FUCK FUCK FUCK FUCK FUCK. Stop expeceting me to be some fucking one that im not. im fucking me so stop thinking that im fucking going to be someone else. id you dont fucking like who i am then fucking leave becasue fuck i dont wanna fucking hear blah blah blah. i mean fuck this shit. I have better things to do then fucking being like oh you dont like who the fuck i am. and you fucking know what if no one fucking likes who the fuck i am then what the fuck ever. I've been alone my whole fucking life you think i really fucking care. I mean fuck that shit i'd rather be alone then life a fucking empty life fuck.

    Ahh that feels much better getting that shit off my fucking sholders. Wefh. I can all ready feel a bit better knowing that I said that. Now i just need to take a few suicide pills and life will be perfecto! Oh well what do you do. I will slowly find myself...hopefully. If not I'll just end it all. Make life easy on me and everyone around me lol. 

Ciao~"
"eventtime","2004-11-04 21:11:00"
"url","http://tribalwarrior08.livejournal.com/6172.html"
"userid","16030"
"itemid","23"
"event","Im curious as to the way life throws its self in many directions never actually choosing a path that you can take and know its the right one. I wish that I was able to see that golden path that led to where I am supose to go. I hate following a path that ends up in a dead end. Thou that is beggingin to sound like my life story. Its hard you know to follow down the way that you think is right. You put your heart into it then Bam. Shot down and you are left to pick your remains up off the ground and start over again. It can get to a person. And as hard as it is I also am thankful for how it is. I get to see life grow. See light bloom from within. My soul grows darker but at times for a faint second i am able to see that light that i once had within my soul. I know that life is worth living. I just need to do someting with it. Maybe I will do it. See new things meet new people. But maybe i wont get over my fear. I need to be strong. I need to find the strength within me. Find a hope that is locked away. Soon."
"eventtime","2004-10-29 23:35:00"
"current_moodid","43"
"url","http://tribalwarrior08.livejournal.com/5910.html"
"userid","16030"
"itemid","22"
"event","~ ""Off in the distance another day ends with a wonderous explosion
Colours are being shot throught the magnificant sky.
Clouds are set on fire with a wonderous glow of colours.
Changing into wonderous spectrums for the eye.
Our hearts melt at the sight of this wonderful experience
 
The fires of colour calm their fury and all that is left
Is the blackness of another day that has come to an end.
The darkness of the covers the land and hides it from the world
And when it seems all hope is lost the magnificant glow of the
Moon burns into our hearts and reminds us that another day is comming.
 
The darkness of the night seems to drag on for an eternity
It feels like the dawning of a new day shal never come again.
Then a burst of light shoots up from the horizon.
Our hearts wake up again and are ready for a new day."" ~



Now that I come to think about it I wonder if I ever named this poem. But if I were to name it now I would have to call it life. To think that poem is probably 2 if not 3 years old. Wow not to gloat but I did fairly well for a 15 or 16 year old. Now all that comes to mind is agony of another broken soul. Hrm I wonder what I can come up with on the spot...




Far from home, burried in a hole over flowing with the tears of tommorow.
A family broken for the profit of the world.
An empty soul smiles beliving that it is fulfilled.


hrm for somereason i dont think a poem is what i need to do right now too many thoughts to try and put it into poetic form....lets do some writing..dont mind the pain that i am about to exude.


Take a look around. What do you see. I mean really close your eyes tight see noting think of noting just close your eyes and open them. What is really there. You see the same thing that is shown to you every day but at the same time for a split second it all seems new. I see people from my window walking around outside. I see everyone from base ball players to drug deals to little children comming home from school..all just in front of my house. I see a sientist, I see a new child born, I see pain I see anger. I see the death of a loved one through eyes of unspeakable hurt. Yet. At the sametime i see noting. My eyes are able to see but i am blind. Thou not fully. I can see where life is. Unfortunatly it is painful. Almost a curse. I wish I didnt have to see the world as it truly is. Why do we have to live in the media. Why do we have to want what we cant be. We are no less people because we are not on tv. Some of the best people out there live in a small town just serving coffee. Seeing the same people every day and finding out that their son just turned 8 and all is right in the world with them. If it was only that easy. If only we could live such lives. But the majority live lives of hope that is un reachable. The stars have not been set around for what they want. They were not ment to do that. Yet out of spite they reach knowing they are only going to disapoint themselves. I belive in dreams. I belive in goals. I think that if you want someting that you will get it. But you have to understand why i contradict myself. The people that want their dreams will recive them. What I'm saying is that the people that just want their dreams and know they cant have them arent going to have them because they dont work hard enough for them. I belive that everything is possible. But you have to sacrafice for those dreams. You cant live a life that you want these days. I live day to day. I dont expect anyting becasue when someting comes along it is the most amazing thing. 

I have to sometimes re evaluate my situation. Decide why I bother to take another breath. Its harsh when the out come is because my body wont allow me to stop breathing. But I move along with the flow and push my way as to where I am supose to be. Its hard thou sometimes for me. The whole not knowing. I feel like im wrapped in a prision cell. My lungs arent able to breath and all that I am used for is just another person for mosters to suck the life out of...helpless. It almost feels like my naked body is exposed to the world and it is deformed. I am being pointed at and people run away screaming. I feel like some hedious creature mutated into who in heaven knows what. Arms growing out of me. My face massacared. My body all twisted and horrified. I am put to death because of who i look like. A horrible beast. There is no point to living right. I walk around and look at the world wishing that this is all a dream and i would wake up not having to live such a horrible nightmare again. But I wake up every day to the same nightmare. Only a few things are worth living for in life. And even at that sometimes the things that are worth living for are hard to live for. My soul feels like its burning up. Its becomming hollow from the inside eating its way out of my body. I am becomming numb not wanting to feel another pain. Why it that I destoy myself so. I need to get out of this prision. I need to breath. I need to feel. I need to live. Please someone help me to fly again with my broken wings. My tears are slowly drowning me I need to get out of this body and fly again. It is broken, twisted, shattered. Let me live again. Let me hope again. Let me love again."
"eventtime","2004-10-29 01:32:00"
"current_moodid","73"
"url","http://tribalwarrior08.livejournal.com/5813.html"
"userid","16030"
"itemid","21"
