"names","values"
"event","stuff happens and happens some more
things fall down and don't get put together
my relationship with my mother is in shambles now
i honestly think she's turning crazy
a lot of stress at the present
but i don't know
me and my bro are going on a cruise on sat
she's known about it for months
but it's only in the past week that she's put on the guilt trips to really want to go
and oh what guilt trips
the crying
i've done so much for you and you hate me
how could you not want me to go
i bow in at the crying
but she's not going because of my bro
he won't say he wants her to go
she calls him evil
but last time it was terrible
it was like we were policed
but i'm not a criminal

as the peacemaker as always i try and make amends
then say stupid things
the guilt gets to a point where you want her to go
because you know how miserable it'll be once we're back
i really won't mind if they went i think
but i won't find out because as of now they're not
one day could change that
i just don't care one way or the other anymore
no matter what it'll be miserable"
"eventtime","2004-07-09 00:45:00"
"url","http://tsbasizzle.livejournal.com/45262.html"
"userid","16091"
"itemid","175"
"event","what's with the naked old men who walk around the gym locker room
shave naked
talk naked
all running around
put a towel on or something
underwear...anything
fat people
all saggy
i really don't get it
would it be such an inconvenience to put on a towel
i think it takes more effort to walk around naked than with clothes
what age is it that you say i just don't care anymore
yuk
leaning over the sink shaving with your bits and pieces on the counter
EEEWWWWWWW!!!"
"eventtime","2004-06-08 09:30:00"
"url","http://tsbasizzle.livejournal.com/44906.html"
"userid","16091"
"itemid","174"
"event","aSBzaG91bGQganVzdCBkbyB3aGF0IG15IGZhdGhlciBkb2VzDQppdOKAmXMgaW4gZGVtYW5kDQppIGtub3cgaeKAmWQgYmUgZ29vZCBhdCBpdA0KeW91IGNhbiBtYWtlIGEgYm9hdCBsb2FkIG9mIG1vbmV5DQpidXQgaeKAmW0gZmFyIHRvIGFtYml0aW91cyBmb3IgdGhhdCAoaW4gYSBzYXJjYXN0aWMgbGlrZSBtYW5uZXIpDQoyIGluc3RlYWQgb2YgNA0KaGFwcHkgaW5zdGVhZCBvZiBtaXNlcmFibGUNCmJvcmluZyBpbnN0ZWFkIG9mIGp1c3QgYXMgYm9yaW5nDQp0aGUgd29yc3QgcXVhbGl0eSBpIGhhdmUgaXMgY29uZm9ybWl0eQ0KaWYgdGhhdCBjYW4gYmUgY29uc2lkZXJlZCBhIHF1YWxpdHkNCml0cyBtb3JlIG5hdHVyZSBvciBzdGF0ZSB0aGF0IHlvdXIgaW4NCmJ1dCB0aGUgYW5zd2VyIGlzbuKAmXQgbm9uY29uZm9ybWl0eQ0KaXTigJlzIGp1c3QgZG9u4oCZdCBhbHdheXMgZG8gd2hhdCBldmVyeW9uZSBleHBlY3RzIHlvdSB0byBkbw0Kd2hhdCB0aGV5IHRoaW5rIGlzIHJlYWwgYW5kIGhhcHB5IGlzIG5vdCB0aGUgc2FtZSBmb3IgeW91DQppZiBpIGhhZCBqdXN0IGZvdW5kIHRoZSBtaWRkbGUgZ3JvdW5kIGJldHdlZW4gbXkgb3Bwb3NpdGUgYSBmZXcgeWVhcnMgYWdvDQpub3QgdGhhdCBsaWZlIHdvdWxkIGJlIGJldHRlcg0KYnV0IGl04oCZZCBiZSBhIHdob2xlIGxvdCBlYXNpZXINCg0KaSBoYXZlIG5vdGhpbmcgc2lnbmlmaWNhbnQgdG8gc2F5DQpub3QgdGhhdCBpIGV2ZXIgZG8NCmJ1dCBpJ2QgbG92ZSB0byBhYmxlIHRvIHdyaXRlDQpqdXN0IHNpdCBsb29rIGFuZCB0aGUgZmV3IHN0YXJzIHdlIGhhdmUgYW5kIHdyaXRlDQpldmVyeSB3ZWVrIGknbSB3cml0aW5nIHRhbGtzDQp5ZXN0ZXJkYXkgaSBoYWQgdHdvDQpzbyB0aGF0IHRvb2sgYWxsIGRheQ0KYnV0IGl0IHdhcyB3b3J0aCBpdCBiZWNhdXNlIHRoZXkgdHVybmVkIG91dCBnb29kDQpicmluZGxlIGJlYXIgdGVsbGluZyB0aGUgdGltZQ0KdGVhcg0KaSB3aXNoIGkgY291bGQgc2l0IG9uIG15IGZhdGhlcidzIGxhcCBhZ2FpbiBzbyBoZSBjb3VsZCByZWFkIGl0IHRvIG1lDQp0aGUgZGlmZmVyZW50IHZvaWNlcw0KY2hlZXJpbw0KaSdsbCB0aGluayBvZiBzb21ldGhpbmc="
"eventtime","2004-06-04 14:51:00"
"url","http://tsbasizzle.livejournal.com/44606.html"
"userid","16091"
"itemid","173"
"event","i'm not going shopping after the meeting anymore
if you're in a suit a bunch of people ask do you work here
it happened like 10 times yesterday
instead of saying no to ""can you help me?""
i should have been like no but you can help with your number
hehe
that would have been funny

sneeze
what are you allergic to me
best new line instead of god bless you"
"eventtime","2004-05-17 10:21:00"
"url","http://tsbasizzle.livejournal.com/44289.html"
"userid","16091"
"itemid","172"
"event","new screen name
timmyh8scchz"
"eventtime","2004-05-12 11:58:00"
"url","http://tsbasizzle.livejournal.com/44270.html"
"userid","16091"
"itemid","171"
"event","so its all done
tear
tear
i am back in the living world
after a few days straight of sleep of course
over the past 2 weeks i've gotten maybe 24 hours of sleep
my bed is calling me and i can't resist
it was such a tempter
now i'll let go and give in
i haven't done anything but work in the last month
neglected friends
the past few weeks neglected meetings
i have talks coming up 3 weeks in a row
and then i'm writing a public talk
so it doesn't stop does it
they'll always be something to do


time to rejuvenate and get some feeling back
i haven't had fun in a few weeks
i miss it"
"eventtime","2004-05-12 11:47:00"
"url","http://tsbasizzle.livejournal.com/43903.html"
"userid","16091"
"itemid","170"
"event","i can't schmooze anymore
soooo out of practice
i just tried
a nervous mess
it worked
but i felt so awkward
i practically offered a bribe to the guy
he said fine and i just kept coming with excuses
it was already cool
but i was not
and now that i look back
i think i even said some insulting things
he's irish and i kept talking about drinking
implying that he's a big drinker
but i can't be like that when i don't really know the person
what the hell am i doing
i could take a B and turn it into an A
or be able to hand in something a month late
i had history, was loved
now its as if i fear them
it takes some pressure off
i wish someone else can take the other burdens"
"eventtime","2004-05-03 13:36:00"
"url","http://tsbasizzle.livejournal.com/43624.html"
"userid","16091"
"itemid","169"
"event","so i'm actually considering it
a whole year extra
i have a scholarship so money isn't holding me back
it's a master's degree
i'd be guaranteed at least 60 grand coming out
i would never have to go back to school
but then there's always the negatives
another year of school
i was really looking forward to being half done
if i make it five years its like going through high school all over again
i'll get out when i'm 23
only 2 years to live
every girl worth getting is already taken
and you're not suppose to date unless your ready for marriage
and w/out a job...you're not ready for marriage
another year in this school means 2 years of aging
i'm tired of papers and homework
i've had enough for a few lifetimes
for kicks i looked at the princeton review describing my school
comments: people lose sleep and have a hell of a lot of work to do
i should have read that before i came here
another year that i'm unhappy
i hadn't planned to go 5 years
i hope my cash doesn't run out if i do go
my whole life i saved a good amount of money
but its amazing all the years you save and then how fast you go through it
and will it really be that much of an advantage in getting a job
and will i make that much more money with a masters
or is a year of experience better
how much more will i really learn in one year
aren't i sick of school already
why would i even consider going another year
why am i even thinking about this now when i have so much work to do in the week and half left
and won't i be winning 10 million dollars this summer so i don't have to worry about this"
"eventtime","2004-05-03 10:54:00"
"url","http://tsbasizzle.livejournal.com/43338.html"
"userid","16091"
"itemid","168"
"event","i should have gone to the art school
the only thing that's holding me back is the fact that i'm not an artist which you would kind of need since the art school is the hardest school to get into in the country
but they're always doing much more interesting things 
every week they paint the lobby and do something new
now all the windows are blacked out and they put a new wall with a mural being painted
we make robots and models of robots and design structures
i've got to get out of here
i think i've repeated that phrase so many times
but i never follow through
maybe i'll just fail
that way i don't have to decide if i want to stay or not"
"eventtime","2004-04-28 13:38:00"
"url","http://tsbasizzle.livejournal.com/43226.html"
"userid","16091"
