"names","values"
"itemid","51"
"event","Mummy...Johnny brought a gun to school
He told his friends that it was cool
And when he pulled the trigger back
It shot with a great crack
Mummy I was a good girl
I did what I was told
I went to school, I got straight A's, I even got the gold
But mummy when I went to school that day, I never said goodbye
I'm sorry mummy I had to go, but mommy please don't cry
When Johnny shot the gun he hit me and another
And all because he got the gun from his older brother
Mummy please tell daddy that I love him very much
And please tell Chris, my boyfriend, that it wasn't just a crush
And tell my little sister that she is the only one now
And tell my dear sweet grandmother that I'll be waiting for her now
And tell my wonderful friends that they were always the best
Mummy I'm not the first I'm no better than the rest
Mummy tell my teachers I won't show up for class
And never to forget this and please don't let this pass
Mummy why'd it have to be me no one deserves this
Mummy warn the others, mummy I left without a kiss
And mummy tell the doctors I know they really did try
I think I even saw a doctor trying not to cry
Mummy I'm slowly dying with a bullet in my chest
But mummy please remember I'm in heaven with the rest
Mummy I ran as fast as I could when I heard that crack
Mummy listen to me if you would
I wanted to go to college
I wanted to try things that were new
I guess I'm not going with daddy
On that trip to the new zoo
I wanted to get married
I wanted to have a kid
I wanted to be an actress
Mummy I wanted to live
But mummy I must go now
The time is getting late
Mummy tell my Chris
I'm sorry but I had to cancel the date
I love you mummy I always have
I know you know it's true
Mummy all I wanted to say is ""mummy I love you""
In memory of the Columbian students that were lost
Please if you would
Pass this around
I'd be happy if you could
Don't smash this on the ground
If you pass this on
Maybe people will cry
Just keep this in heart
For the people that didn't get to say ""goodbye"""
"eventtime","2009-10-26 23:23:00"
"current_moodid","81"
"url","http://whitechaos.livejournal.com/13210.html"
"userid","16796"
"itemid","50"
"event","My dog died today....."
"eventtime","2009-01-26 19:57:00"
"url","http://whitechaos.livejournal.com/12912.html"
"userid","16796"
"itemid","49"
"event","<div style=""width:170px;height:405px;overflow:hidden;background:black url(&#39;http://www.pcavote.com/pca/widgets/showvoting/mini_widget_bg.jpg&#39;) top left no-repeat;""><div style=""display:block;""><img src=""http://www.pcavote.com/pca/widgets/showvoting/widget_hdr_01.gif"" border=""0"" height=""41px"" width=""171px"" alt=""People&#39;s Choice Awards"" style=""border:0;margin:0;padding:0;"" /></div><div style=""display:block;height:296px;padding:8px 5px 5px;""><lj-embed id=""1""/></div><div style=""display:block;""><a href=""http://www.pcavote.com/pca/votenow.jsp?pollId=800025&amp;ev=cl&amp;utm_source=blog&amp;utm_medium=mysp2widget""><img src=""http://www.pcavote.com/pca/widgets/showvoting/showVoting08.gif"" border=""0"" alt=""Go to PCAVote.com"" style=""border:0;margin:0;padding:0;"" /></a></div></div>"
"eventtime","2008-12-04 10:29:00"
"url","http://whitechaos.livejournal.com/12686.html"
"userid","16796"
"itemid","47"
"event","If you hate child abusing, copy this into your profile:

My name is Sarah
I am but three,
My eyes are swollen
I cannot see
I must be stupid
I must be bad,
What else could have made
My daddy so mad?
I wish I were better
I wish I weren't ugly,
Then maybe my mommy
Would still want to hug me.
I can't speak at all
I can't do a wrong
Or else I'm locked up
All the day long
When I awake I'm all alone
The house is dark
My folks aren't home.
When my mommy does come
I'll try and be nice,
So maybe I'll get just
One whipping tonight
Don't make a sound!
I just heard a car
My daddy is back
From Charlie's Bar.
I hear him curse
My name he calls
I press myself
Against the wall.
I try and hide
From his evil eyes
I'm so afraid now
I'm starting to cry.
He finds me weeping
He shouts ugly words,
He says it's my fault
That he suffers at work.
He slaps me and hits me
And yells at me more,
I finally get free
And I run for the door.
He's already locked it
And I start to bawl,
He takes me and throws me
Against the hard wall.
I fall to the floor
With my bones nearly broken,
And my daddy continues
With more bad words spoken.
""I'm sorry,"" I scream
But it's now much too late
His face has been twisted
Into unimaginable hate.
The hurt and the pain
Again and again
Oh, please God, have mercy!
Oh please let it end!
And he finally stops
And heads for the door
While I lay there motionless
Sprawled on the floor.
My name is Sarah
And I am but three,
Tonight my daddy,
Murdered me."
"eventtime","2008-04-06 13:32:00"
"current_moodid","56"
"url","http://whitechaos.livejournal.com/12147.html"
"userid","16796"
"itemid","46"
"event","Aaaarrrrrggghhhhhhh!!!!!!!!!!!!!!!!!!!!!!!!!!!!!!!!!!!!!!!!!!!!!!!!!!!!!!!!!!!!!! DAMN YOU!!!!!!!!!!!!!"
"eventtime","2008-02-16 21:05:00"
"current_moodid","19"
"url","http://whitechaos.livejournal.com/11904.html"
"userid","16796"
"itemid","43"
"event","Explain this before hand because it makes more sense that way:
Requiem means Mass (or song) for the dead


Red, such a dangerous color
Is now a hazy mist before my eyes
Blocking all of my senses
I can literally feel my mind crumble
It started out as nothing but a dull ache in my head
As I watched you spilling silent tears
...I was worried about you
Of course I was...
You just told me that you wouldn't mind dieing
That you would take me with you
What would you do if someone you loved said that to you?
You've no idea?
Not many do...
I too had no idea as to what to do
So I let go, I let my emotions take control
Who knew that would be such a bad thing to do?
That intoxicating red haze grew
It filled my mind
My throat
My eyes
I put my hand to my mouth as a choking sound emitted
You thought I was crying
...How cute...
The person I thought I had always loved
I found that I really only despised
For some reason...
I found this funny
HOW IRONIC!
The very person I had slaved away over
Just to make sure she was HAPPY!
She wanted to die
he he he he HA HA HA...
The laughter rang throughout the room 
Echoing in your ears
Rattling you brain
Bringing a shiver to your spine
And a chill to your heart
I hated you 
Oh god!...how I hated you
Your tears no longer meant anything to me
I was crying too
But they were the type of tears that appeared
when you laughed too hard
I left you there
My laughter trailing behind me 
leaving the room with a vile feel to it
The last thing I saw of you
was the horrified look on your face
That made me laugh even harder if 
it was even possible
As I continued on my way to nowhere
Or maybe it was to hell
I don't really know...
I thought this of you
...How insignificant
Go ahead and die little one
Let my laughter be your requiem"
"eventtime","2007-09-18 10:42:00"
"current_moodid","106"
"url","http://whitechaos.livejournal.com/11036.html"
"userid","16796"
"itemid","41"
"event","table width=350 align=center border=0 cellspacing=0 cellpadding=2><tr><td bgcolor=""#999999"" align=center><font face=""Georgia, Times New Roman, Times, serif"" style='color:black; font-size: 14pt;'><b>Your Eyes Should Be Violet</b></font></td></tr><tr><td bgcolor=""#CCCCCC""><center><img src=""http://images.blogthings.com/whatcolorshouldyoureyesbequiz/violet.jpg"" height=""100"" width=""100""></center><font color=""#000000"">
Your eyes reflect: Mystery and allure

What's hidden behind your eyes: A quiet passion</font></td></tr></table><div align=""center""><a href=""http://www.blogthings.com/whatcolorshouldyoureyesbequiz/"">What Color Should Your Eyes Be?</a></div>"
"eventtime","2007-08-20 15:57:00"
"current_moodid","64"
"url","http://whitechaos.livejournal.com/10696.html"
"userid","16796"
"itemid","40"
"event","<table width=350 align=center border=0 cellspacing=0 cellpadding=2><tr><td bgcolor=""#EEEEEE"" align=center><font face=""Georgia, Times New Roman, Times, serif"" style='color:black; font-size: 14pt;'><b>You Are a Cappuccino</b></font></td></tr><tr><td bgcolor=""#FFFFFF""><center><img src=""http://images.blogthings.com/whatkindofcoffeegirlareyouquiz/cappuccino.jpg"" height=""100"" width=""100""></center><font color=""#000000"">
You're fun, outgoing, and you love to try anything new.
However, you tend to have strong opinions on what you like.
You are a total girly girly at heart - and prefer your coffee with good conversation.
You're the type that seems complex to outsiders, but in reality, you are easy to please</font></td></tr></table><div align=""center""><a href=""http://www.blogthings.com/whatkindofcoffeegirlareyouquiz/"">What Kind of Coffee Girl Are You?</a></div>"
"eventtime","2007-08-20 15:51:00"
"current_moodid","64"
"url","http://whitechaos.livejournal.com/10286.html"
"userid","16796"
"itemid","38"
"event","Rose Garden

The reason why the roses grow
To hide the dead down below
Their blood was spilled
They halt the flow
The screams they shrill
They muffle their bellow
Their sunken eyes, unseeing, unreal
Are taken by their earthly glow
Their flaccid bodies thoroughly tilled
Feed the eternal red velvet rose
And so now you know
Why they grow
They grow to hide
What's six below"
"eventtime","2007-08-19 03:09:00"
"current_moodid","92"
"url","http://whitechaos.livejournal.com/9903.html"
"userid","16796"
"itemid","37"
"event","<table width=350 align=center border=0 cellspacing=0 cellpadding=2><tr><td bgcolor=""#EEEEEE"" align=center><font face=""Georgia, Times New Roman, Times, serif"" style='color:black; font-size: 14pt;'><b>You Are Beef</b></font></td></tr><tr><td bgcolor=""#FFFFFF""><center><img src=""http://images.blogthings.com/whatkindofmeatareyouquiz/beef.jpg"" height=""100"" width=""100""></center><font color=""#000000"">
You're big, burly, and maybe even a little stinky. And no one's going to come between you and a good steak.
And you've probably never met a vegetable you like, unless fries and ketchup count.</font></td></tr></table><div align=""center""><a href=""http://www.blogthings.com/whatkindofmeatareyouquiz/"">What Kind of Meat Are You?</a></div>"
"eventtime","2007-08-01 00:25:00"
"url","http://whitechaos.livejournal.com/9700.html"
"userid","16796"
"itemid","36"
"event","<table width=350 align=center border=0 cellspacing=0 cellpadding=2><tr><td bgcolor=""#E6E6FA"" align=center><font face=""Georgia, Times New Roman, Times, serif"" style='color:black; font-size: 14pt;'><b>Your Birthdate: February 17</b></font></td></tr><tr><td bgcolor=""#F2F2FB""><center><img src=""http://images.blogthings.com/whatdoesyourbirthdatemeanquiz/birthday.jpg"" height=""100"" width=""100""></center><font color=""#000000"">
You tend to find yourself lucky - both in business and in life.
And while being wealthy is nice, you enjoy sharing your abundance with others.
You put your luck to good use: you are very ambitious and goal oriented.
Often times, you get over excited and take on more than you can manage.

Your strength: Your ability to make your own luck

Your weakness: Thinking you can do it all

Your power color: Bronze

Your power symbol: Half Moon

Your power month: August</font></td></tr></table><div align=""center""><a href=""http://www.blogthings.com/whatdoesyourbirthdatemeanquiz/"">What Does Your Birth Date Mean?</a></div>"
"eventtime","2007-07-31 23:09:00"
"current_moodid","56"
"url","http://whitechaos.livejournal.com/9318.html"
"userid","16796"
"itemid","29"
"event","A/N: This is really me just trying out something, so don't let this throw you or anything.

All Over Again

Why? What is it that makes it so damn hard?
Why can't I just call him and say ""Dad, I hate you!"" 
I can say that right now, why can't I say it to you?
I mean I can't even write a letter telling you that.
I'M ANGRY AND I CAN'T DO ANYTHING!!!
I mean you left. Left...just like that. 
The last time I saw you....damn it,
it was from me happening to see you outside the car window.
That's right, happening, as in by pure chance. No warning. 
Now if I was being rational right now I would be thinking, 
""How would you tell your four year old daughter that you
were divorced now and you had to leave."" 
Then my irrational side would say, 
""If you loved me you would have stayed. 
Not smiled and waved like everything was gonna be okay."" 
You know what I remember that day so well. 
You know, I remember whispering in my head 
""...wait,....don't leave me..please..."" 
Now you're getting remarried. 
That wasn't so bad. 
I mean I know you told me her name like 
five times already and I keep forgetting. 
I know you might be just a tad angry at that, 
but you know...did you ever think that 
I don't want to remember her STUPID NAME?!?! 
DID YOU THINK ABOUT THAT?! 
WHAT...what if I wanted to forget? 
What if I wanted to you to know
...to understand JUST how much I suffered? 
How my family suffered, which by the way, 
I no longer include you as a part of. 
Like I said it wasn't so bad,
...until you talked about having kids. 
You said something about me might having to be a big sister. 
My world blew apart. 
Right then. 
All the fuck over again."
"eventtime","2006-11-27 01:52:00"
"current_moodid","101"
"url","http://whitechaos.livejournal.com/7673.html"
"userid","16796"
"itemid","27"
"event","Your Voice
The voices of those around me
Every voice is so different
There is so much color and 
sound that makes up one voice alone.
The color of a voice can range
from green to gray
It can make you feel like you're looking 
at the first snow against a blue winter sky
You could see a fire engulfing everything in
it's path, to caress 
everything it catches with pain
So much pain...
But with your voice 
I see the color of gentle bronze
That matches your eyes so perfectly
So much so that I don't know whether I'm
lost within the swimming depths of your eyes
or drunk off of the sweet sound of your voice
The combination confuses me so that 
I can't tell up from down
The only reason why I'm still standing
Is because you're still holding me up 
And the sound, oh the sound of your voice
It's so different...
A voice can sound like thunder 
or the tiniest bell
It can sound like a playful breeze 
playing among the branches of trees
Like a child's laughter
Or woman's scream
Listening to yours makes 
me feel like I'm in a dream
A dream that I don't want to escape
That traps me, makes me feel safe.
And as long as you speak 
those sweet nothings in my ear
I'll have to thrust my heart 
into your hands to steer.
I'm like your puppet attached 
to those little strings
Wondering exactly what 
the next act will bring
And so this evening closes 
with a last saying from you
""If nothing lasts forever, 
and if this saying is true,
let me be your nothing,
let me be your groom."""
"eventtime","2006-11-07 20:33:00"
"current_moodid","107"
"url","http://whitechaos.livejournal.com/6933.html"
"userid","16796"
"itemid","24"
"event","The Soliloquy Of 'Some of Us'


I realized something today.
I'm envious.
I'm angry.
And I'm tired.
But most of all...I'm selfish.
You know how I figured that one out?
I was thinking to myself how lucky some people are
And how they never seem to realize it.
Because you know...there are some of us
that don't look handsome smiling.
We don't look beautiful when we cry.
Some of us won't get to experience love
from that certain someone.
We're not gonna look good no matter how long
we stand in front of our mirrors.
Some of us aren't gonna get that 'I'm-checking-you-out' once over from a pretty girl.
Some of us aren't gonna have some guy walk up to us, 
look us straight in the eyes, and say so sincerely
""You're beautiful.""
We're not gonna get it. 
And I'm sure this happens to both boys and girls.
Did you know that it feels good when someone actually notices that you are in fact a girl or a guy?
It feels relieving, or it would,... if it ever happened.
Know what else?
Some of us don't have talent.
We aren't going to get a moment of recognition.
No ones gonna say ""Wow, that was incredible!"" and then mean it.
You know what they're gonna say?
""Good Job."" 
All the while thinking 'What a waste of time.'
When that happens some of us feel like all we're doing
is taking up space and air.
We don't ever feel like we did something worthy of 
notice.
And you know what?
You'd think we brains to fall back on.
Well we were told just like you I'm sure,
""If you put your mind to it, you can become anything you want to be.""
That's a load of bull if I ever heard one.
Did you notice?
Did you see?
When some of us put all our minds, our souls, and hearts, into something we still fall short?
Do you know how much it hurts to have studied for 
something all night and then someone says to you
I just read it.
Or maybe they said, I just took notes,
Or my personal favorite, I just listened.
And then while you're sitting over there with a C
that you studied all night for,
and they have an A
do you know how much that hurts?
Do you know how it feels when it seems like no matter what you do, you're just falling behind?
This really does happen to some of us.
Some of us are so unlucky that we
have to deal with all of it.
You must be wondering,
""What does this have to do with 
you being selfish now?""
Well, as soon I thought all of this, 
I realized that I too was fortunate.
I was rich with family and friends.
...Of course there were those thoughts.
You know, (or maybe you don't)... those thoughts 
that say to you ""I wonder if all those times 
your friends said jokingly 
""Man, you are so stupid,"" 
were really just said in jest, or if they had a ring of truth?
And what about your parents? Do they really care about you 
or are they saying ""I love you"" over and over 
not only to convince you, but also themselves?
Of course we always bypass those thoughts,
because that's all we've got.
Do you want to know how you can recognize one of us?
You'll know us by our masks which show only our eyes
made beautiful with our tears; 
the current style for us...
is the never ending smile,
while inside we're whispering so desperately:
""Save me"" 
So be on the look out.
Who knows,...maybe you can rescue some of us...
We need it..."
"eventtime","2006-09-07 21:58:00"
"current_moodid","9"
"url","http://whitechaos.livejournal.com/6213.html"
"userid","16796"
"itemid","22"
"event","Guess what!!!! Yesterday I met someone that works for Tokyo-pop! I know i make like I'm excited, but it wasn't as big as I'm making it out to be. It was okay really, it was kinda cool. He was nice, but nothing really happened. I did, however learn that the new Fruits Basket Manga will be out within the month.  That was worthy of a WEEEE!!!"
"eventtime","2006-06-30 14:06:00"
"current_moodid","15"
"url","http://whitechaos.livejournal.com/5696.html"
"userid","16796"
"itemid","21"
