"names","values"
"event","know what to do. I'm so fucking confused right now... I'm totally in love with her... and she really doesn't get it. And she's in love with someone else... is this more karma or that I just didn't move fast enough? Daniel was right... at least I got a small chance to make amazing memories with her. And I'm thankful for that. But I'm seriously hoping for a chance one day. I'm counting on it..

But right now I honestly feel like I need rachel.. but I don't know how to go about that. I'm not able to just come out and tell her how I feel.... I'll admit that I'm scared shitless... mostly of rehjection but also that I'll have to tell myself it's time to give up. 

But then there's Emma... and a part of me does have feelings for her. And if only someone or she could help herself.. she needs to get that it's not a sin and accept herself.... but I don't know how to help her with that... except show her the way that I live and love my lifestyle... 

I'm still freaked out at times about the whole sexuality and stuff... but whatever... I know who I am. It took me too long to accept that to try and go back now."
"eventtime","2007-12-05 14:10:00"
"current_moodid","22"
"url","http://x-pixieness-x.livejournal.com/20110.html"
"userid","17046"
"itemid","77"
"event","are so fucking crazy...  you gotta read this shit...

We might feel like ""Alice in Wonderland,"" for unusual things continue to happen for the next day or two. Interactions with others become a bit strained; the passionate Scorpio Sun requires the depth of emotional intensity while the clever Gemini Moon needs to stay closer to the surface. Fiery Mars forms an uncomfortable quincunx with wounded Chiron, challenging us to move past our fears instead of frittering away an opportunity for intimacy.

first, things are getting totally weird. Not only with life and things going on, but with me. and out of no where last night around almost one in the morning, I was at a party.. and out of no where, I couldn't take being with people. Just because it was work.. I had to strain myself to talk to them or anything... for the last while that I was there I sat in the living room where no one was on the phone to my friend...Emotional intensity? I'm feeling more lately.. I'm more letting myself somewhat get hurt.......challenging us to move past our fears instead of frittering away an opportunity for intimacy........ I'm done running away from things... I want to talk to Rachel.. I want her to know what's up. 

Now another one...well, it's from the same place, they kinda go together..

You may not be able to relax enough today to feel fully at ease. You can sense that something big is coming down the path, but you cannot possibly know how to respond until you know exactly what it is. Don't push for a solution; clarity will return in time and you'll be able to take definitive action. 

And I also got like a tarot reading or something last night.. and I'm supposed to have someone new coming into my life soon... most likely someone I don't know at all, but it could be someone that I already know that will try and get closer to me... and they will be very smart, and helpful.. and just great. And they will be a very big thing to me.. but I have to watch out, because especially if it's someone that I know at all already, they will be very strog witted and cunning.. and wont try to do good things at all...
And I'm very excited about this. Not the bad things part.. just someone new comeing into my life.. I could use a change right now before I go fucking insane... 

yeah.. I guess that's about it right now. Everything else in my head is too scattered up to find words for any of it."
"eventtime","2007-10-28 12:55:00"
"current_moodid","84"
"url","http://x-pixieness-x.livejournal.com/19760.html"
"userid","17046"
"itemid","76"
"event","Oh, oh, oh, oh
For the longest time
Oh, oh, oh, oh 
For the longest time
If you said goodbye to me tonight
There would still be music left to write
What else could I do
I'm so inspired by you
That hasn't happened for the longest time

Once I thought my innocence was gone
Now I know that happiness goes on
That's where you found me
When you put your arms around me
I haven't been there for the longest time

Oh, oh, oh, oh
For the longest time
Oh, oh, oh, oh
For the longest
I'm that voice you're hearing in the hall
And the greatest miracle of all
Is how I need you
And how you needed me too
That hasn't happened for the longest time

Maybe this won't last very long
But you feel so right
And I could be wrong
Maybe I've been hoping too hard
But I've gone this far
And it's more than I hoped for

Who knows how much further we'll go on
Maybe I'll be sorry when you're gone
I'll take my chances
I forgot how nice romance is
I haven't been there for the longest time

I had second thoughts at the start
I said to myself
Hold on to your heart
Now I know the woman that you are
You're wonderful so far
And it's more than I hoped for

I don't care what consequence it brings
I have been a fool for lesser things
I want you so bad
I think you ought to know that
I intend to hold you for the longest time

Oh Oh Oh Oh 
For the longest time
Oh Oh Oh Oh
For the longest time
Oh Oh Oh Oh
For the longest time
(Fade out)"
"eventtime","2007-10-17 23:29:00"
"current_moodid","4"
"url","http://x-pixieness-x.livejournal.com/19689.html"
"userid","17046"
"itemid","75"
"event","Everything has gotten so crazy... Out of no where I have no feelings for Ani anymore... not at all. Like absolutely none... which is weird. Cuz I always have. 

I don't think I'mr eady for a relationship... like I think I even was like a couple weeks ago. But now, enotionally I don't think I could take it. And for once in a really long time I want one. I like her... I really really like her. And I miss her... already.... She's so... I don't even know. 

I cut myself... because I needed to cry... but it didn't help. I thought it might make me like it always did... this time though I just laughed at myself and realized how pathetic I was freaking out over nothing.

And yeah... I don't have much else to say right now..."
"eventtime","2007-10-04 17:42:00"
"current_moodid","14"
"url","http://x-pixieness-x.livejournal.com/19251.html"
"userid","17046"
"itemid","74"
"event","I saw you with your new friends
You wear them so well
Broken shoes and loose ends
Gee you look swell
Me I'm drinking too much coffee
And I'm smoking cigarettes
I'm a deputy of habit
I just can't forget

I'm only lonely when I'm driving in my cae
I'm only lonely after dark
I'm only lonely when I watch my TV
I'm only lonely occasionally

I saw you with your envoy
A consenting adult
Technique in moderation
But vogue to the cult
Me I've got my strangers
To exile in the night
I guess I'm just addicted
to the pain of delight

I'm only lonely when I'm driving in my car
I'm only lonely after dark
I'm only lonely when I watch my TV
I'm only lonely occasionally
occasionally
occasionally"
"eventtime","2007-09-27 15:21:00"
"current_moodid","112"
"url","http://x-pixieness-x.livejournal.com/19146.html"
"userid","17046"
"itemid","73"
"event","So life is fucking crazy... And what's up with my horoscope? I mean seriously... I just need to quit reading it cuz I always know that it's going to be right on, so why do it just to piss myself off? I guess I just hope for the day when it can stop pushing my issues in my face and I can be like haha bitch, you're wrong.... but I don't ever see that happeneing..

Give up on an unrealistic goal, if it was meant to be it will come back to you.... or it was something like that. Now... Fuck off. 

SO I know I sbould give up, but... I don't know. It's not like I even have any hope or anything. I'm not a very hopeful person anymore. 

It's just Why? That's all I can think about for the past day... why? Things I thought were going great so far, and I thought that they were just going to be amazing.. and they still could be... but then my issues just have to come out of they're hiding places and just right into the middle of the situation..."
"eventtime","2007-09-27 07:53:00"
"current_moodid","129"
"url","http://x-pixieness-x.livejournal.com/18745.html"
"userid","17046"
"itemid","72"
"event","So I'm going insane. Physical pain really does mean nothing to me now. I don't want to cut or burn or anyting anymore. I want to be hurt. I want my heart broken. I want to fall in love with the wrong erson again. But I'm numb. Numb to everything but anger and hatred and hopelessness.

Her though... she could do it to me. But she wont. I'm not the one she wants and I madly wish I was.

I want to cry and not be able to stop for days. I want to remember the stomach wrenching pains and the nausea. I wanna feel like I still need physical pain. I want to want to cut myself. I miss the fresh scars. I want to be built up and have the rug pulled out from under me again. I want someone to help me stand on my own two feet again and then throw me oever that ledge.

Is it sick?"
"eventtime","2007-09-26 17:14:00"
"current_moodid","7"
"url","http://x-pixieness-x.livejournal.com/18643.html"
"userid","17046"
"itemid","71"
"event","What do you do when what you need most is a promise you wont accept? If it doens't matter to me so much why is love the only thing that comes out? Is it the way I've been lied to about it so many times that it's bitter to the taste now? If I plug my nose before the bite and swallow could I fool my brain as to what I'm taking in? Or would it be left unsettled in my stomach burning holes as it mixes with the acid and leave me coughing up blood? If I pour that blood in a zip-lock baggie would you take it from me? I know you love the way what you say makes me so uncomfortable. If only you knew that it wasn't just my soul that you broke but my body too. So try one more time to force feed me your feelings in spoonfulls... I told you that I'll give you everything.

Oh if only you would..."
"eventtime","2007-09-20 22:27:00"
"current_moodid","9"
"url","http://x-pixieness-x.livejournal.com/18352.html"
"userid","17046"
"itemid","69"
"event","I'm sorry... I honestly am. you have no idea how much I've been thinking about things today. 
I never meant for you to get this link. But one day I was randomly reading my friends profile and I saw that she had a link to her livejournal in it.. and I was like, huh. how come I never thought about that? and I put it in there... then Friday I think it was I had just about the biggest spazz attack when I thought about you or Hailey or my dad or something getting it... so I took it out. You hand't said anything, so I thought you hadn't read it. 

Yeah, I can't go back and change things. And I'm not going to say that I regret anything. But I feel bad... I was a bitch. I'm sorry for what I did. I should have been more honest with you all along. It would have never gotten to this... remember a while back I asked if it was possible to turn into your ex? yeah... this is pretty  much what I'm talking about.... and you still probably have no idea what I'm talking about. 

So.... I never lied to you. Not once or at all... but reading this was probably like a whole nother something, huh? I do that... I try not to. But I don't anymore... not at all. I'm completely open from now on. I hate the shit that I get myself into cuz I just can't fucking be honest and open. 

I should have told you right away when I felt things changing... but I didn't know how to. It literally happened in about four or five minutes. ANd then I was just lost and confused. Like what the fuck just happened? 

I honestly was never just trying to get you to fall for me... at least not that I know of. And I know I have to take blame and I can't make up excuses... but sometimes I just don't know what the fuck is happening in my head. And with you, it's really been like that a lot. 

**

So today I'm going through my phone, right? deleting old pics that I don't want anymore, and texts that I've had for way too long... it was crazy. The memories that I have in there that I've forgotten about. I have things from back in February when I got that phone.... cuz you see, I have this problem where I don't delete text messages if they mean a lot to me... and well..... there were some from you. And it brought back things that I'd forgotten about totally... and just the way it used to be and the way I felt... even if it was just about a little over a month ago that things started changing with me. I'd totally forgotten... and then, out of no where, I missed you. Lately I've been so pissed off at you, I haven't wanted to talk to you or anything... and missing you... I don't know....

And ya know what I usually do in a situation like that? I act all sweet...I tell stupid little lies to make it seem like I didn't do anything and you have no idea not to like me anymore. And I get things all better, and make you fall for me harder... thing is... I care about you. I care about you a lot.. and I can't do that. Yeah, I want you in my life. But you mean too much to me to keep doing to you what I've been doing. I can't know that I'm hurting you...

If you still want to be in my life, that's fine with me.... and you know I'll always be here... but things can't stay the same... I couldn't take that. I'm done being horrible... I think this is the first time in my life I've been so set on it.... 
But the thing is, if you need time away from me I completely understand.... I just need to be honest with you from now on... and I'm still not so good at it. But I'm trying... 

So yeah... it's all up to you whatever you want to do."
"eventtime","2007-08-21 02:09:00"
"current_moodid","6"
"url","http://x-pixieness-x.livejournal.com/17880.html"
"userid","17046"
"itemid","68"
"event","U28gdGhpcyBpc24ndCBieSBtZSwgYnV0IEkgdGhvdWdodCBpdCB3YXMgYW1hemluZy4uLg0KDQpGb3JnZXQgSGltLCBCcm9rZW4gSGVhcnQgDQpCeSBKcjJibGFja2JlbHQgb24gMDgvMDcvMjAwNyBWaWV3ZWQ6IDEzDQpSZXZpZXdzOiAxDQpSYXRpbmc6IE5vIFJhdGluZyANCkZvcmdldCB5b3UgdG9kYXkuDQpGb3JnZXQgeW91IHRvbW9ycm93Lg0KRm9yZ2V0IGFsbCBvZiBteSB0ZWFycy4NCkFuZCBhbGwgb2YgbXkgc29ycm93Lg0KDQpGb3JnZXQgYWxsIHRoZSBnb29kLg0KRm9yZ2V0IGFsbCB0aGUgYmFkLg0KRm9yZ2V0IGFueSBmdXR1cmUNCkkgd2lzaCB3ZSBzaG91bGQgaGF2ZSBoYWQuDQoNCkZvcmdldCBvdXIgdGltZXMgb2YgbGF1Z2h0ZXIuDQpGb3JnZXQgb3VyIHRpbWVzIG9mIHRlYXJzLg0KRm9yZ2V0IHdoZW4gbXkgdGhvdWdodHMgb2YgbG9zaW5nIGhpbQ0KV2FzIG9uZSBvZiBteSBiaWdnZXN0IGZlYXJzLg0KDQpGb3JnZXQgdGhlIHdhcm10aCBvZiBoaXMgYnJlYXRoLg0KRm9yZ2V0IHRoZSBsb29rIGluIGhpcyBleWVzLg0KRm9yZ2V0IGZlZWxpbmcgbGlrZSBJIHdhcyBzcGVjaWFsDQpBbmQgZmx5aW5nIGluIGhpcyBza2llcy4NCg0KRm9yZ2V0IHRoZSB3b3JkcywgIkkgbG92ZSB5b3UuIg0KRm9yZ2V0IGhlIHNhaWQgdGhlbSBhdCBhbGwuDQpGb3JnZXQgYmVpbmcgc2FmZSB3aXRoIGhpbSBvbmUgZGF5LA0KQW5kIHRoZSBuZXh0LCBoZSdzIHdhdGNoaW5nIG1lIGZhbGwuDQoNCkZvcmdldCB0aGUgc2Vjb25kIGNoYW5jZSBJIGdhdmUgaGltLg0KRm9yZ2V0IGhpbSB0aHJvd2luZyBpdCBpbiBteSBmYWNlLg0KRm9yZ2V0IGhlIHdvdWxkIGV2ZXIgY29tZSBiYWNrIHRvIG1lDQpBZnRlciBnaXZpbmcgaGltIHNvIG11Y2ggZ3JhY2UuDQoNCkZvcmdldCB0aGUgc2NhciBoZSBsZWZ0IG1lLg0KRm9yZ2V0IGhpbSwgYnJva2VuIGhlYXJ0Lg0KRm9yZ2V0IHRoZSBwb3NzaWJpbGl0eSBvZiB1cw0KSGF2aW5nIGEgYnJhbmQgbmV3IHN0YXJ0Lg0KDQpGb3JnZXQgd2Ugd2VyZSBldmVyIHRvZ2V0aGVyLg0KRm9yZ2V0IGhlIHdhcyBvbmNlIG15IGJlc3QgZnJpZW5kLg0KRm9yZ2V0IG91ciBiZWF1dGlmdWwgYmVnaW5uaW5nDQpJIHByYXkgdGhhdCB0aGlzIGlzIHRoZSBlbmQuDQoNCkZvcmdldCBhbGwgb3VyIHByZWNpb3VzIG1lbW9yaWVzLg0KRm9yZ2V0IGhpbSBhbHRvZ2V0aGVyIHN0aWxsLg0KRm9yZ2V0IHRoZSBjaGFuY2Ugb2YgZm9yZ2V0dGluZyBoaW0sDQpGb3IgSSBmZWFyIEkgbmV2ZXIgd2lsbC4NCg0KwqkgQnkgSnIyYmxhY2tiZWx0IE9uIDgvNy8yMDA3IDQ6MjM6MzggUE0="
"eventtime","2007-08-09 02:41:00"
"current_moodid","22"
"url","http://x-pixieness-x.livejournal.com/17637.html"
"userid","17046"
"itemid","67"
"event","ok.. I'm gonna post some lyrics to a song in here... honestly, this should be as hard as it is... This is like.. lately, I've been trying to open to people. Like not on purpose... like it's just happening.. and I hate it. But seriously... this song is as close and you'll all ever get to me opening up to you... I don't know why it hits me so fucking hard but it does..
So here is me....

 *!*!*!*!*!*!*!*!*!*!*!*!*!*!*!*!*!*!*!*!*!*!*!*!*!*!*!*!*!*!*!*!*!*!*!*

Beautiful Disaster lyrics by Jon Mclaughlin.

She loves her mama's lemonade,
Hates the sounds that goodbyes make.
She prays one day she'll find someone to need her.
She swears that there's no difference,
Between the lies and complements.
It's all the same if everybody leaves her.

And every magazine tells her she's not good enough,
The pictures that she sees make her cry.

And she would change everything, everything just ask her.
Caught in the in between of beautiful disaster,
And she needs someone to take her home.

She's giving boys what they want, tries to act so nonchalant,
Afraid they'll see that she's lost her direction.
She never stays the same for long,
Assuming that she'll get it wrong.
Perfect only in her imperfection.

She's not a drama queen,
She doesn't want to feel this way, only seventeen but tired

She would change everything for happy ever after.
Caught in the in between of beautiful disaster,
But she just needs someone to take her home.

Cuz she's just the way she is, but no ones told her that's ok.

And she would change everything, everything just ask her.
Caught in the in between of beautiful disaster,

And she would change everything for happy ever after.
Caught in the in between of beautiful disaster,

But she just needs someone to take her home
And just needs someone to take her home."
"eventtime","2007-08-01 10:45:00"
"current_moodid","97"
"url","http://x-pixieness-x.livejournal.com/17292.html"
"userid","17046"
"itemid","66"
"event","7-21-07

Mom, 
I miss you. Yeah, the past few day's that you weren't drinking you kinda really drove me insane. But I was happy that you weren't drinking. I don't think you'll ever realize how much it hurts me... and Jesse. He wanted you home so bad tonight. You should have seen the disappointment on his face when he was trying to talk you into coming home. Why'd you give up?
I miss our relationship. I miss when I used to be able to talk to you. Back when you used to b e there for me. You might think you have a year and a half with me, but you have no idea who fast that time will go. And at this point I don't see me coming back. I have nothing to come back for. I'll have Jesse come and say with me some... I don't wanna see you. 
I don't think you get how much you hurt me. You just don't get it. Yesterday, I really did have a fucked up day. Lately, I;'ve been having a massive mental breakdown. Have you noticed at all? And yesterday, it had nothing to do with not monopolizing the phone and internet. I enjoyed the time alone. 
Do you get that I really don't have a life? I'm stuck home all the time? And that's why I'm on the phone and computer all the time. What the fuck do you expect me to do with my time? Clean the house to make you happy? That's not fair to me.
Ya know what? I'm done. I'm going to play a game with Jesse, spend time with him to get his mind off of you. You should see how bummed he looks.
Fuck you mom.

Love always,
Jasmine.

***********************************************************************************

And this is a journal entry I wrote tonight, I am going to trigger it, just because... well, if you think you might be tempted to cut, don't read it..

It's crazy. Something that happened so long ago can still throw me so far over the edge. Over a month now. I've done so well,
*
*
*
*
*
*
*
*
But sooner or later that razor decides it misses the taste of my flesh. The sight of the blood is what forces me to do it. The thought of it pouring down my arm, the memory of the taste as it runs over my lips. Have you ever cut your lips? I haven't. But I'm considering it right now. As I hold the piece of metal in my hands I long to squeeze, tearing apart those lines I could never figure out how to read. Life lines and love lines. Just dumb creases that give people too much hope, if you ask me. The side of your wrist stings if you don't push deep enough... who stops at one? That's my problem I just want to keep going. But what if she sees it? I think I need her right now..."
"eventtime","2007-07-24 13:27:00"
"current_moodid","7"
"url","http://x-pixieness-x.livejournal.com/16988.html"
"userid","17046"
"itemid","65"
"event","A little journal entry I wrote today...
~~~~~~

I'm breaking down. I don't want to let myself, but I think I need to. IO've been ahving a massive mental breakdown over the past couple days, butnow I'm really cruing and freaking out. It started when my mom left for work. I sat here and watched her pull out the the driveway and rerealized how much I love her. I tried to call her to tell her and it went straight to the voicemeal. She was calling me at the same time to tell me. We're not getting along at all... adn it's killing me. I miss her so much. I'm one in less than a year and a half... I'll never be able to live without her. 
This isn't who I wanted to be. Just abuot none of me is. I can't care anymore. Yeah, I do care about people and things to a point, but I don't give a fuck. I just can't. No matter how much part of me wants to. Even most of my best friends I could calre less if I ever talk to them again. I've known her for almost thriteen... my mom just called... she heard cants in the cradle and she's crying too.. what the fuck?... I've known her for almost thirteen years now, and I'm giving up on someone I love more than anything... because she'd depressed mostly. No, that's not why, it's because of how she's acting towards me, but that's because of the deoression. And I just can't take it anymore. 
I went to the doctor the other day. I weight more then I have in years. Yeah, I'm also taller lately, but it scared me. I look thinner... but I still hate it.
It's like I need there to be something wrong with me.. maybe to feel slightly sane? Does that make sense? So I have an excuse? People say I'm not totally crazy... and I know that I'm not. But my head's just not working likme it used to.. it scares me. My mood swings are coming back. I'm thinking totally fucking psychotic again.. but physically I'm just blah.. And it's driving me crazy. 
I miss Ani too mych. I still love her more then anything... for that I feel guilty.. but it's saving my life and my heart right now. 

~~~~~~~~~~~~~~~~~~~~~~
Now this is random updates I guess...
~~~~~

When I went to the doctor the other day I had a bunch of blood tests done, and there's something fucked up with my liver... as soon as this virus thingy I have is totally gone I'm going to get more tests done to see if it's really bad. Honestly, I'm scared it's from drinking too much. I don't think that I ever drank way too much. And I cut back. It's been over a week since I've been drunk... but I think that drinking may have helped it... so I'm going to try and quit.. haha. right. Like that's going to work. 

She's... oh god. She's fucking amazing. I want to be good for her... I want to be fucking perfect, and everything that she needs... but I know that I'm not. I know that I will do her no good, and she's better off without me in her life. I'm just going to fuck things up for her.... I've tried to tell her this.. but it hurts. And she wont listen to me. Now... here's my really big problem with her. I'm a healous person.... a really really jealous person... but I never let it show. not at all... and I've realized with her, I can't help it. I never let people realize how jealous I am of something.. but it just comes out while we're talking... I hate it. I try not to let it.. but it just does. 

I had another ultrasound today.. I do still have gallstones. Why I haven't had an attack in over a year and a half I can't quite figure out.. it's driving me crazy. So, I probably am going to have to get my gallbladder taken out.. so not looking forward to that. But I know that it's best for me. 

I blame the heat for this bread down I've been having.. this fucking heat wave is crazy.. it's over 90, and it's only 1:56... It's going to get worse... today is supposed to be the worst day... but it's not going to end for a couple more days... I don't know how I'm going to live though this. 

Well.. there was something else I was going to write about.. but I just realized that that person might read this. so I can't... and yeah, there was something else too, and someone else can't read it.... damn.... maybe I'll srite about it on myspace... or one of my other million LJs... and I think I have a Xanga... haha... oh wow. Let's see if maybe someone figures some things out by that. if you do read it... there's your secret... and I fucking hate you. 

My ex moved... like, a couple hours away.. and I already miss her. I don't have feelings for her. And I don't think that I ever did. I just liked having someone here... but every time I talk to her, I miss her so much... I've only hung out with her like two or three times since we broke up in April... Now I don't know when I'm ever going to be able to see her again.. 

Yeah.. I guess that's it for now. If anyone read that... thank you. It means a lot to me."
"eventtime","2007-07-11 13:42:00"
"current_moodid","95"
"url","http://x-pixieness-x.livejournal.com/16848.html"
"userid","17046"
"itemid","63"
