"names","values"
"itemid","93"
"event","It's all happened so fast. I di...
I don't know what to say. I'm lost. 
I love you so fucking much fortune..."
"eventtime","2010-04-03 20:59:00"
"url","http://x-pixieness-x.livejournal.com/23937.html"
"userid","17046"
"itemid","92"
"event","I hate you. It's taken me so long to hate you this much. Of course I still love with you. With all of my heart. But guess what, I am my own person. I'm me. Not some creation that you've made. I'm fucking tired of it. Trying to talk about myself and being like well here's the thing, I was with this one girl... or well, since I was with her... or like anything to do with me. I cannot talk about who I am without you coming up ten billion times. Is that what you were trying for? I always knew you were a game player, but after all this time I'm finally seeing just what your game is. 
I could be happy with this girl. After all this time you still get in the way. I don't even realize that I think about you, but yet you're name comes out of my mouth a thousand times a day still. And I'm pretty sure she's over it. 
I guess I'll just always be yours... happy now?"
"eventtime","2010-04-02 19:26:00"
"url","http://x-pixieness-x.livejournal.com/23644.html"
"userid","17046"
"itemid","89"
"event","I'm singing, and even my dog is looking at me like I'm an idiot. 
I'm starting to see that the very obvious lines we set were there for good reason. When my mind started crossing them it was kinda weird, but that I can deal with. Actually talking about it a little? it was just weird. 
I love this girl. She's fucking amazing. I don't ever wanna do anything to hurt her. Actually what I want, is I was to hurt for her. i don't want to hurt because she's with another woman that likes her. I don't want to hurt when she tries to say goodbye. I don't even want to hurt for her pain. I want to know that she's far away, and I want it to hit me. I wake up every morning, and it's her I think about. I spent over an hour thinking about her this morning before I finally decided to text her, cuz I thought maybe she didn't wanna talk to me. And guess what. i still didn't do it. It's like.. i can't get her out of my head. I want a life with her. I toss and turn on nights that I don't tell her that I love her. But then when I say it... I get this bad feeling inside. And it's not because I don't mean it. It's because I know that when I say it, it makes her smile. Every time I say anything sweet like that, I know it makes her think of our possibilities, and how much she cares. And so, I like to keep her attachment as low as possible. So I just don't say things like that. But then she thinks that I don't actually feel it, and she decides its time to walk away. And then I freak out. And then it starts all over again. 
I want to think about it, I want it to bother me, I want it to hurt me, before it's pushed in my face. 
I know she's different. And I know that I'm much different now than I used to be... like, everything is different... but sometimes it all reminds me too much of how things were between us. And then I just hate myself. 
I don't know if I could ever try with you again. because yes, I am an idiot. And you deserve the world. And I suck at relationships. Yeah, I hate her for how she treats you. But I wouldn't give you what you need or deserve either. I hope that you find someone who truly loves you, wants to give you everything, and treats you better than anyone in the world. 
I do love her so fucking much. I just wish that I would have been the one to hit rock bottom first. I don't care about me. I want to feel that she is safe. And my heart is a cold bitch."
"eventtime","2010-03-05 22:12:00"
"url","http://x-pixieness-x.livejournal.com/22948.html"
"userid","17046"
"itemid","88"
"event","you told me once that it feels good to get things out. That it's important to... So I'm going to. But I'm hoping that afterwards, we can forget that I said anything. 

I feel like part of me may be begining to fall. But it's something that I should have done a very long time ago now. Then maybe I would't be in the situation that I am in today. Looking back, I should have been the one apologizing. I'm sorry for what I did. I'm sorry for how selfish I can be, for the fact that part of me wishes you would have waited. But that's not very nice of me. You deserve more than the pain I cause. 
After awhile I was scared that you might get rid of some of the things yo wrote to me. I don't think I ever told you this, so please do't think that I'm a freak, but I saved some of them. I didn't wanna forget the small amount of time we shared. 
I knew that I was lucky before, but I was so bitter and full of hate I didn't see it very much. My trust issues were so bad I told myself that everything you said was a lie. I met you at the worst possible time in my life. So today I went back and I read some of those things. It was really hard. Actually, less than halfway through your first letter I was balling my eyes out. For a short period of time I had the most amazing thing in the world, and I was completely blind to it. 
One good thing for me came out of it for me. I learned to not be so stupid. That I don't have to trust everyone, but sometimes it's ok to  let go a little. I guess I got a serious wake up call... but not at the time. months later I realized how stupid I was. But it was too late. For awhile I wished that I would have tried to get ahold of you when I first thought about it, two days sooner than it happened... but I know that that probably wouldn't have changed anyhthing. you were already moved on. Which is good. I'm no good for you.
I was scared of how sweet you were. Of how innocent you sounded when you were talkig about your feelings. I never wanted to hurt you.. and I was horrible. i still don't understand why you put up with me today. But I'll say, I'm so thankful that you do. You're the best friend I've ever had..."
"eventtime","2010-01-22 00:23:00"
"current_moodid","4"
"url","http://x-pixieness-x.livejournal.com/22589.html"
"userid","17046"
"itemid","87"
"event","I'm tired of depending on other people. It's only my problem that my anxiety has gotten so bad. What's gonna happen when she's given up? When she realizes how pathetic I've been, and I'm old enough that I should be on my own.. but yet I can't even leave on my own without freaking.
why haven't I done my own research? I'll tell the doctor what meds to give me this time, since theirs never seem to work.
I fall asleep only in hopes of dreaming, that everything will be like it was before.
R.I.P. my Betty Spaghetti
God do I miss you.
You died all for my stupidity.. you deserved so much better than I ever gave you. I'm sorry.
And because of that guilt I freak everytime I leave the house. What careless act is going to curse someone else too?
I miss her a lot. Too much I think. Because from what I've been told she doesn't even talk about me... she doesn't even want to talk to me, that's obvious.. What we had is now dead to her.
Like I've said she is to me, 
but she never was
and after that, she for sure wont be now. 
But whatever. 
I should go straight...haha... that's the first time I've ever said that. But I'm pretty good with guys, currently have them surrounding me like fucking mosquitos.. .he'd treat me good if I let him. But what do I do? I obsess over the day that she might come back.
Yeah right Jasmine.Get over yourself, It's pretty obvious that she was using you all along anyways.
And you... yes YOU! you know who you are. FUCK YOU! Yes, I want you back in my life, but not to try to hurt me. Not to bother me on purpose just because you have such beautiful women surrounding you.. what the fuck ever. 
There's no doubt in my mind I'm the best you will ever have, and you wont even take the chance... so HA!
Shamanna's doing a lot better. She'll probably never be ok.. but she's doing better. We're talking more... and I can somewhat understand what she's saying now. I missed her a lot.
""You're my best friend in the world, how can I love anyone more than you?"" 
Funny how long it's been, and we're still best friends. 
My hand keeps going numb. And I'm getting hella weird muscle twitches in it. It's driving me insane."
"eventtime","2009-08-14 22:46:00"
"current_moodid","110"
"url","http://x-pixieness-x.livejournal.com/22435.html"
"userid","17046"
"itemid","85"
"event","About my sanity mostly. 

See, in the past when I've gotten really stressed out I've felt like I was somewhat losing my mind. Which I'm sure everyone does. But I tend to see things and hear things that are obvious to even me that there is no possible way they're even there. 
It started a couple years ago and it was only once in a long while. Well lately.. it's been happening a lot. Almost all the time. 

And it really hit me today, am I ok?

And I know I've been told this a million times before and it even makes sense, that people who ask if they're crazy really aren't. Because those who are don't question themselves because that is their reality. 

So I'm always telling myself that I'm not crazy because I know that whats going on isn't real. And maybe that's not all I'm worried about anyways... 
Who really knows..

I just know that there's too much shit going on right now. wayy to much for me to deal with and slowly but surely little weird things are happening. 
And I hate it. 
I'm such a paraniod person I just can't stand it. 

I don't even know why I started writing this. 

I guess I just know the feeling of losing your mind. I remember the first time it really happened to me. It was one of the most amazing days of my life. I remember how it felt and there has been times that I would have given anything to have been able to get it back. But I have too much shit going for me right now. 

I guess a lot of it I can't talk about on here.

I need to just use my journal.."
"eventtime","2009-01-22 22:23:00"
"url","http://x-pixieness-x.livejournal.com/21966.html"
"userid","17046"
"itemid","84"
"event","I miss writing. I miss getting it all out. I miss how I used to just be able to do it. And how I wasn't afraid to let my journal learn things about me. But now it's like I can't even admit to myself who I am. Why after all this time do I still think of myself as her ex. Is that all I'm letting myself be? A part of her past?
But that's not even it. I loved myself. She showed me that I deserved it. And if she couldn't love me I didn't deserve the love that I was giving myself. It's like I lost myself when she said goodbye. I sent every last piece of who I was over the phone and into the nearest garbage can on her side of the country. 
Then, when I was all gone, all that was left was a memory of her. And that's why I did the bad things I did. I didn't know anything else but that. She was all that was left inside of me and I didn't know how to exsist anymore. 
And now that that is gone. I've lost how to even be her anymore, I don't remember anything else. I'm left with the one thing I knew before her. 

Drinking. 

I don't even know myself anymore. Some days I wonder. When something happens I actually have to ask myself, Jasmine, how do you react to this? 

It's like I'm reteaching myself how to walk and talk and be a human being. 

I know it's pathetic. 


I hate myself when I'm drunk. It's like, after that first shot of the morning I just break down. I tell myself every day, today will be the day. Today, I'm not going to need it. But then I see it, whatever kind of alcohol is closest to the coffee pot, since that's the first thing I do in the morning. And... it drives me insane. Every little thing I try to make as an excuse, this isn't going my way so I can drink. Then I'm like,no. Then, I don't have anything to do today, so I can drink. Then I'm like, no. Then, It'll help my nerves... 
then I'm like, no... 

And I always do it. 

and since I'm always drinking, I'm always hating myself... 

But I don't know myself sober. 

I can't sleep. I can't eat. It's like I literally don't know how to live. 
you should see me on sober nights, I remember the first one I had in almost a half a year, I literally layed there in bed that night and asked myself, how do I do this again? and I tossed and turned for days.... then about three days into it the physical withdrawls set it... I don't think I can ever go though that again...
well, I don't want to. 

I'm stuck at my dads house, I've been sober for days... I can't think straight. I'm shaky. my body hurts... thankfully not the all over body cramps I went through the first time. I was literally stuck on the kitchen floor and couldn't move anywhere. I was stuck there crying. 

that's not anything what I wanted to write this entry about. Actually... I don't know what I wanted to write it about. 

Well... there was lyrics to a song I wanted to post... there's mixed feelings about it....



Lyrics to The B-Side To The Truth :
I hate the way that my words come together at your expense
Wish that when I wrote I wouldn't have to be so honest
Show some tact or show some class or maybe just some respect
I'll respect you when you respect me, what can you expect?
I'm just being honest

I still fight the urge to call, I know there's nothing to say
I still love you and I think about you every day
It's not easy for me though I know I act like it is
Feel the pain that hurts so bad I guess I've gotta fake it
Just like I've gotta say this

That this song is the b-side to the truth
About how I really feel about you
And I know sometimes my words they burn like hell
But I still want you, if you can't tell

It's hard to see you I know that we've got to act like we're friends
Force a smile, fake a hug and try not to act nervous
""How am I? I'm good, no great, no perfect, life's just a treat""
Ask you question after question, I don't want you to leave
I just want you to see

That this song is the b-side to the truth
About how I really feel about you
And I know sometimes my words they burn like hell
I still want you, if you can't tell

I've got the keys if you wanna roll
I'll take you anywhere that you wanna go
We'll climb in the backseat like when we first met
I'll lay on my back while you lay on my chest

I've got the keys if you wanna roll
I'll take you anywhere that you wanna go
We'll climb in the backseat like when we first met
I'll lay on my back while you lay on my chest
While you lay on my chest

This song is the b-side to the truth




Especially... 
I still fight the urge to call, I know there's nothing to say
I still love you and I think about you every day
It's not easy for me though I know I act like it is
Feel the pain that hurts so bad I guess I've gotta fake it
Just like I've gotta say this


*~*~*~*~*~*~*~*~*~*~*~*~*~*~*~*~*~*~*~*~*~*~*~*~*~*~*~*~*~*~*~*~*~*~*~*~


It's really hard ya know... just looking at them.. all the beautiful pictures. I wish I would have gotten over my shit and told her that I loved her a long time ago. 
Here's my problem, there's so many things that I would not give up that I've been through... it just wasn't meant to be. I think I get it now. No matter how much I love to think about it. How perfect it would have been. How amazing she is... it's just for my dreams. She'll never be mine. She was good to be for awhile.... and I got more then I deserved. 
It's... it's still hard not to call sometimes."
"eventtime","2008-09-05 22:05:00"
"current_moodid","131"
"url","http://x-pixieness-x.livejournal.com/21663.html"
"userid","17046"
"itemid","83"
"event","I'm sure that you're like done with me or something. And I'm not asking you to be all like, aww, jasmine, I want to be your friend again. I just wanted to get everything straight. 

First... don't just see part of a conversation and assume you know how I'm feeling, or that I hate you and don't want to talk to you anymore or something. I would tell you exactly that if that was it. 
I just... don't want to start shit, but found out a couple things from a couple different people about you talking more shit about me and more of what you've said in the past. Things that you either took wrong or completely made up, and that's not cool. 

I tried to be there for you no matter what. I tried to be a good friend, and from what I can see you just walked all over the friendship I tried to give you. And I just... have too much shit going on right now to think about it too much. 
I will always care about you. And if you need anything, or someone to talk to, you know I'm always here. 

And that thing about you being a dollar, the only thing I can think of is some application that I added to myspace with buying people and being the boss or something. And like, the bid starts at $1 or something... It just confused me so I clicked yes on a bunch of people and gave up. I've never said that you're only worth a dollar. 

Next time if you want to confront me, just have the time. Cuz it's not fair for you to say that you're done and not give me time to explain what's going on and why I didn't go to you in the first place. 

Honestly... I think you talk too much shit about people that you wouldn't say to they're face.. and if everything that I've heard you've said is true.. well, that's just really fucked up. 
When did I once try and get you to cheat on anyone? and when did I try to get you to do stuff in bed with me?
and how exactly did anything start between us? do you not remember? it usually wasn't me. 
I know that I did get a little in over my head fast with the whole feelings thing.. but honestly, it's just how I can be at times. But for anything that I ever said to you, did I not get something back? in writing or not? 
And when months and months ago you told me that you felt bad, that you'd found karma and you were going to try being a better person, and I know you kept talking shit about me, who knows about anyone else. 

I don't want to start a fight... I'm sorry I brought all this up. It's just been bothering me for a long time."
"eventtime","2008-07-22 00:40:00"
"current_moodid","14"
"url","http://x-pixieness-x.livejournal.com/21437.html"
"userid","17046"
"itemid","82"
"event","The Risk-Taker
The Risk-Taker needs an adrenaline rush to feel true sexual excitement. If it's forbidden, you're the first in line to give it a try. Defying social conventions turns you on like nothing else. If it's liable to get you fired, divorced, or ex-communicated, you're into it. You're not likely to ""listen to reason"" because level-headedness is at odds with your needs. Many risk-takers practice some form of danger-seeking in their daily lives, but some of them only fantasize about it. Danger is an aphrodisiac to you, and you are drawn to it in and out of bed."
"eventtime","2008-06-19 13:11:00"
"current_moodid","6"
"url","http://x-pixieness-x.livejournal.com/21015.html"
"userid","17046"
"itemid","81"
"event","So I'm almost done with my first quarter at the college. It's been a lot harder then I thought it was going to be since it's only senior level english that I'm taking right now. And like, no ones giving me any credit for it. I am seventeen years old and neither of my parents have ever helped me with any schoolwork my entire life that I've been homeschooled. I dropped out of public school almost five years ago, and I'm still a year ahead of my self, and oh my god it's not even college level yet. Well fuck off, at least I can do shit for myself. I wouldn't be anywhere now if I had to count on my crappy ass parents. 

I'm having no luck finding a job. I work saturdays, that's it. And it doens't matter if I work 13 hour days they wont pay me for more then 8. And I have to work for as long as they need me. It's fucked up. 

I'm taking off to oregon on thursday. I can't fucking wait to get away from everything and everyone here for awhile. I'm so over washington. 

Hopefully I'm going to Mass in september, but I gotta kiss up to my dad and get some money from him, since that's really all he's good for. 

I'm totally in love.. I don't know what to do. This woman means the world to me....
and it's never going to happen. 

My best friend, my love and my world.. is doing meth. And there's nothing anyone can do about it since she's over 14... fuck do I love that girl... I hate seeing and not being able to do anything when she's practically begging me for help.

I'm confused. 

Do you know that I still cry about you all the time? You're still... it. And you'll never know who you are. 

Because there's so many poeple I talk about... hahahaha... 
Not like you're going to read this anyways... who even gives a shit about what I have to say. 

I've become a very bad friend... I'm not ditching them like I did last time, that was totally fucked up... but I've recently been rerealizing who my real friends are and who needs me the most. 
I'm trying to get everything together lately. It's not going so well, but I'm really really trying. 

Fuck... There's too much else to say that I can't... There's so much I need to tell someone... 
but I can't. 
I could never do that. it'd fuck up too much for too many people. 
I hate holding this much control of lives and happiness.

Sometimes when we touch the honesty's too much
and I have to close my eyes and hide
I wanna hold you till I die
till we both break down and cry
I wanna hold you till the fear in me subsides



or more like the fear in you subsides. 

How could you have done this? and why did I let it happen? I guess I had more faith in both of us than I ever should have. 
You really are a... I can't say it. 
I love you. 


But... why did I write that much to someone that had no idea that this livejournal even exsists? someone that even if she did, she would never take the time to read it. She wouldn't even listen long enough if I wanted to sit her down and tell her. 
Fuck...."
"eventtime","2008-06-03 18:09:00"
"current_moodid","9"
"url","http://x-pixieness-x.livejournal.com/20951.html"
"userid","17046"
"itemid","80"
"event","God I'm so depressed... and so in love with one of the last girls in the world that I should be... but still hung up on another... shes still the one... fuck..

I don't even know what to do anymore. I have so much to write about but I can't now... it's not the right time.. it's never the right time..

what am I doing?"
"eventtime","2008-04-18 22:27:00"
"current_moodid","7"
"url","http://x-pixieness-x.livejournal.com/20633.html"
"userid","17046"
"itemid","79"
"event","12-17-07

I don't think I'll ever let you read this letter, but there's some things I kinds just need to get out. 

I've been completely numb for so long. I haven't felt shit... till I met you. There's been so many amazing girls that haven't gotten me anywhere. I thought it'd never happen again. I'd given up by the time you came into my life. But Rachel, there's just something about you. And it happened out of nowhere. I never thought you'd be the one to push me over the edge. Bot that it's you, I believed that it just wasn't possible. But I've fallen so far so fast. 

I've come to love you so much. It's hurting so bad... and just knowing that you don't feel the same. You've come to form such a big place inside of me for yourself. I wish you'd take it. 
It's killing me knowing that I can't force you to feel the same. Or take what I want to give you.. But I'd never try. Even if I knew I could do it. 

I have to leave you be. Let you figure yourself out on your own. And if I'm ever it,. I have to learn to take it for what it is. And if your friendship is all I can ever have, I have to tell myself to take just that... I don't want to lose you.

I know by now I sound like a total pathetic freak. But you have no idea how much this all means to me. 


I kept telling myself that yeah, I had feelings for other people, but right now I need you. And now that I can fully admit that I'm in love with you, I've realized why...

9-26-07
It's the way your eyes
are so un-mine
that wakes me want them the most. 
To make you promise to feel
as I hide behind my walls.
But if you'd help me,
I'm sure the glass is thin,
you could shatter them
with just a glance.
Physical pain means nothing to me now. 
I need something more
something deeper
that I really might feel.
So I'd help you break through
if you promise to make it hurt.
Cuz I'm lost
and I'm numb
and I'm done trying this on my own.
So wait just a month or two, 
make me falls
till I've lost it all
please make me see
that I can do this again
and let me really be free.


12-17-07
I got my wish. That's all I needed... I needed  you to help me really feel again."
"eventtime","2007-12-17 18:05:00"
"current_moodid","55"
"url","http://x-pixieness-x.livejournal.com/20477.html"
"userid","17046"
"itemid","78"
