"names","values"
"event","I believe in poeple. I believe in people too much. More then they could ever believe in themselves, so that's why I'm always let down....But, for some reason I don't think that I ever once believed in you too much....I think that I just believed you too much...I think that you can go and do whatever you want, I think I've believed in you more then just about anyone in the world...but I'm not wrong about you. I know that.....I just have to tell myself not to believe everything about someone again...and I'm getting better at it.

I don't believe anything anymore, everything is a lie...and I like it that way.

I started thinking about this a couple days ago, about why I'm saying sorry so much lately...I always have said it a lot, but it's getting more and more. And I really think it is that I'm just trying to believe tat something could be my fault. I've always blamed everything on other people, no matter what it is, and I've felt totally powerless....and when I do think that I have conrol over something or someone, it was never real, or it all just disappears...so I'm saying sorry...to juts about everything that people say...just to feel powerful...to think that I've caused something...so I can believe that I've done something to someone....

So, yesterday someone told me that she hated me....and she says that she had to say it, but she doesn't totally mean it...and I totally get it. When someone breaks your heart, and you hate them more then anything. And you just want to scream at them, and beat the shit out of them, but yet you'll never love them any less, and that's why you keep talking to them..you keep trying to get them to fall for you more....but when she said it...I don't know...it was almost orgasmic. I loved the way it felt to have someone say it...and I actually wanted her to say it again, but she wouldn't....I told her to freak out on me..but I couldn't get her to.....

I live my life to be accepted, and have everyone agree with me. And not judge me, so I put up my mask, whatever it is I think they want to see in me....but the whole I hate you thing, I think that was just knowing that I've caused something...I'm the reason for some big amazing feeling that just eats you alive...

I always thought that if I broke someones heart it would be an amazing feeling...I always wanted to do it..just to cause someone the pain....but yet, when she said it. I almost started crying....it doens't feel as good as I thought it would...it doens't feel good at all...

I guess....I can hate you for making me think that everything was fine....and I do. You made me think that you were happy, that we were all cool...and it was just more of the lies...I hate you for what you did..but i guess I also have to thank you, because I really was happy...for just about the whole time that I've known you, and especially the two months that we were together, I was really truthfully happy....so I thank you for that. 

The thing that bothers me a lot, is when you said that you probably had a little laugh about it...the whole fucking Elyse when you had the breakdown, and lying about it...I never did believe your story, but when I asked about it you freaked on me and made me feel all guilty for caring at all...we were fucking dating! How do I have no right to care?

And the ass, that wasn't even a big deal to me....why did you lie about it so much? All I asked was if something clicked in your head, was it a hot ass or not? You liking that one chick, whoever it was with the tests or something like that, woudn't have freaked about that either...yeah, maybe I'd be a little jealous, but I wouldn't freak out on you....

This is what I think...you knew what you were doing to me the whole time. Even if some of the time you didn't totally think about what you were doing, it was somewhere in your head...you built me up there, making me so happy. Making me think that everything was fucking perfect, and you loved me oh so much, you were mine until I didn't want you anymore...you promised me things you knew you wouldn't be able to keep. Just to tear me down...because you knew that you had control over me. You say that  you didn't...that I don't have many weaknesses. Maybe I don't have all that many weaknesses, but you know all of them...you seem to be able to find them better then I can....but wanna know what I think? I think that if you tell me I have a weakness or a fault, I'll believe it. I'll make it into a weakness or a fault...you tell me that I can't do something, and I know that I can't..I believe it. And you say that you never had control of me, because I couldn't be controlled....right. You know how easy it is to control me, and you knew how much control you had over me, and you loved it. And you took advantage of it...

I think that you love the fact that you hurt me.... that you were able to break me so hard...and I just fed into it...oh god Bri, you broke my heart, I loved you so much...you were my everythig, I'll always love you.....and you just fucking love it.

~~~~~~~~~~~~~~~~~~~~~~~~~~~~

Ferris Wheel

there is no dark side to me
you said to me that night
what you see is what you get -
there will be no surprises you said
and I believed you as much as I could
but there were signs of the opposite
deom the minute that we met
and part of that is what made me trust you

cause you would not lie and you could not steal
any more imagination from inside this ferris wheel
that is my own  desire to be different someday
more like you are... is getting in my way

there is a dark side to me,
I promised you that night
what you see isn't always what you get -
there will be some surprises I bet
but you appeased ,e as much as you could
'cause there were signs of divinity
in my struggle to  be free and 
aprt of that is what made you love me

'cause you would not lie and you could not steal
any more imagination from inside this ferris wheel
that is my won desire to be different somday
more like you are... is getting in the way

ribbon candy falling fast
deep inside my lovers oven
is there hope to melt the sugar
that begets he bittersweet
ribbon candy tripping over 
all the lies and slow surrender
that is champion of defeat in matters such as these
in my attempts to please you... in matters such as these

~~~~~~~~~~~~~~~~~~~~~~~~~"
"eventtime","2007-01-30 14:17:00"
"current_moodid","9"
"url","http://x-pixieness-x.livejournal.com/14151.html"
"userid","17046"
"itemid","54"
"event","""The Game""

Tell me exactly
what am I supposed to do?
Now that I have
allowed you to beat me!
Do you think that
we could play another game?
Maybe I can win this time?
I kind of like
the misery you put me through.
Darling, you can trust me
completely.
If you even try
to look the other way,
I think that I could kill this time.

Rah! Rah! [x2]

It doesn't really seem
I'm getting through to you.
Though I see you weeping so sweetly.
I think that you might
have to take another taste,
a little bit of hell this time.

Rah! Rah!
Lie to me!
Rah! Rah!
Lie to me!

Is she not right?
Is she insane?
Will she now run for her life
in the battle that ends this day?
Is she not right?!
Is she insane?!
Will she now run for her life
now that she LIED TO ME!

You always wanted
people to remember you.
You leave your little mark on
society!
Don't you know your wish
is coming true today?
Another victim dies tonight.

Rah! Rah!
Lie to me!
Rah! Rah!
Lie to me!

Is she not right?
Is she insane?
Will she now run for her life
in the battle that ends this day?
Is she not right?!
Is she insane?!
Will she now run for her life
now that she LIED TO ME!

Ramidi ma ma ba di ma!
Ramidi ma ma din do!
Ramidi ma ma ba di ma!
Ramidi ma ma ba di mo!
[all x3]

Is she really telling lies again?
Doesn't she realize she's in danger?

Eeeeeeeyow!

Is she not right?
Is she insane?
Will she now run for her life
in the battle that ends this day?
Is she not right?!
Is she insane?!
Will she now run for her life
now that she LIED TO ME!

The little bitch,
she went and she told A LIE!
Now she will never tell another.
A LIE!
The little bitch,
she went and she told A LIE!
NEVER FUCKING LIE TO ME!"
"eventtime","2007-01-30 14:16:00"
"current_moodid","84"
"url","http://x-pixieness-x.livejournal.com/13952.html"
"userid","17046"
"itemid","53"
"event","I realized just a little  bit ago, I'm really depressed....I know that I have been more then usual lately, but like..wow...it's getting really bad...I was filling out a survey for myspace and like, with all my answers...it was scary...so I decided not to post it. The last time I posted a couple my friend actually asked me if I was depressed...I didn't even really realize it...

Whatever...I'm used to it...it's all coming back on me now..stupid me thinking it was possible to be happy...

I'll never attempt that again...

right...I will..I know myself oh too well, even though I try to make it seem like I don't..no, of course I don't realize what I'm doing..it just...happens...

and I lead people on..I fucking hate it...but lies..oh god I'm so good with them..no no no. I'd NEVER EVER play mind games with you...haha..right..I enjoy my mind games. I like being a bitch...and no one get's why I do things...they just look right past it...and I do everything I can to get in there and just...

*poof*

and I just erased your memory...you didn't read any of that...you're imagining things...I'd never say something like that..I'd never admit...I mean uhh...who said that?

wow...I'm a total fucking dork..

So I ate...I fucking ate food..and wanna know what's really funny? both times I just wrote ate I actually wrote hate and I had to go fix it.....probably because of what I was thinking..I fucking HATE myself for it..but whatever....I'll find a way to punish myself for it somehow..

Why am I being so honest? why am I writing all this and actually planning on posting it on public? because I'm a fucking dumbass...and no I don't just want attention...I just really don't fucking care about anything right now...

yes I do..that's all I do with my time now....care..fucking pity myself..well I'm over it. I'm fucking over everything..

but at the same time, I'm actually really happy right now...kinda..to a point....not really...but if I thought long and hard something might make me happy...............................................................................................................................................................................................................................................................................................................................................................................................ok..I...wait...not happy....................ok...I got it..god I'm so good.I get coffee in the morning! yayness...now I kinda want to wake up.

I want to go back to counseling..I miss Deb...she was fucking amazing, and I was never honest with her...well I'm ready to be now, but no one gets that I need it now more then I ever did in the past. My head is seriously fucking up..

So, fucking dumbass me got out my rubberband again..when was it? today or yesterday....and I put it on my wrist, so I'd have it there anytime I needed it..Well I took i...it was yesterday..I took it off today, I'm sure I'll put it back on though, I only took it off cuz it pinched me when I moved my hand..I don't like pain like that..I only want it if I cause it on purpose..So I'll snap my wrist with it till it's raw and it hurts to fucking move my hand at all, but god forbid it accidentally snap me and I freak the fuck out..

I guess....that's it...

fuck you..."
"eventtime","2007-01-25 23:23:00"
"current_moodid","9"
"url","http://x-pixieness-x.livejournal.com/13626.html"
"userid","17046"
"itemid","51"
"event","It's  been quite a while since I actually wrote an entry in here....lately, my head has  been all fucked up...nothing makes sense. I've been really depressed...and uhh...just feeling really fucking stupid. My chest pain is coming back, but a little different then before. Out of nowhere it just hurts to beath...my back is a little better. My hips are all fucked up. There's something wrong with my leg and it just about kills me to walk...my head hurts all the time. and...other things...pretty much it's just killing me to be alive...but I'll get through it. I always do...But I am proud of myself becuse with all the shit that's going on in my head, it's been over two weeks since I've self harmed at all...I'm working on it...

I'm not eating enough. Either I'm not hungry and I can't eat or when I do get hungry I don't eat....haven't really told anyone that part of it....But I'll be ok..I take care of myself for the most part...I guess a really big thing in my head it I just want to be perfect for somebody...and I know I can't be...I couldn't be for anyone...I didn't believe in perfection before...now I actually do...but I know that I'm not it..

I think my anger is getting worse all the time, I just drew a little thingy all cool like that says DIE BITCH.....but I wont tell you who I was thinking of..

Umm....I just want to get out...I want to do something, I need to get my mind off of what's going on in my head...does that make any sense? Probably not...but whatever......And I found something...or..someone actually who was perfect for it and everyone is freaking out on me about it..even people who don't know the person...I know, it's a stupid idea. I'm a fucking idiot...I'm just.....tired of being alone I guess...

~~~~~~~~

Bri, remember how I told you when I went to that concert and I heard that song and I started crying cuz all I could think about was how much I wanted to be with you? Well, I thought it was just that one time, with all the couples...well I listened to that song again a couple days ago, and I cried again...I don't know why I think of you so much when I hear it....but here are the lyrics to it....

C'mon in, yeah welcome to my life
I get up in the morning
Grab a cup of coffee
Check out and pack my car
Kick it in 5th gear
75 won't get ya caught here
We're pulling in to one more city
Where, hey, from the looks of it
All the girls are pretty

So i promise to grab my soul 
And leave my ego at the door
I'm gonna open up my eyes
So, c'mon sing along if ya wanna
Cry if ya hafta
Lean back into your lover's arms
Grab the hand of the person
standing right next to you
show them we are not afraid of who we are
nobody is afraid of who we are here

Yeah, see I have 4 bags, 2 guitars, my friend Jen
Who helps me remember that its the fans who got me where I am
So if I close out a show and I m still 40 dollars in the hole
You know, I just put the room on plastic 
And sleep another night on an unfamiliar mattress 
And wonder where you are.
I wonder where you are

So im gonna grab my soul
And leave my ego at the door
I'm gonna open up my eyes
So, c'mon sing along if ya wanna
Cry if ya hafta
Lean back into your lover's arms
Grab the hand of the person
Standing right next to you
Show them we are not afraid of who we are

C'mon in, yeah welcome to my life
I get up in morning grab a cup of coffee
Check out and pack my car

I wonder where you are, yeah where you are
Am i gonna meet you in Boise, Boston, in Chicago or New Orleans
In Phoenix, Miami, in Atlanta or Des Moines
Am i gonna meet you in Cleveland, in Charleston
Chapel Hill or Detroit, 
In Austin, Portland, in Arlington or Brooklyn
in Hartford, Philly or New York City

Welcome to my life 



......

I'm still honest with you. I don't lie to you about anything in the world...I just don't talk to you as much..and I hate it...I really do hate...I don't know...I'm not saying that I want you to drop everything to still be able to talk to me on the phone all day every day still, I just hate the thought of losing you...and I know that I'm not going to, thank you for not totally dropping me....just growing apart from you...You really are just about the best thing that's ever happened to me..You've helped me with a lot. I hate it when you say something about how I don't need you, because I have everyone else..you need to get that I do need you..you're still usually the person that I go to..and the only person in the world that I don't keep anything from...you never let me explain to you why I kinda freaked when you called me your ex...I get that we were together and we're not anymore..I am your ex...it just made me realize that it's in the past...and I just want to believe so bad that we're not in the past. Maybe we're not together right now..but I hope for us in the future....but that's probably just wishful thinking..I just need to get over it and move on....

~~~~~~~~~~~~~~~~~~

Stevi..I really am happy that we're talking again. I did miss you, and I never want you to be someone from my past...I like having you in my life. Yeah, there's things that have kinda really pissed  me off and such...but I'd like to work through them all..I uhh.....had something to say and I'm trying to remember....when we were talking yesterday, and we were listening to music...listening to that song and talking to you, it was the weirdest feeling..I didn't start crying, but for those few minutes that it was playing, I totally felt how I did back when we had our thing....I'd forgotten what it felt like...and truthfully, I'm glad that I have a way to relive it...

~~~~~~~~~~~~~~~~~~~~~~

I need a bath...

and I seriously need to get off...

~~~~~"
"eventtime","2007-01-23 21:01:00"
"current_moodid","129"
"url","http://x-pixieness-x.livejournal.com/13253.html"
"userid","17046"
"itemid","52"
"event","It's  been quite a while since I actually wrote an entry in here....lately, my head has  been all fucked up...nothing makes sense. I've been really depressed...and uhh...just feeling really fucking stupid. My chest pain is coming back, but a little different then before. Out of nowhere it just hurts to beath...my back is a little better. My hips are all fucked up. There's something wrong with my leg and it just about kills me to walk...my head hurts all the time. and...other things...pretty much it's just killing me to be alive...but I'll get through it. I always do...But I am proud of myself becuse with all the shit that's going on in my head, it's been over two weeks since I've self harmed at all...I'm working on it...

I'm not eating enough. Either I'm not hungry and I can't eat or when I do get hungry I don't eat....haven't really told anyone that part of it....But I'll be ok..I take care of myself for the most part...I guess a really big thing in my head it I just want to be perfect for somebody...and I know I can't be...I couldn't be for anyone...I didn't believe in perfection before...now I actually do...but I know that I'm not it..

I think my anger is getting worse all the time, I just drew a little thingy all cool like that says DIE BITCH.....but I wont tell you who I was thinking of..

Umm....I just want to get out...I want to do something, I need to get my mind off of what's going on in my head...does that make any sense? Probably not...but whatever......And I found something...or..someone actually who was perfect for it and everyone is freaking out on me about it..even people who don't know the person...I know, it's a stupid idea. I'm a fucking idiot...I'm just.....tired of being alone I guess...

~~~~~~~~

and then I tell you
""you know honey, love doesn't know distance""
and then you turn around and look at me and say
""yeah but my arms do""

Bri, remember how I told you when I went to that concert and I heard that song and I started crying cuz all I could think about was how much I wanted to be with you? Well, I thought it was just that one time, with all the couples...well I listened to that song again a couple days ago, and I cried again...I don't know why I think of you so much when I hear it....but here are the lyrics to it....

C'mon in, yeah welcome to my life
I get up in the morning
Grab a cup of coffee
Check out and pack my car
Kick it in 5th gear
75 won't get ya caught here
We're pulling in to one more city
Where, hey, from the looks of it
All the girls are pretty

So i promise to grab my soul 
And leave my ego at the door
I'm gonna open up my eyes
So, c'mon sing along if ya wanna
Cry if ya hafta
Lean back into your lover's arms
Grab the hand of the person
standing right next to you
show them we are not afraid of who we are
nobody is afraid of who we are here

Yeah, see I have 4 bags, 2 guitars, my friend Jen
Who helps me remember that its the fans who got me where I am
So if I close out a show and I m still 40 dollars in the hole
You know, I just put the room on plastic 
And sleep another night on an unfamiliar mattress 
And wonder where you are.
I wonder where you are

So im gonna grab my soul
And leave my ego at the door
I'm gonna open up my eyes
So, c'mon sing along if ya wanna
Cry if ya hafta
Lean back into your lover's arms
Grab the hand of the person
Standing right next to you
Show them we are not afraid of who we are

C'mon in, yeah welcome to my life
I get up in morning grab a cup of coffee
Check out and pack my car

I wonder where you are, yeah where you are
Am i gonna meet you in Boise, Boston, in Chicago or New Orleans
In Phoenix, Miami, in Atlanta or Des Moines
Am i gonna meet you in Cleveland, in Charleston
Chapel Hill or Detroit, 
In Austin, Portland, in Arlington or Brooklyn
in Hartford, Philly or New York City

Welcome to my life 



......


I'm still honest with you. I don't lie to you about anything in the world...I just don't talk to you as much..and I hate it...I really do hate...I don't know...I'm not saying that I want you to drop everything to still be able to talk to me on the phone all day every day still, I just hate the thought of losing you...and I know that I'm not going to, thank you for not totally dropping me....just growing apart from you...You really are just about the best thing that's ever happened to me..You've helped me with a lot. I hate it when you say something about how I don't need you, because I have everyone else..you need to get that I do need you..you're still usually the person that I go to..and the only person in the world that I don't keep anything from...you never let me explain to you why I kinda freaked when you called me your ex...I get that we were together and we're not anymore..I am your ex...it just made me realize that it's in the past...and I just want to believe so bad that we're not in the past. Maybe we're not together right now..but I hope for us in the future....but that's probably just wishful thinking..I just need to get over it and move on....

.......

but my stomach hurts
when I hear your name
and so I just keep replaying the film
of the time when you helped me off the stage
and you know that if you think that this is game
well I am not joking
cause my heart she is tired
she is tired of being broken

so hey there
little love
yeah you took me
yeah you took me for a ride
little love
you took me for a ride 

~~~~~~~~~~~~~~~~~~

Stevi..I really am happy that we're talking again. I did miss you, and I never want you to be someone from my past...I like having you in my life. Yeah, there's things that have kinda really pissed  me off and such...but I'd like to work through them all..I uhh.....had something to say and I'm trying to remember....when we were talking yesterday, and we were listening to music...listening to that song and talking to you, it was the weirdest feeling..I didn't start crying, but for those few minutes that it was playing, I totally felt how I did back when we had our thing....I'd forgotten what it felt like...and truthfully, I'm glad that I have a way to relive it...

~~~~~~~~~~~~~~~~~~~~~~

I need a bath...

and I seriously need to get off...

~~~~~"
"eventtime","2007-01-23 21:01:00"
"current_moodid","129"
"url","http://x-pixieness-x.livejournal.com/13546.html"
"userid","17046"
"itemid","50"
"event","QklHIEVOT1VHSCoNCmNsaWNrIG9uICM0IG9mIHRoZSAgYXVkaW8gcGxheWVyIGJlbG93IHRvIGxpc3Rlbg0KDQpmcm9tIGV2ZXJ5dGhpbmcgdG8gbm90aGluZw0KZGlkIHlvdSBnZXQgd2hhdCB5b3Ugd2FudGVkIA0Kd2lsbCB5b3UgYWx3YXlzIGJlIGhhdW50ZWQNCmhhdW50ZWQgYnkgYSBsb3ZlIHlvdSBjb3VsZG7igJl0IHRha2UgDQp5b3UgbGV0IGl0IHNsaXAgYXdheQ0KDQp3ZSB3ZXJlIGluIGxvdmUNCmFuZCBJIHRob3VnaHQgaXQgd2FzIGJpZyBlbm91Z2gNCmkgaGVsZCB5b3UgdG8gbWUgdW50aWwgeW91IGhhZCB0byBiZSBmcmVlDQoNCndpdGhob2xkaW5nIGFsbCB5b3VyIGJlc3QgdGhvdWdodHMNCmJlY2F1c2UgeW91IHdlcmUgc28gYWZyYWlkDQpvbmUgZGF5IHlvdeKAmXJlIGdvbm5hIGdldCBjYXVnaHQNCmNhdWdodCB1cCBpbiBhIG1lc3MgeW91IGNhbuKAmXQgd2Vhc2VsIGFyb3VuZA0KeW91IHdpbGwga25vdyB3aGF0IHlvdSBmb3VuZA0KDQp0aGUgZG9vciBpcyB3aWRlIG9wZW4NCm15IGJhZ3MgYXJlIGZpbmFsbHkgcGFja2VkDQpiZWZvcmUgSSBnbw0KaSB3YW50IHlvdSB0byBrbm93DQpp4oCZbSBob3BpbmcgeW914oCZbGwgZmluZCB5b3VyIHdheSBiYWNrDQoNCg0KDQpOTyBNQU4nUyBMQU5EDQoNCmluIGFub3RoZXIgbGlmZXRpbWUgDQppIGhhZCBhbGwgb2YgeW91ciBsb3ZlDQpub3cgSeKAmW0gc3RyYWRkbGluZyBhIHRoaW4gbGluZQ0KYW5kIHRyeWluZyB0byBsb29rIHRvdWdoIA0Kd2hlbiBpdCBnZXRzIHF1aWV0DQpJ4oCZbSBhbG9uZSB3aXRoIHdoYXQgSSBmZWFyDQpzaW5jZSB5b3Ugd2Fsa2VkIGF3YXkNCnRoZSB3aG9sZSB3b3JsZOKAmXMgYSB0cmlnZ2VyDQoNCmkgd2FudCBzb21lYm9keSB0byBob2xkIG15IGhhbmQNCmluIHRoaXMgbm8gbWFu4oCZcyBsYW5kDQoNCmkgd29rZSB1cCBpbiBhIG5pZ2h0bWFyZQ0KaSBjb3VsZG7igJl0IGZpbmQgbXkgd2F5IGhvbWUNCm5vdGhpbmcgbG9va2VkIGZhbWlsaWFyDQpteSBsZWdzIGZlbHQgaGVhdnkgYW5kIHNsb3cNCmkgdGhvdWdodCBJIGxvc3QgbXkgZmlyZQ0KaSBidXJuZWQgc28gbG9uZyBmb3IgeW91DQpzaW5jZSB5b3Ugd2Fsa2VkIGF3YXkNCnlvdXIgc2hhZG93IHNlZW1zIGV2ZW4gYmlnZ2VyDQoNCmkgd2FudCBzb21lYm9keSB0byBob2xkIG15IGhhbmQNCmluIHRoaXMgbm8gbWFu4oCZcyBsYW5kDQoNCmZyb20gYmlydGhtYXJrcyB0byBicnVpc2VzIA0KaG93IGNvbWUgZXZlcnlib2R5IGxvc2Vz"
