"names","values"
"event","After an interesting day of being stuck in an elevator with a panicked girl, I look back and really wonder what was up. Perhaps it was just a different viewpoint on life. I personally believe that either you act or you die. Sitting around until you die or until someone else changes your fate must have been her philosophy.

<LJ-CUT TEXT=""'Click to Read' [Natalie, Alex]"">

10/30/2007


Taking the elevator down from the top floor, Alex finds himself watching as the numbers creep downward. He stands at the back of the elevator, leaning against the wall, both hands on the rail, and looking rather casual in his hiking boots, jeans and a leather jacket over a mock turtleneck. He's perhaps stuck in the 90's. On his right shoulder is a leather backpack that is pushed to the side against the wall.

Natalie catches the elevator on the 6th - not too far to walk, when she's feeling energetic, but the pile of books in her arms discourages her from trying, and she's a bit breathless when she darts inward and spares a passing smile for the man already occupying the space. She shifts her load carefully so she can free a hand to push her glasses back on the bridge of her nose and then settles in, gaze tipped upward to the numbers overhead.

As she enters, Alex gives a half smile and a slight nod, but no sooner afterwards does he look up at the numbers which begin to pass after the doors close.
5
4
And then with a sudden jolt the elevator freezes. There's a grinding of metal and the sounds of a cable whipping to sudden tension. 
Then the silence of ascertaining what just occurred while he holds onto the rail just a second or two longer. Then he intones, ""You've got to be kidding me."" while stepping to get a better look at the control panel.

Natalie's hand whips sideways to grasp desperately at the handrail as her heart jumps aproximately to her throat. Her breath comes in in a sharp gasp as her fingers tighten against the metal, and it takes a moment for her to gain enough control over her voice to ask, ""What just happened?""

""Sounded like the emergency couplers kicked in."" Alex says while pushing the emergency call button which does not work. Then there's the emergency bell button that also does not work. He then turns back toward Natalie and says, ""With the breaks engaged, I doubt we're going to fall, they're emergency systems to prevent the car from dropping.""

""You /doubt/ that we're going to fall?"" Natalie does not, all in all, sound overly comforted as she turns to eye Alex warily.

He nods and as he opens his cell phone, ""No signal. So, we either sit and wait, or we try to pry the door open or go up through the hatch."". In his final suggestion, Alex is seen looking up at the light fixture, plastic tiles, and the hidden hatch just a few feet above.

""Go up through the--"" Natalie blinks at Alex in disbelief, and her hand tightens around that handrail just a touch more. In case they fall. Or something. ""Are you /crazy/?"" 

Looking back at the woman Alex says, ""It's okay."" he says calmly. ""What's your name?"" . He is taking the time to get her focused on something as he's realizing that she's a little tense.

How very nice of him. It doesn't appear, for the moment, to be working. ""Natalie,"" she shares, and then offers the obvious in adding, ""I'm not big on small spaces you can't get out of that might fall at any moment.""

""Natalie."" He says with an understanding smile, ""I'm Alex Masters. I teach here at the school. What do you do?"" While closing in his question, he reaches down to pick up his backpack and open it.

Natalie's brows shoot up as she eyes Alex, although she does deign to loosen her death grip on the rail just a touch. ""We're trapped in an elevator and you're making small talk?"" she wants to know. ""Aren't there other things we should be doing? An emergency telephone or something?""

From within his backpack he produces a hammer with a very sharp point on one end and a mallet head on the other, ""I tried the call button and the alarm, neither worked. Surely someone is aware that the elevator is broken, and they're on their way, but it may be best to pad our bet and start seeing about helping their rescue."" With the hammer in hand, Alex walks to the door and inserts the sharp end between the doors, but is suddenly blocked by something within.

Long before Alex reaches the door, Natalie's stepping forward to jerk at his shoulder with an insistant hand. ""Don't /touch/ that!""

Turning to her advance, and refraining from doing what Alex had intentions of doing, ""Natalie? What are you doing?""

""Are you freaking /insane/?"" Natalie wants to know. ""Seriously. Do you design elevators for a living? Do you know what will happen if you pry them open? Leave the freaking doors /alone/.""

""It's just a door."" Alex replies, ""We can probably get it open and then call for help on one of the exposed floors. I so totally saw it done on a rerun of Hawaii 5-0."" Though he doesn't turn toward the door again, seeing how tense she really is.

""Oh, well, then by /all means/, let's try it if we saw it on television!"" Natalie turns back to lean against the far wall, staring at Alex grumpily. She drops her papers to the floor and mutters, ""You teach here at the school.""

Seeing this as something she needs, Alex turns to face her from across the elevator  and leans against the angle of door/wall to address her statement, ""Yeah, I teach Geology. Started this fall. What do you do?""

""PhD?"" Natalie wants to know, eyeing Alex dubiously. /Very/ dubiously.

Letting her have control, Alex says, ""Yes, UC Berkeley Class of 01. Spent some time traveling and working for a few groups, contract mostly.""

""/Berkeley/."" That earns a laugh and a shake of her head from Natalie, and she slides down the elevator wall to settle into a sit on the floor. 

""Yeah, Berkeley. What about it?"" Alex asks seeing that she's settling down. Though he maintains his current position.

""Didn't realize they were that desperate,"" Natalie retorts.

""Ya know, I'll let that slide cause of the situation we're in."" Alex grins and has the look of restraint. 

Natalie meets that grin with a heartfelt roll of her eyes.

""So what about you, share time."" Alex requests as he too settles down in a crouched posture. Knees bent, weight on the balls of his feet and up against the wall with his back.

""Share time?"" Natalie turns her head to stare sidelong at Alex. ""What, is that like story time? Nap time?""

""It's like, you called me out, and I shared, so it's your turn. Especially since you won't let me jimmy the door."" Alex challenges in tone while he places the hammer back into his bag that has rested on the floor.

""Oh, well, forgive me for exerting a little /common freaking sense/,"" Natalie snaps in return, gaze fixed on that hammer. 

After a moment of silence, not really sure how to address this girl he notes, ""Natalie, sorry. I wasn't really looking for a fight and I'm figuring we're knee jerking.""

""To the suggestion that someone start poking around with things he doesn't know jackshit about while we're hanging four stories up in a non-working elevator?"" Natalie wants to know. ""Damn /right/ I'm kneejerking against /that/.""

I don't understand that.

""I'd rather do something than sit here and wait for the fire department to show up or the chance for it to actually give way and we fall."" Alex makes note of while standing up from his crouched position. 

""That's very big strong man of you,"" Natalie returns with a roll of her eyes. 

Alex is definitely not one to understand women one iota; and even taking the time to play nice with her and do as she asked, he's decided that he should do something else. So in his standing, he moves to the back left corner of the elevator and starts looking up through the grated tile.

""Gonna climb out through the top now?"" Natalie wonders.

""You got any better idea?"" Alex asks as he puts a foot on the railing that surrounds the midline of the elevator.

""Sit your ass down and wait for the people who know what they're doing before you manage to fall or shake the car loose?"" Natalie suggests, voice /quite/ even.

He turns back to her, looking down past his shoulder and before he starts to say something, there's another sound just outside the elevator car, a grinding of metal and then a sudden drop of the floor by about 17 inches. In this, he loses his footing and grabs the railing while going down.

Natalie , it must be said, /freaks out/. Her hands come down hard on the floor in a desperate grip and she loses her breath entirely, eyes flying wide in panic.

As the movement stops, Alex finds himself raising up off the floor. He looks over at Natalie and asks, ""You okay?""

Natalie has since closed her eyes and is concentrating very, very hard on not hyperventilating.

Alex moves over to her, staying low on the floor and says, ""Natalie, breathe, easy. Just in and out, slowly. Very slowly."" He reaches and attempts to place his right hand on her left shoulder.

""If you touch me, I will bite off your hand,"" Natalie snaps, jerking her head toward him.

Moving back, Alex says while retracting his hand and whole body, ""Easy.""

""Sit the fuck down,"" Natalie bites between clenched teeth, ""and do. Not. Touch. Anything.""

He remains seated across the elevator car from her and lets out a frustrated sigh.  But says nothing while he waits for something else to happen. Surely there are people outside that have heard this noise and or they know that the elevator is broken. Surely.

Surely. Natalie waits, eyes closed once more as she tips her head back against the cool surface of the elevator's wall.

Then there are sounds from outside, a tapping on metal with something also metalic. A voice coming through the walls asking, ""This is the <region> Fire Department, is there anyone in the elevator?""

""We'd love to get out!"" Natalie calls in return, head lowering so she can stare at the door.

Shifting, Alex calls out, ""There are two of us in here.""

Then the fire/rescue voice remarks, ""Ok, we're working on getting you out, just be patient.""

Natalie frowns, brows pulling down, and leans her head back once more. She does not speak to Alex.

Patienty he waits, moving to put his back against a wall and dragging his bag with him. Alex remains quiet for a time and then says, ""I normally take the stairs.""

Natalie does not reply. She's feeling terribly social at the moment.

Crowbars are used to pry the outer and then inner doors open. The car is mostly along the level of the 3rd floor and firefighters are ready to help those within, out. Alex says nothing about the means by which they opened the doors, he just lets it go and waits for them to evacuate Natalie first. 

Natalie does not remark on the difference between trained professionals and dubious geology professors with hammers in their backpacks. She has no problem with allowing Alex to stay in the small, metal space that might plummet at any moment. First her bag, then Natalie, disappear through the door, and she's already brushing off firefighterly attention and striding away toward the stairs before Alex can appear behind her.

There's no interest in pursuit, after he exit and the attention given to her by the firefighters, Alex moves out of the elevator and leaves well enough alone, but takes time to thank the men and will stay around if there are questions.


</LJ-CUT>

<small>panic on the elevator with natalie and alex</small>"
"eventtime","2007-10-31 07:30:00"
"url","http://xmm-havok-0.livejournal.com/6533.html"
"userid","17278"
"itemid","24"
"event","That girl, from the Cash Cab, ran into her today. I'm hoping that I'll randomly run into that little thief from the subway, he's toast when I do... Anyway, the girl, she likes old movies, invited me over. I never considered to ask her age, she seems a little young. Maybe she's going to try and set me up with her mom.

<LJ-CUT TEXT=""'Click to read' [Alexis, Alex]"">


Holding onto the nape of a young man's neck, Alex Masters is seen walking the youth to a nearby counter so as to speak with a Library administrator. Alex doesn't look to pleased with the going's on, nor does the youth. Once at the counter, Alex notes to the administrator that the youth was cutting pages out of a library text (which is presented) with a razor blade. And within minutes, university security is contacted to escort the youth to a back room where the issue will be reviewed. 

Once complete, and free of his captive, Alex turns and starts walking back toward a seating area where his belongings lay.

Alexis is not a student here, but she blends in well enough. Her hair is pulled back into a ponytail and her dress is casual in jeans and a blouse that fits snuggly to her form, but is still presentable. She stands over by the bulletin board, looking through the flyers put up there until she's distracted by security coming by. Curious, her gaze follows them to where Alex and the student explain the situation. Seeing the professor makes her smile and she trots over toward him, following his path back to the seating area. ""Hello again, Professor Alex.""

Just as casual, Alex wears hiking boots, jeans, a flannel shirt of red and black that is untucked and generally 'loose' looking. Just before he takes a seat he is greeted by Alexis. He turns, smiles and says, ""Hey, it's that girl with my name, only with an 'is'. What a pleasant suprise, what brings you all the way out to Queens?""

Alexis chuckles, remaining standing. ""That's me. Oh, well I'm just looking to see if there's drama clubs that are open to non-students..maybe try and get some connection. Y'know, networking and all that. How are you?""

Motioning to the seating area, he non verbally offers a seat while he too sits, ""I'm actually pretty good. So what'd you do with your half of the money?"" Curious, Alex follows a conversation trail in regards to their last encounter.

Alexis nods and takes a seat after being invited to do so. ""Uh-"" She chuckles a little. ""Nothing as exciting as I had hoped-I think it just went toward bills. But it's all good..it saved me some money so I could by my niece some toys and my friend a yo-yo last night. And yours?""

""Spent some on food during my trip upstate, but aside from that, it's still in my wallet. How long are you in my neck of the woods for?"", Alex asks putting away a few books into his leather pack - making ready to depart the library.

Alexis shrugs, ""No specific time...I'm just pretty much hanging out until I work tonight."" She watches him pack his things idly. ""Why?""

""Almost lunch time. Figured you'd want to grab something to eat. There's this sandwich shop just off campus, pretty good, and of course I'll treat."", Alex offers a different venue aside from the standard hanging out in the library and talking just above a whisper. He stands having compiled all of his stuff into his pack.

Alexis lifts her brows, giving the man a slightly scrutinizing look before she nods. ""Sure, why not."" She stands again and waits for him. ""Lead the way.""

Walking toward the exit, and then out, Alex begins, ""So we met randomly in some cab ride, learned a lot about what each other knows, but little about one another. Tell me about your interests in drama and what you want to do with it.""

Alexis smiles, tucking her hands into her pockets as they walk. ""Well, I want to be an actress. And I know, just about every kid today wants to be one and get famous, but I /really/ do. So TV, movies, theater, whatever it takes. I've been going to some open casting calls, but no luck yet...but, I'm going to keep trying and since I know one of the theater professors here, I thought he could help me out.""

""Hey, regardless of how many other people want to do it, at least you've got the follow through and drive. Only means you're one step above the competition."" Alex notes with a compliment and then asks, ""Are you native to New York, or from somewhere else?""

Alexis looks over at him and smiles her thanks. ""New York...I've never been out of it. But you've been all kinds of places, right?""

""Pretty much. My job definitely involves travel and site seeing. But most of the places are remote and not really luxurious. Lots of the time I'm sleeping on a bed roll under the stars. Love it, but there were times when a good shower would have been great."" Alex leads across a street and just off campus where there's a place called ""Three Brothers Deli"". Lots of students in this location and it offers just what he suggested, sandwiches.

Alexis follows along into the sandwich shop. ""It sounds great to me. I mean, sure, I'd prefer a five star suite, but quiet, peaceful, under the sky...that sounds nice too. What do you do that makes you travel around like that?""

""Geologist. That's what I teach at Emerson, but this college was a random encounter that landed me a job when I didnt have one lined up. I graduated a few years back from Berkeley and ended up working a few sites with geologists and archeologists, helping them out with their digs. It was pretty cool, you know, just living in the wind."" He pauses reflecting, ""I already miss it. I probably won't last more than a year here.""

Alexis chuckles, teasing him, ""Does that make you like Indiana Jones? Professor by day, adventurer by night? And I bet all the female students fall at your feet.""

Alex chuckles and shakes his head, oblivious to it if it did exist, he denies, ""Nah, totally not as romantic as it's made out to be. Most of my days were filled with using a rock chipper to pick at the formations, looking at the land. Never chased by pigmys or had a guy stick his hand into my chest to pull out my heart."" 

After a brief pause of getting sandwiches and finding a place to sit. Alex asks, ""So aside from working down in the village, going out for casting calls, what do you do for fun?""

Alexis continues to tease him, using a horribly fake German accent, ""I think you are just being modest, Dr. Jones."" After they sit she muches on a chip. ""Um..."" That's a good question. ""Nothing really..just hang out with friends, or whatever. Nothing special.""

""Oddly, my career is my hobby. Like, rocks are fun to me, and when people ask me that question, I'm always wondering if there's more to life than rocks. I heard rumors that people go out to movies, see plays, shows, etc. But I don't think I've seen a movie in ... 7 years. I'm so out of the loop."" Alex notes and then takes a bite of a large sub. 

Alexis laughs, ""Rocks are fun?"" She echoes, quite amused. Then she stares at him a little awestruck. ""7 years? You're kidding? Okay, well, you are in severe need of a dirt-break. You should come over and hang out at my place, I've got tons of movies to catch you up. Seriously Professor, you need help.""

""Professor.... I feel there's a new nick name in there, but it makes me wonder if I'm gonna be calling you Mary Ann or Ginger."" Alex notes a tease in kind but doesn't remark about going back to her place, as it just may be friendly teasing on her part and he isn't one to push or jump right in on a potential 'hit'. 

Alexis giggles, ""Ginger of course! She's the movie star. 'Course, I'd have to dye my hair..and I'm not sure how I'd fair as a redhead."" After a bite of her food, she inquires further, ""So, what kind of movies do you like? Anything but horror, I don't like those.""

""I like old movies... you know, the sort that has 'va va voom' in them between dance numbers with Carey Grant and Katherine Hepburn. 'Bringing up Baby' is my all time favorite of that era. I'm not really big on all this CGI stuff with explosions and the lack of acting skills."" Alex answers reflecting to a time when running across a field with an actual airplane behind was how they did it instead of using blue screens and computer graphics.

Alexis smiles brightly, ""Oh my gosh, me too! Old movies are my favorite, with musicals a close second. Well, now you just /have/ to come over. No one else I know is into that stuff.""

Alex now sees she's serious with the whole 'movie watching' aspect which is a casual way of saying she's interested in getting to know him. At least that's his translation. He smiles and says, ""I think I just may take you up on that."" - Though, he could also show up and she have friends there that she's trying to set him up with, girls are still a mystery. He leaves it open, to feel her out and sees where she may continue. ""Just not to much Spencer Tracy, I can only take so much of him.""

Alexis chuckles. ""Alright. I'll go through my collection and pick out the best, then you can pick what you want to watch."" She nibbles another patoto chip. ""So, when are you off?""

""Off?"", Alex asks thinking of taking off to another dig site, then realizes she means off work, not something he's acostomed to being asked, ""Oh, off work."" he notes then follows with. ""I just teach in the mornings, not doing reasearch currently and labs are handled by the TA's. So anytime after noon I'm free.""

Alexis nods, ""Cool. Hmmm, I don't have any paper on me...do you? I can write you down my number and address."" She offers, licking a bit of mayo from her finger so that if he has a pen, it won't get messy. 

Having brought his pack, Alex pulls out a small spiral and pen. He slides it across and says, ""You thinking this week or next?"" asking just following up on the idea.

Alexis takes the pen and writes down her name, phone number and address on it before sliding it back over. ""Um, whenever really. This week is fine with me."" Not a slow mover, this one. ""How about friday?""

""Friday sounds good."" Alex notes taking the slid over pad. His eyes linger a moment more before shifting to the pad and then taking it to stuff within his pack.

And with that, connections and plans are made. Lunch covers other recent topics such as current events and her pursuit of acting. He doesn't know anyone in the region that caiters to that dream, but he's sure there are people on campus who can help. The drama department can be her friend. Soon, lunch will pass and the two will move on their seperate ways.


</LJ-CUT>

<small>Lunch with Alexis and Alex</small>"
"eventtime","2007-09-19 17:37:00"
"url","http://xmm-havok-0.livejournal.com/6374.html"
"userid","17278"
"itemid","23"
