"names","values"
"event","I met Professor Charles Xavier today. And still, I have no idea what to think about it all. Regardless, he helped me convince myself that I need to talk to Dr Grey again - about my mutation. Maybe she will know what I can do about it.

<LJ-CUT TEXT=""'The illusions of the young!' [Xavier, Havok]"">

7/31/2007

The afternoon has dawned bright and hot, and the search for air conditioning is the order of the day, for those less inclined to stretch out in bikinis and shorts on the manicured lawns. In the bookstore, filtered air runs cold and strong; it bites through fabric and gnaws at skin, nibbling its way into bloodstreams and summer fever. There are few enough students in the store to appreciate it, beyond those browsing for supplies for the last weeks of the semester. Of adults, there is at least one formidable one.

Clad with propriety and elegance in a grey suit and blue tie, Professor Charles Xavier makes his way down the aisles in his wheelchair, accompanied by the solemn blond viking that serves as his attache. The deep-set gaze explores the stacks with mild interest, academic curiosity skating across the spines of books and, upon occasion, pausing on one. ""Ah,"" he says, plucking one off the shelves. ""How extraordinary. I haven't seen this in years.""

Walking through the stacks, Alex Masters carries three books, one of which he's half opened flipping through pages making sure he wants to buy it before he actually does. All three books are supplimental texts on Geology. Currently Alex wears jeans, hiking boots, a nice T shirt that's blue in color and has the 90's hair do that is inclined to him rolling out of bed and not brushing it. 

For the most part, Alex isn't watching where he's going but he's not in any hurry, so when he rounds the corner to be confronted by a viking an a man in a wheel chair, he's taken off guard, more by the viking than the man. His eyes are pulled from his book as it closes and he says, ""Oh, excuse me."" as he is only feet from collision coming to a full stop.

The tall young man is broad-shouldered and muscled, handsome in a quiet way, capable in a visible one. The blue eyes glance across Alex, immediately assessing; a silent intelligent moves behind them, skating across the other young man with immediate suspicion before veiling their expression in a glance at Xavier.

The Professor, his attention split between the back of the textbook and the abrupt apology, turns a distracted smile at Alex. It is the polite expression used in such casual encounters: civility without an invitation to intimacy. ""Not at all,"" he says, courteously. ""I'm afraid that I've rather blocked this aisle. If you will give me a moment, I can make a path.""

Alex takes note of the viking's expression but is distracted by Xavier's words. Looking down at the man within the wheel chair, it only takes Alex a fraction of a second to identify him - which causes him to stand up straighter and become somewhat anxious or disturbed. Mental images within his own mind quickly cover photographs of the school, Xavier, Jean, Kitty, Emma, Cassy, Andre, and Monet. Not all because he associates them being mutants, but they're the path he's followed to where he is currently, all starting with that school. And for a moment Alex would rather just distance himself as he says, ""It's all good, I can go around."" - In a brief second, Alex is all about turning and walking around, but then slows and turns back to the professor and asks, ""You're Charles Xavier, aren't you?"" - He already knows the answer, but it's just a way for him to start off this conversation.

The Professor settles the book in his lap, age-cramped hands folding gracefully over its cover. Eyes darkened by shadow turn thoughtfully onto Alex; behind them, disciplined shields shore up their walls, thickening in the wake of that barrage of imagery. ""Indeed,"" he says. His baritone is deep and cultured, Shakespearean in its richness and its malleable beauty. ""You have identified me correctly. I fear you have me at a disadvantage, Mister--?""

""Alex Masters. PhD in Geophysics. I teach here at Emerson."" He leans forward after shifting the books into his left hand and offers his right in greeting. ""What brings you all this way from your institute? Surely the books at this store cannot compare to the volumes you may possess.""

""Dr. Masters, then,"" Xavier amends, inclining his head in acknowledgement. Light spits off the dome of his skull, tracing its smooth curve into the hollow of nape and sagging jaw. ""I was here as a guest lecturer for Dr. Mitzger's civil liberties class. As I had some time remaining in my schedule, I thought perhaps to investigate the bookstore. I have fond memories of university bookstores,"" he adds, mildly. ""Although they come from a different generation, of course.""

There is some fear Alex is confronting by talking to Xavier. And he's still torn as to why he's even doing it. His eyes identify with the topic of civil liberties and there's regret in his tone when he says, ""I'm sorry I missed your lecture, it would have been an honor to hear you speak. I'll say though, those fond memories of university bookstores wouldn't have anything to do with the prices of books here. I've often felt that half my tutition went to paying for just the books."" He tries to make a joke at the expense of the bookstore while reaching mentally for the right words that he wants to convey. So he just juts it out there, ""I met Doctor Grey a few weeks back, charming woman, brilliant."" - He's going somewhere, but he's not sure where.

Nor is Professor Xavier. He attends patiently nonetheless, his expression inquiring. More familiar friends would recognize that hint of blandness in it: the tiny signs that the bulk of his attention has moved elsewhere, though his mask of civility is honed by decades. ""An opinion that I certainly sympathize with,"" he says gravely, humorously, answering the thought that he can at least share: Charles Xavier has never winced at the price of a /book/. ""I will be happy to pass along your greetings, if you like. Did you encounter her at Emerson?""

Lowering his left hand which still supports the books that he carries, Alex tends to motion with this right hand as he talks, gesturing with palm open and up. ""Actually no. It was in Salem Center, when I was up there investigating possible tectonic activity. She informed me that it was a mutant at your school that caused a local earthquake."" His index finger touches just above his right brow, amost scratching as his head slightly tilts. ""And since then I've been pondering.."" he looks right and left, seeing if anyone is close to hear what he has to say - identifying the coast is clear, he returns his eyes back to the professor and says, ""...to come and speak with her about my."" He pauses, not really sure how to say 'mutation'.

The Professor's eyebrows lift, inquiring. Inviting. It is Alex's decision to say the word: not his. 

""Mutation."" - There, he said it. Somewhere in him he's a little relieved with all of it. And with Xavier being involved with that school, perhaps Alex is safe in his mentioning of it.

""Ah,"" says Xavier, his attention focusing sharply on Alex at last, and stretches out with a small nudge of power to envelop them in privacy. A student bumbling down the crossing aisle swerves abruptly, drawn by a hitherto undiscovered passion for botany, and disappears to investigate a book of photographs down a different row. ""I see. You are certainly welcome to come and speak with her if you like. She has office hours. As do many of the other members of my staff. Our doors are -- usually open, barring security.""

With a slight frown and a shrug, Alex notes, ""Yeah, that's just it. I wasn't so sure it was good for my career. You know, blacklisting because I'm a mutant or even going to that place and being associated. So I've been rather reticent in making an appointment."" His thoughts are mostly concerned with being outed as a mutant and losing his job. He surely feels that the government is watching the location and if he were to walk up to the gates, he'd be marked.

Xavier's mouth curves slightly. ""An understandable concern,"" he allows, ""and there is certainly cause for it. A regrettable fact of life, I'm afraid, though Emerson is not so intolerant as all that, I believe. Nonetheless -- there are other ways to speak to Dr. Grey. While I cannot speak for her, necessarily, she has made appointments to meet in public, or in neutral territory, as it were. I'm certain she can find some method that would be acceptable to you both.""

Relieved, Alex nods thoughtfully and likes the words he's heard. He notes, ""Thank you sir. I mean, not like anything happened here, but you know. It's sort of a relief. I'll finally have the opportunity to better understand myself and what I can do."" He's talking like Jean will be able to tell him everything, he knows she's psychic and figures she will have all the answers. 

The illusions of the young! Xavier does not persuade him otherwise. ""If it would not make you uncomfortable, Dr. Masters,"" he murmurs with a delicate courtesy. ""Might I ask exactly what--?"" He leaves the question open, one hand gesturing at the younger man. 

""From what I can gather."" He pauses to glance around again, ""It's a form of firey plasma that I can emit. Very destructive and I have problems controlling it. Rather, I sort of have to discharge it every 16 to 24 hours. Or else I'll have a meltdown."" The imagery there in his mind is graphic, he visualizes things he's destroyed, cars, boulders, holes in the ground, etc.

""Ah,"" Professor Xavier says, and blinks. And adds with a mildness of voice that exacerbates understatement: ""How inconvenient.""

Alex takes that as humor and he smiles with a slight chuckle and nod, ""Oh yeah, really gets in the way of taking a cruise or long flights at inconvient times.""

""I can certainly imagine,"" the Professor says wryly, his pale gaze -- blue-tinged, a color caught from his tie -- regarding Alex with the harmless benevolence of an old man regarding a younger generation. Deceptive cover, that; telepathy ghosts across bared surface thoughts and emotions, recording knowledge to feed a sharp curiosity. ""How do you deal with this overflow currently? In a city as crowded as this one, surely there is a risk of discovery.""

""Sewer system."" He shakes his head with a slight cringe, wrinkling his nose, ""Not the nicest smell in the world, that or head down to brighton beach and hope no one is watching while I discharge it under water.""

The Professor's face registers humorous approval at this solution. ""I imagine the CDC would be rather grateful at the sterilization,"" he says with a dry note to his deep voice, ""given the sort of effluvium that finds its way to the sewer system. I daresay it is not necessary for me to warn you to be careful? Noxious though the tunnels are, there is a significant homeless population that uses portions of them as homes.""

Alex registers a new angle on it. ""I took a gas detector down with me to avoid the whole methane so I wouldn't blow myself up, but didn't see anyone right off hand. I'll be sure to check it out more clearly next time."" It would not be good to run into morlocks or what ever else lives down there.

Or simple, homeless homo sapiens. ""I am sure,"" Xavier says in a tone of voice that does not brook argument, ""that you do not intend to cause harm to anyone. An ounce of prevention, as the old saying goes-- but I will not belabor the point. I trust you know how to reach Dr. Grey? If you would prefer not to contact the school, you can always reach her at her laboratory in the city.""

""I do and I will."" Alex notes in the future of contacting Dr Grey. ""Thanks for your time sir."" He notes in realizing that it's best to close this conversation and move on before he realizes that he could be damaging the ozone too.

A matter for later consideration. For the time being, Xavier inclines his head politely, cordially, a smile once more warming his face. It is somewhat more friendly than the original specimen. ""Of course,"" he murmurs, while the Nordic assistant stirs and plants possessive hands on the handles of the Professor's wheelchair. ""It has been a pleasure, Dr. Masters. I hope all goes well for you in the future. I will look forward to meeting you again someday.""

Giving a nod and a ""Good day sir."", Alex moves on heading toward the exit and where to pay with his left arm and an IOU for his first born.


<small>Xavier and Havok meet at the bookstore and discuss the mutant road less traveled.</small>"
"eventtime","2007-08-01 07:27:00"
"url","http://xmm-havok-0.livejournal.com/2914.html"
"userid","17278"
"itemid","10"
"event","Ran into an old friend today, good guy.

<LJ-CUT TEXT=""'Stop Plate Tectonics' [Andre, Alex]"">

7/16/2007

In an age where food increasingly becomes an experimental art form and movies propose that Anyone Can Cook and be a genius at it, Andre Harrison is still sitting in an IHOP. The percussionist, dressed in suitably casual jeans and a t-shirt that says 'Stop Plate Tectonics,' occupies one bench of a booth, facing the door and sipping coffee slowly. Menus, still closed, lay in the of the table.

From the door, crossing the room, Alex Masters comes strolling. Wearing hiking boots, jeans and a non discript t-shirt blue in color, he approaches and says, ""Dude, your mom musta given you that shirt."" with a broad smile of humor at the subject matter.

""Nah,"" Andre responds to the conjecture with a grin. ""I saw one of her coworkers wearing one at Cal, and I /asked/ her where I could get one. She found it, but I had to pay for it still."" He gestures at the empty booth bench. ""How's it going?""

Taking a seat across from Andre, Alex offers the glad hand in greeting, ""It's great bro. Your mom sends her best. So how you been?"" 

Andre shakes the offered hand, his grip firm but the shake easy and relaxed. ""She's probably trying to get me back to Berkeley sooner than later. I guess I'm just foolishly waiting for that plane ticket price to drop a liiittle bit more."" With his other hand, he indicates an empty cup and the trademark IHOP blue coffee pitcher. ""I'm doing pretty well - orchestra's been good, and it's good to have the summer off from all the morning rehearsals."" He sips his own coffee. ""What brings you to New York? Kind of less geology here than many places.""

Letting out a scoff with a slight roll of his eyes, Alex answers the latter of Andre's statement, ""Dude... So I'm down in Peru working a dig for some archeologist when I get a wire from your mom telling me that there was tectonic activity up here in New York. So, since things were wrapping up down there, and it'd been like 5 years since I've been in the states, I jumped on a plane. Took me a little bit, but finally found out what was going on. There's this mutant school up in Salem Center. They've got a mutant that was shaking the earth. Even got to meet this Dr Jean Grey who told me all about it. Sorta some mutant celebrity in her own right. Well, after a few days of floundering and not having another job to run off to, I ran into this lady, Emma Frost who pointed me toward Emerson University, she told me I should try to get a job there, did, and well, that's where I'm working for at least the next year.""

As soon as Alex describes mutant earthshakers confirmed by Jean Grey, some of the casual conversational relaxation hardens out of Andre's expression, in the form of raised eyebrows, widened eyes, and a slightly opened mouth. He anxiously taps a few fingers against the side of his coffee cup, which produces no sound. ""Some/one/ caused that quake in the winter?"" Surprise rings clear in his tone. ""I read about it in the paper, it shook Manhattan pretty good, but they said /not/ to worry about that kind of thing. 128th Street Fault, they said...""

Leaning back after his story Alex is pleased to have gotten that all off his chest, just because it's good to talk to someone he knows about this crazy world they all live in. He nods, ""Yeah, that's exactly what I was thinking, 128th, but the USGS showed nothing going on with it, and now I'm convinced it was mutant related. Totally jacked up that someone would have such power."" - he's missing the Winter aspect of it all, to him this was more recent and local to Westchester county, but he's putting them all together since he's been out of touch with local and recent events (due to being in Peru).

""Well, if Dr. Grey told you so herself,"" Andre begins slowly, but the speed of his words contracts to something more normal as he continues, ""I don't think she'd make it up. She's been open about the school, and her own thing..."" Speaking of tremors, Andre's still speaking /with/ a small one. ""It's not really the kind of thing you'd think to make up..."" His fingers continue to tap against his coffee cup, and he looks at them for a few seconds before abruptly looking back at Havok, swallowing deeply before he asks, ""You going to, um. Get this guy to help you study how the, um, waves work? So people don't have to wait for the next real one?""

Alex isn't really following what Andre is saying, but he figures Andre is wondering if Alex will follow up with the study, ""Nah, I'm done with it. No good can come of getting in the middle of mutant affairs. I'm just gonna hang out at Emerson, teaching Geology or Geophysics, or do a little research if they want me to, and when my contract is up, I'll see where the wind takes me.""

Andre does not exactly have the best way with words when he's startled. As Alex pushes the subject away from Westchester's newly-acquired seismicity, though, some of the tension drains from Andre's posture, and his fingers stop their springloaded-but-silent tapping, now lifting the cup so he can take another sip of coffee. Once he swallows, his smile widens again. ""But seriously. Congrats on landing a job like that! I hear all these stories about people ending up being professors in someplace in the total middle of nowhere, but Emerson's a /good/ deal, especially if they let you run the course on your own syllabus rather than some 101-level rigid plan.""

After a slight interruption of ordering and getting a glass of water, Alex notes in return, ""Thanks bro. Emerson seems like a great place, but I'm way too cloistered there. Hell, I've not lived in a city for years, I already miss my wide open spaces, the desert. But you're right, I'm pretty lucky to have gotten such a cushy position. I think it goes back to that Frost chick, she's got some pull it seems. So what about you, what about this orchestra stuff. Are you doin any individual work, like some Beatles cover band or something on the wild side?"" 

Andre orders as well, then refills his coffee from the blue pitcher. He doesn't sip yet, though, but rather rubs the thumb and forefinger of the hand not holding the cup over his temples, snorting quietly and grinning. ""Oh ma-an, mom told you about the band, huh?"" He lowers his hand. ""We're pretty bad,"" the term is uttered affectionately, ""but it's a blast. So's the orchestra, and I'm thinking of maybe trying to pick up some private students if time permits - which it should, considering I still waste plenty of time on the internet!"" He shrugs and sips his coffee after all. ""And hey, if you stay at the university long enough and teach well, I'd bet they'll have you off doing field work and research and stuff. Maybe you can convince them to let you take a class to, I dunno, poke at faults.""

Alex smiles broadly, having shown his hand but proud of it. He kicks back a bit and nods at the poking at faults remark, ""I'd be totally down with that. Do a 6 week trip with a class of fresh minds anywhere would be great just about now. But tell me, where do yall play, got a gig or something going, I mean if I ever find some chick to take out that'd be a great date.""

""I'd be up for a trip like that, too. Change of pace and stuff. Though I'd pretty much guarantee you'd get no actual quakes if I went along."" Andre tips his chin down toward his shirt, then adds, a little more quickly than his previous speech, ""With my luck."" He looks back up and returns to his normal speech, ""You asking about the band or the orchestra?""

Not catching onto emotional or visual clues, Alex more or less brushes off any hints of reservation from Andre, he chalks it up to that the East Coast has affected the guy. Regardless, Alex notes, ""Either, but band would be more fun.""

Andre is still less East Coast than most! Or so he'd like to think. He squints toward the ceiling at the question, considering, ""Well, for the orchestra, I can tell you pretty much exactly where and when, but the band's far more sporadic. We had this gig on Halloween in Westchester last year, but I don't know if that was for a theme thing or what. They seemed to like us, at any rate, so I'm hoping it could be a repeatable venue.""

""Dude, it'll probably take till Halloween before I even meet a girl I want to hang out with. So I'll be all over it."" Alex notes with some interest in the whole 'seeing the band play' stuff. Aside from any of that, he's one to go into talking about Berkeley when he mentions, ""I've not seen a live concert since Berkeley. Speakin of, I know it ain't a money issue with you heading back, when you gonna get out to visit your mom?"" - Alex is adopted, so family is one of those things that mean a lot to him <andre would know about the adoption part>.

Andre laughs quietly, promising, ""I'll keep you posted on that, then!"" He shifts slightly in his seat, then brushes his hair back from his forehead and scratches idly behind one ear as he considers, ""Professional musician pay is hardly enough to be taking trips around the country and world! Though I'm looking at late August or early September. If anything, dad's been hoping to get me back there even sooner.""

""Well, I'm sure it'll all work out."", Alex notes in a supporting tone, hoping that Andre will get back to see his mom - mostly because Alex admires Dr Harrison. Then the conversations flow to topics of what either has been doing for the past years, humorous and light.


</LJ-CUT>

<small>Alex and Andre have lunch and catch up on current events.</small>"
"eventtime","2007-07-17 08:48:00"
"url","http://xmm-havok-0.livejournal.com/2803.html"
"userid","17278"
"itemid","9"
"event","Funny how things that you want avoid end up right in your path. And there's Jean, that school, and mutants, again."
"eventtime","2007-07-11 15:25:00"
"url","http://xmm-havok-0.livejournal.com/2440.html"
"userid","17278"
"itemid","8"
"event","message at the beep... <beep>, ""Andre, yo, it's Alex Masters. I'm in town, lookin you up, gimmie ah call, ###-###-####. I'll be here for a while, teaching at Emerson now, anyway, yo."" <click>"
"eventtime","2007-07-11 12:58:00"
"url","http://xmm-havok-0.livejournal.com/2180.html"
"userid","17278"
"itemid","7"
