"names","values"
"itemid","30"
"event","To: Scott Summers

Fr: Alex Masters

Sub: RE: Testing completed

Scott,

Sorry it took me a few days to get back to you. I sort of just blanked out after reading your email. Guess it sort of got to me that I finally found you. Anyway, let's get together this week. I can easily catch a train up there and let's find food.

Thanks, and thank Jean for me too.

Alex Masters (Summers)"
"eventtime","2007-11-26 14:28:00"
"url","http://xmm-havok-0.livejournal.com/7917.html"
"userid","17278"
"itemid","29"
"event","Scott,

Good idea about the information and hopes. I'll wait till Jean can get results for us. Either way; It was good to meet you.

-

Jean,

You have my permission to run what ever test you need. I look forward to the results.


Thanks,


-Alex Masters"
"eventtime","2007-11-21 14:20:00"
"url","http://xmm-havok-0.livejournal.com/7574.html"
"userid","17278"
"itemid","28"
"event","I may have found Scott, my brother.

<LJ-CUT TEXT=""'Click to read' [Scott, Alex]"">

11/19/2007


A break between classes finds Scott sitting at one of the work benches on a stool, feet hooked into one of the rungs as he goes over the various papers.  His grading pen of choice? A neon blue of gel ink.  Red ink doesn't show up too easily for the man with the ruby shades and deciphering takes too long to be worth the hassle. A collection of Johnny Lang and Kenny Wayne Shepherd plays from a stereo on the bench behind him.

Passing through the doorway, Alex Masters walks in wearing hiking boots, jeans, brown leather jacket over a blue pull tshirt. He glances around the room for its' occupant and the person he's been directed to by a few students. There's a slight knock on the side of the door facing when he takes note of Scott and he says, ""Hey, I'm looking for Scott Summers.""

""You've managed to find him,"" Scott says, not looking up from the page till the pen tip is hovering over the bottom, having finished all the questions on that page that needed checked.  The pen is put down, the clip keeping it from rolling off the bench as it so desperately wants to do. ""May I help you?"" he asks, raising his chin to focus on the man who spoke.  Ruby shades presenting a small red mirrored view of Alex back to him.

Alex's eyes are very active as he sizes up the man. He's looking for something, the stature, the facial features, the hair, seeking a familiar tone or quality. ""Yeah, I'm Alex Masters. I ran into one of your students the other day, a girl named Alyssa. She told me that I should come talk to you. Something about ... I don't know, that we had something in common."" He left out the most important part, probably because he doesn't want to sound like a lost puppy. Though he does step into the room by a few feet and hooks his thumbs on his front pockets.

""And what would that be?"" Scott asks, not looking for any similarities between their looks.  Why would he? The name 'Alex' is fairly common so it doesn't mean that it's his brother Alex.  Plus 24 years of time make a big difference when the last time you saw them was as an 8 year old looking at a 6.

There's even a reticentence in his voice, ""Yeah, I have no idea."" Alex shrugs slightly, glancing around the room for a second then decides that he should just come out with it, even though it's going to sound really stupid 'to him'. He tightens his lips, pushing them together for a moment longer then inhales and says, ""Guess I was kinda... I mean, so I'm adopted and I had a brother named Scott, we got seperated when we were young..."" He will continue if allowed, but he pauses.

To say that Scott is now gaping at him would be completely accurate, jaw slack for a few moments before it tightens, teeth gritting as he watches the other man.  Scott rises slowly from the stool, making sure to untangle feet before trying to place them on the floor, palms pressed to the surface of the counter. ""This had better not be some kind of joke,"" Scott says as he watches Alex's face and eyes.  After a momentary pause he asks, ""Do you remember anything of your family?""

Goose flesh. Alex feels the hair stand up on the back of his neck and his scalp tingles. He's closer than he's ever been to this and now he's trying not to get hopeful. His jaw also loosens, eyes blink thinking back. Lips part and as he says, ""Nothin really."" he shakes his head. ""I was adopted at 6, there was a lot that happened and.."" he pauses again, trying to reflect and remember, it's a lot to take in and there's some regret forming in his eyes.

""So you were adopted right after the crash,"" Scott says slowly, mis mind turning at the reality of it.  He always wondered if he would ever find Alex, what he'd be like, and here he is. Scott's eyes search out the man's face, looking for similarities to himself and their parents. ""You're here,"" Scott muses, a lightening in his tone and a slight, if unsure, smile on his face.  This is kind of an awkward situation.

Alex reflects to 'back then' and he nods when Scott mentions the adoption right after the crash.  - There is a definite tension forming within Alex's eyes. A furrowing of his brow, struggling to remember. But that's the factor that really cinches it. Crash. The history he was able to discover was that their parents went down in a plane crash. Though he really doesn't remember it. - ""Dude..."" Alex intones losing air in his lungs.

""I gave up finding you years ago,"" Scott says slowly, leaning on the desk now.  How do you act when you face a relative you haven't seen in 24 years?  ""So, you obviously know something about me,"" Scott says, making the assumption since he is at the school, ""So what about you?""

Alex blinks a little, looking down, a sniff and then the fingers of his right hand meet his eyebrows wiping down trying to hide that there are tears forming. ""Man.."" he looks to the side and tries to keep his cool, shifting some on his heels. ""I kept running into dead ends. The agency had no records of who adopted you. Or wouldn't tell me.""

""Which is kind of funny considering I was at the orphanage for almost six years,"" Scott says with a shake of his head, desbelief in his eyes.  Scott doesn't have any tears visible, the few trying to escape hidden behind the shades. ""And I'd pretty much done the same thing,"" Scott says with a shrug, ""hit enough dead-ends that it didn't seem like I'd ever find you unless the court opened the adoption records, which they usually won't without a very good reason.""

Alex is unsure of what to do at this point. He stands there, firm and trying to hold it all in. After another palm across his right eye he sures himself back up looking at Scott. ""So, what? I mean, how do we make sure? I mean, do we get Dr Gray to run tests?"" There's so much more he wants to say, but he is fearful that Scott isn't his brother, and he's really bottled up.

""I'm sure that Dr. Grey could run that test, all she'd need would be a blood sample.  I've no idea how busy she is right now though so it might be a few weeks before anything is known for all I know,"" Scott says, shrugging his shoulders slightly.  He doesn't talk to Jean often enough to know what her schedule is like anymore. ""Unfortunately real tests aren't always so quick and simple as they make them out to be on CSI."" Scott says with a twitch of a smile.

""So, looks like you ended up in a pretty good place."" Alex notes, glancing around at the surroundings and opening it up for Scott to share a little history.

A slow moment before Scott takes a step back to lean against the bench behind him, watching Alex. Hands slide into khaki pockets and his shoulders shrug, ""Xavier's is home now, has been for a while.""  A bell rings off in the distance and Scott's attention turns to it, ""Next class starts in like five minutes, so we'll have to continue later,"" Scott says, moving back to the bench where he was grading papers, pulling the incomplete one aside, turning the ones yet to be looked at to landscape and putting the others on top that are done in a portrait manner, with the incomplete one on top of all. ""You have a card or something? we could talk over e-mail and such.""

Alex shakes his head, ""Nah, but here."" and he pulls out a post-it where something has been scribbled on it, rips it in half and closes on the desk that Scott is utilizing. He looks for an obvious pen and takes to write. He scribbles down a phone number and email <Alex.Masters@emerson.edu> He comments, ""I teach Geophysics at Emerson, in Queens. Just started there this semester."" - There's an apparent discheveled feel to the tearing of paper, jotting down, not being prepared with pen. 

Those things are exchanged, Alex seems reticent to leave, but then on the other foot he's ready to go. This has been a very emotional moment for him and he wants to hug his brother, shake his hand, or something, but instead, he will opt to escape to collect his feelings and continue communication in another fashion.


</LJ-CUT>"
"eventtime","2007-11-21 14:12:00"
"url","http://xmm-havok-0.livejournal.com/7276.html"
"userid","17278"
"itemid","27"
"event","To be a teenager again.... oh hell no. 

<lj-cut text=""&#39;Click to Read&#39; [Nadia, Alex]"">

11/16/2007

=NYC= IHOP - Queens

IHOP is more friendly than classy, but anyone who looks for class in an IHOP . . . well. It has seen better days. If the booths are more rubbery than soft, the tables more rickety than steady, and occasionally a patron knocks one entirely over, if the carpet is sort of a puced out green . . . the servers are enthusiastic and the pancakes are still pancakey and that is all that matters.

The tinkle of the tiny bell above the front door of the IHOP is enough to drive anyone working there insane, as it's been jingling all morning long without pause for rest or respite. Sure, tip money is great and all, but the wait is out the door! Which is why when it tingles once again, few if any even look up. Two men, mid twenties, perhaps, come stepping through. Because of the packedness of the resteraunt they pause there in the doorway, which is when the voice piques up. ""Hey, do you mind? Some of us are trying to get through!"" Being in New York, these sounds should be common. And they are. What's surprising is the little thing with the balls to utter them. Nadia, all five foot three of her, comes wiggling between them. She glares at the men once through and just shakes her dark hair out, moving to the counter. There are two available seats at the counter, and she's not waiting for anyone. She slides her little butt up onto the corner one and slaps the table a bit. ""Menu, please?"" She asks the question a little exasperated. The waitress doesn't seem to appreciate it and one thought can be seen running through said waitress' mind: she'd best tip well.

Already there, Alex Masters has been sitting at the counter for just a few minutes holding  a menu of his own. He closes it as the young woman is taking a seat next to him requesting a menu, then in a partial turn, mostly of his neck, he offers his, ""Better take mine, it's really slow going this mornin."". 

Simply dressed, Alex Masters wears a brown leather jacket on top of some green cotton shirt, jeans and hiking boots. His hair is a mess of early 90's though his face wears few lines, so perhaps late 20's. 

Nadia glances over from where she's had her head perched on her knuckles. Her own attire? Simple denim jeans with a sweater that reveals a flash of midrift as she moves, of course a jacket to go over it. A floppy hat has been uncerimoniously dumped on her head. ""Oh, thanks. Yeah what the hell, right? You'd think somebody was giving out free liquor up in here."" For as rude as she proved herself to be in the first ten seconds, apparently she's not below saying thank you as she takes the menu and flips it open.

With a slight grin, Alex places his elbow on the counter leaning slightly forward and shifting his seat, perhaps he's been sitting here for some time and it's getting numb. Then he notes with a nod, ""It's normally busy, but I think they're short one or two servers."" He then looks over his shoulder back at the line and the room, ""Yep, and it's just gonna get worse. I'm Alex by the way, figure we may as well get acquainted, we're here for the long haul.""

Nadia  glances over her shoulder as well, if for no other reason than to repeat his motion. She spies to two men that she had to claw her way through earlier. They spy her. She sneers, and then she turns back to the conversation at hand. ""Nadia. You think we're really gonna be here for that long? Uber suckage."" She sighs, letting her chin slump to her knuckles once more.

His head turns, capturing her gaze and then to infer her to look, his chin slightly raises looking across to her left and toward an older man in his 70's. Alex notes, ""When he came in, he still had his teeth."" Thus offering a half smile making a joke.

Nadia she doesn't smile, but at the same time she seems to appreciate the joke. Still, ""I'd knock his teeth out if it'd get me my shit any faster."" She orders some...chocolate milk, yes, and belgium waffles, and then the waitress is gone, probobly for a good, long time. As such, Nadia pushes her fists on the counter and scoots her little butt back to sit comfortable in the swivle chair. 

When Nadia gained the server's attention, he too ordered the standard breakfast sampler. After those few moments, Alex then asks, ""You go to school around here?"" just making casual conversation. - One may note a book to the right of his flatware, entitled, 'Bandera Volcano'.

Apparently the girl doesn't notice it. But then if he knew Nadia, or rather, if he knew most sixteen year old girls, that's not much of a surprise. ""Yeah, I go to Flushing High."" The name is accompanied with a roll of her eyes. Then again, that should be of little surprise. ""It definatly sucks. Though you look a little old for high school anyway.""

There's a grin and half chuckle, ""Yeah, just a little. I teach at Emerson. Geophysics. When do you graduate?"" Alex asks while glancing across to the kitchen window and seeing how much is going on up there.

Nadia can't help but blink. A deep blink. Twice. ""Geo-huh?"" She asks, shaking her head a bit. ""2010 if things go well, might have to get a little lucky on that though."" She gets her chocolate milk, and takes an almost childlike slurp of it. ""We'll just have to cross our fingers and see. I certaintly ain't ready for college, though, if I don't even know what the subjects are about.""

In slight reflection, Alex considers the date 2010, something he's probably never even thought of in the terms of graduation, though it's really just right around the corner. ""Yeah, no rush on all that, enjoy where you are now cause 2010 is gonna come faster than you think. So you having trouble in school?""

Nadia shrugs. ""I guess I wouldn't call it trouble. I mean you have to actually do most of the stuff to have trouble with it, right?"" SHe shrugs, and yes, she blows bubbles in her milk for a second before drinking another sip. ""I just don't care about it.""

With a brief 'Ah' and a nod Alex sees what she's talking about. He's got several students like that in his classes. So he leaves well enough alone and remains quiet for a moment or two. Then looks around the room at all the crowd.

Nadia doesn't stop talking. ""Yeah I know. You're a teacher, and I'm a bad student. Talk about the uberness of akward."" She drinks her milk agian. ""But seriously, why should I care? When is someone going to wlak up to me and say, 'Medizowigan, have the hypotonuse of this triangle on my desk by monday?' Let's go with like....umm....nobody. /Ever/.""

Briefly he chuckles then Alex says, ""Well, you'd be surprised. Just the other day I was on a train and the conductor came up to me and asked, 'The train is currently traveling at 35 miles per hour, another train 8 miles away, heading straight for us is traveling at 45 miles per hour. The station is only 3 miles away. Will we reach it before the other train?""

As the milk glass is pulled away from her lips, Nadia has enough sense to lick away the chocolately musache before answering. ""See, I woulda just kicked him in the  balls and asked him why he was bothering me with shit he was supposed to know. It's not my job to know how fast the train is getting there, so long as it gets me there.""

All smiles, Alex adds, ""Of course. And don't think me lecturing because I'm a teacher, but in the real world, sometimes you need to know how to figure something out and though it may never be the hypotonuse of a triangle, that exercise it just teaching you logic and clear thinking. But yeah, no worries, we sometimes end up in places where clear thinking doesn't even matter.""

Nadia shrugs, slurping up the last of the milk all loud and annoyinglike. Is she sixteen or six?! ""What could I need to figure out with like, math though? I can add, subtract, hell I can divide if you put a gun to my head."" That's an interesting mental picture. ""I can carry a calculator in my purse otherwise.""

Alex just starts in with story time, ""So a few years back I was down in Australia, Ayres Rock. It was your standard geological survey. I was having to calculate the weight of a particular stone. Sure, I had a calculator, rarely go anywhere without one. But to figure out the weight of this stone I had to measure height, width, length and then know the relative density and mass of the object. Then put it all into the forumula and do the calculation. This may not be at all what you will ever do. But depending on your future career choice, you may want to be ready, just in case you choose to do something that requires numbers. Heck, you could be the next Hawking and not even realize it because you're ignoring the numbers.""

Nadia just kinda stares. ""WHy the hell would I be measuring rocks or anything else with numbers if I hate them? I don't ignore them. I'm concious enough to know that i hate 'em, but still. I hate 'em. Don' get me wrong, I'm not that fond of reading either. I'm justnot really a school kind of person.""

""And that's totally your choice. I guess being an educator I'm sort of implying that no matter what future you have, you may want to be prepared for it. But heck, you make make a choice that won't ever require you to have to read or do math ever again."", Alex wonders to himself what that may be, street urchin, trophy wife, beauty contestant, professional cheerleader, stripper.

Nadia grins. ""See, you're just like my mom. You're missing the point. I /can/ read, I just don't like to. And I /can/ do math, I just choose not to."" Because it's boring. And stupid. ""Besides, there are other thngs in life besides school.""

""Wow, I just got compared to a mom."" Alex shakes his head grinning, ""I totally need to get out of this education racket. I think I liked myself better when I was digging in the dirt. Though, you're totally right. I think you'd make a great bodyguard. I can see it, going around playing roshambo with big guys like your two friends over there.""

Now Alex hasn't gotten a shit-eaters grin out of this girl. She's pleased. Very pleased. ""Aw, they ain' so big."" She says, glancing around to find the two men from earlier. ""Coulda fucked them up if I'd wanted to. Didn't want to make a scene and all.""

Alex glances toward those guys and then back at her, ""Totally. Your kung fu is stronger than theirs."" He's not really being serious, but it's fun because she's such a petite little girl and who knows, she may totally have a surprise.

""Come on, straight kick in the balls and they all go down. Wanna see?"" Is she playing? She pushes to her feet, standing, as if ready to go chase down the men and make a statement. Good god she's short. 

There's an 'uh' that escapes Alex's throat and he says, ""Actually Nadia, I think they learned their lesson, you know, I can tell. They probably want nothing more to do with you.""

That eat shit grin remains, and so does Nadia. Standing, that is. She laughs a little and shakes her head. ""I need to run to the ladies rom, don't let someone take my seat okay?"" And withthat she turns and starts to elbow her way through the crowd.

Nadia returns from the loo to find her food's been placed out at her seat. ""Oh, neato."" She chimes, settling in and grabbing the nearest utensil. ""Didn't spit in it or anything did you?"" She asks of Alex. It's hard to tell if she's beign serious.

He grins, having his own food in front of him and partially eaten. ""Now if I'd done that, would I tell you?"" asks Alex.

Nadia takes a bite, dribbling strawberry all over her chin. ""I'd like to think you would. But then again, if this is your spit, it tastes really fucking awesome."" She continues to eat, slurping her new chocolate milk again.

After having the last of his bacon, Alex gives himself time to chew and then drink some of the OJ. ""Anyway."" listing as if to change the subject, ""If you're ever in the neighborhood of Emerson, you should stop by, I'm in the Geology department, not hard to miss.""

Now the girl can't help but laugh, finally wiping down her chin. ""I dunno why I'd ever be there. THink they'd take one look at me and kick me right out."" 

Glancing her over he smiles, ""Little young, but I'd imagin there's nothing any different about you than the rest of the student body. Some of them like school, some don't. But there are some really great parties."" Alex thenpushes himself off the stool and pulls out his wallet. 

Nadia spins her chair so her back is to her counter and the food and she can face the man. ""Well if you're inviting me to a party I'm all in for that."" She says happily. She loves parties. Loves 'em!

""Sorry, didn't mean to imply that. More like members of the student body are always having parties. It's the college thing to do. Perhaps an added perk to actually being in college. Believe me, I've had my share in the 8 or so years I was in."" Alex makes quick note correcting any potential legal action of the statutory type.

There's no such thing as statutory drinking! ""Well now I might actually get myself in there. Hook myself up in the party scene."" Skip the classes, go to the parties. Sounds pretty much perfect. ""Don't worry, I won't tell anyone a teacher was the one who hinted to me about the booziing.""

With a grin, he nods, ""Thanks."" then after Alex puts money down on the bill, he notes, ""Take care of yourself, and no playing roshambo with the locals, unless they diserve it.""

Nadia grins. ""Well most of 'em deserve it. I'll see ya round, teach."" She says, swinging her chair back foreward to bury her tiny face in unhealthy breakfast food.

And with that, Alex departs the crowded restaurant to go teach.


</lj-cut>

<small>Nadia and Alex meet</small>"
"eventtime","2007-11-16 10:34:00"
"url","http://xmm-havok-0.livejournal.com/7163.html"
"userid","17278"
"itemid","26"
