"names","values"
"event","First encounter of the day, a young guy named Tobias who could turn into fog. Interesting and very useful power. 

<LJ-CUT TEXT=""'Click to read' [Tobias, Havok]"">

Sitting in a straight backed, but comfortable chair of oak with heavy padding, Alex Masters is seen with a cup of tea upon a saucer in his left hand looking around the room. He currently wears hiking boots, jeans, a light blue t-shirt underneath a light colored sport coat. On his right knee is a napkin that once held a nicely cut triangular sandwich. Any rumors of his existence in the facility is that he's waiting on Dr Grey to get done with what she had been tied up with. And he's been here a while. It's a new day, and he's back, waiting more.

There has to be a place where someone can get a little bit of time to yourself around here, and Tobias Ryder is bound and determined to find it.  One of the new students on campus, Tobais peers into the room, large headset hanging around his neck and a book under his arm as he walks into the room.  He doesn't make it three feet before noticing the man sitting there.  Pushing up his glasses with his free hand, he sighs quietly, one is better than the handfuls everywhere else, and this guy sure as hell isn't student body.  The teen walks over to a couch and slumps into it, nodding to Alex as he opens his book to flip through the pages.

""Sup."". A common greeting offered by Alex as he's given the head nod from the youth who plops down on the couch. He turns slightly and places the teacup/saucer upon a nearby end table and returns to his normal silence.

""Reading,"" Tobias offers the obvious as he holds up his book, a thick Bostonian accent to his voice.  ""Looking to find a point away from the cloud hanging over the school,"" he remarks.  Being new, the death of the student here did not really affect him, which has put him a little distant from some of the more distraught students in the school.

Returning his attention to the youth, Alex questions, ""Yeah, I heard something bad went down. So what's up? Or can I ask that?"" - He takes the napkin from his knee and places it atop the tea cup. Then pulls his right ankle over his left knee to place his hands on either leg. 

And the book closes and gets dropped on the floor beside the couch as Tobias opts the put his feet on the end, looking at the ceiling.  ""Well, kid got killed by another one a few days back.  Some kind of a fight.  Whacked her head on a curb.  I didn't know her,"" he explains off hand.  ""Haven't seen you here before.  You teach?""

With a slight grimmace, Alex flinches at the thought of head trauma then recovering a bit he answers, ""Yeah, but not here. I teach at Emerson in the city. Just waiting on Dr Grey to get free. But I don't see that happening anytime soon with all that's been going on. Figured it was bad, but damn, not that bad. They get it all worked out with the authorities?""

Tobias shrugs in his utter lack of any real knowledge on the subject.  ""I hear the girl, well, guy, that did it got busted, going away for a while.""  The teen sighs and adjusts the headset around his neck as he's reclined.  ""I guess what I'm saying is that I don't know the whole story, just word about school.""

Offering a change of subject, as this one has come to a bitter end - just like the girl - Alex asks, ""So what are you studying? Or is this a general studies school, like high school?""

""I just take a little of everything,"" Tobias answers.  ""I like English a lot.  Poetry's pretty fun.""  He shrugs a little.  ""I already know what I'm going to be doing with my life anyways.""

""Oh yeah, what's that?"" Alex asks with some curiousity in tone.

""Hotel,"" Tobias says simply.  ""My parents own one back home on the Island.  I'm their only kid, so someone's going to have to make sure the place stays in the family.""

""So you're here to..."" given a brief pause to focus on the question, ""...learn about your abilities, get your studies done, graduate, then back to take over the family business? Or will you go to college for hospitality classes?""

Tobias looks over to the man for a moment, mulling the question over.  ""Pretty much.  I'll probably go to school for it.  Just for the degree.  Not like I don't have enough experience already.""

""That's kinda cool, inheriting and all that. Kinda like having it all laid out for you. Oh, by the way, I'm Alex."", giving afterthought to not having given his name, so Alex does.

""Tobias,"" he gives his own in turn.  ""Yeah, it's not so bad.  Not like I can say I dealt with much else.  Hell, talking to most folks here, my life is pretty sweet.""

He doesn't want to go back to the topic of /here/, as it's already established that this place is in a funk, so Alex notes a little about himself, ""I teach geology and geophysics, graduated Berkeley a few years back, did my time as a geologist in the field, doing lots of on site work, love it. Miss it even, cannot believe I ended up being a teacher. Probably won't do it for more than a year though, the city is totally not for me. But all in all, it's been a pretty good life.""

Tobias nods as he listens, only somewhat cataloging this for later.  ""So,"" he starts, eyeing the man from the side of his glasses, ""You got to be pretty mutant friendly to be so calm hanging around here.  Unless you are one.""

With a brief lopsided smile, Alex gives a chuckle and says, ""Mutant friendly, mutant, pretty much just want to get it straightened out. Hence the appointment with Jean. But yeah, it's all good. I just wish life was a little easier out there for mutant kind. I'm guessing you being a student here makes you the same?""

""Ayuh,"" Tobias says with small grin.  ""And believe me, I know what it's like.  I spent two years hiding what I was.  Course, even in a small town on the water, people around where I'm from love to keep their mouths shut about things?""

""So now, you're out of the proverbial closet?"" Alex lends a smile to the reference, ""I mean, I see how mutants are treated on a daily basis on the news, in public, etc. And dude (said like a surfer), I totally don't want to be on the bad end of that stick. It's like being black in the 40's, 50's and 60's. Or worse.""

""Pretty much,"" Tobias says with a nod.  Looking down to his poetry book, he grins a little.  ""And I think it's a metaphor, coming out of the closet, not a proverb,"" he adds, rolling back onto his back.  ""But yeah, I come from a pretty liberal place and all, but still don't talk about things like that.""

After a chuckle, Alex notes, ""That's why I teach Geology, not English. Metaphors, Proverbs, Nouns, all that is Greek to me. I'm glad though, that people like us have a place like this.""

""Ayup,"" Tobias says with a faint smile.  ""I was probably the only one in my school.  Glad they never found out, well, till just a week ago or so when I came here.  Probably would have been drummed out of the place.""

""That's what I'm thinking will happen if I'm outed at Emerson. I suspect that I'll be king of the blacklist."" Alex says in a sarcastic tone. ""Still, the more I think on it, the less I think I'll mind. I'd just go back to field work and other countries. The states are really fanitical when it comes to stuff like this.""

""What's it that you do?"" Tobias asks, looking over to the man.  ""I mean, I'd be booted pretty much because of what I can.  But I guess what matters is you having something to keep you busy.""

Alex asks for clairification, ""Power wise?""

Tobias nods.

""From what I gather, I absorb ambient energy, build it up, and discharge it in the form of what I think is plasma. All in all, it's pretty destructive, and I mean like blowing stuff up or vaporizing things."" Alex notes with a slight grimmace. ""Just looking to get it under control, cause if I don't discharge it on a regular basis, it sort of forces me to at the most inconvenient of times.""

""Wow.  So, yeah, you'd be a danger to the kids they'd say.  Lock you away like a loaded gun or something,"" Tobias says flatly.  ""At least I'd just get kicked out because people would say I was cheating by using my powers whenever I got a good grade.""

""So telepathic of sorts?"" Alex asks trying to narrow down Tobias' power.

With a snort of laughter, Tobias shakes his head.  ""Nope,"" he says, shutting his eyes as he decides to just show rather than explain.  The teen on the couch fades away into a smoky wisp.  A roll of fog moves across the room, building up a few feet away and reforming along the wall into Tobias again.  The teen cleaning off his glasses.  ""That.""

""Dude"", said in a surfer tone of amazement, ""That's sweet. I didn't say this, but like, the girls locker room would totally be the place to roll."" Alex showes his devious side and thinks how Tobias' power is far more useful than his. ""I've been amazed at some of the powers I've seen on the news. Heck, it was some guy up here who has seismic control which drew me up here in the first place.""

Tobias walks back over towards the couch again to sit, grinning slyly.  ""Yeah, had that one suggested to me.  Though I won't tell you if I have or not,"" he says with a short laugh.  The talk of seismic control gets a short shake of his head.  ""Looking for an assistant?"" he jokes.

With a chuckle, Alex shakes his head and says, ""Nah, more like ... well, it's just a long story. Suffice it to say, I came up here thinking there was tectonic activity, turned out it was a mutant effect. Ended up running into someone who referred me to Emerson, and well, there you have it, my story.""

Settling his glasses back on his face, Tobias nods a short bit.  ""So, you're here to see which student shakes stuff up?"" he asks, looking back over towards Alex.

""Nah, just here for me. If I run into him, cool, but I've already put that to rest."" Alex answers as he stands up and moves to look at something on a shelf.

Tobias ahs, nodding slowly.  ""So you're here for yourself, and waiting for Dr. Grey.  I get you,"" he says with a sly grin.

Alex glances back briefly, ""Well, Dr Grey is easy on the eyes."" Then turns back to the framed photograph. ""How many students are here, any idea?""

Tobias just shrugs and shakes his head.  ""I've been here a week or two,"" he says, ""I got no clue how many people I see come and go around here.""

Moving to a nearby window, Alex looks out, he's a little restless. His thumbs go into his front pocket corners and he looks for activity on the lawn. ""I think I need to stretch my legs."", is noted as a side remark letting the last subject go into the aether. ""Been sitting here for..."" checking his watch, ""More than an hour.""

""Have fun,"" Tobias says, reaching down for his book.  ""Good luck with the mope going down around here.""

""Thanks man, be careful out there."" Alex notes as he starts his walk through a door.


</LJ-CUT>

<small>Tobias and Alex meet within the Xavier living room and talk about being a mutie.</small>"
"eventtime","2007-09-10 10:09:00"
"url","http://xmm-havok-0.livejournal.com/5791.html"
"userid","17278"
"itemid","21"
"event","Having arrived at the Xavier Facility, I was allowed in without too much trouble. But once inside, I quickly discovered that this place is incredibly intricate and filled with students who have a lot more going on than those at Emerson. 

From what I gathered, there was some recent trouble and I think someone passed away. Needless to say, Jean was busy, so I left, returned to the hotel, and will be staying the weekend, then going back tomorrow."
"eventtime","2007-09-10 08:47:00"
"url","http://xmm-havok-0.livejournal.com/5531.html"
"userid","17278"
"itemid","20"
"event","Made it into Salem Center last night. I prefer the rail system of Europe over the States. It's a little more accommodating there and the seats are not made of plastic. I was referred to a local B&B that I signed into, slept like a king. That's one thing the east coast has that the rest of the world should try to emulate, a nice bed and breakfast. 

Today is not a day I'm looking forward to. Keeping a low profile, I've got to get through some picketers (if they're still there) and then onto the Xavier Property. Albeit I have an appointment, it'll still be 'exposure', something I do not want. At least I can still claim geological study and further investigation into the tremors of late, which is totally what I'm going to do if questions are posed. 

So, after breakfast, I'll be journeying that way. Time to shower."
"eventtime","2007-09-07 08:06:00"
"url","http://xmm-havok-0.livejournal.com/5200.html"
"userid","17278"
"itemid","19"
"event","Shared a cab ride with a lovely girl named Alexis that works at a place called Bella's in the Village. Some place I should visit in the future. The unique thing about the cab ride was that it was the ""Cash Cab"" - some reality television program. Kinda cool actually.

<LJ-CUT TEXT=""'Alex's for the Win!' [Alexis, Alex]"">

Alex Masters is traveling northward and is currently in the Lower East Side of Manhattan Island. He hailed a cab. The yellow checker pulls to the side of the road where he slips into the back seat. (Giving time for Alexis to also enter the cab on the opposite side, not seeing Alex as he too got in.) 

Currently Alex wears hiking boots, jeans, a red t-shirt and carries a brown worn leather backpack. His hair isn't all that neat and his face seems to have a determined scowl upon it. He's about to give the location of where he's going...

Alexis hurries to cross the street with a brown grocery bag in one hand and a backpack slung over the opposite shoulder which falls lopsidedly onto her elbow as she moves quickly toward the cab that just pulled up. She opens the door, stuffing herself inside before she notices it was occupied. The girl, dressed in jeans and a fitted t-shirt that reveals a sliver of her stomach, looks over at Alex. ""Er...I think he stopped for me."" She says tentatively, not used to standing up for herself, even for the sake of cabs.

Alex turns to notice the new entry just as he was saying something about 5th and Vine and addresses the newcomer, ""You headed uptown?"" he questions with a slight pause, ""Cause it'd probably be cheaper to share."" 

The guy behind the steering wheel is a bald white male who mentions, ""More the merrier.""

Alexis settles her bag on the seat between them. ""Oh, sure. We can share."" She looks up to the cab driver, giving him the address of her own destination before settling back into her seat and stretching a little.

The cab is long, and shaped like a mini-van. There is a partial plexi glass screen that is open between the cab driver and the passenger compartment. Once establishing where his two fares are traveling, he pushes down the meter and as lights illuminate the ceiling and a brief musical noise is heard, he says, ""Welcome to the Cash Cab, where during your ride you will be asked questions. If you get them right, you can win money. So, you ready to play.""

Alex pauses a second, looks back at his travel companion, and then back at the cabby, ""Uh, yeah. I guess."" Then asking the girl, ""You in?""

Alexis chuckles. ""It's like a game show. Heck yeah, I'm in."" Amused, she glances from Alex back up toward the front of the cab, waiting and attempting to tug random trivia to the front of her brain.

The cabby puts the cab into gear and says, ""We've got 27 blocks to go. During our drive, if you miss any of the questions, you get a strike. Three strikes and you're out. So, let's get started. Question number one. On July 4, 1776, the Declaration of Indpendence was adopted. Who was the first person to sign the document?""

Alex notes half under his breath and says, ""I teach college geology, not history."" Turning to the girl he says, ""Hi, I'm Alex and all I really remember are Thomas Jefferson, Benjamin Franklin, Washington and John Hancock.""

Alexis is a high school drop out, so they're not starting out so well. She thinks back. ""Uh...I'm not exactly sure...I think it was John Hancock, 'cause he signed it real big right and then everyone else had to do it real small around his?"" Sounded logical to her but she still shrugs, leaving the official answer up to the man to give. ""Oh, I'm Alex too."" She says with a smile. ""Well, Alexis really.""

Settling back in his seat, Alex's former scowl has lightened some. He drops his pack securely between his feet. There's even a hint of a smile after the Cab driver says, ""John Hancock is absolutely correct."" Alex then notes, ""Right on.""

""Next question."" the cabby asks, ""Which is closer to the Equator, Easter Island, or the Hawaiian Islands?"" Alex interjects, ""I've been to both."" he notes mostly to Alexis who just introduced herself and he then follows with, ""Easter island is far south while the Hawaiian Islands are a little closer.""

Alexis grins happily as the first answer was correct. The second question draws a complete blank. ""Uh..."" But Alex saves the day and she nods to him with an impressed raising of her brows. ""Well, if you've been there, you'd know."" She replies, agreeable to let his answer pass for both of them.

The cabby chuckles and says, ""Yes, he's been there and he is correct.""

The meter on the cab shows positive money, it's gone from 25 to 50 dollars with no X's on the screen. Alex grins and then says, ""Alex, we're rollin now.""

Alexis giggles and offers her hand for a high five. ""Alex's for the Win! So what's next? I wanna see how much more pampering I can afford for a trip to the salon.""

A followthrough with the high-five is performed by the other Alex. Then, making a turn, the cabby navigates through heavy traffic and comes to a stop at a light. ""Red light double bonus question: What ethnic group was largely responsible for building most of the early railways in the U.S. West?"" Alex looks over at Alexis, ""I'm thinking Kung Fu.""

Alexis hmmms and looks quizzically over to the man, ""Kung Fu?"" She asks, way to young to remember that one. ""Uh, I dunno that one either, but I would've guessed Blacks. You think it was what, Chinese people?""

Alex chuckles, ""When i was young, Kung Fu was in reruns, I was a total fan. It was about this chinaman who walked the desert and there were thousands of chinese railroad workers that he helped out from the oppressive white man, so yeah, Chinese.""

The cabby smiles really big, ""Interesting approach to the answer to that question, which is totally correct!""

Alexis laughs, ""And people say TV makes you dumb...I knew it was all lies. Too bad there was nothing about the railroads in 'I love Lucy', then I might have had a chance.""

The Meter registers 100 dollars. The cabby notes, ""Now, we're moving into the round where you make 50 dollars per question.""

Alex smiles to Alexis's remark. Then states, ""Yeah, I remember nothing about Lucy other than stomping on grapes."" The cabby then steps up and asks, ""Next Question: Which two wicked cities were destroyed by God in Genesis?"" Alex gets quiet and gets a look of confusion on his face, ""Wicked cities?"" turning to Alexis.

Alexis chuckles, ""Seriously? Lucy and Mary Tyler Moore were like the best shows ever."" The teen pauses to hear the next question and smiles. ""Sodom and Gomorrah,"" She replies with ease to the driver giving Alex a confident nod.

Alex repeats her words and notes, ""Oh, duh, all I could think of was Babylon and Jerusalem."" The cabby then gives a nod as he's making another turn and states, ""The girl Alex is right. Sodom and Gamorrah are those cities that God wiped out.""

Alex chuckles and states, ""We make a pretty good team.""

Alexis laughs, ""I know. We totally need to go on the professional game show circuit. We could make a pretty good living.""

After a smile and a nod from Alex to Alexis, the cabby then questions after the meter registers 150 dollars. ""What planet in our solar system is closest to the size of the Earth's moon? Is it, Mars, Jupiter, Venus, or Mercury?"" 

Alex says the names back and then starts to rationalize, ""Jupiter is far to big, Venus is about the size of the Earth, and Mars is just a little smaller, it's got to be Mercury."" Turning to Alexis giving her a chance to interject if she has an argument otherwise.

Alexis thinks over his reply, nodding as it makes sense to her too. ""Uh...yeah, sure. That sounds good-Mercury."" This is by far the best cab ride ever.

The cabby says, ""Absolutely right, Mercury is the closest in size to the Earth's moon."" 

Over the next few minutes, several other questions are asked, giving Alex and Alexis a total of 550 dollars in cash to split between themselves. Getting out of the cab, the cabby says, ""You two did great, thanks for riding in the Cash Cab.""

Out on the street, Alex is dividing the money and he says with a smile, ""Hey, thanks, you really pulled us out of the fire on a few of those questions. And now we're super-mega-rich."" 

Alexis slings her backpack over her shoulder and then sets the paper bag on the sidewalk next to her. ""You did too. Wow, I can't believe we made that much money just riding in a cab. Are you sure you don't have somewhere else to go?"" She jokes, ""A few more rides and I could cover rent for the month.""

Alex hands over her half of the money and pockets his. With a smile, he notes, ""Yeah, I've got an appointment tomorrow up state that I really can't miss. But if you're ever in the geology department at Emerson, look me up, I teach there. Alex Masters."".

Alexis takes her portion and pockets it as well. ""A professor? No wonder you're so smart. Well, if you're ever in the mood for a drink, come down to Bella's in the Village. I work there."" She picks up her groceries. ""Nice to meet you Alex.""

""Good meeting you."" he says in parting, ""Take care."" - With that, he is off, walking north toward a metro station. Slinging his pack and suring up his walk, Alex fades into the crowd.


</LJ-CUT>

<small>Alexis and Alex play Cash Cab during Alex's Incredible Journey - Part 4</small>"
"eventtime","2007-09-06 09:51:00"
"url","http://xmm-havok-0.livejournal.com/4937.html"
"userid","17278"
"itemid","18"
"event","Havok's Incredible Journey is in day 2 of this multi day event. Temporal mechanics be dammed!

The way it is working out is such that I (Havok's player) am unable to knock out the entire trip in one real life/time day. Havok is a moving scene, allowing the character to have multiple encounters as he crosses the city. Think back to the movie ""The Warriors"" http://en.wikipedia.org/wiki/The_Warriors_%28film%29 ; the main characters/street gang were/was moving from Harlem to Coney Island during a 4-8 hour period. During that time, they had many encounters. Most of them were violent. Don't count on too much violence here.

But like with any long scene, real life tends to move faster than the game, so Havok is stuck on day one, while the rest of us move on with life.

What I ask in this OOC notice is that during this week, I seek players who have characters which haven't been played in a while, could be out of time, or just able to be RP'able with a time stamp of yesterday (any yesterday will do).

So if you're up for this, see Havok online, and feel a little giddy, then please contact me and we can keep this scene ball rolling."
"eventtime","2007-09-06 08:03:00"
"url","http://xmm-havok-0.livejournal.com/4667.html"
"userid","17278"
"itemid","17"
